all_awardings,archived,associated_award,author,author_flair_background_color,author_flair_css_class,author_flair_richtext,author_flair_template_id,author_flair_text,author_flair_text_color,author_flair_type,author_fullname,author_patreon_flair,author_premium,body,body_sha1,can_gild,collapsed,collapsed_because_crowd_control,collapsed_reason,collapsed_reason_code,comment_type,controversiality,created_utc,distinguished,gilded,gildings,id,is_submitter,link_id,locked,no_follow,parent_id,permalink,retrieved_utc,score,score_hidden,send_replies,stickied,subreddit,subreddit_id,subreddit_name_prefixed,subreddit_type,top_awarded_type,total_awards_received,treatment_tags,unrepliable_reason,created,author_cakeday
[],False,,Dry-Town2466,,,[],,,,text,t2_hq4b0qv1,False,False,"&gt; Well, the sales pitch of democracy is that the regime, by definition, has wide political support

I think many people in Tunisia or the US would disagree with you.",fa98fc71bcd0a12fe8b63f2c0a8acb7bca682b31,True,False,,,,,0,1652977181,,0,{},i97vf09,False,t3_usqpal,False,False,t1_i96ymbm,/r/CredibleDefense/comments/usqpal/when_strongmen_invade_they_bring_their/i97vf09/,1652977197,1,False,True,False,CredibleDefense,t5_2y5ib,r/CredibleDefense,public,,0,[],,1652948381.0,
[],False,,stult,,,[],,,,text,t2_43rkt,False,False,"Because there are number of questionable posters that post in the exact same manner. It's concern trolling when a Russian propagandist does it, but you amplify their concern trolling when you follow the same pattern. Your diction and tone indicated excessive concern relative to the importance of the Russian gains and contributed nothing in terms of analysis. You may not be intending to spread propaganda, but your post follows the same pattern that many propaganda posters do. High on emotion and low on objective information, sources, or analysis. Unfortunately, even if you are well-intentioned, we at present have no way to easily identify the propaganda posters other than by inferring from the content of their posts. It's important to recognize and avoid those patterns if you want to contribute positively, and we absolutely should call out those patterns in order to disrupt the information warfare efforts.",e74105c76cea2b33daaad39bd2cf699507c98f2f,True,False,,,,,0,1652977152,,0,{},i97vcc5,False,t3_ut1tmt,False,True,t1_i97m4mt,/r/CredibleDefense/comments/ut1tmt/ukraine_conflict_megathread_may_19_2022/i97vcc5/,1652977167,1,False,True,False,CredibleDefense,t5_2y5ib,r/CredibleDefense,public,,0,[],,1652948352.0,
[],False,,Darth_Cosmonaut_1917,,,[],,,,text,t2_komu3,False,False,"It’s understandable, a *lot* has been going on in the past few months.",add2208be31ae03ff1ed3f0e808850cb22038238,True,False,,,,,0,1652977106,,0,{},i97v84t,False,t3_ushfw3,False,False,t1_i97lclc,/r/CredibleDefense/comments/ushfw3/the_russian_militarys_people_problem_its_hard_for/i97v84t/,1652977120,1,False,True,False,CredibleDefense,t5_2y5ib,r/CredibleDefense,public,,0,[],,1652948306.0,
[],False,,carkidd3242,,,[],,,,text,t2_tep8n,False,False,"Ukrainian forces have been pictured with M549A1 RAP shells which have a range of 30KM when fired with a full charge from a M777.

https://twitter.com/UAWeapons/status/1524490850931474433",a33c81ebf4281fa469e83554530d5633b4472975,True,False,,,,,0,1652977086,,0,{},i97v6ef,False,t3_ut1tmt,False,True,t1_i97meuv,/r/CredibleDefense/comments/ut1tmt/ukraine_conflict_megathread_may_19_2022/i97v6ef/,1652977097,1,False,True,False,CredibleDefense,t5_2y5ib,r/CredibleDefense,public,,0,[],,1652948286.0,
[],False,,hatesranged,,,[],,,,text,t2_3svjqav4,False,False,"&gt;This isn't /r/ukrainewar or the rest of reddit where it's taboo to suggest Russia has any chance of making progress anywhere.

Let's try to keep it that way.",81e4b8b1ec3d725f81acad7966eb0c0a58a5ef95,True,False,,,,,0,1652977065,,0,{},i97v4jl,False,t3_ut1tmt,False,True,t1_i97j5ck,/r/CredibleDefense/comments/ut1tmt/ukraine_conflict_megathread_may_19_2022/i97v4jl/,1652977083,1,False,True,False,CredibleDefense,t5_2y5ib,r/CredibleDefense,public,,0,[],,1652948265.0,True
[],False,,hatesranged,,,[],,,,text,t2_3svjqav4,False,False,"Bakhmut has been a theoretical secondary ""once they break through"" target for them for a while.  Personally it feels pretty low value right now.  Bakhmut is on the road to Sloviansk - however it's doubtful Sloviansk will ever fall, so its main usefulness is as a logistical relay to Lyschiansk - which they don't need to take Bakhmut to cut off, they just need to cut off the highway to Lyschiansk.",e6382e9ccb580b984717100bc4df24d0e0356609,True,False,,,,,0,1652977035,,0,{},i97v1x6,False,t3_ut1tmt,False,True,t1_i97lbxy,/r/CredibleDefense/comments/ut1tmt/ukraine_conflict_megathread_may_19_2022/i97v1x6/,1652977050,1,False,True,False,CredibleDefense,t5_2y5ib,r/CredibleDefense,public,,0,[],,1652948235.0,True
[],False,,GayDroy,,,[],,,,text,t2_nltea,False,False,Sorry yea I was just adding that Australia and Canada added a collective 10 M777s to the staggering 90 the US provided. I’m unaware of there are any more in Ukraine or on their way,d3c0c7c5cffdf958c196526cfc5762136eedcde0,True,False,,,,,0,1652976984,,0,{},i97uxbu,False,t3_ut1tmt,False,True,t1_i97tuia,/r/CredibleDefense/comments/ut1tmt/ukraine_conflict_megathread_may_19_2022/i97uxbu/,1652977004,1,False,True,False,CredibleDefense,t5_2y5ib,r/CredibleDefense,public,,0,[],,1652948184.0,
[],False,,hatesranged,,,[],,,,text,t2_3svjqav4,False,False,"&gt; Same feeling as when Russia started pushing out of Izyum.

Let's hope it turns out to be equally anticlimactic.",e7273e19e2d74fad02fc7a89a5c968c7fdc1f288,True,False,,,,,0,1652976981,,0,{},i97ux0q,False,t3_ut1tmt,False,True,t1_i97kzyp,/r/CredibleDefense/comments/ut1tmt/ukraine_conflict_megathread_may_19_2022/i97ux0q/,1652976995,1,False,True,False,CredibleDefense,t5_2y5ib,r/CredibleDefense,public,,0,[],,1652948181.0,True
[],False,,Redpanther14,,,[],,,,text,t2_m01ns,False,False,"They pursue political change in Kurdish areas through insurgent tactics, including terrorist attacks on civilians, which makes them terrorists.",27011820d37a2441986d162fc7c488c19e5d21ae,True,False,,,,,0,1652976820,,0,{},i97uiv7,False,t3_ut1tmt,False,True,t1_i97sfko,/r/CredibleDefense/comments/ut1tmt/ukraine_conflict_megathread_may_19_2022/i97uiv7/,1652976835,1,False,True,False,CredibleDefense,t5_2y5ib,r/CredibleDefense,public,,0,[],,1652948020.0,
[],False,,wrosecrans,,,[],,,,text,t2_a99kk,False,False,"Also, a month+ ago, there was talk of ""We can't just give XYZ system to Ukraine, they'd need over a month of training to use it!""  Well, it's been over a month and we are still just now seeing actual deliveries of the easy stuff.  So apparently we have had plenty of time to do stuff like train ground crews on the basics of F-16 and Paladin artillery maintenance in case we do want to give them such things.  As far as I can tell, there are no reports that we have used the past month to proactively train any Ukrainian people on any of the complex systems that have been discussed.

If I was running things, I'd definitely have a fairly open training program in Poland or Germany that Ukraine could send folks to for education about such systems if they want to consider them for future acquisition.  So if a day comes where we want to send them Pariots or whatever, we can pretty much just roll a truck and deliver it to the already trained team the next day.",c758111ac75aa5756a9066aa57ed446aaaefe6ad,True,False,,,,,0,1652976741,,0,{},i97ubsm,False,t3_ut1tmt,False,True,t1_i97ipkl,/r/CredibleDefense/comments/ut1tmt/ukraine_conflict_megathread_may_19_2022/i97ubsm/,1652976757,1,False,True,False,CredibleDefense,t5_2y5ib,r/CredibleDefense,public,,0,[],,1652947941.0,
[],False,,stult,,,[],,,,text,t2_43rkt,False,False,"&gt; he has also mislabeled many political opponents as terrorists and incorrectly accused people of supporting the coup

And that pattern of behavior means he no longer deserves the benefit of the doubt. Especially given the long history of the Turks fucking the Kurds over. 

It's also worth considering the scale of what he is complaining about against the importance of Sweden and Finland joining NATO. Erdogan at first threatened to hold up the addition of these two incredibly important allies to NATO over the opinions of a few legislators in one of the two countries trying to join. Not even both countries! And not even actual government policies or diplomatic positions, but the opinions of freely elected legislators. In the west, we value free speech and the opinions expressed by legislators are not considered government policy. Every free country has legislators that express opinions that are outside the norm or differ from the official government line. 

It was clearly just an excuse, so he pivoted to claiming Sweden and Finland harbor terrorists. But those are people associated with FETO, the organization he blamed for the failed 2016 coup, despite there being no evidence of that. Sweden and Finland both consider PKK a terrorist organization, and if there were evidence of PKK members located in their borders they would absolutely act to address it. But Erdogan is actually just trying to stamp out legitimate opposition to his autocratic rule by crushing dissent even where it exists abroad, in countries where free speech rights are far better protected than in Turkey. He is, in effect, demanding that his western allies stoop to his level on human rights. 

So don't be fooled. This is nothing more than power politics, not some righteous campaign against terrorists.",c19df7cd9f30ef2c22ce1735466a27c3ebf3d739,True,False,,,,,0,1652976694,,0,{},i97u7mn,False,t3_ut1tmt,False,True,t1_i97pd8j,/r/CredibleDefense/comments/ut1tmt/ukraine_conflict_megathread_may_19_2022/i97u7mn/,1652976712,1,False,True,False,CredibleDefense,t5_2y5ib,r/CredibleDefense,public,,0,[],,1652947894.0,
[],False,,hatesranged,,,[],,,,text,t2_3svjqav4,False,False,"Right, I was talking the M777 since that's what's on the front already.

If we wanna total up artillery:

105 155mm towed, 9 122mm towed, unknown amount and type towed from UK and Czech

42+ 155mm self-propelled, 20+ 152mm self-propelled, 21+ 122mm self-propelled",f0d052eff3ca10c17d20ae71ed9bb4e8dcd4e4d6,True,False,,,,,0,1652976545,,0,{},i97tuia,False,t3_ut1tmt,False,True,t1_i97t8lg,/r/CredibleDefense/comments/ut1tmt/ukraine_conflict_megathread_may_19_2022/i97tuia/,1652976557,1,False,True,False,CredibleDefense,t5_2y5ib,r/CredibleDefense,public,,0,[],,1652947745.0,True
[],False,,GayDroy,,,[],,,,text,t2_nltea,False,False,"100* howitzers. 

90- USA
6- Australia
4- Canada",d1d280cacfe360eaacbce4de245506aecfa0d06f,True,False,,,,,0,1652976297,,0,{},i97t8lg,False,t3_ut1tmt,False,True,t1_i97ipkl,/r/CredibleDefense/comments/ut1tmt/ukraine_conflict_megathread_may_19_2022/i97t8lg/,1652976317,1,False,True,False,CredibleDefense,t5_2y5ib,r/CredibleDefense,public,,0,[],,1652947497.0,
[],False,,fuggtyler,,,[],,,,text,t2_68ot6jg4,False,False,"I used to think people talking about Russian bots were hysterical but it’s undeniable.

Go and look at the video of lavrov shitting the bed and claiming that hitler had Jewish ancestry on that French YouTube channel.

There’s thousands of comments and every single top comment is praising Lavrov. They’re all repeating talkie points like “listen to John meersheimer he’s the only sensible intellectual” and “USA wants to fight to the last Ukrainian” blah blah.

Most of all these comments are highly upvoted with little dissent. They’re likely reporting any critical comments enmasse too in my realisation.

You would think the entirety of the English speaking world thinks lavrov is a genius that never got anything wrong if you took that comment section as representative of what the English speaking world thinks.

So the information warfare is pretty undeniable.",c5b2df34a47bfe004717b77f8558f5e6118cf34d,True,False,,,,,0,1652976215,,0,{},i97t192,False,t3_ut1tmt,False,True,t1_i97hsau,/r/CredibleDefense/comments/ut1tmt/ukraine_conflict_megathread_may_19_2022/i97t192/,1652976232,1,False,True,False,CredibleDefense,t5_2y5ib,r/CredibleDefense,public,,0,[],,1652947415.0,
[],False,,hatesranged,,,[],,,,text,t2_3svjqav4,False,False,"How else am I supposed to take it?  There's a theorized Russian push that - OP's seen it, I've seen it, plenty of others have seen it and we wanted to discuss it in a good subreddit for serious, objective discussion.  And to further justify us, evidence is pouring out demonstrating that in fact this push probably did happen (https://twitter.com/NeilPHauer/status/1527252065394769924).

And you invaded the thread asking us to ""be more positive"", legitimately stuff yourself mate.",fb97aae164f6ad9f1419e3d38ab365f08d82735f,True,False,,,,,0,1652976123,,0,{},i97ssyz,False,t3_ut1tmt,False,True,t1_i97rwyb,/r/CredibleDefense/comments/ut1tmt/ukraine_conflict_megathread_may_19_2022/i97ssyz/,1652976137,1,False,True,False,CredibleDefense,t5_2y5ib,r/CredibleDefense,public,,0,[],,1652947323.0,True
[],False,,Duncan-M,,,[],,,,text,t2_2pdwadue,False,False,"Turkey is more important as a NATO member than nearly every other. Who contains Russian expansion and movement into the Mediterranean, who threatens their southern borders? 3/4 of current NATO countries could be removed with almost no real loss of strategic power versus losing Turkey.

And that's why they're doing this. They know they have NATO leadership by the balls. We need them far more than the PR win of finally gaining Sweden and Finland.",ec415ec91122410b4430bbdc8f6b660001279791,True,False,,,,,0,1652976058,,0,{},i97sn8w,False,t3_ut1tmt,False,True,t1_i970tis,/r/CredibleDefense/comments/ut1tmt/ukraine_conflict_megathread_may_19_2022/i97sn8w/,1652976075,1,False,True,False,CredibleDefense,t5_2y5ib,r/CredibleDefense,public,,0,[],,1652947258.0,
[],False,,iemfi,,,[],,,,text,t2_35byk,False,False,"Yeah lol, like it would at least be a tricky question to figure out if Russia wasn't completely incompetent at propaganda/psyops. Like it's even worse than their fighting performance.",7bdecf88ad30b0d66bf5247f7349afbd511e59af,True,False,,,,,0,1652976003,,0,{},i97si3q,False,t3_usb7wn,False,True,t1_i96qmmx,/r/CredibleDefense/comments/usb7wn/ukraine_conflict_megathread_may_18_2022/i97si3q/,1652976021,1,False,True,False,CredibleDefense,t5_2y5ib,r/CredibleDefense,public,,0,[],,1652947203.0,
[],False,,UpvoteIfYouDare,,,[],,,,text,t2_5kf74,False,False,"To clarify, I was asking about the M777 w/ the M795, which the Russian alternative outranges by 6km despite being 13 years older. However, I still appreciate the response.",74532791c90fda4456b8cd83cc4f953b7b222f2a,True,False,,,,,0,1652975988,,0,{},i97sgoh,False,t3_ut1tmt,False,True,t1_i97qyz7,/r/CredibleDefense/comments/ut1tmt/ukraine_conflict_megathread_may_19_2022/i97sgoh/,1652976005,1,False,True,False,CredibleDefense,t5_2y5ib,r/CredibleDefense,public,,0,[],,1652947188.0,
[],False,,MagicianNew3838,,,[],,,,text,t2_3rh4cbrh,False,False,"&gt;He is concerned about PKK which is a real terrorist organization that has taken many innocent lives and strangely has sympathies in the west.

The PKK are freedom fighters, not terrorists.",90decbc837faf6a4d0283346b94ac988e4da9982,True,False,,,,,0,1652975976,,0,{},i97sfko,False,t3_ut1tmt,False,True,t1_i97pd8j,/r/CredibleDefense/comments/ut1tmt/ukraine_conflict_megathread_may_19_2022/i97sfko/,1652975989,1,False,True,False,CredibleDefense,t5_2y5ib,r/CredibleDefense,public,,0,[],,1652947176.0,
[],False,,WordSalad11,,,[],,,,text,t2_7smt7,False,False,One ship would also mean next to nothing. We're talking about million of tons of exports. Without a real functioning port the entire exercise is pointless.,ca1bdd3a8778acc72537e371596844fced08466f,True,False,,,,,0,1652975935,,0,{},i97sbw9,False,t3_usb7wn,False,True,t1_i96mjom,/r/CredibleDefense/comments/usb7wn/ukraine_conflict_megathread_may_18_2022/i97sbw9/,1652975950,1,False,True,False,CredibleDefense,t5_2y5ib,r/CredibleDefense,public,,0,[],,1652947135.0,
[],False,,Duncan-M,,,[],,,,text,t2_2pdwadue,False,False,"At this point Sweden and Finland are both protected, the UK just signed a defense treaty with them. I don't know how binding that is, but if the UK sticks to it then if Russia fucks with either it pulls in the UK, who pulls in NATO. So as of right now, Sweden and Finland are basically getting the benefits of NATO membership already.",8f5ce80806724e06f30a56df37d561b50a6ec3ff,True,False,,,,,0,1652975878,,0,{},i97s6xe,False,t3_ut1tmt,False,True,t1_i97k9hc,/r/CredibleDefense/comments/ut1tmt/ukraine_conflict_megathread_may_19_2022/i97s6xe/,1652975896,1,False,True,False,CredibleDefense,t5_2y5ib,r/CredibleDefense,public,,0,[],,1652947078.0,
[],False,,hatesranged,,,[],,,,text,t2_3svjqav4,False,False,"&gt;I'm the same guy that you're calling reasonable and an extremist in the same breath.

Ok I'm gonna blow your mind:  People can have different opinions on different things.  Your opinion on Ukrainians being able to retake land is entirely reasonable.

Does that answer your concerns in that regard?


&gt;we just have different standards of what is major progress.

I think ""the one highway to the main two towns Russia wants right now"" is a pretty universal standard for progress, enough to warrant discussion, which is what OP tried to do before a bunch of trolls came in.  Like OP didn't walk in to say Ukraine is screwed, he literally just wanted to talk about a serious Russian push, and which is now basically confirmed (https://twitter.com/NeilPHauer/status/1527252065394769924).",d1c2f40b5134e0daa861ae0f27ee5eff78abc5f3,True,False,,,,,0,1652975854,,0,{},i97s4t1,False,t3_ut1tmt,False,True,t1_i97riaf,/r/CredibleDefense/comments/ut1tmt/ukraine_conflict_megathread_may_19_2022/i97s4t1/,1652975865,1,False,True,False,CredibleDefense,t5_2y5ib,r/CredibleDefense,public,,0,[],,1652947054.0,True
[],False,,stult,,,[],,,,text,t2_43rkt,False,False,"&gt; My guy, this isn't a cheerleading forum

Well that's a rather childish take on what I said. Expressing mindless worry without any analysis isn't a substantial contribution. At best it is spewing your emotions about. At worst it is emotional manipulation. Pointing that out does not equate to requiring only positive perspectives or cheerleading.",7a3af723cc937fadeda017e18bfdfd0399ecc2fd,True,False,,,,,0,1652975765,,0,{},i97rwyb,False,t3_ut1tmt,False,True,t1_i97ku4u,/r/CredibleDefense/comments/ut1tmt/ukraine_conflict_megathread_may_19_2022/i97rwyb/,1652975781,1,False,True,False,CredibleDefense,t5_2y5ib,r/CredibleDefense,public,,0,[],,1652946965.0,
[],False,,hatesranged,,,[],,,,text,t2_3svjqav4,False,False,Lotta backpedaling from how this thread began.  Sting when you found out you're in the wrong?,d2fb35333442fe8b03eaa9613a9bf14f64da34fe,True,False,,,,,0,1652975695,,0,{},i97rqtw,False,t3_ut1tmt,False,True,t1_i97riaf,/r/CredibleDefense/comments/ut1tmt/ukraine_conflict_megathread_may_19_2022/i97rqtw/,1652975711,1,False,True,False,CredibleDefense,t5_2y5ib,r/CredibleDefense,public,,0,[],,1652946895.0,True
[],False,,crochet_du_gauche,,,[],,,,text,t2_a76x1,False,False,"Why is the treaty unpopular? IIRC, Greece’s position was always that “Northern Macedonia” was acceptable, so isn’t it really NM who gave in?",d308f24df1f370a00952ddfc78e5fa53f9e1353e,True,False,,,,,0,1652975621,,0,{},i97rk8u,False,t3_ut1tmt,False,True,t1_i978gv3,/r/CredibleDefense/comments/ut1tmt/ukraine_conflict_megathread_may_19_2022/i97rk8u/,1652975633,1,False,True,False,CredibleDefense,t5_2y5ib,r/CredibleDefense,public,,0,[],,1652946821.0,
[],False,,Draskla,,,[],,,,text,t2_hw71hsw6,False,False,"You've lost the thread, quite literally. I'm the same guy that you're calling reasonable and an extremist in the same breath. You know, maybe the difference between myself and you/others on this thread is not that we see the world all that differently, we just have different standards of what is major progress. I've never accused anyone of ""concern trolling."" Maybe, I'm just more conservative in taking massive changes in the status quo until it's confirmed, and you and OP are a lot more comfortable taking random reports as signs of something bigger (as an example, Hauer had a similar article on the defenders of Kharkiv, and look at how that turned out.)",cef13fcb728ac71e9811c29c756db9195faf9b6c,True,False,,,,,0,1652975599,,0,{},i97riaf,False,t3_ut1tmt,False,True,t1_i97pzvu,/r/CredibleDefense/comments/ut1tmt/ukraine_conflict_megathread_may_19_2022/i97riaf/,1652975610,1,False,True,False,CredibleDefense,t5_2y5ib,r/CredibleDefense,public,,0,[],,1652946799.0,
[],False,,Duncan-M,,,[],,,,text,t2_2pdwadue,False,False,"Just a quick glance at Jomini of the West's map, it looks like there are ~10-12 Ukraine brigades in the Severodonetsk salient fighting,™ with each having its own artillery battalion, plus a few independent artillery batteries and battalions. 

The US gave Ukraine enough M777 guns and trained enough artillerymen to only man a few batteries, maybe a full battalion That's basically a drop in the bucket in terms of this battle, but it's a start. It'll only go up from there, and that's where it'll matter. As the existing Ukrainian 152mm towed guns break down, get destroyed or abandoned in battle, or run out of ammo there is a replacement that's even better. Plus they can expand too with more towed batteries and battalions as the war progresses. 

Also, media attention aside towed guns have limitations in this sort of battle, where there are drones everywhere and Russians are hitting everything they see with their own arty. Tube arty are exposed when setting up, operating, and taking down their guns. M777 usually uses wheeled prime movers (vehicles that tow the gun). The type of arty that is meant for this sort of war are self propelled arty, fully enclosed tracked vehicles with armor rated against small arms and artillery fragmentation/blast, that are quicker to pick up, move, and emplace than tube arty (SPA specialize in shoot and scoot fire missions), and have better tactical mobility off-roading because they're tracked. The issue with them is they're way more complicated to operate, they require much more training for crews and mechanics, they're more expensive so there are fewer of them made, and those that are fielded are less likely to be given away by NATO countries versus towed guns. For instance, the US Marines just downsized their active duty cannon artillery of M777 from 21 batteries to 7. Which was likely why the US gave Ukraine the M777. 

That said, when it comes to towed guns, the M777 is one of the best there is, especially considering ammo options (though it doesn't look like Ukraine has access to all of them).",8db7a2f0391414f70e6b1ece88a5d8e4f83d1e5f,True,False,,,,,0,1652975598,,0,{},i97ri8h,False,t3_ut1tmt,False,True,t1_i97eydi,/r/CredibleDefense/comments/ut1tmt/ukraine_conflict_megathread_may_19_2022/i97ri8h/,1652975609,1,False,True,False,CredibleDefense,t5_2y5ib,r/CredibleDefense,public,,0,[],,1652946798.0,
[],False,,hatesranged,,,[],,,,text,t2_3svjqav4,False,False,"&gt; Is there a reason you included none of that in your OP?

Basically what he said.  Plenty of people on this subreddit are well aware of the Popasna situation to the point where having to cite everything that's already happened is redundant.

Maybe you should be more informed on the issue before calling people concern trolls or spreaders of information.  Because right now you've become the troll.",3ad0f387f9b45e1fd92956dab2ba7884aa87897b,True,False,,,,,0,1652975571,,0,{},i97rfqh,False,t3_ut1tmt,False,True,t1_i97no1x,/r/CredibleDefense/comments/ut1tmt/ukraine_conflict_megathread_may_19_2022/i97rfqh/,1652975587,1,False,True,False,CredibleDefense,t5_2y5ib,r/CredibleDefense,public,,0,[],,1652946771.0,True
[],False,,Acies,,,[],,,,text,t2_3mz6e,False,False,"I'm assuming it's just air resistance. The further you want to push the projectile the bigger the explosion you need to get a higher initial speed, and the higher the initial speed the greater the air resistance, so you end up needing enormous amounts of explosive to get small range increases. My guess is that 30km tends to be the sweet spot between range and the weight of the propellant.",c8cab244db553796c9d3ede7f2548915aa3bcf6a,True,False,,,,,0,1652975384,,0,{},i97qyz7,False,t3_ut1tmt,False,True,t1_i97pepe,/r/CredibleDefense/comments/ut1tmt/ukraine_conflict_megathread_may_19_2022/i97qyz7/,1652975402,1,False,True,False,CredibleDefense,t5_2y5ib,r/CredibleDefense,public,,0,[],,1652946584.0,
