all_awardings,archived,associated_award,author,author_flair_background_color,author_flair_css_class,author_flair_richtext,author_flair_template_id,author_flair_text,author_flair_text_color,author_flair_type,author_fullname,author_patreon_flair,author_premium,body,body_sha1,can_gild,collapsed,collapsed_because_crowd_control,collapsed_reason,collapsed_reason_code,comment_type,controversiality,created_utc,distinguished,gilded,gildings,id,is_submitter,link_id,locked,no_follow,parent_id,permalink,retrieved_utc,score,score_hidden,send_replies,stickied,subreddit,subreddit_id,subreddit_name_prefixed,subreddit_type,top_awarded_type,total_awards_received,treatment_tags,unrepliable_reason,created,author_cakeday
[],False,,technologyisnatural,,,[],,,,text,t2_3xuv1,False,False,"&gt; how Western leaders would react if Ukrainian troops were forced to withdraw from Severodonetsk and Lysychansk

Double the aid budget and apologize for not doing more sooner.",8c5520c9cf256cde37f0920f1fbea2666c300a4d,True,False,,,,,0,1653004747,,0,{},i99lf2z,False,t3_ut1tmt,False,True,t1_i99hd7t,/r/CredibleDefense/comments/ut1tmt/ukraine_conflict_megathread_may_19_2022/i99lf2z/,1653004762,1,False,True,False,CredibleDefense,t5_2y5ib,r/CredibleDefense,public,,0,[],,1652975947.0,
[],False,,ColdSuit,,,[],,,,text,t2_mn3ff,False,False,"I just can’t see how the Russians can regain any of their offensive power in the next decade. Much of their professional manpower has been gutted, lots of command staff as well. They’ve suffered heavy losses of their best equipment that even had a ghost of a chance against supplied NATO equipment, and I severely doubt that their “reserve” equipment would fair much better. 

This is decades of buildup gone in a matter of months.",96fd466f2b16a445edc0a250d058b74a467bd3d4,True,False,,,,,0,1653004738,,0,{},i99leh9,False,t3_ut1tmt,False,True,t1_i995frd,/r/CredibleDefense/comments/ut1tmt/ukraine_conflict_megathread_may_19_2022/i99leh9/,1653004755,1,False,True,False,CredibleDefense,t5_2y5ib,r/CredibleDefense,public,,0,[],,1652975938.0,
[],False,,i_reddit_too_mcuh,,,[],,,,text,t2_xmite,False,False,"First, like the article pointed out, US security guarantee does not have as much value as people think, since the PLA already assumes US intervention. Second, the Taiwanese will not give up sovereignty through talks. The days of a political solution are long gone. In other words, ""peaceful reunification"" is impossible. It's only a matter of when that China decides to attack. Since war is coming, do people want to fight the PLA of today or the PLA of 2030?",329abdd6af5f83cbb8a8210123a6f3f11bcd0069,True,False,,,,,0,1653004645,,0,{},i99l859,False,t3_utdgmr,False,True,t3_utdgmr,/r/CredibleDefense/comments/utdgmr/taiwan_doesnt_need_a_formal_us_security_guarantee/i99l859/,1653004658,1,False,True,False,CredibleDefense,t5_2y5ib,r/CredibleDefense,public,,0,[],,1652975845.0,
[],False,,e_tisch,,,[],,,,text,t2_mi47xmiz,False,False,"&gt;unified, highly-motivated, highly-armed Ukrainian army

That is an overstatement, given the recent surrenders",5bf664e3df8a58422457483089ccd033d8487f36,True,False,,,,,0,1653004641,,0,{},i99l7tu,False,t3_ut1tmt,False,True,t1_i99ih8c,/r/CredibleDefense/comments/ut1tmt/ukraine_conflict_megathread_may_19_2022/i99l7tu/,1653004658,1,False,True,False,CredibleDefense,t5_2y5ib,r/CredibleDefense,public,,0,[],,1652975841.0,
[],False,,Whole_Collection4386,,,[],,,,text,t2_dnydc0oe,False,False,A formal defense pact could have conditions like they have to spend x number of money or percent of GDP to be eligible for US protection.,c9fb862952566a8ffc752caada2456cff76846c3,True,False,,,,,0,1653004540,,0,{},i99l0ps,False,t3_utdgmr,False,True,t1_i99epdm,/r/CredibleDefense/comments/utdgmr/taiwan_doesnt_need_a_formal_us_security_guarantee/i99l0ps/,1653004557,1,False,True,False,CredibleDefense,t5_2y5ib,r/CredibleDefense,public,,0,[],,1652975740.0,
[],False,,TermsOfContradiction,,,[],,,,text,t2_4doeu,False,False,"This is a long article with several videos and photos, you will have to click over to see it.

-----------

*New Evidence Shows How Russian Soldiers Executed Men in Bucha*

Witness testimony and videos obtained by The New York Times show how Russian paratroopers executed at least eight Ukrainian men in a Kyiv suburb on March 4, a potential war crime.

https://www.nytimes.com/2022/05/19/world/europe/russia-bucha-ukraine-executions.html",4c1237d5eebebbc11d54e70fec958ae1dc51d15a,True,False,,,,,0,1653004378,,0,{},i99kpfv,False,t3_ut1tmt,False,True,t3_ut1tmt,/r/CredibleDefense/comments/ut1tmt/ukraine_conflict_megathread_may_19_2022/i99kpfv/,1653004395,1,False,True,False,CredibleDefense,t5_2y5ib,r/CredibleDefense,public,,0,[],,1652975578.0,
[],False,,Euro_Snob,,,[],,,,text,t2_fo7bi,False,False,"&gt;I'm hoping it doesn't happen, but can't help but wonder how Western leaders would react if Ukrainian troops were forced to withdraw from Severodonetsk and Lysychansk.

So what if it happens? The West already saw a significant part of the east and south of Ukraine taken by the Russians, did that cause them to waiver? No.

Russians will capture some small objectives, the Ukrainians will capture some small objectives, this war is not close to being over.",33fb687e73a1008040943d3b4ed35a3eabb6879e,True,False,,,,,0,1653004358,,0,{},i99ko2m,False,t3_ut1tmt,False,True,t1_i99hd7t,/r/CredibleDefense/comments/ut1tmt/ukraine_conflict_megathread_may_19_2022/i99ko2m/,1653004373,1,False,True,False,CredibleDefense,t5_2y5ib,r/CredibleDefense,public,,0,[],,1652975558.0,
[],False,,grenideer,,,[],,,,text,t2_b45rh,False,False,How is it remotely possible that only 20% of Popasna units remain? Wouldn't we have some imagery of major destruction or propaganda announcements if that was the case?,62540374820acb5d88b0e2987d152c3c0a098075,True,False,,,,,0,1653004343,,0,{},i99kn0k,False,t3_ut1tmt,False,True,t1_i98ub4y,/r/CredibleDefense/comments/ut1tmt/ukraine_conflict_megathread_may_19_2022/i99kn0k/,1653004358,1,False,True,False,CredibleDefense,t5_2y5ib,r/CredibleDefense,public,,0,[],,1652975543.0,
[],False,,60days,,,[],,,,text,t2_35xtv,False,False,"Probably best for Ukraine. The shock that started the wheels of materiel and financial aid from US + EU wouldn’t be there for Russias next invasion, especially if they tried to keep it more ‘conflict’ than ‘invasion’ in character and scale, while still claiming land and compromising Ukranian politics.

Unless Russia is thoroughly militarily defeated, with clear borders restored, and security guarantees made by third parties, Ukraine will face a slow bleed in the future.",691d629175d32d4dfe2898fbc9c6165405123543,True,False,,,,,0,1653004242,,0,{},i99kg0k,False,t3_ut1tmt,False,True,t1_i99cemb,/r/CredibleDefense/comments/ut1tmt/ukraine_conflict_megathread_may_19_2022/i99kg0k/,1653004255,1,False,True,False,CredibleDefense,t5_2y5ib,r/CredibleDefense,public,,0,[],,1652975442.0,
[],False,,[deleted],,,,,,dark,,,,,[removed],fe993932d6dced4c0a879e9aa5d7a6e0fbb467f5,True,True,,,DELETED,,0,1653004215,,0,{},i99ke5d,False,t3_ut1tmt,False,True,t1_i97w530,/r/CredibleDefense/comments/ut1tmt/ukraine_conflict_megathread_may_19_2022/i99ke5d/,1653004226,1,False,True,False,CredibleDefense,t5_2y5ib,r/CredibleDefense,public,,0,[],,1652975415.0,
[],False,,lamiska,,,[],,,,text,t2_8ohjx,False,False,It is estimated that more than 100k people stayed in the city and it is not completely leveled. Yes there is lot of destruction but if you watch some prorussian videos there also blocks which were more lucky.,b1acdab33b8224955aa384c3683ed3019ee27573,True,False,,,,,0,1653004043,,0,{},i99k1yy,False,t3_ut1tmt,False,True,t1_i99j7eo,/r/CredibleDefense/comments/ut1tmt/ukraine_conflict_megathread_may_19_2022/i99k1yy/,1653004056,1,False,True,False,CredibleDefense,t5_2y5ib,r/CredibleDefense,public,,0,[],,1652975243.0,
[],False,,bakedpatato,,,[],,,,text,t2_4v6bh,False,False,"and honestly I don't think the USA is the worst out of NATO, nor the worst at acquiring new technologies as mentioned in the podcast especially as he mentions with the advent of things like SBIRs, DIU and AFWERX the DoD is getting better 

but there is definitely a lot that could be done and while I don't think the US right now is in danger  indeed leaving stuff as is could leave the US in a bad position in the future",4e463a4460b8a1357cf69f0da9115498ef35fc99,True,False,,,,,0,1653004026,,0,{},i99k0sl,False,t3_ut1tmt,False,True,t1_i99i8j3,/r/CredibleDefense/comments/ut1tmt/ukraine_conflict_megathread_may_19_2022/i99k0sl/,1653004042,1,False,True,False,CredibleDefense,t5_2y5ib,r/CredibleDefense,public,,0,[],,1652975226.0,
[],False,,taw,,,[],,,,text,t2_iiun,False,False,"NATO doesn't really have any secrets about such matters. It tells everyone how to run their armed forces well, even Russia was included in Partnership for Peace and various military exercises etc., Russians just weren't interested in implementing any such reforms, and Russia prefers to cosplay a superpower to having effective army suitable to its position as mid-tier country.",cfd70b49e334622f67c05af6043497c8a2ad902f,True,False,,,,,0,1653004011,,0,{},i99jzpx,False,t3_ut1tmt,False,True,t1_i99jeeb,/r/CredibleDefense/comments/ut1tmt/ukraine_conflict_megathread_may_19_2022/i99jzpx/,1653004027,1,False,True,False,CredibleDefense,t5_2y5ib,r/CredibleDefense,public,,0,[],,1652975211.0,
[],False,,MariposaPurpura,,,[],,,,text,t2_22c1weds,False,False,The people didn't magically dissappear. there will be always someone that stays. I suppose struggling to control means that they can't scout or operate in a city that is now half rubble.,843a75cbedf938cd97e1553bda4102f36ae8ffd4,True,False,,,,,0,1653003846,,0,{},i99jnxw,False,t3_ut1tmt,False,True,t1_i99j7eo,/r/CredibleDefense/comments/ut1tmt/ukraine_conflict_megathread_may_19_2022/i99jnxw/,1653003856,1,False,True,False,CredibleDefense,t5_2y5ib,r/CredibleDefense,public,,0,[],,1652975046.0,
[],False,,taw,,,[],,,,text,t2_iiun,False,False,"This is a completely wrong take. Russian losses during the first two days were so crazy high, that Russia would have no army left by now if it continued this way.

And it didn't really secure much territory, it advanced very far, but all those forward units were just exposing themselves to ambushes, with nothing behind them secured.",107c36692040e0e233c89d9a35af15bf6fd2fe8e,True,False,,,,,0,1653003749,,0,{},i99jh0k,False,t3_ut1tmt,False,True,t1_i9968lq,/r/CredibleDefense/comments/ut1tmt/ukraine_conflict_megathread_may_19_2022/i99jh0k/,1653003760,1,False,True,False,CredibleDefense,t5_2y5ib,r/CredibleDefense,public,,0,[],,1652974949.0,
[],False,,Deutschland_1871,,,[],,,,text,t2_5j6w1q21,False,False,"To be fair, they have been NATO-taught since 2014 and given extensive intelligence now, but in the end the main effort is extensively Ukrainian.  Still, Russian cope is a special variety.",da970492dbb85d61a9df390d44020bf4671f42ed,True,False,,,,,0,1653003712,,0,{},i99jeeb,False,t3_ut1tmt,False,True,t1_i99hb6w,/r/CredibleDefense/comments/ut1tmt/ukraine_conflict_megathread_may_19_2022/i99jeeb/,1653003725,1,False,True,False,CredibleDefense,t5_2y5ib,r/CredibleDefense,public,,0,[],,1652974912.0,
[],False,,IntroductionNeat2746,,,[],,,,text,t2_5bv0y43u,False,False,"Yes, that's one possibility. 

Also, maybe their ""surprise"" is actually hoping they'll be able to strike a deal with Ukraine via nato pressure. There sure seems to be talks about a deal again, all of a sudden.",cc822490dcf6deb65618ae2b0db29a5e31b6fd0e,True,False,,,,,0,1653003705,,0,{},i99jdx4,False,t3_ut1tmt,False,True,t1_i99i46h,/r/CredibleDefense/comments/ut1tmt/ukraine_conflict_megathread_may_19_2022/i99jdx4/,1653003718,1,False,True,False,CredibleDefense,t5_2y5ib,r/CredibleDefense,public,,0,[],,1652974905.0,
[],False,,venne1180,,,[],,,,text,t2_migonnxn,False,False,Why is it such a big deal for them to withdraw exactly?,07e209a442bb61c376b54e7c9a7d34868b244da0,True,False,,,,,0,1653003690,,0,{},i99jctp,False,t3_ut1tmt,False,True,t1_i99hd7t,/r/CredibleDefense/comments/ut1tmt/ukraine_conflict_megathread_may_19_2022/i99jctp/,1653003703,1,False,True,False,CredibleDefense,t5_2y5ib,r/CredibleDefense,public,,0,[],,1652974890.0,
[],False,,venne1180,,,[],,,,text,t2_migonnxn,False,False,"&gt; Russian and proxy authorities in Mariupol are struggling to establish coherent administrative control of the city.

I don't understand what this statement means? Control of what city? I thought the entire place was completely leveled and completely void of all life, everyone had been evacuated, except for Russian troops?",907971b9d8f621e92aa7ac4f3341f7b5cce9ad50,True,False,,,,,0,1653003613,,0,{},i99j7eo,False,t3_ut1tmt,False,True,t1_i99iqo7,/r/CredibleDefense/comments/ut1tmt/ukraine_conflict_megathread_may_19_2022/i99j7eo/,1653003628,1,False,True,False,CredibleDefense,t5_2y5ib,r/CredibleDefense,public,,0,[],,1652974813.0,
[],False,,Piano9717,,,[],,,,text,t2_l9cqm,False,False,"No, what the guy means is that 10% of Ukrainians believe in the fairness and effectiveness of the Ukrainian judicial system.",fa53fda2254864a00b1aeb3a264818b641b65ba4,True,False,,,,,0,1653003611,,0,{},i99j799,False,t3_ut1tmt,False,True,t1_i99i1xt,/r/CredibleDefense/comments/ut1tmt/ukraine_conflict_megathread_may_19_2022/i99j799/,1653003629,1,False,True,False,CredibleDefense,t5_2y5ib,r/CredibleDefense,public,,0,[],,1652974811.0,
[],False,,IntroductionNeat2746,,,[],,,,text,t2_5bv0y43u,False,False,"&gt;
What you're saying now is precisely the rhetoric change many Ukrainians are afraid to hear from the West

They're afraid exactly because it may happen. 

I'm all for keeping the fighting going, but like I said there's a limit to idealism in geopolitics. 

BTW, this is not simply an opportunity for Russia to regroup. Their military has been degraded to a level no one could have imagined. If they somehow got away with a land grab, they would stay 1000 miles away from any idea of going for round 3 for a very long time, specially since Ukraine would also have time to improve their military.",5e64187375df9b2399bff810ca85d802136cb15f,True,False,,,,,0,1653003567,,0,{},i99j43h,False,t3_ut1tmt,False,True,t1_i99icnw,/r/CredibleDefense/comments/ut1tmt/ukraine_conflict_megathread_may_19_2022/i99j43h/,1653003584,1,False,True,False,CredibleDefense,t5_2y5ib,r/CredibleDefense,public,,0,[],,1652974767.0,
[],False,,venne1180,,,[],,,,text,t2_migonnxn,False,False,"Ah this makes more sense. 

What you mean is that most Ukrainians think judges are corrupt, only 10% think they're fair, and that makes sense. 

Thank you.",8cac7dbd649948740608c9a8d146ccab240a40f8,True,False,,,,,0,1653003558,,0,{},i99j3hx,False,t3_ut1tmt,False,True,t1_i99is98,/r/CredibleDefense/comments/ut1tmt/ukraine_conflict_megathread_may_19_2022/i99j3hx/,1653003577,1,False,True,False,CredibleDefense,t5_2y5ib,r/CredibleDefense,public,,0,[],,1652974758.0,
[],False,,Duncan-M,,,[],,,,text,t2_2pdwadue,False,False,Good synopsis and I agree with your conclusion. This is one of those things that modern PGM and ISR have totally changed.,5db26648ce9bc92cd592d1c52a719bc0dd30eb35,True,False,,,,,0,1653003475,,0,{},i99ixmr,False,t3_ut7hcd,False,True,t1_i98md86,/r/CredibleDefense/comments/ut7hcd/russian_deliberate_river_crossings_choreographing/i99ixmr/,1653003491,1,False,True,False,CredibleDefense,t5_2y5ib,r/CredibleDefense,public,,0,[],,1652974675.0,
[],False,,taw,,,[],,,,text,t2_iiun,False,False,"Russian offensive [is running on fumes now](https://taw.github.io/open-source-adventures/episode-51/). They keep scaling back, and still not getting anything.

What did Russia take since Izium in late March? Rubizhne and Popasna? So maybe they take Severodonetsk and Lysychansk before completely running out of offensive ability, and maybe they won't even take that. It won't make much difference for the next stage.",79431da78801202273049e505130981a9e95f74c,True,False,,,,,0,1653003424,,0,{},i99itxe,False,t3_ut1tmt,False,True,t1_i99hd7t,/r/CredibleDefense/comments/ut1tmt/ukraine_conflict_megathread_may_19_2022/i99itxe/,1653003438,1,False,True,False,CredibleDefense,t5_2y5ib,r/CredibleDefense,public,,0,[],,1652974624.0,
[],False,,Impossible_Average83,,,[],,,,text,t2_82jyiic7,False,False,"Eng isnt my native lang. The question would be ""Do you believe that you that the decision by judges would be fair and lawful"". UA uses",e2c81c09b90b12153105372083d8515d8180760a,True,False,,,,,0,1653003400,,0,{},i99is98,False,t3_ut1tmt,False,True,t1_i99i1xt,/r/CredibleDefense/comments/ut1tmt/ukraine_conflict_megathread_may_19_2022/i99is98/,1653003416,1,False,True,False,CredibleDefense,t5_2y5ib,r/CredibleDefense,public,,0,[],,1652974600.0,
[],False,,Unlucky-Prize,,,[],,,,text,t2_2ksvu6ky,False,True,"ISW posted their daily update:

[https://www.understandingwar.org/backgrounder/russian-offensive-campaign-assessment-may-19](https://www.understandingwar.org/backgrounder/russian-offensive-campaign-assessment-may-19)

**Key Takeaways**  
  
Russian forces are intensifying operations to advance north and west of Popasna in preparation for an offensive toward Severodonetsk.  
Russian and proxy authorities in Mariupol are struggling to establish coherent administrative control of the city.  
Russian forces reportedly attempted to regain control of the settlements they lost during the Ukrainian counteroffensive north of Kharkiv City.  
Russian forces are bolstering their naval presence around Snake Island to fortify their grouping on the island.  


**Immediate items to watch**  
  
Russian forces will likely complete their withdrawal from the vicinity of Kharkiv City but attempt to hold a line west of Vovchansk to defend their GLOCs from Belgorod to Izyum.  It is unclear if they will succeed.  
The Russians will continue efforts to encircle Severodonetsk and Lysychansk at least from the south, possibly by focusing on cutting off the last highway connecting Severodonetsk-Lysychansk with the rest of Ukraine.",1f83a516b4c0f67232652924f18a2803ee8f1331,True,False,,,,,0,1653003378,,0,{},i99iqo7,False,t3_ut1tmt,False,True,t3_ut1tmt,/r/CredibleDefense/comments/ut1tmt/ukraine_conflict_megathread_may_19_2022/i99iqo7/,1653003395,1,False,True,False,CredibleDefense,t5_2y5ib,r/CredibleDefense,public,,0,[],,1652974578.0,
[],False,,IntroductionNeat2746,,,[],,,,text,t2_5bv0y43u,False,False,"Any sane observer of the acquisition process would come to the conclusion that there's a great deal of insanity going on

If you need to spend a decade and many millions in trials to figure out what sidearm or battle rifle should be adopted, you're better of simply issuing a bunch of the guns to a platoon and asking them what they think after using them fir a while. 

Yes, there's a reason why those process need to be lengthy, but there also needs to be some level of pragmatism, otherwise you run the risk of becoming a giant dinosaur that is too afraid to enact any change.",1655c8c490e2c027f692a8e311ccbc237d8181c8,True,False,,,,,0,1653003315,,0,{},i99im82,False,t3_ut1tmt,False,True,t1_i99ah1y,/r/CredibleDefense/comments/ut1tmt/ukraine_conflict_megathread_may_19_2022/i99im82/,1653003329,1,False,True,False,CredibleDefense,t5_2y5ib,r/CredibleDefense,public,,0,[],,1652974515.0,
[],False,,greyvagabond,,,[],,,,text,t2_37du06ij,False,False,"Not at all. The original Russian goal was for to decapitate the elected Ukrainian government, install a puppet government, and de facto annex the entire country as a vassal of Russia. Failing to win in Kyiv made that goal completely impossible. 

And that would have been the *only* thing making the entire campaign strategically worthwhile. Now, Russia is faced with maybe taking some more territory in the far easy and defending its gains in the south against a unified, highly-motivated, highly-armed Ukrainian army and government.",5aacd9eccce885951913c334b25d25066aabe9c9,True,False,,,,,0,1653003246,,0,{},i99ih8c,False,t3_ut1tmt,False,True,t1_i99g5py,/r/CredibleDefense/comments/ut1tmt/ukraine_conflict_megathread_may_19_2022/i99ih8c/,1653003261,1,False,True,False,CredibleDefense,t5_2y5ib,r/CredibleDefense,public,,0,[],,1652974446.0,
[],False,,Shellback1,,,[],,,,text,t2_a4ipw,False,False,Sounds like the the good old usa,f8dfaf005914170397c0c31a9a233c82f7b89318,True,False,,,,,0,1653003202,,0,{},i99ie2p,False,t3_ut1tmt,False,False,t1_i998ue5,/r/CredibleDefense/comments/ut1tmt/ukraine_conflict_megathread_may_19_2022/i99ie2p/,1653003215,1,False,True,False,CredibleDefense,t5_2y5ib,r/CredibleDefense,public,,0,[],,1652974402.0,
[],False,,iAmFish007,,,[],,,,text,t2_er24l,False,False,"I'm sorry, but I'll have to disagree that any ceasefire would favor Ukrainians. Everyone and their dog knows that Russian ceasefires are simply a way for them to secure territory and regroup for a new offensive. It's a trap that most of the West keeps falling for. 

What you're saying now is precisely the rhetoric many Ukrainians are afraid to hear from the West: ""30% of your land is occupied, your Black Sea trade is dead because of a naval blockade, but at least you weren't completely annexed! Now, agree to a ceasefire, we've done enough to help and Russia is too precious to sever ties with. If you don't, we'll just stop helping!""",0832bc881ec95343174efac6412b039fa855d9da,True,False,,,,,0,1653003183,,0,{},i99icnw,False,t3_ut1tmt,False,True,t1_i99haqv,/r/CredibleDefense/comments/ut1tmt/ukraine_conflict_megathread_may_19_2022/i99icnw/,1653003193,1,False,True,False,CredibleDefense,t5_2y5ib,r/CredibleDefense,public,,0,[],,1652974383.0,
[],False,,mundane_coconut47,,,[],,,,text,t2_n48h0qve,False,False,No jets provided to Ukraine in the next few months could realistically accomplish that task. They would be shot down before they even got close.,083d5255bc5efbb8ad4f86e2fd5ed1441ced91e4,True,False,,,,,0,1653003179,,0,{},i99icev,False,t3_ut1tmt,False,True,t1_i9888qh,/r/CredibleDefense/comments/ut1tmt/ukraine_conflict_megathread_may_19_2022/i99icev/,1653003194,1,False,True,False,CredibleDefense,t5_2y5ib,r/CredibleDefense,public,,0,[],,1652974379.0,
[],False,,flamedeluge3781,,,[],,,,text,t2_61s6s6hf,False,False,"Procurement is pretty much the kryptonite of every modern military. I don't think any nations do it well. USA, Australia, Canada, and Germany all being some of the worst at it.",492b279d56ed9dfa715cb80074553328cf190c4b,True,False,,,,,0,1653003124,,0,{},i99i8j3,False,t3_ut1tmt,False,True,t1_i99ah1y,/r/CredibleDefense/comments/ut1tmt/ukraine_conflict_megathread_may_19_2022/i99i8j3/,1653003142,1,False,True,False,CredibleDefense,t5_2y5ib,r/CredibleDefense,public,,0,[],,1652974324.0,
[],False,,taw,,,[],,,,text,t2_iiun,False,False,"&gt; whether Putin has lost his mind and ordered wathever troops remained inside Russia to go YOLO towards Kyiv.

So here's a theory - maybe Russian run for the border was wrong in retrospect, and doing fighting withdrawal and making Ukrainians fight for each border village would have helped Russian Donbas offensive more.

At least that's my theory why Russia decided to keep those villages North of Kharkiv - they have zero strategic value, but Ukrainians want to clean them up so they'll waste a few weeks on them instead of continuing to Vovchansk or Kupiansk or Izium.

It would be hilarious if Putin believes it so much, that he now wants to send troops back to various border villages to cost Ukrainians more time?

There will definitely be no second #YOLO Kyiv, Russia can't even #YOLO Lysychansk.",c512e802242cfbe10cdd3d8960f20177b97b64db,True,False,,,,,0,1653003063,,0,{},i99i46h,False,t3_ut1tmt,False,True,t1_i997apn,/r/CredibleDefense/comments/ut1tmt/ukraine_conflict_megathread_may_19_2022/i99i46h/,1653003075,1,False,True,False,CredibleDefense,t5_2y5ib,r/CredibleDefense,public,,0,[],,1652974263.0,
[],False,,venne1180,,,[],,,,text,t2_migonnxn,False,False,"&gt; Something only around 10% believes in fair justice in Ukraine. Army is on bright side actually.

This must be a translation error because otherwise this statement makes no sense.


I can't even fathom a polling question that asks ""Do you support fair justice?"" getting anything less than 100% because everyone believes what they want is fair and just.",1265e1bb5c4f5834748a797184d02b758cb68fd6,True,False,,,,,0,1653003031,,0,{},i99i1xt,False,t3_ut1tmt,False,True,t1_i99gb95,/r/CredibleDefense/comments/ut1tmt/ukraine_conflict_megathread_may_19_2022/i99i1xt/,1653003046,1,False,True,False,CredibleDefense,t5_2y5ib,r/CredibleDefense,public,,0,[],,1652974231.0,
[],False,,ChairsAndFlaff,,,[],,,,text,t2_jnpyqx6m,False,False,"Agreed. Also, many people have a fantastical notion that there are no limits to how rapidly Ukraine can absorb and train up on new materiel. Unfortunately, there are such limits. There are limits to how quickly the US can air-lift large systems. There are logistics limits inside Ukraine, which are currently constraining them in some ways.

There are about a million moving parts which are very easy for armchair quarterbacks to ignore.",1b3ada9d2051455d2619697ea866d92b01112505,True,False,,,,,0,1653002978,,0,{},i99hy3a,False,t3_ut1tmt,False,True,t1_i99gmol,/r/CredibleDefense/comments/ut1tmt/ukraine_conflict_megathread_may_19_2022/i99hy3a/,1653002993,1,False,True,False,CredibleDefense,t5_2y5ib,r/CredibleDefense,public,,0,[],,1652974178.0,
[],False,,IntroductionNeat2746,,,[],,,,text,t2_5bv0y43u,False,False,"You do realise that's exactly what happened throughout the whole history of the soviet Union and is happening right now in Russia, right?",698007326dda68ba27ebe9f9e191e4091598bbf4,True,False,,,,,0,1653002883,,0,{},i99hr9p,False,t3_ut1tmt,False,True,t1_i99dyfj,/r/CredibleDefense/comments/ut1tmt/ukraine_conflict_megathread_may_19_2022/i99hr9p/,1653002898,1,False,True,False,CredibleDefense,t5_2y5ib,r/CredibleDefense,public,,0,[],,1652974083.0,
