all_awardings,archived,associated_award,author,author_flair_background_color,author_flair_css_class,author_flair_richtext,author_flair_template_id,author_flair_text,author_flair_text_color,author_flair_type,author_fullname,author_patreon_flair,author_premium,body,body_sha1,can_gild,collapsed,collapsed_because_crowd_control,collapsed_reason,collapsed_reason_code,comment_type,controversiality,created_utc,distinguished,gilded,gildings,id,is_submitter,link_id,locked,no_follow,parent_id,permalink,retrieved_utc,score,score_hidden,send_replies,stickied,subreddit,subreddit_id,subreddit_name_prefixed,subreddit_type,top_awarded_type,total_awards_received,treatment_tags,unrepliable_reason,created,author_cakeday
[],False,,poincares_cook,,,[],,,,text,t2_uea8mi,False,False,"I asked, again and again, for any evidence that the SDF assists or assisted the PKK. No such evidence exists. That is while the PKK was fighting a very high friction war with Turkey and Kurdish cities were razed and ethnically cleansed within eyesight from SDF positions in Syria.

Yes, the PKK and YPG do share connections, they have some ideological similarities and both draw economic-sciologic ideologies from the same source.

No, they are not the same organization. No the SDF has never attacked Turkey. No the SDF never worked with the PKK to attack Turkey.

You're always free to present any evidence of SDF aid to PKK, but these discussions always go the same way because no such evidence exists.",f4a3693d47bb06637299c636d608bea884a9ef6b,True,False,,,,,0,1652990566,,0,{},i98sfc3,False,t3_usb7wn,False,False,t1_i97gp7w,/r/CredibleDefense/comments/usb7wn/ukraine_conflict_megathread_may_18_2022/i98sfc3/,1652990584,1,False,True,False,CredibleDefense,t5_2y5ib,r/CredibleDefense,public,,0,[],,1652961766.0,
[],False,,ParaTodoMalMezcal,,,[],,,,text,t2_dtnsp,False,False,"Ah yeah completely agreed then, as a very left-leaning person (admittedly more so on domestic issues than foreign policy, but still) I've been disappointed and disgusted by the pathological inability of some elements of the left to conceive of a conflict in which Russia is bad and the US is good.

It's Americentric in the opposite of the usual way to think that the US could just snap its omnipotent fingers and produce an acceptable diplomatic solution.",7b117cf2b19e5f0bccad0f2298fb931fd89d9425,True,False,,,,,0,1652990473,,0,{},i98s739,False,t3_ut1tmt,False,True,t1_i98rq51,/r/CredibleDefense/comments/ut1tmt/ukraine_conflict_megathread_may_19_2022/i98s739/,1652990484,1,False,True,False,CredibleDefense,t5_2y5ib,r/CredibleDefense,public,,0,[],,1652961673.0,
[],False,,OriginalLocksmith436,,,[],,,,text,t2_etr4g0ne,False,False,11bn is still like 3 mars sample return missions worth of $$ so that can go a long way.,4bdb18d8426a9350b014daaa389062e7816798bc,True,False,,,,,0,1652990446,,0,{},i98s4py,False,t3_ut1tmt,False,True,t1_i98ezhu,/r/CredibleDefense/comments/ut1tmt/ukraine_conflict_megathread_may_19_2022/i98s4py/,1652990461,1,False,True,False,CredibleDefense,t5_2y5ib,r/CredibleDefense,public,,0,[],,1652961646.0,
[],False,,AbdulMalik-alHouthi,,,[],,,,text,t2_esy7e79a,False,False,You mean I could get a job with the Chinese?,cb8b0267ab0fb433e3daa5cf7127844ff11f2d9a,True,False,,,,,0,1652990427,,0,{},i98s30z,False,t3_ut7vyn,False,True,t3_ut7vyn,/r/CredibleDefense/comments/ut7vyn/are_european_academics_helping_chinas_military_an/i98s30z/,1652990438,1,False,True,False,CredibleDefense,t5_2y5ib,r/CredibleDefense,public,,0,[],,1652961627.0,
[],False,,9090112,,,[],,,,text,t2_4gqooldl,False,False,"You haven't, I was attacking a persistent belief among some people (like say, Chomsky) that will drone on and on about how ""we should support a diplomatic solution"" while dancing around the question of what exactly that entails. For example:

[DSAUSA](https://www.dsausa.org/statements/on-russias-invasion-of-ukraine/)
&gt;There is no solution through war or further intervention. This crisis requires an immediate international antiwar response demanding de-escalation, international cooperation, and opposition to unilateral coercive measures, militarization, and other forms of economic and military brinkmanship that will only exacerbate the human toll of this conflict.

So the Democratic Socialists of America's solution to the Ukraine conflict is to ask very, very nicely for Putin to please put his marauding forces on a leash, if it pleases him. Oh and by the way, no sending the Ukrainians weapons to defend themselves from the people killing them, no stoppage of buying the products of the people that are doing the killing or pretty much anything that would slightly inconveniences a single Russian soul, lest the ""human toll of the conflict"" grow ever larger.",c75070e3fdb4d2f42397803bf9f03b8063fd0afb,True,False,,,,,0,1652990280,,0,{},i98rq51,False,t3_ut1tmt,False,True,t1_i98ntb7,/r/CredibleDefense/comments/ut1tmt/ukraine_conflict_megathread_may_19_2022/i98rq51/,1652990293,1,False,True,False,CredibleDefense,t5_2y5ib,r/CredibleDefense,public,,0,[],,1652961480.0,
[],False,,poincares_cook,,,[],,,,text,t2_uea8mi,False,False,"Do you have any evidence that he personally engaged in any terrorist activities?

It's indicative that you cannot provide a **single** example of the SDF supporting the PKK **in any way**. The evidence is plainly before you, yet you refuse to see.",87654f3bdfbf34e64be02bfb75a1a41d731e9127,True,False,,,,,0,1652990215,,0,{},i98rkj1,False,t3_usb7wn,False,True,t1_i97h2nn,/r/CredibleDefense/comments/usb7wn/ukraine_conflict_megathread_may_18_2022/i98rkj1/,1652990233,1,False,True,False,CredibleDefense,t5_2y5ib,r/CredibleDefense,public,,0,[],,1652961415.0,
[],False,,gaiusmariusj,,,[],,,,text,t2_orwh0,False,False,If it's explicitly and openly admitted then surely you can show them.,229bc7775d69c560894e8cf30e4b8f27129d6aa6,True,False,,,,,0,1652990149,,0,{},i98reva,False,t3_usqpal,False,False,t1_i98qr1x,/r/CredibleDefense/comments/usqpal/when_strongmen_invade_they_bring_their/i98reva/,1652990165,1,False,True,False,CredibleDefense,t5_2y5ib,r/CredibleDefense,public,,0,[],,1652961349.0,
[],False,,gaiusmariusj,,,[],,,,text,t2_orwh0,False,False,"Your first is an assumption. You want to show me competent soldiers who don't want to be party members are significant, or even statistically significant first before you can make the first assumption. 

Your 'then' is a conjecture, what's your evidence?

Until you show the two, your conclusion is invalid.",d285467539c54726888c0bc20af428f2ce9e567a,True,False,,,,,0,1652990119,,0,{},i98rc7l,False,t3_usqpal,False,True,t1_i98qo37,/r/CredibleDefense/comments/usqpal/when_strongmen_invade_they_bring_their/i98rc7l/,1652990134,1,False,True,False,CredibleDefense,t5_2y5ib,r/CredibleDefense,public,,0,[],,1652961319.0,
[],False,,TCP7581,,,[],,,,text,t2_l7pk6ejk,False,False,Weak globally but stable internally would suit China. Russia to soak up all the intl outrage but maintain stability at home to supply China with energy. Just my opinion though.,3ceb7f2fb123665c62ae5b649bc1556172ee67b3,True,False,,,,,0,1652990110,,0,{},i98rbf5,False,t3_uqwn4u,False,True,t1_i93s3g6,/r/CredibleDefense/comments/uqwn4u/general_questions_comments_pet_theories_and/i98rbf5/,1652990126,1,False,True,False,CredibleDefense,t5_2y5ib,r/CredibleDefense,public,,0,[],,1652961310.0,
[],False,,Thoth_the_5th_of_Tho,,,[],,,,text,t2_16tm24,False,False,"It's explicitly based on loyalty. The PLA is an arm of the CCP, not the state, to ensure their loyalty to the party, and it's leadership, above all else.",c05df9f5824b2f59bbf09e7ccc86dc5d982fcbc4,True,False,,,,,0,1652989879,,0,{},i98qr1x,False,t3_usqpal,False,True,t1_i98ol2d,/r/CredibleDefense/comments/usqpal/when_strongmen_invade_they_bring_their/i98qr1x/,1652989893,1,False,True,False,CredibleDefense,t5_2y5ib,r/CredibleDefense,public,,0,[],,1652961079.0,
[],False,,PM-me-youre-PMs,,,[],,,,text,t2_1dm2hxb0,False,False,"Because first, competent people who don't want to be party member are discarded. You're reducing your base of competent peoples already.

Then, among party members, those who value honest feedback and criticism rise slower than those who focus on showing agreement with their superiors.

Ultimately a plan (and everything else) will get better as you increase the number of competent people and the level of their competence giving it a look and giving honest feedback and criticism. The least competent people you have or the least free they feel to give feedback and criticism and the shittier things get. It's basic math.",c2220114e1016734e16d97bb1cbd727950c1a63d,True,False,,,,,0,1652989845,,0,{},i98qo37,False,t3_usqpal,False,True,t1_i98nxi0,/r/CredibleDefense/comments/usqpal/when_strongmen_invade_they_bring_their/i98qo37/,1652989863,1,False,True,False,CredibleDefense,t5_2y5ib,r/CredibleDefense,public,,0,[],,1652961045.0,
[],False,,Duckroller2,,,[],,,,text,t2_tiaqs,False,False,"Maybe if they were TLANs carrying nukes, the w(orld)ar would end in a day.",5e3ea6afafc5087fd655aeaa09bbd524248113f5,True,False,,,,,0,1652989807,,0,{},i98qkqc,False,t3_ut1tmt,False,True,t1_i98f5sy,/r/CredibleDefense/comments/ut1tmt/ukraine_conflict_megathread_may_19_2022/i98qkqc/,1652989824,1,False,True,False,CredibleDefense,t5_2y5ib,r/CredibleDefense,public,,0,[],,1652961007.0,
[],False,,ScopionSniper,,,[],,,,text,t2_685tg,False,False,"Ukrianes already basically won. They are getting everything back.

^^^/s",f2a35de40347c9dfbb165dcce93f0d7f8e85e449,True,False,,,,,0,1652989688,,0,{},i98q9zs,False,t3_ut1tmt,False,True,t1_i98dmrd,/r/CredibleDefense/comments/ut1tmt/ukraine_conflict_megathread_may_19_2022/i98q9zs/,1652989700,1,False,True,False,CredibleDefense,t5_2y5ib,r/CredibleDefense,public,,0,[],,1652960888.0,
[],False,,Ok_Pomelo7511,,,[],,,,text,t2_aa2el1ra,False,False,"The point is that if the northern Donbas front breaks down, the whole eastern front is in jeopardy, especially around Donetsk. Best Russian units are concentrated there, and they would face much less battle hardened rear guard units of territorial guard if they manage to cut off 17th, 55th and 56th brigades.",9fbcf9fac54cc56abc85cb3a8e0bee44b8a92584,True,False,,,,,0,1652989593,,0,{},i98q1m3,False,t3_ut1tmt,False,True,t1_i98mxzd,/r/CredibleDefense/comments/ut1tmt/ukraine_conflict_megathread_may_19_2022/i98q1m3/,1652989607,1,False,True,False,CredibleDefense,t5_2y5ib,r/CredibleDefense,public,,0,[],,1652960793.0,
[],False,,murkskopf,,,[],,,,text,t2_qvbgg,False,False,"&gt; The ASCOD1/ASCOD2 manufactured there (the base chassis) by General Dynamics there has been exported to several countries (Austria/Spain &amp; Czech Republic)

The Czech Republic does not operate the ASCOD. The ASCOD is a contender in the Czech IFV program.",4ec71301e656c0423a79a5bde14f84a7592c82fc,True,False,,,,,0,1652989508,,0,{},i98pu5z,False,t3_us6blu,False,True,t1_i937yp4,/r/CredibleDefense/comments/us6blu/lessons_from_the_ajax_programme_this_paper_seeks/i98pu5z/,1652989521,1,False,True,False,CredibleDefense,t5_2y5ib,r/CredibleDefense,public,,0,[],,1652960708.0,
[],False,,murkskopf,,,[],,,,text,t2_qvbgg,False,False,"The AJAX is not build in Spain. The hull shells are welded in Spain. The assembly takes place in Wales (Merthyr Tydfil), where many of the UK-made components are installed. The turret shells are made in Germany by Rheinmetall.",2ecc13af558ad9ef12a7501901a3d848df80e108,True,False,,,,,0,1652989446,,0,{},i98pou1,False,t3_us6blu,False,True,t1_i9240fa,/r/CredibleDefense/comments/us6blu/lessons_from_the_ajax_programme_this_paper_seeks/i98pou1/,1652989460,1,False,True,False,CredibleDefense,t5_2y5ib,r/CredibleDefense,public,,0,[],,1652960646.0,
[],False,,dilligaf4lyfe,,,[],,,,text,t2_hu461,False,False,"&gt;Also, media attention aside towed guns have limitations in this sort of battle, where there are drones everywhere and Russians are hitting everything they see with their own arty. Tube arty are exposed when setting up, operating, and taking down their guns. M777 usually uses wheeled prime movers (vehicles that tow the gun). The type of arty that is meant for this sort of war are self propelled arty, fully enclosed tracked vehicles with armor rated against small arms and artillery fragmentation/blast, that are quicker to pick up, move, and emplace than tube arty (SPA specialize in shoot and scoot fire missions), and have better tactical mobility off-roading because they're tracked. The issue with them is they're way more complicated to operate, they require much more training for crews and mechanics, they're more expensive so there are fewer of them made, and those that are fielded are less likely to be given away by NATO countries versus towed guns. For instance, the US Marines just downsized their active duty cannon artillery of M777 from 21 batteries to 7. Which was likely why the US gave Ukraine the M777.

My understanding (not an expert) is that SPA have their own drawbacks in this conflict as well, namely that they're more fragile and difficult to maintain, and that towed is more likely to withstand counterbattery and remain functional, despite it being less mobile?",3ecbfa190e39128de743c9d1c93031d31866f995,True,False,,,,,0,1652989231,,0,{},i98p6ap,False,t3_ut1tmt,False,True,t1_i97ri8h,/r/CredibleDefense/comments/ut1tmt/ukraine_conflict_megathread_may_19_2022/i98p6ap/,1652989250,1,False,True,False,CredibleDefense,t5_2y5ib,r/CredibleDefense,public,,0,[],,1652960431.0,
[],False,,ParaTodoMalMezcal,,,[],,,,text,t2_dtnsp,False,False,"Got it, thanks. And yeah, no arguments there, although it's still a breath of fresh air compared to the quality of discussion most anywhere else about these kinds of things. 

Even on twitter where there are a lot of people to read who do know what they're talking about, the replies are pretty universally a cesspool.",52b9d811797fe96c3d03880c4da189854dfd8141,True,False,,,,,0,1652989018,,0,{},i98onu0,False,t3_ut1tmt,False,True,t1_i98o6yv,/r/CredibleDefense/comments/ut1tmt/ukraine_conflict_megathread_may_19_2022/i98onu0/,1652989033,1,False,True,False,CredibleDefense,t5_2y5ib,r/CredibleDefense,public,,0,[],,1652960218.0,
[],False,,LordOfBirds,,,[],,,,text,t2_3fmejac0,False,True,"How unfortunate... And just as ISW finally agreed with me in their May 17 update: 

""Russian forces continued their withdrawal from Kharkiv Oblast but will likely seek to hold a line east of Vovchansk to secure the ground line of communication (GLOC) running from Belgorod through Vovchansk to Izyum. The terrain in this area generally favors the defender, and the Russians have other GLOCs with which to supply Izyum, so the Ukrainians may not try to advance much farther to the east at this time.""

Could we both be wrong this time? Let's wait and see if this action is truly intent on taking back that territory or is just a pinning action like in Sumy. The former would be a odd indeed.",b7c9f8f96355ebaa569480c24ca40eac1cf6b3e4,True,False,,,,,0,1652988996,,0,{},i98olv7,False,t3_uqua8k,False,True,t1_i98lcgk,/r/CredibleDefense/comments/uqua8k/ukraine_conflict_megathread_may_16_2022/i98olv7/,1652989009,1,False,True,False,CredibleDefense,t5_2y5ib,r/CredibleDefense,public,,0,[],,1652960196.0,
[],False,,gaiusmariusj,,,[],,,,text,t2_orwh0,False,False,"Meritocracy is different from promotion base on loyalty. 

IF you want to switch the argument, that it isn't meritocracy rather than it's based on loyalty, that's fine, you just have to acknowledge it.",674cc4c182863d5a55436359a7b6bedc8f1cb431,True,False,,,,,0,1652988986,,0,{},i98ol2d,False,t3_usqpal,False,True,t1_i98o5hn,/r/CredibleDefense/comments/usqpal/when_strongmen_invade_they_bring_their/i98ol2d/,1652989002,1,False,True,False,CredibleDefense,t5_2y5ib,r/CredibleDefense,public,,0,[],,1652960186.0,
[],False,,V0R88,,,[],,,,text,t2_69hgg8vn,False,False,Pretty complex reasons that have been discussed several times in many subs,24d9f4922afe5d74ddfca8f03b424969a461370e,True,False,,,,,0,1652988925,,0,{},i98ofpd,False,t3_ut1tmt,False,True,t1_i97rk8u,/r/CredibleDefense/comments/ut1tmt/ukraine_conflict_megathread_may_19_2022/i98ofpd/,1652988937,1,False,True,False,CredibleDefense,t5_2y5ib,r/CredibleDefense,public,,0,[],,1652960125.0,
[],False,,Plump_Apparatus,,,[],,,,text,t2_lrbt366m,False,False,"You could go as over at /r/Militaryfaq and get a better answer. There is also a lot you can read online.

The Nimitz-class has 180 person berthing areas with triple bunks, the berthing areas include their own head. The GRF-class has a smaller crew because of automation, and berthing is reorganized into 36 person areas with triple bunks and their own heads. There is no wasted space on a carrier, and you are packed in like sardines even on a GRF-class. 

Food is served buffet style, and the mess on a US carrier is never closed afaik. Everyone doesn't eat at the same time because everyone doesn't follow the same schedule as the ship has to be manned 24/7 with different shifts, both for standing watch and doing whatever your job may be. There are gyms onboard both the Nimitz and GRF classes. How often you get to use one may be more of a question since you're likely going to be working 90+ hours a week while underway.

No, USN carriers don't typically carry civilians, unless it has dock workers onboard for testing some piece of equipment, or is doing some sort of PR campaign with a politician. The USN still does tiger cruises, where a small number dependents and friends can come aboard for a short period of time.",c8fec93a82d6e8aed2d2b88edc581dac9d951cd2,True,False,,,,,0,1652988915,,0,{},i98oesq,False,t3_uqwn4u,False,True,t1_i95hj7v,/r/CredibleDefense/comments/uqwn4u/general_questions_comments_pet_theories_and/i98oesq/,1652988930,1,False,True,False,CredibleDefense,t5_2y5ib,r/CredibleDefense,public,,0,[],,1652960115.0,
[],False,,Astrapaios,,,[],,,,text,t2_g7hibk1m,False,False,"Ternova is adjacent to the border point where Ukraine reached the border, isn't it? Seems more like a cross border raid, a way of rebuffing a symbolic victory, but will have to wait and see.",ab16b5f4492c8a906b3bcff63c44e68a528634a3,True,False,,,,,0,1652988857,,0,{},i98o9qs,False,t3_ut1tmt,False,True,t1_i98ndrw,/r/CredibleDefense/comments/ut1tmt/ukraine_conflict_megathread_may_19_2022/i98o9qs/,1652988869,1,False,True,False,CredibleDefense,t5_2y5ib,r/CredibleDefense,public,,0,[],,1652960057.0,
[],False,,Jeffy29,,,[],,,,text,t2_73emm,False,True,The people you are frustrated with. The quality of discussion has really went south here (it was always bad elsewhere) after how much the sub blew up because of the war.,b4603f225073201e4cf2d683c77f0ac4a12a8654,True,False,,,,,0,1652988824,,0,{},i98o6yv,False,t3_ut1tmt,False,True,t1_i98nq19,/r/CredibleDefense/comments/ut1tmt/ukraine_conflict_megathread_may_19_2022/i98o6yv/,1652988840,2,False,True,False,CredibleDefense,t5_2y5ib,r/CredibleDefense,public,,0,[],,1652960024.0,
[],False,,Thoth_the_5th_of_Tho,,,[],,,,text,t2_16tm24,False,False,"If the US fired all members of the millitary who where not registered republicans, explicitly to ensure loyalty to the GOP, I doubt you would be arguing that the force is as meritocratic as it used to be.",6590b40b0522a6be9b39aceb7e6bbd4a9ab3aaf7,True,False,,,,,0,1652988807,,0,{},i98o5hn,False,t3_usqpal,False,True,t1_i98jh70,/r/CredibleDefense/comments/usqpal/when_strongmen_invade_they_bring_their/i98o5hn/,1652988825,1,False,True,False,CredibleDefense,t5_2y5ib,r/CredibleDefense,public,,0,[],,1652960007.0,
[],False,,TybrosionMohito,,,[],,,,text,t2_jess1,False,False,"It hasn’t got nearly the attention for a variety of reasons (lack of footage, no real “dramatic” troop movements or shifts) but the brick wall that Russia bounced off of at Kharkiv was a huge deal.",1e520ea96c6dc088da2feafa87fe2b52bcabdbf2,True,False,,,,,0,1652988792,,0,{},i98o46o,False,t3_ut1tmt,False,False,t1_i987vcl,/r/CredibleDefense/comments/ut1tmt/ukraine_conflict_megathread_may_19_2022/i98o46o/,1652988810,1,False,True,False,CredibleDefense,t5_2y5ib,r/CredibleDefense,public,,0,[],,1652959992.0,
[],False,,iAmFish007,,,[],,,,text,t2_er24l,False,False,"Russians want to drive Ukraine back so Belgorod isn't under risk of shelling. Right Ukrainians are within artillery shelling distance, which is inconvenient for Russian logistics on the Izyum axis.",d707db6784ca523d9fe287729396e78f9ba206d1,True,False,,,,,0,1652988722,,0,{},i98ny68,False,t3_ut1tmt,False,True,t1_i98ndrw,/r/CredibleDefense/comments/ut1tmt/ukraine_conflict_megathread_may_19_2022/i98ny68/,1652988741,1,False,True,False,CredibleDefense,t5_2y5ib,r/CredibleDefense,public,,0,[],,1652959922.0,
[],False,,gaiusmariusj,,,[],,,,text,t2_orwh0,False,False,"Then why bring it up? Again, I am not the one making the claim, I'm questioning it's absurdity just like you. I'm saying there is more, and show me that more.",bbd6c1d9199ad3f7faa4e0129d1420faf1070d93,True,False,,,,,0,1652988714,,0,{},i98nxi0,False,t3_usqpal,False,True,t1_i98m7g6,/r/CredibleDefense/comments/usqpal/when_strongmen_invade_they_bring_their/i98nxi0/,1652988733,1,False,True,False,CredibleDefense,t5_2y5ib,r/CredibleDefense,public,,0,[],,1652959914.0,
[],False,,[deleted],,,,,,dark,,,,,[removed],fe993932d6dced4c0a879e9aa5d7a6e0fbb467f5,True,True,,,DELETED,,0,1652988682,,0,{},i98nuqm,False,t3_ut1tmt,False,True,t1_i98kgdu,/r/CredibleDefense/comments/ut1tmt/ukraine_conflict_megathread_may_19_2022/i98nuqm/,1652988695,1,False,True,False,CredibleDefense,t5_2y5ib,r/CredibleDefense,public,,0,[],,1652959882.0,
[],False,,BigBlueButtonMan2,,,[],,,,text,t2_fvf8jh6z,False,False,"There was a [another comment by someone else](https://www.reddit.com/r/CredibleDefense/comments/usb7wn/comment/i95ynaq/?utm_source=share&amp;utm_medium=web2x&amp;context=3) that talked about Ukraine's failings in the war, failure to properly prepare for the invasion, troubles with mobilization, and difficulties handling the influx of cash, which are all fair (of course, it makes the Russian military look even worse if they managed to botch this invasion so badly against a country that wasn't fully prepared).

I think the thing is that Russia has done so badly that people just expect them to keep doing worse and worse.

Which...frankly, Russia hasn't done anything to really counter that expectation.",81ec7ba2bdc1a4562a891863ee6d67b1be0ff539,True,False,,,,,0,1652988678,,0,{},i98nug3,False,t3_ut1tmt,False,True,t1_i97w530,/r/CredibleDefense/comments/ut1tmt/ukraine_conflict_megathread_may_19_2022/i98nug3/,1652988695,1,False,True,False,CredibleDefense,t5_2y5ib,r/CredibleDefense,public,,0,[],,1652959878.0,
[],False,,Glideer,,,[],,,,text,t2_kpk55,False,False,"The electricity targets so far have been substations for railway electricity network, not general civilian power grid.

NATO experience shows that targeting substation and high power grid doesnt work. In the end they had to target power plants directly.

I think Russia still has plenty of older Soviet air-launched cruise missiles that are not as accurate as new ones but accurate enough for targets like power plants.",2c7339e2bf0c8702fad9b2ab30eda5042827e990,True,False,,,,,0,1652988667,,0,{},i98ntg0,False,t3_ut1tmt,False,True,t1_i98jrgm,/r/CredibleDefense/comments/ut1tmt/ukraine_conflict_megathread_may_19_2022/i98ntg0/,1652988680,1,False,True,False,CredibleDefense,t5_2y5ib,r/CredibleDefense,public,,0,[],,1652959867.0,
[],False,,ParaTodoMalMezcal,,,[],,,,text,t2_dtnsp,False,False,I agree with that completely and don't think I've suggested anywhere that there is a realistic diplomatic solution the US should be looking into.,3960e706139bd15917944272067ed6b0ad122226,True,False,,,,,0,1652988665,,0,{},i98ntb7,False,t3_ut1tmt,False,True,t1_i98mxxn,/r/CredibleDefense/comments/ut1tmt/ukraine_conflict_megathread_may_19_2022/i98ntb7/,1652988680,1,False,True,False,CredibleDefense,t5_2y5ib,r/CredibleDefense,public,,0,[],,1652959865.0,
[],False,,hatesranged,,,[],,,,text,t2_3svjqav4,False,False,Wish him luck next time you see him,aeffe14fa2a4e2bf684a3e052954e6250a46aa32,True,False,,,,,0,1652988645,,0,{},i98nrn2,False,t3_ut1tmt,False,True,t1_i98k7cj,/r/CredibleDefense/comments/ut1tmt/ukraine_conflict_megathread_may_19_2022/i98nrn2/,1652988657,1,False,True,False,CredibleDefense,t5_2y5ib,r/CredibleDefense,public,,0,[],,1652959845.0,True
[],False,,ParaTodoMalMezcal,,,[],,,,text,t2_dtnsp,False,False,Are you saying that I'm concern trolling or that the people I'm frustrated about are?,3a706a2c05d3facf837ae227a9b76f355ebce0a4,True,False,,,,,0,1652988627,,0,{},i98nq19,False,t3_ut1tmt,False,True,t1_i98lcbc,/r/CredibleDefense/comments/ut1tmt/ukraine_conflict_megathread_may_19_2022/i98nq19/,1652988643,1,False,True,False,CredibleDefense,t5_2y5ib,r/CredibleDefense,public,,0,[],,1652959827.0,
[],False,,hatesranged,,,[],,,,text,t2_3svjqav4,False,False,"Pro-Russian sources claim the beginning of a counter-offensive (of unknown magnitude) in the Kharkiv zone.  Specifically an attack on Ternova.

There are reports of fighting in the area.  It's at present clear whether this is an organized counter-offensive or just harassment like what we saw in Sumy.",291b91db05dff976c4ce68cf6c62c263a1f91151,True,False,,,,,0,1652988488,,0,{},i98ndrw,False,t3_ut1tmt,False,True,t3_ut1tmt,/r/CredibleDefense/comments/ut1tmt/ukraine_conflict_megathread_may_19_2022/i98ndrw/,1652988507,1,False,True,False,CredibleDefense,t5_2y5ib,r/CredibleDefense,public,,0,[],,1652959688.0,True
