all_awardings,archived,associated_award,author,author_flair_background_color,author_flair_css_class,author_flair_richtext,author_flair_template_id,author_flair_text,author_flair_text_color,author_flair_type,author_fullname,author_patreon_flair,author_premium,body,body_sha1,can_gild,collapsed,collapsed_because_crowd_control,collapsed_reason,collapsed_reason_code,comment_type,controversiality,created_utc,distinguished,gilded,gildings,id,is_submitter,link_id,locked,no_follow,parent_id,permalink,retrieved_utc,score,score_hidden,send_replies,stickied,subreddit,subreddit_id,subreddit_name_prefixed,subreddit_type,top_awarded_type,total_awards_received,treatment_tags,unrepliable_reason,created,author_cakeday
[],False,,bnndforfatantagonism,,,[],,,,text,t2_legac,False,False,"&gt;Australia

What wars have been in Australia's interest that it hasn't had the ""will to fight""? I constantly hear the refrain that it will tag along with whatever the latest Anglo/American foreign adventure is in hope of cementing a security guarantee when the chips are down.",57f32e3c89b0dc263cf28dbdd9c6a8deb853a389,True,False,,,,,0,1652951681,,0,{},i96k25a,False,t3_ushfw3,False,True,t1_i95umg1,/r/CredibleDefense/comments/ushfw3/the_russian_militarys_people_problem_its_hard_for/i96k25a/,1652951697,1,False,True,False,CredibleDefense,t5_2y5ib,r/CredibleDefense,public,,0,[],,1652922881.0,
[],False,,Antique-Bug462,,,[],,,,text,t2_8v8qmux8,False,False,His age I think.,d0fb15b20debe5abd8c8303521da5e40443ccffe,True,False,,,,,0,1652951399,,0,{},i96jrbp,False,t3_usb7wn,False,True,t1_i96hy70,/r/CredibleDefense/comments/usb7wn/ukraine_conflict_megathread_may_18_2022/i96jrbp/,1652951417,1,False,True,False,CredibleDefense,t5_2y5ib,r/CredibleDefense,public,,0,[],,1652922599.0,
[],False,,hatesranged,,,[],,,,text,t2_3svjqav4,False,False,"Not much to refute.  My point (one that's at this point almost universally agreed upon) is that adding China to the WTO was idiotic.

Your point ""actually legitimizing cyberpunk autocracies is good"".  Lol.",9aba9ec28e565f7e896b0922c06cb1eff10e6eda,True,False,,,,,0,1652951291,,0,{},i96jn0b,False,t3_urktur,False,True,t1_i93l9j7,/r/CredibleDefense/comments/urktur/ukraine_conflict_megathread_may_17_2022/i96jn0b/,1652951306,1,False,True,False,CredibleDefense,t5_2y5ib,r/CredibleDefense,public,,0,[],,1652922491.0,True
[],False,,passabagi,,,[],,,,text,t2_82a7volb,False,False,"&gt; Yeah, Wehrmacht was really crippled organizationally and qualitatively by the authoritarian nature of Nazi Germany. So was Stalin's Red Army in 1945.

In both states, *especially in the army*, *especially in the officer corps*, the regimes were extremely popular. 

I think the argument still holds water, just because a democracy is a strong mechanism for maintaining cohesion between regime and people, and 'popular authoritarians' typically have less strong mechanisms, so it typically gets unstuck at some point (the German people more broadly towards the end of the war, the people of the USSR towards the end of the cold war).

The German case is kind of interesting just because if they had continued to have elections, pre, during, and even after the war, it's very likely they would have continued to vote for Hitler the whole time, and it's definitely the case that the Wehrmacht would have continued to support him, regardless of the political structure they found themselves in.",ec94328c013b6709874c8bb9fa89652b629d8aec,True,False,,,,,0,1652951090,,0,{},i96jf8h,False,t3_usqpal,False,True,t1_i95c9j9,/r/CredibleDefense/comments/usqpal/when_strongmen_invade_they_bring_their/i96jf8h/,1652951105,1,False,True,False,CredibleDefense,t5_2y5ib,r/CredibleDefense,public,,0,[],,1652922290.0,
[],False,,hatesranged,,,[],,,,text,t2_3svjqav4,False,False,Some analyst talked about how in their opinion a significant breach in Popasna would allow Russia to finally wage a maneuver war - maybe this is it.  We'll have to see where the push can reach.,31498222a457b40afc9150864e127368aa2ca721,True,False,,,,,0,1652950790,,0,{},i96j357,False,t3_usb7wn,False,True,t1_i955v9g,/r/CredibleDefense/comments/usb7wn/ukraine_conflict_megathread_may_18_2022/i96j357/,1652950801,1,False,True,False,CredibleDefense,t5_2y5ib,r/CredibleDefense,public,,0,[],,1652921990.0,True
[],False,,hatesranged,,,[],,,,text,t2_3svjqav4,False,False,"Also at the time they released it news of the advance was fresh off the presses (some of it hadn't even happened yet) so it's pretty obvious they aren't trying to hide anything, they just didn't hear about it",ea631fd6eb3d10ee9d0abe28361df631080eedbf,True,False,,,,,0,1652950677,,0,{},i96iysd,False,t3_usb7wn,False,True,t1_i96dkna,/r/CredibleDefense/comments/usb7wn/ukraine_conflict_megathread_may_18_2022/i96iysd/,1652950689,1,False,True,False,CredibleDefense,t5_2y5ib,r/CredibleDefense,public,,0,[],,1652921877.0,True
[],False,,Glideer,,,[],,,,text,t2_kpk55,False,False,"Not to mention that self-reflection was the defining attribute of the German army, which did most of its fighting under semi-authoritarian and brutally authoritarian regimes.

The capacity for self-reflection is widely recognised as one of the qualities, if not the quality, that allowed it to outperform armies of other nations, both democratic and authoritarian.",d75a4901aed28a93943732b3457c43787ab0f28f,True,False,,,,,0,1652950444,,0,{},i96ipu8,False,t3_usqpal,False,True,t1_i963pqy,/r/CredibleDefense/comments/usqpal/when_strongmen_invade_they_bring_their/i96ipu8/,1652950457,1,False,True,False,CredibleDefense,t5_2y5ib,r/CredibleDefense,public,,0,[],,1652921644.0,
[],False,,hatesranged,,,[],,,,text,t2_3svjqav4,False,False,It's pretty tragic since basically most of Russia's gains was the blitz in the south for the first 10 days... and then nothing.  If the southern front was slightly more ready/competent Russia would literally be looking at almost nothing right now.,67bb9f650beddc688122ee208321ca6431e78564,True,False,,,,,0,1652950401,,0,{},i96io5c,False,t3_usb7wn,False,True,t1_i95ynaq,/r/CredibleDefense/comments/usb7wn/ukraine_conflict_megathread_may_18_2022/i96io5c/,1652950417,1,False,True,False,CredibleDefense,t5_2y5ib,r/CredibleDefense,public,,0,[],,1652921601.0,True
[],False,,chowieuk,,,[],,,,text,t2_b230l,False,False,"&gt; Are you talking about Kherson and the land bridge or about Donbass and Crimea?

i was just thinking about crimea. 

&gt; Because it's the former Ukraine absolutely refuses to compromise about.

It's all of it that the government refuses to compromise about. Despite the people just wanting peace as far as i can see.

&gt; ""Pragmaticism"" here means surrendering Ukrainian land and people and ensuring Russia comes back for more after recovering,

I disagree entirely, but also for the sake of this discussion 'coming back for more' isn't really relevant.

&gt; Ukraine has the right and the duty to choose nationalism over ""pragmaticism"" today.

Of course

&gt; This ""pragmaticism"" rethoric reminds me of the ""Ukraine should just roll over and die, it'll be easier for everyone"" rethoric some people used at the beginning of the war, and still use today. And both are complete bullshit takes.

They shouldn't roll over and die, but every decision is a balance of priorities. My perspective is that zelensky was week and idiotic for allowing the war to happen in the first place for the sake of his domestic popularity. He could even have just lied to russia and played along to try and avoid an invasion.",cc32e84d8a26fc363d5a78497010c6ea2f22d556,True,False,,,,,0,1652950355,,0,{},i96imd6,False,t3_usb7wn,False,False,t1_i933hqw,/r/CredibleDefense/comments/usb7wn/ukraine_conflict_megathread_may_18_2022/i96imd6/,1652950369,1,False,True,False,CredibleDefense,t5_2y5ib,r/CredibleDefense,public,,0,[],,1652921555.0,
[],False,,Glideer,,,[],,,,text,t2_kpk55,False,False,"I would usually agree, since I hate national generalisation, but the leitmotif for hundreds of years in practically any military memoir or history is a uniform series of French, Prussian, Austrian, British, German generals saying ""the Russians are badly led and equipped, but by God, they are difficult to convince they are defeated"". 

&amp;#x200B;

On the Japanese, I would argue that their military faults were unrelated to their suicidal toughness. Without it they would have been a weaker army, an easier army to defeat.",0223b344beb486567c37ae703cdbd08f32789ec8,True,False,,,,,0,1652950231,,0,{},i96ihlu,False,t3_ushfw3,False,True,t1_i95ub4v,/r/CredibleDefense/comments/ushfw3/the_russian_militarys_people_problem_its_hard_for/i96ihlu/,1652950243,1,False,True,False,CredibleDefense,t5_2y5ib,r/CredibleDefense,public,,0,[],,1652921431.0,
[],False,,Glideer,,,[],,,,text,t2_kpk55,False,False,"I think we are talking about different levels of better-educated. A small minority on top can avoid conscription. Mid-levels (secondary schools, poorer/less influential students) can't. They are still considerably better educated than the underprivileged ""classes"" that provide most of the professional army manpower.",9d326fb7a2b54cadf6e876499a67c64d15ab9c70,True,False,,,,,0,1652949785,,0,{},i96i0a8,False,t3_ushfw3,False,True,t1_i95ftme,/r/CredibleDefense/comments/ushfw3/the_russian_militarys_people_problem_its_hard_for/i96i0a8/,1652949798,1,False,True,False,CredibleDefense,t5_2y5ib,r/CredibleDefense,public,,0,[],,1652920985.0,
[],False,,florezex,,,[],,,,text,t2_8o5c1,False,False,"What is he referring to when he says ""75""?",1c3a13d82b71324d6727395cec7768828dbf3951,True,False,,,,,0,1652949731,,0,{},i96hy70,False,t3_usb7wn,False,True,t1_i96dbgf,/r/CredibleDefense/comments/usb7wn/ukraine_conflict_megathread_may_18_2022/i96hy70/,1652949745,1,False,True,False,CredibleDefense,t5_2y5ib,r/CredibleDefense,public,,0,[],,1652920931.0,
[],False,,OpenOb,,,[],,,,text,t2_na0hx,False,False,"So far nothing has happened. It was all announcements.

Well they authorized that the Israeli Heron drones can be armed. But that's 20 years late anyway.",7122efcf8abf79db5545fdbe0ab7a3922c39baca,True,False,,,,,0,1652949249,,0,{},i96hf93,False,t3_usb7wn,False,True,t1_i96dxz3,/r/CredibleDefense/comments/usb7wn/ukraine_conflict_megathread_may_18_2022/i96hf93/,1652949260,1,False,True,False,CredibleDefense,t5_2y5ib,r/CredibleDefense,public,,0,[],,1652920449.0,
[],False,,hatesranged,,,[],,,,text,t2_3svjqav4,False,False,"Seems to be a bit of a guttural reaction.  Does the fact they’re still bombing it fly in the face of the “unconditional surrender” narrative, hm?",954de7989c7acf397da93914ba9d5d553bc6c6dc,True,False,,,,,0,1652949030,,0,{},i96h67e,False,t3_usb7wn,False,True,t1_i96a9as,/r/CredibleDefense/comments/usb7wn/ukraine_conflict_megathread_may_18_2022/i96h67e/,1652949047,1,False,True,False,CredibleDefense,t5_2y5ib,r/CredibleDefense,public,,0,[],,1652920230.0,True
[],False,,chowieuk,,,[],,,,text,t2_b230l,False,False,"It's just institutionalised. When someone has had to endure months of daily beatings they want those who come after to 'suffer as they have'.

Makes it extremely hard to stamp out when everyone has been through it and considers it normal",a193c16057974c25d3f7978f27f91832cfadc4ce,True,False,,,,,0,1652948636,,0,{},i96gr0j,False,t3_ushfw3,False,True,t1_i947hxs,/r/CredibleDefense/comments/ushfw3/the_russian_militarys_people_problem_its_hard_for/i96gr0j/,1652948658,1,False,True,False,CredibleDefense,t5_2y5ib,r/CredibleDefense,public,,0,[],,1652919836.0,
[],False,,Plump_Apparatus,,,[],,,,text,t2_lrbt366m,False,False,"What does that have to do with Bush Jr and the 2003 Iraq War? Bush Sr had DS/DS for Kuwait. The US, along with most of the Western world, supported Iraq in the Iraq-Iran war. The US sold weapons to both Iraq and Iran for that matter.",8752dd40d23d3eb1c76114fe20dab2e3c8168357,True,False,,,,,0,1652948272,,0,{},i96gcdo,False,t3_usb7wn,False,True,t1_i96fa8c,/r/CredibleDefense/comments/usb7wn/ukraine_conflict_megathread_may_18_2022/i96gcdo/,1652948284,1,False,True,False,CredibleDefense,t5_2y5ib,r/CredibleDefense,public,,0,[],,1652919472.0,
[],False,,passabagi,,,[],,,,text,t2_82a7volb,False,False,"&gt; This is short term and mistaken thinking.

I totally agree! The funny thing is, I expect a majority of strategists and commentators at all levels share your view, and have shared your view for decades, and yet, we consistently get more of the same policy, which almost everybody agrees is mistaken.

The first problem is that we tend to conflate liberalism and democracy. This is very bad, because most strategically important states are important because of resources, and resource-extraction states almost never have a strong tradition of liberalism. So, when you do have a democratic revolution in a state without a tradition of liberalism, it will rarely be understood as a democracy by people in the west.

On the other side, when you have a liberal autocracy, or a liberal dictatorship, that will be typically understood as 'somewhat democratic', or essentially treated as one, even when there is no correspondence between popular desires and policy, or even, a great deal of repression.

Compounding this, if you gave the people of your average 'strategically important' state a say, the nation they would create would almost inevitably be revisionist. If you take Egypt, for a fairly extreme but useful example, you have a very poor state controlling the Suez canal, through which passes 8% of world trade! Not only do they control it, in the sense that a state-level actor could trivially block it, but the canal is so vulnerable that even a union, or a direct-action protest could block it. There is simply no way that a democracy in Egypt would not lead to a revision of Egypt's place in the world. Even if the larger part of Egyptian society wanted free trade through the canal (they don't) a minor actor could essentially hold it hostage, and there would be nothing the Egyptian state could do without resorting to violence.

If you look at Chile (27% of world copper, almost entirely from one mine) or Saudi Arabia, or really any number of nations, you see states where, if they had healthy and functioning democracies, they absolutely would not be well-behaved participants in the current world order, because they're essentially being shafted, and even if you could buy off the larger part of the population, it would just take a few hundred miners, dockworkers, or railway workers to object, and you would be back to square one.

The last problem is that people who work in the state department (or in western foreign policy establishments more generally) typically have a weak, often partial, typically outdated understanding of the histories and cultures they are dealing with. For instance, in Afghanistan, the west essentially tried to create a regime composed of diaspora Afghanis, despite the fact that many of them had not lived in Afghanistan for decades, and had no real understanding of the state they returned to. So, even if you want to support democracy, it's really hard for westerners to tell if somebody is just making the right noises (e.g. Abiy Ahmed, Assad before the civil war, Putin in the 2000's) while being essentially a sociopathic autocrat.",302a06552b703914c9a58c440579d90f1aaa59ff,True,False,,,,,0,1652948226,,0,{},i96gajp,False,t3_usb7wn,False,True,t1_i96ak2v,/r/CredibleDefense/comments/usb7wn/ukraine_conflict_megathread_may_18_2022/i96gajp/,1652948240,1,False,True,False,CredibleDefense,t5_2y5ib,r/CredibleDefense,public,,0,[],,1652919426.0,
[],False,,AvoidPinkHairHippos,,,[],,,,text,t2_5j4gc60w,False,False,"This war criminal was always good at self deprecation, and I'm tempted to think this one was deliberate and planned, as well.

Just like all his previous jokes",bbc8ef1e67348b413daa992772d5c3a007420244,True,False,,,,,0,1652948162,,0,{},i96g81n,False,t3_usb7wn,False,True,t1_i96dbgf,/r/CredibleDefense/comments/usb7wn/ukraine_conflict_megathread_may_18_2022/i96g81n/,1652948175,1,False,True,False,CredibleDefense,t5_2y5ib,r/CredibleDefense,public,,0,[],,1652919362.0,
[],False,,poincares_cook,,,[],,,,text,t2_uea8mi,False,False,"But the reality shows that those are not related. Show me  evidence for one PKK attack originating from SDF controlled territory. **One** PKK attack that received aid from the SDF. **One** instance of SDF transfering arms to the PKK. You cannot.

The reality is that the SDF **did not lift a finger** to assist the PKK while the Turks were ethnically cleansing cities and razing Kurdish villages within eye sight of SDF position in Syria. The aggression between SDF and Turkey is completely one sided and mirrors the situation in Ukraine exactly.

The PKK and SDF do not share leadership.

Some PKK fighters went over to Syria and helped build the YPG when the SAA abandoned the Kurds to the whims of Jihadists. They left the PKK.

Mazloum is not a member of the PKK anymore, he is not a commander in the PKK and did absolutely nothing to aid the PKK during almost a decade of the PKK's fight with Turkey. 

You're free yo present **any** evidence that the SDF assists the PKK. Fact is I had this discussion many times before, and the other side always fail to present any such evidence.",a060911d7d1d4992531d1433f3aff8581ddf7c34,True,False,,,,,0,1652948038,,0,{},i96g32g,False,t3_usb7wn,False,True,t1_i96fieu,/r/CredibleDefense/comments/usb7wn/ukraine_conflict_megathread_may_18_2022/i96g32g/,1652948053,1,False,True,False,CredibleDefense,t5_2y5ib,r/CredibleDefense,public,,0,[],,1652919238.0,
[],False,,Primalesque,,,[],,,,text,t2_5i71wvhj,False,True,"I’m not sure we have that many old m113s that have not undergone modernization.

Ukraine might get lucky and get the m113AS3 or AS4 variants seen as australia is phasing these out.",87682c07d403286d1f0c4a28929cac2cc4c75cf8,True,False,,,,,0,1652947903,,0,{},i96fxvn,False,t3_usb7wn,False,True,t1_i966s0j,/r/CredibleDefense/comments/usb7wn/ukraine_conflict_megathread_may_18_2022/i96fxvn/,1652947914,1,False,True,False,CredibleDefense,t5_2y5ib,r/CredibleDefense,public,,0,[],,1652919103.0,
[],False,,TechnicalReserve1967,,,[],,,,text,t2_8w1yxym3,False,False,Yes,5397e0583f14f6c88de06b1ef28f460a1fb5b0ae,True,False,,,,,0,1652947855,,0,{},i96fw0h,False,t3_usb7wn,False,True,t1_i93vzzt,/r/CredibleDefense/comments/usb7wn/ukraine_conflict_megathread_may_18_2022/i96fw0h/,1652947869,1,False,True,False,CredibleDefense,t5_2y5ib,r/CredibleDefense,public,,0,[],,1652919055.0,
[],False,,Palmsuger,,,[],,,,text,t2_13uhgq,False,False,"The separatists immediately broke the Minsk II accord. The ceasefire came in effect and they'd broken it a minute later. 

Even after that, the Ukrainians still tried to implement Minsk II. They passed a law implementing it. 

The separatists then did this: 

&gt;saying 'the other side aren't doing this in good faith so i won't  
  
is in fact... bad faith

Ergo, the separatists are in bad faith by your standards, anyway.",c79674aa93b4ffd966bad067e8a0ffacc0d49f01,True,False,,,,,0,1652947567,,0,{},i96fkt9,False,t3_urktur,False,False,t1_i96eb2u,/r/CredibleDefense/comments/urktur/ukraine_conflict_megathread_may_17_2022/i96fkt9/,1652947584,1,False,True,False,CredibleDefense,t5_2y5ib,r/CredibleDefense,public,,0,[],,1652918767.0,
[],False,,WikiMobileLinkBot,,,[],,,,text,t2_ctj9ecbj,False,False,"Desktop version of /u/i_need_a_new_gpu's link: &lt;https://en.wikipedia.org/wiki/Mazloum_Abdi&gt;

 --- 

 ^([)[^(opt out)](https://reddit.com/message/compose?to=WikiMobileLinkBot&amp;message=OptOut&amp;subject=OptOut)^(]) ^(Beep Boop.  Downvote to delete)",43506b18820841681635860018b9c2d936c6b872,True,False,,,,,0,1652947530,,0,{},i96fjb9,False,t3_usb7wn,False,True,t1_i96fieu,/r/CredibleDefense/comments/usb7wn/ukraine_conflict_megathread_may_18_2022/i96fjb9/,1652947543,1,False,True,False,CredibleDefense,t5_2y5ib,r/CredibleDefense,public,,0,[],,1652918730.0,
[],False,,i_need_a_new_gpu,,,[],,,,text,t2_yyu1f,False,False,"If ISIS and PKK shared leadership, members and ideology; of course attacking ISIS would have an effect on PKK. Commander in chief of SDF is/was a PKK member long before SDF or YPG existed. He’s a close friend of Abdullah Ocalan: https://en.m.wikipedia.org/wiki/Mazloum_Abdi

ISIS did not have freedom of movement through that border.

Trying to obfuscate or throw words about the relationship between YPG and PKK would not change the facts in the ground. They are sister organizations under KCK.",1c2db31debb536d932304b3cfe3d22b13ca42fdb,True,False,,,,,0,1652947508,,0,{},i96fieu,False,t3_usb7wn,False,True,t1_i96ep4r,/r/CredibleDefense/comments/usb7wn/ukraine_conflict_megathread_may_18_2022/i96fieu/,1652947523,1,False,True,False,CredibleDefense,t5_2y5ib,r/CredibleDefense,public,,0,[],,1652918708.0,
[],False,,iemfi,,,[],,,,text,t2_35byk,False,False,Saddam did launch an unjustified and burtal invasion of Iran and Kuwait too.,6df170e002233bfd82c72d0d4f6def8971b04a58,True,False,,,,,0,1652947304,,0,{},i96fa8c,False,t3_usb7wn,False,True,t1_i96ellh,/r/CredibleDefense/comments/usb7wn/ukraine_conflict_megathread_may_18_2022/i96fa8c/,1652947315,1,False,True,False,CredibleDefense,t5_2y5ib,r/CredibleDefense,public,,0,[],,1652918504.0,
[],False,,Palmsuger,,,[],,,,text,t2_13uhgq,False,False,"He says, ""Iraq, too"", after he corrects himself.",6b2f48017b49206740d3204fa4e9f63858908bee,True,False,,,,,0,1652947192,,0,{},i96f5iu,False,t3_usb7wn,False,True,t1_i96dbgf,/r/CredibleDefense/comments/usb7wn/ukraine_conflict_megathread_may_18_2022/i96f5iu/,1652947207,1,False,True,False,CredibleDefense,t5_2y5ib,r/CredibleDefense,public,,0,[],,1652918392.0,
[],False,,chowieuk,,,[],,,,text,t2_b230l,False,False,"&gt; No Russian ally will sign off on an international tribunal trying Russian POWs in Ukraine.

Well that just kinda sums up the problem with war crimes tribunals in the first place.

In practice they work as show trials. So long as nations remain sovereign it will always be thus.

Just look at the yugoslav tribunal. You have NATO providing all the evidence they can on the 'enemy', and then concealing all evidence of their own side's mishaps whilst politically pressuring the tribunal funded by and staffed by western/nato countries not to look into 'our side'. 

[This is the chief prosecutor](https://www.spiegel.de/international/world/former-chief-prosecutor-carla-del-ponte-i-keep-telling-myself-that-justice-will-prevail-a-21b02282-89d5-4e7b-b32c-ab16bc1b778b)

&gt; &gt; Del Ponte: it is true that the international community, NATO, had proof of the crimes committed by the Serbs, and they provided that to us, which made things move faster. But it is also true that the U.S. didn’t want us to scrutinize war crimes in Kosovo, for political reasons. We had a lot of trouble investigating the KLA, the Kosovar militia, because the U.S. slowed us down.
&gt; &gt; 
&gt; &gt; DER SPIEGEL: Did U.S. politicians tell you explicitly not to investigate the Kosovars?
&gt; &gt; 
&gt; &gt; Del Ponte: No, because then I could have complained in public. But Madeleine Albright, who was secretary of state at the time, told me over the phone: Carla, slowly, slowly. Be careful with (former KLA leader Ramush) Haradinaj, otherwise there will be unrest in Kosovo.

War crimes trials are an absolute shitshow in terms of actually serving their perceived purpose imo. They're inherently politicised and inherently favour one side over the other

&gt; Secondly, the point of punishment is to deter future crimes. If the current trials in Ukraine sends a message that war-crimes will be persecuted and that we will see less of them in the future, even if just marginally, then I'd say keep them coming.

alternatively it could send the message that you should never surrender or they'll put you in actual prison for life.

The lesson i take from historic war crimes trials is 'always be on the side of the west and you'll be fine', as cynical and depressing as that is.",9cf24e172ab26ddaa0bb1912b28254ce796e0d9d,True,False,,,,,0,1652947069,,0,{},i96f0nf,False,t3_usb7wn,False,True,t1_i93vj1c,/r/CredibleDefense/comments/usb7wn/ukraine_conflict_megathread_may_18_2022/i96f0nf/,1652947082,1,False,True,False,CredibleDefense,t5_2y5ib,r/CredibleDefense,public,,0,[],,1652918269.0,
[],False,,sartres_,,,[],,,,text,t2_fxxe8,False,False,"&gt; What the US needs is a stable Europe able to handle it's own defense.

This is the last thing the US wants. Europe would never allow the dozens of US military bases that are on their soil if they didn't need them. If the EU had a real military they wouldn't have to listen to NATO, they could act like Turkey. If they had a defense industry there would be no one to buy F-35s. And when all that goes away, America's various disproportionate economic advantages are next.",ded222236dbe9afe07bafcbd0610e68e62e19ede,True,False,,,,,0,1652946857,,0,{},i96esev,False,t3_usb7wn,False,True,t1_i95ue9b,/r/CredibleDefense/comments/usb7wn/ukraine_conflict_megathread_may_18_2022/i96esev/,1652946870,1,False,True,False,CredibleDefense,t5_2y5ib,r/CredibleDefense,public,,0,[],,1652918057.0,
[],False,,PuterstheBallgagTsar,,,[],,,,text,t2_kjdfuhea,False,False,"""Here's the check for your service.  Now before you cash it, go stand next to that stack of burned out tanks where the enemy has been focusing artillery fire.""",0aad50a1c10ca4f54d074884725c5e23f775a4f6,True,False,,,,,0,1652946789,,0,{},i96epo6,False,t3_ushfw3,False,True,t1_i947hxs,/r/CredibleDefense/comments/ushfw3/the_russian_militarys_people_problem_its_hard_for/i96epo6/,1652946803,1,False,True,False,CredibleDefense,t5_2y5ib,r/CredibleDefense,public,,0,[],,1652917989.0,
