all_awardings,archived,associated_award,author,author_flair_background_color,author_flair_css_class,author_flair_richtext,author_flair_template_id,author_flair_text,author_flair_text_color,author_flair_type,author_fullname,author_patreon_flair,author_premium,body,body_sha1,can_gild,collapsed,collapsed_because_crowd_control,collapsed_reason,collapsed_reason_code,comment_type,controversiality,created_utc,distinguished,gilded,gildings,id,is_submitter,link_id,locked,no_follow,parent_id,permalink,retrieved_utc,score,score_hidden,send_replies,stickied,subreddit,subreddit_id,subreddit_name_prefixed,subreddit_type,top_awarded_type,total_awards_received,treatment_tags,unrepliable_reason,created,author_cakeday
[],False,,Solubilityisfun,,,[],,,,text,t2_su9cy,False,False,"It did offer defensive value to the sort of fire support ships you mentioned. So it does increase the risk to remaining ships through it's abscence. The less of an AA net the more vulnerable the rest become.

I agree it's not a large immediate impact. Best short term outcome is it scares the rest off from supporting the war because ships have such long term value and extreme replacement costs. I don't believe Russia actually has the kind of shipyard capacity to not be set back in their naval revamp timetable even if cost was removed so there is a real chance a more conservative naval posture will be adopted soon.",5462473a9816f4a2d572bab35c3d8e9130648ae0,True,False,,,,,0,1649909758,,0,{},i4nsrus,False,t3_u2oojz,False,True,t1_i4nr5yd,/r/CredibleDefense/comments/u2oojz/ukraine_conflict_megathread_april_13_2022/i4nsrus/,1649909775,1,False,True,False,CredibleDefense,t5_2y5ib,r/CredibleDefense,public,,0,[],,1649880958.0,
[],False,,dragoaus,,,[],,,,text,t2_d88g9,False,False,"Sure everything can be solved with enough time and money. 

Question is to what extent are those available",1f892cb18bc321d78af90b951e7b78dd0ed8c94d,True,False,,,,,0,1649909653,,0,{},i4nslau,False,t3_u2oojz,False,True,t1_i4nrhxa,/r/CredibleDefense/comments/u2oojz/ukraine_conflict_megathread_april_13_2022/i4nslau/,1649909668,1,False,True,False,CredibleDefense,t5_2y5ib,r/CredibleDefense,public,,0,[],,1649880853.0,
[],False,,thuanjinkee,,,[],,,,text,t2_pv6jy5,False,False,ha take that flat earthers!,b528f16ff4cc95b55272b78da52e3437ca596f9d,True,False,,,,,0,1649909638,,0,{},i4nskel,False,t3_u2oojz,False,True,t1_i4n1w9d,/r/CredibleDefense/comments/u2oojz/ukraine_conflict_megathread_april_13_2022/i4nskel/,1649909655,1,False,True,False,CredibleDefense,t5_2y5ib,r/CredibleDefense,public,,0,[],,1649880838.0,
[],False,,FiredForIncompetence,,,[],,,,text,t2_7bjrlekh,False,False,"You already realized that Globalfirepower is a silly ranking. There are many different ways to rank military powers according to different aspects, capabilities, and categories. Depending on your ranking criteria, you could end up with very different outcomes. 

A major problem you run into is, that military matters are kept secret to a certain degree. Number of planes is something you can easily compare. But soft factors like readiness, maintenance, quality of training, morale, logistics are much harder to gauge. But in a war these can be decisive. 

Lists of rankings attract clicks and create passionate arguments in dick measuring. They are useful for a rough estimate or a starting point for proper evaluation and investigation.",5c14a4c8c91193265e166c8cb4a01ae9c8aabe94,True,False,,,,,0,1649909581,,0,{},i4nsh3y,False,t3_u18fq1,False,True,t1_i4bcin8,/r/CredibleDefense/comments/u18fq1/general_questions_megathread_weekly_april_11th/i4nsh3y/,1649909592,1,False,True,False,CredibleDefense,t5_2y5ib,r/CredibleDefense,public,,0,[],,1649880781.0,
[],False,,thuanjinkee,,,[],,,,text,t2_pv6jy5,False,False,"the turkish navy should do a psyops cruise with giant speakers on a PT boat bumping the Bayraktar song. when Russian Navy boards the boat they find it completely unmanned and the speakers change to a voice counting backwards 


https://youtu.be/d6rZD6njd-s",1d6dad21001fa11c0b9c50ee40734b68d97fdb66,True,False,,,,,0,1649909555,,0,{},i4nsfke,False,t3_u2oojz,False,True,t1_i4n3ljc,/r/CredibleDefense/comments/u2oojz/ukraine_conflict_megathread_april_13_2022/i4nsfke/,1649909571,1,False,True,False,CredibleDefense,t5_2y5ib,r/CredibleDefense,public,,0,[],,1649880755.0,
[],False,,dragoaus,,,[],,,,text,t2_d88g9,False,False,"Biden is unpopular for different reasons. Nobody is against withdrawal from Afghanistan, but the way it was done =&gt; it was said, it will be orderly, and we got Saigon 2.0.",f83898498eba6dfc47e7bd212a9ee7d2964688cb,True,False,,,,,0,1649909398,,0,{},i4ns60b,False,t3_u2oojz,False,True,t1_i4nr2j4,/r/CredibleDefense/comments/u2oojz/ukraine_conflict_megathread_april_13_2022/i4ns60b/,1649909411,1,False,True,False,CredibleDefense,t5_2y5ib,r/CredibleDefense,public,,0,[],,1649880598.0,
[],False,,thuanjinkee,,,[],,,,text,t2_pv6jy5,False,False,"all the most important people from Taiwan are now working at the TSMC factory in Arizona. there is nothing left in Taiwan of value. 

why wouldn’t china just gas the place and then invade without resistance? it doesn’t even have to be lethal gas. there are variants of MDMA which damages the dopamine, norepinephrine and serotonin producing cells of the brain so the victim becomes unable to do anything except shuffle around and thus easy to manage. symptoms are similar to parkinsons disease.

https://openvault.wgbh.org/catalog/V_474CF2C8A20B4173988486AC4C605A3C",af2434e9d37eaa5683a774f81e121390fbbe2174,True,False,,,,,0,1649909367,,0,{},i4ns43y,False,t3_u2oojz,False,True,t1_i4n411q,/r/CredibleDefense/comments/u2oojz/ukraine_conflict_megathread_april_13_2022/i4ns43y/,1649909382,1,False,True,False,CredibleDefense,t5_2y5ib,r/CredibleDefense,public,,0,[],,1649880567.0,
[],False,,BeondTheGrave,,,[],,,,text,t2_4zro2,False,False,"The answer to both questions is the same: Kill them before they kill us. The old Soviet navy had a defensive orientation and a mission to protect the coast, for reasons illustrated in the above post. They wanted to do it with a three layered system. First SSGNs could attack CVBGs from afar. IIRC the Oscars carried the same carrier-killer missile as the surface combatants, or at least something similar. They would push the battle into the Atlantic and try to bag something valuable out there. Books like Red Storm Rising suggest that these were primarily anti-convoy ships, reflecting a general western misunderstanding regarding Soviet doctrine and war planning. But, as mentioned above, if you step back I think youll agree that subs like the Oscar carry too few and too large missiles for attacking many small convoy ships. Theyre carrier killers first, and really popping transports while the CVBGs roam is a waste of a missile. Ditto for Soviet supercavitating torpedo experiments. Russian attack subs would be great for this, *but* they were typically used either for anti-sub patrols OR to protect the Arctic SSBN bastion, and so again would not in wartime wage an anti-shipping war like many Americans feared. 

Second you have the Backfires and land based bombers, and here you have a great example in of their use in the same *Red Storm Rising*. Thats pretty self explanatory, these platforms are *excellent* for a high volume attack aimed at punching through American AD. Assuming of course that they could find the CVBG AND that the CV was where it was supposed to be in the CVBG, both things which turned out to be harder for the Soviets than it seemed in the 1980s. 

Last you have the surface fleet, which would have worked the eastern edge of the Norwegian sea around Murmansk to keep American ships away from the coast. Under the cover of Soviet air and AD, the design of a ship like the Moskva makes sense. Its the command ship for a surface battle group, and it would have pulled double duty coordinating the sub hunt and, if it got the chance, pounding US carriers who were brave (or stupid) enough to try and press the Soviet coast. 

The fact that they only built three of the Slava should tell you it wasn't intended to be a war winning design. It was a command ship of sorts, something that could either work with a battlecruiser in an anti-surface role OR with some destroyers and frigates hunting subs. The goal isn't to compete in some grand sense. The Russian navy was never big enough or strong enough to directly compete with the USN, and anyway it wasted too much in prestige projects such as the Kuznetsov class (abortive) of CVs. The USSR put so much faith in the ability of its airwing that it included ASM launchers. On a carrier. Anyway this was not a navy designed to compete in a military sense, but in a prestige sense. Moreover it was part of an A2/AD strategy designed to secure a rear area along the Russian coast, deny deep penetration air raids from sea, and ensure that the SSBN fleet remained totally protected in incase it was needed. The goal wasn't to choke off the Atlantic so much as turn the North and Norwegian seas into a no-mans-land(sea).",55b83e8cb417dc96594cbd673bd7f7027c990198,True,False,,,,,0,1649909131,,0,{},i4nroyb,False,t3_u2oojz,False,True,t1_i4nexu2,/r/CredibleDefense/comments/u2oojz/ukraine_conflict_megathread_april_13_2022/i4nroyb/,1649909145,1,False,True,False,CredibleDefense,t5_2y5ib,r/CredibleDefense,public,,0,[],,1649880331.0,
[],False,,thuanjinkee,,,[],,,,text,t2_pv6jy5,False,False,"the US navy specifically built this big honking laser because of the concern over drone swarms.

https://www.cbsnews.com/news/us-navy-laser-weapon-test-gulf-of-aden-images/

military forces will have ways to adapt to near peer drone attack given enough time and money.

what keeps me up at night is the potential for a frustrated military commander who is locked in a drone war of attrition to decide to turn the drones on defenseless civillians.",77ce4ba4385c7fdc6cefec86471ec11aa2fd7b95,True,False,,,,,0,1649909025,,0,{},i4nrhxa,False,t3_u2oojz,False,True,t1_i4n2g8c,/r/CredibleDefense/comments/u2oojz/ukraine_conflict_megathread_april_13_2022/i4nrhxa/,1649909040,1,False,True,False,CredibleDefense,t5_2y5ib,r/CredibleDefense,public,,0,[],,1649880225.0,
[],False,,orlock,,,[],,,,text,t2_35adq,False,False,"""Sir. If you want *fashion,* I'm sure I can recommend some sort of suitable outlet. I'll return the javelin, laid down by your grandfather on the occasion of your birth, to its rack. It will still be there when you have come to your senses.""",977fa4a0f679acb4b0600e2a1da48b1cebef0e07,True,False,,,,,0,1649908867,,0,{},i4nr7kx,False,t3_u2oojz,False,True,t1_i4nmn0j,/r/CredibleDefense/comments/u2oojz/ukraine_conflict_megathread_april_13_2022/i4nr7kx/,1649908885,1,False,True,False,CredibleDefense,t5_2y5ib,r/CredibleDefense,public,,0,[],,1649880067.0,
[],False,,forever_zen,,,[],,,,text,t2_y1cye,False,False,"I think it changes very little tactically because while the Slava class ship may have provided some useful air cover, they couldn't even launch some token land attack cruise missiles like the newer surface ships in the fleet.

There's no way to quantify the humiliation and propaganda value though. A critical win in that regard when Russia is preparing to go back into a pivotal offensive with troop morale that's already apparently wavering, and Ukraine is begging for more heavy weapons for operations like this.",85dbad072ec731bdff12611a8279d7e65d1800f3,True,False,,,,,0,1649908843,,0,{},i4nr5yd,False,t3_u2oojz,False,True,t1_i4npg12,/r/CredibleDefense/comments/u2oojz/ukraine_conflict_megathread_april_13_2022/i4nr5yd/,1649908857,1,False,True,False,CredibleDefense,t5_2y5ib,r/CredibleDefense,public,,0,[],,1649880043.0,
[],False,,thuanjinkee,,,[],,,,text,t2_pv6jy5,False,False,"Ukraine has been building Bayraktar TB2 drones under license for about a month now. After Turkey gave them the tooling and technical data pack, Ukraine will not only have an unlimited number of drones, they could potentially get creative with the sensor pod technology in new and interesting ways. 

https://www.defensenews.com/global/europe/2022/02/04/turkey-and-ukraine-to-coproduce-tb2-drones/",9ee7ce4832a442c6f36ff77e4991d180e5f45962,True,False,,,,,0,1649908831,,0,{},i4nr56j,False,t3_u2oojz,False,True,t1_i4n4x9s,/r/CredibleDefense/comments/u2oojz/ukraine_conflict_megathread_april_13_2022/i4nr56j/,1649908842,1,False,True,False,CredibleDefense,t5_2y5ib,r/CredibleDefense,public,,0,[],,1649880031.0,
[],False,,dilligaf4lyfe,,,[],,,,text,t2_hu461,False,False,"If your analogy made sense, Biden would have been more popular after withdrawal, which he wasn't.",36062cc7f61c7bb53b0d33c9c97030dc657ecee5,True,False,,,,,0,1649908791,,0,{},i4nr2j4,False,t3_u2oojz,False,True,t1_i4novzv,/r/CredibleDefense/comments/u2oojz/ukraine_conflict_megathread_april_13_2022/i4nr2j4/,1649908808,1,False,True,False,CredibleDefense,t5_2y5ib,r/CredibleDefense,public,,0,[],,1649879991.0,
[],False,,katui,,,[],,,,text,t2_339sf,False,False,I think a lot of people were surprised by how quickly the government collapsed.,7e6833fa2b8b2f01afb65966735e39f8611e4329,True,False,,,,,0,1649908755,,0,{},i4nr03g,False,t3_u2oojz,False,True,t1_i4novzv,/r/CredibleDefense/comments/u2oojz/ukraine_conflict_megathread_april_13_2022/i4nr03g/,1649908773,1,False,True,False,CredibleDefense,t5_2y5ib,r/CredibleDefense,public,,0,[],,1649879955.0,
[],False,,nightwyrm_zero,,,[],,,,text,t2_152zk2,False,False,I wonder if the Ukrainians will shift some of the forces defending Odessa to reinforce other fronts.,2d5552126e355ce9ae8ae7d484b3231a88baf2ba,True,False,,,,,0,1649908716,,0,{},i4nqxnb,False,t3_u2oojz,False,True,t1_i4npy8m,/r/CredibleDefense/comments/u2oojz/ukraine_conflict_megathread_april_13_2022/i4nqxnb/,1649908729,1,False,True,False,CredibleDefense,t5_2y5ib,r/CredibleDefense,public,,0,[],,1649879916.0,
[],False,,dragoaus,,,[],,,,text,t2_d88g9,False,False,"Pantagon was laying on what was going on on the ground. 

Trillions were pumped in Afganistan with nothing to show. 

If Pentagon was telling the truth, US would be out in 2010s, instead they lied to Obama who started Surge, keeping US in war for close a decade.

Generals constantly pushing Biden to remain in Afganistan?!? For what purpose?!?",850477fa8c7f80bcb25692ed55bc1205573868ac,True,False,,,,,0,1649908442,,0,{},i4nqflu,False,t3_u2oojz,False,True,t1_i4npbnd,/r/CredibleDefense/comments/u2oojz/ukraine_conflict_megathread_april_13_2022/i4nqflu/,1649908454,1,False,True,False,CredibleDefense,t5_2y5ib,r/CredibleDefense,public,,0,[],,1649879642.0,
[],False,,SeenC77,,,[],,,,text,t2_tffwr,False,False,"It’s not, and even if the CIWS effectively engages the missile there’s almost no way to stop the debris from impacting the ship.",14437c216bf492e1d463fb79b3912e0629bf5e38,True,False,,,,,0,1649908442,,0,{},i4nqfkd,False,t3_u2oojz,False,True,t1_i4nl16e,/r/CredibleDefense/comments/u2oojz/ukraine_conflict_megathread_april_13_2022/i4nqfkd/,1649908454,1,False,True,False,CredibleDefense,t5_2y5ib,r/CredibleDefense,public,,0,[],,1649879642.0,
[],False,,VideConspectus,,,[],,,,text,t2_ftzys,False,False,"You are asking some really great questions. And you deserve some answers for such a well thought out comment. Unfortunately I do not think that anyone can know the answers for sure in the open source world that us regular people occupy.  

The Russians do seem to have failed to employ combined arms warfare in most places. The glimpses that we do see are from areas that Russia has failed the most at being a professional military. Were there successful attempts to act like a real military that we don't know about, where they succeeded in defeating the Ukrainians in pitched battles? Perhaps. But the amount of areas where they did fail to be a professional military are numerous, so it does not give me hope for those areas we know nothing about. 

There has certainly been a lot of guerilla tactics by the Ukrainians. Ambushes, and hit and run tactics have been seen on a lot of combat footage. But there are also many areas where the Ukrainians have held territory in spite of repeated Russian attacks. There is a lot of trench warfare in the East of Ukraine, from Donbas to Kharkiv, going on for example. And holding territory despite heavy assault is the opposite of guerilla warfare. The East is where I have read that Ukraine has the bulk of its professional military, so it makes sense that these professionals would be best able to go toe to toe with the Russians.

My guess is that your assessment is more correct than not. If a little more correct on the Russian side than the Ukrainian.

There could be a return, or an attempted return, by both sides to a more conventional combined arms warfare. Both sides could have trouble with doing so for no other reason than they have been exhausted and attrited by weeks of high intensity conflict. A type of conflict that has seen many casualties on the most experienced soldiers of both armies. And performing combined arms warfare is difficult for even the most experienced armies. 

The vastness of Ukraine also comes into play here. The density of focusing on the East of Ukraine will allow both sides to concentrate their forces into a better and more unified command. The stretched out foolishness of the Russians in the North allowed, encouraged, and even demanded, the guerilla tactics by Ukrainians. As the Russians change the location and scale of the fight it will dictate a change in Ukrainian tactics to counter them.

I have been waiting for Russia to get out of its funk for a while now, thinking that they will snap out of the nonsense they have been trying and getting back to their doctrine. But so far they have not been able to show that they know their core competencies, let alone be able to put it all together into symphony of combined arms warfare that is their doctrine. 

So I do expect both sides to have trouble with combined arms warfare. But this is much harder on the offense  of course and a Ukrainian defense in trenches could be able to blunt Russian attacks by just performing well at that task alone. Good trenches combined with modern ATGMs are a powerful defensive position to be in. So the task of combined arms warfare is more critical for the Russians to achieve in my opinion.

I don't think that the impact of the struggle for combined arms warfare is exactly the same for the Russians as it was at the start of the war. Because if you look at the start of the war they did not even seem to try to perform any form of professional military doctrine. A race to Kyiv with riot police right after lightly armed special forces is not part of any combined arms doctrine, it is the opposite of that in fact.

If the Russian military fails to be able to return to their doctrine of acting like a competent, professional military able to perform combined arms warfare then this will have a much greater impact on the war. That would demonstrate that it is not just foolish political ideas of war that have gotten them in in trouble, but instead that their entire military is rotten and cannot be fixed without a chainsaw's amount of reforms. 

These opinions are under the supposition that the Russians still want to take territory and that the Ukrainians will be on the defensive. But this could change at some point in the future.",71603fde8272304b807cd0eff53c3ffbe4399c3e,True,False,,,,,0,1649908291,,0,{},i4nq5fs,False,t3_u18fq1,False,True,t1_i4jww6e,/r/CredibleDefense/comments/u18fq1/general_questions_megathread_weekly_april_11th/i4nq5fs/,1649908306,1,False,True,False,CredibleDefense,t5_2y5ib,r/CredibleDefense,public,,0,[],,1649879491.0,
[],False,,TryingToBeHere,,,[],,,,text,t2_1565qw80,False,False,Odessa landing out of question now and significant air defense capabilities lost now in the southern area of the war (although I imagine there are S300s in Crimea still,49427d6b3d26565b20e3198a545d99f9ba7e768a,True,False,,,,,0,1649908185,,0,{},i4npy8m,False,t3_u2oojz,False,True,t1_i4npg12,/r/CredibleDefense/comments/u2oojz/ukraine_conflict_megathread_april_13_2022/i4npy8m/,1649908200,1,False,True,False,CredibleDefense,t5_2y5ib,r/CredibleDefense,public,,0,[],,1649879385.0,
[],False,,Gracchus__Babeuf,,,[],,,,text,t2_3h53t6al,False,False,"On video holding at least two forms of government issued ID, a copy of today's newspaper and signed/notarized affidavits from an immediate family member with two non-relative witnesses to corroborate that this person is a current sailor from the Moskva.",da1e8c3c909852aaa92100a259f6349df115f4c3,True,False,,,,,0,1649908012,,0,{},i4npmkn,False,t3_u2oojz,False,True,t1_i4ncvjq,/r/CredibleDefense/comments/u2oojz/ukraine_conflict_megathread_april_13_2022/i4npmkn/,1649908030,1,False,True,False,CredibleDefense,t5_2y5ib,r/CredibleDefense,public,,0,[],,1649879212.0,
[],False,,Bokunomimi,,,[],,,,text,t2_chthq8x8,False,False,"In terms of big 'picture' war situation- how does the (likely) loss of Moskva change the war?

Undeniable if true (and looking more confirmed) that it is lost- represents a massive lost for the Russian Navy given how expensive ships are in general. But does this loss change the overall war or should be treated as a tactical victory?",c252bd206672a4214866244183916cf9823cda6c,True,False,,,,,0,1649907914,,0,{},i4npg12,False,t3_u2oojz,False,True,t3_u2oojz,/r/CredibleDefense/comments/u2oojz/ukraine_conflict_megathread_april_13_2022/i4npg12/,1649907930,1,False,True,False,CredibleDefense,t5_2y5ib,r/CredibleDefense,public,,0,[],,1649879114.0,
[],False,,FiredForIncompetence,,,[],,,,text,t2_7bjrlekh,False,False,"You are basing this theory on what exactly? 

Sound like not much better than “revealed to me in a dream”.",d1415aed9f0d9d0c7b584b091edc3c6ae5d8549e,True,False,,,,,0,1649907886,,0,{},i4npe6a,False,t3_u2oojz,False,True,t1_i4m83wd,/r/CredibleDefense/comments/u2oojz/ukraine_conflict_megathread_april_13_2022/i4npe6a/,1649907902,1,False,True,False,CredibleDefense,t5_2y5ib,r/CredibleDefense,public,,0,[],,1649879086.0,
[],False,,SouthernSerf,,,[],,,,text,t2_wzy9khb,False,False,"&gt; But isn't that in every country? Pentagon(together with intelligence agencies) lied for 20 years about true situation in Afganistan, and majority of population was genuinely suprized how quickly everything collapsed.


This just isn’t true in any shape or form, the Pentagon didn’t lie about the deployment of US troops, causalities or operations. Everything that happens with Afghanistan was pretty well documented and communicated to government and public we just didn’t like what we heard and then acted shocked when the plug got pulled and it all came crashing down.",e5cd745fd90f9253043b7d11b61796d8d8dc0981,True,False,,,,,0,1649907850,,0,{},i4npbnd,False,t3_u2oojz,False,True,t1_i4nnqdp,/r/CredibleDefense/comments/u2oojz/ukraine_conflict_megathread_april_13_2022/i4npbnd/,1649907866,1,False,True,False,CredibleDefense,t5_2y5ib,r/CredibleDefense,public,,0,[],,1649879050.0,
[],False,,FiredForIncompetence,,,[],,,,text,t2_7bjrlekh,False,False,It’s a theory based on very little evidence. This journalist goes off on a stretched conjecture.,fdee435a6e07a12f2b9b910a8597ad640d9d13a9,True,False,,,,,0,1649907797,,0,{},i4np84w,False,t3_u2oojz,False,True,t1_i4mpx6m,/r/CredibleDefense/comments/u2oojz/ukraine_conflict_megathread_april_13_2022/i4np84w/,1649907808,1,False,True,False,CredibleDefense,t5_2y5ib,r/CredibleDefense,public,,0,[],,1649878997.0,
[],False,,holymolyitsamonkey,,,[],,,,text,t2_1pljkx1v,False,False,"Yup I agree with this take based on time in Russia and reading Russian news over the ears. Just even scanning the open comment section on RIA’s report re: Moskva, there is a diversity of opinion, although common themes seem to be: a) mistrust and cynicism towards any and all official messaging, regardless of which government it comes from and b) anger at the potential loss of life, a belief that Russian forces have been overly gentle and cautious so far, desire for revenge.

At least until the recent blocking of websites, it wasn’t not a closed information environment, it was a fairly open information environment infected by lies and confusion. If North Korea is an unplugged laptop without any internet connection, then Russia is a laptop with a high-speed internet connection, but stuffed full of viruses.

That kind of undermining of reality works in your favour if there’s a competing message from an “enemy” to discredit. But here some parts of the Russian public are dismissing their own government’s bullshit, and that’s a problem for VVP. 

There’s basically no way for Russian government messaging to really gain traction unless it has life and death immediacy to the public - if a known liar says that your house is on fire right now, you’re still going to check. Hence why they’ve had to come up with some really massive lies about Ukraine’s drug-addled Nazi government exterminating Russian speakers.",e4f75e16e326d6d71a13e19ea03d3094a1e09e05,True,False,,,,,0,1649907766,,0,{},i4np60m,False,t3_u2oojz,False,True,t1_i4nls09,/r/CredibleDefense/comments/u2oojz/ukraine_conflict_megathread_april_13_2022/i4np60m/,1649907779,1,False,True,False,CredibleDefense,t5_2y5ib,r/CredibleDefense,public,,0,[],,1649878966.0,
