all_awardings,archived,associated_award,author,author_flair_background_color,author_flair_css_class,author_flair_richtext,author_flair_template_id,author_flair_text,author_flair_text_color,author_flair_type,author_fullname,author_patreon_flair,author_premium,body,body_sha1,can_gild,collapsed,collapsed_because_crowd_control,collapsed_reason,collapsed_reason_code,comment_type,controversiality,created_utc,distinguished,gilded,gildings,id,is_submitter,link_id,locked,no_follow,parent_id,permalink,retrieved_utc,score,score_hidden,send_replies,stickied,subreddit,subreddit_id,subreddit_name_prefixed,subreddit_type,top_awarded_type,total_awards_received,treatment_tags,unrepliable_reason,created,author_cakeday
[],False,,an_actual_lawyer,,,[],,,,text,t2_6pvo3,False,True,Already won.  The only thing left to determine how much Russia loses.,0df5d38e923614fbc5d12504e4f8953fa1428b1e,True,False,,,,,0,1649980740,,0,{},i4rpfei,False,t3_u3fvip,False,True,t1_i4rjyg1,/r/CredibleDefense/comments/u3fvip/ukraine_conflict_megathread_april_14_2022/i4rpfei/,1649980751,1,False,True,False,CredibleDefense,t5_2y5ib,r/CredibleDefense,public,,0,[],,1649951940.0,
[],False,,WonkiTonk1234,,,[],,,,text,t2_ll6a1ynw,False,False,"Well said. Putins decision to invade did not happen in a vacuum. Of course the intervention is not justified in the least. But a failure to integrate Russia into the liberal system and appreciate it as a ""nexus of power"" definitely played a part in building the underlying resentment against the West and the values it represents.  
In addition, there has been a lot of bilateral trust destroyed by the US, starting with unilaterally withdrawing from arms control treaties under Bush, continuing with the stationing of anti-missile defense systems that have little practical value, as well as foreign interventions (i.e.  Kosovo, Libya ) that went against Russias interest. Of course, Russia also did their part but I believe there is some truth to the view that Putin was not always the scheming dictator bent on restoring the soviet union but that he became disillusioned with Russias chances with the West over time.",9392a21ee10a676c0d0e6f9453b646ae3e9d2f99,True,False,,,,,0,1649980735,,0,{},i4rpf1n,False,t3_u3fvip,False,True,t1_i4rhdru,/r/CredibleDefense/comments/u3fvip/ukraine_conflict_megathread_april_14_2022/i4rpf1n/,1649980751,1,False,True,False,CredibleDefense,t5_2y5ib,r/CredibleDefense,public,,0,[],,1649951935.0,
[],False,,atfyfe,,,[],,,,text,t2_7z222,False,False,"&gt; Russia could release nerve agents in Odessa and take it once the agents had degraded. 

lol. You have a wildly inaccurate view of how chemical weapons work.",6417efc2097462a595f958f5c08cd51e52b0f4db,True,False,,,,,0,1649980681,,0,{},i4rpayl,False,t3_u3fvip,False,True,t1_i4pjuey,/r/CredibleDefense/comments/u3fvip/ukraine_conflict_megathread_april_14_2022/i4rpayl/,1649980693,1,False,True,False,CredibleDefense,t5_2y5ib,r/CredibleDefense,public,,0,[],,1649951881.0,
[],False,,Impossible_Average83,,,[],,,,text,t2_82jyiic7,False,False,Sikorsky is from Kyiv,36d583b55aa9720ec87d48823bebad1e8a5dd5e5,True,False,,,,,0,1649980660,,0,{},i4rp9a9,False,t3_u3fvip,False,True,t1_i4r6muk,/r/CredibleDefense/comments/u3fvip/ukraine_conflict_megathread_april_14_2022/i4rp9a9/,1649980671,1,False,True,False,CredibleDefense,t5_2y5ib,r/CredibleDefense,public,,0,[],,1649951860.0,
[],False,,an_actual_lawyer,,,[],,,,text,t2_6pvo3,False,True,I’m confident NATO/US intelligence pointed out the fact that the radar was really only effective at targeting in one direction.,6fc02b471fdfe0312d778804a9c76e562db689ed,True,False,,,,,0,1649980650,,0,{},i4rp8ku,False,t3_u3fvip,False,True,t1_i4rg1mk,/r/CredibleDefense/comments/u3fvip/ukraine_conflict_megathread_april_14_2022/i4rp8ku/,1649980664,1,False,True,False,CredibleDefense,t5_2y5ib,r/CredibleDefense,public,,0,[],,1649951850.0,
[],False,,atfyfe,,,[],,,,text,t2_7z222,False,False,I can't imagine that armor plates could be damaged by humidity. This seems like stupid speculation. Kevlar vests and ceramic/metal plates aren't gonna stop working because you kept it in a shed for 20 years. Come on.,7d07224050c13d19989c6f483a2b4b3102b6d461,True,False,,,,,0,1649980436,,0,{},i4rort1,False,t3_u3fvip,False,True,t1_i4pkx9v,/r/CredibleDefense/comments/u3fvip/ukraine_conflict_megathread_april_14_2022/i4rort1/,1649980447,1,False,True,False,CredibleDefense,t5_2y5ib,r/CredibleDefense,public,,0,[],,1649951636.0,
[],False,,hatesranged,,,[],,,,text,t2_3svjqav4,False,False,"https://twitter.com/UAWeapons/status/1514717131438501894

Going to out myself as a philistine here, but shouldn't a tank be basically immune to most IFV weapons, especially from the front?",79cd798dc69d5738055c892df670acfea6f3d6ba,True,False,,,,,0,1649980426,,0,{},i4ror0t,False,t3_u3fvip,False,True,t3_u3fvip,/r/CredibleDefense/comments/u3fvip/ukraine_conflict_megathread_april_14_2022/i4ror0t/,1649980439,1,False,True,False,CredibleDefense,t5_2y5ib,r/CredibleDefense,public,,0,[],,1649951626.0,
[],False,,TheRed_Knight,,,[],,,,text,t2_isd5x,False,True,"Reminds me of some quotes from *A Frozen Hell: The Russo-Finish War of 1939-1940* by William R. Trotter about the state of the Russian army

*“Whole divisions entered Finland with no worthwhile intelligence estimates of their opposition, guided by hopelessly inaccurate maps, yet fully burdened with truckloads of propaganda material including reams of posters and brass bands.”*

*“All told, Finnish fighter pilots shot down 240 confirmed Red aircraft, against the loss of 26 of their own planes. It was standard practice to send at least one interceptor up to meet every Russian bomber sortie within range. Not infrequently the appearance of a single Fokker caused an entire squadron of SB-2s to jettison its bombs into the snow and turn tail.”*

***“Leadership beyond the NCO level was brittle, sluggish, and marked by a rigid adherence to the same primitive tactics over and over again, no matter what the actual situation.”***

*“scratch units made up of raw draftees, many of whom were so ignorant they didn't even know the name of the country they were invading.”*

*“One Soviet general, looking at a map of the territory Russia had acquired on the Karelian Isthmus, is said to have remarked: ""We have won just about enough ground to bury our dead” “[Another] One of them remarked, in a flat weary voice, ""The wolves will eat well this year.”*",24c5b2a28e4c945c991b48011db5262a7bd28955,True,False,,,,,0,1649980398,,0,{},i4roosr,False,t3_u3lee5,False,True,t3_u3lee5,/r/CredibleDefense/comments/u3lee5/excerpts_from_an_economist_article_from_1854/i4roosr/,1649980410,1,False,True,False,CredibleDefense,t5_2y5ib,r/CredibleDefense,public,,0,[],,1649951598.0,
[],False,,Impossible_Average83,,,[],,,,text,t2_82jyiic7,False,False,Nato rejected Georgia and Ukraine petitions in 2008. The situation would probably be different right now.,06901999129de9c187bbcdaba0b8d80d48f279a3,True,False,,,,,0,1649980316,,0,{},i4roidj,False,t3_u3fvip,False,True,t1_i4rf0s9,/r/CredibleDefense/comments/u3fvip/ukraine_conflict_megathread_april_14_2022/i4roidj/,1649980331,1,False,True,False,CredibleDefense,t5_2y5ib,r/CredibleDefense,public,,0,[],,1649951516.0,
[],False,,X-RAYben,,,[],,,,text,t2_b80uwo,False,False,"If the Russian Navy is claiming it was an accident, that's embarrassing and bad because accidents at sea happen pretty often in many modern navies across the world. Not like this, of course. If this were an accident, which it doesn't appear to be, this would be very embarrassing just for the simple fact it led to the largest warship ever sunk since WWII.",12a7ee92d3c5d5de8a61378026f8bb6ab419cd1a,True,False,,,,,0,1649980292,,0,{},i4rogh5,False,t3_u3fvip,False,True,t1_i4rf0ux,/r/CredibleDefense/comments/u3fvip/ukraine_conflict_megathread_april_14_2022/i4rogh5/,1649980309,1,False,True,False,CredibleDefense,t5_2y5ib,r/CredibleDefense,public,,0,[],,1649951492.0,
[],False,,DragonCrisis,,,[],,,,text,t2_q93bb,False,False,Well blaming the transport ship that sunk on bad handling of faulty ammo that it was unloading I could buy... but a missile cruiser?,1d9949ca865cd0db2c20119de7df2c17e9144c03,True,False,,,,,0,1649980199,,0,{},i4ro8y1,False,t3_u3fvip,False,True,t1_i4rbevs,/r/CredibleDefense/comments/u3fvip/ukraine_conflict_megathread_april_14_2022/i4ro8y1/,1649980215,1,False,True,False,CredibleDefense,t5_2y5ib,r/CredibleDefense,public,,0,[],,1649951399.0,
[],False,,Impossible_Average83,,,[],,,,text,t2_82jyiic7,False,False,As Ukrainian I can confirm that Ukraine needs more lethal/non-lethal aid not less. More help will means LESS cost for Ukraine,bfbc9a854ea1f3075df79c23b36d0c52682e3c2b,True,False,,,,,0,1649980161,,0,{},i4ro5vi,False,t3_u3fvip,False,True,t1_i4rgamf,/r/CredibleDefense/comments/u3fvip/ukraine_conflict_megathread_april_14_2022/i4ro5vi/,1649980178,1,False,True,False,CredibleDefense,t5_2y5ib,r/CredibleDefense,public,,0,[],,1649951361.0,
[],False,,Frank_JWilson,,,[],,,,text,t2_5jc3m,False,False," [Interesting analysis by on a Russian telegram channel prior to the confirmation of the sinking of Moskva](https://t.me/atomiccherry/429)

It alleges significant NATO intelligence assistance in the planning and execution of the attack.

&gt; The attack on the Moscow missile cruiser is only a harbinger of a change in the military situation in the region.

&gt; In recent weeks, I have repeatedly written that the Black Sea Fleet will become a priority target for the new phase of the campaign.  This was understandable from a military point of view: the active operations of the Black Sea Fleet west of Crimea is a constant threat of amphibious assault, more effective fire support for ground forces by reducing the flight time of subsonic cruise missiles, as well as a threat factor for sea communications near Odessa, which is detrimental both for  for the Ukrainian economy, and for the Western one (if, say, we are talking about shipping through the port of neon, which is necessary for the world microelectronics industry).  This is even more understandable from the point of view of media symbolism - the death of ships is always perceived by the public more tangibly than the death of entire units;  this fact is perfectly confirmed by today's shock state of the Russian media sphere.

&gt; Moscow's attack was not an accident or improvisation - the cruiser was chosen as a target for both technical and propaganda reasons. On the one hand, this is the flagship of the Black Sea Fleet of the Russian Federation, on the other hand, it is a ship that is deeply outdated, worn out by long service and chronic underfunding.

&gt; The strike on the Moscow was well planned and thought out: it was carried out in stormy conditions in order to complicate the ship's damage control and crew evacuation operations as much as possible;  moreover, he was at a distance from other ships of the Black Sea Fleet. According to transponders, only 5 boats of an unknown type could come to the aid of the cruiser.

&gt; As I assumed earlier, the operation was carried out in full cooperation of the Ukrainian Navy with the Allied forces: for example, according to airspace monitoring data for April 12, the British RC-135 reconnaissance aircraft was actively operating in the Black Sea area, and RQ UAV flights were also recorded at different times RQ-4 Global Hawk (map included).  On that day, NATO intelligence confirmed the presence of the Moscow, verified the signatures, and received comprehensive data on the whereabouts of other ships of the Black Sea Fleet of the Russian Federation.

&gt; On April 13 (the day of the attack), some kind of military magic happened - data on the flights of the RC-135 and RQ-4 is simply not available.  The reason for this is that air reconnaissance aircraft flew with transponders turned off, and civilian airspace monitoring devices could not detect them, which in itself is more than a clear reconnaissance sign.

&gt; The missile attack on the cruiser was carried out using the Neptune missile defense system, a modern missile system made using military microelectronics manufactured in Western Europe (and, naturally, it was able to receive external target designation from NATO reconnaissance aircraft).  Various conspiracy theories about the use of the Norwegian Penguin anti-ship missiles are complete nonsense.  This missile is intended only for aviation and naval carriers and, doubly important, it has an extremely limited range of use (34 km in the Mk2 mod.).

&gt; Above, I mentioned the poor technical condition of the Moscow - and this is not an accident.  Previously, the cruiser could not undergo repairs and maintenance for several years, and the Ministry of Defense refused to modernize it.  In practice, this means that the Moscow was a ship with VERY outdated equipment and weapons - the ability of the missile cruiser to repel missile strikes raises legitimate questions. Judging by a number of data, Bayraktar UAVs also took part in the attack on the cruiser, acting as a means of carrying out a distracting maneuver.

&gt; At the moment, the fate of ""Moscow"" is still unknown.  I will not dispute the words of the Russian Ministry of Defense - I will only say that simultaneously declaring ""munitions detonation"" and that ""the ship is intact"" is perhaps not the best move, given the nature of the cruiser design.

&gt; The Moskva incident, however, is deeply symbolic - it shows that a new campaign for control of the Black Sea has begun.

&gt; In conclusion, I will say the following: do not be proud of the fact that Russia ""opposes all the might of the West."" This is not so - the Russian Federation so far opposes only the strategists, analysts and intelligence officers of NATO.

&gt; And this confrontation brings us to extremely disappointing conclusions.",cc4af0a96cca8693d7735b6870a87aca4b75dae5,True,False,,,,,0,1649980158,,0,{},i4ro5q0,False,t3_u3fvip,False,True,t3_u3fvip,/r/CredibleDefense/comments/u3fvip/ukraine_conflict_megathread_april_14_2022/i4ro5q0/,1649980170,1,False,True,False,CredibleDefense,t5_2y5ib,r/CredibleDefense,public,,0,[],,1649951358.0,
[],False,,Blue387,,,[],,,,text,t2_6xigb,False,False,"If I recall, Turkey supported Azerbaijan in the 2020 war while Russia backed the Armenians",14448044033d6777278951c0fb01bb8b48bbdd7d,True,False,,,,,0,1649980154,,0,{},i4ro5dr,False,t3_u3fvip,False,True,t1_i4r7z91,/r/CredibleDefense/comments/u3fvip/ukraine_conflict_megathread_april_14_2022/i4ro5dr/,1649980171,1,False,True,False,CredibleDefense,t5_2y5ib,r/CredibleDefense,public,,0,[],,1649951354.0,
[],False,,atfyfe,,,[],,,,text,t2_7z222,False,False,"We don't organize around battalions, we organize around brigades. That allows a lot of depth for drawing on troops inside the brigade to replace losses. Furthermore, 1/3 of the Russian battalions are conscripts intended to serve in supplyline and rear duties.",ed3597e16aa132ca0affba484eaef8e1a42c580a,True,False,,,,,0,1649980070,,0,{},i4rnysv,False,t3_u3fvip,False,True,t1_i4r5ysc,/r/CredibleDefense/comments/u3fvip/ukraine_conflict_megathread_april_14_2022/i4rnysv/,1649980081,1,False,True,False,CredibleDefense,t5_2y5ib,r/CredibleDefense,public,,0,[],,1649951270.0,
[],False,,VictoryForCake,,,[],,,,text,t2_ciiwo,False,False,"Non-proliferation was lost when it was shown that all the agreements made were simply not worth the paper they were written on. Nuclear weapons and a mechanism to deliver them are the only military force that can deter a much larger nation from invading you or forcing regime change, its a giant equaliser in terms of power, as being able to inflict millions of casualties and mass economic damage is sufficient deterrence. As for who signed those agreements and their outcomes;

Gaddafi - Overthrown and murdered - With US/NATO/EU support
Hussein - Overthrown and executed - US led invasion
Bashar Al-Assad - Almost lost control, only held on with Russian support - US/NATO/EU support
Ukraine - Invaded by Russia

All of these countries had nuclear weapons, or had programs to acquire them. They were talked out of pursuing nuclear weapons and in the meantime were invaded or had attempted regime changes supported by foreign nations that had a narrative of that nation and government being illegitimate by the ideology/standards/morals of the intervening nation.

In such an environment could it be expected that North Korea would give up its nuclear weapons to leave itself open to US or Chinese backed regime change. Of course not giving up nuclear weapons would be illogical not logical. There is a good North Korea academic scholar called Andrei Lankov who goes into great detail on the logic that North Korea uses in its WMD's and its policies towards them, and its general geopolitical relations, I recommend reading up on his writings, or listening to some of his presentations.",c293849213e0860804ea6393f8f7851ccfd306b2,True,False,,,,,0,1649979985,,0,{},i4rns1c,False,t3_u3hjb2,False,True,t3_u3hjb2,/r/CredibleDefense/comments/u3hjb2/nuclear_weapons_iran_north_korea_and_have_we_lost/i4rns1c/,1649980001,1,False,True,False,CredibleDefense,t5_2y5ib,r/CredibleDefense,public,,0,[],,1649951185.0,
[],False,,an_actual_lawyer,,,[],,,,text,t2_6pvo3,False,True,"How are those even remotely the same thing?

Take this bullshit somewhere else.",8e4785bb94c920e244a4d460a80be8ad406bcfcd,True,False,,,,,0,1649979924,,0,{},i4rnn8h,False,t3_u3fvip,False,True,t1_i4rjnfr,/r/CredibleDefense/comments/u3fvip/ukraine_conflict_megathread_april_14_2022/i4rnn8h/,1649979939,1,False,True,False,CredibleDefense,t5_2y5ib,r/CredibleDefense,public,,0,[],,1649951124.0,
[],False,,Euro_Snob,,,[],,,,text,t2_fo7bi,False,False,"Is Belogorod under attack again from Ukraine? Some sources suggest that Ukraine has been shelling industry in the town today: 

[https://twitter.com/JimmySecUK/status/1514724306894348295](https://twitter.com/JimmySecUK/status/1514724306894348295)

**If true**, could these pestering attacks be a done to tie up Russian troops in the Belogorod/Kharkiv area to prevent them from being redeployed to Izium or Donbas?

Or is my thinking too contrived here, when they simply are targeting infrastructure supporting the war?",771d97aa2fd2380d99dbbbaecd8077fc1e882113,True,False,,,,,0,1649979876,,0,{},i4rnjdl,False,t3_u3fvip,False,True,t3_u3fvip,/r/CredibleDefense/comments/u3fvip/ukraine_conflict_megathread_april_14_2022/i4rnjdl/,1649979887,1,False,True,False,CredibleDefense,t5_2y5ib,r/CredibleDefense,public,,0,[],,1649951076.0,
[],False,,TheGreatestAuk,,,[],,,,text,t2_5bvf9h0t,False,False,"The Russian navy is awful, this is a known fact.  The Admiral Kuznetsov hasn't been to sea in years, because she's been in refit.  Not only has she been in refit since 2017, the floating drydock sank and a crane fell over, which put a hole in her deck.  Later, she caught fire.  She isn't expected to be back at sea until mid-2023.

What Russia has going for it, though, is its air defence capabilities.  S-300 and S-400 missiles are (reputedly) some of the best out there.  The systems on board the Moskva should've been able to identify a pair of subsonic anti-ship missiles, but didn't.  I'm hearing that a Bayraktar was flown as a distraction.  It's a very bad look if the Russian Navy was distracted by a drone over here, when there are two missiles over there.  It's less embarrassing to say that the air defenses are great and the ship caught fire, than the flagship of the Black Sea Fleet was sunk by a country with no navy.

PS.  Bonus Kuznetsov story -

On 14 November 2016, a MiG-29K crashed into the sea after taking off from the carrier. The pilot ejected safely from the plane and was rescued by helicopter. According to initial reports from Russian officials, the crash was a result of technical malfunction, but it was later revealed that the plane had actually run out of fuel waiting to land while the crew was attempting to repair a broken arresting wire. The carrier commander could have diverted the aircraft to land at a nearby airbase, but hesitated in the hope that the arrestor gear would be repaired in time.",1f04ab111af2db727a4619ac3c3ea527cb763cc1,True,False,,,,,0,1649979817,,0,{},i4rnem3,False,t3_u3fvip,False,True,t1_i4p3l4f,/r/CredibleDefense/comments/u3fvip/ukraine_conflict_megathread_april_14_2022/i4rnem3/,1649979829,1,False,True,False,CredibleDefense,t5_2y5ib,r/CredibleDefense,public,,0,[],,1649951017.0,
[],False,,IntroductionNeat2746,,,[],,,,text,t2_5bv0y43u,False,False,"&gt;Yes, partial blame no doubt belongs to the West

I don't think it's a question of blame, but rather of the west failing to seize an opportunity. There were many possible approaches at the time, from soft to very hard power. I think it is clear now that the approach that was chosen didn't quite work out.",5ba790749f2984208bad76a7e1469778f26095be,True,False,,,,,0,1649979657,,0,{},i4rn1q1,False,t3_u3fvip,False,True,t1_i4riiqz,/r/CredibleDefense/comments/u3fvip/ukraine_conflict_megathread_april_14_2022/i4rn1q1/,1649979674,1,False,True,False,CredibleDefense,t5_2y5ib,r/CredibleDefense,public,,0,[],,1649950857.0,
[],False,,well-that-was-fast,,,[],,,,text,t2_80r0o,False,False,"&gt; nited States and other powers appear to be willing to fund Ukraine with more weaponry than they could ever need.

IMO, this doubly untrue.

- The US has a selection of weapons that are fully integrated in the US system of command in ways that often makes them not easy to ""give away""

- The US has purposefully stepped back and let the EU take the lead in many ways *because* Trump was so overbearing. It's just Germany and France decided to go awol and leave to Poland and Lithuania to lead.",ba1d323a80a9e354532d06656530514c924e4815,True,False,,,,,0,1649979653,,0,{},i4rn1ez,False,t3_u3fvip,False,True,t1_i4qz3im,/r/CredibleDefense/comments/u3fvip/ukraine_conflict_megathread_april_14_2022/i4rn1ez/,1649979666,1,False,True,False,CredibleDefense,t5_2y5ib,r/CredibleDefense,public,,0,[],,1649950853.0,
[],False,,Nouseriously,,,[],,,,text,t2_ztebf,False,False,"Well, at least the hose got rid of their brains.",ce8e72faf9ccf38e6a5d88457165dcf88380327b,True,False,,,,,0,1649979644,,0,{},i4rn0qk,False,t3_u3fvip,False,True,t1_i4rlhf0,/r/CredibleDefense/comments/u3fvip/ukraine_conflict_megathread_april_14_2022/i4rn0qk/,1649979659,1,False,True,False,CredibleDefense,t5_2y5ib,r/CredibleDefense,public,,0,[],,1649950844.0,
[],False,,throwdemawaaay,,,[],,,,text,t2_xzr44,False,False,"Bill Browder's congressional testimony is a reasonably accurate and succinct version of what happened. Prosperity requires functioning institutions. If there's one pattern that's abundantly clear in post war history it's that societies with dysfunctional institutions will decay towards authoritarianism, at the cost of broad economic growth and social improvement.",f73e46027a0cd50d22355e455c5218cf9b4a58a6,True,False,,,,,0,1649979584,,0,{},i4rmvt7,False,t3_u3fvip,False,True,t1_i4rdmh1,/r/CredibleDefense/comments/u3fvip/ukraine_conflict_megathread_april_14_2022/i4rmvt7/,1649979599,1,False,True,False,CredibleDefense,t5_2y5ib,r/CredibleDefense,public,,0,[],,1649950784.0,
[],False,,Euro_Snob,,,[],,,,text,t2_fo7bi,False,False,"I was being charitable, but yes, I stand corrected. ;-)",61eb77aad728490f00b644d5a8cc2cab50aba241,True,False,,,,,0,1649979531,,0,{},i4rmrjr,False,t3_u3fvip,False,True,t1_i4rks28,/r/CredibleDefense/comments/u3fvip/ukraine_conflict_megathread_april_14_2022/i4rmrjr/,1649979548,1,False,True,False,CredibleDefense,t5_2y5ib,r/CredibleDefense,public,,0,[],,1649950731.0,
[],False,,Blue387,,,[],,,,text,t2_6xigb,False,False,"The Falklands War was 40 years ago, good lord",7a20f76cb09eeeb02f7a57ac8df83a9725d44db7,True,False,,,,,0,1649979485,,0,{},i4rmnrt,False,t3_u3fvip,False,True,t1_i4rkkgl,/r/CredibleDefense/comments/u3fvip/ukraine_conflict_megathread_april_14_2022/i4rmnrt/,1649979496,1,False,True,False,CredibleDefense,t5_2y5ib,r/CredibleDefense,public,,0,[],,1649950685.0,
[],False,,Ascerendant,,,[],,,,text,t2_47xhduin,False,False,But didn’t Rheinmetal also start the whole Marder-fiasko where they said they had 100 still on site and the more it was discussed the more it turned out that only 30 were actually feasible to be reinstated and that was before everybody noticed that they would be of little use to Ukraine at all plus Rheinmetal would have had to also fabricate support packages exclusively for Ukraine for the foreseeable future so that they would last more than two weeks?,ce577941fa9c231ce87249d034e882e1ffbd6011,True,False,,,,,0,1649979477,,0,{},i4rmn6m,False,t3_u3fvip,False,True,t1_i4r5blw,/r/CredibleDefense/comments/u3fvip/ukraine_conflict_megathread_april_14_2022/i4rmn6m/,1649979488,1,False,True,False,CredibleDefense,t5_2y5ib,r/CredibleDefense,public,,0,[],,1649950677.0,
[],False,,well-that-was-fast,,,[],,,,text,t2_80r0o,False,False,"&gt; Wtf is going on with german politicians and Russia? I understand being hesitant to stop buying Russian gas if they're truly dependent, but are they really afraid putin will cut off the gas if they help Ukraine too much?

It's hard to even get a basic understanding of the story, it seems every day someone different from Ukraine or Germany or NATO is in the media saying 180-degree the opposite of what was said yesterday.

I mean, literately, yesterday Scholz went on the record saying they have given the most to Ukraine of any other country, it's just secret. Now like 30-hours later, people are reporting he's holding back...",238498abc4facbc3ce2ed68b0c2781ad6b34ca3a,True,False,,,,,0,1649979398,,0,{},i4rmh01,False,t3_u3fvip,False,True,t1_i4qxzsf,/r/CredibleDefense/comments/u3fvip/ukraine_conflict_megathread_april_14_2022/i4rmh01/,1649979415,1,False,True,False,CredibleDefense,t5_2y5ib,r/CredibleDefense,public,,0,[],,1649950598.0,
