all_awardings,archived,associated_award,author,author_flair_background_color,author_flair_css_class,author_flair_richtext,author_flair_template_id,author_flair_text,author_flair_text_color,author_flair_type,author_fullname,author_patreon_flair,author_premium,body,body_sha1,can_gild,collapsed,collapsed_because_crowd_control,collapsed_reason,collapsed_reason_code,comment_type,controversiality,created_utc,distinguished,gilded,gildings,id,is_submitter,link_id,locked,no_follow,parent_id,permalink,retrieved_utc,score,score_hidden,send_replies,stickied,subreddit,subreddit_id,subreddit_name_prefixed,subreddit_type,top_awarded_type,total_awards_received,treatment_tags,unrepliable_reason,created,author_cakeday
[],False,,MWittman88,,,[],,,,text,t2_i0pxha7h,False,False,"How catastrophic would a detonation of one of those on the deck be for the ship? Also I hope it was one of the heavy missiles, not the lightweight SAMs.",e58dcdd4f52e6322fa27d5ada90a58df896c9d18,True,False,,,,,0,1649946794,,0,{},i4pdvvy,False,t3_u3fvip,False,True,t1_i4p4pk5,/r/CredibleDefense/comments/u3fvip/ukraine_conflict_megathread_april_14_2022/i4pdvvy/,1649946813,1,False,True,False,CredibleDefense,t5_2y5ib,r/CredibleDefense,public,,0,[],,1649917994.0,
[],False,,Wowzlul,,,[],,,,text,t2_ekafly7s,False,False,"I'd prefer a world with fewer Russian nuclear weapons in fewer locations. As we've seen this past month, the Russian military isn't exactly top tier when it comes to operational competence, and the risk of an accident or miscalculation is always greater when nuclear weapons are deployed in more places.

It would be, at the very least, a risky, super dickish move. Very characteristic of the current Russian regime.",95410769d2790d53c61ef8fb2dcb66d81e7677f7,True,False,,,,,0,1649946723,,0,{},i4pdpm2,False,t3_u3fvip,False,True,t1_i4pd4ns,/r/CredibleDefense/comments/u3fvip/ukraine_conflict_megathread_april_14_2022/i4pdpm2/,1649946737,1,False,True,False,CredibleDefense,t5_2y5ib,r/CredibleDefense,public,,0,[],,1649917923.0,
[],False,,KaneIntent,,,[],,,,text,t2_i6bl9,False,False,Completely impossible because of domestic image.,52afd87499b3f76011569b4540dfe2c215670e49,True,False,,,,,0,1649946510,,0,{},i4pd6va,False,t3_u3fvip,False,True,t1_i4pcloe,/r/CredibleDefense/comments/u3fvip/ukraine_conflict_megathread_april_14_2022/i4pd6va/,1649946522,1,False,True,False,CredibleDefense,t5_2y5ib,r/CredibleDefense,public,,0,[],,1649917710.0,
[],False,,kmmontandon,,,[],,,,text,t2_am8zb,False,True,"&gt; Not just American, and not just right wing - tankies and other anti-western lefties latch onto this shit, too.

They don't have votes in Congress, or a major news network (an da couple smaller ones) regurgitating pro-Russian propaganda.",d2ad8421682382b172555459f335df14d808f39e,True,False,,,,,0,1649946489,,0,{},i4pd50w,False,t3_u3fvip,False,True,t1_i4pch0n,/r/CredibleDefense/comments/u3fvip/ukraine_conflict_megathread_april_14_2022/i4pd50w/,1649946499,1,False,True,False,CredibleDefense,t5_2y5ib,r/CredibleDefense,public,,0,[],,1649917689.0,
[],False,,IcecreamLamp,,,[],,,,text,t2_ej9rs,False,False,Yeah they do. It's a nonsensical threat.,4ac12ffc36daa83eb4429edd3d111fde118e5b31,True,False,,,,,0,1649946484,,0,{},i4pd4ns,False,t3_u3fvip,False,True,t1_i4p9i5i,/r/CredibleDefense/comments/u3fvip/ukraine_conflict_megathread_april_14_2022/i4pd4ns/,1649946499,1,False,True,False,CredibleDefense,t5_2y5ib,r/CredibleDefense,public,,0,[],,1649917684.0,
[],False,,Wowzlul,,,[],,,,text,t2_ekafly7s,False,False,"&gt; It's a 1960s era threat. Missiles nearby was a problem in Cuba and Turkey before ICBMs were a thing.

In theory, placing missiles close by can reduce reaction time, requiring an adversary to adapt their nuclear war plans (lol) to account for it. This particular move is unlikely to be destabilizing in that it doesn't impact MAD, but missile placements can theoretically have this effect.

Although maybe nuclear war plans have worked around this effect in all instances I dunno. It's super duper top secret.",e4cb085d46c7f7ad4a299f4ac8408fc05faf81ac,True,False,,,,,0,1649946456,,0,{},i4pd24q,False,t3_u3fvip,False,True,t1_i4pb5k4,/r/CredibleDefense/comments/u3fvip/ukraine_conflict_megathread_april_14_2022/i4pd24q/,1649946470,1,False,True,False,CredibleDefense,t5_2y5ib,r/CredibleDefense,public,,0,[],,1649917656.0,
[],False,,MeSmeshFruit,,,[],,,,text,t2_1k4j1hu0,False,False,"Now it seems that the possibility of a ""Ukrainian guerrila resistance"" is extremely unlikely but not in a good way for Russia. 



As in they will most likely be pushed out with conventional means.",65dd1d9f7e4bb104ec996e33faa89b00e82051f0,True,False,,,,,0,1649946423,,0,{},i4pczdi,False,t3_u3fvip,False,True,t3_u3fvip,/r/CredibleDefense/comments/u3fvip/ukraine_conflict_megathread_april_14_2022/i4pczdi/,1649946439,1,False,True,False,CredibleDefense,t5_2y5ib,r/CredibleDefense,public,,0,[],,1649917623.0,
[],False,,indicisivedivide,,,[],,,,text,t2_7ra55io1,False,False,If the Russian navy has some sense then they will scrap the carrier and this cruiser.,32078b16c5f16d7a4ede94103035e7071e07fb04,True,False,,,,,0,1649946265,,0,{},i4pcloe,False,t3_u3fvip,False,True,t3_u3fvip,/r/CredibleDefense/comments/u3fvip/ukraine_conflict_megathread_april_14_2022/i4pcloe/,1649946283,1,False,True,False,CredibleDefense,t5_2y5ib,r/CredibleDefense,public,,0,[],,1649917465.0,
[],False,,covad_commander,,,[],,,,text,t2_8e3gwkyg,False,False,"Not just American, and not just right wing - tankies latch onto this shit, too.",200e9737f80ad4eded9d84ba4b2eac7baded4fcb,True,False,,,,,0,1649946212,,0,{},i4pch0n,False,t3_u3fvip,False,True,t1_i4p9fbt,/r/CredibleDefense/comments/u3fvip/ukraine_conflict_megathread_april_14_2022/i4pch0n/,1649946222,1,False,True,False,CredibleDefense,t5_2y5ib,r/CredibleDefense,public,,0,[],,1649917412.0,
[],False,,seakingsoyuz,,,[],,,,text,t2_pd7tf,False,False,"See my answer—quite the reverse of what you’ve said, neutral countries are *required* to intern belligerent sailors they rescue.",c67c17410302faf0df343e401d3c2b8d60f0b7ef,True,False,,,,,0,1649946159,,0,{},i4pcchh,False,t3_u3fvip,False,True,t1_i4p0a7v,/r/CredibleDefense/comments/u3fvip/ukraine_conflict_megathread_april_14_2022/i4pcchh/,1649946170,1,False,True,False,CredibleDefense,t5_2y5ib,r/CredibleDefense,public,,0,[],,1649917359.0,
[],False,,i_need_a_new_gpu,,,[],,,,text,t2_yyu1f,False,False,Officially Russia and Ukraine are not at war. There was no war declaration.,0227974a9c4d0b044cacaa6781ac113356d9e4de,True,False,,,,,0,1649946096,,0,{},i4pc6zh,False,t3_u3fvip,False,True,t1_i4p0a7v,/r/CredibleDefense/comments/u3fvip/ukraine_conflict_megathread_april_14_2022/i4pc6zh/,1649946110,1,False,True,False,CredibleDefense,t5_2y5ib,r/CredibleDefense,public,,0,[],,1649917296.0,
[],False,,an_actual_lawyer,,,[],,,,text,t2_6pvo3,False,True,"Yep.  You can bounce data off of a satellite phone service, but it is absurdly slow for HD video and absurdly expensive as well.  Starlink will largely solve that issue where available.",15a6ca6bdd18acacc382330378b153e06aaf3859,True,False,,,,,0,1649946027,,0,{},i4pc0w3,False,t3_u3fvip,False,True,t1_i4p8vzk,/r/CredibleDefense/comments/u3fvip/ukraine_conflict_megathread_april_14_2022/i4pc0w3/,1649946045,1,False,True,False,CredibleDefense,t5_2y5ib,r/CredibleDefense,public,,0,[],,1649917227.0,
[],False,,braderz_12,,,[],,,,text,t2_l8f4o,False,False,"&gt;not at all related defense but geopolitics

Mate, go to the home page of this sub and read the subtitle/ description. 

&gt;Strategy, History, Procurement, International Politics, National Defense, Intelligence

The other comment I linked was probably deleted, I have no idea why the 2nd link doesn't point to the comment that I clicked ""copy link"" on. The 2nd comment was supposed to link to a snarky comment with 10 upvotes that said something like ""Russia is mine. There I said so. Therefore it's mine now"".",8ec4ce3c1f4d0218a36d6612ede33ba5d7eb13f9,True,False,,,,,0,1649946026,,0,{},i4pc0qe,False,t3_u2oojz,False,True,t1_i4p44dx,/r/CredibleDefense/comments/u2oojz/ukraine_conflict_megathread_april_13_2022/i4pc0qe/,1649946036,1,False,True,False,CredibleDefense,t5_2y5ib,r/CredibleDefense,public,,0,[],,1649917226.0,
[],False,,Wowzlul,,,[],,,,text,t2_ekafly7s,False,False,Honestly this is the last place you wanna be reading if you have anxiety issues.,d01d54a22f20ea19b1cc2dd1fd7809a65c6a433c,True,False,,,,,0,1649946009,,0,{},i4pbzam,False,t3_u3fvip,False,True,t1_i4p4y4i,/r/CredibleDefense/comments/u3fvip/ukraine_conflict_megathread_april_14_2022/i4pbzam/,1649946023,1,False,True,False,CredibleDefense,t5_2y5ib,r/CredibleDefense,public,,0,[],,1649917209.0,
[],False,,seakingsoyuz,,,[],,,,text,t2_pd7tf,False,False,"Answer with an actual source:

Article 15 of the Second Geneva Convention says:

&gt; If wounded, sick or shipwrecked persons are taken on board a neutral warship or a neutral military aircraft, it shall be ensured, where so required by international law, that they can take no further part in operations of war.

So they must be interned for the duration of hostilities, as this is generally require for belligerents who enter a neutral power’s jurisdiction IAW the 1907 Hague Convention.

[Here is the ICRC commentary on this article](https://ihl-databases.icrc.org/applic/ihl/ihl.nsf/Comment.xsp?action=openDocument&amp;documentId=D343B72B85E77E90C1258115003BF2F4)

Article 17 further reinforces this for anyone who is landed in a neutral port.",41b1ec82caf59e1f9096938dee9897a5ba5bf0df,True,False,,,,,0,1649945999,,0,{},i4pbyed,False,t3_u3fvip,False,True,t1_i4ozm21,/r/CredibleDefense/comments/u3fvip/ukraine_conflict_megathread_april_14_2022/i4pbyed/,1649946017,1,False,True,False,CredibleDefense,t5_2y5ib,r/CredibleDefense,public,,0,[],,1649917199.0,
[],False,,an_actual_lawyer,,,[],,,,text,t2_6pvo3,False,True,"Absolutely, and they would, no questions asked.  If there had been an actual declaration of war, they might be interred in some circumstances and Russia billed for their room and board.",d1d7461706447771313814b0c3f0a02f62ef0145,True,False,,,,,0,1649945926,,0,{},i4pbrwx,False,t3_u3fvip,False,True,t1_i4ozm21,/r/CredibleDefense/comments/u3fvip/ukraine_conflict_megathread_april_14_2022/i4pbrwx/,1649945942,1,False,True,False,CredibleDefense,t5_2y5ib,r/CredibleDefense,public,,0,[],,1649917126.0,
[],False,,an_actual_lawyer,,,[],,,,text,t2_6pvo3,False,True,"Putin sold the Russian public on a ""special operation"" only using professional soldiers against a weak enemy.  He promised it would be quick and relatively painless. 

Admitting Ukraine sunk the Black Sea flagship is admitting that Russian vessels are either flawed or the crews are poorly trained.  It is also an admission that Ukraine killed Russian sailors.

From Putin's point of view ""bad luck fire with no casualties"" is better than ""Ukraine popped us.""",c98cfe7c65a2fe482a2e0ff15dfdb6be8aef5eb3,True,False,,,,,0,1649945782,,0,{},i4pbfl1,False,t3_u3fvip,False,True,t1_i4p3l4f,/r/CredibleDefense/comments/u3fvip/ukraine_conflict_megathread_april_14_2022/i4pbfl1/,1649945803,1,False,True,False,CredibleDefense,t5_2y5ib,r/CredibleDefense,public,,0,[],,1649916982.0,
[],False,,WiseassWolfOfYoitsu,,,[],,,,text,t2_2gc1i7f,False,False,It's a 1960s era threat. Missiles nearby was a problem in Cuba and Turkey before ICBMs were a thing.,ebde386d1dc7cf1e6baee1011a60c432d4fbb5b7,True,False,,,,,0,1649945662,,0,{},i4pb5k4,False,t3_u3fvip,False,True,t1_i4p31ii,/r/CredibleDefense/comments/u3fvip/ukraine_conflict_megathread_april_14_2022/i4pb5k4/,1649945675,1,False,True,False,CredibleDefense,t5_2y5ib,r/CredibleDefense,public,,0,[],,1649916862.0,
[],False,,an_actual_lawyer,,,[],,,,text,t2_6pvo3,False,True,"You're too cynical.

The military-industrial complex is real, but any conspiracy wouldn't be about advertising, it would be lobbying because ""if our country gives them 100 of these weapons from its warehouses, they're going to order 100 more.""",a3293c7a87d678d9492f968729acf925303aa6a3,True,False,,,,,0,1649945632,,0,{},i4pb2yy,False,t3_u3fvip,False,False,t1_i4p8ayi,/r/CredibleDefense/comments/u3fvip/ukraine_conflict_megathread_april_14_2022/i4pb2yy/,1649945645,1,False,True,False,CredibleDefense,t5_2y5ib,r/CredibleDefense,public,,0,[],,1649916832.0,
[],False,,braderz_12,,,[],,,,text,t2_l8f4o,False,False,"&gt;Which is irrelevant

80 Million votes aren't irrelevant. But then again using your interpretation of ""democracy"" and ""democratic"" maybe it is. This is the problem we have with Plutocrat propaganda. The absolute degradation of the meaning of words.

&gt;No one has ever governed the country with just 30% of the vote.

The tories have for the last 12 years. Even less when they had to beguile the LibDems into a partnership government.

&gt;that doesn't make FPTP undemocratic

Democracy is supposed to mean:

&gt;a system of government by the whole population or all the eligible members of a state, typically through elected representatives.

How is ruling against 70% of the voting population democratic ?

&gt;No they don't.

Ok maybe not always military threats as in the case in Suez but the Americans usually threaten sanctions and other such activities that should not happen in an actual alliance. The relationship between America and its ""allies"" is never one of equality. As I outlined above, they expect their ""allies"" to aid their military aggression in Iraq or Vietnam and then they don't rush to our aid when we get invaded. And you defend that as an alliance?",b6f35490b5bb61cd09689071a7a0f318b8bed3df,True,False,,,,,0,1649945492,,0,{},i4park5,False,t3_u2oojz,False,True,t1_i4p5u05,/r/CredibleDefense/comments/u2oojz/ukraine_conflict_megathread_april_13_2022/i4park5/,1649945508,1,False,True,False,CredibleDefense,t5_2y5ib,r/CredibleDefense,public,,0,[],,1649916692.0,
[],False,,kmmontandon,,,[],,,,text,t2_am8zb,False,True,"&gt; Sunk vs so heavily damaged the crew had to abandon ship and it was towed back to port really makes no difference.

The *Bonhomme Richard* is a good recent example of a modern warship being written off due to a fire.  The *Moskva* is much older, probably suffered worse damage (BR didn't have munitions exploding), and even in the best of times the Russians are worse at ... well ... pretty much everything to do with building and repairing warships.",095ec43885c9b029d44e267103a1ee51d5c60fad,True,False,,,,,0,1649945111,,0,{},i4p9xdx,False,t3_u3fvip,False,True,t1_i4oym2n,/r/CredibleDefense/comments/u3fvip/ukraine_conflict_megathread_april_14_2022/i4p9xdx/,1649945129,1,False,True,False,CredibleDefense,t5_2y5ib,r/CredibleDefense,public,,0,[],,1649916311.0,
[],False,,Skeptical0ptimist,,,[],,,,text,t2_150m2g,False,False,"Airport capture by Russian ground troops came later.  You missed what happened the first few days. 

The initial capture by airborne troops was a failure as paratroopers were overrun by Ukrainians. Russian POWs were used in Ukrainian tweets.",1737863116c28a3ac2acb85c9ddf98e56147ea91,True,False,,,,,0,1649945044,,0,{},i4p9rql,False,t3_u1em2j,False,True,t1_i4n1eub,/r/CredibleDefense/comments/u1em2j/leadership_lessons_from_the_past_operation_market/i4p9rql/,1649945061,1,False,True,False,CredibleDefense,t5_2y5ib,r/CredibleDefense,public,,0,[],,1649916244.0,
[],False,,No_name_Johnson,,,[],,,,text,t2_4c8o0,False,False,Don't the Russians already have nukes in Kaliningrad?,874f64e3b056648b1ef39cf7b37edb5eb85848b9,True,False,,,,,0,1649944931,,0,{},i4p9i5i,False,t3_u3fvip,False,True,t1_i4p31ii,/r/CredibleDefense/comments/u3fvip/ukraine_conflict_megathread_april_14_2022/i4p9i5i/,1649944947,1,False,True,False,CredibleDefense,t5_2y5ib,r/CredibleDefense,public,,0,[],,1649916131.0,
[],False,,kmmontandon,,,[],,,,text,t2_am8zb,False,True,It's aimed at the domestic American right-wing audience.,56d389a0ed1a0b96cc7edc0f41e510cba9074b55,True,False,,,,,0,1649944898,,0,{},i4p9fbt,False,t3_u3fvip,False,True,t1_i4p7ilk,/r/CredibleDefense/comments/u3fvip/ukraine_conflict_megathread_april_14_2022/i4p9fbt/,1649944909,1,False,True,False,CredibleDefense,t5_2y5ib,r/CredibleDefense,public,,0,[],,1649916098.0,
[],False,,TheYetiCaptain1993,,,[],,,,text,t2_8im1p,False,False,"The Pentagon says it’s still floating, for what it’s worth",ba0687b3086e67f61e236644c32900ed9df88b71,True,False,,,,,0,1649944797,,0,{},i4p96q4,False,t3_u3fvip,False,True,t1_i4p8rla,/r/CredibleDefense/comments/u3fvip/ukraine_conflict_megathread_april_14_2022/i4p96q4/,1649944814,1,False,True,False,CredibleDefense,t5_2y5ib,r/CredibleDefense,public,,0,[],,1649915997.0,
[],False,,No_name_Johnson,,,[],,,,text,t2_4c8o0,False,False,"I don't think it's an overt 'oh shit, we gotta sell more javelins' sort of thing. But it definitely bolsters western tech's image on the global stage. I think the Western response is predominantly geopolitical - partially with regards to Russia/NATO/Europe, and partially posturing with regards to China/Taiwan.",41d54536ec5a9cf71f34adc7122c9f89818568a6,True,False,,,,,0,1649944794,,0,{},i4p96f5,False,t3_u3fvip,False,True,t1_i4p8ayi,/r/CredibleDefense/comments/u3fvip/ukraine_conflict_megathread_april_14_2022/i4p96f5/,1649944807,1,False,True,False,CredibleDefense,t5_2y5ib,r/CredibleDefense,public,,0,[],,1649915994.0,
[],False,,Antique_Result2325,,,[],,,,text,t2_940py60c,False,False,"I think it can be both.

Morale boost to Ukrainians (our troops are equipped with superior cool arms!), boost to supplying countries (we are helping, making a meaningful difference and being recognized for it) and the actual companies / military benefit from testing, info/data and advertisement potential",37930b91b2f4cb21e193ce72bf65ef0e42c9a9a3,True,False,,,,,0,1649944762,,0,{},i4p93sm,False,t3_u3fvip,False,True,t1_i4p8ayi,/r/CredibleDefense/comments/u3fvip/ukraine_conflict_megathread_april_14_2022/i4p93sm/,1649944777,1,False,True,False,CredibleDefense,t5_2y5ib,r/CredibleDefense,public,,0,[],,1649915962.0,
[],False,,RafterrMan,,,[],,,,text,t2_3mpaic5j,False,False,It’s quite difficult to upload video from your phone in the middle of the sea…..,210b2fa9a6e15f8a5934e63bbb3c870df1a46e02,True,False,,,,,0,1649944670,,0,{},i4p8vzk,False,t3_u3fvip,False,True,t1_i4owxeh,/r/CredibleDefense/comments/u3fvip/ukraine_conflict_megathread_april_14_2022/i4p8vzk/,1649944686,1,False,True,False,CredibleDefense,t5_2y5ib,r/CredibleDefense,public,,0,[],,1649915870.0,
[],False,,hatesranged,,,[],,,,text,t2_3svjqav4,False,False,"If it’s actually above water, images both from satellites and in port are guaranteed.  If a week from now it’s still a ghost, then I think we can make conclusions.",658aafc685025fcda75ae90998661d0d99c6e671,True,False,,,,,0,1649944617,,0,{},i4p8rla,False,t3_u3fvip,False,True,t1_i4p8b02,/r/CredibleDefense/comments/u3fvip/ukraine_conflict_megathread_april_14_2022/i4p8rla/,1649944631,1,False,True,False,CredibleDefense,t5_2y5ib,r/CredibleDefense,public,,0,[],,1649915817.0,
[],False,,itschaboy___,,,[],,,,text,t2_f8brn,False,False,you know what other group has a weird infatuation with Soros conspiracies...,cc3aa6b2b5818885bf214264f8b543623bfcf8ef,True,False,,,,,0,1649944596,,0,{},i4p8pxs,False,t3_u3fvip,False,True,t1_i4p7ilk,/r/CredibleDefense/comments/u3fvip/ukraine_conflict_megathread_april_14_2022/i4p8pxs/,1649944608,1,False,True,False,CredibleDefense,t5_2y5ib,r/CredibleDefense,public,,0,[],,1649915796.0,
[],False,,Zaptrip2,,,[],,,,text,t2_14u01k,False,False,"I really don’t but the current Russian MOD line that everything on the Moskva is under control. If it as they say and there was only a minor fire, surely they would put out a picture of their glorious flagship still sailing? Even if she is floating, the ship must be in such a condition that they believe it’s not worth showing.",339d21d2cd9f1f8ce8b159d148c7580a72358259,True,False,,,,,0,1649944419,,0,{},i4p8b02,False,t3_u3fvip,False,True,t3_u3fvip,/r/CredibleDefense/comments/u3fvip/ukraine_conflict_megathread_april_14_2022/i4p8b02/,1649944430,1,False,True,False,CredibleDefense,t5_2y5ib,r/CredibleDefense,public,,0,[],,1649915619.0,
[],False,,TheYetiCaptain1993,,,[],,,,text,t2_8im1p,False,False,"The cynical part of me thinks it’s advertising for export customers. Similarly, western weapons manufacturers are probably thrilled with this war because of all the contracts they are now getting, and also that their primary competitors out of Russia are going to be knocked out of the export market for years to come",411e87b6ad2514a329b31286d122cd526fa3b217,True,False,,,,,0,1649944418,,0,{},i4p8ayi,False,t3_u3fvip,False,True,t1_i4p7uet,/r/CredibleDefense/comments/u3fvip/ukraine_conflict_megathread_april_14_2022/i4p8ayi/,1649944430,1,False,True,False,CredibleDefense,t5_2y5ib,r/CredibleDefense,public,,0,[],,1649915618.0,
[],False,,red_keshik,,,[],,,,text,t2_8umof,False,False,What right would the nation have to keep him ?,e37dccd12d736abeb38e07432ea9e6679dcfe1de,True,False,,,,,0,1649944391,,0,{},i4p88o5,False,t3_u3fvip,False,True,t1_i4ozm21,/r/CredibleDefense/comments/u3fvip/ukraine_conflict_megathread_april_14_2022/i4p88o5/,1649944406,1,False,False,False,CredibleDefense,t5_2y5ib,r/CredibleDefense,public,,0,[],,1649915591.0,
[],False,,schvepssy,,,[],,,,text,t2_4aq14q,False,False,"Isn't it kind of a feeble response? It virtually changes nothing except for the part where strengthening air defenses on the border with Finland could somewhat hamper a highly unlikely NATO's air invasion on Russia from that vector. This reaction starkly contrasts with the whole narrative of their current invasion being a self-defense move against existential threat of NATO expansion.      
                          
If this is the maximum level of Russia's retaliation, it either means they have never felt really threatened by NATO forces being closer to their borders and it was all about expansion of their sphere of influence or that they are currently toothless. Probably both.",ff6fdba833a612c68054f1096f1b1d59fb329480,True,False,,,,,0,1649944239,,0,{},i4p7w1c,False,t3_u3fvip,False,True,t1_i4p31ii,/r/CredibleDefense/comments/u3fvip/ukraine_conflict_megathread_april_14_2022/i4p7w1c/,1649944254,1,False,True,False,CredibleDefense,t5_2y5ib,r/CredibleDefense,public,,0,[],,1649915439.0,
[],False,,Antique_Result2325,,,[],,,,text,t2_940py60c,False,False,"I wonder if the effectiveness and perhaps more importantly release of footage displaying the effectiveness of US/UK/Turkey/etc. supplied equipment has been a significant factor in increasing support and aid, in the same way that equipment being destroyed or captured would be negative",1192d87f2d018398bb89d74314fb4089a37c2599,True,False,,,,,0,1649944220,,0,{},i4p7uet,False,t3_u3fvip,False,True,t3_u3fvip,/r/CredibleDefense/comments/u3fvip/ukraine_conflict_megathread_april_14_2022/i4p7uet/,1649944232,1,False,True,False,CredibleDefense,t5_2y5ib,r/CredibleDefense,public,,0,[],,1649915420.0,
[],False,,geyges,,,[],,,,text,t2_g2qb1,False,False,lolwtf they got Hunter Biden and George Soros in the slides. Did they hire Alex Jones to put together this report or what?,cb39a6b08bad3b103d485518cef6797f6f25a2a4,True,False,,,,,0,1649944078,,0,{},i4p7ilk,False,t3_u3fvip,False,True,t1_i4p55op,/r/CredibleDefense/comments/u3fvip/ukraine_conflict_megathread_april_14_2022/i4p7ilk/,1649944093,1,False,True,False,CredibleDefense,t5_2y5ib,r/CredibleDefense,public,,0,[],,1649915278.0,
[],False,,Antique_Result2325,,,[],,,,text,t2_940py60c,False,False,"There's a general thing in Russia to simply deny everything Ukraine says first.

This sounds irrational, but remember the key point is to get anyone taking the Russian line to not listen nor trust Ukraine at all, i general.

The benefits are marginal, and your Black Sea flagship being hit is embarrassing either way, but the worst case would be people starting to see that Ukraine is telling the truth here (as in, Russia confirms what they are saying) and they look for other things Ukraine has talked about

Also, bad for Russia regardless, but less good for Ukraine specifically",de076944f1d6559405ca99acc7baf33290e3962a,True,False,,,,,0,1649943950,,0,{},i4p7801,False,t3_u3fvip,False,True,t1_i4p3l4f,/r/CredibleDefense/comments/u3fvip/ukraine_conflict_megathread_april_14_2022/i4p7801/,1649943964,1,False,True,False,CredibleDefense,t5_2y5ib,r/CredibleDefense,public,,0,[],,1649915150.0,
[],False,,Praet0rianGuard,,,[],,,,text,t2_v2wgk,False,False,"Russia attacks Ukraine

Ukraine attacks Russia 

Russia: “wait that’s illegal.”",ec48f689944e8e6430255946b7bb71a560857e28,True,False,,,,,0,1649943714,,0,{},i4p6omb,False,t3_u3fvip,False,True,t1_i4p2y6s,/r/CredibleDefense/comments/u3fvip/ukraine_conflict_megathread_april_14_2022/i4p6omb/,1649943728,1,False,True,False,CredibleDefense,t5_2y5ib,r/CredibleDefense,public,,0,[],,1649914914.0,
[],False,,hatesranged,,,[],,,,text,t2_3svjqav4,False,False,The bullshit cannon is the one Russian munition that never cooks off,d77e3a953b21c593ca4f25f467cee752fffdf978,True,False,,,,,0,1649943685,,0,{},i4p6ma7,False,t3_u3fvip,False,True,t1_i4p6ekj,/r/CredibleDefense/comments/u3fvip/ukraine_conflict_megathread_april_14_2022/i4p6ma7/,1649943700,1,False,True,False,CredibleDefense,t5_2y5ib,r/CredibleDefense,public,,0,[],,1649914885.0,
[],False,,Praet0rianGuard,,,[],,,,text,t2_v2wgk,False,False,Is t that the Nazi propaganda way? Tell a lie enough times and people will start believing it.,1ab913d0040d48e0e2bf429f5983d99da325c8c0,True,False,,,,,0,1649943592,,0,{},i4p6ekj,False,t3_u3fvip,False,True,t1_i4p63uh,/r/CredibleDefense/comments/u3fvip/ukraine_conflict_megathread_april_14_2022/i4p6ekj/,1649943605,1,False,True,False,CredibleDefense,t5_2y5ib,r/CredibleDefense,public,,0,[],,1649914792.0,
