all_awardings,archived,associated_award,author,author_flair_background_color,author_flair_css_class,author_flair_richtext,author_flair_template_id,author_flair_text,author_flair_text_color,author_flair_type,author_fullname,author_patreon_flair,author_premium,body,body_sha1,can_gild,collapsed,collapsed_because_crowd_control,collapsed_reason,collapsed_reason_code,comment_type,controversiality,created_utc,distinguished,gilded,gildings,id,is_submitter,link_id,locked,no_follow,parent_id,permalink,retrieved_utc,score,score_hidden,send_replies,stickied,subreddit,subreddit_id,subreddit_name_prefixed,subreddit_type,top_awarded_type,total_awards_received,treatment_tags,unrepliable_reason,created,author_cakeday
[],False,,xqzc,,,[],,,,text,t2_3jb4v61y,False,False,"I'm sure that when Putin decides that he's done with the war, he's going to tout the land bridge or clay gains in the east as the greatest trophy ever, but from the perspective of the Russian state they have gained precisely nothing (and I'm not even talking about the balance with losses).

&gt;They've consolidated even more control of media/freedoms domestically

What people in the West generally don't understand is that _everything_ domestically was already consolidated as far as possible on Feb 23rd. Navalny imprisoned, the institute of ""foreign agents"" allowing to imprison/cancel whoever you want, oligarchs impotent, elites filtered ideologically, propaganda dominance complete. Sure, now they've banned Facebook or Meduza, but this could've just as easily be done without the war. Any war protests have been habitually and costlessly repressed by the state.

&gt;They've established land bridge to Crimea

They've already had the Kerch bridge to Crimea. Sure, this improves the logistics somewhat, but this really does not change much for Crimean populace. The fresh water thing is a non-issue.

&gt;They've expanded territory in Donbas

True, and this territory has already had all its economic potential destroyed by the 8 years of war, all its productive populace having fled. The land gains in the East are just a money sink for the state.",d2926d9d3a85fced47aef9cb9104b5e69763453c,True,False,,,,,0,1649967133,,0,{},i4qtitt,False,t3_u3fvip,False,True,t1_i4phcw8,/r/CredibleDefense/comments/u3fvip/ukraine_conflict_megathread_april_14_2022/i4qtitt/,1649967151,1,False,True,False,CredibleDefense,t5_2y5ib,r/CredibleDefense,public,,0,[],,1649938333.0,
[],False,,greyvagabond,,,[],,,,text,t2_37du06ij,False,False,"Honestly, might be better for Russian resources to be drained dealing with the burning husk rather than just letting is sink to the bottom of the ocean, but bloody hell, *sinking* the flagship is huge PR win.",42245b47e798a8d1926809e08725f3017f377a94,True,False,,,,,0,1649967053,,0,{},i4qtbsg,False,t3_u3fvip,False,True,t1_i4qrrgk,/r/CredibleDefense/comments/u3fvip/ukraine_conflict_megathread_april_14_2022/i4qtbsg/,1649967067,1,False,True,False,CredibleDefense,t5_2y5ib,r/CredibleDefense,public,,0,[],,1649938253.0,
[],False,,dkdaniel,,,[],,,,text,t2_6ddud,False,False,Going down in history - largest warship sunk since WW2 I believe. Can't believe they pulled it off.,974ddcc9576e5036672565e9c5288728c2f5baa2,True,False,,,,,0,1649966971,,0,{},i4qt4g2,False,t3_u3fvip,False,True,t1_i4qrrgk,/r/CredibleDefense/comments/u3fvip/ukraine_conflict_megathread_april_14_2022/i4qt4g2/,1649966985,1,False,True,False,CredibleDefense,t5_2y5ib,r/CredibleDefense,public,,0,[],,1649938171.0,
[],False,,[deleted],,,,,,dark,,,,,[deleted],228f7d207920fb84335fac5b2b06ed7b472ece9e,True,True,,,DELETED,,0,1649966935,,0,{},i4qt16n,False,t3_u3fvip,False,True,t3_u3fvip,/r/CredibleDefense/comments/u3fvip/ukraine_conflict_megathread_april_14_2022/i4qt16n/,1649966947,1,False,True,False,CredibleDefense,t5_2y5ib,r/CredibleDefense,public,,0,[],,1649938135.0,
[],False,,Lejeune_Dirichelet,,,[],,,,text,t2_jok2d,False,False,The ocean is still a very vast place and carriers can move at decent speed.,fd143f2a824e3d5f0553a4094295986f54b78e90,True,False,,,,,0,1649966924,,0,{},i4qt09f,False,t3_u3fvip,False,True,t1_i4qgbhi,/r/CredibleDefense/comments/u3fvip/ukraine_conflict_megathread_april_14_2022/i4qt09f/,1649966940,1,False,True,False,CredibleDefense,t5_2y5ib,r/CredibleDefense,public,,0,[],,1649938124.0,
[],False,,TheFlawlessCassandra,,,[],,,,text,t2_9bch6dlg,False,False,What a coup for Ukraine.,2d3dd127fa1dd24ffbcb365c3c6865493ddbe9f6,True,False,,,,,0,1649966816,,0,{},i4qsqn6,False,t3_u3fvip,False,True,t1_i4qrrgk,/r/CredibleDefense/comments/u3fvip/ukraine_conflict_megathread_april_14_2022/i4qsqn6/,1649966828,1,False,True,False,CredibleDefense,t5_2y5ib,r/CredibleDefense,public,,0,[],,1649938016.0,
[],False,,uno_01,,,[],,,,text,t2_gdrr3,False,False,glorious Moskva departs for mission to denazify bottom of Black Sea,cb5286041826ac48272b1ede5bf7d1bfe42ddd2c,True,False,,,,,0,1649966716,,0,{},i4qshpj,False,t3_u3fvip,False,True,t1_i4qrrgk,/r/CredibleDefense/comments/u3fvip/ukraine_conflict_megathread_april_14_2022/i4qshpj/,1649966729,1,False,True,False,CredibleDefense,t5_2y5ib,r/CredibleDefense,public,,0,[],,1649937916.0,
[],False,,MWittman88,,,[],,,,text,t2_i0pxha7h,False,False,Holy fucking shit.,afbf435ef82febb4d3f0d4f1663ae66fb977b5d4,True,False,,,,,0,1649966681,,0,{},i4qsehl,False,t3_u3fvip,False,True,t1_i4qsbzx,/r/CredibleDefense/comments/u3fvip/ukraine_conflict_megathread_april_14_2022/i4qsehl/,1649966700,1,False,True,False,CredibleDefense,t5_2y5ib,r/CredibleDefense,public,,0,[],,1649937881.0,
[],False,,Ok_Pomelo7511,,,[],,,,text,t2_aa2el1ra,False,False,"&gt;That means that any time there is visible moisture in the air and the ground temperature is about 45F or less, they can't operate

How did Azeris manage to operate their TB2s in NK conflict? It was in high-altitude mid-late autumn. Pretty sure it was colder than that and TB2s were flying throughout that war.",32419498eb4edba350767ad8c2e0db6c04996f13,True,False,,,,,0,1649966674,,0,{},i4qsdw4,False,t3_u3fvip,False,True,t1_i4qrf6q,/r/CredibleDefense/comments/u3fvip/ukraine_conflict_megathread_april_14_2022/i4qsdw4/,1649966691,1,False,True,False,CredibleDefense,t5_2y5ib,r/CredibleDefense,public,,0,[],,1649937874.0,
[],False,,iGilles,,,[],,,,text,t2_7m7ru,False,False,"Yes, Intel Slava Z confirms. RIA Novosti too. Russian MoD announced it.",14c1ad294e6f20a74380b54467eb2263e2551feb,True,False,,,,,0,1649966653,,0,{},i4qsbzx,False,t3_u3fvip,False,True,t1_i4qrrgk,/r/CredibleDefense/comments/u3fvip/ukraine_conflict_megathread_april_14_2022/i4qsbzx/,1649966669,1,False,True,False,CredibleDefense,t5_2y5ib,r/CredibleDefense,public,,0,[],,1649937853.0,
[],False,,bleepblopbloopy,,,[],,,,text,t2_4lu6l,False,True,"**German chancellor ‘stalling on heavy weaponry to Ukraine’**
Coalition partners accuse Olaf Scholz of failing to live up to promises as major Russian offensive looms

https://www.theguardian.com/world/2022/apr/14/german-chancellor-stalling-heavy-weaponry-ukraine-coalition-olaf-scholz-russia-offensive

&gt; But Scholz’s critics say he is deliberately allowing bureaucratic hurdles to slow down a decision on weapons exports in an effort to pacify those within his party who are still holding out for a diplomatic settlement with the Kremlin.",f875d0f6b3304ef2b515eff73dd8aeefbfc77368,True,False,,,,,0,1649966618,,0,{},i4qs8wi,False,t3_u3fvip,False,False,t3_u3fvip,/r/CredibleDefense/comments/u3fvip/ukraine_conflict_megathread_april_14_2022/i4qs8wi/,1649966632,1,False,True,False,CredibleDefense,t5_2y5ib,r/CredibleDefense,public,,0,[],,1649937818.0,
[],False,,IntroductionNeat2746,,,[],,,,text,t2_5bv0y43u,False,False,"&gt;I have great hope for it, but do not expect to see fusion power my light bulb during my life.

I would have agreed to that a couple years ago. Now it honestly feels like if that is true, it means it going to be dead within the next 30 years, which I hope not.",5c1f6c73936851b6529451c01cdb42e05a63e97f,True,False,,,,,0,1649966595,,0,{},i4qs6sr,False,t3_u3fvip,False,True,t1_i4qnwzp,/r/CredibleDefense/comments/u3fvip/ukraine_conflict_megathread_april_14_2022/i4qs6sr/,1649966610,1,False,True,False,CredibleDefense,t5_2y5ib,r/CredibleDefense,public,,0,[],,1649937795.0,
[],False,,RobotWantsKitty,,,[],,,,text,t2_dg31a,False,False,I haven't seen a single remotely credible source corroborating that something happened to him.,19279452f7aceed5ea9e23027900848f0b8d1206,True,False,,,,,0,1649966565,,0,{},i4qs45b,False,t3_u3fvip,False,True,t1_i4qaag2,/r/CredibleDefense/comments/u3fvip/ukraine_conflict_megathread_april_14_2022/i4qs45b/,1649966580,1,False,True,False,CredibleDefense,t5_2y5ib,r/CredibleDefense,public,,0,[],,1649937765.0,
[],False,,pixus_ru,,,[],,,,text,t2_76mfk,False,False,"My point is that on a couter-attack UA forces will be met with Javelins/NLAWS, so MRAPs won’t protect bodies inside.",1f6777329d74120f58f2db3990f0ec1b82e74553,True,False,,,,,0,1649966435,,0,{},i4qrsht,False,t3_u163bl,False,True,t1_i4keppn,/r/CredibleDefense/comments/u163bl/ukraine_conflict_megathread_april_11_2022/i4qrsht/,1649966452,1,False,True,False,CredibleDefense,t5_2y5ib,r/CredibleDefense,public,,0,[],,1649937635.0,
[],False,,MWittman88,,,[],,,,text,t2_i0pxha7h,False,False,"https://twitter.com/charles_lister/status/1514693881111236609?s=21&amp;t=X_BFUck-wWnCnXYUBbUX_A

&gt; It's sunk!

&gt; #Russia state media just acknowledged the #Moskva sank earlier today.

Accurate?",9ad404f0f9fdb66da88f38c87f5709a4fc60fc8f,True,False,,,,,0,1649966424,,0,{},i4qrrgk,False,t3_u3fvip,False,True,t3_u3fvip,/r/CredibleDefense/comments/u3fvip/ukraine_conflict_megathread_april_14_2022/i4qrrgk/,1649966437,1,False,True,False,CredibleDefense,t5_2y5ib,r/CredibleDefense,public,,0,[],,1649937624.0,
[],False,,NotKumar,,,[],,,,text,t2_3nlhr,False,False,I'm genuinely curious and speaking from a position of ignorance - specifically what did Stalin do to worsen Russian deaths during ww2?,4668e4fd5fd07c55bcf0a9e4b14ad39c595d0d79,True,False,,,,,0,1649966416,,0,{},i4qrqnr,False,t3_u3fvip,False,False,t1_i4q5g6q,/r/CredibleDefense/comments/u3fvip/ukraine_conflict_megathread_april_14_2022/i4qrqnr/,1649966429,1,False,True,False,CredibleDefense,t5_2y5ib,r/CredibleDefense,public,,0,[],,1649937616.0,
[],False,,sponsoredcommenter,,,[],,,,text,t2_fk13v2vo,False,False,"I think it's named after Neptune the god of the sea, not Neptune the planet.",0e472813ebb7a80de9ec296e820cac85f36993f7,True,False,,,,,0,1649966365,,0,{},i4qrm59,False,t3_u3fvip,False,True,t1_i4qfzo8,/r/CredibleDefense/comments/u3fvip/ukraine_conflict_megathread_april_14_2022/i4qrm59/,1649966383,1,False,True,False,CredibleDefense,t5_2y5ib,r/CredibleDefense,public,,0,[],,1649937565.0,
[],False,,OhSillyDays,,,[],,,,text,t2_h1c0qtwi,False,False,"I think an interesting aspect of this war is it shows the value of Western weapons. 

Russian weapons and their derivatives have been being used all over the world as cheaper alternatives to western weapons. Especially in the third world.

Well, it turns out that you get what you pay for. And we're seeing that first hand. 

The T72 tank (and derivatives) are cheap because they sort of forget important things. Like crew survivability or electronic warfare equipment or high quality optics. The same can be said for the warships and aircraft. They save money on the frontend when the weapons are bought, and sometimes having the tanks can help the buyers bluff their shitty hand. But sometimes you have to show your hand... and Russia is in that predicament right now. Russia has been bluffing their hand so long, they believe their shitty hand reflects the bluff. 

As expensive as other weapons are, it has really come clear that they are worth their money in this conflict. 

Another great example is the TB2 compared to the Reapers and the Predators. The TB2 is a smaller and cheaper UAV compared to the Reapers and Predators. You'd think that this makes them better because you can buy ~2-4 TB2s for the cost of one predator. Why in the world would anybody want a predator??? Well, that's the kicker right there. The TB2 is cheaper for a reason. Let me explain.

The Predators have multiple weapon systems they can use that have all-weather capability. That means that the predator can drop bombs (JDAMs) through clouds. The TB2, as far as I can tell, is all line of sight. So if there is a cloudy day, it is basically out of action. Surprise surprise, Ukraine can be quite cloudy. If your enemy knows that, they can always make sure to be well hidden during clear days. 

Additionally, as far as I can tell, the TB2 has no deicing equipment. That means that any time there is visible moisture in the air and the ground temperature is about 45F or less, they can't operate (unless they want to risk losing the UAV). Which pretty much eliminates flying any winter day with clouds, which turns out to be pretty common in Ukraine. Predators have deicing equipment. So they can basically fly whenever they want. 

Those two things make a huge case for why the predator would be considered worth 2-4x more than a TB2. And we're seeing it play out. I'm 90% sure that the 40 mile Kyiv convoy was able to operate free of concern from the TB2 after the first 1-2 days, when the weather got crappy. For about 2 weeks. That gave the Russians breathing room to mount an offensive. Luckily, it seems like the Ukraine ground forces are what saved Kyiv. 

And we didn't even start to talk about ATGMs and Manpads...",2c316a6b3569b3fcf4649eb10213cb3cadd100fc,True,False,,,,,0,1649966285,,0,{},i4qrf6q,False,t3_u3fvip,False,True,t3_u3fvip,/r/CredibleDefense/comments/u3fvip/ukraine_conflict_megathread_april_14_2022/i4qrf6q/,1649966302,1,False,True,False,CredibleDefense,t5_2y5ib,r/CredibleDefense,public,,0,[],,1649937485.0,
[],False,,Wowzlul,,,[],,,,text,t2_ekafly7s,False,False,"Or be part of any hierarchy really, particularly in a large group.",155aac0aac3e1e4638d08ed5da074742337b4064,True,False,,,,,0,1649966232,,0,{},i4qranr,False,t3_u3fvip,False,True,t1_i4q5320,/r/CredibleDefense/comments/u3fvip/ukraine_conflict_megathread_april_14_2022/i4qranr/,1649966249,1,False,True,False,CredibleDefense,t5_2y5ib,r/CredibleDefense,public,,0,[],,1649937432.0,
[],False,,bergerwfries,,,[],,,,text,t2_9n97g,False,False,"For sure. 

But if the world is coalescing into blocs where you mostly trade with allies for important stuff - the West in general is certainly best equipped to handle that",5cfe5f10bacbd0710a5f653e89c2a3d8cae9786f,True,False,,,,,0,1649966170,,0,{},i4qr59m,False,t3_tym4w0,False,True,t1_i4o2ciz,/r/CredibleDefense/comments/tym4w0/weaponisation_of_finance_how_the_west_unleashed/i4qr59m/,1649966188,1,False,True,False,CredibleDefense,t5_2y5ib,r/CredibleDefense,public,,0,[],,1649937370.0,
[],False,,DiligentInterview,,,[],,,,text,t2_1wdvg1lg,False,False,"Ah, I was answering somewhat *tongue in cheek.*

As a bit of a thought to the answers from the west, I give you this. When world war two ended, some British Officers said ""Thank god that's over, now we can get back to proper soldiering.""

However, just because they mobilized every man and woman, does not mean that standards can slip, that rules can be broken.  The force of the DS Solution is strong. 

You have to remember, a lot of us are ***spoiled***. Spoiled by years of small expeditionary armies, of 9 months of basic training for an infantryman, plus 7-12 months of high readiness training before a deployment. Where you need a course to run a chainsaw, or drive a van. Where we have legions of staff officers, doctrine, simulation, directing staff. Where it takes 10 years to make a section commander, 20 years of experience as a platoon warrant officer. Or the road to high readiness is measured in years. 

That's how our system works in the west. That's what 75 years has done. The idea of just giving out equipment, willy-nilly does not go well. You must be trained, certified, and use said equipment correctly in accordance with doctrine, in the correct amounts. Otherwise it's not to be used at all. Why would we do that, too many sacred cows many die otherwise.",ce24e513559fe91f21253fbfcddcd746a31ab7d1,True,False,,,,,0,1649966109,,0,{},i4qqzzz,False,t3_u2oojz,False,True,t1_i4pilg9,/r/CredibleDefense/comments/u2oojz/ukraine_conflict_megathread_april_13_2022/i4qqzzz/,1649966127,1,False,True,False,CredibleDefense,t5_2y5ib,r/CredibleDefense,public,,0,[],,1649937309.0,
[],False,,thesaddestpanda,,,[],,,,text,t2_58ojx,False,True,Right wing popularism is global and use the same anti semitic tropes and Emmanuel Goldsteins. Mocking soros works in Texas and France and Hungary and in London.,d044f92d2c45a51ee7da3806b4d696a9bc110cfe,True,False,,,,,0,1649965969,,0,{},i4qqnc3,False,t3_u3fvip,False,True,t1_i4p9fbt,/r/CredibleDefense/comments/u3fvip/ukraine_conflict_megathread_april_14_2022/i4qqnc3/,1649965984,1,False,False,False,CredibleDefense,t5_2y5ib,r/CredibleDefense,public,,0,[],,1649937169.0,
[],False,,aieeegrunt,,,[],,,,text,t2_6xvv1dhp,False,False,"I can’t imagine they are in very good shape

Whatever they have assaulting Mariopul for example won’t be good for much else afterwards",03ee5337fdc0f53ea425a68da8ff7646c0a90dec,True,False,,,,,0,1649965629,,0,{},i4qprqz,False,t3_u3fvip,False,True,t1_i4qdrbw,/r/CredibleDefense/comments/u3fvip/ukraine_conflict_megathread_april_14_2022/i4qprqz/,1649965643,1,False,True,False,CredibleDefense,t5_2y5ib,r/CredibleDefense,public,,0,[],,1649936829.0,
[],False,,xqzc,,,[],,,,text,t2_3jb4v61y,False,False,"1. Chemical weapons are not a magical ""use it and a city is yours"" silver bullet. Mass-wise they are strictly inferior to high-explosives aside from a few select scenarios. UA forces in Odessa most definitely have access to at least some protection, which will make chemical weapons even less effective. Read a primer here: https://acoup.blog/2020/03/20/collections-why-dont-we-use-chemical-weapons-anymore/. The _only_ way for Russia to ""take"" Odessa is nukes, but then taking Odessa is irrelevant.

2. Russia could mobilise (and there are RU hardliners like Strelkov who have been begging for that since the beginning of the war. Tbh it's getting kinda pitiful), but either it has to take months to ramp up logistics (which Russia might simply be unable to do) and train the conscripts, or the mobilisation is worse than useless, it is actively harmful. In the latter scenario you have to spend resources to get these clueless conscripts to the front, keep them fed and coherent, keep them from deserting, and then without training they cannot provide any military benefit aside from discovering ambushes and unmasking artillery (we've already seen this with DNR/LNR conscripts, where a full mobilization has been in force since February). This is not WW2, where you can give a million people rifles, point them in a direction and call it a day. Ukrainians are not going to run out of bullets, artillery shells and western intelligence to counter that.",df96d99ce075f10c3f8fda26ee90a88f6f93ce5d,True,False,,,,,0,1649965612,,0,{},i4qpq74,False,t3_u3fvip,False,True,t1_i4pjuey,/r/CredibleDefense/comments/u3fvip/ukraine_conflict_megathread_april_14_2022/i4qpq74/,1649965628,1,False,True,False,CredibleDefense,t5_2y5ib,r/CredibleDefense,public,,0,[],,1649936812.0,
[],False,,[deleted],,,,,,dark,,,,,[removed],fe993932d6dced4c0a879e9aa5d7a6e0fbb467f5,True,True,,,DELETED,,0,1649965521,,0,{},i4qphul,False,t3_u3fvip,False,True,t1_i4qe1yo,/r/CredibleDefense/comments/u3fvip/ukraine_conflict_megathread_april_14_2022/i4qphul/,1649965538,1,False,True,False,CredibleDefense,t5_2y5ib,r/CredibleDefense,public,,0,[],,1649936721.0,
[],False,,evo_help93,,,[],,,,text,t2_iul8dbh4,False,False,"Yes and the Marshall Plan cost the US roughly 2% of *total US GDP.* Obviously this was money well-spent, but the post-war Ukrainian political and economic landscape is going to be an extraordinarily difficult challenge. You have:

1. Nascent political institutions surviving an existential conflict. Even established democracies have a *ton* of difficulty maintaining civil institutions and civic norms through a war and in the aftermath. Look at the utter dysfunction that was French politics throughout the 1950s and 1960s (although to be fair, French politics is always a little messy). Ukraine has a strong civic society, but politically speaking it's been extremely tenuous since 2016 onward and now you can add a huge supply of advanced weaponry to the mix. This is liable to cause some serious instability. 
2. Huge dearth of human capital. How many Ukrainians have fled the country? Many will return, but some will not. Pre-war Ukraine was not a rich country and human capital is a key element in post-war reconstruction and stability. 
3. Continued Russian interference. Whether Ukraine pushes Russian troops to Feb 23 lines or further, or exists as a Western aligned rump state (unlikely) you can guarantee that the Russians will continue to interfere in Ukrainian political and economic life. 
4. Corruption. Ukraine still suffers from relatively high levels of corruption (thankfully not in the armed forces it appears), which is only going to further make reconstruction efforts difficult. Corruption also creates negative feedback loops into civil society wherein corrupt players amass political power via their corruption networks. Injecting large amounts of cash into this system is going to create knock-on effects with much destabilization. 
5. Continued political will in the EU and USA to fund Ukraine. This one I am less concerned about, but we are entering a period of inflation, soaring asset prices, continued supply chain disruption, and a rapidly dwindling chance of a post-Covid boom. It's easy to imagine a series of political crises that cause the USA and EU to turn inwards as a Ukraine rebuilding program will not be done in a few years but more likely a decade. 

I don't say these things to discourage a Ukrainian financial assistance program. I would just like us to all be aware that this is going to be a long-run affair with challenges and difficulties every step of the way. Ukraine is not post-war Western Europe. It is likely to continue to face civil difficulties, corruption, fractious politics, and interference from outside powers. All of these make rebuilding efforts slower, more challenging, and more difficult to overcome. We should be prepared to support Ukraine for the long-haul.",7988f4c3115b25c5f568c5ac31127aba38b4e154,True,False,,,,,0,1649965455,,0,{},i4qpbnr,False,t3_u3fvip,False,True,t1_i4q1noq,/r/CredibleDefense/comments/u3fvip/ukraine_conflict_megathread_april_14_2022/i4qpbnr/,1649965473,1,False,True,False,CredibleDefense,t5_2y5ib,r/CredibleDefense,public,,0,[],,1649936655.0,
[],False,,[deleted],,,,,,dark,,,,,[removed],fe993932d6dced4c0a879e9aa5d7a6e0fbb467f5,True,True,,,DELETED,,0,1649965425,,0,{},i4qp8v1,False,t3_u3fvip,False,True,t1_i4qeb6y,/r/CredibleDefense/comments/u3fvip/ukraine_conflict_megathread_april_14_2022/i4qp8v1/,1649965442,1,False,True,False,CredibleDefense,t5_2y5ib,r/CredibleDefense,public,,0,[],,1649936625.0,
[],False,,BiAsALongHorse,,,[],,,,text,t2_k0qzi,False,False,Playing up the ambiguity when it comes to your own intelligence is almost always a positive.,6bbc62abf24ddbc8e5c2068d97e4a21087c4ef9b,True,False,,,,,0,1649965416,,0,{},i4qp7xt,False,t3_u3fvip,False,True,t1_i4qgbjx,/r/CredibleDefense/comments/u3fvip/ukraine_conflict_megathread_april_14_2022/i4qp7xt/,1649965435,1,False,True,False,CredibleDefense,t5_2y5ib,r/CredibleDefense,public,,0,[],,1649936616.0,
[],False,,Lejeune_Dirichelet,,,[],,,,text,t2_jok2d,False,False,"Many will absolutely return. Ukraine cannot afford to behave like the African and Middle Eastern countries and refuse to take their citizens back, or pretend they don't know who these people are.",58a39ebe06354e2e7b70ad353a58d639d1409b53,True,False,,,,,0,1649965371,,0,{},i4qp3tq,False,t3_u3fvip,False,True,t1_i4plas9,/r/CredibleDefense/comments/u3fvip/ukraine_conflict_megathread_april_14_2022/i4qp3tq/,1649965389,1,False,True,False,CredibleDefense,t5_2y5ib,r/CredibleDefense,public,,0,[],,1649936571.0,
[],False,,jambox888,,,[],,,,text,t2_4e6sn,False,False,Joke military smh,268348b36a787fc28cc8a29ccdafa7bfad38b3af,True,False,,,,,0,1649965197,,0,{},i4qonpj,False,t3_u2oojz,False,True,t1_i4q6h2s,/r/CredibleDefense/comments/u2oojz/ukraine_conflict_megathread_april_13_2022/i4qonpj/,1649965216,1,False,True,False,CredibleDefense,t5_2y5ib,r/CredibleDefense,public,,0,[],,1649936397.0,
[],False,,gringobill,,,[],,,,text,t2_4d60y,False,False,https://www.thebulwark.com/i-commanded-u-s-army-europe-heres-what-i-saw-in-the-russian-and-ukrainian-armies/,f98aedbe833d26d0cea85f849e38dd241b602446,True,False,,,,,0,1649965022,,0,{},i4qo7lq,False,t3_u3fvip,False,True,t1_i4qnppq,/r/CredibleDefense/comments/u3fvip/ukraine_conflict_megathread_april_14_2022/i4qo7lq/,1649965035,1,False,True,False,CredibleDefense,t5_2y5ib,r/CredibleDefense,public,,0,[],,1649936222.0,
[],False,,thesaddestpanda,,,[],,,,text,t2_58ojx,False,True,Russians are dumb.  They can see western standards.  They don’t need Ukraine to showcase them too. They support Putin because they agree with his anti lgbtq politics and expansionist agendas.,49a4cbf114c87283358a4983371c452b3e4b0f0a,True,False,,,,,0,1649965007,,0,{},i4qo65e,False,t3_u3fvip,False,True,t1_i4qgx0x,/r/CredibleDefense/comments/u3fvip/ukraine_conflict_megathread_april_14_2022/i4qo65e/,1649965021,1,False,False,False,CredibleDefense,t5_2y5ib,r/CredibleDefense,public,,0,[],,1649936207.0,
