Unnamed: 0,all_awardings,archived,associated_award,author,author_flair_background_color,author_flair_css_class,author_flair_richtext,author_flair_template_id,author_flair_text,author_flair_text_color,author_flair_type,author_fullname,author_patreon_flair,author_premium,body,body_sha1,can_gild,collapsed,collapsed_because_crowd_control,collapsed_reason,collapsed_reason_code,comment_type,controversiality,created_utc,distinguished,gilded,gildings,id,is_submitter,link_id,locked,no_follow,parent_id,permalink,retrieved_utc,score,score_hidden,send_replies,stickied,subreddit,subreddit_id,subreddit_name_prefixed,subreddit_type,top_awarded_type,total_awards_received,treatment_tags,unrepliable_reason,created,author_cakeday,edited,editable,media_metadata
,[],False,,TheHun-78,,,[],,,,text,t2_dx0b5wmn,False,False,This is terrible.Stay strong people.,c658ccbe4d09adcb1aa8c77f859f9373485351d8,True,False,,,,,0,1647129446,,0,{},i0fjw4j,False,t3_tcu50x,False,True,t3_tcu50x,/r/UkraineInvasionVideos/comments/tcu50x/mass_graves_are_now_common_across_ukraine_russia/i0fjw4j/,1647129458,1,False,True,False,UkraineInvasionVideos,t5_5wkihl,r/UkraineInvasionVideos,public,,0,[],,1647100646.0,,,,
,[],False,,GreasyWog4020,,,[],,,,text,t2_8tmys3v5,False,False,gangsta,edebe4475eca9849d90e677e09172d9895653359,True,False,,,,,0,1647129106,,0,{},i0fj6gg,False,t3_tcsdx9,False,True,t3_tcsdx9,/r/UkraineInvasionVideos/comments/tcsdx9/welcome_to_hell/i0fj6gg/,1647129122,1,False,True,False,UkraineInvasionVideos,t5_5wkihl,r/UkraineInvasionVideos,public,,0,[],,1647100306.0,,,,
,[],False,,GreasyWog4020,,,[],,,,text,t2_8tmys3v5,False,False,snake,148627088915c721ccebb4c611b859031037e6ad,True,False,,,,,0,1647129047,,0,{},i0fj1xy,False,t3_tcnhfc,False,True,t3_tcnhfc,/r/UkraineInvasionVideos/comments/tcnhfc/galina_danilchenko_a_local_deputy_of_melitopol/i0fj1xy/,1647129062,1,False,True,False,UkraineInvasionVideos,t5_5wkihl,r/UkraineInvasionVideos,public,,0,[],,1647100247.0,,,,
,[],False,,Plus_Box_7363,,,[],,,,text,t2_k6om60lt,False,False,dont get cold feet,809a54e642963553831829e78528dbb9efaa0488,True,False,,,,,0,1647128906,,0,{},i0fir22,False,t3_tcd0w5,False,True,t3_tcd0w5,/r/UkraineInvasionVideos/comments/tcd0w5/as_a_finn_im_talking_very_briefly_many_topics/i0fir22/,1647128922,1,False,True,False,UkraineInvasionVideos,t5_5wkihl,r/UkraineInvasionVideos,public,,0,[],,1647100106.0,,,,
,[],False,,dukenukem9272,,,[],,,,text,t2_662hogzo,False,False,"gorgeous lady, i hope she makes it out of the war unscathed(also for all ukrainian army)",18a88e302610bb3309313330ca1bf5235d9f71e2,True,False,,,,,0,1647128903,,0,{},i0fiqtx,False,t3_tbuvrn,False,True,t3_tbuvrn,/r/UkraineInvasionVideos/comments/tbuvrn/ukrainian_soldier_says_they_will_defend_kyiv/i0fiqtx/,1647128915,1,False,True,False,UkraineInvasionVideos,t5_5wkihl,r/UkraineInvasionVideos,public,,0,[],,1647100103.0,,,,
,[],False,,ImprovementBetter154,,,[],,,,text,t2_2ckt9lvx,False,False,🤷‍♂️,a6e679cd8e29800d7c4e9ad06bc52cdc3f9b09e9,True,False,,,,,0,1647128811,,0,{},i0fik12,True,t3_tcpt2j,False,True,t1_i0fhz7f,/r/UkraineInvasionVideos/comments/tcpt2j/russian_tactics_havent_chainged_since_wwii/i0fik12/,1647128828,1,False,True,False,UkraineInvasionVideos,t5_5wkihl,r/UkraineInvasionVideos,public,,0,[],,1647100011.0,,,,
,[],False,,TheHashishCook,,,[],,,,text,t2_dxqiu,False,False,"You say that because this is a far away conflict that only exists to you on the Internet and the TV. 

Imagine if enemy soldiers had already taken your state capital. Imagine your cute mini American shepherd had died in an artillery strike on your house while you were away.

Pretty sure you wouldn’t show such restraint then.",9b96e6e0dc9fd8b60b6ae7ee8636ac186e92456a,True,False,,,,,0,1647128633,,0,{},i0fi6jq,False,t3_tch2z2,False,True,t1_i0ewgpy,/r/UkraineInvasionVideos/comments/tch2z2/road_signs_in_kyiv/i0fi6jq/,1647128644,1,False,True,False,UkraineInvasionVideos,t5_5wkihl,r/UkraineInvasionVideos,public,,0,[],,1647099833.0,,,,
,[],False,,Nissanleaf11,,,[],,,,text,t2_4ssfdb12,False,False,If anything they probably will,c1edf1b5b37f1fb0af16f38f6433187d4a0280d2,True,False,,,,,0,1647128621,,0,{},i0fi5l0,False,t3_tc30or,False,True,t1_i0doxvl,/r/UkraineInvasionVideos/comments/tc30or/no_fly_zone_please/i0fi5l0/,1647128637,1,False,True,False,UkraineInvasionVideos,t5_5wkihl,r/UkraineInvasionVideos,public,,0,[],,1647099821.0,,,,
,[],False,,TerpeneProfile,,,[],,,,text,t2_1t8hnanw,False,False,I mean they did win ww2 in the end.,b8d50fc32bd9ced70e11635cdf9cde3c91affcd5,True,False,,,,,0,1647128536,,0,{},i0fhz7f,False,t3_tcpt2j,False,True,t3_tcpt2j,/r/UkraineInvasionVideos/comments/tcpt2j/russian_tactics_havent_chainged_since_wwii/i0fhz7f/,1647128549,1,False,True,False,UkraineInvasionVideos,t5_5wkihl,r/UkraineInvasionVideos,public,,0,[],,1647099736.0,,,,
,[],False,,Plus_Box_7363,,,[],,,,text,t2_k6om60lt,False,False,i stil l cant beleive these armies dont use run flat tyres yet,21ce7677b72b211e9bc792442ad91b282f331011,True,False,,,,,0,1647128474,,0,{},i0fhug6,False,t3_t1s5g2,False,True,t3_t1s5g2,/r/UkraineInvasionVideos/comments/t1s5g2/more_videos_of_russian_soldiers_being_captured/i0fhug6/,1647128490,1,False,True,False,UkraineInvasionVideos,t5_5wkihl,r/UkraineInvasionVideos,public,,0,[],,1647099674.0,,,,
,[],False,,RockViolinist,,,[],,,,text,t2_xfxej,False,False,Women fight less and have less and create less fatalities. men fight more and have more and create more fatalities. Which one does the wise person choose? No need to discuss further it is obvious for every intelligent person!,7ff48d5a0b69a8f6810f6ccd47bed3b268c26ab9,True,False,,,,,0,1647128463,,0,{},i0fhtoa,True,t3_tcrsmo,False,True,t1_i0ffby3,/r/UkraineInvasionVideos/comments/tcrsmo/pavel_ignatyev_plays_on_kyiv_rooftop_talented_and/i0fhtoa/,1647128476,1,False,True,False,UkraineInvasionVideos,t5_5wkihl,r/UkraineInvasionVideos,public,,0,[],,1647099663.0,,,,
,[],False,,Gravvy255,,,[],,,,text,t2_a3j2usdi,False,False,BS,16374ac2b9a2eb53d18fcede0cdf14c4d6e18ba5,True,False,,,,,0,1647128376,,0,{},i0fhn67,False,t3_tcpt2j,False,True,t3_tcpt2j,/r/UkraineInvasionVideos/comments/tcpt2j/russian_tactics_havent_chainged_since_wwii/i0fhn67/,1647128388,1,False,True,False,UkraineInvasionVideos,t5_5wkihl,r/UkraineInvasionVideos,public,,0,[],,1647099576.0,,,,
,[],False,,Creepy-Algae-4148,,,[],,,,text,t2_3ljxavsc,False,False,Sweden did. The factory is in UK but it's a swedish weapon.,d413369c3d1468831e63bdb68ffd06169c3c6d1b,True,False,,,,,0,1647128365,,0,{},i0fhmb9,False,t3_tcsdx9,False,True,t1_i0ff6xb,/r/UkraineInvasionVideos/comments/tcsdx9/welcome_to_hell/i0fhmb9/,1647128380,1,False,True,False,UkraineInvasionVideos,t5_5wkihl,r/UkraineInvasionVideos,public,,0,[],,1647099565.0,,,,
,[],False,,RockViolinist,,,[],,,,text,t2_xfxej,False,False,"Well, women create less fatalities and fight less. Men create more fatalities and fight more. Which behaviour is better? I don't think we have to discuss this, it's obvious!",48003fc20b2db45552aeee365d0207776732b442,True,False,,,,,0,1647128322,,0,{},i0fhj13,True,t3_tcrsmo,False,True,t1_i0f9tms,/r/UkraineInvasionVideos/comments/tcrsmo/pavel_ignatyev_plays_on_kyiv_rooftop_talented_and/i0fhj13/,1647128336,1,False,True,False,UkraineInvasionVideos,t5_5wkihl,r/UkraineInvasionVideos,public,,0,[],,1647099522.0,,,,
,[],False,,[deleted],,,,,,dark,,,,,[deleted],228f7d207920fb84335fac5b2b06ed7b472ece9e,True,False,,,,,0,1647128300,,0,{},i0fhhe9,False,t3_tckgz5,False,True,t3_tckgz5,/r/UkraineInvasionVideos/comments/tckgz5/center_of_kharkov_mironositskaya_street/i0fhhe9/,1647128314,1,False,True,False,UkraineInvasionVideos,t5_5wkihl,r/UkraineInvasionVideos,public,,0,[],,1647099500.0,,,,
,[],False,,TheHashishCook,,,[],,,,text,t2_dxqiu,False,False,"Bro, idk if you’re American, but imagine the Chinese were rolling up in tanks 20 miles from DC, and everyone around you knows someone who died because of them in the last two weeks. Are you seriously going to concern yourself with being portrayed in a  “positive light”?",8c8aa6b6d80274d3990b02d4e4eaa4178b5164d7,True,False,,,,,0,1647128262,,0,{},i0fhekp,False,t3_tch2z2,False,True,t1_i0e2dn7,/r/UkraineInvasionVideos/comments/tch2z2/road_signs_in_kyiv/i0fhekp/,1647128278,1,False,True,False,UkraineInvasionVideos,t5_5wkihl,r/UkraineInvasionVideos,public,,0,[],,1647099462.0,,,,
,[],False,,Plus_Box_7363,,,[],,,,text,t2_k6om60lt,False,False,static electricity,5d160662c36fe13d77c1ddc52cc6bafb02fdb69f,True,False,,,,,0,1647128232,,0,{},i0fhce3,False,t3_tavisz,False,True,t1_i05vonl,/r/UkraineInvasionVideos/comments/tavisz/brave_russian_aviobomb_deactivation/i0fhce3/,1647128249,1,False,True,False,UkraineInvasionVideos,t5_5wkihl,r/UkraineInvasionVideos,public,,0,[],,1647099432.0,,,,
,[],False,,ETVG,,,[],,,,text,t2_2k4ruitm,False,False,"They are playing a very dangerous play without knowing fooled as they are. What a bunch of genetic waste.

Lucky for them Germany is a very decent country.  Image this the other way around in Moscow.",4b12d65de965ac8ba5d3138e2a4aea223029cb2e,True,False,,,,,0,1647128212,,0,{},i0fhats,False,t3_tcpmjf,False,True,t3_tcpmjf,/r/UkraineInvasionVideos/comments/tcpmjf/russians_that_came_to_germany_protested_against/i0fhats/,1647128227,1,False,True,False,UkraineInvasionVideos,t5_5wkihl,r/UkraineInvasionVideos,public,,0,[],,1647099412.0,,,,
,[],False,,austinf0727,,,[],,,,text,t2_invvv2pv,False,False,I saw the same picture in another thread and he was covered in snow still chained up,438557849e0b80229f9f2c76f4ae13b687751ccb,True,False,,,,,0,1647128205,,0,{},i0fhaau,False,t3_tcpt2j,False,True,t1_i0f8qf0,/r/UkraineInvasionVideos/comments/tcpt2j/russian_tactics_havent_chainged_since_wwii/i0fhaau/,1647128220,1,False,True,False,UkraineInvasionVideos,t5_5wkihl,r/UkraineInvasionVideos,public,,0,[],,1647099405.0,,,,
,[],False,,Chimeravx,,,[],,,,text,t2_k5cri3fi,False,False,u/savevideo,70a0f94b1709054e8c936673e18a6bab7d60f29f,True,False,,,,,0,1647128104,,0,{},i0fh2im,False,t3_tcsdx9,False,True,t3_tcsdx9,/r/UkraineInvasionVideos/comments/tcsdx9/welcome_to_hell/i0fh2im/,1647128121,1,False,True,False,UkraineInvasionVideos,t5_5wkihl,r/UkraineInvasionVideos,public,,0,[],,1647099304.0,,,,
,[],False,,ApprehensiveYou7803,,,[],,,,text,t2_4xjvv59u,False,False,Javelins you can reload right,2e9f103f5ce55d985cac42b00f597809ee202587,True,False,,,,,0,1647128023,,0,{},i0fgwcp,False,t3_tcsdx9,False,True,t1_i0fgik3,/r/UkraineInvasionVideos/comments/tcsdx9/welcome_to_hell/i0fgwcp/,1647128039,1,False,True,False,UkraineInvasionVideos,t5_5wkihl,r/UkraineInvasionVideos,public,,0,[],,1647099223.0,,,,
,[],False,,watcherofworld,,,[],,,,text,t2_k44a2qg0,False,False,Putin is looking to establish a new global order alongside China. And it's getting wrecked in every conceivable way,1994121b69a288801c12e4ff8f6eddda43085f28,True,False,,,,,0,1647128022,,0,{},i0fgw9k,False,t3_tctrsx,False,True,t3_tctrsx,/r/UkraineInvasionVideos/comments/tctrsx/russian_invasion/i0fgw9k/,1647128039,1,False,True,False,UkraineInvasionVideos,t5_5wkihl,r/UkraineInvasionVideos,public,,0,[],,1647099222.0,,,,
,[],False,,CADrunkie,,,[],,,,text,t2_aqlivnlq,False,False,Truth,c8edbb5b8d23220cbd8268fc3241e045136d0667,True,False,,,,,0,1647127975,,0,{},i0fgstc,False,t3_tctrsx,False,True,t3_tctrsx,/r/UkraineInvasionVideos/comments/tctrsx/russian_invasion/i0fgstc/,1647127987,1,False,True,False,UkraineInvasionVideos,t5_5wkihl,r/UkraineInvasionVideos,public,,0,[],,1647099175.0,,,,
,[],False,,Dredd005,,,[],,,,text,t2_75rh3sax,False,True,Step 1: Shoot the tank. Step 2: Drop the NLAW and run Step 3: Get another NLAW,9532ce2b296ab99a2c6b8d4783735cb90ae2d366,True,False,,,,,0,1647127934,,0,{},i0fgpod,True,t3_tcsdx9,False,True,t1_i0fg74d,/r/UkraineInvasionVideos/comments/tcsdx9/welcome_to_hell/i0fgpod/,1647127949,1,False,True,False,UkraineInvasionVideos,t5_5wkihl,r/UkraineInvasionVideos,public,,0,[],,1647099134.0,,,,
,[],False,,ETVG,,,[],,,,text,t2_2k4ruitm,False,False,"They are fighting Ukrainians because they're made up Nazis.

Please have some Ukrainians send these guys home.",2c109d465084e240d9cee718946d2b4f5ae3ec8b,True,False,,,,,0,1647127908,,0,{},i0fgnkx,False,t3_tcqv41,False,True,t3_tcqv41,/r/UkraineInvasionVideos/comments/tcqv41/russian_troops_go_pro_combat_footage_in_ukraine/i0fgnkx/,1647127919,1,False,True,False,UkraineInvasionVideos,t5_5wkihl,r/UkraineInvasionVideos,public,,0,[],,1647099108.0,,,,
,[],False,,Chimeravx,,,[],,,,text,t2_k5cri3fi,False,False,Only technology beats attrition. Those NLAWs are forcing Russia to rewrite their armoured warfare doctrine.,242da843ebf15f5fa2d2c5178b711a979f4311e3,True,False,,,,,0,1647127880,,0,{},i0fglib,False,t3_tcsdx9,False,False,t3_tcsdx9,/r/UkraineInvasionVideos/comments/tcsdx9/welcome_to_hell/i0fglib/,1647127897,1,False,True,False,UkraineInvasionVideos,t5_5wkihl,r/UkraineInvasionVideos,public,,0,[],,1647099080.0,,,,
,[],False,,NineKnot,,,[],,,,text,t2_1ko02qq,False,False,One shot and done.,a2c6adf0e8545288e358844081e5030710d5e7e5,True,False,,,,,0,1647127840,,0,{},i0fgik3,False,t3_tcsdx9,False,True,t1_i0fg74d,/r/UkraineInvasionVideos/comments/tcsdx9/welcome_to_hell/i0fgik3/,1647127854,1,False,True,False,UkraineInvasionVideos,t5_5wkihl,r/UkraineInvasionVideos,public,,0,[],,1647099040.0,,,,
,[],False,,ETVG,,,[],,,,text,t2_2k4ruitm,False,False,"As if that will work out well.

I wonder how far China will let this go.

Perhaps they will use it to take Taiwan or think it's not worth it.

A world where nukes are flying having Taiwan or a world without nukes flying without Taiwan. Those people are also totally not waiting to be conquered by China because China feels entitled and want it.",613fd4eba2f161949701ec092e242401689a39b7,True,False,,,,,0,1647127707,,0,{},i0fg8k9,False,t3_tcrg02,False,True,t3_tcrg02,/r/UkraineInvasionVideos/comments/tcrg02/russia_threatens_to_strike_us_if_it_transfers/i0fg8k9/,1647127718,1,False,True,False,UkraineInvasionVideos,t5_5wkihl,r/UkraineInvasionVideos,public,,0,[],,1647098907.0,,,,
,[],False,,ApprehensiveYou7803,,,[],,,,text,t2_4xjvv59u,False,False,Can you reload those are they pretty much disposable after one round,cd49ad430a5fb2f703cc0324bd22d8784d96338d,True,False,,,,,0,1647127688,,0,{},i0fg74d,False,t3_tcsdx9,False,True,t3_tcsdx9,/r/UkraineInvasionVideos/comments/tcsdx9/welcome_to_hell/i0fg74d/,1647127703,1,False,True,False,UkraineInvasionVideos,t5_5wkihl,r/UkraineInvasionVideos,public,,0,[],,1647098888.0,,,,
,[],False,,manueltava,,,[],,,,text,t2_k49haqbs,False,False,There are always collaborators in all the wars. What a sad role this woman is making.,85fc24215852af3dcdcde84589fa9a5518258351,True,False,,,,,0,1647127553,,0,{},i0ffwqe,False,t3_tcnhfc,False,True,t3_tcnhfc,/r/UkraineInvasionVideos/comments/tcnhfc/galina_danilchenko_a_local_deputy_of_melitopol/i0ffwqe/,1647127569,1,False,True,False,UkraineInvasionVideos,t5_5wkihl,r/UkraineInvasionVideos,public,,0,[],,1647098753.0,,,,
,[],False,,Jealous_Tangerine_93,,,[],,,,text,t2_e6bb6agg,False,False,"I saw this earlier. 
The amount of respect shown by his fellow Ukrainian citizens was immense and made me cry.
It is tragic seeing a decent life lost, needlessly. 
But wonderful seeing the unity of loss shown. 
RIP 🌺",cb01f9cd4ef337feb39bd5230ee9cd009ad84e3e,True,False,,,,,0,1647127528,,0,{},i0ffuus,False,t3_tct374,False,True,t3_tct374,/r/UkraineInvasionVideos/comments/tct374/a_fallen_war_hero_coming_home_to_his_last_rest/i0ffuus/,1647127539,1,False,True,False,UkraineInvasionVideos,t5_5wkihl,r/UkraineInvasionVideos,public,,0,[],,1647098728.0,,,,
,[],False,,RatnikTampons,,,[],,,,text,t2_kn3gnegm,False,False,lol,403926033d001b5279df37cbbe5287b7c7c267fa,True,False,,,,,0,1647127526,,0,{},i0ffuqt,False,t3_tch2z2,False,True,t3_tch2z2,/r/UkraineInvasionVideos/comments/tch2z2/road_signs_in_kyiv/i0ffuqt/,1647127539,1,False,True,False,UkraineInvasionVideos,t5_5wkihl,r/UkraineInvasionVideos,public,,0,[],,1647098726.0,,,,
,[],False,,DopestSophist,,,[],,,,text,t2_9erv9jmi,False,False,"What a pussy. No dirt on his uniform or body. Probably not even in Ukraine if he’s walking around in the open and in front like this. If he is, Wali’s got his next easy target",3810c63b7a725ae47e0535d1f2fd3613454f70e3,True,False,,,,,0,1647127506,,0,{},i0fft7r,False,t3_tct8xx,False,True,t3_tct8xx,/r/UkraineInvasionVideos/comments/tct8xx/chechen_army_on_the_ground_in_ukraine_led_by/i0fft7r/,1647127523,1,False,True,False,UkraineInvasionVideos,t5_5wkihl,r/UkraineInvasionVideos,public,,0,[],,1647098706.0,,,,
,[],False,,Slow-Economist-810,,,[],,,,text,t2_a235fa1f,False,False,😂😂😂😂😂😂😂😂😂👏👏👏👏👏👏,13d9ab7032a2d8c6d8e780e1b591d2aadb9d3fb7,True,False,,,,,0,1647127333,,0,{},i0ffgg0,False,t3_tcelh2,False,True,t3_tcelh2,/r/UkraineInvasionVideos/comments/tcelh2/russian_influencer_crying_due_to_instagram_shut/i0ffgg0/,1647127345,1,False,True,False,UkraineInvasionVideos,t5_5wkihl,r/UkraineInvasionVideos,public,,0,[],,1647098533.0,,,,
,[],False,,ImprovementBetter154,,,[],,,,text,t2_2ckt9lvx,False,False,"Very good analysis. This is why things like this should be posted, so that we can get an influx of well thought out opinions.",0b3644d6541429c3011a5bb76a53b939b757c6ae,True,False,,,,,0,1647127326,,0,{},i0fffxd,True,t3_tcpt2j,False,True,t1_i0ff1iw,/r/UkraineInvasionVideos/comments/tcpt2j/russian_tactics_havent_chainged_since_wwii/i0fffxd/,1647127338,1,False,True,False,UkraineInvasionVideos,t5_5wkihl,r/UkraineInvasionVideos,public,,0,[],,1647098526.0,,,,
,[],False,,Dredd005,,,[],,,,text,t2_75rh3sax,False,True,CIA,d5b519f94ca6097e2af78e390307d395d35ff3ba,True,False,,,,,0,1647127323,,0,{},i0fffo5,True,t3_tcsdx9,False,True,t1_i0ff6xb,/r/UkraineInvasionVideos/comments/tcsdx9/welcome_to_hell/i0fffo5/,1647127338,1,False,True,False,UkraineInvasionVideos,t5_5wkihl,r/UkraineInvasionVideos,public,,0,[],,1647098523.0,,,,
,[],False,,emptybowloffood,,,[],,,,text,t2_c06nv7vd,False,False,Tabasco.,f784e4aa87b5213b88139697748ec8f958ee8f66,True,False,,,,,0,1647127304,,0,{},i0ffe55,False,t3_tco5hd,False,True,t1_i0eggci,/r/UkraineInvasionVideos/comments/tco5hd/air_raid_sounds_at_russian_embassy_ottawa_canada/i0ffe55/,1647127314,1,False,True,False,UkraineInvasionVideos,t5_5wkihl,r/UkraineInvasionVideos,public,,0,[],,1647098504.0,,,,
,[],False,,AncientMasterpiece72,,,[],,,,text,t2_h9a3tcip,False,False,"So every Ukrainian should stop fighting for their country and play piano on the roof instead?
Worst quote i ever heard",72ee56804fb03aba76c8593557fd531f2372300c,True,False,,,,,0,1647127275,,0,{},i0ffby3,False,t3_tcrsmo,False,True,t3_tcrsmo,/r/UkraineInvasionVideos/comments/tcrsmo/pavel_ignatyev_plays_on_kyiv_rooftop_talented_and/i0ffby3/,1647127291,1,False,True,False,UkraineInvasionVideos,t5_5wkihl,r/UkraineInvasionVideos,public,,0,[],,1647098475.0,,,,
,[],False,,Locke7768,,,[],,,,text,t2_3veq1bhd,False,False,"  
As a Ukrainian, you forgive Russia the for Holodomor?  
I am going to say bullshit about this post.  
Some of the most glaringly biased, propaganda statements included in this  
contrived post.  
Post -They also guilt trip and blackmail  
Russians with sanctions to overthrow  
their government - in other words get beaten up and locked in jail or  
starve to death.  
Response - Putin invaded a Democratically  
elected sovereign nation that did not provoke Russia at all. Sanctions are  
meant to show Putin that he can no longer be the demented tyrant he believes he  
should be. The sanctions are designed to put internal pressure on Putin to end  
his war. No one is being locked in jail or starving to death. This is a  
delusional overstatement.  
Post - - The rest of the world (mainly the  
West) encourages Ukrainians, ....blah blah blah.  
Response - This clearly indicates that you are  
not Ukrainian. Welcome another freaking Russian Troll pretending to be  
Ukrainian. I have visited Ukraine multiple times in the last 3 years (last time  
in April 2021). Even back then, Ukrainians did not want to be Russian. They  
love their countries and stated to me multiple times that they would fight for  
Ukraine. Also, isn't Russian sending in citizens (conscripts) with about as  
much training as newly recruited Ukrainian citizens?  
You are such a fucking liar here - 'nothing  
would change with Russia in charge'. You do know that all of the occupied areas  
want to rejoin Ukraine because living under Russian rule sucks? I mean you  
cannot be this totally biased to ignore the general hatred of Russian rule in  
Ukraine occupied territories. Man, you are a piece of shit.  
   
Troll statement - 2004 Ukraine election  
Response - You mean the ELECTION THAT RUSSIA  
POISONED THE PRO-WEST CANDIDATE? Oh, you want to talk about that election. Why  
do most of Ukraine not want Russian rule, let's look at the dioxin face of  
Yuchchenko. Freaking moron. Do you really expect people to be so lazy or  
ignorant not to call you on this shit.  
Why Ukraine does not want to be ruled by  
Russians ever again - Your freaking example of the run-off election. Russia  
manipulated the vote. This is not the West's opinion, this is the freaking UN  
opinion. Yanukovych won the south because Russia packed the voting ballets in  
his favor. A UN statistical analysis considered it comparable to every single  
Belarussian election. Every Belarusian election, people wake up Lukashenko with  
the following statement, 'Mr Prime Minister you again received the less amount  
of votes of any candidates, congratulation you won in a landside'.  
OH MY GOD, RUSSIA WAS CAUGHT TRYINIG TO ELECT A  
PRO-RUSSIAN POLITICIAN (SLAVE) AND WAS CAUGHT. That is the result of the 2004  
election.  
Troll Lie - They won't let us speak Russian in  
Ukraine, and this is so wrong.  
Response - I had conversations with high-level  
Ukrainian officials in Russian. You are so full of shit on this statement.  
Almost every single Ukrainian speaks both Ukrainian and Russian. Try again. I  
gave a lecture at KPI, and I did it in Russian. So, the most liberal,  
Pro-Ukrainian university in Ukraine allowed an American Professor to give a  
talk in Russian with no problem. It was the same talk I gave in St. Petersburg  
a month later. WATCH YOUR STEP FOR TROLL BULLSHIT HERE.  
Troll Lie Again - If western-backed (and also  
unconstitutional) Ukrainian government  
wasn't so overbearing, this whole situation wouldn't happen in the first  
place  
Response - Zelensky won a democratic election  
fairly. Everyone, even RUSSIA, acknowledged that Zelensky won. WHAT TROLL LIES  
ARE THEY MAKING YOU STATE HERE TO STAY ALIVE? Overbearing, sure buddy. Zelensky  
did nothing and begged Russia not to attack. That is overbearing.  
   
Troll Lie - Sanctions don't help us in any way...blah blah blah  
Response - Sanctions have cut the value of the  
ruble in half. That is a major burn. Russia is part of the global economy, it  
is having a terrible effect right now. Second, everyone grabbed Putin's and the  
oligarchs' foreign assets.  
NO ONE IS GOING TO RUSSIA AS REFUGEES. Russia  
has recorded 150 Ukrainian refugees to the UN. You are right that 3 million  
Ukrainians live in Russia, but they are now leaving Russia in droves.  
Your Conclusions-  
Troll first statements - Propaganda straight  
from the FSB/GRU.  
Response - The loss of both Russian and  
Ukrainian lives rests on a single person, Putin. The Russians do not want this  
war. The Ukrainians do not want this war. Your statement is that there would  
have been no war if Ukraine had just become the joke of Belarus. Prior to 2014,  
most oblasts were autonomous. There has always been a Kyiv versus Odesa rift in  
the government. In 2021, the Kyiv people hated Stepanov as the Minister of  
Health. It was funny to receive emails from the two sanctions. The rest of your  
crap is just crap.  
If Ukrainians wanted to tear down the symbols  
of their oppressors and the organizers of the Holodomor, that is their freaking  
choice. If parts of Ukraine wanted to keep the relics, that was their choice.  
In 2018, I went to Donbas, and there was plenty of Lenin statues all over the  
place (not Stalin, but does Russia has Stalin statues anymore?).  
If Ukrainians wanted to tear down the symbols  
of their oppressors and the organizers of the Holodomor, that is their freaking  
choice. If parts of Ukraine wanted to keep the relics, that was their choice.  
In 2018, I went to Donbas, and there were plenty of Lenin statues all over the  
place (not Stalin, but does Russia has Stalin statues anymore?).  
   
Last Russian Troll Statement -Again, in my  
opinion people's lives and property are more important than flag or a line on  
the map. That's why I'm angry at west for making  
prolonged conflict possible.  
Response - If this is true, then why the hell  
did Russia invade. Oh snap, your logic is illogical if you make it apply to  
Putin's rage. Why does the Russian flag need to fly over Kyiv? I mean it is  
only a flag or a line on a map. The west did not invade. The west tried to get  
Russia not to invade. If Ukrainians (unlike your fake nationality statement)  
want to protect their nation against Putin's new iron curtain, that is their  
rights.  
   
 ",c329d81b411dbff145bb3969908356f7051b6d88,True,False,,,,,0,1647127207,,0,{},i0ff6wf,False,t3_tcqojj,False,True,t3_tcqojj,/r/UkraineInvasionVideos/comments/tcqojj/the_other_side_of_ukraine/i0ff6wf/,1647127224,1,False,True,False,UkraineInvasionVideos,t5_5wkihl,r/UkraineInvasionVideos,public,,0,[],,1647098407.0,,,,
,[],False,,everwonderedhow,,,[],,,,text,t2_26rsm4b4,False,False,"Damn, who sent this?",dfd1e9755247d8c8d5b5cea8fcf746f4dd83b9d1,True,False,,,,,0,1647127207,,0,{},i0ff6xb,False,t3_tcsdx9,False,True,t3_tcsdx9,/r/UkraineInvasionVideos/comments/tcsdx9/welcome_to_hell/i0ff6xb/,1647127224,1,False,True,False,UkraineInvasionVideos,t5_5wkihl,r/UkraineInvasionVideos,public,,0,[],,1647098407.0,,,,
