all_awardings,archived,associated_award,author,author_flair_background_color,author_flair_css_class,author_flair_richtext,author_flair_template_id,author_flair_text,author_flair_text_color,author_flair_type,author_fullname,author_patreon_flair,author_premium,body,body_sha1,can_gild,collapsed,collapsed_because_crowd_control,collapsed_reason,collapsed_reason_code,comment_type,controversiality,created_utc,distinguished,gilded,gildings,id,is_submitter,link_id,locked,no_follow,parent_id,permalink,retrieved_utc,score,score_hidden,send_replies,stickied,subreddit,subreddit_id,subreddit_name_prefixed,subreddit_type,top_awarded_type,total_awards_received,treatment_tags,unrepliable_reason,created
[],False,,Successful-Ad3507,,,[],,,,text,t2_6dt0v0aj,False,False,These are people who misinform,df00cb8f70077266341c123bbdc0f9ce52f0dc51,True,False,,,,,0,1651217631,,0,{},i6n1ln8,False,t3_udrjmi,False,True,t1_i6m3a2d,/r/UkraineConflict/comments/udrjmi/brief_summary_of_russian_propaganda_world_war_iii/i6n1ln8/,1651217644,1,True,True,False,UkraineConflict,t5_30oyx,r/UkraineConflict,public,,0,[],,1651188831.0
[],False,,KataqNarayan,,,[],,,,text,t2_qu2cb,False,False,Interesting. I suppose a nuclear deterrent isn’t worth much when you are dealing with an enemy that’s too stupid to be able to understand it.,26b46ba9a7155e3edb6759a3ca7b981b3db9d194,True,False,,,,,0,1651217614,,0,{},i6n1kwh,False,t3_ue41gw,False,True,t1_i6n1dcv,/r/UkraineConflict/comments/ue41gw/russian_tv_keeps_threatening_nuclear_strikes/i6n1kwh/,1651217631,1,True,True,False,UkraineConflict,t5_30oyx,r/UkraineConflict,public,,0,[],,1651188814.0
[],False,,Kieran_Mc,,,[],,,,text,t2_rjtki,False,False,"They very much seemed to think that striking us fast and first would prevent retaliation? London in 202 seconds? Cool. Not where our nuclear deterrent is.


Also those missiles aren't ready until autumn and they're trying to get them made while their economy collapses, they can't import anything to aid in production and a massive brain drain happens.


202 seconds sounds a bit closer to 4 months-never.",f63869026edb4d6f528b9718893a1255ac40e66d,True,False,,,,,0,1651217434,,0,{},i6n1dcv,False,t3_ue41gw,False,True,t1_i6lc0af,/r/UkraineConflict/comments/ue41gw/russian_tv_keeps_threatening_nuclear_strikes/i6n1dcv/,1651217446,1,True,True,False,UkraineConflict,t5_30oyx,r/UkraineConflict,public,,0,[],,1651188634.0
[],False,,Baldrs_Draumar,,,[],,,,text,t2_21o3rae5,False,False,why post 2 month old article?,8dd10408da1a747c61a19b2a280761837d73cd40,True,False,,,,,0,1651217004,,0,{},i6n0v5z,False,t3_ueg2hr,False,True,t3_ueg2hr,/r/UkraineConflict/comments/ueg2hr/ukraine_bans_male_citizens_aged_18_to_60_from/i6n0v5z/,1651217020,1,True,True,False,UkraineConflict,t5_30oyx,r/UkraineConflict,public,,0,[],,1651188204.0
[],False,,PositiveStress8888,,,[],,,,text,t2_jqsp2r03,False,False,"an MIA1tank weighs 67 tons

155mm howitzer just shy of 1 

however 200 tones of rifles and ammo to a civilian population trained in basic defense can go a long way.

most likely they are sending more VAMTAC 4x4 armored vehicles, Instalaza C-90 anti-tank grenade launchers like they did bach in march",d0c074909b6e4087ad2a46b2755e5aa21a7a0c42,True,False,,,,,0,1651216722,,0,{},i6n0jbg,False,t3_ue01jv,False,True,t3_ue01jv,/r/UkraineConflict/comments/ue01jv/the_cargo_ship_ysabel_of_the_spanish_navy_arrived/i6n0jbg/,1651216733,1,True,True,False,UkraineConflict,t5_30oyx,r/UkraineConflict,public,,0,[],,1651187922.0
[],False,,i7oldgr3gg,,,[],,,,text,t2_72vl9wo5,False,True,Go ahead drop a nuke give us a reason to wipe the earth of your scum,63ffb46758e5c18080b9042f006ee611b65a0334,True,False,,,,,0,1651216549,,0,{},i6n0c3d,False,t3_ue41gw,False,True,t3_ue41gw,/r/UkraineConflict/comments/ue41gw/russian_tv_keeps_threatening_nuclear_strikes/i6n0c3d/,1651216563,1,True,True,False,UkraineConflict,t5_30oyx,r/UkraineConflict,public,,0,[],,1651187749.0
[],False,,Major_Boot2778,,,[],,,,text,t2_8rl984jv,False,True,"Very old, widely known already.",25d15b3cbfc89bf878048b33436e32cfc88ac82b,True,False,,,,,0,1651215763,,0,{},i6mzebw,False,t3_ueg2hr,False,True,t3_ueg2hr,/r/UkraineConflict/comments/ueg2hr/ukraine_bans_male_citizens_aged_18_to_60_from/i6mzebw/,1651215778,1,True,True,False,UkraineConflict,t5_30oyx,r/UkraineConflict,public,,0,[],,1651186963.0
[],False,,noptamoius,,,[],,,,text,t2_zwh8m,False,False,"Include what, OP? You left us hanging .",276a139efece331aac44949b24028754151f0e0b,True,False,,,,,0,1651215734,,0,{},i6mzd2d,False,t3_ue01jv,False,True,t3_ue01jv,/r/UkraineConflict/comments/ue01jv/the_cargo_ship_ysabel_of_the_spanish_navy_arrived/i6mzd2d/,1651215744,1,True,True,False,UkraineConflict,t5_30oyx,r/UkraineConflict,public,,0,[],,1651186934.0
[],False,,Sharp-Homework-9380,,,[],,,,text,t2_ejwbncwe,False,False,Isn't this old news?,b363d216d1183c2db29aad2648737c1ebcdaefcb,True,False,,,,,0,1651215553,,0,{},i6mz512,False,t3_ueg2hr,False,True,t3_ueg2hr,/r/UkraineConflict/comments/ueg2hr/ukraine_bans_male_citizens_aged_18_to_60_from/i6mz512/,1651215565,1,True,True,False,UkraineConflict,t5_30oyx,r/UkraineConflict,public,,0,[],,1651186753.0
[],False,,wattyka666,,,[],,,,text,t2_ig2xxds,False,False,"Looks more dangerous than Moskwa, thats for sure.",7b2d303976ca891e997a5ca80fed55c962239cb7,True,False,,,,,0,1651214411,,0,{},i6mxp7y,False,t3_ue01jv,False,True,t1_i6m6pdq,/r/UkraineConflict/comments/ue01jv/the_cargo_ship_ysabel_of_the_spanish_navy_arrived/i6mxp7y/,1651214424,1,True,True,False,UkraineConflict,t5_30oyx,r/UkraineConflict,public,,0,[],,1651185611.0
[],False,,Tymofiy2,,,[],,,,text,t2_queijrb,False,False,"King/Prince Volodymyr/Vladimir ruled Kyivian Rus and chose Orthodoxy from Constantinople as the religion to rule his people. In 988 the people of Kyivian-Rus were formally baptized en masse in the Dniepro River by a hishop and priests from Constantinople.

In the 1800's Tsaritsa Catherine the ""not so great"" directed writers to rewrite the History of Moscovia and Russia to falsely include Kyivian-Rus as part of Russian "" history"". Hence St  Prince Vladimir's name is given to many boys in Ukraine and Russia.

Volodymyr is the Ukrainian spelling.

Vlad is short for Vladimir.",513653af6be4cadef49218b8387d4be109cd70e4,True,False,,,,,0,1651214394,,0,{},i6mxogk,False,t3_ue00zu,False,True,t1_i6l5e74,/r/UkraineConflict/comments/ue00zu/president_putin_warns_of_lightningfast/i6mxogk/,1651214411,1,True,True,False,UkraineConflict,t5_30oyx,r/UkraineConflict,public,,0,[],,1651185594.0
[],False,,PlatypusXray,,,[],,,,text,t2_bvf97ly,False,False,"BREAKING: Over the past six hours, hundreds of destroyed T-72 tanks suddenly appeared across fields and streets in the USA and other NATO countries.",9617ac5b545f3f05e7078b3488b2f8caa0a3f923,True,False,,,,,0,1651214364,,0,{},i6mxn2j,False,t3_ue00zu,False,True,t3_ue00zu,/r/UkraineConflict/comments/ue00zu/president_putin_warns_of_lightningfast/i6mxn2j/,1651214378,1,True,True,False,UkraineConflict,t5_30oyx,r/UkraineConflict,public,,0,[],,1651185564.0
[],False,,Mysandwichok,,,[],,,,text,t2_433xsb2e,False,False,"Theres no way they can maintain 5000 nukes, they can't even  keep their APCs in a good state of repair.",6ca588a99e4731f009f628644c67a2d50549821f,True,False,,,,,0,1651214227,,0,{},i6mxgxh,False,t3_ue00zu,False,True,t1_i6mqzmg,/r/UkraineConflict/comments/ue00zu/president_putin_warns_of_lightningfast/i6mxgxh/,1651214239,1,True,True,False,UkraineConflict,t5_30oyx,r/UkraineConflict,public,,0,[],,1651185427.0
[],False,,Void_Ling,,,[],,,,text,t2_3mzmowoh,False,False,"I consider this war as a wake up call for people on religion. If you don't get it, then nobody can help you...",5a2f3589ed05ed9cc9d3ac347cc2165a3b93858b,True,False,,,,,0,1651214049,,0,{},i6mx8m2,False,t3_udrjmi,False,True,t1_i6kdpi3,/r/UkraineConflict/comments/udrjmi/brief_summary_of_russian_propaganda_world_war_iii/i6mx8m2/,1651214065,1,True,True,False,UkraineConflict,t5_30oyx,r/UkraineConflict,public,,0,[],,1651185249.0
[],False,,Successful-Ad3507,,,[],,,,text,t2_6dt0v0aj,False,False,Are you saying that’s all that need it to avoid being mobilized is a tattoo? I hope you are 12,2726b51787f26b7cb6e16b51ac64a6e7026d3b8f,True,False,,,,,0,1651213525,,0,{},i6mwk26,False,t3_tyvwnu,False,True,t1_i40cx1q,/r/UkraineConflict/comments/tyvwnu/captured_russian_soldier_is_literally_a_nazi/i6mwk26/,1651213541,1,True,True,False,UkraineConflict,t5_30oyx,r/UkraineConflict,public,,0,[],,1651184725.0
[],False,,hemroidhammer,,,[],,,,text,t2_a18sqlfh,False,False,I'm skeptical as well. I bet it's pigeon guided,d5598b6254a1e1f8ca0df3cb9ba6fde2a266bf22,True,False,,,,,0,1651213218,,0,{},i6mw5fl,False,t3_ue41gw,False,True,t1_i6mepjx,/r/UkraineConflict/comments/ue41gw/russian_tv_keeps_threatening_nuclear_strikes/i6mw5fl/,1651213233,1,True,True,False,UkraineConflict,t5_30oyx,r/UkraineConflict,public,,0,[],,1651184418.0
[],False,,Coyote-Thick,,,[],,,,text,t2_8651x0mp,False,False,Looks like he’s about to pass out hahahaha,e39a8f08d9eb30acd55c915348a77e3817648aea,True,False,,,,,0,1651213140,,0,{},i6mw1n4,False,t3_ue00zu,False,True,t3_ue00zu,/r/UkraineConflict/comments/ue00zu/president_putin_warns_of_lightningfast/i6mw1n4/,1651213152,1,True,True,False,UkraineConflict,t5_30oyx,r/UkraineConflict,public,,0,[],,1651184340.0
[],False,,kpapenbe,,,[],,,,text,t2_ixf7ljmz,False,False,"In its obviousness I suppose....but...and regardless...Moldova and the rest of the former Eastern Block have been ""put on notice""",fb81dee702c8002b5da28f177538e4effce3059b,True,False,,,,,0,1651212187,,0,{},i6murqg,True,t3_udqqwc,False,True,t1_i6l7h9x,/r/UkraineConflict/comments/udqqwc/but_of_course_this_was_russians_taking_down_their/i6murqg/,1651212201,1,True,True,False,UkraineConflict,t5_30oyx,r/UkraineConflict,public,,0,[],,1651183387.0
[],False,,AlderonTyran,,,[],,,,text,t2_cml4w8s,False,False,"This isn't Chess at all. If we put missiles in Ukraine Russia will escalate just like we were prepared to do in Cuba. If we didn't remove them or God forbid gave the Ukrainians control of them, Ukraine would be nuked. If NATO missiles are detected, the rest of the Arsenal goes. Don't get me wrong the Russo-Ukrainian War would be over in the course of a few hours. But so would WWIII...

Nuclear proliferation with world tensions as they are now is the easiest way to start WWIII. As it is The Russians already think of the war with Ukraine as existential and the presence of NATO troops supporting and even leading operations against the Russians has led several to consider themselves already at war with NATO just without nukes...

For the sake of everyone in America and across Eurasia, don't advocate nuclear proliferation...",ce7cc846f1bc27d5b9cc0e902c16db96466de313,True,False,,,,,0,1651212140,,0,{},i6mupit,False,t3_udtiyb,False,True,t1_i6k8xxv,/r/UkraineConflict/comments/udtiyb/russian_tv_about_possibility_of_nuclear_war/i6mupit/,1651212152,1,True,True,False,UkraineConflict,t5_30oyx,r/UkraineConflict,public,,0,[],,1651183340.0
[],False,,AlderonTyran,,,[],,,,text,t2_cml4w8s,False,False,"We're not talking about a Russian first Strike,  we're talking about Russian Retaliation after NATO Missiles in Ukraine hit Moscow or St. Petersburg. The resulting nuclear strike would be demanded just like we would demand a launch if New York or DC was hit. The response wouldn't be a ""oh yes we will win"" strike it'll be a ""They're going down with us"" strike. Basically MAD will come to its conclusion. Tensions are so high right now it wouldn't matter who actually hit who, missiles would fly and while Russia would surely be destroyed, so would America. If you think the Russians wouldn't launch for whatever reason I'll point out that we are aware that several Russian silos are designated deadman silos where, if they don't hear from command (because it's been destroyed) they launch, and the Russians have made sure that their silo operations will fire if orders are given. If any Russian city is destroyed then the first missiles will fly, followed by the next wave. 

It doesn't really matter how many SLBMs we have if the Russians can launch regardless or finish launching before they reach their targets.

This is all assuming that the Russian HSCMs are not operational in any nuclear conflict which, *if they have them*, they *will* be used, in which case the Russians would have a First Strike weapon.",07cd214709bc0de7deb4c60559cf25b7bad56141,True,False,,,,,0,1651211602,,0,{},i6mtzeh,False,t3_udtiyb,False,True,t1_i6k5kc8,/r/UkraineConflict/comments/udtiyb/russian_tv_about_possibility_of_nuclear_war/i6mtzeh/,1651211616,1,True,True,False,UkraineConflict,t5_30oyx,r/UkraineConflict,public,,0,[],,1651182802.0
[],False,,ViewInternal3541,,,[],,,,text,t2_7j2fevtb,False,False,But just imagine how fun life will be when we are all in a different world without them 😁,c1d623991226d40ebb2cb2163e5e3fb117e3863d,True,False,,,,,0,1651211587,,0,{},i6mtynx,False,t3_ue41gw,False,True,t1_i6m7l4m,/r/UkraineConflict/comments/ue41gw/russian_tv_keeps_threatening_nuclear_strikes/i6mtynx/,1651211602,1,True,True,False,UkraineConflict,t5_30oyx,r/UkraineConflict,public,,0,[],,1651182787.0
[],False,,Megawoopi,,,[],,,,text,t2_62ggnr9k,False,False,Never knew the US were so charitable.,9226a324b86ca87ee44aa8e08e658a1412ba2c82,True,False,,,,,0,1651211582,,0,{},i6mtyep,False,t3_ue7kkx,False,True,t3_ue7kkx,/r/UkraineConflict/comments/ue7kkx/us_pledges_670_million_in_global_food_assistance/i6mtyep/,1651211595,1,True,True,False,UkraineConflict,t5_30oyx,r/UkraineConflict,public,,0,[],,1651182782.0
[],False,,privatepoeistrash,,,[],,,,text,t2_ckwn6xgk,False,False,At this point I wouldn't be surprised if their nuclear bombs were made from styrofoam like their planes.,043eae71fcb0ddcf4886ecc3b826a60e4a39e991,True,False,,,,,0,1651211165,,0,{},i6mtdo2,False,t3_udtiyb,False,True,t1_i6m5ifs,/r/UkraineConflict/comments/udtiyb/russian_tv_about_possibility_of_nuclear_war/i6mtdo2/,1651211180,1,True,True,False,UkraineConflict,t5_30oyx,r/UkraineConflict,public,,0,[],,1651182365.0
[],False,,Signal-Secret1311,,,[],,,,text,t2_ab2epeld,False,False,Oligarchs sold the fuel for his nuclear missiles to Iran and bought mega yachts.,47746c4471ec398135e2438b956f7aa9395df158,True,False,,,,,0,1651210459,,0,{},i6msdip,False,t3_ue00zu,False,False,t3_ue00zu,/r/UkraineConflict/comments/ue00zu/president_putin_warns_of_lightningfast/i6msdip/,1651210475,1,True,True,False,UkraineConflict,t5_30oyx,r/UkraineConflict,public,,0,[],,1651181659.0
[],False,,alane2022,,,[],,,,text,t2_kiz3xyng,False,False,"That's a bad-ass looking big ship!

Looks more like a tank than a cargo ship....big gun to blast the Russians should poke out of the front...",c15f2b4896810d25fd4bb9b6699c1d615bb9902d,True,False,,,,,0,1651209795,,0,{},i6mrefv,False,t3_ue01jv,False,True,t3_ue01jv,/r/UkraineConflict/comments/ue01jv/the_cargo_ship_ysabel_of_the_spanish_navy_arrived/i6mrefv/,1651209811,1,True,True,False,UkraineConflict,t5_30oyx,r/UkraineConflict,public,,0,[],,1651180995.0
[],False,,alane2022,,,[],,,,text,t2_kiz3xyng,False,False,"Yes! And, much appreciated help! Yah Ukraine!",3f02f8a9bade6d13141eb1c7c0a3b6bdb74b0c36,True,False,,,,,0,1651209662,,0,{},i6mr7gi,False,t3_ue01jv,False,True,t1_i6k2ac9,/r/UkraineConflict/comments/ue01jv/the_cargo_ship_ysabel_of_the_spanish_navy_arrived/i6mr7gi/,1651209673,1,True,True,False,UkraineConflict,t5_30oyx,r/UkraineConflict,public,,0,[],,1651180862.0
[],False,,DeathRowLemon,,,[],,,,text,t2_2llntaru,False,False,They only have 5000 nukes on paper,a6945d078ab283264fb484f0d2ee67894826c6ff,True,False,,,,,0,1651209522,,0,{},i6mqzmg,False,t3_ue00zu,False,True,t1_i6mizze,/r/UkraineConflict/comments/ue00zu/president_putin_warns_of_lightningfast/i6mqzmg/,1651209538,1,True,True,False,UkraineConflict,t5_30oyx,r/UkraineConflict,public,,0,[],,1651180722.0
[],False,,Neat_Charity5362,,,[],,,,text,t2_f278pzgf,False,True,Can you make a video of your art work on a loop to the song go a shum,8fe78cc9a8c8db326f1845d62c027ae42b27c256,True,False,,,,,0,1651209273,,0,{},i6mqm47,False,t3_ue60w1,False,True,t3_ue60w1,/r/UkraineConflict/comments/ue60w1/sunflower_land_by_me_digital_2022/i6mqm47/,1651209289,1,True,True,False,UkraineConflict,t5_30oyx,r/UkraineConflict,public,,0,[],,1651180473.0
[],False,,VaarrLovesHisWife,,,[],,,,text,t2_6n262g2k,False,False,"""No seriously guys...I'm totally gonna do it. I...I mean it guys.""

2 weeks later: ""I mean it guys, you better back off. I'm getting really mad guys. I will seriously fuck you up.""

1 more week later: ""For reals though guys. This isn't cool. You need to let me win. I will seriously mess you up if you don't. """,e5f5ddd6802a15e67b7cfa33beb1cf0a5c70cbf3,True,False,,,,,0,1651208935,,0,{},i6mq3i2,False,t3_ue00zu,False,True,t3_ue00zu,/r/UkraineConflict/comments/ue00zu/president_putin_warns_of_lightningfast/i6mq3i2/,1651208952,1,True,True,False,UkraineConflict,t5_30oyx,r/UkraineConflict,public,,0,[],,1651180135.0
[],False,,Circlemadeeverything,,,[],,,,text,t2_d8s9q1c0,False,False,Ah sorry. Now I get it,6aa1832578cf684d960cd57136720bd1e5cf5875,True,False,,,,,0,1651208412,,0,{},i6mp9ye,False,t3_ue41gw,False,True,t1_i6mn1hn,/r/UkraineConflict/comments/ue41gw/russian_tv_keeps_threatening_nuclear_strikes/i6mp9ye/,1651208429,1,True,True,False,UkraineConflict,t5_30oyx,r/UkraineConflict,public,,0,[],,1651179612.0
[],False,,Strawberry-Obvious,,,[],,,,text,t2_7q5z9fe7,False,False,"Wasn’t talking about you, talking about them.",b24468337cf4b12e68e5e2722e07b7fe972732a5,True,False,,,,,0,1651207007,,0,{},i6mn1hn,False,t3_ue41gw,False,True,t1_i6mlq3l,/r/UkraineConflict/comments/ue41gw/russian_tv_keeps_threatening_nuclear_strikes/i6mn1hn/,1651207020,1,True,True,False,UkraineConflict,t5_30oyx,r/UkraineConflict,public,,0,[],,1651178207.0
[],False,,3ntryL3v3lmilli,,,[],,,,text,t2_9lj7w7c3,False,False,Slava Ukraini 💪🇺🇦,64df05ecf65aa2dde477266cbf5daef99ddf9f86,True,False,,,,,0,1651206991,,0,{},i6mn0is,False,t3_uaqxdi,False,True,t3_uaqxdi,/r/UkraineConflict/comments/uaqxdi/ukrainian_longdistance_mlrs_bm27_uragan_in_action/i6mn0is/,1651207006,1,True,True,False,UkraineConflict,t5_30oyx,r/UkraineConflict,public,,0,[],,1651178191.0
[],False,,I-am-Pilgrim,,,[],,,,text,t2_6d41hr3f,False,False,I think hes referring to their new super fast missile…,aaee6c1ef6e2af5e39bd075405108b7511cf45d1,True,False,,,,,0,1651206921,,0,{},i6mmwc6,False,t3_ue00zu,False,True,t1_i6k39ar,/r/UkraineConflict/comments/ue00zu/president_putin_warns_of_lightningfast/i6mmwc6/,1651206936,1,True,True,False,UkraineConflict,t5_30oyx,r/UkraineConflict,public,,0,[],,1651178121.0
[],False,,I-am-Pilgrim,,,[],,,,text,t2_6d41hr3f,False,False,Interesting theory. Crazy spin: “Taliban sends troops to Ukraine” in payback move over Russian invasion of Afghanistan…,2fe67c3107a0247e106bc3365c5307523631efcf,True,False,,,,,0,1651206766,,0,{},i6mmmln,False,t3_ue00zu,False,True,t1_i6l1jbp,/r/UkraineConflict/comments/ue00zu/president_putin_warns_of_lightningfast/i6mmmln/,1651206779,1,True,True,False,UkraineConflict,t5_30oyx,r/UkraineConflict,public,,0,[],,1651177966.0
[],False,,I-am-Pilgrim,,,[],,,,text,t2_6d41hr3f,False,False,The only “lightning fast” thing in Russia right now is this guts bowel movement…,3fe564ac8bdd7113d858bebdb00b38e1581c99a4,True,False,,,,,0,1651206375,,0,{},i6mlxjo,False,t3_ue00zu,False,True,t3_ue00zu,/r/UkraineConflict/comments/ue00zu/president_putin_warns_of_lightningfast/i6mlxjo/,1651206391,1,True,True,False,UkraineConflict,t5_30oyx,r/UkraineConflict,public,,0,[],,1651177575.0
[],False,,Circlemadeeverything,,,[],,,,text,t2_d8s9q1c0,False,False,What does what I do matter to others?  But I am not afraid to die if that’s what you’re asking.,06d40f2dcf83c357345553a8258745eca3c69769,True,False,,,,,0,1651206256,,0,{},i6mlq3l,False,t3_ue41gw,False,True,t1_i6mlldb,/r/UkraineConflict/comments/ue41gw/russian_tv_keeps_threatening_nuclear_strikes/i6mlq3l/,1651206270,1,True,True,False,UkraineConflict,t5_30oyx,r/UkraineConflict,public,,0,[],,1651177456.0
[],False,,Strawberry-Obvious,,,[],,,,text,t2_7q5z9fe7,False,False,“You talk the talk… but do you walk the walk?”,ec2d548f6a2322956208e05e269154773d135c47,True,False,,,,,0,1651206182,,0,{},i6mlldb,False,t3_ue41gw,False,True,t1_i6kttvj,/r/UkraineConflict/comments/ue41gw/russian_tv_keeps_threatening_nuclear_strikes/i6mlldb/,1651206193,1,True,True,False,UkraineConflict,t5_30oyx,r/UkraineConflict,public,,0,[],,1651177382.0
[],False,,yogyadreams,,,[],,,,text,t2_52atf2vn,False,False,Don't ever poke the sleeping bull,6c1b59b5785dcac8c9e1eca0519819ae81e7af9a,True,False,,,,,0,1651206067,,0,{},i6mle2w,False,t3_ue01jv,False,True,t3_ue01jv,/r/UkraineConflict/comments/ue01jv/the_cargo_ship_ysabel_of_the_spanish_navy_arrived/i6mle2w/,1651206083,1,True,True,False,UkraineConflict,t5_30oyx,r/UkraineConflict,public,,0,[],,1651177267.0
[],False,,AgentChange2021,,,[],,,,text,t2_a0kizd6f,False,False,Awesome flute work,591b940a517a8fc7b982861cb72e0b841b63f736,True,False,,,,,0,1651205917,,0,{},i6ml4jm,False,t3_ue60w1,False,True,t3_ue60w1,/r/UkraineConflict/comments/ue60w1/sunflower_land_by_me_digital_2022/i6ml4jm/,1651205930,1,True,True,False,UkraineConflict,t5_30oyx,r/UkraineConflict,public,,0,[],,1651177117.0
[],False,,Strawberry-Obvious,,,[],,,,text,t2_7q5z9fe7,False,False,"Oh stop with the nuclear winter nonsense.  It’s not a thing.  For one, the models which predict it assume NO RAIN.  Since when is that a thing?  Read a bit about it and you’ll find out that “nuclear winter” depends on a lot of things that have never been tested before actually happening, which is unlikely at best.  To be clear, I think a nuclear exchange would be catastrophic for the countries involved and anyone downwind, but this “global winter” scenario is just silly.  Some cooling with SOME crop effects, possibly, but sending us back to snowball earth is just ridiculous.",cbfff20e1a0521e7a4c099f15c376b1904359064,True,False,,,,,0,1651205465,,0,{},i6mkc1h,False,t3_ue00zu,False,True,t1_i6lli1i,/r/UkraineConflict/comments/ue00zu/president_putin_warns_of_lightningfast/i6mkc1h/,1651205481,1,True,True,False,UkraineConflict,t5_30oyx,r/UkraineConflict,public,,0,[],,1651176665.0
[],False,,BetterGuest8447,,,[],,,,text,t2_4313bhel,False,False,THEN FUCKING DO IT but you better lunch all 5000 of your nukes at once because you will get exactly one shot at using them before we season the earth with your Russian ashes.,0baa62b6d9bd85c74e368391f478965f1d1b6c05,True,False,,,,,0,1651204713,,0,{},i6mizze,False,t3_ue00zu,False,False,t3_ue00zu,/r/UkraineConflict/comments/ue00zu/president_putin_warns_of_lightningfast/i6mizze/,1651204724,1,True,True,False,UkraineConflict,t5_30oyx,r/UkraineConflict,public,,0,[],,1651175913.0
[],False,,kamden096,,,[],,,,text,t2_fbggrg60,False,True,"Crush it all. Destroy roads, bridges, railroads in russia so They cant reach the front in Ukraine with reinforcements",2fac7fa5405ca55a75d185ad4fb66ee087b06a2e,True,False,,,,,0,1651203653,,0,{},i6mh0ci,False,t3_udz8i0,False,True,t3_udz8i0,/r/UkraineConflict/comments/udz8i0/the_missile_attacks_on_bryansk_belgorod_and_other/i6mh0ci/,1651203670,1,True,True,False,UkraineConflict,t5_30oyx,r/UkraineConflict,public,,0,[],,1651174853.0
[],False,,DC_Daddy,,,[],,,,text,t2_22stbl87,False,False,"Blow me,  Vladimir",1cb58007ad6b5e56ed3eb9799d984d7cb6cfbf33,True,False,,,,,0,1651203061,,0,{},i6mfve7,False,t3_ue00zu,False,True,t3_ue00zu,/r/UkraineConflict/comments/ue00zu/president_putin_warns_of_lightningfast/i6mfve7/,1651203077,1,True,True,False,UkraineConflict,t5_30oyx,r/UkraineConflict,public,,0,[],,1651174261.0
[],False,,samsounder,,,[],,,,text,t2_gtxinat2,False,False,Washington State could take Moscow.,cfcba1dbea89cd5ca1acd5f67a782ace63cea3f6,True,False,,,,,0,1651202737,,0,{},i6mf8r7,False,t3_ue00zu,False,True,t3_ue00zu,/r/UkraineConflict/comments/ue00zu/president_putin_warns_of_lightningfast/i6mf8r7/,1651202753,1,True,True,False,UkraineConflict,t5_30oyx,r/UkraineConflict,public,,0,[],,1651173937.0
[],False,,Thanx4TheGrub,,,[],,,,text,t2_d7opmxa4,False,False,Glory to the hero’s! Men like him could’ve stayed home but he was brave enough to do something about the injustice that he saw.,fffb982ec01ef00ec5c5f90fd2bafbef51e185fe,True,False,,,,,0,1651202697,,0,{},i6mf60b,False,t3_ue0unx,False,True,t3_ue0unx,/r/UkraineConflict/comments/ue0unx/ukraine_conflict_british_man_scott_sibley_killed/i6mf60b/,1651202708,1,True,True,False,UkraineConflict,t5_30oyx,r/UkraineConflict,public,,0,[],,1651173897.0
[],False,,scatterbrained187,,,[],,,,text,t2_dmamc,False,False,Fuck him... Suka Putin,883afafb5be3e7c24a5ee691ea03e17883e09a4f,True,False,,,,,0,1651202667,,0,{},i6mf3v0,False,t3_ue00zu,False,True,t3_ue00zu,/r/UkraineConflict/comments/ue00zu/president_putin_warns_of_lightningfast/i6mf3v0/,1651202680,1,True,True,False,UkraineConflict,t5_30oyx,r/UkraineConflict,public,,0,[],,1651173867.0
[],False,,Prestigious-Stick302,,,[],,,,text,t2_fdln0t1o,False,False,I'm skeptical. Probably guided by 3G,26dd9329cd76e3964af54abdc70dcf550b012b65,True,False,,,,,0,1651202468,,0,{},i6mepjx,False,t3_ue41gw,False,True,t3_ue41gw,/r/UkraineConflict/comments/ue41gw/russian_tv_keeps_threatening_nuclear_strikes/i6mepjx/,1651202480,1,True,True,False,UkraineConflict,t5_30oyx,r/UkraineConflict,public,,0,[],,1651173668.0
[],False,,Due_Yogurtcloset4882,,,[],,,,text,t2_eiyvmyj1,False,False,Is there a candian version?,6116c5312524aab73da69b6ffa9de1e661f75a13,True,False,,,,,0,1651202458,,0,{},i6meovr,False,t3_ubwmh0,False,True,t3_ubwmh0,/r/UkraineConflict/comments/ubwmh0/if_you_are_american_you_can_afford_to_sponsor_a/i6meovr/,1651202473,1,True,True,False,UkraineConflict,t5_30oyx,r/UkraineConflict,public,,0,[],,1651173658.0
