all_awardings,archived,associated_award,author,author_flair_background_color,author_flair_css_class,author_flair_richtext,author_flair_template_id,author_flair_text,author_flair_text_color,author_flair_type,author_fullname,author_patreon_flair,author_premium,body,body_sha1,can_gild,collapsed,collapsed_because_crowd_control,collapsed_reason,collapsed_reason_code,comment_type,controversiality,created_utc,distinguished,gilded,gildings,id,is_submitter,link_id,locked,no_follow,parent_id,permalink,retrieved_utc,score,score_hidden,send_replies,stickied,subreddit,subreddit_id,subreddit_name_prefixed,subreddit_type,top_awarded_type,total_awards_received,treatment_tags,unrepliable_reason,created
[],False,,xalofonus,,,[],,,,text,t2_lw6d6orj,False,False,we will wipe russia off the face of earth and purge history of russia. all russia and every russian shall perish. wipe them out. No mercy!!!! SLAVA UKRAINE!!!!,d08b6af00c3dd71a77c0aec2fb8898e513c638e4,True,False,,,,,0,1651238581,,0,{},i6nvqbs,False,t3_ue00zu,False,True,t1_i6niosw,/r/UkraineConflict/comments/ue00zu/president_putin_warns_of_lightningfast/i6nvqbs/,1651238592,1,True,True,False,UkraineConflict,t5_30oyx,r/UkraineConflict,public,,0,[],,1651209781.0
[],False,,FNFALC2,,,[],,,,text,t2_16v23j,False,False,At least the other guys tried to help,d66faa88624306cb6ea2ae412ec42dbfc6a16ab6,True,False,,,,,0,1651238211,,0,{},i6nux4c,False,t3_ueiso9,False,True,t3_ueiso9,/r/UkraineConflict/comments/ueiso9/azov_shot_a_stupid_russian_in_mariupol_near/i6nux4c/,1651238224,1,True,True,False,UkraineConflict,t5_30oyx,r/UkraineConflict,public,,0,[],,1651209411.0
[],False,,gunnerdk,,,[],,,,text,t2_k1ejgxkv,False,False,Stunning.,a55e62bff76b40e0c4536fcdc0aba694c551f687,True,False,,,,,0,1651238153,,0,{},i6nuso2,False,t3_uelj55,False,True,t3_uelj55,/r/UkraineConflict/comments/uelj55/the_ukrainian_r18_octocopter_drops_bomb_on_orcs/i6nuso2/,1651238167,1,True,True,False,UkraineConflict,t5_30oyx,r/UkraineConflict,public,,0,[],,1651209353.0
[],False,,Ra-rexan,,,[],,,,text,t2_a95m996u,False,False,"Russia be like
I also have a gift for Spain, here have a nuke🚀",069267a181f98de9317247236957abe289bbab90,True,False,,,,,0,1651237995,,0,{},i6nugec,False,t3_ue01jv,False,True,t3_ue01jv,/r/UkraineConflict/comments/ue01jv/the_cargo_ship_ysabel_of_the_spanish_navy_arrived/i6nugec/,1651238013,1,True,True,False,UkraineConflict,t5_30oyx,r/UkraineConflict,public,,0,[],,1651209195.0
[],False,,adenosine-5,,,[],,,,text,t2_fwwxu,False,False,"In a sane world yes. But in reality we would have had another one, maybe two world wars if it werent for MAD.",ac3d726ef6eb4cb94745d06b44a825b26c707da1,True,False,,,,,0,1651237984,,0,{},i6nufk8,False,t3_ue41gw,False,True,t1_i6m7l4m,/r/UkraineConflict/comments/ue41gw/russian_tv_keeps_threatening_nuclear_strikes/i6nufk8/,1651237998,1,True,True,False,UkraineConflict,t5_30oyx,r/UkraineConflict,public,,0,[],,1651209184.0
[],False,,WiseChonk,,,[],,,,text,t2_hbvuuazm,False,False,Amazing what artillery can do with drone spotters,4f44d95d20cd715c9721da49b4f06b41283fbb06,True,False,,,,,0,1651237979,,0,{},i6nuf3u,False,t3_uejmur,False,True,t3_uejmur,/r/UkraineConflict/comments/uejmur/soldiers_of_the_armed_forces_of_ukraine_in_the/i6nuf3u/,1651237991,1,True,True,False,UkraineConflict,t5_30oyx,r/UkraineConflict,public,,0,[],,1651209179.0
[],False,,Misdemeanour2020,,,[],,,,text,t2_i4obwohc,False,False,"OK, I take back what I said about the Spanish politicians",6a9d49efaa03abc7c2d234942b7f425ff7a1a2e3,True,False,,,,,0,1651237912,,0,{},i6nua0q,False,t3_ue01jv,False,True,t3_ue01jv,/r/UkraineConflict/comments/ue01jv/the_cargo_ship_ysabel_of_the_spanish_navy_arrived/i6nua0q/,1651237924,1,True,True,False,UkraineConflict,t5_30oyx,r/UkraineConflict,public,,0,[],,1651209112.0
[],False,,JaxXxStaR,,,[],,,,text,t2_auhvlyr6,False,False,"But being a slave of war is easier than farming,        -  African warlord army probably

What i dont like with them is that how a simple tribal/religion seems to make them go haywire locally on their own countryman most of this african country that are still problematic cant get out of this stoneage tribal war",05aa061c9d072c411b37a6ed49a162f897ace4aa,True,False,,,,,0,1651237826,,0,{},i6nu3nq,False,t3_ue7kkx,False,True,t1_i6nd4lv,/r/UkraineConflict/comments/ue7kkx/us_pledges_670_million_in_global_food_assistance/i6nu3nq/,1651237837,1,True,True,False,UkraineConflict,t5_30oyx,r/UkraineConflict,public,,0,[],,1651209026.0
[],False,,KeyserSoze72,,,[],,,,text,t2_1de40fci,False,False,"I understand your stance, but my thing is history, specifically the history of dictatorships. Right now America is transitioning to becoming one. The media does like to blow things out of proportion but they are right on one thing, this is the legal phase of fascism. Right now the institutions that are supposed to hold the public trust at heart are not acting on the will of the public, they’re ignoring it. The law is being changed to better suit a more fascist agenda by blocking any progressive motions and supporting greater restrictions on voting, particularly for groups in the “out group” meaning the non-white population. The Supreme Court is acting like a political arm of a former president, the state governments are infringing on the rights of their people, the federal government is too compromised to put a check on these infringements because of lobbyists and trump loyalists. This is the kind of thing we see in countries with no care for the ideals of liberty and equality. Our police force is more militarized every year, and the population is kept from education by high tuitions and the frustration of the general population is being preyed upon by populist rhetoric. Populism destroys every county it’s ever succeeded in: Mexico, Italy, Argentina, Germany, Romania, Hungary, and now the United States. What’s worse is that if we continue down the path we are on, we’ll be even worse than Russia. It’s already been proven that they planned to kidnap the VP to stop the certification of the election and that they planned to use martial law as a means of enforcing that rule. Our elections have been compromised by a foreign power and our military is compromised by populists. If you don’t want to see the writing on the wall, I don’t know what to say to you. An unfortunate side effect of growing up in America is that Americans have become spoiled and have taken democracy for granted. It is much easier than you think to kill a democracy, though I’d argue it hasn’t been a proper one since the 70s. After all, why keep an antiquated and racially based system like the electoral college in a modern democracy? Regardless, don’t presume going business as usual will solve our issues, in fact they count on people to do nothing.",ef8c86efb45c593c567d5d8a8a242b66af173f5c,True,False,,,,,0,1651236932,,0,{},i6ns9or,False,t3_uc5i4z,False,True,t1_i6jxid8,/r/UkraineConflict/comments/uc5i4z/russia_warns_nuclear_war_risks_now_considerable/i6ns9or/,1651236944,1,True,True,False,UkraineConflict,t5_30oyx,r/UkraineConflict,public,,0,[],,1651208132.0
[],False,,itsallaroundu,,,[],,,,text,t2_a3rpbxqh,False,False,"True. History shows that they will never wake up. From the crusaders to the jihadists, their stupidity/blind faith is way more dangerous than their malice. It's its own weapon. Billions have already died behind it and there's more to come. Hell, we might get caught up in their bullshit this time. Not saying its gonna, but this type of propaganda is signaling that they're just holy enough to do it. 

If poot poot goes full bat shit crazy and begins to think he's doing God's will, who is going to stop him besides his own personal Jesus? I say no one.",90842a96202a3dc3a8420cb5af2619945d5cb0bd,True,False,,,,,0,1651236640,,0,{},i6nrowr,False,t3_udrjmi,False,True,t1_i6mx8m2,/r/UkraineConflict/comments/udrjmi/brief_summary_of_russian_propaganda_world_war_iii/i6nrowr/,1651236657,1,True,True,False,UkraineConflict,t5_30oyx,r/UkraineConflict,public,,0,[],,1651207840.0
[],False,,[deleted],,,,,,dark,,,,,[removed],fe993932d6dced4c0a879e9aa5d7a6e0fbb467f5,True,False,,,,,0,1651236538,,0,{},i6nrhhj,False,t3_uejmur,False,True,t3_uejmur,/r/UkraineConflict/comments/uejmur/soldiers_of_the_armed_forces_of_ukraine_in_the/i6nrhhj/,1651236556,1,True,True,False,UkraineConflict,t5_30oyx,r/UkraineConflict,public,,0,[],,1651207738.0
[],False,,awpiiii,,,[],,,,text,t2_kqs6bv5k,False,False,Can't way till the war is over and all of these celebrities travel abroad (Should states be dumb enough to lift sanctions against Russia) so that we can spit on them and treat them like garbage for even suggesting the death of so many people.,cdbe039278fb9e7353e1d1642236b1be281b833a,True,False,,,,,0,1651235822,,0,{},i6nq3mt,False,t3_ue41gw,False,False,t3_ue41gw,/r/UkraineConflict/comments/ue41gw/russian_tv_keeps_threatening_nuclear_strikes/i6nq3mt/,1651235834,1,True,True,False,UkraineConflict,t5_30oyx,r/UkraineConflict,public,,0,[],,1651207022.0
[],False,,[deleted],,,,,,dark,,,,,[removed],fe993932d6dced4c0a879e9aa5d7a6e0fbb467f5,True,False,,,,,0,1651235766,,0,{},i6npzr6,False,t3_ueiso9,False,True,t3_ueiso9,/r/UkraineConflict/comments/ueiso9/azov_shot_a_stupid_russian_in_mariupol_near/i6npzr6/,1651235778,1,True,True,False,UkraineConflict,t5_30oyx,r/UkraineConflict,public,,0,[],,1651206966.0
[],False,,Grifasaurus,,,[],,,,text,t2_xn7nc,False,False,"this is just ""Allah ackbar"" but with russians.",af324159578a8da1e7341aa4356eaeaeee7f35d4,True,False,,,,,0,1651234296,,0,{},i6nn9is,False,t3_udrjmi,False,False,t3_udrjmi,/r/UkraineConflict/comments/udrjmi/brief_summary_of_russian_propaganda_world_war_iii/i6nn9is/,1651234307,1,True,True,False,UkraineConflict,t5_30oyx,r/UkraineConflict,public,,0,[],,1651205496.0
[],False,,Jakoobus91,,,[],,,,text,t2_iez5lnh,False,False,One of the ugliest groups of motherfuckers I've ever seen. Fuck a trial. Just put a bullet between each one of their eyes and we'll all be better for it.,61545ca11c1fc77a4cd5e6f469494e1f33d759a5,True,False,,,,,0,1651234261,,0,{},i6nn7ak,False,t3_ueimpr,False,True,t3_ueimpr,/r/UkraineConflict/comments/ueimpr/faces_of_butchers_of_bucha_who_tortured_civilians/i6nn7ak/,1651234278,1,True,True,False,UkraineConflict,t5_30oyx,r/UkraineConflict,public,,0,[],,1651205461.0
[],False,,PioLek,,,[],,,,text,t2_3ldb0uip,False,False,Epic,b3efd0d2dd507ba6211015b1bc8119629dd74e05,True,False,,,,,0,1651233847,,0,{},i6nmh2x,False,t3_ue60w1,False,True,t3_ue60w1,/r/UkraineConflict/comments/ue60w1/sunflower_land_by_me_digital_2022/i6nmh2x/,1651233861,1,True,True,False,UkraineConflict,t5_30oyx,r/UkraineConflict,public,,0,[],,1651205047.0
[],False,,Misdemeanour2020,,,[],,,,text,t2_i4obwohc,False,False,That idjit keeps talking as if Ukraine belongs to Russia. He really is on a different planet and not the brightest star in the sky.,ad080ec9cb03785cbad54a3729451dcdc6abf4f5,True,False,,,,,0,1651233534,,0,{},i6nlx5d,False,t3_ue00zu,False,True,t3_ue00zu,/r/UkraineConflict/comments/ue00zu/president_putin_warns_of_lightningfast/i6nlx5d/,1651233545,1,True,True,False,UkraineConflict,t5_30oyx,r/UkraineConflict,public,,0,[],,1651204734.0
[],False,,GlobusGlobus,,,[],,,,text,t2_i22apm2,False,False,That is certainly what I would think at this point. Let's see.,9b5b83dc04d755b6545ae2a13043e97f2e890667,True,False,,,,,0,1651233184,,0,{},i6nlbkx,False,t3_uehuet,False,True,t1_i6njhgy,/r/UkraineConflict/comments/uehuet/do_we_agree_that_russia_is_bogged_down_in_a_slog/i6nlbkx/,1651233195,1,True,True,False,UkraineConflict,t5_30oyx,r/UkraineConflict,public,,0,[],,1651204384.0
[],False,,Volomon,,,[],,,,text,t2_8rg68,False,False,"Have a feeling Russia is taking more losses cause it Ukraine was taking ""colossal"" loses they wouldn't be able to fight where as Russia is force conscripting from seperatist regions where there are basically no one in the streets any more and kidnapping people in Russia to go fight.  So it sounds like Russia is actually taking colossal loses and Ukraine is not.",64a8943b4218119929a072afc1607770e2915c0f,True,False,,,,,0,1651232677,,0,{},i6nkgpr,False,t3_ueigkh,False,True,t1_i6nh0jy,/r/UkraineConflict/comments/ueigkh/ukraine_says_russia_taking_colossal_losses_in/i6nkgpr/,1651232687,1,True,True,False,UkraineConflict,t5_30oyx,r/UkraineConflict,public,,0,[],,1651203877.0
[],False,,kpapenbe,,,[],,,,text,t2_ixf7ljmz,False,False,"True....and then there's Germany paying their GAZPROM debts....so maybe there's hope for the Rooskis yet, ugh....",f4a3e568faf06139931aefb9cc0551dcca4d82cf,True,False,,,,,0,1651232156,,0,{},i6njlxx,True,t3_uehuet,False,True,t1_i6nixmz,/r/UkraineConflict/comments/uehuet/do_we_agree_that_russia_is_bogged_down_in_a_slog/i6njlxx/,1651232172,1,True,True,False,UkraineConflict,t5_30oyx,r/UkraineConflict,public,,0,[],,1651203356.0
[],False,,moruart,,,[],,,,text,t2_hnp70vas,False,False,"I'd say this progress is temporary, once the ukrainian forces start breathing on their necks from the west.",c7002f20b91d716d4d5956768c5e3bfdb56642a0,True,False,,,,,0,1651232080,,0,{},i6njhgy,False,t3_uehuet,False,True,t1_i6nfo0o,/r/UkraineConflict/comments/uehuet/do_we_agree_that_russia_is_bogged_down_in_a_slog/i6njhgy/,1651232094,1,True,True,False,UkraineConflict,t5_30oyx,r/UkraineConflict,public,,0,[],,1651203280.0
[],False,,Motor-Cheetah572,,,[],,,,text,t2_a0i80kav,False,False,1v1,d6db37efe25922350ccad80c5bb11251f41f7d27,True,False,,,,,0,1651232019,,0,{},i6njdul,False,t3_ue00zu,False,True,t3_ue00zu,/r/UkraineConflict/comments/ue00zu/president_putin_warns_of_lightningfast/i6njdul/,1651232034,1,True,True,False,UkraineConflict,t5_30oyx,r/UkraineConflict,public,,0,[],,1651203219.0
[],False,,GlobusGlobus,,,[],,,,text,t2_i22apm2,False,False,"Yeah, it think this is their maximum effort. As Ukraine now is starting to acquire new heavy weoponry, including tanks, it looks rough for Russia to reach their goals without going nuclear.",67e45c6ea85eba5263590bfddd0b22e27c90b865,True,False,,,,,0,1651231732,,0,{},i6nixmz,False,t3_uehuet,False,True,t1_i6ng8pd,/r/UkraineConflict/comments/uehuet/do_we_agree_that_russia_is_bogged_down_in_a_slog/i6nixmz/,1651231747,1,True,True,False,UkraineConflict,t5_30oyx,r/UkraineConflict,public,,0,[],,1651202932.0
[],False,,Wicked99Rako,,,[],,,,text,t2_k6634abr,False,False,Fellow Russian? What do you mean?,12db8b2a11fd67926aa5c5c528c5a8e97d51cc66,True,False,,,,,0,1651231717,,0,{},i6niwt8,False,t3_ue00zu,False,True,t1_i6ncknl,/r/UkraineConflict/comments/ue00zu/president_putin_warns_of_lightningfast/i6niwt8/,1651231733,1,True,True,False,UkraineConflict,t5_30oyx,r/UkraineConflict,public,,0,[],,1651202917.0
[],False,,lovesredditt2022,,,[],,,,text,t2_j2dw3t3q,False,False,His only defense is to keep making threats.,949fe2b19a183ab33d282187d048bef3acf4f3f6,True,False,,,,,0,1651231614,,0,{},i6niqua,False,t3_ue00zu,False,True,t1_i6nd9gs,/r/UkraineConflict/comments/ue00zu/president_putin_warns_of_lightningfast/i6niqua/,1651231629,1,True,True,False,UkraineConflict,t5_30oyx,r/UkraineConflict,public,,0,[],,1651202814.0
[],False,,zen_tm,,,[],,,,text,t2_39chx,False,False,"&gt;virtual copies of the stock

Scam",de7dd395179c93731f4bc1ca4c81ac100a10c3c8,True,False,,,,,0,1651231589,,0,{},i6nipi2,False,t3_ueh6st,False,True,t1_i6ngwus,/r/UkraineConflict/comments/ueh6st/morpher_is_launching_a_project_that_will_let_you/i6nipi2/,1651231601,1,True,True,False,UkraineConflict,t5_30oyx,r/UkraineConflict,public,,0,[],,1651202789.0
[],False,,lovesredditt2022,,,[],,,,text,t2_j2dw3t3q,False,False,Lol. He really is full of himself. He really has no idea of the level of technology the west has. His corrupt government has siphoned do much money out of the military they haven’t got a chance against NATO.,4ec94d0741b21dbd1665b9b1665503a580102c49,True,False,,,,,0,1651231577,,0,{},i6niosw,False,t3_ue00zu,False,True,t3_ue00zu,/r/UkraineConflict/comments/ue00zu/president_putin_warns_of_lightningfast/i6niosw/,1651231594,1,True,True,False,UkraineConflict,t5_30oyx,r/UkraineConflict,public,,0,[],,1651202777.0
[],False,,hemimotorsport,,,[],,,,text,t2_5l4xapz2,False,False,Get fucked putin,d308a8f913d1318a7473420cb3dd00a1ad9f7686,True,False,,,,,0,1651231503,,0,{},i6niklx,False,t3_ue00zu,False,True,t3_ue00zu,/r/UkraineConflict/comments/ue00zu/president_putin_warns_of_lightningfast/i6niklx/,1651231515,1,True,True,False,UkraineConflict,t5_30oyx,r/UkraineConflict,public,,0,[],,1651202703.0
[],False,,se7ensez,,,[],,,,text,t2_6pw16b5t,False,False,We have drone squadrons that never land already and can strike anywhere in the world like right now.,b6a4007a1e9ba65b1a7747e3074e8f38628cd713,True,False,,,,,0,1651231410,,0,{},i6nifgn,False,t3_ue41gw,False,True,t1_i6l6ylt,/r/UkraineConflict/comments/ue41gw/russian_tv_keeps_threatening_nuclear_strikes/i6nifgn/,1651231423,1,True,True,False,UkraineConflict,t5_30oyx,r/UkraineConflict,public,,0,[],,1651202610.0
[],False,,Phoenix_2015,,,[],,,,text,t2_oaopt,False,False,Follow the Mossad template here. Even if it takes decades these criminals should be hunted and made to account for their crimes.  They should never sleep comfortably again. Let them suffer the fear that Ukrainian agents or bounty hunters might snatch them in dead of night.,0f227731d7809f448e84cf259f47be7786247c8e,True,False,,,,,0,1651231215,,0,{},i6ni4i9,False,t3_ueimpr,False,True,t3_ueimpr,/r/UkraineConflict/comments/ueimpr/faces_of_butchers_of_bucha_who_tortured_civilians/i6ni4i9/,1651231229,1,True,True,False,UkraineConflict,t5_30oyx,r/UkraineConflict,public,,0,[],,1651202415.0
[],False,,se7ensez,,,[],,,,text,t2_6pw16b5t,False,False,I agree they have trash and no money,2f96672e2ab487025fdb9d39f87fb72ed542270b,True,False,,,,,0,1651231143,,0,{},i6ni0f3,False,t3_ue41gw,False,True,t1_i6lz528,/r/UkraineConflict/comments/ue41gw/russian_tv_keeps_threatening_nuclear_strikes/i6ni0f3/,1651231159,1,True,True,False,UkraineConflict,t5_30oyx,r/UkraineConflict,public,,0,[],,1651202343.0
[],False,,packetlag,,,[],,,,text,t2_f0zm4,False,False,"To be fare, now that both chambers of congress have passed the Lend Lease legislation this week (not done since WWII) the US is able to hand over any of our military assets to any country we deem to be in our national security interest, it will for sure be the US’ weapons going forward.",b39a4e9c5e71ebe3c71ada0b71dddde3fca98f64,True,False,,,,,0,1651231109,,0,{},i6nhyj6,False,t3_ue00zu,False,True,t1_i6n822a,/r/UkraineConflict/comments/ue00zu/president_putin_warns_of_lightningfast/i6nhyj6/,1651231124,1,True,True,False,UkraineConflict,t5_30oyx,r/UkraineConflict,public,,0,[],,1651202309.0
[],False,,SodaPopPlop,,,[],,,,text,t2_l9mh2lqr,False,False,Like children in the sandbox,0b40490545a65063f23d846b3c0853e60066822e,True,False,,,,,0,1651231062,,0,{},i6nhvy5,False,t3_udrjmi,False,True,t3_udrjmi,/r/UkraineConflict/comments/udrjmi/brief_summary_of_russian_propaganda_world_war_iii/i6nhvy5/,1651231076,1,True,True,False,UkraineConflict,t5_30oyx,r/UkraineConflict,public,,0,[],,1651202262.0
[],False,,se7ensez,,,[],,,,text,t2_6pw16b5t,False,False,"Can they still launch that 50 year old shit Russia hasn't had the economy to maintain? They didn't exactly roll right over Ukraine with their superior military. Yes they were a super power once and ""have"" nukes but come on. They are not hardware capable of blowing their way out of a wet paper bag. Aren't they still running the same garbage they had in the 1980's?",8f80057309c14150f4c587246553a63ee7678166,True,False,,,,,0,1651231010,,0,{},i6nht3t,False,t3_ue41gw,False,True,t3_ue41gw,/r/UkraineConflict/comments/ue41gw/russian_tv_keeps_threatening_nuclear_strikes/i6nht3t/,1651231022,1,True,True,False,UkraineConflict,t5_30oyx,r/UkraineConflict,public,,0,[],,1651202210.0
[],False,,SodaPopPlop,,,[],,,,text,t2_l9mh2lqr,False,False,Coward,9ba766458d05032c3217b6ed2d3eae750aa56711,True,False,,,,,0,1651230924,,0,{},i6nhogk,False,t3_ue00zu,False,True,t3_ue00zu,/r/UkraineConflict/comments/ue00zu/president_putin_warns_of_lightningfast/i6nhogk/,1651230939,1,True,True,False,UkraineConflict,t5_30oyx,r/UkraineConflict,public,,0,[],,1651202124.0
[],False,,ShitPost6969x,,,[],,,,text,t2_9z1kmpss,False,False,My thoughts exactly I know for a fact the US has some serious fire power and defensive capabilities no one knows about,404c1afb94ebcbc61da3bc786aa81aa0b31bc9a3,True,False,,,,,0,1651230883,,0,{},i6nhmbk,False,t3_udtiyb,False,True,t1_i6lagn2,/r/UkraineConflict/comments/udtiyb/russian_tv_about_possibility_of_nuclear_war/i6nhmbk/,1651230898,1,True,True,False,UkraineConflict,t5_30oyx,r/UkraineConflict,public,,0,[],,1651202083.0
[],False,,Sulaco-426,,,[],,,,text,t2_444m9f7s,False,False,Tango down,f46c93d2279fe7a8c66b2905883cc66a96f2a153,True,False,,,,,0,1651230841,,0,{},i6nhk23,False,t3_ueiso9,False,True,t3_ueiso9,/r/UkraineConflict/comments/ueiso9/azov_shot_a_stupid_russian_in_mariupol_near/i6nhk23/,1651230857,1,True,True,False,UkraineConflict,t5_30oyx,r/UkraineConflict,public,,0,[],,1651202041.0
[],False,,Abdul_Wahab_1810,#ff66ac,,[],f60e8e14-b5c8-11ec-b08d-8e5399c45361,Complete Idiot-Ignore Me,dark,text,t2_9j1jlzr3,False,False,Both sides are taking colossal losses.,091b7debbf77df544fb8a8168118c0a43419688c,True,False,,,,,0,1651230474,,0,{},i6nh0jy,False,t3_ueigkh,False,True,t3_ueigkh,/r/UkraineConflict/comments/ueigkh/ukraine_says_russia_taking_colossal_losses_in/i6nh0jy/,1651230489,1,True,True,False,UkraineConflict,t5_30oyx,r/UkraineConflict,public,,0,[],,1651201674.0
[],False,,kpapenbe,,,[],,,,text,t2_ixf7ljmz,False,False,"Yea, you would think they'd be ramping up for 9 May already, but it's really just bogging down....their ""offensive"" that is....",f6e1bd2f28a57d1b5e8c366ca3a1e165e1af2dd8,True,False,,,,,0,1651229944,,0,{},i6ng8pd,True,t3_uehuet,False,True,t1_i6nfo0o,/r/UkraineConflict/comments/uehuet/do_we_agree_that_russia_is_bogged_down_in_a_slog/i6ng8pd/,1651229956,1,True,True,False,UkraineConflict,t5_30oyx,r/UkraineConflict,public,,0,[],,1651201144.0
[],False,,GlobusGlobus,,,[],,,,text,t2_i22apm2,False,False,"There are rumours that they will do this come May 9th. If they do that this might be very long term. It would be an incredibly stupid thing to do, but Russia loves doing stupid stuff, it seems.",da70a0a77cba4976d12c16153961673d35d8dddf,True,False,,,,,0,1651229758,,0,{},i6nfz5e,False,t3_uehuet,False,True,t1_i6n9ki0,/r/UkraineConflict/comments/uehuet/do_we_agree_that_russia_is_bogged_down_in_a_slog/i6nfz5e/,1651229774,1,True,True,False,UkraineConflict,t5_30oyx,r/UkraineConflict,public,,0,[],,1651200958.0
[],False,,GlobusGlobus,,,[],,,,text,t2_i22apm2,False,False,"Over the last ten days Russia has advanced slighty, but beeing bled out while doing so. This is the way to think about the current stage. (But remember, we don't know what will happen in the next weeks. Things could change in any way.)",7ad3c2d8bcc4a0baf9084226e9953ace39ff19d6,True,False,,,,,0,1651229656,,0,{},i6nftxh,False,t3_uehuet,False,True,t1_i6ncryv,/r/UkraineConflict/comments/uehuet/do_we_agree_that_russia_is_bogged_down_in_a_slog/i6nftxh/,1651229673,1,True,True,False,UkraineConflict,t5_30oyx,r/UkraineConflict,public,,0,[],,1651200856.0
[],False,,GlobusGlobus,,,[],,,,text,t2_i22apm2,False,False,"Basically. They have made some progress in terms of land during the increased attack the last ten days or so. In some areas Ukraine has advanced, but Russia has overall advanced a bit more over this period. 

But it certainly would seem as if the losses sustained by Russia during this advance are much, much higher than reasonable for these wins. Slog is a good word for this.",1c72f37ce48fb9df9ee94a8a5f56b6af0a1d3911,True,False,,,,,0,1651229538,,0,{},i6nfo0o,False,t3_uehuet,False,True,t3_uehuet,/r/UkraineConflict/comments/uehuet/do_we_agree_that_russia_is_bogged_down_in_a_slog/i6nfo0o/,1651229549,1,True,True,False,UkraineConflict,t5_30oyx,r/UkraineConflict,public,,0,[],,1651200738.0
[],False,,kpapenbe,,,[],,,,text,t2_ixf7ljmz,False,False,"You make so many good points; mainly, and I hate to admit this, but I enjoy the sobbing conscripts calling home to their mamas--sounds like Chechnya or Afghan all over again, which isn't fair since they didn't want to go (well most, I'm sure)...still...talk about a lack of having a clear, well-defined mission in which to build some sort of morale...

Then there's the retreat that Russia will likely have to conduct in one form or another and the scorched Earth policy they'll probably invoke....I worry for those who stayed behind...run and hide or get underground....what the Russians are doing and will likely continue to do to civilians/women/children is unconscionable...",42c93c982cdb1c65b22af30b422b6815fba91281,True,False,,,,,0,1651229394,,0,{},i6nfguf,True,t3_uehuet,False,True,t1_i6ncvhj,/r/UkraineConflict/comments/uehuet/do_we_agree_that_russia_is_bogged_down_in_a_slog/i6nfguf/,1651229407,1,True,True,False,UkraineConflict,t5_30oyx,r/UkraineConflict,public,,0,[],,1651200594.0
[],False,,the_internet_clown,,,[],,,,text,t2_5lk5g,False,False,Fuck punk ass Putin,6a8c9a9a6d6833a8d0810ca91fabe478ce43674b,True,False,,,,,0,1651229218,,0,{},i6nf82a,False,t3_ue00zu,False,True,t3_ue00zu,/r/UkraineConflict/comments/ue00zu/president_putin_warns_of_lightningfast/i6nf82a/,1651229232,1,True,True,False,UkraineConflict,t5_30oyx,r/UkraineConflict,public,,0,[],,1651200418.0
[],False,,kpapenbe,,,[],,,,text,t2_ixf7ljmz,False,False,Absolutely the epitome of the fog/friction of war...misinformation/disinformation/diplomacy/politics/economics et al,c97784c8687c7deaa6a65be9343a292861457b2a,True,False,,,,,0,1651229111,,0,{},i6nf2rd,True,t3_uehuet,False,True,t1_i6ncryv,/r/UkraineConflict/comments/uehuet/do_we_agree_that_russia_is_bogged_down_in_a_slog/i6nf2rd/,1651229126,1,True,True,False,UkraineConflict,t5_30oyx,r/UkraineConflict,public,,0,[],,1651200311.0
