all_awardings,archived,associated_award,author,author_flair_background_color,author_flair_css_class,author_flair_richtext,author_flair_template_id,author_flair_text,author_flair_text_color,author_flair_type,author_fullname,author_patreon_flair,author_premium,body,body_sha1,can_gild,collapsed,collapsed_because_crowd_control,collapsed_reason,collapsed_reason_code,comment_type,controversiality,created_utc,distinguished,gilded,gildings,id,is_submitter,link_id,locked,no_follow,parent_id,permalink,retrieved_utc,score,score_hidden,send_replies,stickied,subreddit,subreddit_id,subreddit_name_prefixed,subreddit_type,top_awarded_type,total_awards_received,treatment_tags,unrepliable_reason,created
[],False,,TSIDATSI,,,[],,,,text,t2_71yaz2pp,False,True,Dolphins are much smarter.,7eb2b9674a2a3e6b81b4bdfce8363abe0a870173,True,False,,,,,0,1651276799,,0,{},i6qbxwc,False,t3_ueo1an,False,True,t3_ueo1an,/r/UkraineConflict/comments/ueo1an/russia_is_using_dolphins_to_protect_the_black_sea/i6qbxwc/,1651276816,1,True,True,False,UkraineConflict,t5_30oyx,r/UkraineConflict,public,,0,[],,1651247999.0
[],False,,Ukraine_News_Bot,,,[],,,,text,t2_klp2hk59,False,False,"Reminder to respect UKR op-sec by not sharing videos of UKR soldier locations or any other such classified intelligence you discover or witness online.

https://reddit.com/r/ukraine/comments/sy65wi/ministry_of_defense_of_ukraine_do_not_view_our/

News Sources: https://www.reddit.com/user/Ukraine_News_Bot/comments/tnadz3/news_sources/

Godspeed Ukrainians. 💙💛

Ways to help Ukraine (charities) https://reddit.com/r/ukraine/comments/s6g5un/want_to_support_ukraine_heres_a_list_of_charities/

Please message me if there are any translation errors, typos, or dead links.

This comment was made by a bot. Original comment from iamkunii on r/worldnews",8998b0c1bcdee8746c37461483bccbf9a18bc4f2,True,False,,,,,0,1651274592,,0,{},i6q7ati,False,t3_ueya10,False,True,t3_ueya10,/r/UkraineConflict/comments/ueya10/russia_vs_ukraine_daily_update_april_29th/i6q7ati/,1651274605,1,True,True,False,UkraineConflict,t5_30oyx,r/UkraineConflict,public,,0,[],,1651245792.0
[],False,,Major_Boot2778,,,[],,,,text,t2_8rl984jv,False,False,"This is Russia. We made a mistake with Chechnya, Syria, Georgia. We made a mistake letting them keep their nukes in the first place. Fuck peace. That ship has sailed imo.",39a00a6716fc08cb8c27d2db29a5ff93e1a06128,True,False,,,,,0,1651274509,,0,{},i6q74bw,False,t3_uews7z,False,True,t3_uews7z,/r/UkraineConflict/comments/uews7z/how_us_can_aid_in_peaceful_resolution_to/i6q74bw/,1651274522,1,True,True,False,UkraineConflict,t5_30oyx,r/UkraineConflict,public,,0,[],,1651245709.0
[],False,,HeathersZen,,,[],,,,text,t2_c1lgl,False,False,You’re absolutely correct. Drones are the future of warfare and it’s terrifying to think of all of the ways they will be used — and even more terrifying to think of all the ways they will be *misused*.,ad1b5e98017b1c2a8d7fc7f06188d81c6fb89fea,True,False,,,,,0,1651274386,,0,{},i6q6uj4,False,t3_uelllp,False,True,t1_i6q4oq7,/r/UkraineConflict/comments/uelllp/apu_copters_delivered_the_package/i6q6uj4/,1651274404,1,True,True,False,UkraineConflict,t5_30oyx,r/UkraineConflict,public,,0,[],,1651245586.0
[],False,,redditspeedbot,,,[],,,,text,t2_4amoxp50,False,False,"Here is your video at 0.5x speed

https://gfycat.com/TimelyFatalFunnelweaverspider

^(I'm a bot | Summon with) ^""[/u/redditspeedbot](/u/redditspeedbot) ^&lt;speed&gt;"" ^| [^(Complete Guide)](https://www.reddit.com/user/redditspeedbot/comments/eqdo8u/redditspeedbot_guide) ^| ^(Do report bugs) ^[here](https://www.reddit.com/message/compose/?to=adityakrshnn&amp;subject=RedditSpeedBot%20Issue) ^| [^(Keep me alive)](https://www.buymeacoffee.com/redditspeedbot)",1cb30c8f07b29df3557df01fea79582bdd2438b8,True,False,,,,,0,1651274041,,0,{},i6q64am,False,t3_uen2u3,False,True,t1_i6q5vaf,/r/UkraineConflict/comments/uen2u3/youre_not_safe_anywhere_in_ukraine_buddy/i6q64am/,1651274054,1,True,True,False,UkraineConflict,t5_30oyx,r/UkraineConflict,public,,0,[],,1651245241.0
[],False,,sorin_d,,,[],,,,text,t2_lo9dvdm,False,False,u/redditspeedbot 0.5,fb1be14a4817f268aefaae00e3fe1f55075a6d65,True,False,,,,,0,1651273919,,0,{},i6q5vaf,False,t3_uen2u3,False,True,t3_uen2u3,/r/UkraineConflict/comments/uen2u3/youre_not_safe_anywhere_in_ukraine_buddy/i6q5vaf/,1651273934,1,True,True,False,UkraineConflict,t5_30oyx,r/UkraineConflict,public,,0,[],,1651245119.0
[],False,,sorin_d,,,[],,,,text,t2_lo9dvdm,False,False,Did some projectile hit him the face or was it an explosion next to him.,2b7d887f9a433c58113c073a850e33881db10d20,True,False,,,,,0,1651273766,,0,{},i6q5ju4,False,t3_uen2u3,False,True,t3_uen2u3,/r/UkraineConflict/comments/uen2u3/youre_not_safe_anywhere_in_ukraine_buddy/i6q5ju4/,1651273777,1,True,True,False,UkraineConflict,t5_30oyx,r/UkraineConflict,public,,0,[],,1651244966.0
[],False,,UnfairDetective2508,,,[],,,,text,t2_715n0269,False,False,"Odds are that best case scenario this war will go on for another year or two, and have knock-on effects for decades.",a6ebe388e89b1b59abf9c446a564d3948d654c9a,True,False,,,,,0,1651273563,,0,{},i6q54p3,False,t3_ue01jv,False,True,t1_i6ks2xb,/r/UkraineConflict/comments/ue01jv/the_cargo_ship_ysabel_of_the_spanish_navy_arrived/i6q54p3/,1651273578,1,True,True,False,UkraineConflict,t5_30oyx,r/UkraineConflict,public,,0,[],,1651244763.0
[],False,,LJAkaar67,,,[],,,,text,t2_6yp1uoxi,False,False,"I hear what you're saying, but drone delivered explosives will certainly becoming to street intersections, sporting events, schools, protests in the too near future

I am okay with the drone actions here because Ukraine, but all in all, drone warfare, swarm drone warfare, massively swarmed drone warfare, AI driven massively swarmed drone warfare and even the lone psychopathic terrorist deployed drone is going to give us a very difficult future",3109a15c944398e732f406b53cc4a924385146ea,True,False,,,,,0,1651273351,,0,{},i6q4oq7,False,t3_uelllp,False,True,t1_i6pw5sz,/r/UkraineConflict/comments/uelllp/apu_copters_delivered_the_package/i6q4oq7/,1651273363,1,True,True,False,UkraineConflict,t5_30oyx,r/UkraineConflict,public,,0,[],,1651244551.0
[],False,,chronic221987,,,[],,,,text,t2_7ot5fmuh,False,False,Looks like a chechen unit,378618dc77bed55f8128d5eb871b484f02b10451,True,False,,,,,0,1651272530,,0,{},i6q2z9a,False,t3_uen2u3,False,False,t1_i6onqro,/r/UkraineConflict/comments/uen2u3/youre_not_safe_anywhere_in_ukraine_buddy/i6q2z9a/,1651272546,1,True,True,False,UkraineConflict,t5_30oyx,r/UkraineConflict,public,,0,[],,1651243730.0
[],False,,Superb-Replacement35,,,[],,,,text,t2_kmpa7b9n,False,False,I remember having to pay $20.00 US to dispose of my last CRT tv... and to think.. these guys would have just taken it for free.,34200b1a89ae799178d2c5a0d1cd1ed2b9ce4d71,True,False,,,,,0,1651272101,,0,{},i6q22w4,False,t3_uepboi,False,True,t3_uepboi,/r/UkraineConflict/comments/uepboi/russian_invaders_removed_some_of_the_surviving/i6q22w4/,1651272114,1,True,True,False,UkraineConflict,t5_30oyx,r/UkraineConflict,public,,0,[],,1651243301.0
[],False,,Superb-Replacement35,,,[],,,,text,t2_kmpa7b9n,False,False,He's just such a pantload... I wish he would put the barrel in his mouth a get it over with already.,73907b47c74095ea82e7fb449550dad5cb51d1c3,True,False,,,,,0,1651271908,,0,{},i6q1o4j,False,t3_uem1o5,False,True,t3_uem1o5,/r/UkraineConflict/comments/uem1o5/vladimir_putin_could_declare_new_world_war_in/i6q1o4j/,1651271922,1,True,True,False,UkraineConflict,t5_30oyx,r/UkraineConflict,public,,0,[],,1651243108.0
[],False,,SomeJackassonline,,,[],,,,text,t2_95n6uqmp,False,False,"Weakest false flag ever.

I find it odd that the rockets hit the same room where a certain online journalist was held a couple weeks ago.",3fa7e53bb5c976a4de423d53cc4726a6573c982e,True,False,,,,,0,1651271767,,0,{},i6q1dk3,False,t3_uesnke,False,True,t3_uesnke,/r/UkraineConflict/comments/uesnke/cctv_imagery_of_attack_on_transnistrian_ministry/i6q1dk3/,1651271784,1,True,True,False,UkraineConflict,t5_30oyx,r/UkraineConflict,public,,0,[],,1651242967.0
[],False,,Superb-Replacement35,,,[],,,,text,t2_kmpa7b9n,False,False,"I guess it's like.. you talk shit.. you eat shit!
Not talking anymore is he.",016e9719c9ceaf3675f600aada5c48062a337776,True,False,,,,,0,1651271298,,0,{},i6q0dog,False,t3_uen2u3,False,True,t3_uen2u3,/r/UkraineConflict/comments/uen2u3/youre_not_safe_anywhere_in_ukraine_buddy/i6q0dog/,1651271313,1,True,True,False,UkraineConflict,t5_30oyx,r/UkraineConflict,public,,0,[],,1651242498.0
[],False,,Ill_Revolution_6887,,,[],,,,text,t2_hxtflee0,False,True,"HAHAHAHAHAHAHAHA
VIVA UKRAINE",a1953b1c7d07468e52756e84f31aab9349b4ec4b,True,False,,,,,0,1651270766,,0,{},i6pz8ty,False,t3_uen2u3,False,True,t3_uen2u3,/r/UkraineConflict/comments/uen2u3/youre_not_safe_anywhere_in_ukraine_buddy/i6pz8ty/,1651270779,1,True,True,False,UkraineConflict,t5_30oyx,r/UkraineConflict,public,,0,[],,1651241966.0
[],False,,GaskyAsky,,,[],,,,text,t2_k8ikx71t,False,False,"Do they ever have scientists on these Russian media shows?
Have they ever heard of the Jet Steam?
There are no nuclear weapons that don't elite deadly amounts of gamma, neutron, and ionizing radiation and then there is the nuclear winter.  Plants animals and human.. . A mass extinction event.",b22b39ca139ca00cdd0a80790a5b77a7fc95c7f9,True,False,,,,,0,1651270156,,0,{},i6pxy40,False,t3_ue41gw,False,True,t3_ue41gw,/r/UkraineConflict/comments/ue41gw/russian_tv_keeps_threatening_nuclear_strikes/i6pxy40/,1651270171,1,True,True,False,UkraineConflict,t5_30oyx,r/UkraineConflict,public,,0,[],,1651241356.0
[],False,,Asleep_Astronaut396,,,[],,,,text,t2_b6hc5hll,False,False,So Putin will have a problem or most just go and fight? I always thought the ones using vpn's was a small group and also just in the less poor regions.,aa4bb515c2decc6e2acd69f7174ea49543f1a68d,True,False,,,,,0,1651270110,,0,{},i6pxuj5,False,t3_uem1o5,False,True,t1_i6pvh14,/r/UkraineConflict/comments/uem1o5/vladimir_putin_could_declare_new_world_war_in/i6pxuj5/,1651270128,1,True,True,False,UkraineConflict,t5_30oyx,r/UkraineConflict,public,,0,[],,1651241310.0
[],False,,IAManAlcoholic164,,,[],,,,text,t2_ickkx0mb,False,False,Don’t let the media and social media fool you into thinking you and all your Loved ones will not die if there is a nuclear war. Russia has the largest nuclear arsenal with hypersonic rockets of which America doesn’t even have. Our anti missile defense will be useless against that. And even if only one detonates there will be total economic collapse leaving survivors even more unlucky than one who would be reduced to vapor and ashes from the initial blast. It will literally be hell on earth.,dea3c3cca004c2f010971b5e2ee57113af95f002,True,False,,,,,0,1651269804,,0,{},i6px6qv,False,t3_uem1o5,False,True,t1_i6pvj9x,/r/UkraineConflict/comments/uem1o5/vladimir_putin_could_declare_new_world_war_in/i6px6qv/,1651269821,1,True,True,False,UkraineConflict,t5_30oyx,r/UkraineConflict,public,,0,[],,1651241004.0
[],False,,HeathersZen,,,[],,,,text,t2_c1lgl,False,False,"That’s got to be incredibly demoralizing knowing that a hand grenade type of explosive can drop right on top of you at any given moment with no warning.

I hope they expand this program 1000 times over so that there are 1000 times more of these drones in the air over the orcs at any given moment.",735025dddb87a6e3276e350a8c7c468167336c69,True,False,,,,,0,1651269336,,0,{},i6pw5sz,False,t3_uelllp,False,True,t3_uelllp,/r/UkraineConflict/comments/uelllp/apu_copters_delivered_the_package/i6pw5sz/,1651269350,1,True,True,False,UkraineConflict,t5_30oyx,r/UkraineConflict,public,,0,[],,1651240536.0
[],False,,Zanders2J,,,[],,,,text,t2_1j97h3jw,False,False,"They have a terminal case of stupid, think we have the cure.",502fdde95df86c151f8a091c0a20e4bd3059f7bc,True,False,,,,,0,1651269303,,0,{},i6pw39p,False,t3_udrjmi,False,True,t3_udrjmi,/r/UkraineConflict/comments/udrjmi/brief_summary_of_russian_propaganda_world_war_iii/i6pw39p/,1651269314,1,True,True,False,UkraineConflict,t5_30oyx,r/UkraineConflict,public,,0,[],,1651240503.0
[],False,,dollhouse85746,,,[],,,,text,t2_35m9d75a,False,False,"A nuclear arsenal is only a threat until put to use. Once it is put to use, it better be nearly 100% effective and fully operational, not only to destroy the enemy but to secure from a second strike that will turn your country into a sea of glass. 

Putin: This will be WW3
NATO:  You feel lucky, punk?",0fde0aa9c4e425cb9eed872eff744cd91ec46770,True,False,,,,,0,1651269045,,0,{},i6pvj9x,False,t3_uem1o5,False,True,t1_i6otv50,/r/UkraineConflict/comments/uem1o5/vladimir_putin_could_declare_new_world_war_in/i6pvj9x/,1651269058,1,True,True,False,UkraineConflict,t5_30oyx,r/UkraineConflict,public,,0,[],,1651240245.0
[],False,,mshousekeeping,,,[],,,,text,t2_4r97vwcv,False,False,"Not true. My friend lives in Moscow, him and everyone he knows are aware of what’s going on. There’s also a push in local communities to use VPNs (which aren’t banned atm). The big cities are all like that, it’s the rural areas that are still extremely subject to state media control. 

Majority of Russia’s population know what’s happening, they just don’t have the energy to go in the streets and get immediately arrested (they tried early in the invasion). Remember many of the those in western Russia have relatives in Ukraine, belarus, the baltics etc. Information is a lot harder to control than propaganda would have you believe.",3f07ffd11dfa74f6f0f291f732b9346ae52d18a6,True,False,,,,,0,1651269017,,0,{},i6pvh14,False,t3_uem1o5,False,True,t1_i6of5pn,/r/UkraineConflict/comments/uem1o5/vladimir_putin_could_declare_new_world_war_in/i6pvh14/,1651269029,1,True,True,False,UkraineConflict,t5_30oyx,r/UkraineConflict,public,,0,[],,1651240217.0
[],False,,oldaliumfarmer,,,[],,,,text,t2_jcm2u2lm,False,False,Might as well say Kalingrad now sacred Polish land. It will be as soon as he messes with NATO.,7ff889a358afb7aadeeb963d0513d21d8615f347,True,False,,,,,0,1651267390,,0,{},i6prxmf,False,t3_uem1o5,False,True,t3_uem1o5,/r/UkraineConflict/comments/uem1o5/vladimir_putin_could_declare_new_world_war_in/i6prxmf/,1651267403,1,True,True,False,UkraineConflict,t5_30oyx,r/UkraineConflict,public,,0,[],,1651238590.0
[],False,,Individual_Break6067,,,[],,,,text,t2_78h2uyjz,False,False,I believe 300 is for the wounded,cef0473f8f224cc744732c3b2335e7d8f8699d80,True,False,,,,,0,1651267247,,0,{},i6prmal,False,t3_uen2u3,False,True,t1_i6onqro,/r/UkraineConflict/comments/uen2u3/youre_not_safe_anywhere_in_ukraine_buddy/i6prmal/,1651267258,1,True,True,False,UkraineConflict,t5_30oyx,r/UkraineConflict,public,,0,[],,1651238447.0
[],False,,WorthTheBansSlavaUA,,,[],,,,text,t2_lp2e1bfs,False,False,"LOL ""I declare a 3rd world war"" umm okay..",24d48a2f93615c701b536ba80a518c689cde0f14,True,False,,,,,0,1651267205,,0,{},i6prisz,False,t3_uem1o5,False,False,t3_uem1o5,/r/UkraineConflict/comments/uem1o5/vladimir_putin_could_declare_new_world_war_in/i6prisz/,1651267221,1,True,True,False,UkraineConflict,t5_30oyx,r/UkraineConflict,public,,0,[],,1651238405.0
[],False,,us3rnam3andpassword,,,[],,,,text,t2_62gaq76k,False,False,Great. I love this for us.,b03a989cd912731c6d64c5d7f06228d3b2701ddc,True,False,,,,,0,1651267131,,0,{},i6prcur,False,t3_uem1o5,False,False,t3_uem1o5,/r/UkraineConflict/comments/uem1o5/vladimir_putin_could_declare_new_world_war_in/i6prcur/,1651267147,1,True,True,False,UkraineConflict,t5_30oyx,r/UkraineConflict,public,,0,[],,1651238331.0
[],False,,MrSchaudenfreude,,,[],,,,text,t2_4don69pl,False,False,Thanks,97cba4858411c435e526dd651157aac20178222c,True,False,,,,,0,1651266426,,0,{},i6ppter,False,t3_ueigkh,False,True,t1_i6oy6ah,/r/UkraineConflict/comments/ueigkh/ukraine_says_russia_taking_colossal_losses_in/i6ppter/,1651266440,1,True,True,False,UkraineConflict,t5_30oyx,r/UkraineConflict,public,,0,[],,1651237626.0
[],False,,SnooTangerines3448,,,[],,,,text,t2_2olbkoi8,False,False,"Yes, again. Until they learn.",56be8b936ee67c559549c80e17b62ee802e34a8b,True,False,,,,,0,1651266422,,0,{},i6ppt4j,False,t3_uem1o5,False,True,t1_i6pmjy4,/r/UkraineConflict/comments/uem1o5/vladimir_putin_could_declare_new_world_war_in/i6ppt4j/,1651266433,1,True,True,False,UkraineConflict,t5_30oyx,r/UkraineConflict,public,,0,[],,1651237622.0
[],False,,Charming_Arugula_313,,,[],,,,text,t2_anmbkfk5,False,False,I counted 7 plus a dog,83acdc7e5f491ad1b8baaf95cf6956612f186ebd,True,False,,,,,0,1651266311,,0,{},i6ppkfm,False,t3_uelllp,False,True,t1_i6ou26q,/r/UkraineConflict/comments/uelllp/apu_copters_delivered_the_package/i6ppkfm/,1651266325,1,True,True,False,UkraineConflict,t5_30oyx,r/UkraineConflict,public,,0,[],,1651237511.0
[],False,,Charming_Arugula_313,,,[],,,,text,t2_anmbkfk5,False,False,definitely more than 2 people. I believe they heard the drone but couldnt tell from where,17f773d2ace264fb1d130599b057de69075f276f,True,False,,,,,0,1651266253,,0,{},i6ppfqp,False,t3_uelllp,False,True,t1_i6ou26q,/r/UkraineConflict/comments/uelllp/apu_copters_delivered_the_package/i6ppfqp/,1651266272,1,True,True,False,UkraineConflict,t5_30oyx,r/UkraineConflict,public,,0,[],,1651237453.0
[],False,,SomeJackassonline,,,[],,,,text,t2_95n6uqmp,False,False,"I have immediate family that worked for a reputable newspaper and were high up in its ranks.

One thing I have learned is that many outlets will publish articles intended to do nothing but stir people up to generate revenue.

This is one of these articles.

Putin is a piece of shit, extremely immoral, probably not a human being (at least I don’t consider him one), possibly a pedophile, and of questionable intelligence. 

That said as long as he has children living abroad, he isn’t going to use nukes.",30a154aef3bb0091ba894b457b1d69ba40bbbc0c,True,False,,,,,0,1651265872,,0,{},i6polbm,False,t3_uem1o5,False,True,t3_uem1o5,/r/UkraineConflict/comments/uem1o5/vladimir_putin_could_declare_new_world_war_in/i6polbm/,1651265884,1,True,True,False,UkraineConflict,t5_30oyx,r/UkraineConflict,public,,0,[],,1651237072.0
[],False,,TheWelshOne83,,,[],,,,text,t2_1d37ifp8,False,False,"Can't believe how easy the ruzzkis make themselves look like a target with a huge giving Z in their vehicle, fucking fun asses.",33821204a3b10a59830b3d673b529bfd1fc0f758,True,False,,,,,0,1651265286,,0,{},i6pna23,False,t3_uelllp,False,True,t3_uelllp,/r/UkraineConflict/comments/uelllp/apu_copters_delivered_the_package/i6pna23/,1651265319,1,True,True,False,UkraineConflict,t5_30oyx,r/UkraineConflict,public,,0,[],,1651236486.0
[],False,,TheWelshOne83,,,[],,,,text,t2_1d37ifp8,False,False,Humanity is due a reset. Lol,22037bd159d769ef8c4f5908298e95768f15f525,True,False,,,,,0,1651264964,,0,{},i6pmjy4,False,t3_uem1o5,False,True,t1_i6ovlco,/r/UkraineConflict/comments/uem1o5/vladimir_putin_could_declare_new_world_war_in/i6pmjy4/,1651264979,1,True,True,False,UkraineConflict,t5_30oyx,r/UkraineConflict,public,,0,[],,1651236164.0
[],False,,Potatoesupmyassxxx,,,[],,,,text,t2_iwknqb11,False,False,What's the kill radius on these things? Thought it was at least 5 meters but they seem to be fine,960843e7857fc2907cc0f8be8a3efaa0a6098fe8,True,False,,,,,0,1651264711,,0,{},i6plz7h,False,t3_uelllp,False,True,t3_uelllp,/r/UkraineConflict/comments/uelllp/apu_copters_delivered_the_package/i6plz7h/,1651264723,1,True,True,False,UkraineConflict,t5_30oyx,r/UkraineConflict,public,,0,[],,1651235911.0
[],False,,Serpico2,,,[],,,,text,t2_10exi1,False,False,"What am I watching here, are the Ukrainians or Russians being destroyed?",3260aef7037c5f35a8a9d28ea69711ff9d168b2c,True,False,,,,,0,1651264402,,0,{},i6pl9ot,False,t3_uejmur,False,True,t3_uejmur,/r/UkraineConflict/comments/uejmur/soldiers_of_the_armed_forces_of_ukraine_in_the/i6pl9ot/,1651264420,1,True,True,False,UkraineConflict,t5_30oyx,r/UkraineConflict,public,,0,[],,1651235602.0
[],False,,tallone1982,,,[],,,,text,t2_k1fwol7f,False,False,"A Ukrain kiss of (hopefully very slow) death for this russian orc... 

Slava Ukraini! 🇺🇦🇺🇦🇺🇦👊🏻👊🏻👊🏻🇺🇦🇺🇦🇺🇦",41b872cbed1b190765c6a1d0fc2dbc599e5701fb,True,False,,,,,0,1651264380,,0,{},i6pl7un,False,t3_uen2u3,False,True,t3_uen2u3,/r/UkraineConflict/comments/uen2u3/youre_not_safe_anywhere_in_ukraine_buddy/i6pl7un/,1651264398,1,True,True,False,UkraineConflict,t5_30oyx,r/UkraineConflict,public,,0,[],,1651235580.0
[],False,,blynott,,,[],,,,text,t2_ek9wh,False,False,That made me smile,e6b0778e9cb61292bb96b5dbfa690bf5bb70529a,True,False,,,,,0,1651263835,,0,{},i6pjz4h,False,t3_uen2u3,False,True,t3_uen2u3,/r/UkraineConflict/comments/uen2u3/youre_not_safe_anywhere_in_ukraine_buddy/i6pjz4h/,1651263845,1,True,True,False,UkraineConflict,t5_30oyx,r/UkraineConflict,public,,0,[],,1651235035.0
[],False,,elaintahra,,,[],,,,text,t2_ek5v6,False,False,"""Light up""?",ae594e803e2ecab354ba26f5be2eb7814276d7a3,True,False,,,,,0,1651263686,,0,{},i6pjmz4,False,t3_uejmur,False,True,t1_i6p3k1k,/r/UkraineConflict/comments/uejmur/soldiers_of_the_armed_forces_of_ukraine_in_the/i6pjmz4/,1651263705,1,True,True,False,UkraineConflict,t5_30oyx,r/UkraineConflict,public,,0,[],,1651234886.0
[],False,,no-straight-lines,,,[],,,,text,t2_m4zar8sc,False,False,"[*Where are you from*, Probass Hardi](https://www.youtube.com/watch?v=BvgNgTPTkSo)",fd8ed2c64da1aa72ad6109a5643304c65f819560,True,False,,,,,0,1651263571,,0,{},i6pjdlh,False,t3_uejmur,False,True,t1_i6p3k1k,/r/UkraineConflict/comments/uejmur/soldiers_of_the_armed_forces_of_ukraine_in_the/i6pjdlh/,1651263588,1,True,True,False,UkraineConflict,t5_30oyx,r/UkraineConflict,public,,0,[],,1651234771.0
[],False,,Fvlad13,,,[],,,,text,t2_k2q4solk,False,False,He was live 😂😂😂🤣🤣🤣🤣,d4ce9be049f0b5d0b138717bc8bdb9ad1c3a2001,True,False,,,,,0,1651262975,,0,{},i6pi07w,False,t3_uen2u3,False,True,t1_i6on644,/r/UkraineConflict/comments/uen2u3/youre_not_safe_anywhere_in_ukraine_buddy/i6pi07w/,1651262989,1,True,True,False,UkraineConflict,t5_30oyx,r/UkraineConflict,public,,0,[],,1651234175.0
[],False,,Fvlad13,,,[],,,,text,t2_k2q4solk,False,False,Add a couple of 200s...,97ecf43c054792595f92c69712046e18a07aadbc,True,False,,,,,0,1651262956,,0,{},i6phymj,False,t3_uen2u3,False,True,t1_i6p961i,/r/UkraineConflict/comments/uen2u3/youre_not_safe_anywhere_in_ukraine_buddy/i6phymj/,1651262975,1,True,True,False,UkraineConflict,t5_30oyx,r/UkraineConflict,public,,0,[],,1651234156.0
[],False,,kpapenbe,,,[],,,,text,t2_ixf7ljmz,False,False,Got it....yea....nothing more than pawns in his game....so sad....,bf51e8fb9a62b769fb8fd49c7a0d3c7f24b4869f,True,False,,,,,0,1651262314,,0,{},i6pggs9,True,t3_uehttn,False,True,t1_i6pg0th,/r/UkraineConflict/comments/uehttn/minute_200_i_think_he_tees_it_up_pretty_well_and/i6pggs9/,1651262330,1,True,True,False,UkraineConflict,t5_30oyx,r/UkraineConflict,public,,0,[],,1651233514.0
[],False,,Asleep_Astronaut396,,,[],,,,text,t2_b6hc5hll,False,False,I mean sacrificing them like he did to so many in Ukraine.,2ba32afc027c1a5f6fcefcc9a5983827e447bd10,True,False,,,,,0,1651262122,,0,{},i6pg0th,False,t3_uehttn,False,True,t1_i6penud,/r/UkraineConflict/comments/uehttn/minute_200_i_think_he_tees_it_up_pretty_well_and/i6pg0th/,1651262134,1,True,True,False,UkraineConflict,t5_30oyx,r/UkraineConflict,public,,0,[],,1651233322.0
[],False,,schmedit67,,,[],,,,text,t2_4ghvdjao,False,False,American Public University is operating tactical drones for Ukraine?!,0b3612f271eb1c42163149fbb5701de48fa1bc4b,True,False,,,,,0,1651261563,,0,{},i6pepmd,False,t3_uelllp,False,True,t3_uelllp,/r/UkraineConflict/comments/uelllp/apu_copters_delivered_the_package/i6pepmd/,1651261575,1,True,True,False,UkraineConflict,t5_30oyx,r/UkraineConflict,public,,0,[],,1651232763.0
[],False,,kpapenbe,,,[],,,,text,t2_ixf7ljmz,False,False,Putin has other plans?  Such as.......going nuclear?,77801bedc7eb575131bfd0e34be71c96c7f53480,True,False,,,,,0,1651261542,,0,{},i6penud,True,t3_uehttn,False,True,t1_i6pal4o,/r/UkraineConflict/comments/uehttn/minute_200_i_think_he_tees_it_up_pretty_well_and/i6penud/,1651261554,1,True,True,False,UkraineConflict,t5_30oyx,r/UkraineConflict,public,,0,[],,1651232742.0
[],False,,kpapenbe,,,[],,,,text,t2_ixf7ljmz,False,False,"Thank you so much for the recommendation, but somehow Russia proves itself a sort of zombie...it just keeps coming back from the dead!  We all thought Afghan would be the nail in the coffin then Chechnya/Grozni and, of course, their aging/declining population, but I don't know....they've come back from the dead time and time again....just a matter of how long until they need a rest!",a672cec2be4247c001c082e0cb3985bc21b203e9,True,False,,,,,0,1651261478,,0,{},i6peina,True,t3_uehuet,False,True,t1_i6p7ixk,/r/UkraineConflict/comments/uehuet/do_we_agree_that_russia_is_bogged_down_in_a_slog/i6peina/,1651261527,1,True,True,False,UkraineConflict,t5_30oyx,r/UkraineConflict,public,,0,[],,1651232678.0
[],False,,Cheif-of-the-mudkips,,,[],,,,text,t2_3x4l6rib,False,False,Is he ok? Cause if not I want to finish the job,bb23e326ebd124dde6ada7fba0f019c87497e9c1,True,False,,,,,0,1651261175,,0,{},i6pdtob,False,t3_uen2u3,False,True,t3_uen2u3,/r/UkraineConflict/comments/uen2u3/youre_not_safe_anywhere_in_ukraine_buddy/i6pdtob/,1651261189,1,True,True,False,UkraineConflict,t5_30oyx,r/UkraineConflict,public,,0,[],,1651232375.0
