all_awardings,archived,associated_award,author,author_flair_background_color,author_flair_css_class,author_flair_richtext,author_flair_template_id,author_flair_text,author_flair_text_color,author_flair_type,author_fullname,author_patreon_flair,author_premium,body,body_sha1,can_gild,collapsed,collapsed_because_crowd_control,collapsed_reason,collapsed_reason_code,comment_type,controversiality,created_utc,distinguished,gilded,gildings,id,is_submitter,link_id,locked,no_follow,parent_id,permalink,retrieved_utc,score,score_hidden,send_replies,stickied,subreddit,subreddit_id,subreddit_name_prefixed,subreddit_type,top_awarded_type,total_awards_received,treatment_tags,unrepliable_reason,created
[],False,,Puzzled_Draw6014,,,[],,,,text,t2_a2284akx,False,False,"Thanks for opening this discussion, I have also been wondering about the same things. 

Ukraine has been putting up a strong defence. I get concerned about whether they will become too tired or depleted to continue. Eventually, the new recruits and new equipment will bolster the defence. Hopefully they are sufficiently trained and prepared. I think that the current forces are doing some strategic retreats so that they can fight back harder later. In the long run, I don't see how Russia can win the war.

I am most concerned at how a certain cornered rat is going to react when he realises that defeat is inevitable. I just hope that either a coup or a popular uprising happens sooner. The central bank in Russia has reported that they can no longer prop up the economy. Russian struggles are going to grow in the coming months... so I am hoping the rest of Russia sees this and put out some rat poison.",2ec03ae726027031b80273dd439e78a7b92b4c17,True,False,,,,,0,1651252295,,0,{},i6ospq7,False,t3_uehuet,False,True,t3_uehuet,/r/UkraineConflict/comments/uehuet/do_we_agree_that_russia_is_bogged_down_in_a_slog/i6ospq7/,1651252312,1,True,True,False,UkraineConflict,t5_30oyx,r/UkraineConflict,public,,0,[],,1651223495.0
[],False,,Embarrassed_Army8026,,,[],,,,text,t2_86bsxzo6,False,False,"Don't mind the troops, they are on their way to protect the ~~Sudeten-Germans~~ Transnustrian Russians and merely passing by!",eca75bf21f2fcbd7cd4440c44d7031e058815cd9,True,False,,,,,0,1651252281,,0,{},i6osogx,False,t3_ue00zu,False,True,t1_i6ohsmf,/r/UkraineConflict/comments/ue00zu/president_putin_warns_of_lightningfast/i6osogx/,1651252297,1,True,True,False,UkraineConflict,t5_30oyx,r/UkraineConflict,public,,0,[],,1651223481.0
[],False,,NinjaCow1,,,[],,,,text,t2_b12ch1yf,False,False,"Whether they “hear it,” or not, they know it’s part of the operating theater. So, they’re going to storm out of a vehicle and run for cover because of the potential threat.",274bf2cdcde1832e105f98ca8649a87bcf1a4eca,True,False,,,,,0,1651252199,,0,{},i6osh3r,False,t3_uelllp,False,True,t1_i6oh91b,/r/UkraineConflict/comments/uelllp/apu_copters_delivered_the_package/i6osh3r/,1651252214,1,True,True,False,UkraineConflict,t5_30oyx,r/UkraineConflict,public,,0,[],,1651223399.0
[],False,,KataqNarayan,,,[],,,,text,t2_qu2cb,False,False,"I’m a little surprised they can’t hear it, but it’s possible they were making enough noise on the ground that they didn’t. I’ve flown quite a few different types of drones up to around 150m (the legal limit in my country) and they are quite audible even at this height. But yes, if they are making enough noise on the ground then it can go undetected.",fabc19ce7a9166e3981a14c759010fd998dd0a5f,True,False,,,,,0,1651252176,,0,{},i6osewn,False,t3_uelllp,False,True,t1_i6oies8,/r/UkraineConflict/comments/uelllp/apu_copters_delivered_the_package/i6osewn/,1651252192,1,True,True,False,UkraineConflict,t5_30oyx,r/UkraineConflict,public,,0,[],,1651223376.0
[],False,,Cane-toads-suck,,,[],,,,text,t2_q9zzjqd,False,False,"There are *far* more than two running! When it zooms down, looks like seven plus folk run toward the top of the screen and the dude scrambles from the car and runs the other way with another guy",089fd9162895d2f7036fef43eabc072061814e7b,True,False,,,,,0,1651252154,,0,{},i6osd08,False,t3_uelllp,False,True,t1_i6oq531,/r/UkraineConflict/comments/uelllp/apu_copters_delivered_the_package/i6osd08/,1651252170,1,True,True,False,UkraineConflict,t5_30oyx,r/UkraineConflict,public,,0,[],,1651223354.0
[],False,,johndenverauthor,,,[],,,,text,t2_9dnsmt3w,False,False,The Russians will never suspect it…,65ed64bab868ef9c7813991f1a5018ddd89a3b74,True,False,,,,,0,1651252065,,0,{},i6os4wd,False,t3_ue01jv,False,True,t1_i6lp0t7,/r/UkraineConflict/comments/ue01jv/the_cargo_ship_ysabel_of_the_spanish_navy_arrived/i6os4wd/,1651252078,1,True,True,False,UkraineConflict,t5_30oyx,r/UkraineConflict,public,,0,[],,1651223265.0
[],False,,[deleted],,,,,,dark,,,,,[removed],fe993932d6dced4c0a879e9aa5d7a6e0fbb467f5,True,False,,,,,0,1651251604,,0,{},i6oqzuu,False,t3_ueiso9,False,True,t3_ueiso9,/r/UkraineConflict/comments/ueiso9/azov_shot_a_stupid_russian_in_mariupol_near/i6oqzuu/,1651251618,1,True,True,False,UkraineConflict,t5_30oyx,r/UkraineConflict,public,,0,[],,1651222804.0
[],False,,GenitalJouster,,,[],,,,text,t2_12h4nw,False,False,"Nah. I think nobody was aware of it. Guy was just trying to pick up something from that pile of whatever it is. 

The 2 people running make it seem like they knew it was coming but if you look more closely most people don't flinch before the boom. The 2 runners are probably coincidental and the guy you think is trying to pick up the bomb was just doing something else entirely and unaware a bomb was dropping next to him.",4f40863dfc46584438b4f12b999c3a72905510f0,True,False,,,,,0,1651251579,,0,{},i6oqxld,False,t3_uelllp,False,True,t1_i6o02ct,/r/UkraineConflict/comments/uelllp/apu_copters_delivered_the_package/i6oqxld/,1651251596,1,True,True,False,UkraineConflict,t5_30oyx,r/UkraineConflict,public,,0,[],,1651222779.0
[],False,,NewDistrict6824,,,[],,,,text,t2_kd2n1evi,False,False,"This is a silly article when there doesn’t appear to be any evidence to support the statement.  You could just as easily l write “Putin not to declare new world war in days”; it would be equally valid. There is nothing to back it up, and if there is, where is the evidence?

If Putin was so stupid (entirely possible given what he’s done so far) as to declare World War III what does that mean? Frankly it means nothing unless Russia declares war on another state or group of states, or takes action against states that would be indicative of being at war. The only other option possibly, is that Putin declares war on Ukraine, basically changing an SMO to a war, which might allow national call up and moving nuclear alert up, for examples.

Putin has run out of options. He’s at the point of strategic dilemma… go on, escalate, or retreat. My money is on escalate.",0e603d5e1716337bf3c790eeeb31cacc54620abe,True,False,,,,,0,1651251460,,0,{},i6oqmxn,False,t3_uem1o5,False,True,t3_uem1o5,/r/UkraineConflict/comments/uem1o5/vladimir_putin_could_declare_new_world_war_in/i6oqmxn/,1651251474,1,True,True,False,UkraineConflict,t5_30oyx,r/UkraineConflict,public,,0,[],,1651222660.0
[],False,,GenitalJouster,,,[],,,,text,t2_12h4nw,False,False,"First watch I thought the same but I'm increasingly unsure if they're aware before it goes off.

There are I think 2 guys running/slow sprinting but that might just be coincidental (have to take a piss really urgently)",9e73863af15ede701e1b0bf251ee736425a963a9,True,False,,,,,0,1651251260,,0,{},i6oq531,False,t3_uelllp,False,True,t1_i6oh91b,/r/UkraineConflict/comments/uelllp/apu_copters_delivered_the_package/i6oq531/,1651251271,1,True,True,False,UkraineConflict,t5_30oyx,r/UkraineConflict,public,,0,[],,1651222460.0
[],False,,Aoxmodeus,,,[],,,,text,t2_6gr8b,False,False,"One can only hope, that if it exists, that is their destination.",cfcd9a5bf1ef850b3decf4d677e5c800ae9dcfb4,True,False,,,,,0,1651251207,,0,{},i6oq0dw,False,t3_uelllp,False,True,t1_i6nytc4,/r/UkraineConflict/comments/uelllp/apu_copters_delivered_the_package/i6oq0dw/,1651251218,1,True,True,False,UkraineConflict,t5_30oyx,r/UkraineConflict,public,,0,[],,1651222407.0
[],False,,[deleted],,,,,,dark,,,,,[removed],fe993932d6dced4c0a879e9aa5d7a6e0fbb467f5,True,False,,,,,0,1651250659,,0,{},i6oon5m,False,t3_uephd5,False,True,t3_uephd5,/r/UkraineConflict/comments/uephd5/ukraine_war_news_relatives_say_former_us_marine/i6oon5m/,1651250671,1,True,True,False,UkraineConflict,t5_30oyx,r/UkraineConflict,public,,0,[],,1651221859.0
[],False,,Dubanx,,,[],,,,text,t2_613y4,False,False,"and? 

There's literally zero reason for them to require an app except to sell your information.",68cc5dba5a994c399422d0d884a9228aff00e7d9,True,False,,,,,0,1651250485,,0,{},i6oo7fp,False,t3_ueigkh,False,True,t1_i6onp9l,/r/UkraineConflict/comments/ueigkh/ukraine_says_russia_taking_colossal_losses_in/i6oo7fp/,1651250495,1,True,True,False,UkraineConflict,t5_30oyx,r/UkraineConflict,public,,0,[],,1651221685.0
[],False,,AnonymousWritings,,,[],,,,text,t2_itwof,False,False,Open it in incognito mode.,fe213587d69ff4e71337fa34f70af298c7809d0f,True,False,,,,,0,1651250384,,0,{},i6onyd1,False,t3_ueigkh,False,True,t1_i6oivgd,/r/UkraineConflict/comments/ueigkh/ukraine_says_russia_taking_colossal_losses_in/i6onyd1/,1651250398,1,True,True,False,UkraineConflict,t5_30oyx,r/UkraineConflict,public,,0,[],,1651221584.0
[],False,,ThankuConan,,,[],,,,text,t2_20zyq0uq,False,False,What could they possibly loot from the ocean?,198e1a91eddf1d943d4a89d301fdaf0a5cf655aa,True,False,,,,,0,1651250374,,0,{},i6onxkh,False,t3_ueo1an,False,True,t3_ueo1an,/r/UkraineConflict/comments/ueo1an/russia_is_using_dolphins_to_protect_the_black_sea/i6onxkh/,1651250391,1,True,True,False,UkraineConflict,t5_30oyx,r/UkraineConflict,public,,0,[],,1651221574.0
[],False,,dariy16,,,[],,,,text,t2_btt5n94,False,False,Yes. They are. 300 is the code used by Russians when they survive a battle. 200 is a dead man.,39c5fc6d4e11b229bc0a1ab81c575402a5f9b75b,True,False,,,,,0,1651250300,,0,{},i6onqro,False,t3_uen2u3,False,True,t1_i6oht13,/r/UkraineConflict/comments/uen2u3/youre_not_safe_anywhere_in_ukraine_buddy/i6onqro/,1651250318,1,True,True,False,UkraineConflict,t5_30oyx,r/UkraineConflict,public,,0,[],,1651221500.0
[],False,,Motor-Ad-8858,,,[],,,,text,t2_dbbfvtmx,False,False,This reply was to Darwin.,fd808fe4c117f596bb3e8d49656eb30c7576e9b3,True,False,,,,,0,1651250282,,0,{},i6onp9l,True,t3_ueigkh,False,True,t1_i6on5xi,/r/UkraineConflict/comments/ueigkh/ukraine_says_russia_taking_colossal_losses_in/i6onp9l/,1651250295,1,True,True,False,UkraineConflict,t5_30oyx,r/UkraineConflict,public,,0,[],,1651221482.0
[],False,,OkFisherman1620,,,[],,,,text,t2_k5mb3x3r,False,False,"The only thing he has left are the nukes in which case no one wins so I basically think he’s talking out of his ass….
He is so fucked, can’t wait for them to hang his ass off one of those big old statues of Stalin",77b86d854195a5e8d7bccf5f10559e841f6e8524,True,False,,,,,0,1651250146,,0,{},i6ond5m,False,t3_ue00zu,False,True,t3_ue00zu,/r/UkraineConflict/comments/ue00zu/president_putin_warns_of_lightningfast/i6ond5m/,1651250160,1,True,True,False,UkraineConflict,t5_30oyx,r/UkraineConflict,public,,0,[],,1651221346.0
[],False,,Asleep_Astronaut396,,,[],,,,text,t2_b6hc5hll,False,False,Is he live streaming or did a buddy really upload his comrades bang?,748c79f64f56fe6b8f22c1ecbb9550e42e29b0c2,True,False,,,,,0,1651250069,,0,{},i6on644,False,t3_uen2u3,False,True,t3_uen2u3,/r/UkraineConflict/comments/uen2u3/youre_not_safe_anywhere_in_ukraine_buddy/i6on644/,1651250084,1,True,True,False,UkraineConflict,t5_30oyx,r/UkraineConflict,public,,0,[],,1651221269.0
[],False,,Dubanx,,,[],,,,text,t2_613y4,False,False,"Ill pass on the spyware, thanks.",476c302cd30ef2a7e473112b096bb8c20127a70f,True,False,,,,,0,1651250067,,0,{},i6on5xi,False,t3_ueigkh,False,True,t1_i6oj2c2,/r/UkraineConflict/comments/ueigkh/ukraine_says_russia_taking_colossal_losses_in/i6on5xi/,1651250084,1,True,True,False,UkraineConflict,t5_30oyx,r/UkraineConflict,public,,0,[],,1651221267.0
[],False,,kpapenbe,,,[],,,,text,t2_ixf7ljmz,False,False,"Oh I'm so glad you had a laugh at the clip....it's an awful legacy for sure, but I'm German by heritage and get it as much as I can (living in Moldova at the moment) and trust you me we've paid all our gas bills (in rubles).",34cd8ea123897475569b35e43b84be134ba19852,True,False,,,,,0,1651249922,,0,{},i6omt12,True,t3_uehuet,False,True,t1_i6oi1be,/r/UkraineConflict/comments/uehuet/do_we_agree_that_russia_is_bogged_down_in_a_slog/i6omt12/,1651249940,1,True,True,False,UkraineConflict,t5_30oyx,r/UkraineConflict,public,,0,[],,1651221122.0
[],False,,Sad_Bad_7920,,,[],,,,text,t2_7v6f8ixt,False,False,The Russian Mafia is dying a slow merciful death at the hands of Ukraine! Rock on Ukraine!,36cabdb36e27351d5ea5974651146b440f34c753,True,False,,,,,0,1651249845,,0,{},i6omm2a,False,t3_udz8i0,False,False,t1_i6kxhog,/r/UkraineConflict/comments/udz8i0/the_missile_attacks_on_bryansk_belgorod_and_other/i6omm2a/,1651249865,1,True,True,False,UkraineConflict,t5_30oyx,r/UkraineConflict,public,,0,[],,1651221045.0
[],False,,Ukraine_News_Bot,,,[],,,,text,t2_klp2hk59,False,False,"Reminder to respect UKR op-sec by not sharing videos of UKR soldier locations or any other such classified intelligence you discover or witness online.

https://reddit.com/r/ukraine/comments/sy65wi/ministry_of_defense_of_ukraine_do_not_view_our/

News Sources: https://www.reddit.com/user/Ukraine_News_Bot/comments/tnadz3/news_sources/

Godspeed Ukrainians. 💙💛

Ways to help Ukraine (charities) https://reddit.com/r/ukraine/comments/s6g5un/want_to_support_ukraine_heres_a_list_of_charities/

Please message me if there are any translation errors, typos, or dead links.

This comment was made by a bot. Original comment from iamkunii on r/worldnews",8998b0c1bcdee8746c37461483bccbf9a18bc4f2,True,False,,,,,0,1651249687,,0,{},i6om7y3,False,t3_uepoqv,False,True,t3_uepoqv,/r/UkraineConflict/comments/uepoqv/ukraine_slams_kyiv_attack_amid_new_mariupol/i6om7y3/,1651249704,1,True,True,False,UkraineConflict,t5_30oyx,r/UkraineConflict,public,,0,[],,1651220887.0
[],False,,knowledge_truth,,,[],,,,text,t2_bimjfhgn,False,False,It is and Really Brave.,f5db349297763d7474ff4f20c9c579a1eb958e1b,True,False,,,,,0,1651249597,,0,{},i6olzz9,True,t3_uda4x1,False,True,t3_uda4x1,/r/UkraineConflict/comments/uda4x1/ukrainian_aircraft_mig29_taking_off_during/i6olzz9/,1651249614,1,True,True,False,UkraineConflict,t5_30oyx,r/UkraineConflict,public,,0,[],,1651220797.0
[],False,,Sbeast,,,[],,,,text,t2_4k4q4,False,False,I guess that's one of the benefits.,f6fe72ac8dbbc6fb53fda77dd06c393f49a9529c,True,False,,,,,0,1651249419,,0,{},i6olk6h,False,t3_ue41gw,False,True,t1_i6nufk8,/r/UkraineConflict/comments/ue41gw/russian_tv_keeps_threatening_nuclear_strikes/i6olk6h/,1651249437,1,True,True,False,UkraineConflict,t5_30oyx,r/UkraineConflict,public,,0,[],,1651220619.0
[],False,,Tairaa90,,,[],,,,text,t2_5hnm8m0,False,False,Not what you're supposed to do In  this situation. At least according to our doctrine.,bdfbd88ba971a1b01b82000c78a204c1946211d6,True,False,,,,,0,1651249325,,0,{},i6olbua,False,t3_ueiso9,False,True,t1_i6nux4c,/r/UkraineConflict/comments/ueiso9/azov_shot_a_stupid_russian_in_mariupol_near/i6olbua/,1651249338,1,True,True,False,UkraineConflict,t5_30oyx,r/UkraineConflict,public,,0,[],,1651220525.0
[],False,,superanth,,,[],,,,text,t2_33k8u,False,False,That is a very cool looking ship!,71b09d040e3e25dbc7e63cab447bcc83959b3a69,True,False,,,,,0,1651249219,,0,{},i6ol2cl,False,t3_ue01jv,False,True,t3_ue01jv,/r/UkraineConflict/comments/ue01jv/the_cargo_ship_ysabel_of_the_spanish_navy_arrived/i6ol2cl/,1651249233,1,True,True,False,UkraineConflict,t5_30oyx,r/UkraineConflict,public,,0,[],,1651220419.0
[],False,,Abdul_Wahab_1810,#ff66ac,,[],f60e8e14-b5c8-11ec-b08d-8e5399c45361,Complete Idiot-Ignore Me,dark,text,t2_9j1jlzr3,False,False,"Both sides have been mauled badly. Russia’s main problems are manpower shortages, precise weapon shortages and untrained personnel. Ukraine’s problem are logistical issues, damaged or destroyed infrastructures such as roads, railways and bridges. This is basically a war of attrition which suits Russia more but Russia takes majority of the losses. Check out HistoryLegends on YouTube on his analysis on the battlefield.",130311970742b646739351965aeb660befec3387,True,False,,,,,0,1651249170,,0,{},i6okxsk,False,t3_ueigkh,False,True,t1_i6oe890,/r/UkraineConflict/comments/ueigkh/ukraine_says_russia_taking_colossal_losses_in/i6okxsk/,1651249189,1,True,True,False,UkraineConflict,t5_30oyx,r/UkraineConflict,public,,0,[],,1651220370.0
[],False,,Sandy10202,,,[],,,,text,t2_6zfaute7,False,False,With what army?,211d8a4f46eec74fd224475ac9ea95f5d4eb9b58,True,False,,,,,0,1651248918,,0,{},i6okbh0,False,t3_uem1o5,False,True,t3_uem1o5,/r/UkraineConflict/comments/uem1o5/vladimir_putin_could_declare_new_world_war_in/i6okbh0/,1651248936,1,True,True,False,UkraineConflict,t5_30oyx,r/UkraineConflict,public,,0,[],,1651220118.0
[],False,,RevolutionaryBite555,,,[],,,,text,t2_9pfwmlrd,False,False,We need a game over tag at the end,ffd903757d63a078ab11966845a96e9936735d29,True,False,,,,,0,1651248831,,0,{},i6ok3x5,False,t3_uen2u3,False,True,t3_uen2u3,/r/UkraineConflict/comments/uen2u3/youre_not_safe_anywhere_in_ukraine_buddy/i6ok3x5/,1651248845,1,True,True,False,UkraineConflict,t5_30oyx,r/UkraineConflict,public,,0,[],,1651220031.0
[],False,,Motor-Ad-8858,,,[],,,,text,t2_dbbfvtmx,False,False,Down load the free app on your smart phone.,37eb12f466814f5375497d15d99db7a5d83bcfe9,True,False,,,,,0,1651248405,,0,{},i6oj2c2,True,t3_ueigkh,False,True,t1_i6oivgd,/r/UkraineConflict/comments/ueigkh/ukraine_says_russia_taking_colossal_losses_in/i6oj2c2/,1651248416,1,True,True,False,UkraineConflict,t5_30oyx,r/UkraineConflict,public,,0,[],,1651219605.0
[],False,,project23,,,[],,,,text,t2_4d0ou,False,False,The free world does not fear you russia.,ccdb32655ae236cdb6197fb449ee7bf1cbac2985,True,False,,,,,0,1651248371,,0,{},i6oizen,False,t3_ue41gw,False,True,t3_ue41gw,/r/UkraineConflict/comments/ue41gw/russian_tv_keeps_threatening_nuclear_strikes/i6oizen/,1651248386,1,True,True,False,UkraineConflict,t5_30oyx,r/UkraineConflict,public,,0,[],,1651219571.0
[],False,,darwinn_69,,,[],,,,text,t2_dq8fz,False,False,Anyone have a non-paywall version? I'm out of my reads.,822c79119232eadd1526df72ab726194e81b4cf8,True,False,,,,,0,1651248327,,0,{},i6oivgd,False,t3_ueigkh,False,True,t3_ueigkh,/r/UkraineConflict/comments/ueigkh/ukraine_says_russia_taking_colossal_losses_in/i6oivgd/,1651248340,1,True,True,False,UkraineConflict,t5_30oyx,r/UkraineConflict,public,,0,[],,1651219527.0
[],False,,Otherwise-Tiger3359,,,[],,,,text,t2_bnssb5gv,False,False,"About 120 meters, they ""should"" be able to hear it?",f7d8c6abfbdfa956f75adb6de619b14b3d5ce3b4,True,False,,,,,0,1651248218,,0,{},i6oilpg,False,t3_uelllp,False,True,t1_i6oh91b,/r/UkraineConflict/comments/uelllp/apu_copters_delivered_the_package/i6oilpg/,1651248235,1,True,True,False,UkraineConflict,t5_30oyx,r/UkraineConflict,public,,0,[],,1651219418.0
[],False,,Otherwise-Tiger3359,,,[],,,,text,t2_bnssb5gv,False,False,"Oen dead, maybe two injured? I wonder whether they buzz with drones all the time, so they have no",70d8e6c699ad7930cbaf32d79d5bbdf1f520cada,True,False,,,,,0,1651248198,,0,{},i6oijxi,False,t3_uelllp,False,True,t1_i6o79ca,/r/UkraineConflict/comments/uelllp/apu_copters_delivered_the_package/i6oijxi/,1651248213,1,True,True,False,UkraineConflict,t5_30oyx,r/UkraineConflict,public,,0,[],,1651219398.0
[],False,,IphtashuFitz,,,[],,,,text,t2_3dtdd,False,False,"Doubtful. Drones aren't terribly loud, even larger ones that can carry a payload the size of one of those shells. When it's a few hundred feet/meters up like that it would be very difficult to hear even if the air was perfectly still. A small breeze, other background noise, etc. would mask it quite well.",7d658f4940848f68136fc347be5430300f16d30b,True,False,,,,,0,1651248141,,0,{},i6oies8,False,t3_uelllp,False,True,t1_i6oh91b,/r/UkraineConflict/comments/uelllp/apu_copters_delivered_the_package/i6oies8/,1651248159,1,True,True,False,UkraineConflict,t5_30oyx,r/UkraineConflict,public,,0,[],,1651219341.0
[],False,,IslandMafia808,,,[],,,,text,t2_e1nij5b8,False,True,I’m wondering as well.,1ebabc1346bd2ca2b74a07eaf6fe3e82bc698ae9,True,False,,,,,0,1651248089,,0,{},i6oia1j,False,t3_uen2u3,False,True,t1_i6oht13,/r/UkraineConflict/comments/uen2u3/youre_not_safe_anywhere_in_ukraine_buddy/i6oia1j/,1651248104,1,True,True,False,UkraineConflict,t5_30oyx,r/UkraineConflict,public,,0,[],,1651219289.0
[],False,,infodawg,,,[],,,,text,t2_1ryjw,False,True,"maybe of all time, I think I said. Be that as it may, hands with weapons in them... its hard to be top of all time if you don't actually fight, we're finding that out loud and clear with the Russian armed forces. Most analysts considered them top echelon prior to this conflict, and look at them.",d440fee6edb26c953c5d07f9c1b19129c3237523,True,False,,,,,0,1651248065,,0,{},i6oi7y2,False,t3_uelllp,False,True,t1_i6og4lp,/r/UkraineConflict/comments/uelllp/apu_copters_delivered_the_package/i6oi7y2/,1651248082,1,True,True,False,UkraineConflict,t5_30oyx,r/UkraineConflict,public,,0,[],,1651219265.0
[],False,,hallihanno,,,[],,,,text,t2_1sen7i7v,False,False,"Actually being German myself I understand your point and the frustration that germany could do so much more aswell and I wish our government would be more decisive, but Chancellor Scholz is just taking the safest route possible, as Merkel did before him.. 
and the clip is hilarious ^^, like everytime someone mentions that German tanks showing up suddenly is probably not a good sign.😂",54e999df1cde9a655f0cadda6ce188ae5f08c738,True,False,,,,,0,1651247990,,0,{},i6oi1be,False,t3_uehuet,False,True,t1_i6ohdea,/r/UkraineConflict/comments/uehuet/do_we_agree_that_russia_is_bogged_down_in_a_slog/i6oi1be/,1651248005,1,True,True,False,UkraineConflict,t5_30oyx,r/UkraineConflict,public,,0,[],,1651219190.0
[],False,,Shadowtin,,,[],,,,text,t2_a6s6p7it,False,False,"Im sorry I still cant tell just from the camo, these guys are Russian, right?",ea4c4719a56b4d76fc71c68f40f7eb3dc8060bb0,True,False,,,,,0,1651247899,,0,{},i6oht13,False,t3_uen2u3,False,True,t3_uen2u3,/r/UkraineConflict/comments/uen2u3/youre_not_safe_anywhere_in_ukraine_buddy/i6oht13/,1651247916,1,True,True,False,UkraineConflict,t5_30oyx,r/UkraineConflict,public,,0,[],,1651219099.0
[],False,,MantasL,,,[],,,,text,t2_852zehp,False,False,Does he perhaps mean.. a blitz? Or a lightning war? Where have I heard that before…? 🧐,ac857c93a1a4cc88df5778fa6316cf2136090ec9,True,False,,,,,0,1651247895,,0,{},i6ohsmf,False,t3_ue00zu,False,True,t3_ue00zu,/r/UkraineConflict/comments/ue00zu/president_putin_warns_of_lightningfast/i6ohsmf/,1651247909,1,True,True,False,UkraineConflict,t5_30oyx,r/UkraineConflict,public,,0,[],,1651219095.0
[],False,,kpapenbe,,,[],,,,text,t2_ixf7ljmz,False,False,"No, no, all fair points....and I did take the easy way out by pointing the finger at Germany, especially given how much they've done for Europe throughout the recession and in terms of financing bailouts, etc.

I also don't think it's fair to judge Germany too harshly given their past....

As a bit of an aside / laughable moment &gt;&gt; check out minute 00 sec 40 &gt;&gt; https://www.youtube.com/watch?v=cV0vH\_IIQo4",4d71bbb0062005ca8ddbca15eca6776df9443586,True,False,,,,,0,1651247724,,0,{},i6ohdea,True,t3_uehuet,False,True,t1_i6odi5d,/r/UkraineConflict/comments/uehuet/do_we_agree_that_russia_is_bogged_down_in_a_slog/i6ohdea/,1651247742,1,True,True,False,UkraineConflict,t5_30oyx,r/UkraineConflict,public,,0,[],,1651218924.0
[],False,,Cane-toads-suck,,,[],,,,text,t2_q9zzjqd,False,False,Can they hear the drone? They seem to be running away as it drops?,5ea0c4cb936934ed9c2246ea5342157f5a19f6d1,True,False,,,,,0,1651247675,,0,{},i6oh91b,False,t3_uelllp,False,True,t3_uelllp,/r/UkraineConflict/comments/uelllp/apu_copters_delivered_the_package/i6oh91b/,1651247688,1,True,True,False,UkraineConflict,t5_30oyx,r/UkraineConflict,public,,0,[],,1651218875.0
[],False,,AgentChange2021,,,[],,,,text,t2_a0kizd6f,False,False,... from short guy.,57d1c1ffc0cdbf7afa24a3ad1b50dc87a156b7d9,True,False,,,,,0,1651247586,,0,{},i6oh13h,False,t3_uem1o5,False,True,t1_i6oef7u,/r/UkraineConflict/comments/uem1o5/vladimir_putin_could_declare_new_world_war_in/i6oh13h/,1651247597,1,True,True,False,UkraineConflict,t5_30oyx,r/UkraineConflict,public,,0,[],,1651218786.0
[],False,,AgentChange2021,,,[],,,,text,t2_a0kizd6f,False,False,"Fuck WW3, take out Putin.",285e1b39b54cf11272046d7de58ebee7a915efff,True,False,,,,,0,1651247511,,0,{},i6ogug4,False,t3_uem1o5,False,True,t3_uem1o5,/r/UkraineConflict/comments/uem1o5/vladimir_putin_could_declare_new_world_war_in/i6ogug4/,1651247523,1,True,True,False,UkraineConflict,t5_30oyx,r/UkraineConflict,public,,0,[],,1651218711.0
[],False,,kpapenbe,,,[],,,,text,t2_ixf7ljmz,False,False,"I agree...and I think they'll need to leverage technology and the economic-angle being applied by the West....

In other words, they really don't have the troop numbers to force a ""classic"" sort of retreat...",98757107b72d8eec96bccac0d010e50d1d5d653b,True,False,,,,,0,1651247509,,0,{},i6oguc7,True,t3_uehuet,False,True,t1_i6o9w0m,/r/UkraineConflict/comments/uehuet/do_we_agree_that_russia_is_bogged_down_in_a_slog/i6oguc7/,1651247523,1,True,True,False,UkraineConflict,t5_30oyx,r/UkraineConflict,public,,0,[],,1651218709.0
