Unnamed: 0,all_awardings,archived,associated_award,author,author_flair_background_color,author_flair_css_class,author_flair_richtext,author_flair_template_id,author_flair_text,author_flair_text_color,author_flair_type,author_fullname,author_patreon_flair,author_premium,body,body_sha1,can_gild,collapsed,collapsed_because_crowd_control,collapsed_reason,collapsed_reason_code,comment_type,controversiality,created_utc,distinguished,gilded,gildings,id,is_submitter,link_id,locked,no_follow,parent_id,permalink,retrieved_utc,score,score_hidden,send_replies,stickied,subreddit,subreddit_id,subreddit_name_prefixed,subreddit_type,top_awarded_type,total_awards_received,treatment_tags,unrepliable_reason,created,author_cakeday,edited,editable,media_metadata
,[],False,,lovesredditt2022,,,[],,,,text,t2_j2dw3t3q,False,False,Usually new accounts are a way to avoid the band placed on older accounts. So he/she has been banned her before and is back to post more pro Russia stuff.,1aab758925600feb8b39422fe4d9eb69bb3e693e,True,False,,,,,0,1648369084,,0,{},i2aikrh,False,t3_torpiq,False,True,t1_i2aewb6,/r/UkraineConflict/comments/torpiq/group_of_russian_soldiers_captured_by_ukrainian/i2aikrh/,1648369097,1,True,True,False,UkraineConflict,t5_30oyx,r/UkraineConflict,public,,0,[],,1648340284.0,,,,
,[],False,,Exact-Cycle-400,,,[],,,,text,t2_adicsqpk,False,False,Let me guess. That in the picture is either pig or cow blood,013672f9ce86e8de109f5e55d82e923198b10a18,True,False,,,,,0,1648369074,,0,{},i2aikcl,False,t3_top1lu,False,True,t3_top1lu,/r/UkraineConflict/comments/top1lu/czechs_remind_the_people_working_for_the_russian/i2aikcl/,1648369090,1,True,True,False,UkraineConflict,t5_30oyx,r/UkraineConflict,public,,0,[],,1648340274.0,,,,
,[],False,,NewDistrict6824,,,[],,,,text,t2_kd2n1evi,False,False,Yep -you asked where was CNN in all the other conflicts that was one of them,c90a9217efe0509e0bdc9d4bec9a413bce32edb0,True,False,,,,,0,1648368941,,0,{},i2aiev4,False,t3_towtk5,False,True,t1_i29wrry,/r/UkraineConflict/comments/towtk5/in_mariupol_a_russian_occupier_shot_an_11yearold/i2aiev4/,1648368952,1,True,True,False,UkraineConflict,t5_30oyx,r/UkraineConflict,public,,0,[],,1648340141.0,,,,
,[],False,,apoex,,,[],,,,text,t2_7684d,False,False,exactly there just freaking kids the dont belong there bet his training is like couple days max,910a9cb0e33dfa1163c1ed6b1dca8fb1f177ba1e,True,False,,,,,0,1648368539,,0,{},i2ahyf7,False,t3_tp684u,False,True,t1_i29etz2,/r/UkraineConflict/comments/tp684u/another_video_of_russian_soldiers_taken_captive/i2ahyf7/,1648368551,1,True,True,False,UkraineConflict,t5_30oyx,r/UkraineConflict,public,,0,[],,1648339739.0,,,,
,[],False,,apoex,,,[],,,,text,t2_7684d,False,False,"i find this video realy odd and heres why,

1: clothing is like not realy dirty its like the just got it

2: lot of them miss the ukraine flag patch

3: if u look good theres a lot of diff boots and if am correct most of the ukr army wears the same boots

4: the barly have any armband colors

&amp;#x200B;

so either its staged or its in the 1st couple days of the war.",1a4948f2b4655db5f0f1bd1c77f74c3380e267c3,True,False,,,,,0,1648368438,,0,{},i2ahu7r,False,t3_tpadsq,False,False,t3_tpadsq,/r/UkraineConflict/comments/tpadsq/need_the_verify_of_this_video_sources_and_when/i2ahu7r/,1648368449,1,True,True,False,UkraineConflict,t5_30oyx,r/UkraineConflict,public,,0,[],,1648339638.0,,,,
,[],False,,funkytownpants,,,[],,,,text,t2_4x0vsl3m,False,False,There’s a strong of propaganda on here that should be removed. Make sure to tell admins,2e7f50b68c8e157c0108e0d0de89105aef471472,True,False,,,,,0,1648368323,,0,{},i2ahpfr,False,t3_tpd5pr,False,True,t1_i2a5fo0,/r/UkraineConflict/comments/tpd5pr/did_joe_biden_go_too_far_putin_must_be_removed/i2ahpfr/,1648368337,1,True,True,False,UkraineConflict,t5_30oyx,r/UkraineConflict,public,,0,[],,1648339523.0,,,,
,[],False,,dariy16,,,[],,,,text,t2_btt5n94,False,False,"Personally there should be no breaks given. Instead of sympathizing for the people of Russia going through economic turmoils, look at the situation in Mariupol. Think about this from a Ukrainian lense. Your entire culture, your country, everything you've believed in and that has given you values and pride and a sense of identity is at threat of being decimated. And this is an on going conflict from Russia towards Ukraine that goes back generations. It's deeper than a simple war right now. Russias biggest prize is Ukraine and we do not relate. We are free people and we have the deepest love for everything in our heritage. Sanction everything.",f752c153686c0eea6a2865088cca3c6d4a905bbd,True,False,,,,,0,1648368203,,0,{},i2ahkhh,False,t3_tpd541,False,True,t3_tpd541,/r/UkraineConflict/comments/tpd541/should_russian_science_be_sanctioned_because_of/i2ahkhh/,1648368218,1,True,True,False,UkraineConflict,t5_30oyx,r/UkraineConflict,public,,0,[],,1648339403.0,,,,
,[],False,,Lord_Bertox,,,[],,,,text,t2_5j5vuhhl,False,False,What I just said are facts,de99e6124fc9e6f1dbb755994fb103f22e42c19a,True,False,,,,,0,1648368152,,0,{},i2ahicl,False,t3_tltcqw,False,True,t1_i24k3jo,/r/UkraineConflict/comments/tltcqw/russia_can_launch_cruise_missile_strikes_on_their/i2ahicl/,1648368167,1,True,True,False,UkraineConflict,t5_30oyx,r/UkraineConflict,public,,0,[],,1648339352.0,,,,
,[],False,,zen_tm,,,[],,,,text,t2_39chx,False,False,"South Front should be on here, not Task &amp; Purpose. 
I wonder if this is actually a smear campaign.

South Front is an actual Russian disinformation website, Task &amp; Purpose are not",0dd989314d36877c5b1509a62d4c3edef64db649,False,False,,,,,0,1648368051,,0,{},i2ahe7l,False,t3_tp9a38,False,True,t1_i2afyq4,/r/UkraineConflict/comments/tp9a38/putin_simps_be_coping/i2ahe7l/,1648368064,1,False,True,False,UkraineConflict,t5_30oyx,r/UkraineConflict,public,,0,[],,1648339251.0,,,,
,[],False,,MusicianAltruistic68,,,[],,,,text,t2_apncgn9o,False,False,I would beat him,47591e0aef227c1977ca983bc1e0ab99a600477d,True,False,,,,,0,1648367405,,0,{},i2agnrs,False,t3_tp684u,False,True,t3_tp684u,/r/UkraineConflict/comments/tp684u/another_video_of_russian_soldiers_taken_captive/i2agnrs/,1648367415,1,True,True,False,UkraineConflict,t5_30oyx,r/UkraineConflict,public,,0,[],,1648338605.0,,,,
,[],False,,Glum_Stock2582,,,[],,,,text,t2_dz67vq5n,False,False,Is task and purpose understood to be slanted towards russia?,996292411bf6826255532509529cb3832a9531ac,False,False,,,,,0,1648366803,,0,{},i2afyq4,False,t3_tp9a38,False,True,t3_tp9a38,/r/UkraineConflict/comments/tp9a38/putin_simps_be_coping/i2afyq4/,1648366819,1,False,True,False,UkraineConflict,t5_30oyx,r/UkraineConflict,public,,0,[],,1648338003.0,,,,
,[],False,,microwavedsaladOZ,,,[],,,,text,t2_kfdarp3p,False,False,"Poor bloody kid should be out with his mates or playing footy. 
Instead he’s dragged into this mess",35b96910a69bb4878de7c182f64569666adefed0,True,False,,,,,0,1648366667,,0,{},i2aft8s,False,t3_tp684u,False,True,t3_tp684u,/r/UkraineConflict/comments/tp684u/another_video_of_russian_soldiers_taken_captive/i2aft8s/,1648366684,1,True,True,False,UkraineConflict,t5_30oyx,r/UkraineConflict,public,,0,[],,1648337867.0,,,,
,[],False,,Glum_Stock2582,,,[],,,,text,t2_dz67vq5n,False,False,"I feel you, but yeah i can imagine memes of even small effect like this being part of such a campaign. Crazy that this is a new reality",20740432089cdea5a7937fb60264bc986bb8202f,True,False,,,,,0,1648366550,,0,{},i2afoet,False,t3_tob5az,False,True,t1_i2afj74,/r/UkraineConflict/comments/tob5az/coping_russiaboo_starter_pack/i2afoet/,1648366561,1,True,True,False,UkraineConflict,t5_30oyx,r/UkraineConflict,public,,0,[],,1648337750.0,,,,
,[],False,,MuchDesk2515,,,[],,,,text,t2_kvghz2j3,False,False,"Interesting, why do you think that?",e00cb7653c568b8bd8b67929cea8b361b6ca54f6,True,False,,,,,0,1648366497,,0,{},i2afm7v,False,t3_torpiq,False,True,t1_i2aewb6,/r/UkraineConflict/comments/torpiq/group_of_russian_soldiers_captured_by_ukrainian/i2afm7v/,1648366509,1,True,True,False,UkraineConflict,t5_30oyx,r/UkraineConflict,public,,0,[],,1648337697.0,,,,
,[],False,,zen_tm,,,[],,,,text,t2_39chx,False,False,It's a murky world. Even just slowing down and doubting things is an effective end goal from the use of this cold-war-themed disinformation campaign. Very sad that we are subjected to it,13c539111a0000c06a13b29d02e2f0e800738273,True,False,,,,,0,1648366427,,0,{},i2afj74,False,t3_tob5az,False,True,t1_i2af9ij,/r/UkraineConflict/comments/tob5az/coping_russiaboo_starter_pack/i2afj74/,1648366437,1,True,True,False,UkraineConflict,t5_30oyx,r/UkraineConflict,public,,0,[],,1648337627.0,,,,
,[],False,,Glum_Stock2582,,,[],,,,text,t2_dz67vq5n,False,False,"That sorta stuff is above my “paygrade”, lol. But interesting mention, though.",3df69fe25c18d755f213875260ffaa8bfea07d74,True,False,,,,,0,1648366197,,0,{},i2af9ij,False,t3_tob5az,False,True,t1_i2af1hh,/r/UkraineConflict/comments/tob5az/coping_russiaboo_starter_pack/i2af9ij/,1648366211,1,True,True,False,UkraineConflict,t5_30oyx,r/UkraineConflict,public,,0,[],,1648337397.0,,,,
,[],False,,zen_tm,,,[],,,,text,t2_39chx,False,False,I guess it's actually possible that the meme is intended to cast doubt on task&amp; purpose in the first place. It does seem rather strange...,f4ba3992f03617426b4fd54bb26faf686882a1f1,True,False,,,,,0,1648366006,,0,{},i2af1hh,False,t3_tob5az,False,True,t1_i2aell5,/r/UkraineConflict/comments/tob5az/coping_russiaboo_starter_pack/i2af1hh/,1648366019,1,True,True,False,UkraineConflict,t5_30oyx,r/UkraineConflict,public,,0,[],,1648337206.0,,,,
,[],False,,undercover-hustler,,,[],,,,text,t2_1ciea9mx,False,True,Lol japans about to got 3 for 3 in Russian conflicts,93a29815096c9be0bd448ced41b430173c9c7b1c,True,False,,,,,0,1648365935,,0,{},i2aeygo,False,t3_toq087,False,False,t3_toq087,/r/UkraineConflict/comments/toq087/russias_eastern_military_district_said_it_was/i2aeygo/,1648365947,1,True,True,False,UkraineConflict,t5_30oyx,r/UkraineConflict,public,,0,[],,1648337135.0,,,,
,[],False,,MasterChiefette,,,[],,,,text,t2_asxb6,False,True,I've seen your post now - you are a pro-Russian troll - you post pro- Russian shit all over Reddit and your account is just days old.  The mods should ban your ass from this subreddit.,b7a0ce2fc1d3d08404d3085346bde014984e43e7,True,False,,,,,0,1648365884,,0,{},i2aewb6,False,t3_torpiq,False,True,t1_i2acqxg,/r/UkraineConflict/comments/torpiq/group_of_russian_soldiers_captured_by_ukrainian/i2aewb6/,1648365895,1,True,True,False,UkraineConflict,t5_30oyx,r/UkraineConflict,public,,0,[],,1648337084.0,,,,
,[],False,,Glum_Stock2582,,,[],,,,text,t2_dz67vq5n,False,False,"Yeah makes sense, from what i’ve heard that’s where they could potentially stage propaganda easiest. Disgusting stuff but u know how it is",9340df704bfbba449c6027dff912502d6be6c81e,True,False,,,,,0,1648365638,,0,{},i2aell5,False,t3_tob5az,False,True,t1_i2aeg48,/r/UkraineConflict/comments/tob5az/coping_russiaboo_starter_pack/i2aell5/,1648365652,1,True,True,False,UkraineConflict,t5_30oyx,r/UkraineConflict,public,,0,[],,1648336838.0,,,,
,[],False,,zen_tm,,,[],,,,text,t2_39chx,False,False,South Front would be a much more relevant addition to this meme instead of task&amp;purpose. That's an actual Russian disinformation site.,d6ece284f30ea9abecc0fea54f06c8a051021ea8,True,False,,,,,0,1648365511,,0,{},i2aeg48,False,t3_tob5az,False,True,t1_i2abzyv,/r/UkraineConflict/comments/tob5az/coping_russiaboo_starter_pack/i2aeg48/,1648365525,1,True,True,False,UkraineConflict,t5_30oyx,r/UkraineConflict,public,,0,[],,1648336711.0,,,,
,[],False,,all-about-that-fade,,,[],,,,text,t2_9c9zypqp,False,False,No. Germans aren’t interested in any areal expansion. Only the far-right sorts.,b9332497fd24eda2f84c4a839e78432eb1b1ac71,True,False,,,,,0,1648365114,,0,{},i2adyxn,False,t3_tokpcx,False,True,t1_i272p4z,/r/UkraineConflict/comments/tokpcx/polish_general_excommander_of_the_ground_forces/i2adyxn/,1648365132,1,True,True,False,UkraineConflict,t5_30oyx,r/UkraineConflict,public,,0,[],,1648336314.0,,,,
,[],False,,Xandurpein,,,[],,,,text,t2_1k474p6,False,False,"No matter how we try to stop an evil dictator, the people in his country pays too. Boycotting Russian scientists to deny Russia the technology to threaten us militarily is a fairly humane way to do it. Those Russian scientists can always defect anyway.",e1bd760cfda9fc8df799ddd161f30c1b7d8b898a,True,False,,,,,0,1648364963,,0,{},i2adsgf,False,t3_tpd541,False,False,t3_tpd541,/r/UkraineConflict/comments/tpd541/should_russian_science_be_sanctioned_because_of/i2adsgf/,1648364976,1,True,True,False,UkraineConflict,t5_30oyx,r/UkraineConflict,public,,0,[],,1648336163.0,,,,
,[],False,,loveforallhumanity,,,[],,,,text,t2_kwoep2tl,False,False,Real classy video you nazi fuck,5d4271154dc914a2e09790f958f564adbb11e6c2,True,False,,,,,0,1648364373,,0,{},i2ad2sr,False,t3_tp684u,False,True,t3_tp684u,/r/UkraineConflict/comments/tp684u/another_video_of_russian_soldiers_taken_captive/i2ad2sr/,1648364385,1,True,True,False,UkraineConflict,t5_30oyx,r/UkraineConflict,public,,0,[],,1648335573.0,,,,
,[],False,,MuchDesk2515,,,[],,,,text,t2_kvghz2j3,False,False,"&gt; They should all be shot on sight.

And they are. And that's fine, because this is war. But shooting bound captured soldiers is disgusting, no matter who does it.

You also sound very emotional, take a chill pill.",b9f31c21c4f0465cecc4987503ee9765ca4e3f9d,True,False,,,,,0,1648364096,,0,{},i2acqxg,False,t3_torpiq,False,True,t1_i2achu3,/r/UkraineConflict/comments/torpiq/group_of_russian_soldiers_captured_by_ukrainian/i2acqxg/,1648364111,1,True,True,False,UkraineConflict,t5_30oyx,r/UkraineConflict,public,,0,[],,1648335296.0,,,,
,[],False,,Few-Definition-583,,,[],,,,text,t2_gq0kb4b6,False,False,Thats the land of the germans not polnish,ef43549a80247c0802b68983299b587d58dcb1fa,True,False,,,,,0,1648363995,,0,{},i2acmol,False,t3_tokpcx,False,True,t3_tokpcx,/r/UkraineConflict/comments/tokpcx/polish_general_excommander_of_the_ground_forces/i2acmol/,1648364010,1,True,True,False,UkraineConflict,t5_30oyx,r/UkraineConflict,public,,0,[],,1648335195.0,,,,
,[],False,,MasterChiefette,,,[],,,,text,t2_asxb6,False,True,"Good! Fuck them Russia pricks...they are shooting at civilians(including children) and don't give two fucks.   [https://www.youtube.com/watch?v=rHxW7vO04mM](https://www.youtube.com/watch?v=rHxW7vO04mM)

I no longer have any sympathy for Russian soldiers...none...0.  They should all be shot on sight.  There are now dozens upon dozens of captured phone calls made by Russian soldiers to wives back home describing how they kill all Ukrainians on sight - women =, children, old people...they don't care.  Fuck them and fuck Putin and fuck anyone that supports them!",269f29c6f048eb161e819726172789d0b4b83d09,True,False,,,,,0,1648363880,,0,{},i2achu3,False,t3_torpiq,False,True,t1_i29yrz3,/r/UkraineConflict/comments/torpiq/group_of_russian_soldiers_captured_by_ukrainian/i2achu3/,1648363894,1,True,True,False,UkraineConflict,t5_30oyx,r/UkraineConflict,public,,0,[],,1648335080.0,,,,
,[],False,,zen_tm,,,[],,,,text,t2_39chx,False,False,I think a lot of people and analysts in particular have had to readjust what their expectations of the Russians were Vs how it's going... They are definitely underperforming.,8c07a18ac0beeb12ffaf050397bd4f88561e8d86,True,False,,,,,0,1648363669,,0,{},i2ac8fr,False,t3_tob5az,False,True,t1_i2923z8,/r/UkraineConflict/comments/tob5az/coping_russiaboo_starter_pack/i2ac8fr/,1648363685,1,True,True,False,UkraineConflict,t5_30oyx,r/UkraineConflict,public,,0,[],,1648334869.0,,,,
,[],False,,zen_tm,,,[],,,,text,t2_39chx,False,False,"Ha. Might be a soldiers mentality?

I'm not in any way convinced that he is ""Russiaboo"" though, even if he is a flashy twat. 

Maybe the person who created this had to deal with genuine ""Russiaboo's"" who linked back to task&amp;purpose when they were arguing?",6d1a446c65d3c48262b41e9fc83564457f5086c5,True,False,,,,,0,1648363534,,0,{},i2ac2dl,False,t3_tob5az,False,True,t1_i2a44kr,/r/UkraineConflict/comments/tob5az/coping_russiaboo_starter_pack/i2ac2dl/,1648363546,1,True,True,False,UkraineConflict,t5_30oyx,r/UkraineConflict,public,,0,[],,1648334734.0,,,,
,[],False,,kyivanRys77,,,[],,,,text,t2_kzi3cf6x,False,False,What’s to say this traitor is not lying for Russian propaganda against Ukraine? He’s definitely lying.,71231e07ecc7849d5cb89c817334cb2983ac9451,True,False,,,,,0,1648363499,,0,{},i2ac0sw,False,t3_tpdh0o,False,True,t1_i2a9tmw,/r/UkraineConflict/comments/tpdh0o/ukrainian_sbu_have_abducted_daughter_of_mayor_of/i2ac0sw/,1648363514,1,True,True,False,UkraineConflict,t5_30oyx,r/UkraineConflict,public,,0,[],,1648334699.0,,,,
,[],False,,Glum_Stock2582,,,[],,,,text,t2_dz67vq5n,False,False,"So i am fully with you, but i understand the reaction to the war when said war is an unnecessary land grab at the cost of the magnitude of atrocities it has been. Still not sure about the task and purpose tho lol",75e11f22ef47dc16fc84b1d65893827113bf1715,True,False,,,,,0,1648363479,,0,{},i2abzyv,False,t3_tob5az,False,True,t1_i2abuhc,/r/UkraineConflict/comments/tob5az/coping_russiaboo_starter_pack/i2abzyv/,1648363493,1,True,True,False,UkraineConflict,t5_30oyx,r/UkraineConflict,public,,0,[],,1648334679.0,,,,
,[],False,,kyivanRys77,,,[],,,,text,t2_kzi3cf6x,False,False,Exactly. This is him lying and making Russian propaganda for the Russians against Ukraine.,5554c3e4018a887c81fcffe32aa27d0b67b9b1ee,True,False,,,,,0,1648363443,,0,{},i2abyc9,False,t3_tpdh0o,False,True,t1_i2aam2g,/r/UkraineConflict/comments/tpdh0o/ukrainian_sbu_have_abducted_daughter_of_mayor_of/i2abyc9/,1648363454,1,True,True,False,UkraineConflict,t5_30oyx,r/UkraineConflict,public,,0,[],,1648334643.0,,,,
,[],False,,zen_tm,,,[],,,,text,t2_39chx,False,False,"Yeah. I think someone is taking the ""Russiaboo"" thing too far with that one. Being even-handed and sceptical of knee-jerk reactions to an incomplete privture of the war is not the same thing..",059f6fd74e3a40a8ac47fe4bee3127de113d8a0b,True,False,,,,,0,1648363354,,0,{},i2abuhc,False,t3_tob5az,False,True,t1_i29knps,/r/UkraineConflict/comments/tob5az/coping_russiaboo_starter_pack/i2abuhc/,1648363368,1,True,True,False,UkraineConflict,t5_30oyx,r/UkraineConflict,public,,0,[],,1648334554.0,,,,
,[],False,,zen_tm,,,[],,,,text,t2_39chx,False,False,"Problem with that statement is that it is a war crime to target civilians and civilian infrastructure. And Russia is happy to do so. If they deliberately target a civilian shelter with a one tonne bomb, you can be damn sure they will happily use thermobarics too.",5513fcbd1d9104739610cf904866238eedd604d6,True,False,,,,,0,1648363118,,0,{},i2abjzq,False,t3_tob5az,False,True,t1_i26gowq,/r/UkraineConflict/comments/tob5az/coping_russiaboo_starter_pack/i2abjzq/,1648363132,1,True,True,False,UkraineConflict,t5_30oyx,r/UkraineConflict,public,,0,[],,1648334318.0,,,,
,[],False,,majoraloysius,,,[],,,,text,t2_5tfpre8c,False,False,Unless you’re a nation state and a signatory of the Geneva Convention I wouldn’t worry about it.,cc8b98c54b4b017cefd61adb75ebbafa1a0bf23f,True,False,,,,,0,1648362667,,0,{},i2aazd1,False,t3_tp684u,False,True,t1_i29dggt,/r/UkraineConflict/comments/tp684u/another_video_of_russian_soldiers_taken_captive/i2aazd1/,1648362683,1,True,True,False,UkraineConflict,t5_30oyx,r/UkraineConflict,public,,0,[],,1648333867.0,,,,
,[],False,,ReeverFalls,,,[],,,,text,t2_c7fw2c3k,False,False,"I give your comments a 0/10. If you're going to troll people you should go all in on it. From my perspective this a weak limp-wristed attempt at getting people riled up. I'm sure you were born with an extra chromosome, so that's not on you. However I feel compelled to call you the weakest link. That'll be all. Run along now little one.",c07b8b2db7aba466987ac73721031b851dccf546,True,False,,,,,0,1648362579,,0,{},i2aavbp,False,t3_top1lu,False,True,t1_i29vzaq,/r/UkraineConflict/comments/top1lu/czechs_remind_the_people_working_for_the_russian/i2aavbp/,1648362595,1,True,True,False,UkraineConflict,t5_30oyx,r/UkraineConflict,public,,0,[],,1648333779.0,,,,
,[],False,,Shadowtin,,,[],,,,text,t2_a6s6p7it,False,False,Boycott Russian everything.,aec0ce68bfbe249fa31ec01c07720e1ea1b91fe7,True,False,,,,,0,1648362387,,0,{},i2aamw4,False,t3_tpd541,False,True,t3_tpd541,/r/UkraineConflict/comments/tpd541/should_russian_science_be_sanctioned_because_of/i2aamw4/,1648362399,1,True,True,False,UkraineConflict,t5_30oyx,r/UkraineConflict,public,,0,[],,1648333587.0,,,,
,[],False,,deathtoputin31,,,[],,,,text,t2_kmmm8us5,False,False,"russian traitor don't worry about your daughter, worry what ukraine will do to you when they catch you",5e8f3865bf5a1c61f27d5a3e1be45487d09b1f05,True,False,,,,,0,1648362369,,0,{},i2aam2g,False,t3_tpdh0o,False,True,t3_tpdh0o,/r/UkraineConflict/comments/tpdh0o/ukrainian_sbu_have_abducted_daughter_of_mayor_of/i2aam2g/,1648362379,1,True,True,False,UkraineConflict,t5_30oyx,r/UkraineConflict,public,,0,[],,1648333569.0,,,,
,[],False,,Jswljones,,,[],,,,text,t2_x07mp,False,False,"See this is my first reaction, it seems they already know who this guy is and what he did so why not keep tabs and deal with him when everything is over?  


Even if true why not just broadcast it as a sign of Ukrainian solidarity instead of taking his daughter and making it look bad... Just seems off to me but I also want to try to be open minded SO IDK...",4c543c04e6c99ae2a83b4ec96f88140de6cde11b,True,False,,,,,0,1648362210,,0,{},i2aaf09,True,t3_tpdh0o,False,True,t1_i2a7cst,/r/UkraineConflict/comments/tpdh0o/ukrainian_sbu_have_abducted_daughter_of_mayor_of/i2aaf09/,1648362224,1,True,True,False,UkraineConflict,t5_30oyx,r/UkraineConflict,public,,0,[],,1648333410.0,,,,
,[],False,,kirmm3la,,,[],,,,text,t2_l0crt,False,False,"Oh fuck. It looks recent, they got a lot of Ukrainians 😢",c0dce2c31d03045780a395264b0d69af7ca882bd,True,False,,,,,0,1648362162,,0,{},i2aacvc,False,t3_tpadsq,False,True,t3_tpadsq,/r/UkraineConflict/comments/tpadsq/need_the_verify_of_this_video_sources_and_when/i2aacvc/,1648362179,1,True,True,False,UkraineConflict,t5_30oyx,r/UkraineConflict,public,,0,[],,1648333362.0,,,,
,[],False,,Dramatic_Quiet_5796,,,[],,,,text,t2_k3mdzzkd,False,False,"He chose to collaborate. That is known. And he is charged with treason for cooperating with the Russian occupiers. 

As for his daughter, nobody knows. It's an allegation that she's been kidnapped. We have no data to say anything other than his words -- which could be politically motivated.",0cb3d6dbcd84a0c7e9eb8ade964ca1cb1a6a0e66,True,False,,,,,0,1648361738,,0,{},i2a9tmw,False,t3_tpdh0o,False,True,t3_tpdh0o,/r/UkraineConflict/comments/tpdh0o/ukrainian_sbu_have_abducted_daughter_of_mayor_of/i2a9tmw/,1648361749,1,True,True,False,UkraineConflict,t5_30oyx,r/UkraineConflict,public,,0,[],,1648332938.0,,,,
,[],False,,Vejasple,,,[],,,,text,t2_bxxiq,False,False,Russia does not change its plan - Putin denies existence of Ukrainian state and Ukrainian nation.,11a9e6cc01d4c7232ec2f4b2248eec84b27cb7dd,True,False,,,,,0,1648361151,,0,{},i2a92vs,False,t3_tpd5pr,False,True,t3_tpd5pr,/r/UkraineConflict/comments/tpd5pr/did_joe_biden_go_too_far_putin_must_be_removed/i2a92vs/,1648361166,1,True,True,False,UkraineConflict,t5_30oyx,r/UkraineConflict,public,,0,[],,1648332351.0,,,,
,[],False,,MusicianGlad61,,,[],,,,text,t2_7sdmjzhx,False,False,russian propaganda shit,390b62742d870d0d64edfe99b4d863ab227f5f79,True,False,,,,,0,1648361031,,0,{},i2a8xbp,False,t3_tpdh0o,False,False,t3_tpdh0o,/r/UkraineConflict/comments/tpdh0o/ukrainian_sbu_have_abducted_daughter_of_mayor_of/i2a8xbp/,1648361046,1,True,True,False,UkraineConflict,t5_30oyx,r/UkraineConflict,public,,0,[],,1648332231.0,,,,
,[],False,,Asleep_Astronaut396,,,[],,,,text,t2_b6hc5hll,False,False,i smell propaganda.,dd6218098ebd9b6758cb1e5e36077a2837b4d381,True,False,,,,,0,1648360999,,0,{},i2a8vru,False,t3_tpdh0o,False,True,t3_tpdh0o,/r/UkraineConflict/comments/tpdh0o/ukrainian_sbu_have_abducted_daughter_of_mayor_of/i2a8vru/,1648361012,1,True,True,False,UkraineConflict,t5_30oyx,r/UkraineConflict,public,,0,[],,1648332199.0,,,,
,[],False,,Burner_0001,,,[],,,,text,t2_3eiozzoc,False,False,https://v.redd.it/vi5auqzzwtp81,5139bf96c65abb403bfee54560efeb75381b3697,True,False,,,,,0,1648360826,,0,{},i2a8np1,True,t3_tpau64,False,True,t1_i2a7sfc,/r/UkraineConflict/comments/tpau64/ukrainians_torturing_russian_pows_and_videotaping/i2a8np1/,1648360840,1,True,True,False,UkraineConflict,t5_30oyx,r/UkraineConflict,public,,0,[],,1648332026.0,,,,
,[],False,,infodawg,,,[],,,,text,t2_1ryjw,False,False,"Hey at least he didn't call him ""smart""....",4ac418486d8a73e23baf335c4448a52b3f20a22d,True,False,,,,,0,1648360536,,0,{},i2a8a7f,False,t3_tpd5pr,False,True,t3_tpd5pr,/r/UkraineConflict/comments/tpd5pr/did_joe_biden_go_too_far_putin_must_be_removed/i2a8a7f/,1648360548,1,True,True,False,UkraineConflict,t5_30oyx,r/UkraineConflict,public,,0,[],,1648331736.0,,,,
,[],False,,kwagenknight,,,[],,,,text,t2_opzwo,False,False,"The whole world is saying this (besides a handful) so how could this be ""going too far""? There is no coming back from this from Putin with all the war crimes. Russia can survive this but only when Putin is gone.",9b2bd6351092972e93bbe2552c3982f8d4ea1ec3,True,False,,,,,0,1648360431,,0,{},i2a858f,False,t3_tpd5pr,False,False,t3_tpd5pr,/r/UkraineConflict/comments/tpd5pr/did_joe_biden_go_too_far_putin_must_be_removed/i2a858f/,1648360442,1,True,True,False,UkraineConflict,t5_30oyx,r/UkraineConflict,public,,0,[],,1648331631.0,,,,
