Unnamed: 0,all_awardings,archived,associated_award,author,author_flair_background_color,author_flair_css_class,author_flair_richtext,author_flair_template_id,author_flair_text,author_flair_text_color,author_flair_type,author_fullname,author_patreon_flair,author_premium,body,body_sha1,can_gild,collapsed,collapsed_because_crowd_control,collapsed_reason,collapsed_reason_code,comment_type,controversiality,created_utc,distinguished,gilded,gildings,id,is_submitter,link_id,locked,no_follow,parent_id,permalink,retrieved_utc,score,score_hidden,send_replies,stickied,subreddit,subreddit_id,subreddit_name_prefixed,subreddit_type,top_awarded_type,total_awards_received,treatment_tags,unrepliable_reason,created,author_cakeday,edited,editable,media_metadata
,[],False,,GreekViking17,,,[],,,,text,t2_7spw8sto,False,False,"So you are cheering for making ukranian pilots die slowly?

Huh whatever floats your boat I suppose.

These jets are confirmed ukranian SU's",515ca987a46a167c5451ac13d9adce4920e5e6d4,True,False,,,,,0,1648408460,,0,{},i2cj6ud,False,t3_tgaqz2,False,True,t1_i2ch3wd,/r/UkraineConflict/comments/tgaqz2/two_russian_attack_aircrafts_were_bombing_ukraine/i2cj6ud/,1648408475,1,True,True,False,UkraineConflict,t5_30oyx,r/UkraineConflict,public,,0,[],,1648379660.0,,,,
,[],False,,GreekViking17,,,[],,,,text,t2_7spw8sto,False,False,"Man why are you talking about a war like it's COD MW2 voice chat lobby ?

Get real the last thing anybody wants is WW3 get out of here go scream this on Cod warzone or something.",721af5d3ab61d27709dd652ad4105158e0d48cc9,True,False,,,,,0,1648408314,,0,{},i2ciujh,False,t3_t429fu,False,True,t1_i02hmvn,/r/UkraineConflict/comments/t429fu/just_got_sent_this_from_a_friend_in_kharkov_this/i2ciujh/,1648408325,1,True,True,False,UkraineConflict,t5_30oyx,r/UkraineConflict,public,,0,[],,1648379514.0,,,,
,[],False,,ordobellatores,,,[],,,,text,t2_hy61dfqa,False,False,I hope they are only going to eat it....,a7b52136ac1377c2bf69a6ccfb7cb02e154d4e66,True,False,,,,,0,1648407997,,0,{},i2ci41s,False,t3_tpp4e1,False,False,t3_tpp4e1,/r/UkraineConflict/comments/tpp4e1/watch_kadyrovtsy_chechens_successfully_captured_a/i2ci41s/,1648408010,1,True,True,False,UkraineConflict,t5_30oyx,r/UkraineConflict,public,,0,[],,1648379197.0,,,,
,[],False,,creativeusernameidkl,,,[],,,,text,t2_4l7a5g3w,False,False,"Man i said 7 times that i am OPPOSED to invasion. How many more times i need to repeat it. About Wagner i havent heard anything till the war, but azov is 8 years old established story. Once again for autistic reditors- Opossing clear-cut nazis NOT EQUAL to supporting Russia?",784eff59284a39770f3cbe6d3ff242a3df9183d8,True,False,,,,,0,1648407930,,0,{},i2chyh1,False,t3_tpkwpr,False,True,t1_i2cho1h,/r/UkraineConflict/comments/tpkwpr/powerful_mustwatch_video_from_the_bbc_looking_at/i2chyh1/,1648407950,1,True,True,False,UkraineConflict,t5_30oyx,r/UkraineConflict,public,,0,[],,1648379130.0,,,,
,[],False,,GreekViking17,,,[],,,,text,t2_7spw8sto,False,False,"Uuuhm all those that fight for the tyrant,?? You are aware that there is a fuck Tonne of 18 year Olds that got conscripted that want nothing to do with this war you jackass. 

Man must be nice being so ignorant 🙄 and not being able to think for yourself.",9a8b6741c480be8366577cb789d67e54596bf887,True,False,,,,,0,1648407823,,0,{},i2chpck,False,t3_te49eo,False,True,t1_i0oyxqv,/r/UkraineConflict/comments/te49eo/intercepted_phone_call_between_russian_soldiers/i2chpck/,1648407839,1,True,True,False,UkraineConflict,t5_30oyx,r/UkraineConflict,public,,0,[],,1648379023.0,,,,
,[],False,,Big-Ad-1476,,,[],,,,text,t2_47om6bkn,False,False,"Give this article a gander. About the head of Wagner group

Then explain to me again how its Ukraine that needs to be de-nazified.

http://www.romea.cz/en/news/world/the-times-putin-has-sent-mercenaries-to-kyiv-led-by-an-admirer-of-the-nazis-to-murder-zelenskyy-and-the-klitschko-brothers",1e23aa1e20423b56252655965361bb3764793f4d,True,False,,,,,0,1648407807,,0,{},i2cho1h,False,t3_tpkwpr,False,True,t1_i2cgml8,/r/UkraineConflict/comments/tpkwpr/powerful_mustwatch_video_from_the_bbc_looking_at/i2cho1h/,1648407833,1,True,True,False,UkraineConflict,t5_30oyx,r/UkraineConflict,public,,0,[],,1648379007.0,,,,
,[],False,,HuntressMainn,,,[],,,,text,t2_je2mtwp7,False,False,Of course they are,1b41acd35950cb3343218ee72ca15edaf6cf8944,True,False,,,,,0,1648407570,,0,{},i2ch3wd,False,t3_tgaqz2,False,True,t1_i2cgzkn,/r/UkraineConflict/comments/tgaqz2/two_russian_attack_aircrafts_were_bombing_ukraine/i2ch3wd/,1648407583,1,True,True,False,UkraineConflict,t5_30oyx,r/UkraineConflict,public,,0,[],,1648378770.0,,,,
,[],False,,GreekViking17,,,[],,,,text,t2_7spw8sto,False,False,You are aware these were Ukrainians bombing russian convoys right?? Kinda awkward.,ef24aa374b385b9b6188b969b4a9e628375e0d35,True,False,,,,,0,1648407520,,0,{},i2cgzkn,False,t3_tgaqz2,False,True,t1_i24nhfy,/r/UkraineConflict/comments/tgaqz2/two_russian_attack_aircrafts_were_bombing_ukraine/i2cgzkn/,1648407530,1,True,True,False,UkraineConflict,t5_30oyx,r/UkraineConflict,public,,0,[],,1648378720.0,,,,
,[],False,,lVl4v3r1ck99,,,[],,,,text,t2_39fluajy,False,False,"Yes, yes, my nation is the dog of europe, again... ty mr president!",91a8496a1c4ef166da4fce0fbed21caa569171ed,True,False,,,,,0,1648407442,,0,{},i2cgt1g,False,t3_tpl1ni,False,True,t3_tpl1ni,/r/UkraineConflict/comments/tpl1ni/lol_the_guy_is_a_hero_to_his_people_and_the_world/i2cgt1g/,1648407457,1,True,True,False,UkraineConflict,t5_30oyx,r/UkraineConflict,public,,0,[],,1648378642.0,,,,
,[],False,,creativeusernameidkl,,,[],,,,text,t2_4l7a5g3w,False,False,"Wouldnt call one wikipedia page and having aarger memory than a goldfish a rabbit hole. SS in a logo man, just tell me how can your mind justify that",a23903b18aecc0ad667ea89fceb95c0d1bafedf0,True,False,,,,,0,1648407366,,0,{},i2cgml8,False,t3_tpkwpr,False,True,t1_i2cgew1,/r/UkraineConflict/comments/tpkwpr/powerful_mustwatch_video_from_the_bbc_looking_at/i2cgml8/,1648407383,1,True,True,False,UkraineConflict,t5_30oyx,r/UkraineConflict,public,,0,[],,1648378566.0,,,,
,[],False,,Big-Ad-1476,,,[],,,,text,t2_47om6bkn,False,False,"Yeah, you're pretty deep down that rabbit hole.",1fcf288237b7f63003a938b7003cecfa2d1eb762,True,False,,,,,0,1648407275,,0,{},i2cgew1,False,t3_tpkwpr,False,True,t1_i2cemq6,/r/UkraineConflict/comments/tpkwpr/powerful_mustwatch_video_from_the_bbc_looking_at/i2cgew1/,1648407286,1,True,True,False,UkraineConflict,t5_30oyx,r/UkraineConflict,public,,0,[],,1648378475.0,,,,
,[],False,,shropshireladdy,,,[],,,,text,t2_a3ls0141,False,False,So he is more talented than Orban,48b95e57c55b08aa957d497f2f48c94a68975a33,True,False,,,,,0,1648407210,,0,{},i2cg995,False,t3_tpl1ni,False,False,t3_tpl1ni,/r/UkraineConflict/comments/tpl1ni/lol_the_guy_is_a_hero_to_his_people_and_the_world/i2cg995/,1648407225,1,True,True,False,UkraineConflict,t5_30oyx,r/UkraineConflict,public,,0,[],,1648378410.0,,,,
,[],False,,Ok-TaiCantaloupe,,,[],,,,text,t2_jbbsgtjc,False,False,"After the betrayal of the voters, Zelensky stopped being our hero. Now, as an actor, he continues to speak for European partners, shutting up the free media in Ukraine and opposition parties.",ca8d5dfa76fa99b6dacbbde25962ec873efb0731,True,False,,,,,0,1648407180,,0,{},i2cg6nz,False,t3_tpl1ni,False,True,t3_tpl1ni,/r/UkraineConflict/comments/tpl1ni/lol_the_guy_is_a_hero_to_his_people_and_the_world/i2cg6nz/,1648407197,1,True,True,False,UkraineConflict,t5_30oyx,r/UkraineConflict,public,,0,[],,1648378380.0,,,,
,[],False,,Adventurous-Comb-324,,,[],,,,text,t2_b11dvxbp,False,False,Ignorant fucking peasants,6c44fbdf823e2f2965719dc1070be41a42e3344f,True,False,,,,,0,1648406938,,0,{},i2cflxq,False,t3_toslyi,False,True,t3_toslyi,/r/UkraineConflict/comments/toslyi/ordinary_russian_people_are_terrorizing_siege_of/i2cflxq/,1648406955,1,True,True,False,UkraineConflict,t5_30oyx,r/UkraineConflict,public,,0,[],,1648378138.0,,,,
,[],False,,TSIDATSI,,,[],,,,text,t2_71yaz2pp,False,True,I don't understand: can UK troop positions be compromised by such photos? I know Geraldo is not there.,661277085644a689d27bd543a7a0c03596adc326,True,False,,,,,0,1648406782,,0,{},i2cf8bt,False,t3_tpk3il,False,True,t3_tpk3il,/r/UkraineConflict/comments/tpk3il/footage_of_ukrainian_soldiers_fighting_and/i2cf8bt/,1648406798,1,True,True,False,UkraineConflict,t5_30oyx,r/UkraineConflict,public,,0,[],,1648377982.0,,,,
,[],False,,Ill-Preparation-4768,#a06324,,[],afa65fb4-a101-11ec-9a63-02a4aa3dad09,Kremlin Propagandist ,light,text,t2_cfg6rmqn,False,False,I live in a apartment,846e9d6da82ca403d82f3f03e369f2849bf5f1b8,True,False,,,,,0,1648406719,,0,{},i2cf2us,False,t3_top1lu,False,True,t1_i2awfxf,/r/UkraineConflict/comments/top1lu/czechs_remind_the_people_working_for_the_russian/i2cf2us/,1648406730,1,True,True,False,UkraineConflict,t5_30oyx,r/UkraineConflict,public,,0,[],,1648377919.0,,,,
,[],False,,Ogura_Tetsuka,,,[],,,,text,t2_aoro9n8e,False,False,yes,fb360f9c09ac8c5edb2f18be5de4e80ea4c430d0,True,False,,,,,0,1648406704,,0,{},i2cf1fw,False,t3_tp684u,False,True,t1_i2bnwf2,/r/UkraineConflict/comments/tp684u/another_video_of_russian_soldiers_taken_captive/i2cf1fw/,1648406715,1,True,True,False,UkraineConflict,t5_30oyx,r/UkraineConflict,public,,0,[],,1648377904.0,,,,
,[],False,,creativeusernameidkl,,,[],,,,text,t2_4l7a5g3w,False,False,"So US goverment was prepetuating Russian propaganda? CNN too? BBC? It uses fucking SS as a logo, come on man.  Ofcourse Its not a pretext for invasion, that is bullshit excuse. But we are letting a genie out of a bottle with this one. Calling out nazis =/= supporting invasion. I just prefer keeping nazism where it belongs-in a graveyard. They didnt transfer out any nazis. All the people who started it-still lead it.",633f30a5cf6bb767e924b999f261004270763a66,True,False,,,,,0,1648406534,,0,{},i2cemq6,False,t3_tpkwpr,False,True,t1_i2cdv1k,/r/UkraineConflict/comments/tpkwpr/powerful_mustwatch_video_from_the_bbc_looking_at/i2cemq6/,1648406550,1,True,True,False,UkraineConflict,t5_30oyx,r/UkraineConflict,public,,0,[],,1648377734.0,,,,
,[],False,,Big-Ad-1476,,,[],,,,text,t2_47om6bkn,False,False,"So because a Ukrainian militia, which was integrated into UA army and had the Nazis transferred out, kept its name, the Russian's have a right to use that as a pretext for invasion?",986fcc70be21d05857c5f018c2252d3a25ad88f1,True,False,,,,,0,1648406219,,0,{},i2cdv1k,False,t3_tpkwpr,False,True,t1_i2c67dk,/r/UkraineConflict/comments/tpkwpr/powerful_mustwatch_video_from_the_bbc_looking_at/i2cdv1k/,1648406236,1,True,True,False,UkraineConflict,t5_30oyx,r/UkraineConflict,public,,0,[],,1648377419.0,,,,
,[],False,,ArmChairAnalyst86,,,[],,,,text,t2_hj938hzd,False,False,Very striking footage. The scale of damage is put into context from the POV.,6c67ef38641b15fa9691f50adf530a9961a6aa7b,True,False,,,,,0,1648405896,,0,{},i2cd21s,False,t3_tpkqjn,False,True,t3_tpkqjn,/r/UkraineConflict/comments/tpkqjn/mariupol_before_and_after/i2cd21s/,1648405908,1,True,True,False,UkraineConflict,t5_30oyx,r/UkraineConflict,public,,0,[],,1648377096.0,,,,
,[],False,,Educational_Cap_1266,,,[],,,,text,t2_jv0x1mc0,False,False,U r saying as if any country except Israel or russia ever helped india. Look history dude. West was always against India. 1971 war for instance,ff9ad639c14d428ac035f4d9d6d6460d91a3de9f,True,False,,,,,0,1648405893,,0,{},i2cd1sc,False,t3_to4igu,False,True,t1_i25i1gi,/r/UkraineConflict/comments/to4igu/india_refuses_to_entertain_british_mps_coming_to/i2cd1sc/,1648405908,1,True,True,False,UkraineConflict,t5_30oyx,r/UkraineConflict,public,,0,[],,1648377093.0,,,,
,[],False,,Chemical-Zen-2468,,,[],,,,text,t2_k8mh54yp,False,False,Sooo young &amp; brain washed be easy on him,89fac15684ea3bb3965d40b3053c15bacbb0f8a8,True,False,,,,,0,1648405142,,0,{},i2cb8bz,False,t3_tp684u,False,True,t3_tp684u,/r/UkraineConflict/comments/tp684u/another_video_of_russian_soldiers_taken_captive/i2cb8bz/,1648405158,1,True,True,False,UkraineConflict,t5_30oyx,r/UkraineConflict,public,,0,[],,1648376342.0,,,,
,[],False,,Chemical-Zen-2468,,,[],,,,text,t2_k8mh54yp,False,False,Sad Putin not 1sr Short Fat man to send young kids to die in name of Russia! I love Russians &amp; im with their people as well as Ukrainianes! WANTED DEAD OR ALIVE=PUTIN &amp; this ends b4 the States sneak Trump back in office ...scary,2df756c452a8b46c680e0b48b0664930a8756a2d,True,False,,,,,0,1648405120,,0,{},i2cb6fd,False,t3_tp684u,False,True,t3_tp684u,/r/UkraineConflict/comments/tp684u/another_video_of_russian_soldiers_taken_captive/i2cb6fd/,1648405136,1,True,True,False,UkraineConflict,t5_30oyx,r/UkraineConflict,public,,0,[],,1648376320.0,,,,
,[],False,,Chemical-Zen-2468,,,[],,,,text,t2_k8mh54yp,False,False,Sad Putin not 1sr Short Fat man to send young kids to die in name of Russia! I love Russians &amp; im with their people as well as Ukrainianes! WANTED DEAD OR ALIVE=PUTIN &amp; this ends b4 the States sneak Trump back in office ...scary,2df756c452a8b46c680e0b48b0664930a8756a2d,True,False,,,,,0,1648405113,,0,{},i2cb5u6,False,t3_tp684u,False,True,t3_tp684u,/r/UkraineConflict/comments/tp684u/another_video_of_russian_soldiers_taken_captive/i2cb5u6/,1648405129,1,True,True,False,UkraineConflict,t5_30oyx,r/UkraineConflict,public,,0,[],,1648376313.0,,,,
,[],False,,Consistent_Rip_4671,,,[],,,,text,t2_d5emmwqk,False,False,The moan gets me every time lol,331e25019b238328218c24eaf6c4c8ce1af63bbd,True,False,,,,,0,1648404825,,0,{},i2cagna,False,t3_tpl4yw,False,True,t3_tpl4yw,/r/UkraineConflict/comments/tpl4yw/new_footage_showing_a_russian_t72b3_tank_being/i2cagna/,1648404837,1,True,True,False,UkraineConflict,t5_30oyx,r/UkraineConflict,public,,0,[],,1648376025.0,,,,
,[],False,,Inevitable-Pie-8020,,,[],,,,text,t2_78b591sq,False,False,"Glad, I'm not the only sane person here, I am firmly in the ukrainian camp, but what would be the point of being more barbaric than the invader",2391352c8132c99286c02e8bf22888672e11a7ae,True,False,,,,,0,1648404793,,0,{},i2cadxd,False,t3_torpiq,False,True,t1_i2bq2yu,/r/UkraineConflict/comments/torpiq/group_of_russian_soldiers_captured_by_ukrainian/i2cadxd/,1648404807,1,True,True,False,UkraineConflict,t5_30oyx,r/UkraineConflict,public,,0,[],,1648375993.0,,,,
,[],False,,NewDistrict6824,,,[],,,,text,t2_kd2n1evi,False,False,"You are a star 
Well done and keep this up 
Excellent work
Keep safe but keep talking!
Love your work!",15b29c925205365e8dbb13b6fa82dff3e604e41e,True,False,,,,,0,1648404733,,0,{},i2ca8r6,False,t3_tpkuno,False,True,t3_tpkuno,/r/UkraineConflict/comments/tpkuno/first_month_of_war_in_ukraine_russian_propaganda/i2ca8r6/,1648404747,1,True,True,False,UkraineConflict,t5_30oyx,r/UkraineConflict,public,,0,[],,1648375933.0,,,,
,[],False,,Prairie_drifter,,,[],,,,text,t2_8x57yuuk,False,False,"It's just a flesh wound, Russia Today probably",20b51703122ab68fd008ce10e7a47c567ca9fb2d,True,False,,,,,0,1648404548,,0,{},i2c9sh3,False,t3_tpk2jm,False,True,t3_tpk2jm,/r/UkraineConflict/comments/tpk2jm/the_russian_invasion_of_ukraine_is_literally/i2c9sh3/,1648404559,1,True,True,False,UkraineConflict,t5_30oyx,r/UkraineConflict,public,,0,[],,1648375748.0,,,,
,[],False,,Fckenstein,,,[],,,,text,t2_14xehe,False,False,"They were loaded in trucks and taken away shortly after, i saw the vids, its from taking some town near kharkiv i believe",8299ccfb6b8373846a2023b9224296d61b44cc39,True,False,,,,,0,1648404462,,0,{},i2c9kq2,False,t3_torpiq,False,True,t1_i27xqaz,/r/UkraineConflict/comments/torpiq/group_of_russian_soldiers_captured_by_ukrainian/i2c9kq2/,1648404476,1,True,True,False,UkraineConflict,t5_30oyx,r/UkraineConflict,public,,0,[],,1648375662.0,,,,
,[],False,,johnathanesanders,,,[],,,,text,t2_2ntntprn,False,False,"I think it speaks volumes about the training of the Russian military when in his army photograph, his finger is INSIDE the trigger guard on that rifle- while taking a peace time posed photo,

Now, before I get the gun control pile on in my statements below - I’m referencing BB/Pellet guns prior to around 12 years old, then shotgun and long rifle only until 16-18 years old, when they can move on to pistol. These are the same age groupings used by the Boy Scouts of America and other organizations that teach firearm safety and use. 


In America, we teach our kids early on about basic firearm safety, whether the firearm is loaded or not (because you ALWAYS treat it as tho it’s loaded with live ammunition). Among other things your finger never EVER enters the trigger guard, let alone touches the trigger, unless you are ready to fire. 

The guy in this picture is violating the basics, what other fundamental training are they missing?",5d7e79d06909065947ca8c9a54fdaeb4e2d4a43d,True,False,,,,,0,1648404334,,0,{},i2c98u0,False,t3_tpg3oj,False,True,t3_tpg3oj,/r/UkraineConflict/comments/tpg3oj/young_russian_solider_has_conscripted_up_to_the/i2c98u0/,1648404347,1,True,True,False,UkraineConflict,t5_30oyx,r/UkraineConflict,public,,0,[],,1648375534.0,,,,
,[],False,,mogg1001,,,[],,,,text,t2_1to9dc71,False,False,"Oop, looks like the war is no longer.",be2f985639aab718069d16dfdfc8ad0f3f692c38,True,False,,,,,0,1648404305,,0,{},i2c968d,False,t3_tpg3oj,False,True,t1_i2ayyd9,/r/UkraineConflict/comments/tpg3oj/young_russian_solider_has_conscripted_up_to_the/i2c968d/,1648404317,1,True,True,False,UkraineConflict,t5_30oyx,r/UkraineConflict,public,,0,[],,1648375505.0,,,,
,[],False,,Fckenstein,,,[],,,,text,t2_14xehe,False,False,"Then dont post this shit, he was there for 1 month, plenty of time to kill and loot.",3d340eb5f7c5da0a7a831f68e756302d4f8daaef,True,False,,,,,0,1648404259,,0,{},i2c9246,False,t3_tpg3oj,False,True,t1_i2b1imp,/r/UkraineConflict/comments/tpg3oj/young_russian_solider_has_conscripted_up_to_the/i2c9246/,1648404274,1,True,True,False,UkraineConflict,t5_30oyx,r/UkraineConflict,public,,0,[],,1648375459.0,,,,
,[],False,,Tman11967,,,[],,,,text,t2_8owi82zw,False,False,"It occurs to me that this may be an attempt to use Putin’s own paranoia against him. This confirms his worst fear and it’s also the truth. It’s like a fury sword of truth that stabs right into him. It also signals solid alliance with Poland and other countries that surround this conflict and are threatened by it, without promising direct military intervention. Lastly, he’s I’ll and will die soon or sooner. This statement will strengthen the “rightness” of the Western countries.",b1323edba49f992e0a3864912b8345f673138ed5,True,False,,,,,0,1648404213,,0,{},i2c8y1p,False,t3_tpd5pr,False,True,t3_tpd5pr,/r/UkraineConflict/comments/tpd5pr/did_joe_biden_go_too_far_putin_must_be_removed/i2c8y1p/,1648404224,1,True,True,False,UkraineConflict,t5_30oyx,r/UkraineConflict,public,,0,[],,1648375413.0,,,,
,[],False,,Legal_Refuse,,,[],,,,text,t2_13u196gn,False,False,Where is the bridge in the back. Is that even the same spot?,898b8dbb8947e4e43370b2617088c8e0586e08d0,True,False,,,,,0,1648404090,,0,{},i2c8nj9,False,t3_tppbti,False,True,t3_tppbti,/r/UkraineConflict/comments/tppbti/city_of_bucha_street_vokzalna_before_and_after/i2c8nj9/,1648404106,1,True,True,False,UkraineConflict,t5_30oyx,r/UkraineConflict,public,,0,[],,1648375290.0,,,,
,[],False,,SuperSpread,,,[],,,,text,t2_5q1d6yng,False,False,"It’s always trickier for Russian media to frame this because it begs the question what Biden is referring to.

Same if the Russian media reports that Ukraine is unwilling to negotiate peace. Why would that be if the mission was successful?",dee7317f2bcbb5c380df92cc6c2cda573ddab5c2,True,False,,,,,0,1648403782,,0,{},i2c7x5l,False,t3_tpmji1,False,True,t3_tpmji1,/r/UkraineConflict/comments/tpmji1/us_president_joe_biden_calls_putin_a_butcher/i2c7x5l/,1648403797,1,True,True,False,UkraineConflict,t5_30oyx,r/UkraineConflict,public,,0,[],,1648374982.0,,,,
,[],False,,creativeusernameidkl,,,[],,,,text,t2_4l7a5g3w,False,False,"Tbh it doesnt matter if those are russian talking points, because it is true. If nazis are long gone, why did US goverment block funding for them in 2018? Calling out evil doesnt instantly equate to supporting russia. And if we keep queit and downplay it, how are we any better then russian bots?  https://mobile.twitter.com/Liveuamap/status/1188041134943154177
Here is a link to a ukrainian artillery men outright refusing zelenskys orders to his face. We should support ukraine as much as we can, but it needs a real cleanup after this.",09762cc776285dac1e757d129e5da5ba9511d62c,True,False,,,,,0,1648403081,,0,{},i2c67dk,False,t3_tpkwpr,False,True,t1_i2c527v,/r/UkraineConflict/comments/tpkwpr/powerful_mustwatch_video_from_the_bbc_looking_at/i2c67dk/,1648403097,1,True,True,False,UkraineConflict,t5_30oyx,r/UkraineConflict,public,,0,[],,1648374281.0,,,,
,[],False,,HEMMAAN,,,[],,,,text,t2_a1njhom6,False,False,Its more likely that we will see a West China after China buying half of Russia.,ab599dfa73ed2c754cd614db91b18b4fc1e3af41,True,False,,,,,0,1648402981,,0,{},i2c5yp9,False,t3_tpl9tr,False,True,t3_tpl9tr,/r/UkraineConflict/comments/tpl9tr/military_intelligence_russia_wants_to_split/i2c5yp9/,1648402992,1,True,True,False,UkraineConflict,t5_30oyx,r/UkraineConflict,public,,0,[],,1648374181.0,True,,,
,[],False,,d1ndeed,,,[],,,,text,t2_4tgloc15,False,False,"Of course it is, you see and hear whats comforting to you.",2016fa132090f4711d5dbbe8eefdd75ef493ffb2,True,False,,,,,0,1648402685,,0,{},i2c58jo,False,t3_tpg3oj,False,True,t1_i2bthq5,/r/UkraineConflict/comments/tpg3oj/young_russian_solider_has_conscripted_up_to_the/i2c58jo/,1648402699,1,True,True,False,UkraineConflict,t5_30oyx,r/UkraineConflict,public,,0,[],,1648373885.0,,,,
,[],False,,Big-Ad-1476,,,[],,,,text,t2_47om6bkn,False,False,"Way to repeat Russian talking points.

Aziv has been incorporated into the UA army and the Nazis are long gone.

Russians on the other hand, support neo-nazi movements openly, as in the link above.  This is one of their top officials, even now.",4ad4f4116976c014fdf7e8d6233b2633318ffda2,True,False,,,,,0,1648402613,,0,{},i2c527v,False,t3_tpkwpr,False,False,t1_i2c3gpz,/r/UkraineConflict/comments/tpkwpr/powerful_mustwatch_video_from_the_bbc_looking_at/i2c527v/,1648402630,1,True,True,False,UkraineConflict,t5_30oyx,r/UkraineConflict,public,,0,[],,1648373813.0,,,,
,[],False,,ericallenjett,,,[],,,,text,t2_2fikb5yc,False,False,Reasons why Putin needs to be removed from office.,f369061dec85ea9b5bfaadca454c4310ea83be81,True,False,,,,,0,1648402375,,0,{},i2c4hbt,False,t3_tpg3oj,False,True,t3_tpg3oj,/r/UkraineConflict/comments/tpg3oj/young_russian_solider_has_conscripted_up_to_the/i2c4hbt/,1648402386,1,True,True,False,UkraineConflict,t5_30oyx,r/UkraineConflict,public,,0,[],,1648373575.0,,,,
,[],False,,Bellica_Animi,,,[],,,,text,t2_jv39inhu,False,False,I hate this new form of racism.,28e045144a0347d0de1a11692af3f272546dff59,True,False,,,,,0,1648402193,,0,{},i2c40ux,False,t3_towtk5,False,True,t1_i291o6l,/r/UkraineConflict/comments/towtk5/in_mariupol_a_russian_occupier_shot_an_11yearold/i2c40ux/,1648402208,1,True,True,False,UkraineConflict,t5_30oyx,r/UkraineConflict,public,,0,[],,1648373393.0,,,,
,[],False,,ericallenjett,,,[],,,,text,t2_2fikb5yc,False,False,A resounding NO.,65fcd4ad7298b3d5f5abb588050fcfa821de05ab,True,False,,,,,0,1648401982,,0,{},i2c3ifr,False,t3_tpl9tr,False,True,t3_tpl9tr,/r/UkraineConflict/comments/tpl9tr/military_intelligence_russia_wants_to_split/i2c3ifr/,1648401994,1,True,True,False,UkraineConflict,t5_30oyx,r/UkraineConflict,public,,0,[],,1648373182.0,,,,
,[],False,,creativeusernameidkl,,,[],,,,text,t2_4l7a5g3w,False,False,"Do you really want me to link you a compilation of MSM, from CNN ans CBS to FOX calling azov nazis? Or you can go to aikipedia anout azov, and see EVEN US government blocked some millitary aid for azov due to nazism. I get Russia propaganda and all, but come on. They are nazis",3116f20549e51cd6bfd1ac20e76706b617aff778,True,False,,,,,0,1648401962,,0,{},i2c3gpz,False,t3_tpkwpr,False,True,t1_i2bxlap,/r/UkraineConflict/comments/tpkwpr/powerful_mustwatch_video_from_the_bbc_looking_at/i2c3gpz/,1648401979,1,True,True,False,UkraineConflict,t5_30oyx,r/UkraineConflict,public,,0,[],,1648373162.0,,,,
,[],False,,Fckenstein,,,[],,,,text,t2_14xehe,False,False,"Fk russians, mad bruh?",6c5df6794b01cf77cfe58c9c04ddb594451d47f6,True,False,,,,,0,1648401840,,0,{},i2c368e,False,t3_tp684u,False,True,t1_i2c2kjy,/r/UkraineConflict/comments/tp684u/another_video_of_russian_soldiers_taken_captive/i2c368e/,1648401852,1,True,True,False,UkraineConflict,t5_30oyx,r/UkraineConflict,public,,0,[],,1648373040.0,,,,
,[],False,,vergorli,,,[],,,,text,t2_4dmkg9cb,False,False,Stating the obvious.,9230fb03881bd21f7f36d7e601c988048af56429,True,False,,,,,0,1648401830,,0,{},i2c35eg,False,t3_tpl1ni,False,True,t1_i2buoq2,/r/UkraineConflict/comments/tpl1ni/lol_the_guy_is_a_hero_to_his_people_and_the_world/i2c35eg/,1648401844,1,True,True,False,UkraineConflict,t5_30oyx,r/UkraineConflict,public,,0,[],,1648373030.0,,,,
,[],False,,HeavyLogix,,,[],,,,text,t2_9yf7l7ap,False,False,"&gt; “They” 

Yes, the hive mind and collective conscious that is all Russians.  

Fuck off moron",61a75d6ddc966d9340b8ef92fb60661f12e146b3,True,False,,,,,0,1648401587,,0,{},i2c2kjy,False,t3_tp684u,False,True,t1_i2bisf8,/r/UkraineConflict/comments/tp684u/another_video_of_russian_soldiers_taken_captive/i2c2kjy/,1648401599,1,True,True,False,UkraineConflict,t5_30oyx,r/UkraineConflict,public,,0,[],,1648372787.0,,,,
,[],False,,P-Square1134,,,[],,,,text,t2_63mr21l0,False,False,Thanks! Kinda weird they decide to blurt that.,88d8643e6d50bc2afd71d16ded19447e693a3213,True,False,,,,,0,1648401499,,0,{},i2c2cym,False,t3_tpk3il,False,True,t1_i2c0wdu,/r/UkraineConflict/comments/tpk3il/footage_of_ukrainian_soldiers_fighting_and/i2c2cym/,1648401517,1,True,True,False,UkraineConflict,t5_30oyx,r/UkraineConflict,public,,0,[],,1648372699.0,,,,
