Unnamed: 0,all_awardings,archived,associated_award,author,author_flair_background_color,author_flair_css_class,author_flair_richtext,author_flair_template_id,author_flair_text,author_flair_text_color,author_flair_type,author_fullname,author_patreon_flair,author_premium,body,body_sha1,can_gild,collapsed,collapsed_because_crowd_control,collapsed_reason,collapsed_reason_code,comment_type,controversiality,created_utc,distinguished,gilded,gildings,id,is_submitter,link_id,locked,no_follow,parent_id,permalink,retrieved_utc,score,score_hidden,send_replies,stickied,subreddit,subreddit_id,subreddit_name_prefixed,subreddit_type,top_awarded_type,total_awards_received,treatment_tags,unrepliable_reason,created,author_cakeday,edited,editable,media_metadata
,[],False,,BGpolyhistor,,,[],,,,text,t2_nnrnpw,False,False,Pretty messed up that the Internet knows and his parents probably don’t.,db5486945990477d974aeaa3dc596a935a840811,True,False,,,,,0,1648425565,,0,{},i2djpe0,False,t3_tpg3oj,False,True,t3_tpg3oj,/r/UkraineConflict/comments/tpg3oj/young_russian_solider_has_conscripted_up_to_the/i2djpe0/,1648425582,1,True,True,False,UkraineConflict,t5_30oyx,r/UkraineConflict,public,,0,[],,1648396765.0,,,,
,[],False,,WhiteNoise_1981,,,[],,,,text,t2_k4taogwg,False,False,This is what happens when you shovel so much rubbish with fake propaganda even the people making the propaganda up start to believe it.,f30000b4aa62a1be377d67875f0c0a5c7d0d2b7e,True,False,,,,,0,1648425500,,0,{},i2djkjj,False,t3_tpw9lw,False,True,t3_tpw9lw,/r/UkraineConflict/comments/tpw9lw/russias_current_war_effort_going_so_well_some/i2djkjj/,1648425511,1,True,True,False,UkraineConflict,t5_30oyx,r/UkraineConflict,public,,0,[],,1648396700.0,,,,
,[],False,,Prior-Ranger8092,,,[],,,,text,t2_9epgbi1w,False,False,"The picture of the wreckage is 3 weeks old.

Why am I seeing this?",f2bcccf4c692691366e0265ceeb55a907979f3c4,True,False,,,,,0,1648425438,,0,{},i2djfwo,False,t3_tppbti,False,True,t3_tppbti,/r/UkraineConflict/comments/tppbti/city_of_bucha_street_vokzalna_before_and_after/i2djfwo/,1648425453,1,True,True,False,UkraineConflict,t5_30oyx,r/UkraineConflict,public,,0,[],,1648396638.0,,,,
,[],False,,Stressedup,,,[],,,,text,t2_r6p5e,False,False,"I mean, my classmates signed up for Iraq at aged 17, and reported for duty once they turned 18. 

Our local high schools have recruitment offices in them 5 days a week all school year. 

So I’d say the US military definitely has a large number of barely legal kids in it. 

None of the vets I know who served in Iraq and/or Afghanistan were old enough to legally drink when they started their first tour.",1825f47ad4837532e5cbd042f8a7ec92883c92f0,True,False,,,,,0,1648425199,,0,{},i2dixsu,False,t3_tpg3oj,False,True,t1_i2bhopz,/r/UkraineConflict/comments/tpg3oj/young_russian_solider_has_conscripted_up_to_the/i2dixsu/,1648425212,1,True,True,False,UkraineConflict,t5_30oyx,r/UkraineConflict,public,,0,[],,1648396399.0,,,,
,[],False,,red5commander,,,[],,,,text,t2_6xw1db8k,False,False,Balls of steel.,8375d71f96f58f45e09236bffb0d3f188a21b18c,True,False,,,,,0,1648424923,,0,{},i2dicv0,False,t3_tpkac4,False,True,t3_tpkac4,/r/UkraineConflict/comments/tpkac4/watch_ukrainian_forces_beautifully_attacking/i2dicv0/,1648424935,1,True,True,False,UkraineConflict,t5_30oyx,r/UkraineConflict,public,,0,[],,1648396123.0,,,,
,[],False,,richsmith45,,,[],,,,text,t2_3ht487j8,False,False,He looks like he hasn’t lost his virginity yet let alone has a fucking clue what’s going on in Ukraine the small dick looking pussy,192a59b4d7b4a55f903885f38edc37484593ac50,True,False,,,,,0,1648424803,,0,{},i2di3rm,False,t3_tpudrn,False,True,t3_tpudrn,/r/UkraineConflict/comments/tpudrn/russian_politician_suggested_to_invade_other/i2di3rm/,1648424814,1,True,True,False,UkraineConflict,t5_30oyx,r/UkraineConflict,public,,0,[],,1648396003.0,,,,
,[],False,,StupidizeMe,,,[],,,,text,t2_3qltpbcr,False,False,"In the Soviet Union's war with Afghanistan they lost 15,000 soldiers OVER 7 YEARS.

 After the Soviet Union withdrew from Afghanistan, the Berlin Wall came down...and Vladimir Putin was a KGB Colonel right there in East Germany at Stasi (secret police) headquarters, rushing to burn secret documents and nervously wondering if the crowd of demonstrators would seek vengeance. As we all know, after that the Soviet Union collapsed.

In their invasion of Ukraine, Russia has lost 15,000 soldiers IN ONE MONTH. Russia has also lost a fortune in high tech military equipment, they've been hit with crippling economic sanctions, assets have been seized, and the value of the Russian Ruble has collapsed.

Putin must be drawing parallels with what happened in the past.",f59e2952b516bb52ce57dea12f3accad5ac75eeb,True,False,,,,,0,1648424707,,0,{},i2dhwjp,True,t3_tpw2ar,False,True,t3_tpw2ar,/r/UkraineConflict/comments/tpw2ar/watch_could_be_a_big_problem_for_you_security/i2dhwjp/,1648424720,1,True,True,False,UkraineConflict,t5_30oyx,r/UkraineConflict,public,,0,[],,1648395907.0,,,,
,[],False,,Ok-Calligrapher-7517,,,[],,,,text,t2_a2rkjqff,False,False,Russian trolls have really stepped it up a notch these last few weeks. I've noticed.,1366c45a4cc73afb9a37a69131c5870f7b612959,True,False,,,,,0,1648424673,,0,{},i2dhu15,False,t3_tpvuew,False,False,t3_tpvuew,/r/UkraineConflict/comments/tpvuew/seems_like_putins_internet_trolls_are_trying_to/i2dhu15/,1648424684,1,True,True,False,UkraineConflict,t5_30oyx,r/UkraineConflict,public,,0,[],,1648395873.0,,,,
,[],False,,KalashaCola,,,[],,,,text,t2_j30antwq,False,False,It's almost as if this guy sniffs Cosmoline for fun.,31f3cb97091c615a03eebe4e2d6c897133c5120a,True,False,,,,,0,1648424594,,0,{},i2dho1d,True,t3_tpw9lw,False,True,t3_tpw9lw,/r/UkraineConflict/comments/tpw9lw/russias_current_war_effort_going_so_well_some/i2dho1d/,1648424605,1,True,True,False,UkraineConflict,t5_30oyx,r/UkraineConflict,public,,0,[],,1648395794.0,,,,
,[],False,,twitterStatus_Bot,,,[],,,,text,t2_d38zaa6k,False,False,"A \#Moscow City Duma deputy suggested that six more countries - \#Kazakhstan, \#Moldova, \#Poland, \#Lithuania, \#Latvia, and \#Estonia - should be ""denazified"". 

---

Photos in tweet | [photo 1](https://pbs.twimg.com/media/FOvwksaWYAkIaxe.jpg) | [photo 2](https://pbs.twimg.com/media/FOvwmvYX0AMBvNj.jpg)

---

posted by [@nexta_tv](https://twitter.com/nexta_tv/)

---

^(If media is missing, please DM me with a link to submission url and tweet. I will do my best to solve the issue)",2508caa06f8c0ff2332ae443458ac2fde1274823,True,False,,,,,0,1648424582,,0,{},i2dhn6x,False,t3_tpw9lw,False,True,t3_tpw9lw,/r/UkraineConflict/comments/tpw9lw/russias_current_war_effort_going_so_well_some/i2dhn6x/,1648424598,1,True,True,False,UkraineConflict,t5_30oyx,r/UkraineConflict,public,,0,[],,1648395782.0,,,,
,[],False,,KalashaCola,,,[],,,,text,t2_j30antwq,False,False,I'm going to say this the nicest way I can but how much more does this guy want?,50a6a5e41c6a0e9d0de8e6da0629032ea2219bd3,True,False,,,,,0,1648424325,,0,{},i2dh3xm,False,t3_tpu13v,False,True,t3_tpu13v,/r/UkraineConflict/comments/tpu13v/zelenskyy_west_needs_more_courage_in_helping/i2dh3xm/,1648424337,1,True,True,False,UkraineConflict,t5_30oyx,r/UkraineConflict,public,,0,[],,1648395525.0,,,,
,[],False,,KalashaCola,,,[],,,,text,t2_j30antwq,False,False,Goddamn. Roasted.,8ac03346db2e0382a9e4db0c2947df0c5f3f225d,True,False,,,,,0,1648424236,,0,{},i2dgx9y,False,t3_tpl1ni,False,True,t1_i2d6e8u,/r/UkraineConflict/comments/tpl1ni/lol_the_guy_is_a_hero_to_his_people_and_the_world/i2dgx9y/,1648424251,1,True,True,False,UkraineConflict,t5_30oyx,r/UkraineConflict,public,,0,[],,1648395436.0,,,,
,[],False,,Razzmatazz12345,,,[],,,,text,t2_a1ol9vxp,False,False,"You might not, but the majority of Western Europeans, European Americans, and European Canadians do. They treat Asians, Africans, and Latin Americans like monoliths while having empathy for anti-war, anti-Putin Russian progressives.",262e13b032004e46c86d7d83f412a6194199230e,True,False,,,,,0,1648424230,,0,{},i2dgwqv,False,t3_tpg3oj,False,True,t1_i2dgjzz,/r/UkraineConflict/comments/tpg3oj/young_russian_solider_has_conscripted_up_to_the/i2dgwqv/,1648424244,1,True,True,False,UkraineConflict,t5_30oyx,r/UkraineConflict,public,,0,[],,1648395430.0,,,,
,[],False,,poopiwoopi1,,,[],,,,text,t2_78juhh4b,False,False,"In photo appears to be an AK 103 or akm with an M4 standard issue style stock and buffer on it. You can see the white numbers of the rear sight block, which AK-12 doesn't have, and the dust cover is round when the AK-12 is a pic rail, and the magazine appears ribbed like the classic metal 7.62 magazines",99e46a5e8bbe0976ae09ae3917e3940ebd4f2f93,True,False,,,,,0,1648424190,,0,{},i2dgttm,False,t3_tpg3oj,False,True,t1_i2co7ud,/r/UkraineConflict/comments/tpg3oj/young_russian_solider_has_conscripted_up_to_the/i2dgttm/,1648424201,1,True,True,False,UkraineConflict,t5_30oyx,r/UkraineConflict,public,,0,[],,1648395390.0,,,,
,[],False,,Ultradarkix,,,[],,,,text,t2_104toc,False,False,In a dictatorship or monarchy it’s not really up to the people whatever their government does until a major revolt (which is usually led by someone in the government anyways” and are usually repressed to i wouldn’t blame saudi citizens or chinese citizens.,81a1aa466b7ffbc508c0b08d8982b3740ab60c36,True,False,,,,,0,1648424058,,0,{},i2dgjzz,False,t3_tpg3oj,False,True,t1_i2dffmx,/r/UkraineConflict/comments/tpg3oj/young_russian_solider_has_conscripted_up_to_the/i2dgjzz/,1648424071,1,True,True,False,UkraineConflict,t5_30oyx,r/UkraineConflict,public,,0,[],,1648395258.0,,,,
,[],False,,poopiwoopi1,,,[],,,,text,t2_78juhh4b,False,False,No more amusing than seeing American 17 year olds dying in the middle east. Neither should happen.,52065e357ee3f0b891c38e9707bae0f63869fdd1,True,False,,,,,0,1648423967,,0,{},i2dgcz8,False,t3_tpg3oj,False,True,t1_i2ddqff,/r/UkraineConflict/comments/tpg3oj/young_russian_solider_has_conscripted_up_to_the/i2dgcz8/,1648423984,1,True,True,False,UkraineConflict,t5_30oyx,r/UkraineConflict,public,,0,[],,1648395167.0,,,,
,[],False,,pmmeaslice,,,[],,,,text,t2_k33tinpw,False,False,Shit or get off the crapper. That's my advice for you.,fd038bedf05060cfb371096dc49f7fd39cd0d539,True,False,,,,,0,1648423708,,0,{},i2dftbg,False,t3_tpkwpr,False,True,t1_i2cemq6,/r/UkraineConflict/comments/tpkwpr/powerful_mustwatch_video_from_the_bbc_looking_at/i2dftbg/,1648423721,1,True,True,False,UkraineConflict,t5_30oyx,r/UkraineConflict,public,,0,[],,1648394908.0,,,,
,[],False,,Razzmatazz12345,,,[],,,,text,t2_a1ol9vxp,False,False,"If Putin goes to the Hague and Bush doesn't, it sends the message that Western Europeans, European Americans, European Australians, and European Canadians are above laws. 

That's why I support both or neither. A law is only a law if it is applied equally to everyone.",90158589942b6386b7db58786bdbdcbe957920b6,True,False,,,,,0,1648423676,,0,{},i2dfqvx,False,t3_tpg3oj,False,True,t1_i2cn3jz,/r/UkraineConflict/comments/tpg3oj/young_russian_solider_has_conscripted_up_to_the/i2dfqvx/,1648423691,1,True,True,False,UkraineConflict,t5_30oyx,r/UkraineConflict,public,,0,[],,1648394876.0,,,,
,[],False,,Razzmatazz12345,,,[],,,,text,t2_a1ol9vxp,False,False,"It's funny how people only say what you say when it comes to European, North American, and Antipodean governments.

If people from these regions can talk about Saudis and Chinese people the way they do, I can talk about Russians and Americans the way I do.",6258e35901314719899387bde1b09ea471d9ed2d,True,False,,,,,0,1648423530,,0,{},i2dffmx,False,t3_tpg3oj,False,True,t1_i2df1am,/r/UkraineConflict/comments/tpg3oj/young_russian_solider_has_conscripted_up_to_the/i2dffmx/,1648423545,1,True,True,False,UkraineConflict,t5_30oyx,r/UkraineConflict,public,,0,[],,1648394730.0,,,,
,[],False,,Ultradarkix,,,[],,,,text,t2_104toc,False,False,It’s not “russians and americans” it’s russian and american governments.,8a9dfcc889e5d86c6f90977b276de4d1c403cbf0,True,False,,,,,0,1648423343,,0,{},i2df1am,False,t3_tpg3oj,False,True,t1_i2b8sks,/r/UkraineConflict/comments/tpg3oj/young_russian_solider_has_conscripted_up_to_the/i2df1am/,1648423356,1,True,True,False,UkraineConflict,t5_30oyx,r/UkraineConflict,public,,0,[],,1648394543.0,,,,
,[],False,,Ultradarkix,,,[],,,,text,t2_104toc,False,False,"Yea but there’s a reason every nazi soldier wasn’t instantly detained and tried. Because a dude who was literally a child months prior shouldn’t just be naturally expected to rise up against probably the only place he’s ever lived and has his parents friends and family, and desert everything. The Russian government is to blame here not him",68039049bc627da0ca8d164fb1940c4c37dbe25a,True,False,,,,,0,1648423287,,0,{},i2dex1l,False,t3_tpg3oj,False,True,t1_i2bafb6,/r/UkraineConflict/comments/tpg3oj/young_russian_solider_has_conscripted_up_to_the/i2dex1l/,1648423305,1,True,True,False,UkraineConflict,t5_30oyx,r/UkraineConflict,public,,0,[],,1648394487.0,,,,
,[],False,,Highlord_Salem,,,[],,,,text,t2_9qrhl698,False,False,Good find mate. In someway it's help humanise that situation. Reading his bio and stuff. Put alot into perspective,0b8dfd5a954af0c593004214e52f18b3bdc5703e,True,False,,,,,0,1648423280,,0,{},i2dewir,False,t3_tp684u,False,True,t1_i2d2v75,/r/UkraineConflict/comments/tp684u/another_video_of_russian_soldiers_taken_captive/i2dewir/,1648423298,1,True,True,False,UkraineConflict,t5_30oyx,r/UkraineConflict,public,,0,[],,1648394480.0,,,,
,[],False,,rodmjay,,,[],,,,text,t2_zfh7z,False,False,Not really sad at all.  Amusing,e458511bd4ee0de5e4a123b680e5a578733379c9,True,False,,,,,0,1648422739,,0,{},i2ddqff,False,t3_tpg3oj,False,True,t1_i2b6rfo,/r/UkraineConflict/comments/tpg3oj/young_russian_solider_has_conscripted_up_to_the/i2ddqff/,1648422753,1,True,True,False,UkraineConflict,t5_30oyx,r/UkraineConflict,public,,0,[],,1648393939.0,,,,
,[],False,,WXbearjaws,,,[],,,,text,t2_b8gn72j0,False,False,"So what you’re saying is that, because Russia is bigger and stronger, Ukraine should just roll over and die

Maybe ask the Ukrainians what they think about that? I’m sure they’d LOVE to hear your opinion on the subject",cc66fef0c03236d5c2b46d631c62edd2dc74ecaa,True,False,,,,,0,1648422650,,0,{},i2ddjsa,False,t3_too5sk,False,True,t1_i2dcpdp,/r/UkraineConflict/comments/too5sk/why_ukraine_should_surrender/i2ddjsa/,1648422661,1,True,True,False,UkraineConflict,t5_30oyx,r/UkraineConflict,public,,0,[],,1648393850.0,,,,
,[],False,,MysteryDildoBandit,,,[],,,,text,t2_14z1sk,False,False,Lets not be naive. By tomorrow that goat is gonna need years of therapy,4b1cace004abef65fadbc359ea71ff898ca45df6,True,False,,,,,0,1648422641,,0,{},i2ddj42,False,t3_tpp4e1,False,True,t1_i2ci41s,/r/UkraineConflict/comments/tpp4e1/watch_kadyrovtsy_chechens_successfully_captured_a/i2ddj42/,1648422653,1,True,True,False,UkraineConflict,t5_30oyx,r/UkraineConflict,public,,0,[],,1648393841.0,,,,
,[],False,,SubstantialArt9001,,,[],,,,text,t2_b0x258lj,False,False,Yeah invade your own country,51d88f177b956ae86b74fa7c28f2fb52994e671c,True,False,,,,,0,1648422393,,0,{},i2dd0ix,False,t3_tpudrn,False,True,t3_tpudrn,/r/UkraineConflict/comments/tpudrn/russian_politician_suggested_to_invade_other/i2dd0ix/,1648422420,1,True,True,False,UkraineConflict,t5_30oyx,r/UkraineConflict,public,,0,[],,1648393593.0,,,,
,[],False,,voice-of-hermes,,,[],,,,text,t2_j32rw,False,False,"&gt; No ones apologizing for fascism

You are.

&gt;  if you think it’s ok for Russia to do what it’s doing

Nope.  That's 100% your strawman.  And such moral judgements (""okay/justified"") are completely irrelevant here anyway.  Scream all you want about injustice; it changes nothing.  The question is what should be done in the light of the context of nation-states and how they behave.  Something that's clearly way, way, *way* over your head.  Anyone is free to go back up to my original comment in this exchange to see exactly where I called it:

&gt; If you think this is a *moral* argument, then you just have no idea how nation-states and geopolitics work, and you don't know what a humanitarian and anti-war argument looks like (liberal).  You might want to brush up on these things.

So, back to square one where you are in over your head.  No point continuing this further with you.  Replying again would be a waste of time and energy.  Go educate yourself; you do no one any good by yapping about things you don't understand.",eae6116b955100ad1187b8697a506ddbbb533ed2,True,False,,,,,0,1648422245,,0,{},i2dcpdp,False,t3_too5sk,False,True,t1_i2dbpf8,/r/UkraineConflict/comments/too5sk/why_ukraine_should_surrender/i2dcpdp/,1648422264,1,True,True,False,UkraineConflict,t5_30oyx,r/UkraineConflict,public,,0,[],,1648393445.0,,,,
,[],False,,Proxymal,,,[],,,,text,t2_10ej6xeq,False,False,Obviously protesting gets you no where in Russia but a cold cell. Time to rebel.,f69c4ef2d18660ce1d08827400fd902334b0c5c8,True,False,,,,,0,1648422070,,0,{},i2dccsg,False,t3_tpsgqy,False,True,t3_tpsgqy,/r/UkraineConflict/comments/tpsgqy/a_russian_artist_doused_herself_in_fake_blood_in/i2dccsg/,1648422087,1,True,True,False,UkraineConflict,t5_30oyx,r/UkraineConflict,public,,0,[],,1648393270.0,,,,
,[],False,,SubstantialArt9001,,,[],,,,text,t2_b0x258lj,False,False,You have a very 1 sided view. But I guess with you media being government controlled you don’t know better.  Your saying Ukraine can’t win against Russia well I’m saying the opposite.. As you say only English speaking world agrees I think you have a skewered view on that maybe you need to go see how many non English countries are against this war. I hope you enjoy the USSR again with all the trappings and without ukraini,30dac9b2f25178499c1bd3bef91bd963e9137138,True,False,,,,,0,1648422045,,0,{},i2dcb0y,False,t3_too5sk,False,True,t1_i2clgp1,/r/UkraineConflict/comments/too5sk/why_ukraine_should_surrender/i2dcb0y/,1648422058,1,True,True,False,UkraineConflict,t5_30oyx,r/UkraineConflict,public,,0,[],,1648393245.0,,,,
,[],False,,WXbearjaws,,,[],,,,text,t2_b8gn72j0,False,False,"Lmfao, fuck outta here.

The people of Ukraine want to fight for their freedom. Who the fuck are you or this guy In the video to say they should roll-over and let Russia have their way with them?",802b9ccee4ed1de414cb5e05f121197a8849d588,True,False,,,,,0,1648421981,,0,{},i2dc6mg,False,t3_too5sk,False,True,t1_i2d91dq,/r/UkraineConflict/comments/too5sk/why_ukraine_should_surrender/i2dc6mg/,1648421993,1,True,True,False,UkraineConflict,t5_30oyx,r/UkraineConflict,public,,0,[],,1648393181.0,,,,
,[],False,,WXbearjaws,,,[],,,,text,t2_b8gn72j0,False,False,"No ones apologizing for fascism, because it cannot be apologized for. It’s a twisted ideology

However, if you think it’s ok for Russia to do what it’s doing because of a small contingent of fascists in Ukraine, you’re out of your mind

The Anschluss of Austria and the taking of Sudentenland and later most of the rest of Czechoslovakia was done by the Nazis under the pretense of “protecting Germanic speaking peoples”

Sounds awfully familiar to what Putin has been trying to do in eastern Ukraine the past 8 years",cf808f2fb32c5e6d381fea30fe00593ed4ed0456,True,False,,,,,0,1648421737,,0,{},i2dbpf8,False,t3_too5sk,False,True,t1_i2dahd3,/r/UkraineConflict/comments/too5sk/why_ukraine_should_surrender/i2dbpf8/,1648421753,1,True,True,False,UkraineConflict,t5_30oyx,r/UkraineConflict,public,,0,[],,1648392937.0,,,,
,[],False,,Virtual_Cod_1840,,,[],,,,text,t2_8duytmgl,False,False,Macron is about to have his own Chamberlain moment.,682144cc5479e2739516c469840229f9ad00cd88,True,False,,,,,0,1648421603,,0,{},i2dbfpu,False,t3_tpl9tr,False,True,t3_tpl9tr,/r/UkraineConflict/comments/tpl9tr/military_intelligence_russia_wants_to_split/i2dbfpu/,1648421614,1,True,True,False,UkraineConflict,t5_30oyx,r/UkraineConflict,public,,0,[],,1648392803.0,,,,
,[],False,,voice-of-hermes,,,[],,,,text,t2_j32rw,False,False,"You, at the muggee: *Fight!  Fight!  Fight!  Get your brains blown out, so your mugger can get your wallet AND leave your dead body on the floor!*

You, at anyone suggesting that the person being mugged stay alive: *HOW DARE YOU!  YOU SUPPORT MUGGERS!!!!!*

Okay.  If you're not illiterate, then you are something far, *FAR* worse.  I'll leave it for others to make up their minds on that one.  Responding to you further would be a complete waste of time and energy.",0922b6cf94ed869423088a7b53e0bd8dcc02f9a2,True,False,,,,,0,1648421487,,0,{},i2db7gh,False,t3_too5sk,False,True,t1_i2d9g3v,/r/UkraineConflict/comments/too5sk/why_ukraine_should_surrender/i2db7gh/,1648421500,1,True,True,False,UkraineConflict,t5_30oyx,r/UkraineConflict,public,,0,[],,1648392687.0,,,,
,[],False,,Virtual_Cod_1840,,,[],,,,text,t2_8duytmgl,False,False,Niet.,b0c4264dd3a6663fa19d9ca176f2e47e6d896e02,True,False,,,,,0,1648421412,,0,{},i2db1v8,False,t3_tpl9tr,False,True,t3_tpl9tr,/r/UkraineConflict/comments/tpl9tr/military_intelligence_russia_wants_to_split/i2db1v8/,1648421428,1,True,True,False,UkraineConflict,t5_30oyx,r/UkraineConflict,public,,0,[],,1648392612.0,,,,
,[],False,,Strawberry-Obvious,,,[],,,,text,t2_7q5z9fe7,False,False,"What implications?  This is just an airborne command post.  We use them domestically during natural disasters.  This isn’t something they just haul out for nuclear war exclusively, although it is designed with that purpose in mind.  It makes sense to bring it to Europe while the president is in Europe as a precaution, would be pretty embarrassing if it turned out to be needed and it was sitting in a hangar at Andrews AFB.",e2c9e6269f185ccc6042b836a4a03a28c8df69f4,True,False,,,,,0,1648421276,,0,{},i2das0i,False,t3_tpfqlg,False,True,t1_i2bnawb,/r/UkraineConflict/comments/tpfqlg/us_sends_nukeproof_doomsday_plane_boeing_747_e4b/i2das0i/,1648421289,1,True,True,False,UkraineConflict,t5_30oyx,r/UkraineConflict,public,,0,[],,1648392476.0,,,,
,[],False,,voice-of-hermes,,,[],,,,text,t2_j32rw,False,False,"&gt; Anyone against Russia is a fascist, got it lmao.

Nope.  Anyone who apologizes for fascism is a fascist.  That'd be you.  Anyone is welcome to go a few comments up to see the fascism you are denying...and that you're now doubling down on.",2f521191ffd62c91cd29d7c40758b87b59307ca4,True,False,,,,,0,1648421123,,0,{},i2dahd3,False,t3_too5sk,False,False,t1_i2d9qo0,/r/UkraineConflict/comments/too5sk/why_ukraine_should_surrender/i2dahd3/,1648421137,1,True,True,False,UkraineConflict,t5_30oyx,r/UkraineConflict,public,,0,[],,1648392323.0,,,,
,[],False,,deadlyruckas,,,[],,,,text,t2_djtumyd5,False,False,"Didn't he play the president in the last TV show he was in??

That's a nice bit of experience",9720c0115e6fe45e49850ba32ed2f66664233376,True,False,,,,,0,1648420772,,0,{},i2d9s27,False,t3_tpl1ni,False,True,t3_tpl1ni,/r/UkraineConflict/comments/tpl1ni/lol_the_guy_is_a_hero_to_his_people_and_the_world/i2d9s27/,1648420783,1,True,True,False,UkraineConflict,t5_30oyx,r/UkraineConflict,public,,0,[],,1648391972.0,,,,
,[],False,,WXbearjaws,,,[],,,,text,t2_b8gn72j0,False,False,"Anyone against Russia is a fascist, got it lmao.

You’re on the wrong side of history here, bud. 

The biggest fascist in this fight is Putin. The media censorship, poisoning of political rivals, purging of his own ranks should tip you off to that, but you know, you do you",20b5b265eb0a9feb17a88e189b288ac853d3957e,True,False,,,,,0,1648420753,,0,{},i2d9qo0,False,t3_too5sk,False,True,t1_i2d934a,/r/UkraineConflict/comments/too5sk/why_ukraine_should_surrender/i2d9qo0/,1648420769,1,True,True,False,UkraineConflict,t5_30oyx,r/UkraineConflict,public,,0,[],,1648391953.0,,,,
,[],False,,chevy_gvan,,,[],,,,text,t2_14qolqvd,False,False,Well at least they still have their kneecaps...,11e1dcf1e3af75ad5ae3d7c2d8ad929ace3b8a7a,True,False,,,,,0,1648420631,,0,{},i2d9hz7,False,t3_tozmfx,False,True,t3_tozmfx,/r/UkraineConflict/comments/tozmfx/russian_prisoners_forced_to_sing_ukrainian_anthem/i2d9hz7/,1648420644,1,True,True,False,UkraineConflict,t5_30oyx,r/UkraineConflict,public,,0,[],,1648391831.0,,,,
,[],False,,WXbearjaws,,,[],,,,text,t2_b8gn72j0,False,False,"Nah, I’m plenty literate, tyvm.

You are pro-Russian, and say that Russia is the mugger (AKA the one with the gun)

Ergo, you are pro-mugger

It’s your own metaphor, I’m not sure what you disagree with here LMAO",2e048527072445998563eb851363c428d827f5fa,True,False,,,,,0,1648420606,,0,{},i2d9g3v,False,t3_too5sk,False,True,t1_i2d91dq,/r/UkraineConflict/comments/too5sk/why_ukraine_should_surrender/i2d9g3v/,1648420623,1,True,True,False,UkraineConflict,t5_30oyx,r/UkraineConflict,public,,0,[],,1648391806.0,,,,
,[],False,,voice-of-hermes,,,[],,,,text,t2_j32rw,False,False,OK fascist.,100df3c1c0202b3516ce7acd12830a0c28973e7a,True,False,,,,,0,1648420426,,0,{},i2d934a,False,t3_too5sk,False,True,t1_i2d8lxv,/r/UkraineConflict/comments/too5sk/why_ukraine_should_surrender/i2d934a/,1648420438,1,True,True,False,UkraineConflict,t5_30oyx,r/UkraineConflict,public,,0,[],,1648391626.0,,,,
,[],False,,voice-of-hermes,,,[],,,,text,t2_j32rw,False,False,Illiterate twit.,ae833f2619f351083952cf1a622ec3a07fb8f9ad,True,False,,,,,0,1648420403,,0,{},i2d91dq,False,t3_too5sk,False,True,t1_i2d8dcb,/r/UkraineConflict/comments/too5sk/why_ukraine_should_surrender/i2d91dq/,1648420416,1,True,True,False,UkraineConflict,t5_30oyx,r/UkraineConflict,public,,0,[],,1648391603.0,,,,
,[],False,,Imagine_Gravity_0007,,,[],,,,text,t2_k9d19dlw,False,False,Is this available on the new Switch Blade console ?,f4d54f9039899887b9d4edca951dc6d1ef16bfb2,True,False,,,,,0,1648420234,,0,{},i2d8p9w,False,t3_tpl4yw,False,True,t3_tpl4yw,/r/UkraineConflict/comments/tpl4yw/new_footage_showing_a_russian_t72b3_tank_being/i2d8p9w/,1648420251,1,True,True,False,UkraineConflict,t5_30oyx,r/UkraineConflict,public,,0,[],,1648391434.0,,,,
