Unnamed: 0,all_awardings,archived,associated_award,author,author_flair_background_color,author_flair_css_class,author_flair_richtext,author_flair_template_id,author_flair_text,author_flair_text_color,author_flair_type,author_fullname,author_patreon_flair,author_premium,body,body_sha1,can_gild,collapsed,collapsed_because_crowd_control,collapsed_reason,collapsed_reason_code,comment_type,controversiality,created_utc,distinguished,gilded,gildings,id,is_submitter,link_id,locked,no_follow,parent_id,permalink,retrieved_utc,score,score_hidden,send_replies,stickied,subreddit,subreddit_id,subreddit_name_prefixed,subreddit_type,top_awarded_type,total_awards_received,treatment_tags,unrepliable_reason,created,author_cakeday,edited,editable,media_metadata
,[],False,,temporalz,,,[],,,,text,t2_9n4d7,False,False,What did Ralphy get for xmas?,fa53dc063ad96eb169cef07ebc68308642484945,True,False,,,,,0,1648391814,,0,{},i2bfuxf,False,t3_tpjwdb,False,True,t3_tpjwdb,/r/UkraineConflict/comments/tpjwdb/ukrainian_soldier_unpack_the_swedish_at4_antitank/i2bfuxf/,1648391828,1,True,True,False,UkraineConflict,t5_30oyx,r/UkraineConflict,public,,0,[],,1648363014.0,,,,
,[],False,,ThickOpportunity3967,,,[],,,,text,t2_k82f4iih,False,False,Brave little girl. Tears of anger/despair/helplessness filling my eyes. 16 years as a soldier in my younger days - now not capable of much more than useless anger. Hope the equipment we Brits send is of use to a younger generation who can avenge this poor girl.,51888dc455b9e1db899e84a9208d7762cebd4945,True,False,,,,,0,1648391374,,0,{},i2bewwo,False,t3_toryva,False,True,t3_toryva,/r/UkraineConflict/comments/toryva/ukrainian_family_11yearold_girl_shot_in_face_by/i2bewwo/,1648391389,1,True,True,False,UkraineConflict,t5_30oyx,r/UkraineConflict,public,,0,[],,1648362574.0,,,,
,[],False,,TheSunflowerSeeds,,,[],,,,text,t2_sldqd7t,False,False,"Sunflowers are incredible sources of folic acid. 100 g of kernels contains 227 µg of folic acid, which is about 37% of recommended daily intake. Folic acid is essential for DNA synthesis. When given in anticipant mothers during the peri-conceptional period, it may prevent neural tube defects in the baby.",ceeb1f712fb45377e7551b317fed047b3f37d80d,True,False,,,,,0,1648390736,,0,{},i2bdk9j,False,t3_tpg3oj,False,True,t1_i2bdj1r,/r/UkraineConflict/comments/tpg3oj/young_russian_solider_has_conscripted_up_to_the/i2bdk9j/,1648390753,1,True,True,False,UkraineConflict,t5_30oyx,r/UkraineConflict,public,,0,[],,1648361936.0,,,,
,[],False,,ElNeekster,,,[],,,,text,t2_8munxtog,False,False,Sunflower in April 🌻,b74c0c0f2df99c4251f4e2351fdd410639ab5195,True,False,,,,,0,1648390719,,0,{},i2bdj1r,False,t3_tpg3oj,False,True,t3_tpg3oj,/r/UkraineConflict/comments/tpg3oj/young_russian_solider_has_conscripted_up_to_the/i2bdj1r/,1648390731,1,True,True,False,UkraineConflict,t5_30oyx,r/UkraineConflict,public,,0,[],,1648361919.0,,,,
,[],False,,MonsieurCatsby,,,[],,,,text,t2_pskspwk,False,False,"News reports heavily slant towards thermobarics or ""vacuum bombs"" as they love to call them as being evil and bad. Therefore Russia is bad because they use evil weapons.

They're developed and used by the USA since the 60's, almost certainly having been responsible for a whole bunch of civilian deaths (however not in the same pre-meditated way the Russians are targeting civilian centers as the primary target, which is an _important distinction_).

Now draw a line between the two and create a narrative that lessens the impact of Russias actions, generates a lot of ""whatabouttery"" and sows division. Me and you wouldn't be fooled by it but there's plenty of muppets out there who would spread it shifting the narrative away from the pre-meditated nature of Russias actions and towards ""we're as bad as them, so why care?"".

The truth is so important right now to avoid such bullshit.",d1659e9a96bb3e41836b121b8eacb8fb2501d4a8,True,False,,,,,0,1648390464,,0,{},i2bczyv,False,t3_tob5az,False,True,t1_i2bb6we,/r/UkraineConflict/comments/tob5az/coping_russiaboo_starter_pack/i2bczyv/,1648390479,1,True,True,False,UkraineConflict,t5_30oyx,r/UkraineConflict,public,,0,[],,1648361664.0,,,,
,[],False,,iwonss,,,[],,,,text,t2_8wnerev7,False,False,"From first paragraph:

&gt;The Russian Federation sent troops into Ukraine on February 24 in response to decades of relentless US-led NATO provocation. 

Oh, poor good Russian and bad provocative NATO. Yes, it's not about Imperialism, it's about self-defenses like RU propaganda says. 

&amp;#x200B;

Should I read this article farther?",4b5ef1f4b4d82410029f0a4b4e5e13806fe398d1,True,False,,,,,0,1648390192,,0,{},i2bcg1r,False,t3_tpjdi5,False,True,t3_tpjdi5,/r/UkraineConflict/comments/tpjdi5/us_peace_council_statement_on_russias_military/i2bcg1r/,1648390206,1,True,True,False,UkraineConflict,t5_30oyx,r/UkraineConflict,public,,0,[],,1648361392.0,,,,
,[],False,,Fantastic-Mud7819,,,[],,,,text,t2_k4oi1kxi,False,False,I sru w dołek...,ce29040baabd6729da84902967f2f830dd86ae5c,True,False,,,,,0,1648389891,,0,{},i2bbte2,False,t3_torpiq,False,True,t3_torpiq,/r/UkraineConflict/comments/torpiq/group_of_russian_soldiers_captured_by_ukrainian/i2bbte2/,1648389907,1,True,True,False,UkraineConflict,t5_30oyx,r/UkraineConflict,public,,0,[],,1648361091.0,,,,
,[],False,,iwonss,,,[],,,,text,t2_8wnerev7,False,False,"Sacrificing your health for freedom is a heroism 

Sacrificing your health in aggressive imperial war is ... well, just look into the eyes of these guys",c64ab50bc28573966643a407b9bd90346cb467a8,True,False,,,,,0,1648389671,,0,{},i2bbcy0,False,t3_tpk2jm,False,True,t3_tpk2jm,/r/UkraineConflict/comments/tpk2jm/the_russian_invasion_of_ukraine_is_literally/i2bbcy0/,1648389687,1,True,True,False,UkraineConflict,t5_30oyx,r/UkraineConflict,public,,0,[],,1648360871.0,,,,
,[],False,,Goggz15,,,[],,,,text,t2_1va551fh,False,False,"Yeah, this is sooo much worse than shelling civilians. Shame on these guys for having the absolute gall to make them sing…",f9be8f60afe9d3522e037df4346fb1f2f7f8f9f5,True,False,,,,,0,1648389597,,0,{},i2bb78g,False,t3_tozmfx,False,True,t3_tozmfx,/r/UkraineConflict/comments/tozmfx/russian_prisoners_forced_to_sing_ukrainian_anthem/i2bb78g/,1648389613,1,True,True,False,UkraineConflict,t5_30oyx,r/UkraineConflict,public,,0,[],,1648360797.0,,,,
,[],False,,zen_tm,,,[],,,,text,t2_39chx,False,False,Explain what you think this strawman argument is exactly?,ed538b41799fd1703cb65b4f96fa486eaf5c13a1,True,False,,,,,0,1648389593,,0,{},i2bb6we,False,t3_tob5az,False,True,t1_i2b9npe,/r/UkraineConflict/comments/tob5az/coping_russiaboo_starter_pack/i2bb6we/,1648389606,1,True,True,False,UkraineConflict,t5_30oyx,r/UkraineConflict,public,,0,[],,1648360793.0,,,,
,[],False,,SionAbes,,,[],,,,text,t2_79jwp,False,False,"From the German Jewish community I know here in Munich, it's often referred to as the ""Myth of the Clean Wehrmacht"". I'm happy to write up a more detailed response to this a bit later when I'm sat at my PC, though this wikipedia article (yes I know Wikipedia isn't the best of sources) gives a good overview and starting point to the topic. 

https://en.m.wikipedia.org/wiki/Myth_of_the_clean_Wehrmacht

As for my sweeping views on the Russian Military as a whole: there are many options. Deserting. Not signing up. Surrendering. Shooting your own. Refusing to fight. Sabotaging war efforts.

Those who have surrendered to Ukrainian forces, or actively donated tanks and trucks have my admiration.

Russians calling for an end of the war and protesting in the streets, despite mass police violence have my admiration.

We also see many examples of refusing to fight and sabotaging infrastructure from the Belarusian Army, who also have my respect and admiration.

Contextually yes it's very hard, and life threatening to stand up for what is morally right and courageous in this moment.. but those who don't and abet war criminals, shall share the same fate.",0ac535ebb820ee2d734170c6c4cd81f249512920,True,False,,,,,0,1648389579,,0,{},i2bb5vs,False,t3_tpg3oj,False,True,t1_i2b62kk,/r/UkraineConflict/comments/tpg3oj/young_russian_solider_has_conscripted_up_to_the/i2bb5vs/,1648389591,1,True,True,False,UkraineConflict,t5_30oyx,r/UkraineConflict,public,,0,[],,1648360779.0,,,,
,[],False,,MrSchaudenfreude,,,[],,,,text,t2_4don69pl,False,False,"Their are plenty of Nazi that would say I was just following orders.   It didn't work then,  it shouldn't work now.   He should have never been there.",6b0d682a0cff9bfab900ac1d1ed03c254ad1cb16,True,False,,,,,0,1648389218,,0,{},i2bafb6,False,t3_tpg3oj,False,True,t1_i2b0umj,/r/UkraineConflict/comments/tpg3oj/young_russian_solider_has_conscripted_up_to_the/i2bafb6/,1648389229,1,True,True,False,UkraineConflict,t5_30oyx,r/UkraineConflict,public,,0,[],,1648360418.0,,,,
,[],False,,shootphotosnotarabs,,,[],,,,text,t2_aiq9h,False,True,How did this all go down on the end…?,949fae5865fd311c2fc63debd98497a036397174,True,False,,,,,0,1648388980,,0,{},i2b9xjz,False,t3_tpj4yh,False,True,t3_tpj4yh,/r/UkraineConflict/comments/tpj4yh/president_of_ukraine_volodymyr_zelensky_gave_an/i2b9xjz/,1648388996,1,True,True,False,UkraineConflict,t5_30oyx,r/UkraineConflict,public,,0,[],,1648360180.0,,,,
,[],False,,MonsieurCatsby,,,[],,,,text,t2_pskspwk,False,False,"But for a lot of people who aren't educated about modern war the word ""thermobaric"" was a switch, it was plastered all over mainstream news for a week to drum up some outrage.

Is that a good thing that people care? Yes. Are thermobaric weapons still not a war crime in and of themselves? Also, yes. Does someone then create a strawman argument based on this lie to discredit the truth? Absolutely. 

Theres enough war crimes going around without us making stuff up for clickbait ad revenue.",ba3127ecf21506983d1e4d8a76d05ff7c067fe68,True,False,,,,,0,1648388848,,0,{},i2b9npe,False,t3_tob5az,False,True,t1_i2b75z7,/r/UkraineConflict/comments/tob5az/coping_russiaboo_starter_pack/i2b9npe/,1648388864,1,True,True,False,UkraineConflict,t5_30oyx,r/UkraineConflict,public,,0,[],,1648360048.0,,,,
,[],False,,Razzmatazz12345,,,[],,,,text,t2_a1ol9vxp,False,False,"I'm ok with it either way. 

Either blame Russians AND Americans for most of the world's problems for blame neither. But I don't like double standards. Either both Putin and Bush end up at the Hague or neither do.",0de0439a8c46201c6556df4309f4c4c7861572c4,True,False,,,,,0,1648388418,,0,{},i2b8sks,False,t3_tpg3oj,False,True,t1_i2b12pu,/r/UkraineConflict/comments/tpg3oj/young_russian_solider_has_conscripted_up_to_the/i2b8sks/,1648388433,1,True,True,False,UkraineConflict,t5_30oyx,r/UkraineConflict,public,,0,[],,1648359618.0,,,,
,[],False,,ReusableBear487,,,[],,,,text,t2_9z1n4wxd,False,False,Why do people keep saying this?? How old do people think the worlds military aged people are,2ddf6c32f07be4435219a3218c4ac1cc5b298bae,True,False,,,,,0,1648388032,,0,{},i2b81kv,False,t3_tpg3oj,False,True,t1_i2avpd4,/r/UkraineConflict/comments/tpg3oj/young_russian_solider_has_conscripted_up_to_the/i2b81kv/,1648388045,1,True,True,False,UkraineConflict,t5_30oyx,r/UkraineConflict,public,,0,[],,1648359232.0,,,,
,[],False,,strawman_chan,,,[],,,,text,t2_i7xgc,False,False,But that's what science deniers do.,9650009c7e741977117ffb820fa3c6639b7b68e4,True,False,,,,,0,1648387923,,0,{},i2b7u31,False,t3_tpd541,False,True,t3_tpd541,/r/UkraineConflict/comments/tpd541/should_russian_science_be_sanctioned_because_of/i2b7u31/,1648387939,1,True,True,False,UkraineConflict,t5_30oyx,r/UkraineConflict,public,,0,[],,1648359123.0,,,,
,[],False,,strawman_chan,,,[],,,,text,t2_i7xgc,False,False,"Piecekeepers, resting in pieces.",643b92d1ba3f49bce6d18d86629fb829ecc6ede1,True,False,,,,,0,1648387825,,0,{},i2b7nks,False,t3_tpd05p,False,True,t1_i2b5d3y,/r/UkraineConflict/comments/tpd05p/azov_drone_shows_some_resting_russian_soldiers/i2b7nks/,1648387838,1,True,True,False,UkraineConflict,t5_30oyx,r/UkraineConflict,public,,0,[],,1648359025.0,,,,
,[],False,,ius736,,,[],,,,text,t2_5ocab859,False,False,"\#save Ukraine   
  
discord link - https://discord.gg/EDF6aQa67x  
donation page - https://www.buymeacoffee.com/SaveUA  
  
a small help will help us to bring change ..",cd0abe378feec39e214d3b3ef346393e494851f0,True,False,,,,,0,1648387820,,0,{},i2b7n73,True,t3_tpjyrm,False,True,t3_tpjyrm,/r/UkraineConflict/comments/tpjyrm/save_ukraine_campaign_check_first_comment_rn/i2b7n73/,1648387831,1,True,True,False,UkraineConflict,t5_30oyx,r/UkraineConflict,public,,0,[],,1648359020.0,,,,
,[],False,,JimCracksJokes,,,[],,,,text,t2_a0xkzzuu,False,False,Not far right and I want the land back. Dissolve the EU and start a European Confederation that is only a shared currency and partner military. Grant way more independence to states and end free travel. Save Europe.,c6f97c5fe5904a4e3aff0a3965c95f11e48259e5,True,False,,,,,0,1648387632,,0,{},i2b7aol,False,t3_tokpcx,False,True,t1_i2adyxn,/r/UkraineConflict/comments/tokpcx/polish_general_excommander_of_the_ground_forces/i2b7aol/,1648387647,1,True,True,False,UkraineConflict,t5_30oyx,r/UkraineConflict,public,,0,[],,1648358832.0,,,,
,[],False,,zen_tm,,,[],,,,text,t2_39chx,False,False,"The difference is between outcry, and even more outcry. It's not as if people are not already appalled. It's not like the thermobarics are a switch that is the only catalyst for people to start being horrified, it's just even more horrible. Surely you can sense that there IS a sliding scale - if a nuke was used, do you think people would stop and qualify their reactions according to the technicalities? I doubt it.",ddf5f67e4f1fcbfb536f7451a52a33207b0b87aa,True,False,,,,,0,1648387559,,0,{},i2b75z7,False,t3_tob5az,False,True,t1_i2b64ot,/r/UkraineConflict/comments/tob5az/coping_russiaboo_starter_pack/i2b75z7/,1648387571,1,True,True,False,UkraineConflict,t5_30oyx,r/UkraineConflict,public,,0,[],,1648358759.0,,,,
,[],False,,JimCracksJokes,,,[],,,,text,t2_a0xkzzuu,False,False,Oh you’re an idiot okay. If you actually feel that way you’re the reason the party is failing. You’re out of touch with the needs of the American people. Counting to enjoy what is becoming a party of war and mental illness is the party of Joe Biden and party of you. FYI no I didn’t pull any of those candidates out of my ass and no there is no evidence of Tulsi being a Russian asset it was literally made up by Hillary Clinton. The candidates you’ve listed are fucking jokes therefore I won’t take you seriously. Lol Robert And Pete.,61fcbe354de6cd67e485d0c043a3ce160088df82,True,False,,,,,0,1648387439,,0,{},i2b6xyl,False,t3_to2u1w,False,True,t1_i2ar9p5,/r/UkraineConflict/comments/to2u1w/the_difference_between_a_leader_and_a_dictator/i2b6xyl/,1648387454,1,True,True,False,UkraineConflict,t5_30oyx,r/UkraineConflict,public,,0,[],,1648358639.0,,,,
,[],False,,Virtual_Cod_1840,,,[],,,,text,t2_8duytmgl,False,False,"Out of the womb, boom! Very sad to see young kids dying for Putin's corruption.",8f2ecc6e5f42812be9b5fc5d2ec530d14529de7e,True,False,,,,,0,1648387339,,0,{},i2b6rfo,False,t3_tpg3oj,False,True,t3_tpg3oj,/r/UkraineConflict/comments/tpg3oj/young_russian_solider_has_conscripted_up_to_the/i2b6rfo/,1648387356,1,True,True,False,UkraineConflict,t5_30oyx,r/UkraineConflict,public,,0,[],,1648358539.0,,,,
,[],False,,DrXaos,,,[],,,,text,t2_8v0nw,False,False,"It’s very likely that many scientists oppose the war, as they opposed the aggressive depravations of the USSR.  Soviets were always suspicious of their scientists but they needed them nonetheless.

Right approach:  don’t fund any Russian institutions, but heavily fund individual scientists and offer generous visas and foreign jobs.  There was a large influx to the benefit of Western society in the 1990s, and that should be repeated.",cdbe04fd4b903a526b9c65b15c4128798db691a9,True,False,,,,,0,1648387254,,0,{},i2b6lx7,False,t3_tpd541,False,True,t3_tpd541,/r/UkraineConflict/comments/tpd541/should_russian_science_be_sanctioned_because_of/i2b6lx7/,1648387271,1,True,True,False,UkraineConflict,t5_30oyx,r/UkraineConflict,public,,0,[],,1648358454.0,,,,
,[],False,,hifructosetrashjuice,,,[],,,,text,t2_kj0ondng,False,False,"These sparks are burning aluminum (powder?), phosphorus creates cone of smoke with trails on sides",5b895b63ac6606c1486d88d1cf034eea93ad4b08,True,False,,,,,0,1648387236,,0,{},i2b6kqg,False,t3_tp7bve,False,True,t3_tp7bve,/r/UkraineConflict/comments/tp7bve/im_hoping_this_is_not_really_phosphorus_if_it_is/i2b6kqg/,1648387249,1,True,True,False,UkraineConflict,t5_30oyx,r/UkraineConflict,public,,0,[],,1648358436.0,,,,
,[],False,,MonsieurCatsby,,,[],,,,text,t2_pskspwk,False,False,"But if using such terrible weapons is bad, why do the good guys use them?

That's my main issue here, there doesn't get to be a sliding scale of bad when it comes to war crimes or we end up in a very murky area. Targeting civilians at all is bad, we don't need to move the goalposts to say that only targeting civilians with the really nasty stuff is the real bad. Getting disembowelled by a hail of shrapnel and debris from a bog standard artillery rocket is just as unpleasant as getting shattered by the pressure wave of an FAE. Both are horrific things to inflict upon civilians.

But making it about the ""barbarity"" of the act lessens the cost paid by the thousands upon thousands of civilians killed over the last 20 years, because they weren't killed by the evil thermobaric using bad guys.",7794075b5f261641de2752aad812014cb37dd2c6,True,False,,,,,0,1648386991,,0,{},i2b64ot,False,t3_tob5az,False,True,t1_i2b4vd7,/r/UkraineConflict/comments/tob5az/coping_russiaboo_starter_pack/i2b64ot/,1648387005,1,True,True,False,UkraineConflict,t5_30oyx,r/UkraineConflict,public,,0,[],,1648358191.0,,,,
,[],False,,d1ndeed,,,[],,,,text,t2_4tgloc15,False,False,"&gt;As someone who is both Jewish and living in Germany: yes I would absolutely make the same statement about 19 year olds in the Wehrmacht. 

As a descendant of a Jewish woman and living in UK. Can you find any examples to back up that statement? ie   


&gt;**Many** ~~Waffen-SS~~  **Wehrmacht** soldiers in WW2 massacred civilians in their thousands were also 19.

I think you'll find **majority** of Wehrmacht soldiers didnt directly participate in mass executions.

&gt; It has been highly documented that they knew what was happening and very few did anything to stop it.

Because what's a 19 year old going to do to stop it? It's very honourable to take a stance once you're in that position and **literally bite the bullet** and we should honour and remember that courage, no doub**t**. 

But at the same time you can't blame people for trying to survive either. You should remember the knowledge of this was WELL into the war, not at the beginning.  


&gt;I walk past the memorial to the white rose movement of the LMU every day when I go to work. In 1942 students his age stood up and died protesting the injustice the Nazis caused.

And we should honour them.   


&gt;Your statements suggest we should completely absolve a legal aged adult of their criminal actions, which I simply cannot stand by.

That response suggests you have no issue avoiding context. And prefer to paint entire populations with the same brush y'know like err, some specifically relevant ignorant groups we've been talking about.",075d9d1399edd14a7530cf1a78aabbbadecfa61c,True,False,,,,,0,1648386957,,0,{},i2b62kk,False,t3_tpg3oj,False,True,t1_i2b1fql,/r/UkraineConflict/comments/tpg3oj/young_russian_solider_has_conscripted_up_to_the/i2b62kk/,1648386969,1,True,True,False,UkraineConflict,t5_30oyx,r/UkraineConflict,public,,0,[],,1648358157.0,,,,
,[],False,,ProfessionalHandJob,,,[],,,,text,t2_8jufyqal,False,False,"&gt; fly indefinitely

Just starve them out? Prob packed with MREs but there's also a lot of people on that plane",710cc13577c5be9233723dacca9928fc64031ad1,True,False,,,,,0,1648386793,,0,{},i2b5s18,False,t3_tpfqlg,False,True,t1_i2ar3rf,/r/UkraineConflict/comments/tpfqlg/us_sends_nukeproof_doomsday_plane_boeing_747_e4b/i2b5s18/,1648386806,1,True,True,False,UkraineConflict,t5_30oyx,r/UkraineConflict,public,,0,[],,1648357993.0,,,,
,[],False,,Acidicitizen,,,[],,,,text,t2_k7n5h7yc,False,False,Learn how to film with a phone.,807e2a33ce00f6cce4be468c1d2d6cee73678360,True,False,,,,,0,1648386743,,0,{},i2b5ox0,False,t3_tp1qih,False,True,t3_tp1qih,/r/UkraineConflict/comments/tp1qih/military_vehicles_headed_east/i2b5ox0/,1648386756,1,True,True,False,UkraineConflict,t5_30oyx,r/UkraineConflict,public,,0,[],,1648357943.0,,,,
,[],False,,Ibboibboibbo,,,[],,,,text,t2_1kkzxnpv,False,False,These are Putinites. Let’s be real,4b1a727c7c3e43729194f642087d9aa62e806505,True,False,,,,,0,1648386727,,0,{},i2b5nvq,False,t3_tp55iz,False,True,t3_tp55iz,/r/UkraineConflict/comments/tp55iz/alexey_arestovich_distinguish_between_chechens/i2b5nvq/,1648386742,1,True,True,False,UkraineConflict,t5_30oyx,r/UkraineConflict,public,,0,[],,1648357927.0,,,,
,[],False,,Ibboibboibbo,,,[],,,,text,t2_1kkzxnpv,False,False,Resting?,0180f5b4906bcad7c16d492f56230962e7b4f4af,True,False,,,,,0,1648386556,,0,{},i2b5d3y,False,t3_tpd05p,False,False,t3_tpd05p,/r/UkraineConflict/comments/tpd05p/azov_drone_shows_some_resting_russian_soldiers/i2b5d3y/,1648386577,1,True,True,False,UkraineConflict,t5_30oyx,r/UkraineConflict,public,,0,[],,1648357756.0,,,,
,[],False,,zen_tm,,,[],,,,text,t2_39chx,False,False,"Some don't know the difference, but I would counter that the outcry is about the potential for war crimes to be committed with such terrible weapons. The barbarity of it is what strikes most people, after they find out, and not the idea that the weapons are banned. (Which is quickly disproven)",f1d8bfba7ca9fc115442e19ad3292c88d8ed9321,True,False,,,,,0,1648386276,,0,{},i2b4vd7,False,t3_tob5az,False,True,t1_i2b3tq0,/r/UkraineConflict/comments/tob5az/coping_russiaboo_starter_pack/i2b4vd7/,1648386297,1,True,True,False,UkraineConflict,t5_30oyx,r/UkraineConflict,public,,0,[],,1648357476.0,,,,
,[],False,,strawman_chan,,,[],,,,text,t2_i7xgc,False,False,His war was over in a few milliseconds.,14d4c80cf0409d99287edbbb2c194da63d314494,True,False,,,,,0,1648386273,,0,{},i2b4v76,False,t3_tnyjav,False,True,t1_i248s0x,/r/UkraineConflict/comments/tnyjav/top_russian_commander_who_bragged_the_war_would/i2b4v76/,1648386286,1,True,True,False,UkraineConflict,t5_30oyx,r/UkraineConflict,public,,0,[],,1648357473.0,,,,
,[],False,,CallOfHonour,#a06324,,[],afa65fb4-a101-11ec-9a63-02a4aa3dad09,Kremlin Propagandist ,light,text,t2_h0b9blgc,False,False,Nah.,5f548559890a9040ebaec3341fb034376d74af70,True,False,,,,,0,1648386211,,0,{},i2b4r7g,False,t3_tpg3oj,False,True,t1_i2alsii,/r/UkraineConflict/comments/tpg3oj/young_russian_solider_has_conscripted_up_to_the/i2b4r7g/,1648386227,1,True,True,False,UkraineConflict,t5_30oyx,r/UkraineConflict,public,,0,[],,1648357411.0,,,,
,[],False,,CallOfHonour,#a06324,,[],afa65fb4-a101-11ec-9a63-02a4aa3dad09,Kremlin Propagandist ,light,text,t2_h0b9blgc,False,False,Compare the fascist nationalistic Ukraine to the SS instead you filthy human being.,2a83df2a8147460a60d1f2b0adaecdcb4049e4dd,True,False,,,,,0,1648386156,,0,{},i2b4nrk,False,t3_tpg3oj,False,True,t1_i2b1fql,/r/UkraineConflict/comments/tpg3oj/young_russian_solider_has_conscripted_up_to_the/i2b4nrk/,1648386171,1,True,True,False,UkraineConflict,t5_30oyx,r/UkraineConflict,public,,0,[],,1648357356.0,,,,
,[],False,,MonsieurCatsby,,,[],,,,text,t2_pskspwk,False,False,"They've been happy to target civilians for...Well since forever. They've always been hot on commiting war crimes and have been at it as usual since day one of this conflict, that was never in question. 

What is kinda dumb is the idea that a thermobaric bomb is somehow a war crime, it simply isn't. They are not covered by any convention. They've been in use for half a century with many nations, and they're simply an improved type of explosive. There's no magic involved and their lethality is dependant on specific circumstances. 

The presence of something like TOS-1A wasn't concerning because it was thermobaric (the BM-21 MLRS also has thermobaric warheads, hell the Russians have thermobaric grenades ffs) and a ""war crime"" it was concerning because its a short ranged system designed to break entrenched forces. Its a modern siege gun. Its only use in Ukraine is as a weapon against built up areas, aka. its appearance on CCTV on the first morning heading for Kherson showed they were already planning on doing a Grozny 2.0. 

The specifics matter, because it legitimises the argument _for_ war crimes being committed and for them being pre-meditated. Not the opposite.",395cd9df4a6e80993b5ed139816f081c84fab37d,True,False,,,,,0,1648385669,,0,{},i2b3tq0,False,t3_tob5az,False,True,t1_i2abjzq,/r/UkraineConflict/comments/tob5az/coping_russiaboo_starter_pack/i2b3tq0/,1648385683,1,True,True,False,UkraineConflict,t5_30oyx,r/UkraineConflict,public,,0,[],,1648356869.0,,,,
,[],False,,twitterStatus_Bot,,,[],,,,text,t2_d38zaa6k,False,False,"\#President of \#Ukraine Volodymyr \#Zelenskyy gave an interview to \#Russian \#journalists for the first time since the start of the \#war. The media promise to publish the entire conversation without censorship by the evening. This is reported by \#Meduza. \#StopPutin \#UkraineRussiaWar 

---

Photos in tweet | [photo 1](https://pbs.twimg.com/media/FO21V5jWUAQmsW8.jpg)

---

posted by [@quiraskill](https://twitter.com/quiraskill/)

---

^(If media is missing, please DM me with a link to submission url and tweet. I will do my best to solve the issue)",bed10183ab64090d311899babc3ef18df44e2d59,True,False,,,,,0,1648384958,,0,{},i2b2m1e,False,t3_tpj4yh,False,True,t3_tpj4yh,/r/UkraineConflict/comments/tpj4yh/president_of_ukraine_volodymyr_zelensky_gave_an/i2b2m1e/,1648384975,1,True,True,False,UkraineConflict,t5_30oyx,r/UkraineConflict,public,,0,[],,1648356158.0,,,,
