,all_awardings,archived,associated_award,author,author_flair_background_color,author_flair_css_class,author_flair_richtext,author_flair_template_id,author_flair_text,author_flair_text_color,author_flair_type,author_fullname,author_patreon_flair,author_premium,body,body_sha1,can_gild,collapsed,collapsed_because_crowd_control,collapsed_reason,collapsed_reason_code,comment_type,controversiality,created_utc,distinguished,gilded,gildings,id,is_submitter,link_id,locked,no_follow,parent_id,permalink,retrieved_utc,score,score_hidden,send_replies,stickied,subreddit,subreddit_id,subreddit_name_prefixed,subreddit_type,top_awarded_type,total_awards_received,treatment_tags,unrepliable_reason,created,author_cakeday
328,[],False,,punching_dolphins,,,[],,,,text,t2_1wthxvic,False,False,...... Are you retarded?,1a5c5fe1776c9fe6361dd5ae44246be2123f8728,True,False,,,,,0,1646472156,,0,{},hzfn0tz,False,t3_t6y4ca,False,True,t1_hzeaadp,/r/war/comments/t6y4ca/are_putins_claims_about_genocide_and_nazis_in/hzfn0tz/,1646472167,1,True,True,False,war,t5_2qhk8,r/war,public,,0,[],,1646443356.0,
329,[],False,,pitynotpithy,,,[],,,,text,t2_5xp431o0,False,False,It was probably a Javelin anti-tank shoulder fired weapon.,b9e960c720b1aadcbd4774c215c78ab01bfb73e2,True,False,,,,,0,1646472009,,0,{},hzfmu5o,False,t3_t6hxyy,False,True,t1_hzboe5p,/r/war/comments/t6hxyy/aftermath_russian_column_defeated_while_attacking/hzfmu5o/,1646472026,1,True,True,False,war,t5_2qhk8,r/war,public,,0,[],,1646443209.0,
330,[],False,,HarakenQQ,,,[],,,,text,t2_13m2c0,False,False,Thats what this post about. Sadly,e39645a010779f6ae2f6ed380d3653c9cb77fbf9,True,False,,,,,0,1646471781,,0,{},hzfmjjt,True,t3_t6go0q,False,True,t1_hzfk0ce,/r/war/comments/t6go0q/sorry_we_cant_help/hzfmjjt/,1646471793,1,True,True,False,war,t5_2qhk8,r/war,public,,0,[],,1646442981.0,
331,[],False,,Alexkaw,,,[],,,,text,t2_hz1dshy5,False,False,"He's nearly 70,so doesn't have to have a terminal illness to be running out of time",861f38f61081b2be08a6585c433207bf65b52712,True,False,,,,,0,1646471666,,0,{},hzfme9s,False,t3_t5rcf5,False,True,t3_t5rcf5,/r/war/comments/t5rcf5/is_it_possible_that_putin_started_the_war_because/hzfme9s/,1646471680,1,True,True,False,war,t5_2qhk8,r/war,public,,0,[],,1646442866.0,
332,[],False,,[deleted],,,,,,dark,,,,,[removed],fe993932d6dced4c0a879e9aa5d7a6e0fbb467f5,True,True,,,DELETED,,0,1646471593,,0,{},hzfmawl,False,t3_t6vk43,False,True,t3_t6vk43,/r/war/comments/t6vk43/a_brazilian_politician_who_went_to_ukraine_and/hzfmawl/,1646471607,1,True,True,False,war,t5_2qhk8,r/war,public,,0,[],,1646442793.0,
333,[],False,,[deleted],,,,,,dark,,,,,[removed],fe993932d6dced4c0a879e9aa5d7a6e0fbb467f5,True,True,,,DELETED,,0,1646471450,,0,{},hzfm4ay,False,t3_t6ni69,False,True,t1_hze0ir9,/r/war/comments/t6ni69/russianaustralian_man_booted_from_talk_show_for/hzfm4ay/,1646471465,1,True,True,False,war,t5_2qhk8,r/war,public,,0,[],,1646442650.0,
334,[],False,,Dpan,,,[],,,,text,t2_bwfqh,False,False,"This reminds me of the 2012 US presidential debate when Romney accused Obama of cutting funding because the navy has fewer ships than it did in 1916. Obamas response:

&gt;I think governor Romney maybe hasn't spent enough time looking at how our military works. You mentioned the navy for example, and how we have fewer ships than we did in 1916. Well governor we also have fewer horses and bayonets, because the nature of our military has changed. We have these things called aircraft carriers where planes land on them. We have these ships that go underwater, nuclear submarines. And so the question is not a game of battleship where we're counting ships it's 'what are our capabilities.""",9c4d788538b6af63c89b8dc5e410993368b08ee6,True,False,,,,,0,1646471419,,0,{},hzfm2xd,False,t3_t6whos,False,True,t1_hze9ygc,/r/war/comments/t6whos/ukrainian_farmers_havent_yet_said_their_final_word/hzfm2xd/,1646471432,1,True,True,False,war,t5_2qhk8,r/war,public,,0,[],,1646442619.0,
335,[],False,,decs00046,,,[],,,,text,t2_14xzlh1l,False,False,Thanks for the extra info,ad9d6adc1225faeb5345f5e1f11b7429932af4f9,True,False,,,,,0,1646471355,,0,{},hzflzzv,False,t3_t6jjwd,False,True,t1_hzeqor9,/r/war/comments/t6jjwd/russians_blatantly_shooting_civilian_buildings/hzflzzv/,1646471371,1,True,True,False,war,t5_2qhk8,r/war,public,,0,[],,1646442555.0,
336,[],False,,Downtown-Hospital-59,,,[],,,,text,t2_8mibxka0,False,False,"I think their initial strategy was to quickly finish it by gaining air superiority and taking the airport at hostomel and to take kiev or Zelensky before any defence could be setup from there.
But they failed to do the first and the latter was set up to fail. 
Now after the failed blitz they resort to indiscriminate shelling which is their core strenght.
If this will be effective depends on their capabilities to supply or the ukranians capabilities to disrupt that.",fe4c36e1821207114e8f596860624ea33d2cf8f2,True,False,,,,,0,1646471305,,0,{},hzflxp5,False,t3_t6pnb0,False,True,t1_hzdg9vp,/r/war/comments/t6pnb0/if_nato_invade_russia_could_they_take_moscow_st/hzflxp5/,1646471317,1,True,True,False,war,t5_2qhk8,r/war,public,,0,[],,1646442505.0,
337,[],False,,MediocreDoor6199,,,[],,,,text,t2_a3x0yuyc,False,False,"Seen as Russia arranged for a mass influx of Russians into the Donbas and Krim after the 2014-war by bussing them over so that they could legitimize the protection of Russians, it would still be a huge unjustification. Ukrainians still have to decide if it’s worth it.",3252dfd5075c4780f74eecc2541347cd9fc88c85,True,False,,,,,0,1646471274,,0,{},hzflw97,False,t3_t6t0h0,False,True,t1_hzdaww0,/r/war/comments/t6t0h0/winning_the_war_in_ukraine/hzflw97/,1646471284,1,True,True,False,war,t5_2qhk8,r/war,public,,0,[],,1646442474.0,
338,[],False,,-XxICExX-,,,[],,,,text,t2_jehdxwd,False,False,Guys first pic is an illustration,c4fbf5e436095424c5f0113850c12f1bd46601db,True,False,,,,,0,1646471179,,0,{},hzflrv3,True,t3_t6f7fy,False,True,t1_hzbvzwi,/r/war/comments/t6f7fy/before_and_after/hzflrv3/,1646471191,1,True,True,False,war,t5_2qhk8,r/war,public,,0,[],,1646442379.0,
339,[],False,,[deleted],,,,,,dark,,,,,[removed],fe993932d6dced4c0a879e9aa5d7a6e0fbb467f5,True,True,,,DELETED,,0,1646470953,,0,{},hzflha0,False,t3_t6zo7u,False,True,t3_t6zo7u,/r/war/comments/t6zo7u/sky_news_reporters_shot_at_by_russians_03042022/hzflha0/,1646470969,1,True,True,False,war,t5_2qhk8,r/war,public,,0,[],,1646442153.0,
340,[],False,,hey__its__me__,,,[],,,,text,t2_m2e4qs0,False,False,Relevant https://www.youtube.com/watch?v=BE8gQ_Ef-II,1ae47115c45c4e9f39c5de11c7b93dba38d6b63c,True,False,,,,,0,1646470926,,0,{},hzflfzt,False,t3_t6vk43,False,True,t1_hzepsqc,/r/war/comments/t6vk43/a_brazilian_politician_who_went_to_ukraine_and/hzflfzt/,1646470942,1,True,True,False,war,t5_2qhk8,r/war,public,,0,[],,1646442126.0,
341,[],False,,hey__its__me__,,,[],,,,text,t2_m2e4qs0,False,False,Relevant https://www.youtube.com/watch?v=BE8gQ_Ef-II,1ae47115c45c4e9f39c5de11c7b93dba38d6b63c,True,False,,,,,0,1646470905,,0,{},hzflf19,False,t3_t6vk43,False,True,t1_hzedes0,/r/war/comments/t6vk43/a_brazilian_politician_who_went_to_ukraine_and/hzflf19/,1646470916,1,True,True,False,war,t5_2qhk8,r/war,public,,0,[],,1646442105.0,
342,[],False,,[deleted],,,,,,dark,,,,,[removed],fe993932d6dced4c0a879e9aa5d7a6e0fbb467f5,True,True,,,DELETED,,0,1646470817,,0,{},hzflayp,False,t3_t68kkp,False,True,t3_t68kkp,/r/war/comments/t68kkp/what_youre_not_being_told/hzflayp/,1646470830,1,True,True,False,war,t5_2qhk8,r/war,public,,0,[],,1646442017.0,
343,[],False,,hey__its__me__,,,[],,,,text,t2_m2e4qs0,False,False,This will give you all the info you need https://www.youtube.com/watch?v=BE8gQ_Ef-II,71b6b416704c7583b91422d60cc2024a8ab08949,True,False,,,,,0,1646470781,,0,{},hzfl9br,False,t3_t6vk43,False,True,t1_hzes31v,/r/war/comments/t6vk43/a_brazilian_politician_who_went_to_ukraine_and/hzfl9br/,1646470796,1,True,True,False,war,t5_2qhk8,r/war,public,,0,[],,1646441981.0,
344,[],False,,[deleted],,,,,,dark,,,,,[removed],fe993932d6dced4c0a879e9aa5d7a6e0fbb467f5,True,True,,,DELETED,,0,1646470780,,0,{},hzfl99h,False,t3_t6q8be,False,True,t3_t6q8be,/r/war/comments/t6q8be/premonition/hzfl99h/,1646470796,1,True,True,False,war,t5_2qhk8,r/war,public,,0,[],,1646441980.0,
345,[],False,,MediocreDoor6199,,,[],,,,text,t2_a3x0yuyc,False,False,"Taking out NATO of the equation, Norways stretch of land up to the Russian border is relatively easily defended, with very mountainous terrain and only one road going southwards to the main parts of the country. Now Norways army is too small in any case but if Russia invaded solely from the border that would be a costly move. However, if they made landings all along the Norwegian coastline down to ex Trondheim (which is more plausible an option) that would make it much more difficult for Norway. On the other hand, Norwegian navy and air force is a lot more powerful relative to the army and the country as a whole. Given how the Russian Air Force is doing in Ukraine I think the Norwegian Air Force (as long as their ground support and airfields exist) would entirely wipe out the Russian Air Force. Norway is also getting new submarines now, and along with the skjold-class corvettes and Nansen-class frigates they may keep Russian naval activities limited to operating north of Lofoten. A big win if so, seeing as the decisive land battles probably will be fought in the Narvik region, or possibly in the Skibotn area to the north. 

However, a Russian amphibious assault through the Eastern Sea landing in the Oslo-area, if they have the resources to pull that off, would turn everything around.",19f66a5c60ff2267a300044b18557576ae85c9d1,True,False,,,,,0,1646470615,,0,{},hzfl1kv,False,t3_t6v5hq,False,True,t3_t6v5hq,/r/war/comments/t6v5hq/how_would_russia_fare_against_a_western_european/hzfl1kv/,1646470630,1,True,True,False,war,t5_2qhk8,r/war,public,,0,[],,1646441815.0,
346,[],False,,[deleted],,,,,,dark,,,,,[removed],fe993932d6dced4c0a879e9aa5d7a6e0fbb467f5,True,True,,,DELETED,,0,1646470612,,0,{},hzfl1gc,False,t3_t6aorb,False,True,t3_t6aorb,/r/war/comments/t6aorb/shots_fired_at_unarmed_civilians_during_a_protest/hzfl1gc/,1646470623,1,True,True,False,war,t5_2qhk8,r/war,public,,0,[],,1646441812.0,
347,[],False,,Unique_Ason,,,[],,,,text,t2_a4x765mb,False,False,✌️,5d181c34f401a1375cb900241eccb0985cea6d71,True,False,,,,,0,1646470601,,0,{},hzfl0z0,False,t3_t6764i,False,True,t1_hzfjbbt,/r/war/comments/t6764i/peacefull_russia/hzfl0z0/,1646470616,1,True,True,False,war,t5_2qhk8,r/war,public,,0,[],,1646441801.0,
348,[],False,,Antique_Sandwich_69,,,[],,,,text,t2_b5agqqrw,False,False,"Wow, fuck that one building in particular says the Russians...",86b4764d4b5340317c781ec5841debee3adb9cec,True,False,,,,,0,1646470544,,0,{},hzfkybk,False,t3_t6jjwd,False,True,t3_t6jjwd,/r/war/comments/t6jjwd/russians_blatantly_shooting_civilian_buildings/hzfkybk/,1646470556,1,True,True,False,war,t5_2qhk8,r/war,public,,0,[],,1646441744.0,
349,[],False,,Ajezon,,,[],,,,text,t2_4w6ovanr,False,False,fake. russians kills on sight. they have no food to spare for POWs,050bd247fc31de1cdfc7b5cdff1f3ea42f61f136,True,False,,,,,0,1646470475,,0,{},hzfkv2y,False,t3_t6vh8g,False,True,t3_t6vh8g,/r/war/comments/t6vh8g/ukraine_pows_by_russians_looks_more_recent/hzfkv2y/,1646470490,1,True,True,False,war,t5_2qhk8,r/war,public,,0,[],,1646441675.0,
350,[],False,,Nighthunter1o5,,,[],,,,text,t2_2k4wdt2p,False,False,I think that's even better than guided bombs. In the long run.,ee1ad3777819cca5e834136cdccbf296487e27e8,True,False,,,,,0,1646470388,,0,{},hzfkqtx,False,t3_t6vde8,False,True,t1_hzdvfj5,/r/war/comments/t6vde8/could_russia_has_ammo_stock_problems_specifically/hzfkqtx/,1646470404,1,True,True,False,war,t5_2qhk8,r/war,public,,0,[],,1646441588.0,
351,[],False,,ludorunner,,,[],,,,text,t2_auito551,False,False,Фейк,ad04c5398ee234e6478bbecef8196495813bcbfb,True,False,,,,,0,1646470219,,0,{},hzfkivc,False,t3_t6tj0i,False,True,t3_t6tj0i,/r/war/comments/t6tj0i/russian_senator_lyudmila_narusova_at_a_meeting_of/hzfkivc/,1646470230,1,True,True,False,war,t5_2qhk8,r/war,public,,0,[],,1646441419.0,
352,[],False,,ApplicationOk6762,,,[],,,,text,t2_8wribd26,False,False,How can you tell it was Russians? Or is media set up?,a99455fa08aad57d3fbf8fd54cb7522130c26750,True,False,,,,,0,1646470120,,0,{},hzfke4d,False,t3_t6zo7u,False,True,t3_t6zo7u,/r/war/comments/t6zo7u/sky_news_reporters_shot_at_by_russians_03042022/hzfke4d/,1646470135,1,True,True,False,war,t5_2qhk8,r/war,public,,0,[],,1646441320.0,
353,[],False,,Adorable-Course7532,,,[],,,,text,t2_dor4g90k,False,False,"It will last for a long time, Ukraine will win because they have a strong heart and love for their nation.",931f9187ee66d3f9399b85147a60bef3a9831b8d,True,False,,,,,0,1646470027,,0,{},hzfk9nh,False,t3_t6t0h0,False,False,t3_t6t0h0,/r/war/comments/t6t0h0/winning_the_war_in_ukraine/hzfk9nh/,1646470039,1,True,True,False,war,t5_2qhk8,r/war,public,,0,[],,1646441227.0,
354,[],False,,ShoTwiRe,,,[],,,,text,t2_br3f1,False,False,This is an immediate European issue but Europe and North America depend on each other. This is a Russia vs West issue make no doubt about it.,be5a19845cc4ef632568d793d58ac1394f39159b,True,False,,,,,0,1646469940,,0,{},hzfk5sl,False,t3_t6v16j,False,True,t1_hzdzkqw,/r/war/comments/t6v16j/dose_anyone_want_the_united_states_to_be_involved/hzfk5sl/,1646469952,1,True,True,False,war,t5_2qhk8,r/war,public,,0,[],,1646441140.0,
355,[],False,,[deleted],,,,,,dark,,,,,[removed],fe993932d6dced4c0a879e9aa5d7a6e0fbb467f5,True,True,,,DELETED,,0,1646469879,,0,{},hzfk2xr,False,t3_t6vh8g,False,True,t1_hzdrpt1,/r/war/comments/t6vh8g/ukraine_pows_by_russians_looks_more_recent/hzfk2xr/,1646469892,1,True,True,False,war,t5_2qhk8,r/war,public,,0,[],,1646441079.0,
356,[],False,,ragepaperbonsai,,,[],,,,text,t2_1jy79rxp,False,False,"I am from Bosnia and i remember how NATO and UN didnt give a single fuck while Serbs shelled our cities full of unarmed people, killing them on streets and in their homes 24/7. Rapings, tortures, mass graves, war crimes on daily basis... Even there was no WW3 threat. So why they should give a fuck now about Ukraine?",64c308cd7e78be3a8974b79ec8f7a46cf4563ec1,True,False,,,,,0,1646469823,,0,{},hzfk0ce,False,t3_t6go0q,False,True,t3_t6go0q,/r/war/comments/t6go0q/sorry_we_cant_help/hzfk0ce/,1646469839,1,True,True,False,war,t5_2qhk8,r/war,public,,0,[],,1646441023.0,
357,[],False,,ludorunner,,,[],,,,text,t2_auito551,False,False,💪🏻💪🏻💪🏻💪🏻💪🏻💪🏻💪🏻,315a67d2598b1255459b461811b11c33e0304c32,True,False,,,,,0,1646469721,,0,{},hzfjvmz,False,t3_t6vh8g,False,True,t3_t6vh8g,/r/war/comments/t6vh8g/ukraine_pows_by_russians_looks_more_recent/hzfjvmz/,1646469732,1,True,True,False,war,t5_2qhk8,r/war,public,,0,[],,1646440921.0,
358,[],False,,slide_into_my_BM,,,[],,,,text,t2_3fs0y8uw,False,False,"Don't worry, we will.

Xoxo,

-Lockheed Martin

Fixed that for you",9e46dd10277ac2d8afbb3b0ce482e9831e555e13,True,False,,,,,0,1646469576,,0,{},hzfjoye,False,t3_t2azzg,False,False,t1_hz4x8da,/r/war/comments/t2azzg/if_you_know_you_know/hzfjoye/,1646469590,1,True,True,False,war,t5_2qhk8,r/war,public,,0,[],,1646440776.0,
359,[],False,,[deleted],,,,,,dark,,,,,[removed],fe993932d6dced4c0a879e9aa5d7a6e0fbb467f5,True,True,,,DELETED,,0,1646469347,,0,{},hzfje7h,False,t3_t6j413,False,True,t1_hze6ave,/r/war/comments/t6j413/the_champions_of_humar_rights_nato/hzfje7h/,1646469361,1,True,True,False,war,t5_2qhk8,r/war,public,,0,[],,1646440547.0,
360,[],False,,[deleted],,,,,,dark,,,,,[deleted],228f7d207920fb84335fac5b2b06ed7b472ece9e,True,True,,,DELETED,,0,1646469347,,0,{},hzfje7d,False,t3_t6vk43,False,True,t3_t6vk43,/r/war/comments/t6vk43/a_brazilian_politician_who_went_to_ukraine_and/hzfje7d/,1646469361,1,True,True,False,war,t5_2qhk8,r/war,public,,0,[],,1646440547.0,
361,[],False,,Limoooooooooooo,,,[],,,,text,t2_8w20025g,False,False,indeed bro that country can continue to send people if they want Just Like in the second world war,e8895fbecaf5035852f9fcf687df568639356391,True,False,,,,,0,1646469341,,0,{},hzfjdyh,False,t3_t6o1m6,False,True,t1_hzd4752,/r/war/comments/t6o1m6/it_didnt_end_well_for_this_lot_of_invaders/hzfjdyh/,1646469354,1,True,True,False,war,t5_2qhk8,r/war,public,,0,[],,1646440541.0,
362,[],False,,RedPonana,,,[],,,,text,t2_5t00a92d,False,False,There won't be no peace until people stop supporting the war. But yeah. Same wishes to you brother.,605a1cae61fab9db047ba1caa2d829387aefee89,True,False,,,,,0,1646469284,,0,{},hzfjbbt,False,t3_t6764i,False,True,t1_hzfi2xh,/r/war/comments/t6764i/peacefull_russia/hzfjbbt/,1646469295,1,True,True,False,war,t5_2qhk8,r/war,public,,0,[],,1646440484.0,
363,[],False,,[deleted],,,,,,dark,,,,,[removed],fe993932d6dced4c0a879e9aa5d7a6e0fbb467f5,True,True,,,DELETED,,0,1646469119,,0,{},hzfj3mv,False,t3_t6v2id,False,True,t1_hzf1yzz,/r/war/comments/t6v2id/the_first_casualty_in_war_is_the_truth/hzfj3mv/,1646469129,1,True,True,False,war,t5_2qhk8,r/war,public,,0,[],,1646440319.0,
364,[],False,,[deleted],,,,,,dark,,,,,[removed],fe993932d6dced4c0a879e9aa5d7a6e0fbb467f5,True,True,,,DELETED,,0,1646469045,,0,{},hzfj0ao,False,t3_t6y4ca,False,True,t1_hzf0m8n,/r/war/comments/t6y4ca/are_putins_claims_about_genocide_and_nazis_in/hzfj0ao/,1646469057,1,True,True,False,war,t5_2qhk8,r/war,public,,0,[],,1646440245.0,
365,[],False,,Chelonate_Chad,,,[],,,,text,t2_6e9avwji,False,False,I don't care what they thought they were doing. I only care about the welfare of Ukraine.,acdde00fedab22a5b1647b43812991e2ae9e695b,True,False,,,,,0,1646469011,,0,{},hzfiypq,False,t3_t6hxyy,False,False,t1_hzfi1js,/r/war/comments/t6hxyy/aftermath_russian_column_defeated_while_attacking/hzfiypq/,1646469024,1,True,True,False,war,t5_2qhk8,r/war,public,,0,[],,1646440211.0,
366,[],False,,Unique_Ason,,,[],,,,text,t2_a4x765mb,False,False,Lets stop it i am bored! Good luck and Peace to tha whole fuckin World and our korrupt Politics✌️,b994d3ec89a9aee34e078ea3fd81ce32d52d43a2,True,False,,,,,0,1646468360,,0,{},hzfi2xh,False,t3_t6764i,False,True,t1_hzfhgiu,/r/war/comments/t6764i/peacefull_russia/hzfi2xh/,1646468375,1,True,True,False,war,t5_2qhk8,r/war,public,,0,[],,1646439560.0,
367,[],False,,rocket_guy150,,,[],,,,text,t2_554gppwv,False,False,Truth I live in Canada we had a military general who was a serial rapist scum are all over.,98c06a49f673bd479309dca42ac46b13c9bdca23,True,False,,,,,0,1646468354,,0,{},hzfi2n8,False,t3_t6vk43,False,True,t1_hze8dll,/r/war/comments/t6vk43/a_brazilian_politician_who_went_to_ukraine_and/hzfi2n8/,1646468369,1,True,True,False,war,t5_2qhk8,r/war,public,,0,[],,1646439554.0,
368,[],False,,FormerPhysician,,,[],,,,text,t2_80anx,False,False,Everyone thinks they’re “the good guy” in a war. These young men were likely fed some BS and told they were doing their patriotic duty by serving..and ended up here. It’s sad on both sides. The only winners are the people supplying arms.,a1259f3d4e1e7800aefb927af20542377391eda4,True,False,,,,,0,1646468331,,0,{},hzfi1js,False,t3_t6hxyy,False,True,t1_hzfhglx,/r/war/comments/t6hxyy/aftermath_russian_column_defeated_while_attacking/hzfi1js/,1646468348,1,True,True,False,war,t5_2qhk8,r/war,public,,0,[],,1646439531.0,
369,[],False,,Ill-Art4670,,,[],,,,text,t2_k1l5xvr3,False,False,"fuck man, i'm also brazilian and now this mother fucker will should be fucked. i'm here crying like an idiot by cant legitmate help in this and a scum probably used public money to go there.",d4b95815cdd564542f60857cd0bf66b2b6353386,True,False,,,,,0,1646468278,,0,{},hzfhyxy,False,t3_t6vk43,False,True,t3_t6vk43,/r/war/comments/t6vk43/a_brazilian_politician_who_went_to_ukraine_and/hzfhyxy/,1646468289,1,True,True,False,war,t5_2qhk8,r/war,public,,0,[],,1646439478.0,
370,[],False,,Unique_Ason,,,[],,,,text,t2_a4x765mb,False,False,Lets stop it am bored! Good luck and Peace to the whole fuckin world✌️,8b0e73d2a5aa36e2dc395dc7850da98bde28db15,True,False,,,,,0,1646468207,,0,{},hzfhvf8,False,t3_t6764i,False,True,t1_hzbf6at,/r/war/comments/t6764i/peacefull_russia/hzfhvf8/,1646468219,1,True,True,False,war,t5_2qhk8,r/war,public,,0,[],,1646439407.0,
371,[],False,,Chelonate_Chad,,,[],,,,text,t2_6e9avwji,False,False,"Aid that would have been specifically relevant to the current situation, no less.",ef254219c767a134164b76b567a461fccdecb271,True,False,,,,,0,1646468174,,0,{},hzfhtth,False,t3_t64r0u,False,True,t1_hz9rg4f,/r/war/comments/t64r0u/its_unthinkable_how_2_weeks_ago_we_didnt_even/hzfhtth/,1646468186,1,True,True,False,war,t5_2qhk8,r/war,public,,0,[],,1646439374.0,
372,[],False,,Chelonate_Chad,,,[],,,,text,t2_6e9avwji,False,False,Imagine thinking those things are comparable.,876ec8dc25cd8606bd152d9de997369e91e5c819,True,False,,,,,0,1646468093,,0,{},hzfhpp4,False,t3_t64r0u,False,True,t1_hzb25ah,/r/war/comments/t64r0u/its_unthinkable_how_2_weeks_ago_we_didnt_even/hzfhpp4/,1646468105,1,True,True,False,war,t5_2qhk8,r/war,public,,0,[],,1646439293.0,
373,[],False,,Chelonate_Chad,,,[],,,,text,t2_6e9avwji,False,False,"By all accounts I've heard, the stench is unforgettable.",a492420690cd8f3042a90f4526ad2843c3d554f4,True,False,,,,,0,1646467950,,0,{},hzfhio2,False,t3_t6hxyy,False,True,t1_hzct7ph,/r/war/comments/t6hxyy/aftermath_russian_column_defeated_while_attacking/hzfhio2/,1646467963,1,True,True,False,war,t5_2qhk8,r/war,public,,0,[],,1646439150.0,
374,[],False,,Chelonate_Chad,,,[],,,,text,t2_6e9avwji,False,False,"These are not heroes, these are the Russian invaders. The heroes are the Ukrainians who killed them.",35ee308cb5ca46b06688e8808f1cff0410e025a2,True,False,,,,,0,1646467911,,0,{},hzfhglx,False,t3_t6hxyy,False,True,t1_hzcxuy2,/r/war/comments/t6hxyy/aftermath_russian_column_defeated_while_attacking/hzfhglx/,1646467921,1,True,True,False,war,t5_2qhk8,r/war,public,,0,[],,1646439111.0,
375,[],False,,RedPonana,,,[],,,,text,t2_5t00a92d,False,False,Nice signature you have there. At least you own it.,5f9056e92ffe7528e8df36b4826ba820222695ec,True,False,,,,,0,1646467909,,0,{},hzfhgiu,False,t3_t6764i,False,False,t1_hzfh4q0,/r/war/comments/t6764i/peacefull_russia/hzfhgiu/,1646467921,1,True,True,False,war,t5_2qhk8,r/war,public,,0,[],,1646439109.0,
376,[],False,,Apprehensive_Floor86,,,[],,,,text,t2_75mlr8lb,False,False,Going to go out on a limb and provide a link to the national guard of Ukraine -&gt; https://en.wikipedia.org/wiki/Azov_Battalion,7f2bfd9770f9042beed70511f2a16a9d01a33b20,True,False,,,,,0,1646467849,,0,{},hzfhdij,False,t3_t6wo0d,False,True,t3_t6wo0d,/r/war/comments/t6wo0d/who_is_george_soros_supporting_in_the_war_between/hzfhdij/,1646467860,1,True,True,False,war,t5_2qhk8,r/war,public,,0,[],,1646439049.0,
377,[],False,,wookiepunk,,,[],,,,text,t2_8a99pmqk,False,False,Free press is Russias biggest enemy. Probably a priority target.,75ad06547e6058f8ebb6113f664332d8a361daa8,True,False,,,,,0,1646467780,,0,{},hzfha7k,False,t3_t6zo7u,False,True,t3_t6zo7u,/r/war/comments/t6zo7u/sky_news_reporters_shot_at_by_russians_03042022/hzfha7k/,1646467792,1,True,True,False,war,t5_2qhk8,r/war,public,,0,[],,1646438980.0,
378,[],False,,[deleted],,,,,,dark,,,,,[removed],fe993932d6dced4c0a879e9aa5d7a6e0fbb467f5,True,True,,,DELETED,,0,1646467706,,0,{},hzfh6g4,False,t3_t6whos,False,True,t1_hzfgter,/r/war/comments/t6whos/ukrainian_farmers_havent_yet_said_their_final_word/hzfh6g4/,1646467723,1,True,True,False,war,t5_2qhk8,r/war,public,,0,[],,1646438906.0,
379,[],False,,Unique_Ason,,,[],,,,text,t2_a4x765mb,False,False,"I am on nobodys side, and the onlyone that will suck dicks will be ur women! Little Gaylord🤣",2e3039ab128918be74bae80de9bf873f9b88fba5,True,False,,,,,0,1646467672,,0,{},hzfh4q0,False,t3_t6764i,False,True,t1_hzfeb92,/r/war/comments/t6764i/peacefull_russia/hzfh4q0/,1646467688,1,True,True,False,war,t5_2qhk8,r/war,public,,0,[],,1646438872.0,
380,[],False,,226_Walker,,,[],,,,text,t2_1iopze9d,False,False,"You forgot one thing, they also lack experience. The last time I can remember they fought in a conflict was against Vietnam, to whom they lost. While they may be big, they lack the institutional experience most of their southern neighbours, let alone the US possess.",cc8d37f2eee44bf57f04fa462ae8c56bada8903a,True,False,,,,,0,1646467450,,0,{},hzfgter,False,t3_t6whos,False,False,t1_hzfavt7,/r/war/comments/t6whos/ukrainian_farmers_havent_yet_said_their_final_word/hzfgter/,1646467462,1,True,True,False,war,t5_2qhk8,r/war,public,,0,[],,1646438650.0,
381,[],False,,[deleted],,,,,,dark,,,,,[removed],fe993932d6dced4c0a879e9aa5d7a6e0fbb467f5,True,True,,,DELETED,,0,1646467382,,0,{},hzfgpz4,False,t3_t6zo7u,False,True,t1_hzf82dg,/r/war/comments/t6zo7u/sky_news_reporters_shot_at_by_russians_03042022/hzfgpz4/,1646467395,1,True,True,False,war,t5_2qhk8,r/war,public,,0,[],,1646438582.0,
382,[],False,,RedPonana,,,[],,,,text,t2_5t00a92d,False,False,It's hilarious to call others war mongerers when it's the motherfucking Russians that invaded. With your support.,b1ac9b478724ce6c3a0f51e69243f7eda4afbd0a,True,False,,,,,0,1646467346,,0,{},hzfgo8c,False,t3_t6764i,False,True,t1_hzdngen,/r/war/comments/t6764i/peacefull_russia/hzfgo8c/,1646467362,1,True,True,False,war,t5_2qhk8,r/war,public,,0,[],,1646438546.0,
383,[],False,,[deleted],,,,,,dark,,,,,[removed],fe993932d6dced4c0a879e9aa5d7a6e0fbb467f5,True,True,,,DELETED,,0,1646467327,,0,{},hzfgn60,False,t3_t6vk43,False,True,t1_hzex5zd,/r/war/comments/t6vk43/a_brazilian_politician_who_went_to_ukraine_and/hzfgn60/,1646467341,1,True,True,False,war,t5_2qhk8,r/war,public,,0,[],,1646438527.0,
384,[],False,,PromptDifficult,,,[],,,,text,t2_6kyw05bo,False,False,Part of Ukraine people worshipping Bandera is the one  making some  Polish hating Ukrainians. They are remembered mostly for Wołyń genocide.,a3955971475fe28a9ff0b76b817519891371c03e,True,False,,,,,0,1646466788,,0,{},hzffw78,False,t3_t6y4ca,False,True,t3_t6y4ca,/r/war/comments/t6y4ca/are_putins_claims_about_genocide_and_nazis_in/hzffw78/,1646466802,1,True,True,False,war,t5_2qhk8,r/war,public,,0,[],,1646437988.0,
