,all_awardings,archived,associated_award,author,author_flair_background_color,author_flair_css_class,author_flair_richtext,author_flair_template_id,author_flair_text,author_flair_text_color,author_flair_type,author_fullname,author_patreon_flair,author_premium,body,body_sha1,can_gild,collapsed,collapsed_because_crowd_control,collapsed_reason,collapsed_reason_code,comment_type,controversiality,created_utc,distinguished,gilded,gildings,id,is_submitter,link_id,locked,no_follow,parent_id,permalink,retrieved_utc,score,score_hidden,send_replies,stickied,subreddit,subreddit_id,subreddit_name_prefixed,subreddit_type,top_awarded_type,total_awards_received,treatment_tags,unrepliable_reason,created,author_cakeday
595,[],False,,thedankmemeking16,,,[],,,,text,t2_1o0xtrlm,False,False,I agree I'm tired of seeing everything that have to do with Russia is fake. I want to see both side no matter if it pro ukraine or pro Russia.,d94b56c455e2641b166ca72cc21bdc720b333fa3,True,False,,,,,0,1646446663,,0,{},hzefkgx,False,t3_t6vq8c,False,True,t1_hzedrca,/r/war/comments/t6vq8c/probably_staged_pow_of_ukraine_no_uniform_etc/hzefkgx/,1646446678,1,True,True,False,war,t5_2qhk8,r/war,public,,0,[],,1646417863.0,
596,[],False,,BeeBobMC,,,[],,,,text,t2_7zu16pvk,False,True,PS the Ukrainian footage was shown on world wide media 4 days ago. I'm not giving away anyone's position.,434881c5adf6fd4d51f563c3627e192a08e6047f,True,False,,,,,0,1646446555,,0,{},hzefbyx,True,t3_t6z3fk,False,True,t3_t6z3fk,/r/war/comments/t6z3fk/memories/hzefbyx/,1646446568,1,True,True,False,war,t5_2qhk8,r/war,public,,0,[],,1646417755.0,
597,[],False,,Hrlv47,,,[],,,,text,t2_6qio82xv,False,False,The Azov battalions is made of literal Neo Nazis.,ffe80b323c5fd697e50df185c38fa8571289f07d,True,False,,,,,0,1646446422,,0,{},hzef1gh,False,t3_t6y4ca,False,True,t3_t6y4ca,/r/war/comments/t6y4ca/are_putins_claims_about_genocide_and_nazis_in/hzef1gh/,1646446436,1,True,True,False,war,t5_2qhk8,r/war,public,,0,[],,1646417622.0,
598,[],False,,BeeBobMC,,,[],,,,text,t2_7zu16pvk,False,True,"Not all Russians, but Putin has the same kind of cult following in Russia that Trump had (has) in the US.",0eee67addba581672aa5f0d12e3dc72eb652c5e5,True,False,,,,,0,1646446391,,0,{},hzeez13,False,t3_t6wpyf,False,True,t3_t6wpyf,/r/war/comments/t6wpyf/russian_people_has_no_idea_whats_going_on_in/hzeez13/,1646446407,1,True,True,False,war,t5_2qhk8,r/war,public,,0,[],,1646417591.0,
599,[],False,,Witty-Lettuce5830,,,[],,,,text,t2_97oj9j5f,False,False,"There are neo-nazis in every country. They exist in the U.S, Great Britain, France. While yes its probably true there are Neo-Nazis in Ukraine, and some of them may be in the armed forces, this was more or less a baseless undocumented claim to get a casus belli on Ukraine. The genocide thing was another attempt to justify the invasion as well. However the evidence that everyone has asked Russia to provide has been non-existent. And even them I wouldn't believe anything Putin or the Russian Government says. Leading up to this conflict his administration kept telling the media ""No, no, there will be no war with Ukraine. Never. We seek a peaceful deal."" And look how that turned out.",add33305e4e9ee241f63c4d4e51d41d6729b6696,True,False,,,,,0,1646446345,,0,{},hzeevbi,False,t3_t6y4ca,False,True,t3_t6y4ca,/r/war/comments/t6y4ca/are_putins_claims_about_genocide_and_nazis_in/hzeevbi/,1646446362,1,True,True,False,war,t5_2qhk8,r/war,public,,0,[],,1646417545.0,
600,[],False,,Flat-Dark-Earth,,,[],,,,text,t2_315wtmwq,False,False,"Of all the neighbouring countries that Russia would be looking to confront, I imagine Poland would have the largest military.",2faf9e989df5f8c3efdad3e836c75e688d949690,True,False,,,,,0,1646446058,,0,{},hzee8d4,False,t3_t6v5hq,False,True,t3_t6v5hq,/r/war/comments/t6v5hq/how_would_russia_fare_against_a_western_european/hzee8d4/,1646446076,1,True,True,False,war,t5_2qhk8,r/war,public,,0,[],,1646417258.0,
601,[],False,,Wormstar-Navigator,,,[],,,,text,t2_57dg1pmc,False,False,https://hungarytoday.hu/george-soros-ukrainian-conflict-war-russia-ukraine/,b08ebefa47f5fba1045d409d34e4f17f62a2db49,True,False,,,,,0,1646446002,,0,{},hzee3uy,False,t3_t6wo0d,False,False,t3_t6wo0d,/r/war/comments/t6wo0d/who_is_george_soros_supporting_in_the_war_between/hzee3uy/,1646446017,1,True,True,False,war,t5_2qhk8,r/war,public,,0,[],,1646417202.0,
602,[],False,,JotiimaSHOSH,,,[],,,,text,t2_dc2js,False,False,Maybe also it helps by not giving Putin the ammo to say that the west were also building up weapons on the border at the same time as Russia. But as soon as Russia invaded they went in hard,e65da0f681067a309fd40c838586f6e86e2fe6b9,True,False,,,,,0,1646445944,,0,{},hzedz5z,False,t3_t6nvbr,False,True,t3_t6nvbr,/r/war/comments/t6nvbr/why_is_ukraine_outgunned/hzedz5z/,1646445958,1,True,True,False,war,t5_2qhk8,r/war,public,,0,[],,1646417144.0,
603,[],False,,DrAdviceMan,,,[],,,,text,t2_ftvapqys,False,False,"at this point yes MOST of what comes out of Putins mouth are flat out lies

or gross twisting of the truth.",39b4811b232c00df5f4c1d31eca2b06dc2b5850d,True,False,,,,,0,1646445943,,0,{},hzedz3l,False,t3_t6y4ca,False,True,t3_t6y4ca,/r/war/comments/t6y4ca/are_putins_claims_about_genocide_and_nazis_in/hzedz3l/,1646445958,1,True,True,False,war,t5_2qhk8,r/war,public,,0,[],,1646417143.0,
604,[],False,,JotiimaSHOSH,,,[],,,,text,t2_dc2js,False,False,"Yeh, gotta keep troop stacks on the borders on the Risk board or the enemy will sneak in and take one zone and you won't get reinforcements next turn",73d67c690c6e96bd10afe673bd91edee46b8390e,True,False,,,,,0,1646445872,,0,{},hzedtcq,False,t3_t6nvbr,False,True,t1_hze7izc,/r/war/comments/t6nvbr/why_is_ukraine_outgunned/hzedtcq/,1646445885,1,True,True,False,war,t5_2qhk8,r/war,public,,0,[],,1646417072.0,
605,[],False,,Banksta926,,,[],,,,text,t2_580xz8b0,False,False,You should watch the other videos on RT before they get taken down. The 2 part airport docs are just crazy and similar to how Russia invaded and it’s really informative from Ukrainians who live there.,2eea86a2ea6de6ac87f8121798af7753b0fcdfdf,True,False,,,,,0,1646445866,,0,{},hzedsux,False,t3_t6uifg,False,True,t1_hzedjdb,/r/war/comments/t6uifg/donbass_yesterday_today_and_tomorrow_situation/hzedsux/,1646445878,1,True,True,False,war,t5_2qhk8,r/war,public,,0,[],,1646417066.0,
606,[],False,,machinakuski,,,[],,,,text,t2_k2bi2e2t,False,False,"Why would it be staged? Because its a Ukrainian POW and not a Russian?

Both sides have POWs. It is not staged but what ever a POW might say needs to be taken with a pinch of salt.
Especially if its in the hand of Ukrainian nazi whores from Azov battalion.

Thank you",d77d1985a057dd2aa430b5876128aee8d5e3e657,True,False,,,,,0,1646445847,,0,{},hzedrca,False,t3_t6vq8c,False,True,t3_t6vq8c,/r/war/comments/t6vq8c/probably_staged_pow_of_ukraine_no_uniform_etc/hzedrca/,1646445864,1,True,True,False,war,t5_2qhk8,r/war,public,,0,[],,1646417047.0,
607,[],False,,GriffinRJPorter,,,[],,,,text,t2_3g16ywjx,False,False,Wars are just the rich and powerful’s games.,fb137379072139284a0a9c049c14bdc3446afddd,True,False,,,,,0,1646445780,,0,{},hzedly1,False,t3_t5id11,False,True,t1_hz5l4ub,/r/war/comments/t5id11/why_are_there_rules_in_war/hzedly1/,1646445797,1,True,True,False,war,t5_2qhk8,r/war,public,,0,[],,1646416980.0,
608,[],False,,Kingslayerreddit,,,[],,,,text,t2_1v0wjg,False,False,Yes it is true. They have Nazis in their ranks and they did genocide in Eastern Ukraine. Western propaganda is saying its all false and deleting evidence on that. But there are video and pictures and articles confirming it did happen. They are just hard to find i think. Thats still not an excuse for Russians to attack civilians in Ukraine  and bomb them.,f54d6feeeacdc186aee44a2922cd02ab971c4b43,True,True,,,,,0,1646445752,,0,{},hzedjpz,False,t3_t6y4ca,False,True,t3_t6y4ca,/r/war/comments/t6y4ca/are_putins_claims_about_genocide_and_nazis_in/hzedjpz/,1646445767,1,True,True,False,war,t5_2qhk8,r/war,public,,0,[],,1646416952.0,
609,[],False,,TruthToPower77,,,[],,,,text,t2_9bgv01at,False,True,Welcome to Slavic nations,70283fee6aefd71d0e3a757b83ecacd3f0794b1a,True,False,,,,,0,1646445747,,0,{},hzedjdb,True,t3_t6uifg,False,True,t1_hzedglt,/r/war/comments/t6uifg/donbass_yesterday_today_and_tomorrow_situation/hzedjdb/,1646445759,1,True,True,False,war,t5_2qhk8,r/war,public,,0,[],,1646416947.0,
610,[],False,,Banksta926,,,[],,,,text,t2_580xz8b0,False,False,I was reading that both sides are sending really young men to fight and if they try to retreat they face death. How scary.,e935f991638bcc01a693a10b902d396b03cdbad3,True,False,,,,,0,1646445711,,0,{},hzedglt,False,t3_t6uifg,False,True,t1_hzechcz,/r/war/comments/t6uifg/donbass_yesterday_today_and_tomorrow_situation/hzedglt/,1646445724,1,True,True,False,war,t5_2qhk8,r/war,public,,0,[],,1646416911.0,
611,[],False,,Nointerest12months,,,[],,,,text,t2_7d3vnvdr,False,False,"I used to watch this guy on YouTube that would travel through eastern European countries and I really enjoyed his content, sometimes I decide to do a little research when I find myself watching certain people. Come to find out there was much evidence that this is exactly what he was doing. I looked into it more and found other youtubers that he would even collab with, one whom I had also just started to watch. I can't remember their names but bald was in the main guys name. Anyways I unsubbed and haven't watched him since, a real too cause I thought his content was pretty awesome.",7c3b5fc3a5b733627a4e945fa55d37c2c3ccd715,True,False,,,,,0,1646445688,,0,{},hzedes0,False,t3_t6vk43,False,True,t3_t6vk43,/r/war/comments/t6vk43/a_brazilian_politician_who_went_to_ukraine_and/hzedes0/,1646445702,1,True,True,False,war,t5_2qhk8,r/war,public,,0,[],,1646416888.0,
612,[],False,,Chai1205,,,[],,,,text,t2_aojm56xi,False,False,"Sheesh, and that comes as a suprise to you why exactly? Damn the local pessantry didn't want to hand out their own people, whom they thought were protecting them?!?! Unheard-of. Fk trials, why dont we all just round them up against the wall and play a round of itchy trigger finger. That'll show 'em. Got a question, if you don't mind me asking, since you know mine, what is your nationality?",00a622f87b5edda6d57aceffa44715cc2df59925,True,False,,,,,0,1646445649,,0,{},hzedbmw,False,t3_t6j413,False,True,t1_hzeclyr,/r/war/comments/t6j413/the_champions_of_humar_rights_nato/hzedbmw/,1646445664,1,True,True,False,war,t5_2qhk8,r/war,public,,0,[],,1646416849.0,
613,[],False,,lost_in_life_34,,,[],,,,text,t2_qj4xf,False,False,They would get slaughtered,35640422b6d11e436c3fe42345e4814a46916001,True,False,,,,,0,1646445638,,0,{},hzedas6,False,t3_t6v5hq,False,False,t3_t6v5hq,/r/war/comments/t6v5hq/how_would_russia_fare_against_a_western_european/hzedas6/,1646445649,1,True,True,False,war,t5_2qhk8,r/war,public,,0,[],,1646416838.0,
614,[],False,,[deleted],,,,,,dark,,,,,[removed],fe993932d6dced4c0a879e9aa5d7a6e0fbb467f5,True,True,,,DELETED,,0,1646445595,,0,{},hzed7by,False,t3_t6v2id,False,True,t3_t6v2id,/r/war/comments/t6v2id/the_first_casualty_in_war_is_the_truth/hzed7by/,1646445606,1,True,True,False,war,t5_2qhk8,r/war,public,,0,[],,1646416795.0,
615,[],False,,lost_in_life_34,,,[],,,,text,t2_qj4xf,False,False,"Good chance Ukraine turns into a European version of Israel.

Crack military",2df782c6d31ccfecd7096ed2cf5be7a574816a59,True,False,,,,,0,1646445574,,0,{},hzed5rc,False,t3_t6y6fr,False,True,t3_t6y6fr,/r/war/comments/t6y6fr/what_are_the_chances_of_russia_and_possibly_other/hzed5rc/,1646445584,1,True,True,False,war,t5_2qhk8,r/war,public,,0,[],,1646416774.0,
616,[],False,,JohnHorwat,,,[],,,,text,t2_eeuq30vh,False,False,"A very tiny minority of the Ukrainian army are Nazis, even  the Azov commander who openly admitted to recruiting Nazis said not everyone in his battalion actually agreed with the politics.

The Nazi party in the Ukraine also only received 2.5% of the votes when they elected a Jewish president",d983c1bb445bd5515db44a7c84a768025af20481,True,False,,,,,0,1646445463,,0,{},hzecx25,False,t3_t6y4ca,False,True,t3_t6y4ca,/r/war/comments/t6y4ca/are_putins_claims_about_genocide_and_nazis_in/hzecx25/,1646445476,1,True,True,False,war,t5_2qhk8,r/war,public,,0,[],,1646416663.0,
617,[],False,,[deleted],,,,,,dark,,,,,[removed],fe993932d6dced4c0a879e9aa5d7a6e0fbb467f5,True,True,,,DELETED,,0,1646445415,,0,{},hzect97,False,t3_t6vk43,False,True,t3_t6vk43,/r/war/comments/t6vk43/a_brazilian_politician_who_went_to_ukraine_and/hzect97/,1646445433,1,True,True,False,war,t5_2qhk8,r/war,public,,0,[],,1646416615.0,
618,[],False,,[deleted],,,,,,dark,,,,,[removed],fe993932d6dced4c0a879e9aa5d7a6e0fbb467f5,True,True,,,DELETED,,0,1646445383,,0,{},hzecqpx,False,t3_t6nsi5,False,True,t1_hze9c6j,/r/war/comments/t6nsi5/why_doesnt_russia_just_join_nato/hzecqpx/,1646445397,1,True,True,False,war,t5_2qhk8,r/war,public,,0,[],,1646416583.0,
619,[],False,,Boonaki,,,[],,,,text,t2_8kj4t,False,False,"The big fish were aided by the local population, they didn't see m to think what the war criminals did was a crime.",5a950fccbd340af1e49c363d3b237f4a07811b26,True,False,,,,,0,1646445323,,0,{},hzeclyr,False,t3_t6j413,False,True,t1_hzealf3,/r/war/comments/t6j413/the_champions_of_humar_rights_nato/hzeclyr/,1646445337,1,True,True,False,war,t5_2qhk8,r/war,public,,0,[],,1646416523.0,
620,[],False,,TruthToPower77,,,[],,,,text,t2_9bgv01at,False,True,To be clear I don’t condone this war. It’s started by old rich assholes and it’s regular people like you and me who get sent to die. This is a civil war. Slavic brethren killing each other.,f68c607e5c55f20581d55217207fc975b429ed1c,True,False,,,,,0,1646445266,,0,{},hzechcz,True,t3_t6uifg,False,True,t1_hzeb0i6,/r/war/comments/t6uifg/donbass_yesterday_today_and_tomorrow_situation/hzechcz/,1646445279,1,True,True,False,war,t5_2qhk8,r/war,public,,0,[],,1646416466.0,
621,[],False,,DrAdviceMan,,,[],,,,text,t2_ftvapqys,False,False,after last night i am very worried TBH,ce14bf2b9a9643bde24d65b52c4707a1530bb794,True,False,,,,,0,1646445262,,0,{},hzech1c,False,t3_t6of3u,False,True,t3_t6of3u,/r/war/comments/t6of3u/ive_studied_nuclear_war_for_35_years_you_should/hzech1c/,1646445279,1,True,True,False,war,t5_2qhk8,r/war,public,,0,[],,1646416462.0,
622,[],False,,NoImportance8904,,,[],,,,text,t2_b07qeb6b,False,False,"I'd argue that constant total war is the norm for most countries throughout most of human history.

It's really after the industrial age that things became peaceful. WW1 and WW2 were extremely destructive... but a playdate in the park compared to the wars of the 19th century.

It's just not many people alive today are accustomed to war and catastrophe. We are used to peace, security, and plenty of goods to keep us occupied.",c8d2dd33cd0301e8dc2c6a95b20621a006e1dc01,True,False,,,,,0,1646445228,,0,{},hzecede,False,t3_t1jdir,False,False,t1_hze175v,/r/war/comments/t1jdir/10000_chechen_military_personnel_part_of_the/hzecede/,1646445242,1,True,True,False,war,t5_2qhk8,r/war,public,,0,[],,1646416428.0,
623,[],False,,cutchemist42,,,[],,,,text,t2_8t1a3,False,False,"So if Russia invaded Poland and said he would use nukes on any other NATO country that came to help per the treaty, would we back off that threat?

I mean if he always makes this threat, why would we ever try to counter him?",c78dda0fae084bd1964b31ca380bea51d61b345b,True,False,,,,,0,1646445175,,0,{},hzeca8t,True,t3_t6l596,False,True,t1_hzd1ot5,/r/war/comments/t6l596/honestly_asking_about_the_strategy_of_nuclear/hzeca8t/,1646445191,1,True,True,False,war,t5_2qhk8,r/war,public,,0,[],,1646416375.0,
624,[],False,,FuzzDodger,,,[],,,,text,t2_a0jnzloo,False,False,All that scope and I bet that dude still can’t hit shit,3f92adec7b86a145f56f5518e53be84efafa2c29,True,False,,,,,0,1646445169,,0,{},hzec9q8,False,t3_s6rr99,False,True,t3_s6rr99,/r/war/comments/s6rr99/yemeni_national_army_soldier_says_whoever_wants/hzec9q8/,1646445184,1,True,True,False,war,t5_2qhk8,r/war,public,,0,[],,1646416369.0,
625,[],False,,HelloAvram,,,[],,,,text,t2_4ap3w582,False,False,"Like yeah, you and I both may believe he's not correct for wanting a sitting president to take up arms just yet because it hasn't come to that, but you don't need to insult him. That's just mean.",b5a2e0e662d193cee3756968d3a390937a02940e,True,False,,,,,0,1646445103,,0,{},hzec4ho,False,t3_t64r0u,False,True,t1_hz96ewg,/r/war/comments/t64r0u/its_unthinkable_how_2_weeks_ago_we_didnt_even/hzec4ho/,1646445119,1,True,True,False,war,t5_2qhk8,r/war,public,,0,[],,1646416303.0,
626,[],False,,M00SEHUNT3R,,,[],,,,text,t2_koxnz9c,False,False,"Can’t even tell what side you’re on. First going on about anti-Semitic Europeans chasing them out of Israel and how I killed six million Jewish people, now talking about how they’ve no right to the land they were chased out of. Enjoy your trolling.",232d9e54868c3266405ac69afa31b304161299eb,True,False,,,,,0,1646445100,,0,{},hzec4bs,False,t3_t4yora,False,True,t1_hze94sa,/r/war/comments/t4yora/theory_of_relativity_irl/hzec4bs/,1646445112,1,True,True,False,war,t5_2qhk8,r/war,public,,0,[],,1646416300.0,
627,[],False,,Any-Nothing,,,[],,,,text,t2_4h46mqdo,False,True,People are just too easy to be tricked lol,5ef4d620381c26ed37e4937da59a2b6553eb4548,True,False,,,,,0,1646445020,,0,{},hzeby0k,False,t3_t6jjwd,False,True,t1_hzcrq28,/r/war/comments/t6jjwd/russians_blatantly_shooting_civilian_buildings/hzeby0k/,1646445032,1,True,True,False,war,t5_2qhk8,r/war,public,,0,[],,1646416220.0,
628,[],False,,Pentium95,,,[],,,,text,t2_136y4q2v,False,False,There Is Always someone poorer.,db44cdf69c9dec22ef37a024ac17411c76626fb5,True,False,,,,,0,1646444942,,0,{},hzebrqf,False,t3_t6vk43,False,True,t3_t6vk43,/r/war/comments/t6vk43/a_brazilian_politician_who_went_to_ukraine_and/hzebrqf/,1646444960,1,True,True,False,war,t5_2qhk8,r/war,public,,0,[],,1646416142.0,
629,[],False,,RussianTardBot,,,[],,,,text,t2_jrawfi9r,False,False,"To sum up fuck both sides, we just want to fuck Russia regardless of the cost.

--

^^Beep, ^^boop, ^^I'm ^^a ^^bot. ^^While ^^this ^^bot ^^is ^^against ^^hate, ^^it ^^learns ^^from ^^other ^^subreddits ^^that ^^could ^^be ^^not; ^^hence ^^any ^^call ^^to ^^violence, ^^semblance ^^of ^^hate, ^^or ^^general ^^stupidity ^^is ^^accidental.",f625d2aa70903e84f482d8d290af25b32e6b594e,True,False,,,,,0,1646444871,,0,{},hzebly3,False,t3_t6uifg,False,True,t1_hzebku2,/r/war/comments/t6uifg/donbass_yesterday_today_and_tomorrow_situation/hzebly3/,1646444886,1,True,True,False,war,t5_2qhk8,r/war,public,,0,[],,1646416071.0,
630,[],False,,NewFuturist,,,[],,,,text,t2_880ka,False,False,Russian bot fuck off!,5671888601fcaefc3ae25e8fbc5a91a967f76ca3,True,False,,,,,0,1646444857,,0,{},hzebku2,False,t3_t6uifg,False,True,t1_hze9ffs,/r/war/comments/t6uifg/donbass_yesterday_today_and_tomorrow_situation/hzebku2/,1646444872,1,True,True,False,war,t5_2qhk8,r/war,public,,0,[],,1646416057.0,
631,[],False,,NoImportance8904,,,[],,,,text,t2_b07qeb6b,False,False,"On the Ukrane nazi thing... they have a nationalist political paramilitary group that has been pushing for a monoethnic Ukraine for decades now. They formed in WW2 and conducted guerilla warfare against the soviets. They currently have 10,000 registered members (very small percent of Ukraine) in addition to some public support. You can see their flags in videos, rather than being a yellow and blue flag, its black and red.

&amp;#x200B;

They both cooperated and fought against the Germans at different times during WW2.",cc1403072ba1cc78ba2ca44f87b2e492d431bdfe,True,False,,,,,0,1646444754,,0,{},hzebcll,False,t3_t6wo0d,False,True,t3_t6wo0d,/r/war/comments/t6wo0d/who_is_george_soros_supporting_in_the_war_between/hzebcll/,1646444766,1,True,True,False,war,t5_2qhk8,r/war,public,,0,[],,1646415954.0,
632,[],False,,Alternative_Taste354,,,[],,,,text,t2_ahle7qv5,False,False,"I don't think they deliberately shot him, could of been shooting into the ground and he caught a ricochet",55daa88b3ec94f2eaef49bbd72647d642b54ead4,True,False,,,,,0,1646444687,,0,{},hzeb74w,False,t3_t6aorb,False,True,t3_t6aorb,/r/war/comments/t6aorb/shots_fired_at_unarmed_civilians_during_a_protest/hzeb74w/,1646444701,1,True,True,False,war,t5_2qhk8,r/war,public,,0,[],,1646415887.0,
633,[],False,,Banksta926,,,[],,,,text,t2_580xz8b0,False,False,Thank you for that info. The video has only 14k views share it before it gets taken down!,0225bfb3b16d288ecc07d5798f87b7dc99960be7,True,False,,,,,0,1646444605,,0,{},hzeb0i6,False,t3_t6uifg,False,True,t1_hzeabtm,/r/war/comments/t6uifg/donbass_yesterday_today_and_tomorrow_situation/hzeb0i6/,1646444619,1,True,True,False,war,t5_2qhk8,r/war,public,,0,[],,1646415805.0,
634,[],False,,Alternative_Taste354,,,[],,,,text,t2_ahle7qv5,False,False,I hope putin gives you a reach around when he's fucking you in the arse,f4d2349fb51b7217035a122e1defc0496c873636,True,False,,,,,0,1646444544,,0,{},hzeavn6,False,t3_t6aorb,False,True,t1_hzd780o,/r/war/comments/t6aorb/shots_fired_at_unarmed_civilians_during_a_protest/hzeavn6/,1646444560,1,True,True,False,war,t5_2qhk8,r/war,public,,0,[],,1646415744.0,
635,[],False,,salamiTommy_,,,[],,,,text,t2_7p1k9iwc,False,False,China,d2eaf2aa1512d6596e0a5bae633537c6b8e779a3,True,False,,,,,0,1646444511,,0,{},hzeat2w,False,t3_t6vde8,False,True,t3_t6vde8,/r/war/comments/t6vde8/could_russia_has_ammo_stock_problems_specifically/hzeat2w/,1646444525,1,True,True,False,war,t5_2qhk8,r/war,public,,0,[],,1646415711.0,
636,[],False,,dagilldog,,,[],,,,text,t2_4t4j2arp,False,False,"More than a molotov, his entire track is hanging",2dddd8e33a744b39efd489ba375f5596f008f971,True,False,,,,,0,1646444495,,0,{},hzearps,False,t3_t1w52u,False,True,t1_hyjfo7p,/r/war/comments/t1w52u/russian_tanks_entering_the_townvillage_of_my/hzearps/,1646444510,1,True,True,False,war,t5_2qhk8,r/war,public,,0,[],,1646415695.0,
637,[],False,,walkertos,,,[],,,,text,t2_hz7raflp,False,False,PEACE bro,1c4ebad0151025b793adc75ab8324c9529850f70,True,False,,,,,0,1646444480,,0,{},hzeaqi6,True,t3_t6yh7k,False,True,t3_t6yh7k,/r/war/comments/t6yh7k/arsenal_extended_power_full_campaign_2_1peace_is/hzeaqi6/,1646444495,1,True,True,False,war,t5_2qhk8,r/war,public,,0,[],,1646415680.0,
638,[],False,,FayardWallace,,,[],,,,text,t2_9bvggdi1,False,False,"Is this lack of morality or ignorance, I wish it's ignorance.",b26abe09fcca208eb1078dcbd405f37a74003292,True,False,,,,,0,1646444434,,0,{},hzeamv8,False,t3_t4yora,False,True,t1_hz34yty,/r/war/comments/t4yora/theory_of_relativity_irl/hzeamv8/,1646444451,1,True,True,False,war,t5_2qhk8,r/war,public,,0,[],,1646415634.0,
639,[],False,,Chai1205,,,[],,,,text,t2_aojm56xi,False,False,"You didn't stop any genocide, once you arrived all the killing was already done. You sure did hunt them, but honestly didn't do much of a job there, since the big fish evaded you for years. As for the land mines, you cleared some of them. Look fam, I see there's no agreeing between us in anything regarding the war. You got your opinion, I got mine. Let's agree to disagree and see which one of us sleeps easier at night. 🤝",0fc70c501aaa2910020d474ed8cd172a9b55a0a3,True,False,,,,,0,1646444417,,0,{},hzealf3,False,t3_t6j413,False,True,t1_hze923q,/r/war/comments/t6j413/the_champions_of_humar_rights_nato/hzealf3/,1646444429,1,True,True,False,war,t5_2qhk8,r/war,public,,0,[],,1646415617.0,
640,[],False,,Alternative_Taste354,,,[],,,,text,t2_ahle7qv5,False,False,"I always think of the 18 - 30 yr olds and how they have wife, girlfriend or Fiance waiting at home for them and how they may never know what actually happened to them",a1a534251425fe20e532c6d0199e015c546c48d9,True,False,,,,,0,1646444356,,0,{},hzeaggy,False,t3_t6hxyy,False,True,t1_hzbzyim,/r/war/comments/t6hxyy/aftermath_russian_column_defeated_while_attacking/hzeaggy/,1646444369,1,True,True,False,war,t5_2qhk8,r/war,public,,0,[],,1646415556.0,
641,[],False,,VerdiBlanco10,,,[],,,,text,t2_a1r10ett,False,False,Probably both sides so he can benefit from the war. And both Russians and Ukrainians are racist af a lot of that racism is seen in the soccer games.,fc8598ca58997b8f2866f5f479d3708b0f2cc4cd,True,False,,,,,0,1646444354,,0,{},hzeagbe,False,t3_t6wo0d,False,True,t3_t6wo0d,/r/war/comments/t6wo0d/who_is_george_soros_supporting_in_the_war_between/hzeagbe/,1646444369,1,True,True,False,war,t5_2qhk8,r/war,public,,0,[],,1646415554.0,
642,[],False,,TruthToPower77,,,[],,,,text,t2_9bgv01at,False,True,"https://jacobinmag.com/2022/02/maidan-protests-neo-nazis-russia-nato-crimea?fbclid=IwAR38mavrerH5FPXmQtD59kC1uK7142InjWEefeuzyZ561hAtz7hsi6yBaCU&amp;mibextid=cI88bS

https://jacobinmag.com/2022/01/cia-neo-nazi-training-ukraine-russia-putin-biden-nato/",f976ba00edd740de86d1f87db125a619fd5bc15f,True,False,,,,,0,1646444298,,0,{},hzeabtm,True,t3_t6uifg,False,False,t1_hze9ffs,/r/war/comments/t6uifg/donbass_yesterday_today_and_tomorrow_situation/hzeabtm/,1646444309,1,True,True,False,war,t5_2qhk8,r/war,public,,0,[],,1646415498.0,
643,[],False,,[deleted],,,,,,dark,,,,,[removed],fe993932d6dced4c0a879e9aa5d7a6e0fbb467f5,True,True,,,DELETED,,0,1646444279,,0,{},hzeaadp,False,t3_t6y4ca,False,True,t1_hzea3us,/r/war/comments/t6y4ca/are_putins_claims_about_genocide_and_nazis_in/hzeaadp/,1646444295,1,True,True,False,war,t5_2qhk8,r/war,public,,0,[],,1646415479.0,
644,[],False,,Nighthunter1o5,,,[],,,,text,t2_2k4wdt2p,False,False,Translation: I don't want to die so I'll support russia.,ead3669f8c2cae5b167a245d0352181ee3f65f71,True,False,,,,,0,1646444236,,0,{},hzea6wv,False,t3_t6wpyf,False,True,t3_t6wpyf,/r/war/comments/t6wpyf/russian_people_has_no_idea_whats_going_on_in/hzea6wv/,1646444251,1,True,True,False,war,t5_2qhk8,r/war,public,,0,[],,1646415436.0,
