,all_awardings,archived,associated_award,author,author_flair_background_color,author_flair_css_class,author_flair_richtext,author_flair_template_id,author_flair_text,author_flair_text_color,author_flair_type,author_fullname,author_patreon_flair,author_premium,body,body_sha1,can_gild,collapsed,collapsed_because_crowd_control,collapsed_reason,collapsed_reason_code,comment_type,controversiality,created_utc,distinguished,gilded,gildings,id,is_submitter,link_id,locked,no_follow,parent_id,permalink,retrieved_utc,score,score_hidden,send_replies,stickied,subreddit,subreddit_id,subreddit_name_prefixed,subreddit_type,top_awarded_type,total_awards_received,treatment_tags,unrepliable_reason,created,author_cakeday
0,[],False,,_BaldyLocks_,,,[],,,,text,t2_5d0jbynz,False,False,With their level of training for most units I'd be surprised if they were capable.,beffe186df7418bf97fa5ca41af321fcb9619d2c,True,False,,,,,0,1646495998,,0,{},hzgp13e,False,t3_t7844r,False,True,t3_t7844r,/r/war/comments/t7844r/is_the_russian_air_force_actually_incapable_of/hzgp13e/,1646496011,1,True,True,False,war,t5_2qhk8,r/war,public,,0,[],,1646467198.0,
1,[],False,,musty_chesticle,,,[],,,,text,t2_6zxjfaji,False,False,Ask Joe bidens mother.,1b56487687bf2ab43edc8c83ea868e8c6e864711,True,False,,,,,0,1646495773,,0,{},hzgoiuv,False,t3_t3j1dy,False,True,t3_t3j1dy,/r/war/comments/t3j1dy/how_common_is_rape_in_modern_wars/hzgoiuv/,1646495788,1,True,True,False,war,t5_2qhk8,r/war,public,,0,[],,1646466973.0,
2,[],False,,ShwerzXV,,,[],,,,text,t2_1i634mlc,False,False,"In the US they do, but the time between becoming a soldier/marine/airman/seaman/what have you, and becoming a pilot is a decent amount of time, like years. That said, you must be in shape for selection and for school. I don’t know how Russia does it, but all the out of shape pilots I’ve seen, have been flying for a long time or started flying a desk. I also heard as a Pilots in the army at least, there is no incentive promotion wise for physical training. I mean that doesn’t stop them from maintaining a height and weight standard but I also don’t know how Russia does it. From what I seen, seems like maybe we’ve over estimated Russia’s military standards.",c6586d11743268df4b3a79ef2966b83e08561f87,True,False,,,,,0,1646495770,,0,{},hzgoinw,False,t3_t76r2e,False,True,t1_hzfz0hz,/r/war/comments/t76r2e/pilot_of_the_russian_plane_that_was_shot_down/hzgoinw/,1646495788,1,True,True,False,war,t5_2qhk8,r/war,public,,0,[],,1646466970.0,
3,[],False,,Dope_youtube,,,[],,,,text,t2_1xy78532,False,False,Looks like a su 27,30a86e708ff8e7c053da25db61bafcda18e3a0f1,True,False,,,,,0,1646495737,,0,{},hzgofy0,False,t3_t7bh6g,False,True,t3_t7bh6g,/r/war/comments/t7bh6g/oh_thats_hot_in_ochakiv/hzgofy0/,1646495751,1,True,True,False,war,t5_2qhk8,r/war,public,,0,[],,1646466937.0,
4,[],False,,armoredinfantry,,,[],,,,text,t2_14dmwm,False,False,"If NATO enters the war, it will go nuclear. You should think about what this means for the US, and the rest of the world. If you want to help Ukraine from where you live, then give to charities that are helping Ukrainians survive this. If you want a more direct approach, go to Ukraine and volunteer for service and take the Russians head on.",473b856dd1353f5ff1d87b5c0cdf5e9318278862,True,False,,,,,0,1646495713,,0,{},hzgodys,False,t3_t78gyv,False,True,t3_t78gyv,/r/war/comments/t78gyv/we_need_nofly_zone_over_ukraine_asap/hzgodys/,1646495728,1,True,True,False,war,t5_2qhk8,r/war,public,,0,[],,1646466913.0,
5,[],False,,Boonaki,,,[],,,,text,t2_8kj4t,False,False,Isn't that Syria?,9572fc3a0d316e99c0733ee9f341a9e9b06c4ed9,True,False,,,,,0,1646495687,moderator,0,{},hzgobta,False,t3_t77af7,False,True,t3_t77af7,/r/war/comments/t77af7/white_phosphorus_dropped_on_the_streets_of_mosul/hzgobta/,1646495699,1,True,True,False,war,t5_2qhk8,r/war,public,,0,[],,1646466887.0,
6,[],False,,I-mnotgivingmyname,,,[],,,,text,t2_8ry77d3w,False,False,"""What about""

It's rampant now. Very annoying.",26443ba0f633f2ac189d0f01db76e473e488f9a6,True,False,,,,,0,1646495673,,0,{},hzgoapg,False,t3_t781k0,False,True,t1_hzglund,/r/war/comments/t781k0/the_pilot_of_the_plane_in_chernihiv_used_to_bomb/hzgoapg/,1646495684,1,True,True,False,war,t5_2qhk8,r/war,public,,0,[],,1646466873.0,
7,[],False,,[deleted],,,,,,dark,,,,,[removed],fe993932d6dced4c0a879e9aa5d7a6e0fbb467f5,True,True,,,DELETED,,0,1646495553,,0,{},hzgo152,False,t3_t78gyv,False,True,t3_t78gyv,/r/war/comments/t78gyv/we_need_nofly_zone_over_ukraine_asap/hzgo152/,1646495565,1,True,True,False,war,t5_2qhk8,r/war,public,,0,[],,1646466753.0,
8,[],False,,lostgramma22,,,[],,,,text,t2_aaq6zh4c,False,False,"Isn't it ""like a hot knife through butter""?",f735f791dd6020567c38798d7b33f5a569f82089,True,False,,,,,0,1646495510,,0,{},hzgnxqi,False,t3_t76zu3,False,True,t1_hzgg4j0,/r/war/comments/t76zu3/and_the_second_pilot_that_jumped_out_of_the_plane/hzgnxqi/,1646495527,1,True,True,False,war,t5_2qhk8,r/war,public,,0,[],,1646466710.0,
9,[],False,,DowntownHouse,,,[],,,,text,t2_7n7yn4zt,False,False,Fake,876b2e0b899bd59e51d1f5e610d74d445f8f8b86,True,False,,,,,0,1646495487,,0,{},hzgnvrg,False,t3_t6tvbr,False,True,t3_t6tvbr,/r/war/comments/t6tvbr/russian_media_doesnt_want_anyone_to_see_these/hzgnvrg/,1646495498,1,True,True,False,war,t5_2qhk8,r/war,public,,0,[],,1646466687.0,
10,[],False,,I-mnotgivingmyname,,,[],,,,text,t2_8ry77d3w,False,False,Are you obese too?,ac548c8ad28c2e651a833728768e7e57b525bfac,True,False,,,,,0,1646495442,,0,{},hzgns0o,False,t3_t76r2e,False,True,t1_hzgee02,/r/war/comments/t76r2e/pilot_of_the_russian_plane_that_was_shot_down/hzgns0o/,1646495460,1,True,True,False,war,t5_2qhk8,r/war,public,,0,[],,1646466642.0,
11,[],False,,knixx,,,[],,,,text,t2_l6c3v,False,False,"Norway has access to some extremely advanced hardware. Also, as I understand it the USA has stationed an outfit of infantry and technical equipment (tanks ++) in the north.

Norways plan will always be to delay until NATO or allies can arrive. The advanced missile systems, frigates and aircraft Norway has access to will keep their military at arms length, saving lives, but I don't think it's enough to win. Even with a terrain advantage.

I'd expect high casualties for an invading armies though. Maybe even higher than we have seen in Ukraine.

Hopefully that all stays a mystery and we never have to find out!",6fd4d2a89b033d58c4ab52465fb25d9deacafdfc,True,False,,,,,0,1646495334,,0,{},hzgnj5v,False,t3_t6v5hq,False,True,t1_hzfl1kv,/r/war/comments/t6v5hq/how_would_russia_fare_against_a_western_european/hzgnj5v/,1646495349,1,True,True,False,war,t5_2qhk8,r/war,public,,0,[],,1646466534.0,
12,[],False,,Rokhiani,,,[],,,,text,t2_5jd8y5oc,False,False,"Link to prediction thread: https://www.reddit.com/r/wallstreetbets/comments/sqclkl/papa_putin_is_not_going_to_invade_ukraine_you/

Referenced photo: https://web.archive.org/web/20220305114804/https://twitter.com/i/events/1483255084750282753 (https://twitter.com/i/events/1483255084750282753)",b61af9af66ce65557c1f2fb417ed69c34b3cc496,True,False,,,,,0,1646495264,,0,{},hzgnd9m,True,t3_t7c6hl,False,True,t3_t7c6hl,/r/war/comments/t7c6hl/the_russian_bear_woke_up/hzgnd9m/,1646495283,1,True,True,False,war,t5_2qhk8,r/war,public,,0,[],,1646466464.0,
13,[],False,,[deleted],,,,,,dark,,,,,[removed],fe993932d6dced4c0a879e9aa5d7a6e0fbb467f5,True,True,,,DELETED,,0,1646495250,,0,{},hzgnc48,False,t3_t5nk9g,False,True,t1_hz7rlwg,/r/war/comments/t5nk9g/given_the_archaic_nature_of_the_equipment_weve/hzgnc48/,1646495267,1,True,True,False,war,t5_2qhk8,r/war,public,,0,[],,1646466450.0,
14,[],False,,Alternative_Taste354,,,[],,,,text,t2_ahle7qv5,False,False,Russian,74ad93cbebf587ac46ab0ef1e3f24139ddd3f535,True,False,,,,,0,1646495142,,0,{},hzgn39t,False,t3_t7bh6g,False,True,t1_hzglvpp,/r/war/comments/t7bh6g/oh_thats_hot_in_ochakiv/hzgn39t/,1646495155,1,True,True,False,war,t5_2qhk8,r/war,public,,0,[],,1646466342.0,
15,[],False,,[deleted],,,,,,dark,,,,,[removed],fe993932d6dced4c0a879e9aa5d7a6e0fbb467f5,True,True,,,DELETED,,0,1646495048,,0,{},hzgmvsf,False,t3_t68kkp,False,True,t3_t68kkp,/r/war/comments/t68kkp/what_youre_not_being_told/hzgmvsf/,1646495059,1,True,True,False,war,t5_2qhk8,r/war,public,,0,[],,1646466248.0,
16,[],False,,Witty-Lettuce5830,,,[],,,,text,t2_97oj9j5f,False,False,"Ohhhh trust me. I'm not ignorant in the slightest. I'm well aware of how the West bombed the Middle East in the aftermath of Operation Inherit Resolve when we operated in Afghanistan. Unjustly invaded Iraq to search for ""Weapons of Mass destruction"" and funded the Mujahideen to fight the Soviets in the Soviet-Afghan War. The list goes on and on. Frankly, you must be uneducated to know the U.S supplied those arms to the Mujahideen to fight for their country back after the Soviets fucked it over and afterwards, we left them to run their own business. 

 I remember 9/11as a pretext of WHY we were there in the first place. And it was (with overwhelming evidence) the work of Osama Bin Laden who killed thousands of innocent U.S civilians and forced our hand due to Afghanistan descended into civil war after the Soviet Afghan war and then the Taliban took over which became a cespool for terrorist activities. And they did that on their own. I remember Iraq invaded Kuwait for oil and that became the pretext for our first of many tangles with them and their dictator of a leader Saddam Hussein who did some.......""questionable"" things in his role as president years BEFORE the U.S invasion considering his government was notorious for its severe human rights abuses (*cough* Iran-Iraq War, chemical attack) so yeah. I know this shit. You'd have to be a fucking moron not to know. But funny how none of those points came across your post. You clown.


And frankly, yes. NATO will invade. It's only a matter of time. If you think Western leaders will stop at sanctions then your just as dumb as the others who buy that crap. However you must have forgotten as well. The U.S has the SECOND largest batch of nuclear missiles in the world (Hell, with seeing how Russias army is using outdated broken down vehicles I wonder how many of their nukes work). We also have an Air Force with skilled pilots who can intercept those missiles. CIWS, advanced warning radar, ICBM interceptors, etc. We don't have fucking Healthcare but we have a more advanced armed forces than those Russian Cowards overseas. 


As for Snowden and Assagne, that's on them. You leak classified documents, you get taken care of. Same with any other government. Russia makes any political opposition ""dissappear"". All governments are selfish cruel and downright nasty. If you can name ONE government that doesn't have a history of fucking its people over I'll give you a fucking cookie. It's like you think I'm the president and I have the power to just ""undo"" all the fucked up shit the U.S did over the century. Well I can't. All we can do is apologize, acknowledge it and move on. Make repayments. Give back to those we wronged.",9632e55090d768c79fe27591c4ba5918ea265b0b,True,False,,,,,0,1646495026,,0,{},hzgmtz7,False,t3_t63dpa,False,True,t1_hzfsewu,/r/war/comments/t63dpa/russia_empire_of_evil_biggest_liars_and/hzgmtz7/,1646495038,1,True,True,False,war,t5_2qhk8,r/war,public,,0,[],,1646466226.0,
17,[],False,,MoreOutside1184,,,[],,,,text,t2_esmdl8bd,False,False,I think i just depends on if they are looting for supplies or if they are just looting for stuff.,56b9d3f642e16d179676b56d3ccd3eec1b91cfdf,True,True,,,,,0,1646494826,,0,{},hzgme57,False,t3_t60sta,False,True,t1_hzanrt6,/r/war/comments/t60sta/russian_soldiers_are_something_else/hzgme57/,1646494840,1,True,True,False,war,t5_2qhk8,r/war,public,,0,[],,1646466026.0,
18,[],False,,mynipplesareonfire,,,[],,,,text,t2_4blvw7i2,False,False,then i think i know exactly what you're saying.,63de19bdbfec20f09a45410b13b1e3ce22390d46,True,False,,,,,0,1646494751,,0,{},hzgm8de,False,t3_t2azzg,False,True,t1_hypows6,/r/war/comments/t2azzg/if_you_know_you_know/hzgm8de/,1646494766,1,True,True,False,war,t5_2qhk8,r/war,public,,0,[],,1646465951.0,
19,[],False,,jacxy,,,[],,,,text,t2_agtu4,False,False,"
&gt;How can Russian {CH}Air Force allow that much of body fat accumulation in their airmen body??


Like that.",f83d08bc3e629636a75baf6e59caf4ef03af96ef,True,False,,,,,0,1646494626,,0,{},hzglykf,False,t3_t781k0,False,True,t1_hzfzvqm,/r/war/comments/t781k0/the_pilot_of_the_plane_in_chernihiv_used_to_bomb/hzglykf/,1646494640,1,True,True,False,war,t5_2qhk8,r/war,public,,0,[],,1646465826.0,
20,[],False,,henhen069,,,[],,,,text,t2_3m7plqk2,False,False,Russian or Ukrainian?,327b778c501814362550b62c3cfefc19eba253b9,True,False,,,,,0,1646494590,,0,{},hzglvpp,False,t3_t7bh6g,False,True,t3_t7bh6g,/r/war/comments/t7bh6g/oh_thats_hot_in_ochakiv/hzglvpp/,1646494602,1,True,True,False,war,t5_2qhk8,r/war,public,,0,[],,1646465790.0,
21,[],False,,SunMummis,,,[],,,,text,t2_9q01frag,False,False,A completely different circumstance.,2c655631d91cf9cce4ef078e73feb74164c14860,True,False,,,,,0,1646494577,,0,{},hzglund,False,t3_t781k0,False,True,t1_hzgehk8,/r/war/comments/t781k0/the_pilot_of_the_plane_in_chernihiv_used_to_bomb/hzglund/,1646494595,1,True,True,False,war,t5_2qhk8,r/war,public,,0,[],,1646465777.0,
22,[],False,,zuljin127,,,[],,,,text,t2_311buh10,False,False,Unfortunately this doesn't surprise me. I didn't expect any better from them.,a8b1db1046bb98baabe73048f02553ef83b8b1b5,True,False,,,,,0,1646494362,,0,{},hzglcvs,False,t3_t7bem8,False,True,t3_t7bem8,/r/war/comments/t7bem8/russians_shooting_unarmed_civilian/hzglcvs/,1646494373,1,True,True,False,war,t5_2qhk8,r/war,public,,0,[],,1646465562.0,
23,[],False,,NaturalGlum4286,,,[],,,,text,t2_8xrdj66h,False,False,"Oh now they are acting surprised, what did u think was gonna happen?",32ee5fe8afda9b6c66907e211f3821679ce6f6a5,True,False,,,,,0,1646494358,,0,{},hzglclv,False,t3_t7bem8,False,True,t3_t7bem8,/r/war/comments/t7bem8/russians_shooting_unarmed_civilian/hzglclv/,1646494373,1,True,True,False,war,t5_2qhk8,r/war,public,,0,[],,1646465558.0,
24,[],False,,IndiRefEarthLeaveSol,,,[],,,,text,t2_16ktbrcr,False,False,"those frogfoots in BF4 were a beast, not surprised they are in real life too. I guess its the same for A10s",3e1acd17a92b49af2bffbeed692e254693517359,True,False,,,,,0,1646494299,,0,{},hzgl7pk,False,t3_t76k26,False,True,t1_hzgf038,/r/war/comments/t76k26/russian_plane_shot_down_near_chernihiv/hzgl7pk/,1646494314,1,True,True,False,war,t5_2qhk8,r/war,public,,0,[],,1646465499.0,
25,[],False,,cybil_92,,,[],,,,text,t2_alz6gldv,False,False,"Upset? I think it is quite funny, not angering. Do you think no one should discuss or teach any history whatsoever because they have not personally lived through it enough for your liking? You sound like quite the child here.",6fd210fc0b623095417325b6509d61e72c3ed011,True,False,,,,,0,1646494290,,0,{},hzgl6xv,False,t3_spcimf,False,True,t1_hzg2wpn,/r/war/comments/spcimf/bijeljina_massacre_bosnia_1992_what_a_crazy_world/hzgl6xv/,1646494306,1,True,True,False,war,t5_2qhk8,r/war,public,,0,[],,1646465490.0,
26,[],False,,nicehax2112,,,[],,,,text,t2_1wfl497j,False,False,Fat shaming is good for society from utilitarian aspect.,83d8899d50b877c69c2045c5b2a253d30cdde62d,True,False,,,,,0,1646494137,,0,{},hzgkusj,False,t3_t76r2e,False,True,t1_hzgd2f3,/r/war/comments/t76r2e/pilot_of_the_russian_plane_that_was_shot_down/hzgkusj/,1646494150,1,True,True,False,war,t5_2qhk8,r/war,public,,0,[],,1646465337.0,
27,[],False,,fernguts,,,[],,,,text,t2_4tdbu,False,False,"I'm sure he wasn't that big when initially trained, but pilots are too valuable to fire for being overweight.  Just makes the plane burn a bit more fuel...",6d75ef38037e6dc8e4a587b5192ad83f3f3daa2a,True,False,,,,,0,1646494046,,0,{},hzgknqw,False,t3_t781k0,False,True,t1_hzfzvqm,/r/war/comments/t781k0/the_pilot_of_the_plane_in_chernihiv_used_to_bomb/hzgknqw/,1646494062,1,True,True,False,war,t5_2qhk8,r/war,public,,0,[],,1646465246.0,
28,[],False,,my_dog_can_dance,,,[],,,,text,t2_fpk9fhl,False,False,all out of smart bombs already,59f6b9261567ea76ae04efe29b63e475278dd309,True,False,,,,,0,1646493972,,0,{},hzgki02,False,t3_t77zmn,False,True,t1_hzg0mjj,/r/war/comments/t77zmn/plane_that_was_shot_down_in_chernihiv_crashed_on/hzgki02/,1646493987,1,True,True,False,war,t5_2qhk8,r/war,public,,0,[],,1646465172.0,
29,[],False,,dominic_l,,,[],,,,text,t2_9coeh,False,False,i think the day after the invasion Poland applied to nato and got accepted in 24 hours because they were afraid of exactly that.,308d7b23eb62923e861290857158327de0c555b9,True,False,,,,,0,1646493720,,0,{},hzgjyjn,False,t3_t6l596,False,True,t1_hzeca8t,/r/war/comments/t6l596/honestly_asking_about_the_strategy_of_nuclear/hzgjyjn/,1646493734,1,True,True,False,war,t5_2qhk8,r/war,public,,0,[],,1646464920.0,
30,[],False,,[deleted],,,,,,dark,,,,,[removed],fe993932d6dced4c0a879e9aa5d7a6e0fbb467f5,True,True,,,DELETED,,0,1646493685,,0,{},hzgjvrt,False,t3_t76zu3,False,True,t3_t76zu3,/r/war/comments/t76zu3/and_the_second_pilot_that_jumped_out_of_the_plane/hzgjvrt/,1646493703,1,True,True,False,war,t5_2qhk8,r/war,public,,0,[],,1646464885.0,
31,[],False,,[deleted],,,,,,dark,,,,,[removed],fe993932d6dced4c0a879e9aa5d7a6e0fbb467f5,True,True,,,DELETED,,0,1646493612,,0,{},hzgjq1g,False,t3_t76r2e,False,True,t1_hzgigl0,/r/war/comments/t76r2e/pilot_of_the_russian_plane_that_was_shot_down/hzgjq1g/,1646493628,1,True,True,False,war,t5_2qhk8,r/war,public,,0,[],,1646464812.0,
32,[],False,,GoobyPlsBro,,,[],,,,text,t2_7s3qihny,False,False,"Mate, you most likely didn't even know where Ukraine was located on the map a couple of weeks ago and now you act like you knew them your whole life. Most of people gobble all this bs propaganda without looking into the background to see what's happening. This war started a long time ago and has more context than ""OOH RUSSIA ATTACK UKRAINE RUSSIA EVIL FUCK RUSSIA"". Go back to 2014 or even earlier and educate yourself about the conflict and why this war actually happened between them.",faf9450279982fb3ccce9a9c42be4ee88987a833,True,False,,,,,0,1646493590,,0,{},hzgjob0,False,t3_t6hxyy,False,True,t1_hzfiypq,/r/war/comments/t6hxyy/aftermath_russian_column_defeated_while_attacking/hzgjob0/,1646493605,1,True,True,False,war,t5_2qhk8,r/war,public,,0,[],,1646464790.0,
33,[],False,,MoreOutside1184,,,[],,,,text,t2_esmdl8bd,False,False,Least horny brazilian,72e8870b6cb76cc1fe169c610332f81f1a119095,True,True,,,,,0,1646493368,,0,{},hzgj6z9,False,t3_t6vk43,False,True,t3_t6vk43,/r/war/comments/t6vk43/a_brazilian_politician_who_went_to_ukraine_and/hzgj6z9/,1646493384,1,True,True,False,war,t5_2qhk8,r/war,public,,0,[],,1646464568.0,
34,[],False,,MoreOutside1184,,,[],,,,text,t2_esmdl8bd,False,False,Average brazilian,6c3e9ffd5a87705ebe19ba9b0020ef50122d1b05,True,True,,,,,0,1646493335,,0,{},hzgj4d4,False,t3_t6vk43,False,True,t3_t6vk43,/r/war/comments/t6vk43/a_brazilian_politician_who_went_to_ukraine_and/hzgj4d4/,1646493347,1,True,True,False,war,t5_2qhk8,r/war,public,,0,[],,1646464535.0,
35,[],False,,WREN_PL,,,[],,,,text,t2_14u821,False,False,"I'm not 100 percent sure, but I have a suspicion that it's due to the fact that the seats they sit on are armored, so it protects their backs but not much else.",4f2e0a81b0b84eb769893a60d485ea86c26dfebb,True,False,,,,,0,1646493275,,0,{},hzgizpz,False,t3_t76zu3,False,True,t1_hzgi1oj,/r/war/comments/t76zu3/and_the_second_pilot_that_jumped_out_of_the_plane/hzgizpz/,1646493289,1,True,True,False,war,t5_2qhk8,r/war,public,,0,[],,1646464475.0,
36,[],False,,livarbesaru,,,[],,,,text,t2_9offlwtf,False,False,"I don't think, it's in the phrase ""physical requirement"", you can't be fat and be a pilot, unless you became one when you were fit, since you can't enter the army having to much fat. In case you are a pilot, you must follow a rigid training session and stay in physical and technical parameters, if not, you will be put out of the pilot position and someone better Will take the spot, you are not the owner of the jet nor have rights of position, it's the army, if you can you do it, if not you are out. You're hypothesis is totally faulty, 2 people with different weight do to body fat, not different weight do to muscular mass, will totally have different performance, the one fitter will surely breather better than the fat one, and this is all, to not talk about responsivness and reflex in combat situation.  This man in the photo must have some connection to be put in that position. If you have other statements, before talking, make a little search on internet about body standards in the aviation, I don't know in which country you are, but if you search your country's aviation site, you will find the brochure about enrollment and the body and technical requirements necessary to enter. And I'm discriminating no one, a dog can't climb like a cat, a cat can't hunt an horse like a lion, and a fat man can't ran, jump, climb, like a fitter man, just because you are in a vehicle doesn't mean your capabilities doesn't matter. Just a little extra, even drone's pilots have physical requirements to have the best responsivness.",7fd40ad83035709738642208495ea328830efd5f,True,False,,,,,0,1646493153,,0,{},hzgiqc0,False,t3_t76r2e,False,True,t1_hzgee02,/r/war/comments/t76r2e/pilot_of_the_russian_plane_that_was_shot_down/hzgiqc0/,1646493169,1,True,True,False,war,t5_2qhk8,r/war,public,,0,[],,1646464353.0,
37,[],False,,Evanmara53,,,[],,,,text,t2_1seeycz3,False,False,"Agreed. The pilots are just doing what they are told and almost never know what they are hitting unless it’s a CAS aircraft, which this SU-34 was not",db9454606258d2fd38b16f6d0a1a6255032551bc,True,False,,,,,0,1646493027,,0,{},hzgigl0,False,t3_t76r2e,False,True,t1_hzg21ef,/r/war/comments/t76r2e/pilot_of_the_russian_plane_that_was_shot_down/hzgigl0/,1646493043,1,True,True,False,war,t5_2qhk8,r/war,public,,0,[],,1646464227.0,
38,[],False,,[deleted],,,,,,dark,,,,,[removed],fe993932d6dced4c0a879e9aa5d7a6e0fbb467f5,True,True,,,DELETED,,0,1646492913,,0,{},hzgi7ua,False,t3_t76r2e,False,True,t1_hzg1hfd,/r/war/comments/t76r2e/pilot_of_the_russian_plane_that_was_shot_down/hzgi7ua/,1646492924,1,True,True,False,war,t5_2qhk8,r/war,public,,0,[],,1646464113.0,
39,[],False,,Enoneado,,,[],,,,text,t2_2oq7d4w5,False,False,another two pilots captured (SU-30 i guess) in other video have exactly same wounds on their heads and neck too...,cba4cbb6f0ffd380c4a45b8b00b5d6f71eb99ee7,True,False,,,,,0,1646492832,,0,{},hzgi1oj,False,t3_t76zu3,False,True,t1_hzgg4j0,/r/war/comments/t76zu3/and_the_second_pilot_that_jumped_out_of_the_plane/hzgi1oj/,1646492848,1,True,True,False,war,t5_2qhk8,r/war,public,,0,[],,1646464032.0,
40,[],False,,Former_Dust_1097,,,[],,,,text,t2_js7ux5ra,False,False,He been grazing in a fair paddock,1374fa0810a86d873c0aa8c856ca21ffeb55a016,True,False,,,,,0,1646492808,,0,{},hzghzsd,False,t3_t76r2e,False,True,t3_t76r2e,/r/war/comments/t76r2e/pilot_of_the_russian_plane_that_was_shot_down/hzghzsd/,1646492819,1,True,True,False,war,t5_2qhk8,r/war,public,,0,[],,1646464008.0,
41,[],False,,xXALLIGATORXx,,,[],,,,text,t2_714yvv9d,False,False,All major sub reddits have become propaganda outlets. The audience see only black and white so no point giving counter arguments.,e883788fb52f03ea5386dda963fa6c60fa4540f0,True,False,,,,,0,1646492531,,0,{},hzghest,False,t3_t781k0,False,True,t1_hzgc415,/r/war/comments/t781k0/the_pilot_of_the_plane_in_chernihiv_used_to_bomb/hzghest/,1646492545,1,True,True,False,war,t5_2qhk8,r/war,public,,0,[],,1646463731.0,
42,[],False,,Whitechapelkiller,,,[],,,,text,t2_125de9,False,False,Russian idiots. Stuart Ramsey is a very well known  Journalist.,885eb07c105ebc01544ab6b2f00da3e00fbcd31e,True,False,,,,,0,1646492468,,0,{},hzgha2k,False,t3_t6zo7u,False,True,t1_hzg5yvc,/r/war/comments/t6zo7u/sky_news_reporters_shot_at_by_russians_03042022/hzgha2k/,1646492486,1,True,True,False,war,t5_2qhk8,r/war,public,,0,[],,1646463668.0,
43,[],False,,PADPRADUDIT,,,[],,,,text,t2_3rilwvu7,False,False,Thank you for this.,116dab26c11ec3410d0637bee83c04eda7c38359,True,False,,,,,0,1646492454,,0,{},hzgh8xz,False,t3_t6zo7u,False,True,t1_hzgfhih,/r/war/comments/t6zo7u/sky_news_reporters_shot_at_by_russians_03042022/hzgh8xz/,1646492471,1,True,True,False,war,t5_2qhk8,r/war,public,,0,[],,1646463654.0,
44,[],False,,MountainHawk19,,,[],,,,text,t2_7t2fcxt9,False,False,The key is to get the opposing army to die for their country,04f3854fce4d25981a7f2cdf121aaa83ca083c3c,True,False,,,,,0,1646492383,,0,{},hzgh3l7,False,t3_t6cqb1,False,True,t3_t6cqb1,/r/war/comments/t6cqb1/how_to_survive_a_war_tips_threadsurvival_hacks/hzgh3l7/,1646492397,1,True,True,False,war,t5_2qhk8,r/war,public,,0,[],,1646463583.0,
45,[],False,,WREN_PL,,,[],,,,text,t2_14u821,False,False,"Probably. Those frags are what makes the AA missile so deadly.

AA missile fires basically an explosion-propelled shotgun-like shot of frags, depending on missile type either in a cone, sphere or a cylinder around the missile.

Each of the frags is designed to be fast enough and heavy enough to shred metal, so they pass through human body like knife through hot butter.",5d5414693164f48228bea0c1deff82b062d1a7fc,True,False,,,,,0,1646491916,,0,{},hzgg4j0,False,t3_t76zu3,False,False,t1_hzg3kzn,/r/war/comments/t76zu3/and_the_second_pilot_that_jumped_out_of_the_plane/hzgg4j0/,1646491930,1,True,True,False,war,t5_2qhk8,r/war,public,,0,[],,1646463116.0,
46,[],False,,Dope_youtube,,,[],,,,text,t2_1xy78532,False,False,What jet was this ? A su-25 or su-27 ?,2e8a2be7a3b79e48a3a5d089ac55930028359a58,True,False,,,,,0,1646491745,,0,{},hzgfs00,False,t3_t77zmn,False,True,t3_t77zmn,/r/war/comments/t77zmn/plane_that_was_shot_down_in_chernihiv_crashed_on/hzgfs00/,1646491759,1,True,True,False,war,t5_2qhk8,r/war,public,,0,[],,1646462945.0,
