,all_awardings,archived,associated_award,author,author_flair_background_color,author_flair_css_class,author_flair_richtext,author_flair_template_id,author_flair_text,author_flair_text_color,author_flair_type,author_fullname,author_patreon_flair,author_premium,body,body_sha1,can_gild,collapsed,collapsed_because_crowd_control,collapsed_reason,collapsed_reason_code,comment_type,controversiality,created_utc,distinguished,gilded,gildings,id,is_submitter,link_id,locked,no_follow,parent_id,permalink,retrieved_utc,score,score_hidden,send_replies,stickied,subreddit,subreddit_id,subreddit_name_prefixed,subreddit_type,top_awarded_type,total_awards_received,treatment_tags,unrepliable_reason,created,author_cakeday
852,[],False,,Boonaki,,,[],,,,text,t2_8kj4t,False,False,He can't reply for 7 days.,090c852a4c0cd9063722307751b1d3fe994ac595,True,False,,,,,0,1646428492,moderator,0,{},hzd8g9f,False,t3_t6nsi5,False,True,t1_hzd62dr,/r/war/comments/t6nsi5/why_doesnt_russia_just_join_nato/hzd8g9f/,1646428507,1,True,True,False,war,t5_2qhk8,r/war,public,,0,[],,1646399692.0,
853,[],False,,TheAgenda61,,,[],,,,text,t2_8j1168ct,False,False,"I really don't like propaganda, so sick of people trying to spew their narrative. Teenagers are literally getting burned alive. Then there are people making compilation videos with blockbuster music while sleeping on their nice warm beds halfway across the planet. How many kids do you think died slowly, alone, and scared after those airstrikes? What would that father who bled to death in the middle of the street think of motivational music being played over his dying body? What about the pilot who drowned to death after getting knocked out of the sky, what were his last thoughts? I get you to want to help, but it would be better to just share the NSFW posts as they were recorded. Delete this post please.",1fc36289e438525ac4673a6f1cd41673ce279c5d,True,False,,,,,0,1646428407,,0,{},hzd88fp,False,t3_t6izub,False,True,t3_t6izub,/r/war/comments/t6izub/ukraine_motivation_i_created_this_with_clips/hzd88fp/,1646428423,1,True,True,False,war,t5_2qhk8,r/war,public,,0,[],,1646399607.0,
854,[],False,,cannuckgamer,,,[],,,,text,t2_udvmq,False,False,How come no one's talking about the 8 years of indiscriminate killing of civilians in the Donbas region?,ca3c32c5095bdc2874ba259d21f7ee40dc2745df,True,True,,,,,0,1646428334,,0,{},hzd81i1,False,t3_t6j53h,False,True,t3_t6j53h,/r/war/comments/t6j53h/a_war_on_truth/hzd81i1/,1646428347,1,True,True,False,war,t5_2qhk8,r/war,public,,0,[],,1646399534.0,
855,[],False,,HODLShib2moon,,,[],,,,text,t2_dg0roknw,False,False,"I've found a few, on Woods mostly.  (its my regular jam.)  run the back edge of the map along the mines hit all the camps, and the hut with the chain-link fence if leaving via outskirts.   Never hit the lumber yard I'm too new to survive that hot spot.",a101a7e465e1d68a1ac9f7064cbc5b28fcd51841,True,False,,,,,0,1646428142,,0,{},hzd7jdq,False,t3_t64r0u,False,True,t1_hzcndyr,/r/war/comments/t64r0u/its_unthinkable_how_2_weeks_ago_we_didnt_even/hzd7jdq/,1646428158,1,True,True,False,war,t5_2qhk8,r/war,public,,0,[],,1646399342.0,
856,[],False,,CrazyFlimsy5349,,,[],,,,text,t2_4e0ot9az,False,False,Have a good weekend :),4dca9578249af09085af856732aa9f51832d52b5,True,False,,,,,0,1646428134,,0,{},hzd7ion,False,t3_t6nsi5,False,True,t1_hzd71o3,/r/war/comments/t6nsi5/why_doesnt_russia_just_join_nato/hzd7ion/,1646428150,1,True,True,False,war,t5_2qhk8,r/war,public,,0,[],,1646399334.0,
857,[],False,,[deleted],,,,,,dark,,,,,[removed],fe993932d6dced4c0a879e9aa5d7a6e0fbb467f5,True,True,,,DELETED,,0,1646428024,,0,{},hzd780o,False,t3_t6aorb,False,True,t3_t6aorb,/r/war/comments/t6aorb/shots_fired_at_unarmed_civilians_during_a_protest/hzd780o/,1646428035,1,True,True,False,war,t5_2qhk8,r/war,public,,0,[],,1646399224.0,
858,[],False,,Higgs-B-X37B,,,[],,,,text,t2_ihst086i,False,False,Het. No way no way.,04e20d6870c5ddfbc23dea5a18d9c919c0b8800e,True,False,,,,,0,1646428014,,0,{},hzd773j,False,t3_t6bkls,False,True,t1_hzapat1,/r/war/comments/t6bkls/does_the_russian_attack_on_nuclear_plant_last/hzd773j/,1646428028,1,True,True,False,war,t5_2qhk8,r/war,public,,0,[],,1646399214.0,
859,[],False,,MagicMarshmelllow,,,[],,,,text,t2_3q1qs3xx,False,False,Let’s interview these same brainwashed people in a couple of weeks and see how they feel when they can’t buy shit.,6d2201dc2c2874f60d0475463e1228704892bc52,True,False,,,,,0,1646427961,,0,{},hzd726d,False,t3_t6pz2c,False,True,t3_t6pz2c,/r/war/comments/t6pz2c/how_russians_reacted_when_we_showed_them_pictures/hzd726d/,1646427972,1,True,True,False,war,t5_2qhk8,r/war,public,,0,[],,1646399161.0,
860,[],False,,Ivanxd23,,,[],,,,text,t2_xuh3bq5,False,False,"True, have a good day. And sorry if i offended you but iam not on the russian side",e547f11199f7cf79100402225c0137d1ccb28573,True,False,,,,,0,1646427955,,0,{},hzd71o3,False,t3_t6nsi5,False,True,t1_hzd62dr,/r/war/comments/t6nsi5/why_doesnt_russia_just_join_nato/hzd71o3/,1646427972,1,True,True,False,war,t5_2qhk8,r/war,public,,0,[],,1646399155.0,
861,[],False,,[deleted],,,,,,dark,,,,,[removed],fe993932d6dced4c0a879e9aa5d7a6e0fbb467f5,True,True,,,DELETED,,0,1646427840,,0,{},hzd6qm8,False,t3_t6764i,False,True,t3_t6764i,/r/war/comments/t6764i/peacefull_russia/hzd6qm8/,1646427858,1,True,True,False,war,t5_2qhk8,r/war,public,,0,[],,1646399040.0,
862,[],False,,CellistTop1410,,,[],,,,text,t2_9ktmpulo,False,False,The Mistery Warmachine stolen by the Ucrainean Gypsy's 😂😂,aeb6af2043637c96ee5fde6f4c8b5f9e68e4d9a4,True,False,,,,,0,1646427822,,0,{},hzd6ow4,False,t3_t6mwt2,False,True,t3_t6mwt2,/r/war/comments/t6mwt2/doesnt_look_like_a_training_operation/hzd6ow4/,1646427835,1,True,True,False,war,t5_2qhk8,r/war,public,,0,[],,1646399022.0,
863,[],False,,Zestyclose_Wolf3998,,,[],,,,text,t2_fe2wtnnh,False,False,"&gt;Everyone on reddit claims to post ""the truth"" the truth often times is more bullshit than trolling.

You are right, I advise you not to believe the media, watch the information and make assumptions, now Russia is being persecuted",0bfaf48d7104ea4fb07149d3e6de31620233f748,True,True,,,,,0,1646427817,,0,{},hzd6odx,False,t3_t6mwt2,False,True,t1_hzd4r1d,/r/war/comments/t6mwt2/doesnt_look_like_a_training_operation/hzd6odx/,1646427834,1,True,True,False,war,t5_2qhk8,r/war,public,,0,[],,1646399017.0,
864,[],False,,Higgs-B-X37B,,,[],,,,text,t2_ihst086i,False,False,One shell land behind facility in the grounds.. it was mistake and caused fire. This is bad but also mistake.,46256d32b3e79a2981382dc6517ff67e99a9583a,True,False,,,,,0,1646427781,,0,{},hzd6l03,False,t3_t6bkls,False,True,t1_hzb1ys6,/r/war/comments/t6bkls/does_the_russian_attack_on_nuclear_plant_last/hzd6l03/,1646427796,1,True,True,False,war,t5_2qhk8,r/war,public,,0,[],,1646398981.0,
865,[],False,,MagicMarshmelllow,,,[],,,,text,t2_3q1qs3xx,False,False,Are we sure it was Istanbul and not Constantinople?,42765487ee4bc486b9cd44ec603287e04e6a0797,True,False,,,,,0,1646427754,,0,{},hzd6idp,False,t3_t61w4g,False,True,t1_hz8g0xz,/r/war/comments/t61w4g/ever_wondered_what_a_supersonic_f16_sounds_like/hzd6idp/,1646427766,1,True,True,False,war,t5_2qhk8,r/war,public,,0,[],,1646398954.0,
866,[],False,,[deleted],,,,,,dark,,,,,[removed],fe993932d6dced4c0a879e9aa5d7a6e0fbb467f5,True,True,,,DELETED,,0,1646427707,,0,{},hzd6e1m,False,t3_t6m15y,False,True,t3_t6m15y,/r/war/comments/t6m15y/abandoned_by_the_world_and_destroyed_syrians/hzd6e1m/,1646427721,1,True,True,False,war,t5_2qhk8,r/war,public,,0,[],,1646398907.0,
867,[],False,,Zestyclose_Wolf3998,,,[],,,,text,t2_fe2wtnnh,False,False,"&gt;You should probably post some of your content in other subs. I feel like they'd get more attention there.

Hello, I think my content will just be blocked because people don't want to see the truth...",c22120b35ff32fbfecceef61123369c146564b45,True,True,,,,,0,1646427680,,0,{},hzd6bj3,False,t3_t6mwt2,False,True,t1_hzd5h79,/r/war/comments/t6mwt2/doesnt_look_like_a_training_operation/hzd6bj3/,1646427698,1,True,True,False,war,t5_2qhk8,r/war,public,,0,[],,1646398880.0,
868,[],False,,[deleted],,,,,,dark,,,,,[removed],fe993932d6dced4c0a879e9aa5d7a6e0fbb467f5,True,True,,,DELETED,,0,1646427646,,0,{},hzd68an,False,t3_t6j53h,False,True,t3_t6j53h,/r/war/comments/t6j53h/a_war_on_truth/hzd68an/,1646427660,1,True,True,False,war,t5_2qhk8,r/war,public,,0,[],,1646398846.0,
869,[],False,,ozziedog,,,[],,,,text,t2_4by8c,False,False,"You have to be delusional to think NATO is a military threat to Russia. But now we know NATO can easily handle Russian forces should they invade a NATO state. That's the point. This is all about his ego, his reconquista. Everything else are false justifications. And that poorly organized shitty looking Russian army would suddenly be a whole lot better if they were invaded, like Ukraine. If Russia is beggared by the war, Putin won't give a fuck so long as he conquers. Our best hope is that Russia breaks from Putin and cracks are starting to show.",33e5b7d03194ac45fcbd26c6822060e5a8570950,True,False,,,,,0,1646427637,,0,{},hzd67dx,False,t3_t6h44c,False,False,t1_hzbwna4,/r/war/comments/t6h44c/why_would_putin_invade_knowing_his_country_would/hzd67dx/,1646427653,1,True,True,False,war,t5_2qhk8,r/war,public,,0,[],,1646398837.0,
870,[],False,,m0nopolymoney,,,[],,,,text,t2_fwu8c,False,False,"Putin, knowing he would lose against NATO, would likely escalate to nukes. He would justify this because Russian borders would need to be breached to impose a no fly zone. Anti aircraft defense on Russian soil would need to be destroyed.",17f3fa3c95656c91e2adc39438b4c729fec73f7e,True,False,,,,,0,1646427636,,0,{},hzd67bd,False,t3_t6l596,False,True,t1_hzcv9w2,/r/war/comments/t6l596/honestly_asking_about_the_strategy_of_nuclear/hzd67bd/,1646427652,1,True,True,False,war,t5_2qhk8,r/war,public,,0,[],,1646398836.0,
871,[],False,,DBacksbeatDodgers,,,[],,,,text,t2_3x23v47t,False,False,A real action hero,ff4627f0f9f1efd7ef0bd8128a9a86469a01969a,True,False,,,,,0,1646427611,,0,{},hzd64we,False,t3_t6j413,False,True,t1_hzcbus7,/r/war/comments/t6j413/the_champions_of_humar_rights_nato/hzd64we/,1646427622,1,True,True,False,war,t5_2qhk8,r/war,public,,0,[],,1646398811.0,
872,[],False,,CrazyFlimsy5349,,,[],,,,text,t2_4e0ot9az,False,False,"You're a Russian troll, that's my problem.

If I'm not worth your time, stop replying. Lmfao",f83019346dc4d3be51e7c4afc927c2f123d59a98,True,False,,,,,0,1646427585,,0,{},hzd62dr,False,t3_t6nsi5,False,True,t1_hzd5cr0,/r/war/comments/t6nsi5/why_doesnt_russia_just_join_nato/hzd62dr/,1646427598,1,True,True,False,war,t5_2qhk8,r/war,public,,0,[],,1646398785.0,
873,[],False,,Darth_Vuk,,,[],,,,text,t2_gac9fmtb,False,False,Are you from Bosnia or live through the war?,3bca52db5fb24c7a46461e793c0ed19c8f21172d,True,False,,,,,0,1646427505,,0,{},hzd5uwz,False,t3_spcimf,False,True,t1_hwfeyko,/r/war/comments/spcimf/bijeljina_massacre_bosnia_1992_what_a_crazy_world/hzd5uwz/,1646427520,1,True,True,False,war,t5_2qhk8,r/war,public,,0,[],,1646398705.0,
874,[],False,,SigumndFreud,,,[],,,,text,t2_8x3expii,False,False,Careful in Russia it is now illegal to call it a war.,a94e7b2754bf27bbde2de7fe235bac2e0c568ca7,True,False,,,,,0,1646427462,,0,{},hzd5qql,False,t3_t5tdsa,False,True,t1_hzchr8e,/r/war/comments/t5tdsa/new_update/hzd5qql/,1646427475,1,True,True,False,war,t5_2qhk8,r/war,public,,0,[],,1646398662.0,
875,[],False,,Snoo56380,,,[],,,,text,t2_6cjz6cht,False,False,I mean he’s not right but he’s also not wrong,ddba50a4236827a8c9335e0f93ca7ddb34b882a2,True,False,,,,,0,1646427441,,0,{},hzd5oys,False,t3_t68kkp,False,True,t3_t68kkp,/r/war/comments/t68kkp/what_youre_not_being_told/hzd5oys/,1646427460,1,True,True,False,war,t5_2qhk8,r/war,public,,0,[],,1646398641.0,
876,[],False,,SheepPez,,,[],,,,text,t2_1o77iap4,False,False,You should probably post some of your content in other subs. I feel like they'd get more attention there.,7f09bc339e4c51f100172ff15b7d76ae3b14623e,True,False,,,,,0,1646427359,,0,{},hzd5h79,False,t3_t6mwt2,False,True,t1_hzd1gmc,/r/war/comments/t6mwt2/doesnt_look_like_a_training_operation/hzd5h79/,1646427370,1,True,True,False,war,t5_2qhk8,r/war,public,,0,[],,1646398559.0,
877,[],False,,Ivanxd23,,,[],,,,text,t2_xuh3bq5,False,False,"Fucking retard, you are not worth my time. They triend but uk and us fucked them. What is your problem?",27406f8dd51aeab14a823a074b142b7791726a77,True,False,,,,,0,1646427312,,0,{},hzd5cr0,False,t3_t6nsi5,False,True,t1_hzd1pq7,/r/war/comments/t6nsi5/why_doesnt_russia_just_join_nato/hzd5cr0/,1646427325,1,True,True,False,war,t5_2qhk8,r/war,public,,0,[],,1646398512.0,
878,[],False,,[deleted],,,,,,dark,,,,,[removed],fe993932d6dced4c0a879e9aa5d7a6e0fbb467f5,True,True,,,DELETED,,0,1646427305,,0,{},hzd5c4a,False,t3_t62496,False,True,t1_hzbgzkm,/r/war/comments/t62496/berlin_germany_over_100000_people_turn_out_to/hzd5c4a/,1646427317,1,True,True,False,war,t5_2qhk8,r/war,public,,0,[],,1646398505.0,
879,[],False,,m0nopolymoney,,,[],,,,text,t2_fwu8c,False,False,"When i see the videos and feel bloodlust, i try to pause and think about the smell…",f0de9cdd9fa3cb7d8c2b019e44e8275d04e1b0b2,True,False,,,,,0,1646427183,,0,{},hzd50fa,False,t3_t6kfjm,False,True,t3_t6kfjm,/r/war/comments/t6kfjm/eager_for_war/hzd50fa/,1646427202,1,True,True,False,war,t5_2qhk8,r/war,public,,0,[],,1646398383.0,
880,[],False,,Zestyclose_Wolf3998,,,[],,,,text,t2_fe2wtnnh,False,False,"&gt;Ah the Russians are booby trapping the city? Seems very unlikely and it serves no purpose. It's fake or just the Ukrainian government is lying again. Just like what happened on Snake island, or when they said that the Russians bombed civilian targets but on one video it was clear that the Ukrainian army had set up artillery right between the same buildings that got destroyed later. Ukraine is getting desperate, sadly too many ppl believe in this propaganda bs.

I'm glad there are people who understand what's really going on.",575a99c24dcb8eee835be6463330237279382106,True,True,,,,,0,1646427169,,0,{},hzd4z4a,False,t3_t5rfjs,False,True,t1_hzalyjk,/r/war/comments/t5rfjs/occupants_started_rigging_kherson/hzd4z4a/,1646427186,1,True,True,False,war,t5_2qhk8,r/war,public,,0,[],,1646398369.0,
881,[],False,,SheepPez,,,[],,,,text,t2_1o77iap4,False,False,"Everyone on reddit claims to post ""the truth"" the truth often times is more bullshit than trolling.",dc25c2cefc12b3d26adbc44f9429a55a4d8c03ad,True,False,,,,,0,1646427085,,0,{},hzd4r1d,False,t3_t6mwt2,False,True,t1_hzd1gmc,/r/war/comments/t6mwt2/doesnt_look_like_a_training_operation/hzd4r1d/,1646427096,1,True,True,False,war,t5_2qhk8,r/war,public,,0,[],,1646398285.0,
882,[],False,,Insaneswatage,,,[],,,,text,t2_9r8oo,False,False,"google: shell shocked soldier

poor souls :/",2917a2a616a28547b77a907d8f7b8b0634ae4591,True,False,,,,,0,1646427059,,0,{},hzd4on4,False,t3_t6dj10,False,True,t3_t6dj10,/r/war/comments/t6dj10/how_are_soldiers_not_afraid_of_the_sounds_of/hzd4on4/,1646427074,1,True,True,False,war,t5_2qhk8,r/war,public,,0,[],,1646398259.0,
883,[],False,,SheepPez,,,[],,,,text,t2_1o77iap4,False,False,OOF.,a3d73ff7f2f84d79c985d51a7e3e31f98899d569,True,False,,,,,0,1646427031,,0,{},hzd4lxa,False,t3_t6mwt2,False,True,t3_t6mwt2,/r/war/comments/t6mwt2/doesnt_look_like_a_training_operation/hzd4lxa/,1646427044,1,True,True,False,war,t5_2qhk8,r/war,public,,0,[],,1646398231.0,
884,[],False,,tnsnames,,,[],,,,text,t2_13oq4b,False,False,"It is probably Russians. But considering that, operator say that there is nobody in this building. And that there is construction materials nearby. I do not think that building was occupied, it is probably at finishing stage of construction(which do make it good position for VSU if they do not want to endanger civilians..",d78033b1211691e7bf81456a1a62da4c6e0de8d8,True,False,,,,,0,1646426990,,0,{},hzd4huy,False,t3_t6jjwd,False,True,t1_hzcrq28,/r/war/comments/t6jjwd/russians_blatantly_shooting_civilian_buildings/hzd4huy/,1646427006,1,True,True,False,war,t5_2qhk8,r/war,public,,0,[],,1646398190.0,
885,[],False,,mcmdodo,,,[],,,,text,t2_a0bw5zdh,False,False,Where is NATO when you need them? 🙄 Does Ukraine still want to join NATO?,41ba17119f072392df904d80e8c9daeb893e34cb,True,False,,,,,0,1646426947,,0,{},hzd4dmm,False,t3_t6quje,False,True,t3_t6quje,/r/war/comments/t6quje/i_think_we_can_all_use_a_shitpost_now_and_again/hzd4dmm/,1646426961,1,True,True,False,war,t5_2qhk8,r/war,public,,0,[],,1646398147.0,
886,[],False,,Zestyclose_Wolf3998,,,[],,,,text,t2_fe2wtnnh,False,False,Why do you think the video has no sound? This video was filmed by Ukrainians and they just said that these streamers were put by the army of the Armed Forces of Ukraine,782e98cce6cbe4a4a8014c0ae543818eeec0d457,True,True,,,,,0,1646426947,,0,{},hzd4dmg,False,t3_t5rfjs,False,True,t3_t5rfjs,/r/war/comments/t5rfjs/occupants_started_rigging_kherson/hzd4dmg/,1646426961,1,True,True,False,war,t5_2qhk8,r/war,public,,0,[],,1646398147.0,
887,[],False,,dominic_l,,,[],,,,text,t2_9coeh,False,False,russia can afford way more loses than ukraine so they still have a huge task ahead of them,09e08faacab3b7116a217862e260ad20b2bed864,True,False,,,,,0,1646426880,,0,{},hzd4752,False,t3_t6o1m6,False,True,t1_hzcxojd,/r/war/comments/t6o1m6/it_didnt_end_well_for_this_lot_of_invaders/hzd4752/,1646426897,1,True,True,False,war,t5_2qhk8,r/war,public,,0,[],,1646398080.0,
888,[],False,,AlbaMeira1107,,,[],,,,text,t2_f1lept4r,False,False,This is so intense. This is a real war. Fuck,452f1c9a8c024c8acc7940861d440ab23d685af9,True,False,,,,,0,1646426849,,0,{},hzd448q,False,t3_t6jemf,False,True,t3_t6jemf,/r/war/comments/t6jemf/footage_of_russian_forces_capturing_volnovakha_in/hzd448q/,1646426863,1,True,True,False,war,t5_2qhk8,r/war,public,,0,[],,1646398049.0,
889,[],False,,Zestyclose_Wolf3998,,,[],,,,text,t2_fe2wtnnh,False,False,"'m trying to open your eyes, don't believe the corrupt media, have your own opinion, everything is clear on my videos",b8ffe6b04278dc75283b3b0d1e8ebe00c3033a6f,True,True,,,,,0,1646426834,,0,{},hzd42uu,False,t3_t6jjwd,False,True,t1_hzd278s,/r/war/comments/t6jjwd/russians_blatantly_shooting_civilian_buildings/hzd42uu/,1646426847,1,True,True,False,war,t5_2qhk8,r/war,public,,0,[],,1646398034.0,
890,[],False,,astiik,,,[],,,,text,t2_10a5is,False,False,"Open your eyes, everything is not as simple as they show you.",47411e6f1624b3d3638cbfa3a3bfd4fc6cea3b74,True,False,,,,,0,1646426632,,0,{},hzd3jwc,True,t3_t6saxu,False,True,t3_t6saxu,/r/war/comments/t6saxu/ukraine_neonazis_infiltrate_every_level_of/hzd3jwc/,1646426648,1,True,True,False,war,t5_2qhk8,r/war,public,,0,[],,1646397832.0,
891,[],False,,mcmdodo,,,[],,,,text,t2_a0bw5zdh,False,False,"What's your point? War is bad? ok I agree, war is bad. Good point.

You're preaching to the choir, nobody stared a war here. Or do you mean Ukrainians shouldn't defend their homes because war is bad?",31cc6bb7fe0baf1fbeada87eaa90e6360b048290,True,False,,,,,0,1646426451,,0,{},hzd32uf,False,t3_t6kfjm,False,True,t3_t6kfjm,/r/war/comments/t6kfjm/eager_for_war/hzd32uf/,1646426464,1,True,True,False,war,t5_2qhk8,r/war,public,,0,[],,1646397651.0,
892,[],False,,o0flatCircle0o,,,[],,,,text,t2_kca1d,False,False,And he’s a leftist. This is what a leftist looks like.,793762a8d2c4a1f3ef4fbc962b1370d8c26a11ca,True,True,,,,,0,1646426364,,0,{},hzd2upe,False,t3_t64r0u,False,True,t3_t64r0u,/r/war/comments/t64r0u/its_unthinkable_how_2_weeks_ago_we_didnt_even/hzd2upe/,1646426379,1,True,True,False,war,t5_2qhk8,r/war,public,,0,[],,1646397564.0,
893,[],False,,longestbiggestnamevr,,,[],,,,text,t2_jeny1jo8,False,False,Have 15 capitols.,06e8c8a40fb8ec2fca92b730924548193c832a40,True,False,,,,,0,1646426299,,0,{},hzd2ojy,False,t3_t6cqb1,False,True,t3_t6cqb1,/r/war/comments/t6cqb1/how_to_survive_a_war_tips_threadsurvival_hacks/hzd2ojy/,1646426310,1,True,True,False,war,t5_2qhk8,r/war,public,,0,[],,1646397499.0,
894,[],False,,Steeltoedsandal,,,[],,,,text,t2_ht0slmtf,False,False,"The old adages ""there's two sides to every story"" or ""this is my opinion"" doesn't matter anymore apparently. The governments of the world do not want free thinkers or people that deviate from whatever their narrative is. If you think for yourself the government has no use for you. If you are useful to the government, their most popular job is ""meat shield"" XD",abea21b1651ef1de16dc2a4115b9fd03eb0ecf14,True,False,,,,,0,1646426289,,0,{},hzd2nm5,False,t3_t6ni69,False,True,t3_t6ni69,/r/war/comments/t6ni69/russianaustralian_man_booted_from_talk_show_for/hzd2nm5/,1646426300,1,True,True,False,war,t5_2qhk8,r/war,public,,0,[],,1646397489.0,
895,[],False,,mmanseuragain,,,[],,,,text,t2_a8uvscmi,False,True,"Based on the source, take with a grain of salt.",1f4431b443d9c1d4b132fb237ec8035282bbb70c,True,False,,,,,0,1646426281,,0,{},hzd2mvr,False,t3_t6mdkh,False,True,t3_t6mdkh,/r/war/comments/t6mdkh/ukrainian_foreign_legion_member_killed_in_action/hzd2mvr/,1646426301,1,True,True,False,war,t5_2qhk8,r/war,public,,0,[],,1646397481.0,
896,[],False,,hairyass2,,,[],,,,text,t2_1ism7e7u,False,False,When did I say most are surrendering? lol,f307d6fa8cbec687c0430b47bf83ac1fc91ea9c5,True,False,,,,,0,1646426261,,0,{},hzd2l3a,False,t3_t64f40,False,True,t1_hzclz91,/r/war/comments/t64f40/same_old_story/hzd2l3a/,1646426275,1,True,True,False,war,t5_2qhk8,r/war,public,,0,[],,1646397461.0,
897,[],False,,pwntr,,,[],,,,text,t2_7gox5,False,False,"They made it no fly for now.  It looks like they just cut through it though, not anything really",76c21ca713bf78207569d8b82fc7a8066f4b7f81,True,False,,,,,0,1646426177,,0,{},hzd2d8d,False,t3_t6l5al,False,True,t1_hzcwu8n,/r/war/comments/t6l5al/russian_jets_began_entering_swedish_airspace/hzd2d8d/,1646426190,1,True,True,False,war,t5_2qhk8,r/war,public,,0,[],,1646397377.0,
898,[],False,,-XxICExX-,,,[],,,,text,t2_jehdxwd,False,False,New account posting fake news...,249a7aa6d4b7c045c18be8c315de3b323fad26e0,True,False,,,,,0,1646426114,,0,{},hzd278s,True,t3_t6jjwd,False,True,t1_hzd1m2b,/r/war/comments/t6jjwd/russians_blatantly_shooting_civilian_buildings/hzd278s/,1646426130,1,True,True,False,war,t5_2qhk8,r/war,public,,0,[],,1646397314.0,
899,[],False,,sexylegs0123456789,,,[],,,,text,t2_12b8ti,False,False,"I’m asking because it must be awful - im sorry for being so abrasive about it. I could never imagine this, and all we ever see are images - most never have to live with the other senses interacting with such an environment. 

I’m simply curious because it’s such a god awful scene. 

I am sorry I offended you or anybody else by this question. It is never my intent.",63ee165f7b889bb3e8a772407d483946e5a5021a,True,False,,,,,0,1646425981,,0,{},hzd1ukk,False,t3_t6hxyy,False,True,t1_hzd1j9f,/r/war/comments/t6hxyy/aftermath_russian_column_defeated_while_attacking/hzd1ukk/,1646425997,1,True,True,False,war,t5_2qhk8,r/war,public,,0,[],,1646397181.0,
900,[],False,,mcmdodo,,,[],,,,text,t2_a0bw5zdh,False,False,"Without NATO boots and air power, there's only one probably outcome. Russia will encircle Kyiv and it's only a matter of time before Ukraine runs out of supplies and has to surrender Kyiv. At that point, it's over.

It's frustrating to watch NATO do nothing after leading Ukraine on about membership for so long. As if sanctions and arms shipment are going to change the outcome.",930a5f54757e8bdc0e4b0eff828fbc15cfd0b1d7,True,False,,,,,0,1646425936,,0,{},hzd1qfz,False,t3_t6iw6f,False,True,t3_t6iw6f,/r/war/comments/t6iw6f/russia_and_ukraine/hzd1qfz/,1646425952,1,True,True,False,war,t5_2qhk8,r/war,public,,0,[],,1646397136.0,
901,[],False,,CrazyFlimsy5349,,,[],,,,text,t2_4e0ot9az,False,False,"Misquoted reasons for NATO to deny russias application.

Get fucked troll",55105fdbb456c32ed535c01166479a4d68b8b4af,True,False,,,,,0,1646425929,,0,{},hzd1pq7,False,t3_t6nsi5,False,False,t1_hzd12zs,/r/war/comments/t6nsi5/why_doesnt_russia_just_join_nato/hzd1pq7/,1646425953,1,True,True,False,war,t5_2qhk8,r/war,public,,0,[],,1646397129.0,
902,[],False,,dominic_l,,,[],,,,text,t2_9coeh,False,False,"i dont think people really understand how destructive just one nuclear device is. its basically a small sun exploding on earth. just one could destroy the entire city of new york.

and if everyone has a nuke, the chances of an accident or a bad decission goes waaay up. id still prefer 100 conventional wars to even one nuclear war.

you have to understand some people dont play by the same rules you do. they dont think the same as you. they can cause 100 million people starve to death and still sleep like a baby at night.

like alfred said 'some people just want to watch the world burn'. outside of our safe and comfortable illusion that we call society, the human race never left the jungle. war is the ultimate expression of the jungle. the real world has no rules.",6de6bb96022a747e32d3cd8792c9aadc5b8c8005,True,False,,,,,0,1646425918,,0,{},hzd1ot5,False,t3_t6l596,False,True,t1_hzczoyh,/r/war/comments/t6l596/honestly_asking_about_the_strategy_of_nuclear/hzd1ot5/,1646425929,1,True,True,False,war,t5_2qhk8,r/war,public,,0,[],,1646397118.0,
903,[],False,,Zestyclose_Wolf3998,,,[],,,,text,t2_fe2wtnnh,False,False,"Do not believe the media, you are being deceived, I posted the truth in my account",33771efc690b53687acd2c5081304aafa0db0678,True,False,,,,,0,1646425888,,0,{},hzd1m2b,False,t3_t6jjwd,False,True,t3_t6jjwd,/r/war/comments/t6jjwd/russians_blatantly_shooting_civilian_buildings/hzd1m2b/,1646425907,1,True,True,False,war,t5_2qhk8,r/war,public,,0,[],,1646397088.0,
904,[],False,,pwntr,,,[],,,,text,t2_7gox5,False,False,Real answer: there is no way to answer your question rudely enough to get the point across his extremely inappropriate you are.,e0288557a33d7f07a703abaacfc92af67d537259,True,False,,,,,0,1646425858,,0,{},hzd1j9f,False,t3_t6hxyy,False,True,t1_hzct7ph,/r/war/comments/t6hxyy/aftermath_russian_column_defeated_while_attacking/hzd1j9f/,1646425870,1,True,True,False,war,t5_2qhk8,r/war,public,,0,[],,1646397058.0,
