Unnamed: 0,all_awardings,archived,associated_award,author,author_flair_background_color,author_flair_css_class,author_flair_richtext,author_flair_template_id,author_flair_text,author_flair_text_color,author_flair_type,author_fullname,author_patreon_flair,author_premium,body,body_sha1,can_gild,collapsed,collapsed_because_crowd_control,collapsed_reason,collapsed_reason_code,comment_type,controversiality,created_utc,distinguished,gilded,gildings,id,is_submitter,link_id,locked,no_follow,parent_id,permalink,retrieved_utc,score,score_hidden,send_replies,stickied,subreddit,subreddit_id,subreddit_name_prefixed,subreddit_type,top_awarded_type,total_awards_received,treatment_tags,unrepliable_reason,created,author_cakeday,edited,editable,media_metadata
,[],False,,Intrepid-Western-489,,,[],,,,text,t2_8w62ek4v,False,False,"Ua using civilian ambulances 

https://mobile.twitter.com/Taurevanime/status/1509471500813979653

Shooting civis , there has been other vid  of a guy trying to run away getting shot in a leg

https://www.reddit.com/r/EasternPolitics/comments/t28zkr/ukranian_army_arresting_innocent_civilians_trying/?utm_medium=android_app&amp;utm_source=share

Arming civilians will end up with innocent  ppl mistaken for combatants... 

No war crimes claim by UA and shitheads like Azov just shows ydk shit about that conflict , just read a lil bit about it... from none ukranian site... Donbass did not get so fucked by itself 

also one more thing since u mentioned shelling , Ukrain shelled their own civilians at one point in the invasion 

https://www.reddit.com/r/EasternPolitics/comments/t177hv/ukranian_army_hit_a_building_2_civilians_dead_in/?utm_medium=android_app&amp;utm_source=share


https://www.reddit.com/r/conspiracy/comments/te9x7i/video_graphic_warning_rare_cctv_footage_of_the/?utm_medium=android_app&amp;utm_source=share

also DEEZ NUTS",8a94ea346c09326e9a7b44e1f85a1f022e89ad99,True,False,,,,,0,1649835033,,0,{},i4jdxv7,False,t3_u22o2k,False,True,t1_i4gxc2b,/r/war/comments/u22o2k/what_war_crimes_are_the_ukrainian_doing/i4jdxv7/,1649835046,1,True,True,False,war,t5_2qhk8,r/war,public,,0,[],,1649806233.0,,,,
,[],False,,Always_Jerking,,,[],,,,text,t2_csuku9qr,False,False,"&gt;Why is the media going to such great lengths to show you on side while hiding the other?

This is the most important one. Because russia don't allow any western media. Nobody can check them. They have 100% government produced materials.

They close all their free media. And for speaking anything about war you have 15 years in prison. This is the answer.",5275de2e096b603e1a05953e107a4b2f256022f1,True,False,,,,,0,1649834995,,0,{},i4jdw8f,False,t3_u1sots,False,True,t1_i4iigwz,/r/war/comments/u1sots/if_russia_takes_over_ukraine_then_what_happens/i4jdw8f/,1649835005,1,True,True,False,war,t5_2qhk8,r/war,public,,0,[],,1649806195.0,,,,
,[],False,,royal_asshole,,,[],,,,text,t2_1v2luvdd,False,False,"Difficult to see what really happened here. If there was a chance that enemy tanks come from that direction, why would you just stand there like a bunch of chicken. And from the tank side the same, why would you be crazy enough to approach an enemy group of soldiers like that.",11623ab3b3d2add988f8fc4b0ee996058784ed03,True,False,,,,,0,1649834947,,0,{},i4jdu8f,False,t3_u25pe5,False,True,t3_u25pe5,/r/war/comments/u25pe5/tank_firing_into_a_group_of_ukrainian_soldiers_at/i4jdu8f/,1649834959,1,True,True,False,war,t5_2qhk8,r/war,public,,0,[],,1649806147.0,,,,
,[],False,,QuietDrives87,,,[],,,,text,t2_1qt5fufx,False,False,how can you tell that he is russian?,99ce9ec01390c523ced1ece35a4c79447558bb2b,True,False,,,,,0,1649834842,,0,{},i4jdpug,False,t3_u2bx2m,False,True,t3_u2bx2m,/r/war/comments/u2bx2m/remains_of_a_dead_russian_soldier_nsfw/i4jdpug/,1649834855,1,True,True,False,war,t5_2qhk8,r/war,public,,0,[],,1649806042.0,,,,
,[],False,,Always_Jerking,,,[],,,,text,t2_csuku9qr,False,False,"haha you are writing from the script? All this arguments are so absurdly stupid - there is just many of them so it makes people don't want to waste their time answering. I will choose one.

&amp;#x200B;

Ethiopia get greatest food help from west from any country in the world. This is why they breed so much. They grow their population multiple time last 100 years. And then with overpopulation war came - but as in Ukraine no external country intervened. It is internal conflict - like civil war in US. No country have right to help. There is no clear white or black side. West still helps with food a lot. Twice as many would die otherwise.",249f8438219acc75015835e1f3cc9a4d8c6c5086,True,False,,,,,0,1649834668,,0,{},i4jdilx,False,t3_u1sots,False,True,t1_i4ijvdv,/r/war/comments/u1sots/if_russia_takes_over_ukraine_then_what_happens/i4jdilx/,1649834681,1,True,True,False,war,t5_2qhk8,r/war,public,,0,[],,1649805868.0,,,,
,[],False,,Xortas,,,[],,,,text,t2_8km2c31t,False,False,"Oh, fertiliser can talk.",93221c7cb48223d7bab34600ffc3bef5b582076b,True,False,,,,,0,1649834557,,0,{},i4jdduq,False,t3_u2be10,False,True,t3_u2be10,/r/war/comments/u2be10/the_russian_response_to_the_ukrainian_isis_style/i4jdduq/,1649834569,1,True,True,False,war,t5_2qhk8,r/war,public,,0,[],,1649805757.0,,,,
,[],False,,Always_Jerking,,,[],,,,text,t2_csuku9qr,False,False,"&gt;"" I could give a fuck about Russia or the ukraine...Fuck them both!!

Yeah ok but most people have any sense of justice and compassion fortunately.

&amp;#x200B;

Iran Yes. And USSR have history of changing people in power because of economy. 2 times in XX century. This are not obedient Korean people.

\&gt;I am against poor people not having food while the rich who the sanctions are aimed at are not affected.

Those poor people support Putin. I understand you are not against one country invading other one(fuck them both) but you are against punishing attacker but not against helping attacked one. 

You are clearly pro-russian.",b3ce24ecde43169a55285d713eaabeb53a086fb4,True,False,,,,,0,1649834394,,0,{},i4jd6rh,False,t3_u1sots,False,True,t1_i4ij9jm,/r/war/comments/u1sots/if_russia_takes_over_ukraine_then_what_happens/i4jd6rh/,1649834404,1,True,True,False,war,t5_2qhk8,r/war,public,,0,[],,1649805594.0,,,,
,[],False,,EWJ_Bear,,,[],,,,text,t2_eg13ljvf,False,False,Bro what,c521904d2db1311a78283c39a35c5d182bdeab74,True,False,,,,,0,1649834341,,0,{},i4jd4j0,False,t3_u18it9,False,True,t1_i4hakh5,/r/war/comments/u18it9/purported_aftermath_of_the_pointblank_tank/i4jd4j0/,1649834352,1,True,True,False,war,t5_2qhk8,r/war,public,,0,[],,1649805541.0,,,,
,[],False,,Allioli1659,,,[],,,,text,t2_kekp154m,False,False,"Patriarchy at it's finest.

Russian society is definitely not a safe place for women.",baba0ddbe6a89650a423a1d36c1cd0cefba96fa2,True,False,,,,,0,1649834337,,0,{},i4jd4dd,False,t3_u2be10,False,True,t3_u2be10,/r/war/comments/u2be10/the_russian_response_to_the_ukrainian_isis_style/i4jd4dd/,1649834352,1,True,True,False,war,t5_2qhk8,r/war,public,,0,[],,1649805537.0,,,,
,[],False,,SnooTomatoes6519,,,[],,,,text,t2_7zwuvj4r,False,False,Hopefully they all die when they get nuked! Delusional fuck up of a country,1a8d7ef499ee68a31b086072161b30b2a4739493,True,False,,,,,0,1649834305,,0,{},i4jd30f,False,t3_u0rctf,False,False,t3_u0rctf,/r/war/comments/u0rctf/residents_of_the_kursk_region_see_off_russian/i4jd30f/,1649834319,1,True,True,False,war,t5_2qhk8,r/war,public,,0,[],,1649805505.0,,,,
,[],False,,EWJ_Bear,,,[],,,,text,t2_eg13ljvf,False,False,"There was one sick fuck who commented, and I quote ""GET FUCKED""",7b8bcaecdb22b62ab244ad5e857a458ea98d4cc9,True,False,,,,,0,1649834299,,0,{},i4jd2qa,False,t3_u18it9,False,True,t1_i4cmd7e,/r/war/comments/u18it9/purported_aftermath_of_the_pointblank_tank/i4jd2qa/,1649834312,1,True,True,False,war,t5_2qhk8,r/war,public,,0,[],,1649805499.0,,,,
,[],False,,EWJ_Bear,,,[],,,,text,t2_eg13ljvf,False,False,"What the fuck is wrong with you? Those guys all had families that worried about them and they were all murdered in cold blood all because of a war they didn't want. Can you imagine how traumatized their wives and kids would be if they saw this video? How fucking heart crushing it would be to be worrying about your daddy everyday and you come across a video of him blown to bits? Imagine that was your father... You disgust me, you fucked up peice of shit. You are a complete scumbag seek help you sick fucking bastard.",407d08a4ba229b387a567ed4b56324a0f1101fc5,True,False,,,,,0,1649834164,,0,{},i4jcwvt,False,t3_u18it9,False,False,t1_i4b6gof,/r/war/comments/u18it9/purported_aftermath_of_the_pointblank_tank/i4jcwvt/,1649834181,1,True,True,False,war,t5_2qhk8,r/war,public,,0,[],,1649805364.0,,,,
,[],False,,Whitechapelkiller,,,[],,,,text,t2_125de9,False,False,"Because in any country printing money doesn't work.

Sovereign debt is how you get more money for your country when you spend more than you get in. 

The only country right now who this arrangement has fucked is Russia.",ffcb95cbdcd065788a2d63e0a4905d9b92dd2d16,True,False,,,,,0,1649833566,,0,{},i4jc6e2,False,t3_u2be10,False,True,t1_i4itpjv,/r/war/comments/u2be10/the_russian_response_to_the_ukrainian_isis_style/i4jc6e2/,1649833581,1,True,True,False,war,t5_2qhk8,r/war,public,,0,[],,1649804766.0,,,,
,[],False,,Icy-Cup,,,[],,,,text,t2_563eqf2y,False,False,Any other source for it? Taken down already.,de1640b69002de60fa2eea2d8a3baeff64369b38,True,False,,,,,0,1649833242,,0,{},i4jbrn1,False,t3_u2be10,False,True,t1_i4hwy7h,/r/war/comments/u2be10/the_russian_response_to_the_ukrainian_isis_style/i4jbrn1/,1649833255,1,True,True,False,war,t5_2qhk8,r/war,public,,0,[],,1649804442.0,,,,
,[],False,,rogue-trowa-barton,,,[],,,,text,t2_7ctol201,False,False,Is there a full version of this???,b06ceb16658fb8c4928d2c8e76c6cfc9842349f7,True,False,,,,,0,1649832699,,0,{},i4jb35q,False,t3_u24wwp,False,True,t3_u24wwp,/r/war/comments/u24wwp/a_new_video_angle_has_emerged_of_the_incident_we/i4jb35q/,1649832712,1,True,True,False,war,t5_2qhk8,r/war,public,,0,[],,1649803899.0,,,,
,[],False,,Aron0415,,,[],,,,text,t2_b813tp48,False,False,"&gt;May god have mercy on our souls

If you're finished being dramatic, here is a [US cartoon](https://www.youtube.com/watch?v=rVtB6afVg9A) from WWII making fun of the enemy. This kind of thing is nothing new. Get over yourself.",d2df7cb3aa4e099bd15f6822c481dcf50fc7700e,True,False,,,,,0,1649832046,,0,{},i4ja8uz,False,t3_u2be10,False,True,t1_i4itvca,/r/war/comments/u2be10/the_russian_response_to_the_ukrainian_isis_style/i4ja8uz/,1649832061,1,True,True,False,war,t5_2qhk8,r/war,public,,0,[],,1649803246.0,,,,
,[],False,,jemo97,,,[],,,,text,t2_3z5dn4r7,False,False,"Taking a closer look at your profile I see you're a russian bot. That makes sense, as they also deny this all happening, just like all of their crimes. Get some help, mentally. Some perscriptions are in order.",f0d3f1f31494c3aaa7adc2f20e00e3f2b7a970cb,True,False,,,,,0,1649831705,,0,{},i4j9t1y,True,t3_u1wad3,False,True,t1_i4ist48,/r/war/comments/u1wad3/bosnian_serbs_in_support_of_russian_genocide/i4j9t1y/,1649831719,1,True,True,False,war,t5_2qhk8,r/war,public,,0,[],,1649802905.0,,,,
,[],False,,jemo97,,,[],,,,text,t2_3z5dn4r7,False,False,"Username checks out. Luckally, it is a crime in Bosnia to deny the Genocide.",ab40a9b753adb7ae8a5ba6577ec2bd9a2bae311b,True,False,,,,,0,1649831478,,0,{},i4j9i7o,True,t3_u1wad3,False,True,t1_i4ist48,/r/war/comments/u1wad3/bosnian_serbs_in_support_of_russian_genocide/i4j9i7o/,1649831491,1,True,True,False,war,t5_2qhk8,r/war,public,,0,[],,1649802678.0,,,,
,[],False,,nostro200,,,[],,,,text,t2_oht6r,False,False,"its easy to let your guard down when you see everyone else doing the same. Soldiers are very much like ""sheep"" in that sense.",7d01900a5f4854e392cb3332bdc32738ad63d0ca,True,False,,,,,0,1649831177,,0,{},i4j9405,False,t3_u25pe5,False,True,t1_i4hzqk9,/r/war/comments/u25pe5/tank_firing_into_a_group_of_ukrainian_soldiers_at/i4j9405/,1649831193,1,True,True,False,war,t5_2qhk8,r/war,public,,0,[],,1649802377.0,,,,
,[],False,,[deleted],,,,,,dark,,,,,[removed],fe993932d6dced4c0a879e9aa5d7a6e0fbb467f5,True,True,,,DELETED,,0,1649830457,,0,{},i4j85m5,False,t3_u2be10,False,True,t3_u2be10,/r/war/comments/u2be10/the_russian_response_to_the_ukrainian_isis_style/i4j85m5/,1649830468,1,True,True,False,war,t5_2qhk8,r/war,public,,0,[],,1649801657.0,,,,
,[],False,,Vasilev88,,,[],,,,text,t2_j4igi5i2,False,False,"How do they deal with the 6,257 nuclear warheads that the ruskies have?",df65c2dffa7788ce1a63d0e771392c2f7095cbe7,True,False,,,,,0,1649830348,,0,{},i4j80cm,False,t3_u1bduu,False,True,t1_i4fpw4u,/r/war/comments/u1bduu/russia_if_sweden_and_finland_join_nato_our_army/i4j80cm/,1649830360,1,True,True,False,war,t5_2qhk8,r/war,public,,0,[],,1649801548.0,,,,
,[],False,,JmBiscuit,,,[],,,,text,t2_a9450fvr,False,False,"What a white night amiright XD they're sucking hard atm against these ""women""",24d38989161f541355974c01ada9edbb7c8d691a,True,False,,,,,0,1649830237,,0,{},i4j7uys,False,t3_u2be10,False,True,t3_u2be10,/r/war/comments/u2be10/the_russian_response_to_the_ukrainian_isis_style/i4j7uys/,1649830252,1,True,True,False,war,t5_2qhk8,r/war,public,,0,[],,1649801437.0,,,,
,[],False,,HenryColt,,,[],,,,text,t2_yn0is,False,False,"The aftermath of the shot was posted here before, right ?",be6e50e52d41bb8a13fe23332ecd0b9867fc908e,True,False,,,,,0,1649830219,,0,{},i4j7u3m,False,t3_u21xmc,False,True,t3_u21xmc,/r/war/comments/u21xmc/bone_chilling_footage_of_a_tank_shooting_at_a/i4j7u3m/,1649830232,1,True,True,False,war,t5_2qhk8,r/war,public,,0,[],,1649801419.0,,,,
,[],False,,TungstenChef,,,[],,,,text,t2_9l6oreuc,False,True,"And yet I don't notice you citing all of the glorious Russian victories, comrade.",00a6aea13cdb438b7e4c168bf045342fafbb724a,True,False,,,,,0,1649830124,,0,{},i4j7pmb,False,t3_u2be10,False,True,t1_i4irjii,/r/war/comments/u2be10/the_russian_response_to_the_ukrainian_isis_style/i4j7pmb/,1649830140,1,True,True,False,war,t5_2qhk8,r/war,public,,0,[],,1649801324.0,,,,
,[],False,,Vasilev88,,,[],,,,text,t2_j4igi5i2,False,False,"Russia is the biggest nuclear power in the world to this day.

What is this fucking propaganda subreddit, honestly. Completely disconnected from certain types of realities.",78c42426b965c9b0c3bf554a71462553256e5f71,True,False,,,,,0,1649830093,,0,{},i4j7o3w,False,t3_u1bduu,False,True,t1_i4fpw4u,/r/war/comments/u1bduu/russia_if_sweden_and_finland_join_nato_our_army/i4j7o3w/,1649830106,1,True,True,False,war,t5_2qhk8,r/war,public,,0,[],,1649801293.0,,,,
,[],False,,TungstenChef,,,[],,,,text,t2_9l6oreuc,False,True,"Maria Zakharova also said that Russia had to invade Ukraine because they wouldn't share their delicious borscht recipe, that's all you need to know about the state of Russian propaganda.",cca4097c74febf2ced18a5d83e6bff212b146390,True,False,,,,,0,1649830087,,0,{},i4j7ns4,False,t3_u2be10,False,True,t1_i4ity7e,/r/war/comments/u2be10/the_russian_response_to_the_ukrainian_isis_style/i4j7ns4/,1649830099,1,True,True,False,war,t5_2qhk8,r/war,public,,0,[],,1649801287.0,,,,
,[],False,,Chatto_1,,,[],,,,text,t2_12up3u,False,False,"You do realise the military doctrine of Russia is simply bomb and terrorize people into submission? I wouldn’t call that a better military doctrine, but it could be efficient… If your army wouldn’t be experience resistance. Because then the Russian army is uncovered as pretty weak, consisting for a majority out of conscripts. And those are just as inexperienced as the Ukrainian conscripts. There is one major difference between the two: Ukrainians are fighting for their lives, their home, for each other: never underestimate a highly motivated army. Will they lose? Perhaps, but not without a fight.",2de8ca3d512ceaa01a669a14a8d36fced3538811,True,False,,,,,0,1649829749,,0,{},i4j76u2,False,t3_u2be10,False,True,t1_i4iiu4c,/r/war/comments/u2be10/the_russian_response_to_the_ukrainian_isis_style/i4j76u2/,1649829767,1,True,True,False,war,t5_2qhk8,r/war,public,,0,[],,1649800949.0,,,,
,[],False,,WoahStepBr0,,,[],,,,text,t2_8i91y6kz,False,False,Rip these brave men,2f25af135f678e017478e99d935b0ca3b053b578,True,False,,,,,0,1649828972,,0,{},i4j6380,False,t3_u25pe5,False,True,t3_u25pe5,/r/war/comments/u25pe5/tank_firing_into_a_group_of_ukrainian_soldiers_at/i4j6380/,1649828987,1,True,True,False,war,t5_2qhk8,r/war,public,,0,[],,1649800172.0,,,,
,[],False,,Dismal_Ability6504,,,[],,,,text,t2_dp1qr0cw,False,False,Same reason a tiger has natural camouflage. Easier to get close without you knowing what it is and whether you should run or not,12cb2bc9afc5f801ab32d5b98bdc3f218db4da3e,True,False,,,,,0,1649827912,,0,{},i4j4ji0,False,t3_u21cow,False,True,t1_i4h5dpk,/r/war/comments/u21cow/pov/i4j4ji0/,1649827928,1,True,True,False,war,t5_2qhk8,r/war,public,,0,[],,1649799112.0,,,,
,[],False,,Texan_Eagle,,,[],,,,text,t2_5ehf366j,False,False,Be nice,5a6d4bbad3572f2f854da4e6f7cc340e8692e789,True,False,,,,,0,1649827855,,0,{},i4j4gg5,False,t3_u297f3,False,True,t1_i4iyyos,/r/war/comments/u297f3/good_news_from_mariupol_a_unit_of_the_36th/i4j4gg5/,1649827866,1,True,True,False,war,t5_2qhk8,r/war,public,,0,[],,1649799055.0,,,,
,[],False,,redscorcher,,,[],,,,text,t2_dl2w6,False,False,You literally just described the Russian military,f58e6dcaa63d62d8eb1f09ce308c5239ff0d3c92,True,False,,,,,0,1649827799,,0,{},i4j4djc,False,t3_u2be10,False,True,t1_i4iiu4c,/r/war/comments/u2be10/the_russian_response_to_the_ukrainian_isis_style/i4j4djc/,1649827811,1,True,True,False,war,t5_2qhk8,r/war,public,,0,[],,1649798999.0,,,,
,[],False,,red_beered,,,[],,,,text,t2_87kdl,False,False,"Read up on the child soldiers of the DRC, they carry fully loaded AK’s, multiple magazines, and with ammo belts around their necks, all while hiking for days on end in the jungle.",6c2368862969515274843588286b0274ec5df881,True,False,,,,,0,1649827599,,0,{},i4j430i,False,t3_u20253,False,True,t1_i4ghc55,/r/war/comments/u20253/ukrainian_tough_check_point_with_the_key_word/i4j430i/,1649827612,1,True,True,False,war,t5_2qhk8,r/war,public,,0,[],,1649798799.0,,,,
,[],False,,Cats_Though,,,[],,,,text,t2_aslbgo18,False,False,The US will have to find somewhere else to start a proxy war.,b438d7c7a89a27cf4bd4c3159e21208d490f4f0b,True,False,,,,,0,1649827443,,0,{},i4j3uov,False,t3_u1sots,False,True,t3_u1sots,/r/war/comments/u1sots/if_russia_takes_over_ukraine_then_what_happens/i4j3uov/,1649827454,1,True,True,False,war,t5_2qhk8,r/war,public,,0,[],,1649798643.0,,,,
,[],False,,[deleted],,,,,,dark,,,,,[removed],fe993932d6dced4c0a879e9aa5d7a6e0fbb467f5,True,True,,,DELETED,,0,1649827411,,0,{},i4j3t13,False,t3_u297f3,False,True,t1_i4iyyos,/r/war/comments/u297f3/good_news_from_mariupol_a_unit_of_the_36th/i4j3t13/,1649827427,1,True,True,False,war,t5_2qhk8,r/war,public,,0,[],,1649798611.0,,,,
,[],False,,Cats_Though,,,[],,,,text,t2_aslbgo18,False,False,"This is truly horrifying.  
Hitler Youth shit.",3cb1d17c549420240e4a67b6be29f13b66ca272f,True,False,,,,,0,1649827226,,0,{},i4j3j4h,False,t3_u20253,False,True,t3_u20253,/r/war/comments/u20253/ukrainian_tough_check_point_with_the_key_word/i4j3j4h/,1649827237,1,True,True,False,war,t5_2qhk8,r/war,public,,0,[],,1649798426.0,,,,
,[],False,,Guilty_Difference_20,,,[],,,,text,t2_a0oclrzy,False,False,"I think is the fake protection that you feel in a group, you think that if something dangerous come up the other will notice so you are relaxed, but all the people have the same feeling.",bf012a23859012151dd1274fed288001a92bdab9,True,False,,,,,0,1649826987,,0,{},i4j35vv,False,t3_u24wwp,False,True,t3_u24wwp,/r/war/comments/u24wwp/a_new_video_angle_has_emerged_of_the_incident_we/i4j35vv/,1649827002,1,True,True,False,war,t5_2qhk8,r/war,public,,0,[],,1649798187.0,,,,
,[],False,,Cats_Though,,,[],,,,text,t2_aslbgo18,False,False,"Interesting animated graphic of American imperial terror.  
Especially how the flow of arms to Southeast and East Asia never slows down.",84192049d1a48b4ba2860201cc6595fb34897213,True,False,,,,,0,1649826845,,0,{},i4j2y40,False,t3_8zcav7,False,True,t3_8zcav7,/r/war/comments/8zcav7/the_united_states_of_arms_american_weapons/i4j2y40/,1649826862,1,True,True,False,war,t5_2qhk8,r/war,public,,0,[],,1649798045.0,,,,
,[],False,,Rich_Lock_3167,,,[],,,,text,t2_k3ttf6ry,False,False,The children inside the van miraculously survived. I seen this video on youtube documented by Julian Assange and deleted after 2 days,cc91cf17882a641d24b0a90f6c21973da7915442,True,False,,,,,0,1649826521,,0,{},i4j2g90,False,t3_u01alr,False,True,t3_u01alr,/r/war/comments/u01alr/us_apache_killing_2_journalists_and_insurgents/i4j2g90/,1649826535,1,True,True,False,war,t5_2qhk8,r/war,public,,0,[],,1649797721.0,,,,
,[],False,,No-Bookkeeper-5377,,,[],,,,text,t2_55oghyae,False,False,Yea sure bud,a76ce99b35fa416790a501ae8534e0f8f2445173,True,False,,,,,0,1649826401,,0,{},i4j29gr,False,t3_u2be10,False,False,t1_i4itpjv,/r/war/comments/u2be10/the_russian_response_to_the_ukrainian_isis_style/i4j29gr/,1649826418,1,True,True,False,war,t5_2qhk8,r/war,public,,0,[],,1649797601.0,,,,
,[],False,,Diligent_Swing9052,,,[],,,,text,t2_k63xo70q,False,False,Fuck Russia 😆 😆 😆 😆,07daf440d63a97e0496ece48de3634747a4ab26a,True,True,,,,,0,1649826153,,0,{},i4j1v6c,False,t3_u2be10,False,True,t3_u2be10,/r/war/comments/u2be10/the_russian_response_to_the_ukrainian_isis_style/i4j1v6c/,1649826170,1,True,True,False,war,t5_2qhk8,r/war,public,,0,[],,1649797353.0,,,,
,[],False,,Imactuallyadogg,,,[],,,,text,t2_emuxho1a,False,False,"Yeah, it's a neurotoxin. That's why their legs probably don't work. They are lucky their lungs didn't get destroyed.",f198efb5a34eb62acb3c0d7b54eb25bdcb15e123,True,False,,,,,0,1649826036,,0,{},i4j1of0,False,t3_u28byi,False,False,t3_u28byi,/r/war/comments/u28byi/as_a_result_of_chemical_attack_by_russian_forces/i4j1of0/,1649826052,1,True,True,False,war,t5_2qhk8,r/war,public,,0,[],,1649797236.0,,,,
,[],False,,[deleted],,,,,,dark,,,,,[removed],fe993932d6dced4c0a879e9aa5d7a6e0fbb467f5,True,True,,,DELETED,,0,1649825587,,0,{},i4j0y3y,False,t3_u20253,False,True,t1_i4hlee5,/r/war/comments/u20253/ukrainian_tough_check_point_with_the_key_word/i4j0y3y/,1649825605,1,True,True,False,war,t5_2qhk8,r/war,public,,0,[],,1649796787.0,,,,
,[],False,,heezyjos,,,[],,,,text,t2_an5xi72,False,False,We are all def fucked,08da989aaab5a73a5fd6b829dd1138627ae44ecd,True,False,,,,,0,1649825269,,0,{},i4j0er9,False,t3_u1sots,False,True,t3_u1sots,/r/war/comments/u1sots/if_russia_takes_over_ukraine_then_what_happens/i4j0er9/,1649825280,1,True,True,False,war,t5_2qhk8,r/war,public,,0,[],,1649796469.0,,,,
,[],False,,Lexotan91,,,[],,,,text,t2_swl0x,False,False,I really hope they kill him slowly,ef84d6508aa4c5e76711f752ddc05a3b5d9eb9c5,True,False,,,,,0,1649824910,,0,{},i4izs90,False,t3_tx3xte,False,True,t3_tx3xte,/r/war/comments/tx3xte/captured_russian_bomber_known_for_killing_a_lot/i4izs90/,1649824923,1,True,True,False,war,t5_2qhk8,r/war,public,,0,[],,1649796110.0,,,,
,[],False,,lizardswithguns,,,[],,,,text,t2_hliol2mv,False,False,Nah it's an air soft replica,76fd380f806d9b8719b77ebcc700c0108c2de715,True,False,,,,,0,1649824686,,0,{},i4izdub,False,t3_u20253,False,True,t1_i4icjmh,/r/war/comments/u20253/ukrainian_tough_check_point_with_the_key_word/i4izdub/,1649824702,1,True,True,False,war,t5_2qhk8,r/war,public,,0,[],,1649795886.0,,,,
,[],False,,PrincessViper69,,,[],,,,text,t2_8q1ut74q,False,False,yeah how US falsify its casus beli so they can wage war and the defense industry will profit from it. like how you are doing it now in ukraine?,c8d2ebcc70f4ff3a58034ea8449583dcee495d58,True,False,,,,,0,1649824605,,0,{},i4iz8p2,False,t3_skdiy4,False,True,t1_hvrh7u0,/r/war/comments/skdiy4/us_marines_assault_iraqi_republican_guard/i4iz8p2/,1649824616,1,True,True,False,war,t5_2qhk8,r/war,public,,0,[],,1649795805.0,,,,
,[],False,,AdComprehensive2981,,,[],,,,text,t2_cxz3rpcn,False,False,You go fuck yourself,c93210cadd5001443c86e6ac3329d6cfcc59c07e,True,False,,,,,0,1649824556,,0,{},i4iz5ll,False,t3_u1tl8b,False,False,t1_i4gg1da,/r/war/comments/u1tl8b/putins_spokesman_and_why_world_dont_believe/i4iz5ll/,1649824567,1,True,True,False,war,t5_2qhk8,r/war,public,,0,[],,1649795756.0,,,,
,[],False,,[deleted],,,,,,dark,,,,,[removed],fe993932d6dced4c0a879e9aa5d7a6e0fbb467f5,True,True,,,DELETED,,0,1649824465,,0,{},i4iyzk8,False,t3_u1sots,False,True,t3_u1sots,/r/war/comments/u1sots/if_russia_takes_over_ukraine_then_what_happens/i4iyzk8/,1649824480,1,True,True,False,war,t5_2qhk8,r/war,public,,0,[],,1649795665.0,,,,
,[],False,,AdComprehensive2981,,,[],,,,text,t2_cxz3rpcn,False,False,"Hmm Which dumb ass thought this was a good idea?
Bro you literally have to be brain dead to do this is literally a one way journey 😂",c75d2e3f6980bec44fa863a043ca334df22788a7,True,False,,,,,0,1649824452,,0,{},i4iyyos,False,t3_u297f3,False,True,t3_u297f3,/r/war/comments/u297f3/good_news_from_mariupol_a_unit_of_the_36th/i4iyyos/,1649824466,1,True,True,False,war,t5_2qhk8,r/war,public,,0,[],,1649795652.0,,,,
,[],False,,[deleted],,,,,,dark,,,,,[removed],fe993932d6dced4c0a879e9aa5d7a6e0fbb467f5,True,True,,,DELETED,,0,1649824158,,0,{},i4iyf9h,False,t3_tzc5z5,False,True,t1_i42hqkz,/r/war/comments/tzc5z5/cruel_detention_of_either_russian_sympathizers_or/i4iyf9h/,1649824168,1,True,True,False,war,t5_2qhk8,r/war,public,,0,[],,1649795358.0,,,,
,[],False,,Tasty-Yesterday-4061,,,[],,,,text,t2_8rufb36u,False,False,Google what they have done to Azerbaijan on 20 January 1991 and 26 February 1992 and you will understand why azerbaijanis are fighting them there!,830cfb59d3b3ae1e589ff7dcdbaad50a8a5bdba4,True,False,,,,,0,1649824031,,0,{},i4iy70x,False,t3_u0resj,False,True,t3_u0resj,/r/war/comments/u0resj/georgian_volunteer_fighter_part_of_the_ukrainian/i4iy70x/,1649824046,1,True,True,False,war,t5_2qhk8,r/war,public,,0,[],,1649795231.0,,,,
