Unnamed: 0,all_awardings,archived,associated_award,author,author_flair_background_color,author_flair_css_class,author_flair_richtext,author_flair_template_id,author_flair_text,author_flair_text_color,author_flair_type,author_fullname,author_patreon_flair,author_premium,body,body_sha1,can_gild,collapsed,collapsed_because_crowd_control,collapsed_reason,collapsed_reason_code,comment_type,controversiality,created_utc,distinguished,gilded,gildings,id,is_submitter,link_id,locked,no_follow,parent_id,permalink,retrieved_utc,score,score_hidden,send_replies,stickied,subreddit,subreddit_id,subreddit_name_prefixed,subreddit_type,top_awarded_type,total_awards_received,treatment_tags,unrepliable_reason,created,author_cakeday,edited,editable,media_metadata
,[],False,,Quiet-Repeat-8058,,,[],,,,text,t2_9diihiy2,False,False,"The Russians were happy to send countless women to fight in the frontlines.
Now they are like ""be ashamed to send women to fight for you"".

You know who didn't send women to fight , clearly because they were the aggressor? The Nazis, isn't this funny? 

I hope a woman will shoot these assholes in the d*ck soon!",70503b6eb3b1a5ba8a28f5b8b41d9ff0d043d7b4,True,False,,,,,0,1649879694,,0,{},i4lwrdz,False,t3_u2be10,False,True,t3_u2be10,/r/war/comments/u2be10/the_russian_response_to_the_ukrainian_isis_style/i4lwrdz/,1649879705,1,True,True,False,war,t5_2qhk8,r/war,public,,0,[],,1649850894.0,,,,
,[],False,,_oldcook_,,,[],,,,text,t2_l9niw7fp,False,False,Then why so angry?,ded93769b44251740a13d8aa67d0ae9ddc3a4f9a,True,False,,,,,0,1649879624,,0,{},i4lwld2,False,t3_u2lwr9,False,True,t1_i4lsrk3,/r/war/comments/u2lwr9/allahu_akbar_yes_these_are_russians/i4lwld2/,1649879636,1,True,True,False,war,t5_2qhk8,r/war,public,,0,[],,1649850824.0,,,,
,[],False,,QuietDrives87,,,[],,,,text,t2_1qt5fufx,False,False,got links of these official third party investigations?,94a2c0f9a359d331510bb609885de7ad4a4579ec,True,False,,,,,0,1649879623,,0,{},i4lwlan,False,t3_u20253,False,True,t1_i4lslp3,/r/war/comments/u20253/ukrainian_tough_check_point_with_the_key_word/i4lwlan/,1649879636,1,True,True,False,war,t5_2qhk8,r/war,public,,0,[],,1649850823.0,,,,
,[],False,,Boonaki,,,[],,,,text,t2_8kj4t,False,False,"You mean to Ukraine l?

You say the U.S. is going to supply the US.",9804dbc193bc70408fced2d8551c4051b6ddc1e7,True,False,,,,,0,1649879522,moderator,0,{},i4lwc3j,False,t3_u2xlf9,False,True,t3_u2xlf9,/r/war/comments/u2xlf9/us_to_supply_helicopters_and_artillery_to_the_us/i4lwc3j/,1649879539,1,True,True,True,war,t5_2qhk8,r/war,public,,0,[],,1649850722.0,,,,
,[],False,,ilrasso,,,[],,,,text,t2_5offi,False,False,But then you have to deal with all the issues that comes with nuclear. The ability to hide for a long time may not be so strategically important to AUS.,f80fc3a0057ec5b0ea63163acd2da0ef9057621c,True,False,,,,,0,1649879285,,0,{},i4lvpx5,False,t3_u2uw4b,False,True,t1_i4ljwp5,/r/war/comments/u2uw4b/jaukus/i4lvpx5/,1649879299,1,True,True,False,war,t5_2qhk8,r/war,public,,0,[],,1649850485.0,,,,
,[],False,,Cats_Though,,,[],,,,text,t2_aslbgo18,False,False,"Either Russia is losing and Ukrainian victory is imminent, or Ukraine desperately needs materiel. It's really one or the other.",3dc23ef6dcb6e7588e5c876254bc392611945724,True,True,,,,,0,1649879231,,0,{},i4lvkxn,False,t3_u2sl1u,False,True,t3_u2sl1u,/r/war/comments/u2sl1u/freedom_must_be_better_armed_than_tyranny/i4lvkxn/,1649879246,1,True,True,False,war,t5_2qhk8,r/war,public,,0,[],,1649850431.0,,,,
,[],False,,[deleted],,,,,,dark,,,,,[removed],fe993932d6dced4c0a879e9aa5d7a6e0fbb467f5,True,True,,,DELETED,,0,1649879126,,0,{},i4lvb9h,False,t3_u2lif4,False,True,t3_u2lif4,/r/war/comments/u2lif4/russian_army_convoy_ambushed_by_the_ukrainian/i4lvb9h/,1649879142,1,True,True,False,war,t5_2qhk8,r/war,public,,0,[],,1649850326.0,,,,
,[],False,,NotTakingTheShot,,,[],,,,text,t2_d8oudthg,False,False,"Ok, so the russians leave for russia.  
Situation de-escalated. Happy?",c899842ed2b420771649fa03bf1819db27b3e7dc,True,False,,,,,0,1649879093,,0,{},i4lv84r,False,t3_u2eql0,False,True,t1_i4l8f33,/r/war/comments/u2eql0/descalation_now/i4lv84r/,1649879111,1,True,True,False,war,t5_2qhk8,r/war,public,,0,[],,1649850293.0,,,,
,[],False,,[deleted],,,,,,dark,,,,,[removed],fe993932d6dced4c0a879e9aa5d7a6e0fbb467f5,True,True,,,DELETED,,0,1649879037,,0,{},i4lv2xh,False,t3_u2vden,False,True,t3_u2vden,/r/war/comments/u2vden/russian_soldiers_dug_trenches_in_red_forest_the/i4lv2xh/,1649879049,1,True,True,False,war,t5_2qhk8,r/war,public,,0,[],,1649850237.0,,,,
,[],False,,hAZE2005,,,[],,,,text,t2_2vq0wge,False,False,Unofficial?,33f41da4e9ac854af77fc8d1f5adba4dd4630fc9,True,False,,,,,0,1649878885,,0,{},i4luorj,False,t3_u2uw4b,False,True,t3_u2uw4b,/r/war/comments/u2uw4b/jaukus/i4luorj/,1649878897,1,True,True,False,war,t5_2qhk8,r/war,public,,0,[],,1649850085.0,,,,
,[],False,,awesomesauceitch,,,[],,,,text,t2_10bdgf,False,False,"I'm guessing you didn't see the POV video yet.  Those guys were looking at the oncoming tank when it was 1/4 mile away.  They even said in the video ""I hope he doesn't shoot"".",a30562f622927ca5d841cd9f20cc742d056915e5,True,False,,,,,0,1649878827,,0,{},i4lujbs,False,t3_u21xmc,False,True,t1_i4l5w5h,/r/war/comments/u21xmc/bone_chilling_footage_of_a_tank_shooting_at_a/i4lujbs/,1649878842,1,True,True,False,war,t5_2qhk8,r/war,public,,0,[],,1649850027.0,,,,
,[],False,,Space_Wombat11,,,[],,,,text,t2_c0s0brne,False,False,Natural selection at its finest,4c00b636ed7a5343a2d068a6ee70150a22e7886e,True,False,,,,,0,1649878711,,0,{},i4lu8gk,False,t3_u2vden,False,True,t3_u2vden,/r/war/comments/u2vden/russian_soldiers_dug_trenches_in_red_forest_the/i4lu8gk/,1649878722,1,True,True,False,war,t5_2qhk8,r/war,public,,0,[],,1649849911.0,,,,
,[],False,,Compoundwyrds,,,[],,,,text,t2_a6e7g,False,False,China is going to have an aneurism.,55ab26f8c2a67ca5bd254a6bec958087c4f52241,True,False,,,,,0,1649878668,,0,{},i4lu4l8,False,t3_u2uw4b,False,True,t3_u2uw4b,/r/war/comments/u2uw4b/jaukus/i4lu4l8/,1649878685,1,True,True,False,war,t5_2qhk8,r/war,public,,0,[],,1649849868.0,,,,
,[],False,,llopplloo,,,[],,,,text,t2_5tw6jt7o,False,False,"cant be, you can hear a second shot 😂",ced31268feedfed1790ff37ea1c766564c290e07,True,False,,,,,0,1649878401,,0,{},i4ltghc,False,t3_u0uv3h,False,True,t1_i49p541,/r/war/comments/u0uv3h/ukrainian_soldiers_allegedly_mistake_russian_tank/i4ltghc/,1649878416,1,True,True,False,war,t5_2qhk8,r/war,public,,0,[],,1649849601.0,,,,
,[],False,,ragepaperbonsai,,,[],,,,text,t2_1jy79rxp,False,False,"""Freedom must be armed more than tyranny""... Its like from Orwell",56e5b508d943e9a68098b43a06faf66e26478438,True,False,,,,,0,1649878370,,0,{},i4ltdn1,False,t3_u2sl1u,False,True,t3_u2sl1u,/r/war/comments/u2sl1u/freedom_must_be_better_armed_than_tyranny/i4ltdn1/,1649878387,1,True,True,False,war,t5_2qhk8,r/war,public,,0,[],,1649849570.0,,,,
,[],False,,JaneJaneson1,,,[],,,,text,t2_4cpioxvl,False,False,"Nordic heads of state are mostly women. Makes you think have the are so rich, peaceful and prosperous.... 🤔",c5e9d3bbb9b0ca52d7054d72b07c682d00952038,True,False,,,,,0,1649878267,,0,{},i4lt4kg,True,t3_u2vz0m,False,True,t1_i4lkojb,/r/war/comments/u2vz0m/finland_will_launch_an_immediate_debate_on/i4lt4kg/,1649878283,1,True,True,False,war,t5_2qhk8,r/war,public,,0,[],,1649849467.0,,,,
,[],False,,JournalistBright109,,,[],,,,text,t2_79mv4tgk,False,False,Don’t buy what? It’s an Islamic war cry. I just explained why they say it. Do your own fucking research if you don’t think I’m right I don’t give a single fuck.,a7f40e3f9e3e59636d9b4f72592a02faa2d55bc3,True,False,,,,,0,1649878121,,0,{},i4lsrk3,False,t3_u2lwr9,False,True,t1_i4ls36l,/r/war/comments/u2lwr9/allahu_akbar_yes_these_are_russians/i4lsrk3/,1649878134,1,True,True,False,war,t5_2qhk8,r/war,public,,0,[],,1649849321.0,,,,
,[],False,,SpaceCowboy73,,,[],,,,text,t2_91id9,False,False,"I was going to point out that SEATO exists, only to realize it dissolved in 1977.",45d268b16d13fa382f909c5edb3bf78c13b1e3c1,True,False,,,,,0,1649878103,,0,{},i4lsq08,False,t3_u2uw4b,False,True,t1_i4les47,/r/war/comments/u2uw4b/jaukus/i4lsq08/,1649878120,1,True,True,False,war,t5_2qhk8,r/war,public,,0,[],,1649849303.0,,,,
,[],False,,ragepaperbonsai,,,[],,,,text,t2_1jy79rxp,False,False,Army of ghouls,079d68da81e86575874c77d91f43d73df75dc3ac,True,False,,,,,0,1649878078,,0,{},i4lsnu3,False,t3_u2vden,False,True,t3_u2vden,/r/war/comments/u2vden/russian_soldiers_dug_trenches_in_red_forest_the/i4lsnu3/,1649878097,1,True,True,False,war,t5_2qhk8,r/war,public,,0,[],,1649849278.0,,,,
,[],False,,[deleted],,,,,,dark,,,,,[removed],fe993932d6dced4c0a879e9aa5d7a6e0fbb467f5,True,True,,,DELETED,,0,1649878055,,0,{},i4lslp3,False,t3_u20253,False,True,t1_i4l6tan,/r/war/comments/u20253/ukrainian_tough_check_point_with_the_key_word/i4lslp3/,1649878066,1,True,True,False,war,t5_2qhk8,r/war,public,,0,[],,1649849255.0,,,,
,[],False,,irespectcookies,,,[],,,,text,t2_i1fyqfwq,False,False,"Why not just take Japan into nato as well?

Cant be bad to have the entire Axis on your site.",3ef500d609759c1496c5d13e17e7efe24debc75d,True,False,,,,,0,1649877851,,0,{},i4ls3xe,False,t3_u2uw4b,False,True,t3_u2uw4b,/r/war/comments/u2uw4b/jaukus/i4ls3xe/,1649877865,1,True,True,False,war,t5_2qhk8,r/war,public,,0,[],,1649849051.0,,,,
,[],False,,_oldcook_,,,[],,,,text,t2_l9niw7fp,False,False,I don't buy that. Religion is evil and Islam teaches its ok to kill.,c8544b8e945aeff40e0e5b7b1e7ddf00b3cc449d,True,False,,,,,0,1649877842,,0,{},i4ls36l,False,t3_u2lwr9,False,True,t1_i4lqnhr,/r/war/comments/u2lwr9/allahu_akbar_yes_these_are_russians/i4ls36l/,1649877859,1,True,True,False,war,t5_2qhk8,r/war,public,,0,[],,1649849042.0,,,,
,[],False,,_oldcook_,,,[],,,,text,t2_l9niw7fp,False,False,So you think that russia will win and that Ukrainians need to be paid to fight..... Interesting take I guess,85252ec9fed7b2fc9ad4ba4508cfb15c6ecb8d16,True,False,,,,,0,1649877710,,0,{},i4lrrwy,False,t3_u0gr74,False,True,t1_i4lh4zd,/r/war/comments/u0gr74/50_usd_a_good_wage_for_killing_civilians/i4lrrwy/,1649877728,1,True,True,False,war,t5_2qhk8,r/war,public,,0,[],,1649848910.0,,,,
,[],False,,tortillaturban,,,[],,,,text,t2_66wvmpvm,False,False,Getting real 1914 vibes these days,5c4263275ddbc6c9b258f4364168ff54a7e3ef0f,True,False,,,,,0,1649877710,,0,{},i4lrrx8,False,t3_u2uw4b,False,True,t3_u2uw4b,/r/war/comments/u2uw4b/jaukus/i4lrrx8/,1649877728,1,True,True,False,war,t5_2qhk8,r/war,public,,0,[],,1649848910.0,,,,
,[],False,,Substantial_Buy945,,,[],,,,text,t2_kg75fb4e,False,False,So with an N. NAUKUS.,4e27ed32c8b5e2486f837c3378432303ce8a5a44,True,False,,,,,0,1649877647,,0,{},i4lrmsi,False,t3_u2uw4b,False,True,t1_i4lqtpo,/r/war/comments/u2uw4b/jaukus/i4lrmsi/,1649877661,1,True,True,False,war,t5_2qhk8,r/war,public,,0,[],,1649848847.0,,,,
,[],False,,[deleted],,,,,,dark,,,,,[removed],fe993932d6dced4c0a879e9aa5d7a6e0fbb467f5,True,True,,,DELETED,,0,1649877531,,0,{},i4lre50,False,t3_u2be10,False,True,t1_i4k5f6l,/r/war/comments/u2be10/the_russian_response_to_the_ukrainian_isis_style/i4lre50/,1649877545,1,True,True,False,war,t5_2qhk8,r/war,public,,0,[],,1649848731.0,,,,
,[],False,,GoHuskies1984,,,[],,,,text,t2_ws28o,False,False,"Diesel = Cheaper, doesn’t require extensive upgrade to infrastructure or the issues with disposal as the subs age out of service. 

I though AUS did end up picking to be a part of the next gen nuclear attach sub program but maybe things changed again.

Personally I’d rather see AUS go nuclear as diesels will be limited in ability to participate in more distant Pacific conflict zones, some of a diesels subs endurance will be wasted getting too a conflict zone. Also in any slow buildup situation even the most efficient diesels will need refueling every few weeks. Every surface refueling or supply transfer is a chance for hostile intelligence to tag the sub and work out a patrol area.",1a561c9a3b22357a134be5ad63213efb9c335c89,True,False,,,,,0,1649877489,,0,{},i4lrb07,False,t3_u2uw4b,False,True,t1_i4ljwp5,/r/war/comments/u2uw4b/jaukus/i4lrb07/,1649877502,1,True,True,False,war,t5_2qhk8,r/war,public,,0,[],,1649848689.0,,,,
,[],False,,PopeWalrus,,,[],,,,text,t2_2krhlbbi,False,False,"But that's stupid. The other way you can pronounce it as ""jackass""",d13474061bd709fb0e8cec2ff0841e6b85bfff00,True,False,,,,,0,1649877281,,0,{},i4lqtpo,False,t3_u2uw4b,False,True,t1_i4lf632,/r/war/comments/u2uw4b/jaukus/i4lqtpo/,1649877300,1,True,True,False,war,t5_2qhk8,r/war,public,,0,[],,1649848481.0,,,,
,[],False,,JournalistBright109,,,[],,,,text,t2_79mv4tgk,False,False,It’s less of a god thing and more of war cry. It’s just that Islam is embedded into their identities that they shout that phrase even in situations that doesn’t involve their god.,9a6b224e30448495b6fbcfaab211f82c32297e29,True,False,,,,,0,1649877214,,0,{},i4lqnhr,False,t3_u2lwr9,False,True,t1_i4lhuwp,/r/war/comments/u2lwr9/allahu_akbar_yes_these_are_russians/i4lqnhr/,1649877225,1,True,True,False,war,t5_2qhk8,r/war,public,,0,[],,1649848414.0,,,,
,[],False,,royal_asshole,,,[],,,,text,t2_1v2luvdd,False,False,Could also be a clip made on a teenagers computer. It's so easy to do these things today. I don't trust any pictures / clips out there.,98be368498bd8d2ec1912de178c560d432defff8,True,False,,,,,0,1649877208,,0,{},i4lqmy8,False,t3_u25pe5,False,True,t1_i4kid8x,/r/war/comments/u25pe5/tank_firing_into_a_group_of_ukrainian_soldiers_at/i4lqmy8/,1649877226,1,True,True,False,war,t5_2qhk8,r/war,public,,0,[],,1649848408.0,,,,
,[],False,,Pocketfists,,,[],,,,text,t2_chuy3mqo,False,True,"Not immediately, in time…..",5c8540f9120bfee8d7277245df3e9398ad1ad125,True,False,,,,,0,1649877166,,0,{},i4lqj2v,False,t3_u2vl0l,False,True,t1_i4lq47o,/r/war/comments/u2vl0l/in_the_best_traditions_of_totalitarian_regimes_in/i4lqj2v/,1649877179,1,True,True,False,war,t5_2qhk8,r/war,public,,0,[],,1649848366.0,,,,
,[],False,,JournalistBright109,,,[],,,,text,t2_79mv4tgk,False,False,"Ah yes the tic tok brigade that shoots at empty buildings and street lights. Of course, when the cameras are off, they do seem to love to torture rape and murder innocent people. A lot of the Bucha survivors said they were attacked by Chechens as well as Russians. One guy recounted that some of the Russians acted normal, like they didn’t want to participate in what the other guys were doing, then other Russians plus the Chechens started acting like savages and that’s when the massacre started.",5bcaf96cb450e60e6f5ff5593094f7c044a60a48,True,False,,,,,0,1649877096,,0,{},i4lqcjw,False,t3_u2lwr9,False,True,t3_u2lwr9,/r/war/comments/u2lwr9/allahu_akbar_yes_these_are_russians/i4lqcjw/,1649877111,1,True,True,False,war,t5_2qhk8,r/war,public,,0,[],,1649848296.0,,,,
,[],False,,Quarter13,,,[],,,,text,t2_4xf66h26,False,False,So... They're not executed for refusing to fight?,e41b32f59843bc638429897fef8b26e6d587bc48,True,False,,,,,0,1649877007,,0,{},i4lq47o,False,t3_u2vl0l,False,False,t1_i4ljdzs,/r/war/comments/u2vl0l/in_the_best_traditions_of_totalitarian_regimes_in/i4lq47o/,1649877020,1,True,True,False,war,t5_2qhk8,r/war,public,,0,[],,1649848207.0,,,,
,[],False,,Used-Skill6748,,,[],,,,text,t2_gapa7h08,False,False,U/sacevideo,9c076592d87eca6def431f4dcac1b8b1a3affc1d,True,False,,,,,0,1649876846,,0,{},i4lppff,False,t3_u21cow,False,True,t3_u21cow,/r/war/comments/u21cow/pov/i4lppff/,1649876863,1,True,True,False,war,t5_2qhk8,r/war,public,,0,[],,1649848046.0,,,,
,[],False,,_Mean_Machine_,,,[],,,,text,t2_1uqemzqx,False,False, u/savevideo,85987bab35a7d3323d4e4a5931417203b8f719fd,True,False,,,,,0,1649876602,,0,{},i4lp392,False,t3_u2mzqs,False,True,t3_u2mzqs,/r/war/comments/u2mzqs/inspection_of_captured_ukrainian_soldiers_from/i4lp392/,1649876660,1,True,True,False,war,t5_2qhk8,r/war,public,,0,[],,1649847802.0,,,,
,[],False,,benne236,,,[],,,,text,t2_4tynm7ta,False,False,"I should have said “Working Radios”. When Russia invaded Georgia they used their personnel cell phones for communications.  In Georgia they have been stealing cell phones from the local population in order to communicate so they have a huge coms problem.  

This invasion has been really horrible but it has highlighted so many weaknesses of the Russian “Army”",54a37d362e92e5ea8c26c9e338d96ea2c81797f6,True,False,,,,,0,1649876579,,0,{},i4lp15q,False,t3_u2uw4b,False,True,t1_i4locgb,/r/war/comments/u2uw4b/jaukus/i4lp15q/,1649876593,1,True,True,False,war,t5_2qhk8,r/war,public,,0,[],,1649847779.0,,,,
,[],False,,[deleted],,,,,,dark,,,,,[removed],fe993932d6dced4c0a879e9aa5d7a6e0fbb467f5,True,True,,,DELETED,,0,1649876442,,0,{},i4loohx,False,t3_u2be10,False,True,t1_i4kfnht,/r/war/comments/u2be10/the_russian_response_to_the_ukrainian_isis_style/i4loohx/,1649876457,1,True,True,False,war,t5_2qhk8,r/war,public,,0,[],,1649847642.0,,,,
,[],False,,HorrorPilot1506,,,[],,,,text,t2_lhbjrtwt,False,False,Ukraine always blue sign on arm. Russia white sign or V Z sign at vehicles,b9c181a9bb25f90a9d55df5b481c39fd861181b0,True,False,,,,,0,1649876434,,0,{},i4lonsz,False,t3_u21cow,False,True,t1_i4jsj8g,/r/war/comments/u21cow/pov/i4lonsz/,1649876449,1,True,True,False,war,t5_2qhk8,r/war,public,,0,[],,1649847634.0,,,,
,[],False,,ilrasso,,,[],,,,text,t2_5offi,False,False,Ouch. Mercury is not the best toy.,185e43a398afc7df40b082251020839414a9701b,True,False,,,,,0,1649876322,,0,{},i4lodh7,False,t3_u20253,False,True,t1_i4l8l1a,/r/war/comments/u20253/ukrainian_tough_check_point_with_the_key_word/i4lodh7/,1649876337,1,True,True,False,war,t5_2qhk8,r/war,public,,0,[],,1649847522.0,,,,
,[],False,,anonymoususername100,,,[],,,,text,t2_j5dog92s,False,False,"Russia definitely uses radios...  As for diesel subs, in general submarines have a pretty long lifespan.  Nuclear subs are superior but also waaay more expensive to engineer and build.  Australia didn't want to build their own, they wanted to buy or lease them.  France offered their diesel subs and the deal was almost done.  The US caught wind and essentially was like, ""Australia, you're not seriously gonna buy that shit are you!?  Here bro we got the good shit"", and now Australia is getting them from the US.  France was not pleased.",c7afd07d4dbf0755bbd527411cf4639dba541f8a,True,False,,,,,0,1649876311,,0,{},i4locgb,False,t3_u2uw4b,False,True,t1_i4llle9,/r/war/comments/u2uw4b/jaukus/i4locgb/,1649876329,1,True,True,False,war,t5_2qhk8,r/war,public,,0,[],,1649847511.0,,,,
,[],False,,Sell_Groundbreaking,,,[],,,,text,t2_7dfc0roo,False,False,Right!! I need to get my hands on one.,4f133402fd07039d23c18c95596995deb8b226bc,True,False,,,,,0,1649876294,,0,{},i4loavi,False,t3_u1z1mo,False,True,t1_i4g29ia,/r/war/comments/u1z1mo/in_dnipro_the_first_ukrainian_post_stamp_of/i4loavi/,1649876306,1,True,True,False,war,t5_2qhk8,r/war,public,,0,[],,1649847494.0,,,,
,[],False,,gsrmn,,,[],,,,text,t2_8m8qg,False,True,Its a good thing Russian equipment is garbage.,d22410a32904cee9c575aacb07acbab5ade4b9a8,True,False,,,,,0,1649876264,,0,{},i4lo837,False,t3_u16l3r,False,True,t3_u16l3r,/r/war/comments/u16l3r/kharkiv_ukraine_russian_rocket_stuck_in_the/i4lo837/,1649876276,1,True,True,False,war,t5_2qhk8,r/war,public,,0,[],,1649847464.0,,,,
,[],False,,[deleted],,,,,,dark,,,,,[removed],fe993932d6dced4c0a879e9aa5d7a6e0fbb467f5,True,True,,,DELETED,,0,1649876232,,0,{},i4lo577,False,t3_u2bx2m,False,True,t3_u2bx2m,/r/war/comments/u2bx2m/remains_of_a_dead_russian_soldier_nsfw/i4lo577/,1649876246,1,True,True,False,war,t5_2qhk8,r/war,public,,0,[],,1649847432.0,,,,
,[],False,,english_hillbilly,,,[],,,,text,t2_4axeypqq,False,False,"I'm brainwashed lol. What's really sad is you honestly believe you have good lives in Russia, are you aware I'm sitting here with about 500+ TV channels and uncensored internet, whilst wearing Nike trainers and waiting for my McDonald's to be delivered, none of that be happening in Russia. I also don't have to fear being thrown in a gulag if I call my leaders twats but it's all irrelevant as I know you're just a ruski troll and I've used more of my valuable time on you already than is deserved. I do feel for the Russians who don't want all this shit but you my friend will have to learn to enjoy the regime that is the USSR, good luck you're going to need it.",02f1ab35eaad2ccae857a6c4386526ac8bb6f16c,True,False,,,,,0,1649876217,,0,{},i4lo3t4,False,t3_u2lwr9,False,True,t1_i4ljt1k,/r/war/comments/u2lwr9/allahu_akbar_yes_these_are_russians/i4lo3t4/,1649876231,1,True,True,False,war,t5_2qhk8,r/war,public,,0,[],,1649847417.0,,,,
,[],False,,Whitechapelkiller,,,[],,,,text,t2_125de9,False,False,this sounds very pre WW1.,35c67ca1ead41ee18248eb29b49b14fe72d5f135,True,False,,,,,0,1649876213,,0,{},i4lo3ff,False,t3_u2uw4b,False,True,t1_i4lmvmd,/r/war/comments/u2uw4b/jaukus/i4lo3ff/,1649876224,1,True,True,False,war,t5_2qhk8,r/war,public,,0,[],,1649847413.0,,,,
,[],False,,benne236,,,[],,,,text,t2_4tynm7ta,False,False,Very interesting as well as concerning..,203bfaf8748fb32040b6698444f74f057ddaec2d,True,False,,,,,0,1649876205,,0,{},i4lo2oi,False,t3_u2uw4b,False,True,t1_i4lnfvy,/r/war/comments/u2uw4b/jaukus/i4lo2oi/,1649876217,1,True,True,False,war,t5_2qhk8,r/war,public,,0,[],,1649847405.0,,,,
,[],False,,Whitechapelkiller,,,[],,,,text,t2_125de9,False,False,skujua then there's no one.,fb4d3c9eb3eb6a43576127f6c1d0bf46f3fd8cc6,True,False,,,,,0,1649876110,,0,{},i4lntsc,False,t3_u2uw4b,False,True,t1_i4lhotb,/r/war/comments/u2uw4b/jaukus/i4lntsc/,1649876127,1,True,True,False,war,t5_2qhk8,r/war,public,,0,[],,1649847310.0,,,,
,[],False,,[deleted],,,,,,dark,,,,,[removed],fe993932d6dced4c0a879e9aa5d7a6e0fbb467f5,True,True,,,DELETED,,0,1649876100,,0,{},i4lnstx,False,t3_u2be10,False,True,t1_i4kgp0t,/r/war/comments/u2be10/the_russian_response_to_the_ukrainian_isis_style/i4lnstx/,1649876119,1,True,True,False,war,t5_2qhk8,r/war,public,,0,[],,1649847300.0,,,,
,[],False,,gsrmn,,,[],,,,text,t2_8m8qg,False,True,"Stop with this bullcrap, nobody is going to shoot a nuke over stuff like this. Its getting cringe now.",e14a1c7e06d2b9712c29b882611a45113a1bb30b,True,False,,,,,0,1649876089,,0,{},i4lnrw5,False,t3_u1bduu,False,True,t1_i4dy38o,/r/war/comments/u1bduu/russia_if_sweden_and_finland_join_nato_our_army/i4lnrw5/,1649876103,1,True,True,False,war,t5_2qhk8,r/war,public,,0,[],,1649847289.0,,,,
,[],False,,RedKorss,,,[],,,,text,t2_zi6ul,False,False,"They'd still have range, just not travel across the globe and fight for 6 months without refuelling before going home kind of range.

[This is an extreme example of Diesel-Electric](https://www.businessinsider.com/how-swedish-sub-ran-rings-around-us-aircraft-carrier-escorts-2021-7?r=US&amp;IR=T) going beyond what they're 'supposed' to be capable of.",7344971daf58d8e3f24c67828c1700d4a68a159b,True,False,,,,,0,1649875959,,0,{},i4lnfvy,False,t3_u2uw4b,False,True,t1_i4lmgcy,/r/war/comments/u2uw4b/jaukus/i4lnfvy/,1649875974,1,True,True,False,war,t5_2qhk8,r/war,public,,0,[],,1649847159.0,,,,
,[],False,,gsrmn,,,[],,,,text,t2_8m8qg,False,True,Why would the news show 5 men surrender when thousands of Russian and armor are getting blown up on the front lines lol.,adabd07b9917d4ac122457237caec42a0ec4cea1,True,False,,,,,0,1649875815,,0,{},i4ln2ag,False,t3_u2mzqs,False,True,t1_i4lgnze,/r/war/comments/u2mzqs/inspection_of_captured_ukrainian_soldiers_from/i4ln2ag/,1649875827,1,True,True,False,war,t5_2qhk8,r/war,public,,0,[],,1649847015.0,,,,
,[],False,,Appropriate_Shine739,,,[],,,,text,t2_iaq5da5f,False,False,"So basically, if a nato country is attacked, nato and this helps, if Japan or Australia are attacked it’s just that alliance?",7fb73d5c12e431e2faa610b0541d64910bd55f5e,True,False,,,,,0,1649875744,,0,{},i4lmvmd,False,t3_u2uw4b,False,True,t3_u2uw4b,/r/war/comments/u2uw4b/jaukus/i4lmvmd/,1649875760,1,True,True,False,war,t5_2qhk8,r/war,public,,0,[],,1649846944.0,,,,
,[],False,,Clown_Prince_1014,,,[],,,,text,t2_k3yuur1e,False,True,No not really...they've pushed the Ruooskies out if the North and away from Odessa,6e284328a97858c2484ee1968eb2a1f893a94510,True,False,,,,,0,1649875656,,0,{},i4lmna0,False,t3_u2mzqs,False,True,t1_i4lgnze,/r/war/comments/u2mzqs/inspection_of_captured_ukrainian_soldiers_from/i4lmna0/,1649875670,1,True,True,False,war,t5_2qhk8,r/war,public,,0,[],,1649846856.0,,,,
,[],False,,[deleted],,,,,,dark,,,,,[removed],fe993932d6dced4c0a879e9aa5d7a6e0fbb467f5,True,True,,,DELETED,,0,1649875592,,0,{},i4lmhc1,False,t3_u2be10,False,True,t1_i4i3nc1,/r/war/comments/u2be10/the_russian_response_to_the_ukrainian_isis_style/i4lmhc1/,1649875607,1,True,True,False,war,t5_2qhk8,r/war,public,,0,[],,1649846792.0,,,,
,[],False,,benne236,,,[],,,,text,t2_4tynm7ta,False,False,Thanks for the clarification with nuclear missile subs I would think you want to be able to hide them anywhere right?  Seems like Diesel-Electric just narrows down where the enemy needs to search to find your subs?,d4a109f760b1a6e538c4c4d6ec9026c9536d9cf9,True,False,,,,,0,1649875582,,0,{},i4lmgcy,False,t3_u2uw4b,False,True,t1_i4lm2ha,/r/war/comments/u2uw4b/jaukus/i4lmgcy/,1649875600,1,True,True,False,war,t5_2qhk8,r/war,public,,0,[],,1649846782.0,,,,
,[],False,,RedKorss,,,[],,,,text,t2_zi6ul,False,False,"? AUKUS debacle with Australia cutting their contract with France. but IIRC Diesel-Electric can be quieter than Nuclear, which has a longer range.

So if all you need / want is to protect your coasts then Nuclear-Electric is more than enough, but if you need to send your subs all over the globe then Nuclear is a viable option.",c3cdc050968ce0441765f7feb6c4a7e0624cbafb,True,False,,,,,0,1649875433,,0,{},i4lm2ha,False,t3_u2uw4b,False,True,t1_i4ll9i0,/r/war/comments/u2uw4b/jaukus/i4lm2ha/,1649875446,1,True,True,False,war,t5_2qhk8,r/war,public,,0,[],,1649846633.0,,,,
