Unnamed: 0,all_awardings,archived,associated_award,author,author_flair_background_color,author_flair_css_class,author_flair_richtext,author_flair_template_id,author_flair_text,author_flair_text_color,author_flair_type,author_fullname,author_patreon_flair,author_premium,body,body_sha1,can_gild,collapsed,collapsed_because_crowd_control,collapsed_reason,collapsed_reason_code,comment_type,controversiality,created_utc,distinguished,gilded,gildings,id,is_submitter,link_id,locked,no_follow,parent_id,permalink,retrieved_utc,score,score_hidden,send_replies,stickied,subreddit,subreddit_id,subreddit_name_prefixed,subreddit_type,top_awarded_type,total_awards_received,treatment_tags,unrepliable_reason,created,author_cakeday,edited,editable,media_metadata
,[],False,,Chody-Banks,,,[],,,,text,t2_4wi2pvh9,False,False,That’s not that big of deal tbh. Just calling every fighter pilot that takes out a Russian jet the ghost of Kiev just sounds like a morale booster for the people of Ukraine. You’re acting like they are asking their people to buy war bonds.,02c26494c23f57ed77d0b83e75b1520a433307be,True,False,,,,,0,1649894316,,0,{},i4mvvwd,False,t3_u1i8jr,False,True,t1_i4mvdc1,/r/war/comments/u1i8jr/russians_have_reportedly_attacked_mariupol_with/i4mvvwd/,1649894330,1,True,True,False,war,t5_2qhk8,r/war,public,,0,[],,1649865516.0,,,,
,[],False,,UncleBenji,,,[],,,,text,t2_al835,False,False,The fact that these stamps exist is amazing. Don’t they have computers for these types of records?,b5bb51c10b987b4f479b6d98e086ece191e10f69,True,False,,,,,0,1649894311,,0,{},i4mvvh1,False,t3_u2vl0l,False,True,t3_u2vl0l,/r/war/comments/u2vl0l/in_the_best_traditions_of_totalitarian_regimes_in/i4mvvh1/,1649894322,1,True,True,False,war,t5_2qhk8,r/war,public,,0,[],,1649865511.0,,,,
,[],False,,Make-Burn-decks-good,,,[],,,,text,t2_11vcoy,False,False,"Ask a more specific question then. You asked me what's really going on, you want me to explain the entire conflict going back to 2014? Are you incapable of researching it yourself? This is a forum to state your opinions not explain geopolitics to some propagandized zombie person whos only talking point is Russian are evil, Putin is evil, and NATO and the West are the good guys. You believe every bullshit lie that's put out by your media. 

&amp;#x200B;

Let's look at one story, just one, and from there we can view what's happening with more suspicion. 

The front page of reddit for days had posts about a man called, ""The Ghost of Kiev."" This story was fake, utterly and completely bullshit. Yet reddit believed it wholesale, they believed something that was fake to be real. Now if something like that can make it to the front page, and be posted by mainstream media companies, what other fake news stories can it to the front pages of our ""trusted"" media sources.",0c51d067a2adacaa131bb3c26c1d88aa909055a3,True,False,,,,,0,1649894087,,0,{},i4mvdc1,False,t3_u1i8jr,False,True,t1_i4mrr9z,/r/war/comments/u1i8jr/russians_have_reportedly_attacked_mariupol_with/i4mvdc1/,1649894100,1,True,True,False,war,t5_2qhk8,r/war,public,,0,[],,1649865287.0,,,,
,[],False,,[deleted],,,,,,dark,,,,,[removed],fe993932d6dced4c0a879e9aa5d7a6e0fbb467f5,True,True,,,DELETED,,0,1649894003,,0,{},i4mv6m8,False,t3_u2sl1u,False,True,t3_u2sl1u,/r/war/comments/u2sl1u/freedom_must_be_better_armed_than_tyranny/i4mv6m8/,1649894020,1,True,True,False,war,t5_2qhk8,r/war,public,,0,[],,1649865203.0,,,,
,[],False,,StandUpForYourWights,,,[],,,,text,t2_1314cn,False,False,They probably appear on maps as often as &lt;saltytone&gt;New Zealand&lt;/saltytone&gt;,1fedf80678f4e0782664f518ef97ce0fd4bd6b56,True,False,,,,,0,1649893988,,0,{},i4mv5fx,False,t3_u2uw4b,False,True,t1_i4mtyhj,/r/war/comments/u2uw4b/jaukus/i4mv5fx/,1649894006,1,True,True,False,war,t5_2qhk8,r/war,public,,0,[],,1649865188.0,,,,
,[],False,,EddieB79,,,[],,,,text,t2_5exdw2na,False,False,"The pussy liberal West will never help Ukraine. An anti-tank missile here, some blankets there...
 Where is the no fly zone, where is the human rights abuses ??? Fuck you deep state cabal! You think the normal people are stupid. We will in the end",57188cc2b0134b4f5325ec4bfb1a7c0b4994f807,True,False,,,,,0,1649893824,,0,{},i4mus6k,False,t3_u2sl1u,False,True,t3_u2sl1u,/r/war/comments/u2sl1u/freedom_must_be_better_armed_than_tyranny/i4mus6k/,1649893835,1,True,True,False,war,t5_2qhk8,r/war,public,,0,[],,1649865024.0,,,,
,[],False,,LucasTraman,,,[],,,,text,t2_byob12t9,False,False,Targeted,312e19347c72667514f0896270207fc3f94467d2,True,False,,,,,0,1649893811,,0,{},i4mur4c,False,t3_u1x40k,False,True,t3_u1x40k,/r/war/comments/u1x40k/video_of_a_russian_missile_strike_on_a/i4mur4c/,1649893829,1,True,True,False,war,t5_2qhk8,r/war,public,,0,[],,1649865011.0,,,,
,[],False,,DiverMaleficent129,,,[],,,,text,t2_8e57sko3,False,False,"Looks like an informercial, but what do you expect he's a good actor",698ce4fe6b3f88542909f06bcaa406077522ac95,True,False,,,,,0,1649893618,,0,{},i4mubrv,False,t3_u2sl1u,False,True,t3_u2sl1u,/r/war/comments/u2sl1u/freedom_must_be_better_armed_than_tyranny/i4mubrv/,1649893632,1,True,True,False,war,t5_2qhk8,r/war,public,,0,[],,1649864818.0,,,,
,[],False,,[deleted],,,,,,dark,,,,,[removed],fe993932d6dced4c0a879e9aa5d7a6e0fbb467f5,True,True,,,DELETED,,0,1649893506,,0,{},i4mu2rv,False,t3_u20253,False,True,t1_i4mrxmu,/r/war/comments/u20253/ukrainian_tough_check_point_with_the_key_word/i4mu2rv/,1649893517,1,True,True,False,war,t5_2qhk8,r/war,public,,0,[],,1649864706.0,,,,
,[],False,,Bamtamtam,,,[],,1st Llieutenant of /r/WAR,dark,text,t2_4qlctpua,False,False,You mean the freedom you gave Iraq and Afghanistan?,03e099b015902e9d8f5a7d68a6431f9ecc83186a,True,False,,,,,0,1649893462,,0,{},i4mtz2x,False,t3_u2sl1u,False,True,t1_i4mtcv5,/r/war/comments/u2sl1u/freedom_must_be_better_armed_than_tyranny/i4mtz2x/,1649893474,1,True,True,False,war,t5_2qhk8,r/war,public,,0,[],,1649864662.0,,,,
,[],False,,ameierk,,,[],,,,text,t2_18vflytp,False,False,You aren’t supposed to know about those.,18e45f839ae0e33f7f18cbf361571e4cf049f0e6,True,False,,,,,0,1649893455,,0,{},i4mtyhj,False,t3_u2uw4b,False,True,t1_i4m6ob0,/r/war/comments/u2uw4b/jaukus/i4mtyhj/,1649893475,1,True,True,False,war,t5_2qhk8,r/war,public,,0,[],,1649864655.0,,,,
,[],False,,DiverMaleficent129,,,[],,,,text,t2_8e57sko3,False,False,Support between clowns,b37c82eb4fc03bff0f79a12b502eba6c6ce08b0c,True,False,,,,,0,1649893385,,0,{},i4mtstf,False,t3_u2sl1u,False,True,t1_i4mhuv8,/r/war/comments/u2sl1u/freedom_must_be_better_armed_than_tyranny/i4mtstf/,1649893401,1,True,True,False,war,t5_2qhk8,r/war,public,,0,[],,1649864585.0,,,,
,[],False,,McFryin,,,[],,,,text,t2_o4tog,False,False,"100% agree. Money well spent fighting an oligarchy headed by a tyrant dictator, that has been the enemy of the United States since WW2 ended. Fuck Russia, wish we could liberate them from their own bullshit government. Give them a taste of the freedom they've been denied since 1917.",d2abb0110f65b6b03d33758401b5f8d48b9de663,True,False,,,,,0,1649893189,,0,{},i4mtcv5,False,t3_u2sl1u,False,True,t1_i4mms5g,/r/war/comments/u2sl1u/freedom_must_be_better_armed_than_tyranny/i4mtcv5/,1649893203,1,True,True,False,war,t5_2qhk8,r/war,public,,0,[],,1649864389.0,,,,
,[],False,,[deleted],,,,,,dark,,,,,[removed],fe993932d6dced4c0a879e9aa5d7a6e0fbb467f5,True,True,,,DELETED,,0,1649892866,,0,{},i4msmjm,False,t3_u20253,False,True,t1_i4mrxmu,/r/war/comments/u20253/ukrainian_tough_check_point_with_the_key_word/i4msmjm/,1649892879,1,True,True,False,war,t5_2qhk8,r/war,public,,0,[],,1649864066.0,,,,
,[],False,,MysteriousMist8,,,[],,,,text,t2_4cbi7i8p,False,False,"I know it's of topic but your role says you're 1st lieutenant of the channel. I know it's offtopic, but I've a question. How mariupol is still holding on ? It has been encircled for more than a week so it shouldn't get any supplies. So how is it holding on, I can't wrap my head around it",fc2f2fb62d34c22b1885856bd41c49f24492dc41,True,False,,,,,0,1649892864,,0,{},i4msmcf,False,t3_u2sl1u,False,True,t1_i4meula,/r/war/comments/u2sl1u/freedom_must_be_better_armed_than_tyranny/i4msmcf/,1649892880,1,True,True,False,war,t5_2qhk8,r/war,public,,0,[],,1649864064.0,,,,
,[],False,,McFryin,,,[],,,,text,t2_o4tog,False,False,"Most of their shit is probably barely running or not running at all. What else can you expect from a country that sends conscripts and mercenaries into battle with not enough food, fuel, ammo and other shit.... while you have a supply chain that barely functions and functions even less in enemy territory. They're sending main battle tanks into combat looking like they're fully loaded with ERA and everything. Then you see the same tank with its turret 30 feet from the tank, ERA pouches cut open, and it's just the egg carton spacers.... no ERA plates. I doubt Russia will win this war but if they do they're looking at like a decade or more of insurgency and guerilla warfare funded by NATO members. The price will be high for Ukraine but I believe the can win this, especially with all the NATO support. I'm waiting to see what Putin is doing with the troops he's sending up to Finland area. Hope he doesn't do anything more fucking retarded than he already has. He invades Finland and/or Sweden.... WW3 guaranteed. Which is worrying because nukes, but gotta do something sometime or he's just gonna keep going. If Russia wasn't the largest nuclear power in the world or if nukes weren't an issue NATO would absolutely shit on Russia 100%, probably already would've been done by now. Save Ukraine, then liberate the Russian people from their own government and give them a taste of the freedom they haven't had since 1917.",ff3ef9bf0d9106a7e16329b0e646687c4db58e90,True,False,,,,,0,1649892763,,0,{},i4mse3t,False,t3_u2sl1u,False,True,t1_i4mladq,/r/war/comments/u2sl1u/freedom_must_be_better_armed_than_tyranny/i4mse3t/,1649892776,1,True,True,False,war,t5_2qhk8,r/war,public,,0,[],,1649863963.0,,,,
,[],False,,GriffsterHipster,,,[],,,,text,t2_5qiv4p9a,False,False,"They’re not publicly releasing casualty counts until the end of the war, but families are being notified and bodies are recovered.",51c88bfa9521c03c8aaa69aef17e24f8043aeab7,True,False,,,,,0,1649892583,,0,{},i4mrze9,False,t3_u239h3,False,True,t1_i4jit9f,/r/war/comments/u239h3/civilian_casualties_in_ukraine_during_the_war/i4mrze9/,1649892600,1,True,True,False,war,t5_2qhk8,r/war,public,,0,[],,1649863783.0,,,,
,[],False,,QuietDrives87,,,[],,,,text,t2_1qt5fufx,False,False,If you cant find the details of a report is it really considered reliable? No no its not.,357144f6f5eb56a434e9047ec7c4795403ac8f6c,True,False,,,,,0,1649892562,,0,{},i4mrxmu,False,t3_u20253,False,False,t1_i4mi0wo,/r/war/comments/u20253/ukrainian_tough_check_point_with_the_key_word/i4mrxmu/,1649892577,1,True,True,False,war,t5_2qhk8,r/war,public,,0,[],,1649863762.0,,,,
,[],False,,Real-Professional392,,,[],,,,text,t2_8r9tez7i,False,False,They encouraged people to join the effort they didnt beg and plead and say we absolutely need you,acae2a1182b70ef3415af07b0769436d7786749f,True,False,,,,,0,1649892487,,0,{},i4mrrfz,False,t3_u2sl1u,False,True,t1_i4mfs33,/r/war/comments/u2sl1u/freedom_must_be_better_armed_than_tyranny/i4mrrfz/,1649892504,1,True,True,False,war,t5_2qhk8,r/war,public,,0,[],,1649863687.0,,,,
,[],False,,Chody-Banks,,,[],,,,text,t2_4wi2pvh9,False,False,Good way to avoid what I asked.,b547d39f4ed37fb987676ee2915f7d1a8d2c43b9,True,False,,,,,0,1649892485,,0,{},i4mrr9z,False,t3_u1i8jr,False,True,t1_i4mrkh7,/r/war/comments/u1i8jr/russians_have_reportedly_attacked_mariupol_with/i4mrr9z/,1649892496,1,True,True,False,war,t5_2qhk8,r/war,public,,0,[],,1649863685.0,,,,
,[],False,,[deleted],,,,,,dark,,,,,[removed],fe993932d6dced4c0a879e9aa5d7a6e0fbb467f5,True,True,,,DELETED,,0,1649892427,,0,{},i4mrmh4,False,t3_u2sl1u,False,True,t1_i4l2vou,/r/war/comments/u2sl1u/freedom_must_be_better_armed_than_tyranny/i4mrmh4/,1649892444,1,True,True,False,war,t5_2qhk8,r/war,public,,0,[],,1649863627.0,,,,
,[],False,,danbowles,,,[],,,,text,t2_xxysj,False,False,"Diesel electrics are MUCH quieter than nuclear subs when under battery power only, because you can’t turn a reactor off. Australian subs have been successful at infiltrating US Carrier groups and ‘sinking’ the carrier.",492dcd19633df47b0055866bfecfd308abf071e7,True,False,,,,,0,1649892410,,0,{},i4mrl3r,False,t3_u2uw4b,False,True,t1_i4ljwp5,/r/war/comments/u2uw4b/jaukus/i4mrl3r/,1649892421,1,True,True,False,war,t5_2qhk8,r/war,public,,0,[],,1649863610.0,,,,
,[],False,,Make-Burn-decks-good,,,[],,,,text,t2_11vcoy,False,False,Anyone with a view different from yours is a Russian bot or sounds like a Russian bot. You're not in the right state of mind to even have a conversation on this topic. Maybe there is a different way to view this situation?,2e1f566de112a48204d2d130e1a5f719fbb7febc,True,False,,,,,0,1649892402,,0,{},i4mrkh7,False,t3_u1i8jr,False,True,t1_i4kurep,/r/war/comments/u1i8jr/russians_have_reportedly_attacked_mariupol_with/i4mrkh7/,1649892414,1,True,True,False,war,t5_2qhk8,r/war,public,,0,[],,1649863602.0,,,,
,[],False,,Boonaki,,,[],,,,text,t2_8kj4t,False,False,"The U.S. has given free nukes to a number of nations.

https://en.wikipedia.org/wiki/Nuclear_sharing",e44c9a2377c03ea36f6fac7285aee75593acaee0,True,False,,,,,0,1649892296,,0,{},i4mrbrh,False,t3_u2uw4b,False,True,t1_i4mo5g1,/r/war/comments/u2uw4b/jaukus/i4mrbrh/,1649892310,1,True,True,False,war,t5_2qhk8,r/war,public,,0,[],,1649863496.0,,,,
,[],False,,jerbearman10101,,,[],,,,text,t2_nzwnux3,False,False,"See the velocity graph! (Last picture) 

Hopefully they just turned off their radar or something",b112389bdba2dc78cac40487aee40051de427098,True,False,,,,,0,1649892229,,0,{},i4mr695,True,t3_u33bi8,False,True,t3_u33bi8,/r/war/comments/u33bi8/did_this_cargo_plane_just_get_shot_down_crossing/i4mr695/,1649892242,1,True,True,False,war,t5_2qhk8,r/war,public,,0,[],,1649863429.0,,,,
,[],False,,Boonaki,,,[],,,,text,t2_8kj4t,False,False,"Doesn't look like it.

https://www.flightradar24.com/data/flights/cv7013#2b7ab28b",acaaa2241bc0033f9e8570c0530d9cf69e247607,True,False,,,,,0,1649892183,,0,{},i4mr2b8,False,t3_u33bi8,False,True,t3_u33bi8,/r/war/comments/u33bi8/did_this_cargo_plane_just_get_shot_down_crossing/i4mr2b8/,1649892198,1,True,True,False,war,t5_2qhk8,r/war,public,,0,[],,1649863383.0,,,,
,[],False,,kitch2495,,,[],,,,text,t2_gex1o,False,False,Remember reading somewhere once that japan’s nuclear and rocket capabilities are so advanced that they could outclass China within a year if they really pushed for it. Almost like having a garage with all of the parts to make a Ferrari just casually laying around.,1a39a6a19dd5e45bd57f8aab8b54bd10c8a1babc,True,False,,,,,0,1649892171,,0,{},i4mr1bf,False,t3_u2uw4b,False,True,t3_u2uw4b,/r/war/comments/u2uw4b/jaukus/i4mr1bf/,1649892184,1,True,True,False,war,t5_2qhk8,r/war,public,,0,[],,1649863371.0,,,,
,[],False,,Sale-Timely,,,[],,,,text,t2_azsbdfx6,False,False,Yep.. not a good look.,fb0fe581d8d748358f87932584b44bfc29960374,True,True,,,,,0,1649892143,,0,{},i4mqywf,False,t3_u2wyw1,False,True,t1_i4makk0,/r/war/comments/u2wyw1/ukraine_forces_capture_a_russian_teenager_solider/i4mqywf/,1649892155,1,True,True,False,war,t5_2qhk8,r/war,public,,0,[],,1649863343.0,,,,
,[],False,,Sale-Timely,,,[],,,,text,t2_azsbdfx6,False,False,Oh shit I think ima cum 🥴,934a922665fc54fb5fe9a9f6080e7868daa89a39,True,False,,,,,0,1649892105,,0,{},i4mqvrk,False,t3_u2tm5k,False,True,t3_u2tm5k,/r/war/comments/u2tm5k/size_comparison_ijn_yamato_72000_tons_kms/i4mqvrk/,1649892117,1,True,True,False,war,t5_2qhk8,r/war,public,,0,[],,1649863305.0,,,,
,[],False,,notepad20,,,[],,,,text,t2_abauq,False,False,"Deisle is queiter. 

And Australia has no existing industry or infrastructure, or any kind of experience whatsoever, with nuclear.",79505d35cdbd54e9ae0f2151f32a5fcf0cff23b1,True,False,,,,,0,1649892054,,0,{},i4mqrjz,False,t3_u2uw4b,False,True,t1_i4ljwp5,/r/war/comments/u2uw4b/jaukus/i4mqrjz/,1649892064,1,True,True,False,war,t5_2qhk8,r/war,public,,0,[],,1649863254.0,,,,
,[],False,,xNegatory,,,[],,,,text,t2_omocj,False,False,Good guy stamp in the entire world except russia.,997a75e57213e01c3fdba92fbf7c660718d7cbb7,True,False,,,,,0,1649891836,,0,{},i4mq9bf,False,t3_u2vl0l,False,True,t3_u2vl0l,/r/war/comments/u2vl0l/in_the_best_traditions_of_totalitarian_regimes_in/i4mq9bf/,1649891851,1,True,True,False,war,t5_2qhk8,r/war,public,,0,[],,1649863036.0,,,,
,[],False,,chachi_0991,,,[],,,,text,t2_4adf5x46,False,False,"Wow, the comments on this video. Holy shit.",9945ef844d04d64fdc233793326bc4e20fd6bc94,True,False,,,,,0,1649891543,,0,{},i4mplm8,False,t3_u2sl1u,False,True,t3_u2sl1u,/r/war/comments/u2sl1u/freedom_must_be_better_armed_than_tyranny/i4mplm8/,1649891559,1,True,True,False,war,t5_2qhk8,r/war,public,,0,[],,1649862743.0,,,,
,[],False,,whateveryousay7,,,[],,,,text,t2_zdbfw,False,False,"Ukraine has enough experienced soldiers (it has been in war with Russia for the past 8 years after all), no need for untrained volunteers or rusty reservists. They are ready to use the equipment, exactly the equipment that the west can provide, and is already providing, although could and should provide more. For a good cause.",8e7862ddb5bb62ad1f72b5ed72343b473e8e403c,True,False,,,,,0,1649891494,,0,{},i4mphrm,False,t3_u2sl1u,False,True,t1_i4ml89f,/r/war/comments/u2sl1u/freedom_must_be_better_armed_than_tyranny/i4mphrm/,1649891509,1,True,True,False,war,t5_2qhk8,r/war,public,,0,[],,1649862694.0,,,,
,[],False,,IAmMuffin15,,,[],,,,text,t2_fwlph,False,False,"I'd like a drag of whatever it is you're smoking if you think Russia doesn't want to invade other nations.

1.) Invading other nations and securing more territory for Russia has historically resulted in double-digit approval rating growth for Putin.

2.) Putin want's as many satellite/buffer states between him and the West as he can get. That's why his initial goal was decapitation of the Ukrainian government: he's not a fan of Western-style states on his border, certainly none that are trying to ascend to the NATO or the EU.

3.) Russia INVADED UKRAINE. ""Yeah, he invaded ONE country, but he **DEFINITELY** wouldn't invade another! Mass deportations, mobile crematoriums, ethnic cleansing: Russia just needs to do it to ONE country, then they'll NEVER EVER want to do it again, for realsies this time. I can tell because, uh, reasons.""",a261601c7d135cc0e265199c6d7d539ed7a372d7,True,False,,,,,0,1649891283,,0,{},i4mp1he,False,t3_u2sl1u,False,False,t1_i4m78d0,/r/war/comments/u2sl1u/freedom_must_be_better_armed_than_tyranny/i4mp1he/,1649891297,1,True,True,False,war,t5_2qhk8,r/war,public,,0,[],,1649862483.0,,,,
,[],False,,[deleted],,,,,,dark,,,,,[removed],fe993932d6dced4c0a879e9aa5d7a6e0fbb467f5,True,True,,,DELETED,,0,1649891174,,0,{},i4mothk,False,t3_u2be10,False,True,t1_i4mgbzd,/r/war/comments/u2be10/the_russian_response_to_the_ukrainian_isis_style/i4mothk/,1649891190,1,True,True,False,war,t5_2qhk8,r/war,public,,0,[],,1649862374.0,,,,
,[],False,,Roboticbutthole,,,[],,,,text,t2_ji15n4qj,False,False,This has nothing to do with sarin gas..,553e1bd42e80fe108ecbd6b2d51ee0d7a1a8586a,True,False,,,,,0,1649891131,,0,{},i4moqf0,False,t3_u2vden,False,True,t1_i4lv2xh,/r/war/comments/u2vden/russian_soldiers_dug_trenches_in_red_forest_the/i4moqf0/,1649891147,1,True,True,False,war,t5_2qhk8,r/war,public,,0,[],,1649862331.0,,,,
,[],False,,Roboticbutthole,,,[],,,,text,t2_ji15n4qj,False,False,Lmfao fucking idiots,cbd1adddfe3220707d0af1f9dec89a030f5bbe8d,True,False,,,,,0,1649891109,,0,{},i4moolt,False,t3_u2vden,False,True,t3_u2vden,/r/war/comments/u2vden/russian_soldiers_dug_trenches_in_red_forest_the/i4moolt/,1649891122,1,True,True,False,war,t5_2qhk8,r/war,public,,0,[],,1649862309.0,,,,
,[],False,,StandUpForYourWights,,,[],,,,text,t2_1314cn,False,False,You are correct. Fuds with guns just get killed. Fighting/operating a rank is not like driving a tractor. People train for years to become experts at this.,70f8ad4b1ca9a6465fa8c191f6185af28ec7eb9f,True,False,,,,,0,1649891103,,0,{},i4moo6s,False,t3_u2sl1u,False,True,t1_i4ml89f,/r/war/comments/u2sl1u/freedom_must_be_better_armed_than_tyranny/i4moo6s/,1649891115,1,True,True,False,war,t5_2qhk8,r/war,public,,0,[],,1649862303.0,,,,
,[],False,,whateveryousay7,,,[],,,,text,t2_zdbfw,False,False,"I will not call you Putin shill. But Putin's propaganda does push the NATO expansion cause very heavily. So it's one reason to be suspicious of this idea. There are other reasons too, e.g. now obviously Finland and Sweden intend to join NATO, so Putin only made it worse, and he can't be this stupid. Also, who cares about geo-expansion. If it's about distance to Moscow, Baltic countries are crazy close and in NATO. It just doesn't make sense and is constantly talked about by Russian media. They lied about so many things (including not planning to invade Ukraine), I am very hesitant to believe their version of _why_ they invaded.",68c35f09c6fbee4b352a76ec9ec7c12b6a465aa4,True,False,,,,,0,1649891047,,0,{},i4mojov,False,t3_u2sl1u,False,True,t1_i4mkqjo,/r/war/comments/u2sl1u/freedom_must_be_better_armed_than_tyranny/i4mojov/,1649891064,1,True,True,False,war,t5_2qhk8,r/war,public,,0,[],,1649862247.0,,,,
,[],False,,StandUpForYourWights,,,[],,,,text,t2_1314cn,False,False,You should try having to mod this sub. I don’t know which side I hate worse.,a48422fef490082d3738cb1025883266863220b0,True,False,,,,,0,1649891000,,0,{},i4mofns,False,t3_u2sl1u,False,True,t1_i4mfom5,/r/war/comments/u2sl1u/freedom_must_be_better_armed_than_tyranny/i4mofns/,1649891011,1,True,True,False,war,t5_2qhk8,r/war,public,,0,[],,1649862200.0,,,,
,[],False,,ZestycloseAd7000,,,[],,,,text,t2_6d6qqi6i,False,False,This is exactly how the mexican cartels send threats. Might remind ya'll they're terrorists too,fc302d8f6ae9fef7413cbed627af9475b470916f,True,False,,,,,0,1649890938,,0,{},i4moaj8,False,t3_u2be10,False,True,t3_u2be10,/r/war/comments/u2be10/the_russian_response_to_the_ukrainian_isis_style/i4moaj8/,1649890952,1,True,True,False,war,t5_2qhk8,r/war,public,,0,[],,1649862138.0,,,,
,[],False,,[deleted],,,,,,dark,,,,,[removed],fe993932d6dced4c0a879e9aa5d7a6e0fbb467f5,True,True,,,DELETED,,0,1649890878,,0,{},i4mo5g1,False,t3_u2uw4b,False,True,t1_i4ldenh,/r/war/comments/u2uw4b/jaukus/i4mo5g1/,1649890894,1,True,True,False,war,t5_2qhk8,r/war,public,,0,[],,1649862078.0,,,,
,[],False,,20WordsMax,,,[],,,,text,t2_753xkmvg,False,False,For getting their ass beat they seem to be doing very well in the southern and eastern fronts,343a8d20ad528aadef5d440651bdff0adbd5a49e,True,False,,,,,0,1649890837,,0,{},i4mo20l,True,t3_u2be10,False,False,t1_i4m7eqb,/r/war/comments/u2be10/the_russian_response_to_the_ukrainian_isis_style/i4mo20l/,1649890856,1,True,True,False,war,t5_2qhk8,r/war,public,,0,[],,1649862037.0,,,,
,[],False,,Formuloid,,,[],,,,text,t2_5v0b1s5p,False,False,Lol calling their bluff,b13808cf6717c2b78958ea57f1036cd409de3f84,True,False,,,,,0,1649890827,,0,{},i4mo16b,False,t3_u2wqhk,False,True,t3_u2wqhk,/r/war/comments/u2wqhk/moscow_warns_sweden_and_finland_to_face_dire/i4mo16b/,1649890840,1,True,True,False,war,t5_2qhk8,r/war,public,,0,[],,1649862027.0,,,,
,[],False,,Kilo2716,,,[],,,,text,t2_84sy1x6b,False,False,Bro the Belarusian President showed plans to invade Moldova,528e2587ba58a789191f41fc4eee8436ca1f686e,True,False,,,,,0,1649890541,,0,{},i4mncww,False,t3_u2sl1u,False,True,t1_i4m78d0,/r/war/comments/u2sl1u/freedom_must_be_better_armed_than_tyranny/i4mncww/,1649890558,1,True,True,False,war,t5_2qhk8,r/war,public,,0,[],,1649861741.0,,,,
,[],False,,TommyKanKan,,,[],,,,text,t2_k70gqk0i,False,False,Give the man what he’s asking for! It’s their lives on the line - he’s asking us to do much less than that.,66857fee9ab3546adb7db73dcf81f7a596c0ad41,True,False,,,,,0,1649890371,,0,{},i4mmyoh,False,t3_u2sl1u,False,True,t3_u2sl1u,/r/war/comments/u2sl1u/freedom_must_be_better_armed_than_tyranny/i4mmyoh/,1649890384,1,True,True,False,war,t5_2qhk8,r/war,public,,0,[],,1649861571.0,,,,
,[],False,,Bamtamtam,,,[],,1st Llieutenant of /r/WAR,dark,text,t2_4qlctpua,False,False,"To be honest it's kinda distrubing how internet made to educate people have completely made them immune to any form of criticsm. They've lost logical thinking. It would be easier to trick people nowadays. I legit saw a squad of Ukrianians dying by being fired upon by a tank from point blank range because they let their guard down to guess what? Take fucking pictures infront of a destroyed tank for Tiktok. 

Plus I just hate the hypocrisy so much. Calling someone else human rights violators when the West literally did so much to be labelled the same, it's just awful at that. True, Putin is a warmonger, but I just want people to know that the world they're protecting isn't sunshine and cookies either. 

And it just makes me breathe a sigh of relief that there's someone like you here who has a firm grasp on reality rather than people calling me ""tovarish"" or ""Ivan"". I don't like war, it's hell, it takes away more than it gives, but seriously when you can't criticize a world that advocates for ""free speech"" without being labelled as a terrorist, then something's definitely really wrong. And im sorry for your experiences in the war, they must be bad. We're just normal blokes, you guys have probably experienced this shit first hand so you definitely know better. It's cool when once in a while I come across people like you.",3deee8b0c895018aa029bbc871c40b3da269db0b,True,False,,,,,0,1649890328,,0,{},i4mmv0x,False,t3_u2sl1u,False,True,t1_i4mkqjo,/r/war/comments/u2sl1u/freedom_must_be_better_armed_than_tyranny/i4mmv0x/,1649890339,1,True,True,False,war,t5_2qhk8,r/war,public,,0,[],,1649861528.0,,,,
