all_awardings,archived,associated_award,author,author_flair_background_color,author_flair_css_class,author_flair_richtext,author_flair_template_id,author_flair_text,author_flair_text_color,author_flair_type,author_fullname,author_patreon_flair,author_premium,body,body_sha1,can_gild,collapsed,collapsed_because_crowd_control,collapsed_reason,collapsed_reason_code,comment_type,controversiality,created_utc,distinguished,gilded,gildings,id,is_submitter,link_id,locked,no_follow,parent_id,permalink,retrieved_utc,score,score_hidden,send_replies,stickied,subreddit,subreddit_id,subreddit_name_prefixed,subreddit_type,top_awarded_type,total_awards_received,treatment_tags,unrepliable_reason,created,author_cakeday
[],False,,mrpoopybuttfart,,,[],,,,text,t2_hrzr5hp2,False,False,"Im not saying you're wrong. But all of those examples could have been false flags, or examples of ukraine using civilians as shields by establishing millitary AO's near them. The fact of the matter is that neither you nor i know the truth. Perhaps you're right; personally im not going to take mainstream narratives at face value and use it to justify the dehumanization of an entire nation.",4d2001a20d9e263ff03943bf6b060962c9b3a574,True,False,,,,,0,1649501236,,0,{},i40pzt9,False,t3_tzppnz,False,True,t3_tzppnz,/r/war/comments/tzppnz/russian_view_on_the_world_and_why_they_can_repeat/i40pzt9/,1649501249,1,True,True,False,war,t5_2qhk8,r/war,public,,0,[],,1649472436.0,
[],False,,vaindioux,,,[],,,,text,t2_64d06bai,False,False,It’s like if 20 trained marines could not take a retirement home.,bb034f65f1225c08f4fefbe93c0ca521072fc38d,True,False,,,,,0,1649500669,,0,{},i40p9sy,False,t3_tzi9yq,False,True,t3_tzi9yq,/r/war/comments/tzi9yq/has_russia_completely_destroyed_its_reputation_as/i40p9sy/,1649500683,1,True,True,False,war,t5_2qhk8,r/war,public,,0,[],,1649471869.0,
[],False,,Ok_Cattle1984,,,[],,,,text,t2_kx50w3x2,False,False,"Lol people say she's pro-russia despite condemning the invasion.


Morons say she's pro-Russia cuz she's against flooding Ukraine with armaments. No fucking shit, this is all done for the profits of the arms industry. Go take a look at their stock prices. Exactly. 


Removing the sanctions on Russia, which always hurt the people of the country no matter how much governments insists it doesn't. Children in Iraq suffered because of US sanctions. They literally don't do anything.


Also the utter idiocy of all the businesses leaving Russia as a gesture when none do the same for other countries doing the same lmao. Hollow.


Everyone gets overly emotional and calls anyone a Putin puppet who doesn't just say putin bad and doesn't think Putin bad is a legitimate political position.",428ea98edc9414128afa3b95f77d62f460ee239e,True,False,,,,,0,1649500317,,0,{},i40otu8,False,t3_tx54an,False,True,t1_i3zjm3k,/r/war/comments/tx54an/irish_member_of_the_european_parliament_mep_clare/i40otu8/,1649500331,1,True,True,False,war,t5_2qhk8,r/war,public,,0,[],,1649471517.0,
[],False,,vaindioux,,,[],,,,text,t2_64d06bai,False,False,Onto a bunch of bullets 🤣,d5caf71ba823d2153fe644c84ee28e342ea61599,True,False,,,,,0,1649500220,,0,{},i40opia,False,t3_tzi9yq,False,True,t1_i3zfdhn,/r/war/comments/tzi9yq/has_russia_completely_destroyed_its_reputation_as/i40opia/,1649500232,1,True,True,False,war,t5_2qhk8,r/war,public,,0,[],,1649471420.0,
[],False,,Suitable_Comment_908,,,[],,,,text,t2_9dkt2o6v,False,False,no its confirmed as Russian,b2975817e7bb6ccacf1664be6112362199aeaf59,True,False,,,,,0,1649500129,,0,{},i40olih,False,t3_tzbriz,False,True,t1_i3ze0fk,/r/war/comments/tzbriz/once_again_ukrainian_troops_surrender_in_mariupol/i40olih/,1649500140,1,True,True,False,war,t5_2qhk8,r/war,public,,0,[],,1649471329.0,
[],False,,[deleted],,,,,,dark,,,,,[deleted],228f7d207920fb84335fac5b2b06ed7b472ece9e,True,True,,,DELETED,,0,1649500106,,0,{},i40okfb,False,t3_tzagfd,False,True,t1_i3ysbc9,/r/war/comments/tzagfd/a_torture_chamber_in_bucha_here_russians_murdered/i40okfb/,1649500121,1,True,True,False,war,t5_2qhk8,r/war,public,,0,[],,1649471306.0,
[],False,,DrBucket,,,[],,,,text,t2_3elg4,False,False,"If nukes are ever used, it will absolutely do the exact opposite of what they expect. No decent country will ever want to work with them ever again. There is no real gains from it. For the battle,maybe ya they'll ""win"" but having to resort to nukes is not even a ""dirty blow"", it's literally just stupid. You're ruining land. You're killing civilians. You're causing fallout to go around to other countries. Nukes are actually a pretty ridiculously stupid weapon -- almost as bad as mustard gas was where the change in wind can make it blow back on the originator. Not that Russia is scared of fallout blowing back on them but nukes are just such a messy weapon. It's not as strong as people think. Strength is taking out the exact right target with the most focused and direct energy available.",9c8e66e2e2831f2ef05e11855f8a4d9edf81ff6f,True,False,,,,,0,1649500091,,0,{},i40ojrb,False,t3_tzi9yq,False,True,t1_i400959,/r/war/comments/tzi9yq/has_russia_completely_destroyed_its_reputation_as/i40ojrb/,1649500108,1,True,True,False,war,t5_2qhk8,r/war,public,,0,[],,1649471291.0,
[],False,,TheOnlyNonsense,,,[],,,,text,t2_yjqhl,False,False,"Same, some of the trees i the background are the exact same",7dacad7801e28a027eac880271acf427e4428605,True,False,,,,,0,1649499891,,0,{},i40oao5,False,t3_tzh2f4,False,True,t3_tzh2f4,/r/war/comments/tzh2f4/same_marines_or_different/i40oao5/,1649499909,1,True,True,False,war,t5_2qhk8,r/war,public,,0,[],,1649471091.0,
[],False,,aurelorba,,,[],,,,text,t2_bpmso,False,False, They probably said the same thing in 1942.,44e4b1fff406ee79e58c109527898c6b089e830c,True,False,,,,,0,1649499502,,0,{},i40nt00,False,t3_tzi9yq,False,True,t3_tzi9yq,/r/war/comments/tzi9yq/has_russia_completely_destroyed_its_reputation_as/i40nt00/,1649499513,1,True,True,False,war,t5_2qhk8,r/war,public,,0,[],,1649470702.0,
[],False,,Goro_of_Tibet,,,[],,,,text,t2_3v9q306a,False,True,I think the same,4ed65df339d45483fcc60cba3c7e2cfd0487f8b9,True,False,,,,,0,1649499473,,0,{},i40nrnl,False,t3_tzagfd,False,True,t1_i40cqm6,/r/war/comments/tzagfd/a_torture_chamber_in_bucha_here_russians_murdered/i40nrnl/,1649499487,1,True,True,False,war,t5_2qhk8,r/war,public,,0,[],,1649470673.0,
[],False,,Goro_of_Tibet,,,[],,,,text,t2_3v9q306a,False,True,"The bodies should be investigating if they have gun powder on them. Since you know, all are man and they're all in the age range for the army",b5851c25664bfc548026d88fcbde0f9f23022132,True,False,,,,,0,1649499431,,0,{},i40npr6,False,t3_tzagfd,False,False,t1_i3zjkht,/r/war/comments/tzagfd/a_torture_chamber_in_bucha_here_russians_murdered/i40npr6/,1649499447,1,True,True,False,war,t5_2qhk8,r/war,public,,0,[],,1649470631.0,
[],False,,[deleted],,,,,,dark,,,,,[removed],fe993932d6dced4c0a879e9aa5d7a6e0fbb467f5,True,True,,,DELETED,,0,1649499155,,0,{},i40nde7,False,t3_tzo8l7,False,True,t3_tzo8l7,/r/war/comments/tzo8l7/when_the_old_are_wrong_the_young_pay/i40nde7/,1649499166,1,True,True,False,war,t5_2qhk8,r/war,public,,0,[],,1649470355.0,
[],False,,TheDownvotesFarmer,,,[],,,,text,t2_66lz4o25,False,False,"I dont see liberal here, I just see facts. If you saw that they human trafficking even with their own family then take a look at Ukraine https://web.archive.org/web/20220319100002/https%3A%2F%2Fen.m.wikipedia.org%2Fwiki%2FHuman_trafficking_in_Ukraine",e72a3ad2c7e77ade2b9bcdabddac3e60a6da8302,True,False,,,,,0,1649499094,,0,{},i40nar7,False,t3_tx54an,False,True,t1_i3kq7tz,/r/war/comments/tx54an/irish_member_of_the_european_parliament_mep_clare/i40nar7/,1649499107,1,True,True,False,war,t5_2qhk8,r/war,public,,0,[],,1649470294.0,
[],False,,Substantial-Radio720,,,[],,,,text,t2_9jfanccd,False,False,U/savevideo,674d1d9d688ec31d9e7acfa8e474d4f7427ead0c,True,False,,,,,0,1649498883,,0,{},i40n1in,False,t3_ts3hx6,False,True,t3_ts3hx6,/r/war/comments/ts3hx6/cats_also_love_ukrainian_army/i40n1in/,1649498895,1,True,True,False,war,t5_2qhk8,r/war,public,,0,[],,1649470083.0,
[],False,,SumoftheAncestors,,,[],,,,text,t2_7yun86jd,False,False,"&gt;Russia hasn’t deployed its actual military yet. Z FIGHTERS- The drafted young men aging from 18-25. That is all Russia has deployed so far (Excluding commanders). There is a reason for this.

Yea, that reasoning being all militaries draw their fighters from that age group. Especially in countries who have conscription. Israel for examples conscripts all their young people for a short period of military service. There is absolutely nothing strange or out of place about Russia having young soldiers.

&amp;#x200B;

&gt;They haven’t lived enough life to be okay with dying.

I think haven't living enough is the exact reason the young are used to fight wars. They haven't lived long enough to become cautious of death. Young people often see themselves as invincible, that they will live forever. What better type of mentality to order into combat?

&amp;#x200B;

&gt;This is also the group that would be most likely to group up against the government if there was ever a revolution. This group is more up to date on events as well. The group who is the most integrated with technology and can find the real news whenever they want to, all by using a simple vpn. The only group of Russians in majority, who wouldn’t be ignorant of whom started the war. Putin wants to get rid of the “big thinkers”, whom he considers counterproductive to his own personal goals.

This is a wild gamble and would be unbelievably stupid on Putin's part. You're telling me he is finding the people ""most likely"" to fight him in a revolution and are intelligent enough to see through his propaganda and Putin is giving these people military equipment? Then he is ordering these people into a conflict and isn't worried that they won't all just defect to the Ukrainian side? Giving them a base across his border for them to start their revolution? All this to save his ""actual"" military? Sorry, not buying that.

&amp;#x200B;

&gt;Putin hasn’t used his “actual” military yet. He is using surplus equipment from the Cold War and people he would also consider “surplus”. His military is still at 100%. His equipment is at 100%. The only thing that isn’t at 100% is ammunition. Which is so easy to produce and to import from Soviet backed countries. They would never run out.

I think we are seeing his ""actual"" military. There have been airborne and Spetsnaz units involved in the fighting and taking losses. Generally airborne and special operations forces aren't conscripts and wouldn't be described as not being ""actual"" military.

As far as your take on his percentage of losses, they certainly wouldn't be at 100%, no matter how you're trying to twist things. Most of Russia's arsenal is soviet era equipment. Doesn't mean those aren't upgraded as new technology comes out. Technically the Abrams tank is from the Cold War. Still a modern tank that has been upgraded as new technology is developed.

As far as his goals, I'm not sure he knows at this point. Certainly not the goals you listed. He has fired generals and intelligence agents over this war. If the goal was just to see his own forces slaughtered, then there would be no reason to get rid of the people doing exactly what he wanted them to do.

Eventually Putin will land on an achievable goal and lie that it was what the goal was all along. Then he can pretend that he won, though the rest of the world will know better.",3580547b640db60fc8e48a5a2526ae7a406b0e18,True,False,,,,,0,1649498815,,0,{},i40mykv,False,t3_tzi9yq,False,True,t1_i40bqrh,/r/war/comments/tzi9yq/has_russia_completely_destroyed_its_reputation_as/i40mykv/,1649498829,1,True,True,False,war,t5_2qhk8,r/war,public,,0,[],,1649470015.0,
[],False,,SerbianDude2006,,,[],,,,text,t2_9jl44r2l,False,False,Source trust me bro,c7f9b5db3e3816ce4a9ca7ca9e81d38b58b478b5,True,False,,,,,0,1649498714,,0,{},i40mu6y,False,t3_tz2k1u,False,True,t3_tz2k1u,/r/war/comments/tz2k1u/destroyed_russian_air_defense/i40mu6y/,1649498729,1,True,True,False,war,t5_2qhk8,r/war,public,,0,[],,1649469914.0,
[],False,,_drewcifer_,,,[],,,,text,t2_7ll3v,False,False,No.  He has total dictatorial control.,d83267611556120b17bff76449dd2a6bf7fa776c,True,False,,,,,0,1649498505,,0,{},i40mklw,False,t3_tzi9yq,False,True,t1_i40fk60,/r/war/comments/tzi9yq/has_russia_completely_destroyed_its_reputation_as/i40mklw/,1649498520,1,True,True,False,war,t5_2qhk8,r/war,public,,0,[],,1649469705.0,
[],False,,_drewcifer_,,,[],,,,text,t2_7ll3v,False,False,"He's a dictator.  Yes, it would be pressed.",f4b226bd734e6b44dd41d32a36e187a49ec151e6,True,False,,,,,0,1649498443,,0,{},i40mhtr,False,t3_tzi9yq,False,True,t1_i406ybp,/r/war/comments/tzi9yq/has_russia_completely_destroyed_its_reputation_as/i40mhtr/,1649498455,1,True,True,False,war,t5_2qhk8,r/war,public,,0,[],,1649469643.0,
[],False,,dave41468,,,[],,,,text,t2_4ipul4mk,False,False,https://armypubs.army.mil/ProductMaps/PubForm/FM.aspx#,eb8a4f675db29ae1dd917e691a5e3be6918904d6,True,False,,,,,0,1649497923,,0,{},i40luxz,False,t3_tzp60i,False,True,t3_tzp60i,/r/war/comments/tzp60i/is_there_a_book_or_some_kind_of_military_training/i40luxz/,1649497938,1,True,True,False,war,t5_2qhk8,r/war,public,,0,[],,1649469123.0,
[],False,,Dawgreen,,,[],,,,text,t2_ylrxplm,False,False,"SAS Survival Handbook . Third edition . 

Everything else just copied this.",5dbbba5a731edad85cbe1f7a87e2449694b5899f,True,False,,,,,0,1649497812,,0,{},i40lq0f,False,t3_tzp60i,False,True,t3_tzp60i,/r/war/comments/tzp60i/is_there_a_book_or_some_kind_of_military_training/i40lq0f/,1649497826,1,True,True,False,war,t5_2qhk8,r/war,public,,0,[],,1649469012.0,
[],False,,SomaDomaBoma,,,[],,,,text,t2_5ox025vb,False,False,"https://www.marines.mil/News/Publications/MCPEL/Custompubstatus/3000/

Enjoy.",fbfa2ceeb1027d9cc17ad38b512ad643a69dcd1c,True,False,,,,,0,1649497545,,0,{},i40le3t,False,t3_tzp60i,False,True,t3_tzp60i,/r/war/comments/tzp60i/is_there_a_book_or_some_kind_of_military_training/i40le3t/,1649497563,1,True,True,False,war,t5_2qhk8,r/war,public,,0,[],,1649468745.0,
[],False,,Christmasstolegrinch,,,[],,,,text,t2_587l8a04,False,False,"I’m Kadyrov by name, am a thick brick 

Murder’s my game, call me Chechen hick

I do love me a ride, as Putin’s bride 

And if it’s all the same, lick my chick’s dick",2518a0d929c1ad768481dd854f006b802a951898,True,False,,,,,0,1649497163,,0,{},i40kxi0,False,t3_tyvnq9,False,True,t3_tyvnq9,/r/war/comments/tyvnq9/commander_of_the_north_caucasian_district_of_the/i40kxi0/,1649497177,1,True,True,False,war,t5_2qhk8,r/war,public,,0,[],,1649468363.0,
[],False,,Rhino1bamabm,,,[],,,,text,t2_59do1pf9,False,False,"This is the first example I've seen of this type, nice work ukraine 🇺🇦",520ef366df0da06e11712d4dc434552ab94358e0,True,False,,,,,0,1649496985,,0,{},i40kpy7,False,t3_tzoztu,False,True,t3_tzoztu,/r/war/comments/tzoztu/the_air_force_of_ukraine_shot_down_the_latest/i40kpy7/,1649497001,1,True,True,False,war,t5_2qhk8,r/war,public,,0,[],,1649468185.0,
[],False,,FawnTheGreat,,,[],,,,text,t2_96s1uqsz,False,False,"Hahahaha arguing with a pole about russia, smooth",69cd4f2426995c5d59eb0a927fa2612548e9987f,True,False,,,,,0,1649495940,,0,{},i40jfwb,False,t3_tyzs9k,False,True,t1_i3x5ioo,/r/war/comments/tyzs9k/terrible_video_of_the_first_minutes_after_a/i40jfwb/,1649495953,1,True,True,False,war,t5_2qhk8,r/war,public,,0,[],,1649467140.0,
[],False,,FawnTheGreat,,,[],,,,text,t2_96s1uqsz,False,False,Hahahahahahahahah gottim,18c626ba7f01d61eafacd710544542d5e59e5a7d,True,False,,,,,0,1649495923,,0,{},i40jf7v,False,t3_tyzs9k,False,True,t1_i3x5pdp,/r/war/comments/tyzs9k/terrible_video_of_the_first_minutes_after_a/i40jf7v/,1649495934,1,True,True,False,war,t5_2qhk8,r/war,public,,0,[],,1649467123.0,
[],False,,FawnTheGreat,,,[],,,,text,t2_96s1uqsz,False,False,Dude you’re really new to Russian tactics ? Haha,a29f1afe89bd1ee0919cf585994a362a4d9f5093,True,False,,,,,0,1649495867,,0,{},i40jcmy,False,t3_tyzs9k,False,False,t1_i3wqma8,/r/war/comments/tyzs9k/terrible_video_of_the_first_minutes_after_a/i40jcmy/,1649495883,1,True,True,False,war,t5_2qhk8,r/war,public,,0,[],,1649467067.0,
[],False,,Sucxces_93,,,[],,,,text,t2_av9nyyrf,False,False,What did he say?,7997b271bbd998849f2c6c760b2384d705d08577,True,False,,,,,0,1649495530,,0,{},i40ixur,False,t3_tz654x,False,False,t3_tz654x,/r/war/comments/tz654x/pov_actions_of_destroying_russian_armoured/i40ixur/,1649495544,1,True,True,False,war,t5_2qhk8,r/war,public,,0,[],,1649466730.0,
[],False,,Medium-Evening,,,[],,,,text,t2_41aa0ntc,False,False,These were Russians who were left behind.,29928d2a1c877a2fb8632907041886e0273a7946,True,False,,,,,0,1649495495,,0,{},i40iwbo,False,t3_tzc5z5,False,True,t1_i3zvzn1,/r/war/comments/tzc5z5/cruel_detention_of_either_russian_sympathizers_or/i40iwbo/,1649495511,1,True,True,False,war,t5_2qhk8,r/war,public,,0,[],,1649466695.0,
[],False,,Loud_Stop_4746,,,[],,,,text,t2_brmpbtzg,False,False,Russians are a sick breed man,287614f455f5d8898558483071c3e9e007bd03a3,True,False,,,,,0,1649495485,,0,{},i40ivvz,False,t3_tzbw1i,False,True,t3_tzbw1i,/r/war/comments/tzbw1i/russians_tortured_for_3_days_a_79yearold_retired/i40ivvz/,1649495498,1,True,True,False,war,t5_2qhk8,r/war,public,,0,[],,1649466685.0,
[],False,,ProudRetardA,,,[],,,,text,t2_4yi4cceu,False,False,"Dude you are celebrating an invader of a country that is talking about genocide on Ukrainians. That have Killed so many civilians. Murderers are no heroes, I really hope you come to your senses.",bbced484b8b5cce727423e167f1bd665036094c6,True,True,,,,,0,1649495315,,0,{},i40ioh6,False,t3_tzbw1i,False,True,t1_i40dzhk,/r/war/comments/tzbw1i/russians_tortured_for_3_days_a_79yearold_retired/i40ioh6/,1649495328,1,True,True,False,war,t5_2qhk8,r/war,public,,0,[],,1649466515.0,
[],False,,Eugene0185,,,[],,,,text,t2_5losm,False,False,"Anything is possible in theory, but given there wasn't a single nuclear launch incident during a century long struggle between USSR and the US, it looks like cooler heads generally prevail so the likelihood is that you are not correct. At least if we look at history up until now as the judge.",c73a35ca337e5c36a9cde21f7ba9810c71e4b176,True,False,,,,,0,1649495164,,0,{},i40ihwc,False,t3_tzi9yq,False,True,t1_i40hctb,/r/war/comments/tzi9yq/has_russia_completely_destroyed_its_reputation_as/i40ihwc/,1649495179,1,True,True,False,war,t5_2qhk8,r/war,public,,0,[],,1649466364.0,
[],False,,ProudRetardA,,,[],,,,text,t2_4yi4cceu,False,False,"Shut up with these dumb takes on this war. War crimes happen but they are disproportionate from the Russian site. You don't do any good by picking out one thing that is still disputed and you don't know if Ukrainians will take consequences. When you want to talk war crimes talk about Bucha, Kramatorsk, and the thousand other examples of Russian atrocities. Otherwise you are nothing more than a dumb Putin supporter.",3be753b4350e5f889bc3e6b8f05b9eaaf5cd212a,True,True,,,,,0,1649495155,,0,{},i40ihhr,False,t3_tzbw1i,False,True,t3_tzbw1i,/r/war/comments/tzbw1i/russians_tortured_for_3_days_a_79yearold_retired/i40ihhr/,1649495165,1,True,True,False,war,t5_2qhk8,r/war,public,,0,[],,1649466355.0,
[],False,,bental,,,[],,,,text,t2_7wxiz,False,False,I think the US would be following the events pretty closely to learn everything they can out of this,2d79b078fff0dfe0e763e3a789b1d63cdd144eb8,True,False,,,,,0,1649495124,,0,{},i40ig58,False,t3_tzi9yq,False,True,t1_i3zj5m5,/r/war/comments/tzi9yq/has_russia_completely_destroyed_its_reputation_as/i40ig58/,1649495139,1,True,True,False,war,t5_2qhk8,r/war,public,,0,[],,1649466324.0,
[],False,,Mr_Teofago,,,[],,,,text,t2_62fti4qp,False,False,"Yeah, but they are going to another territory and stealing from them while killing. So not deserved food.",34303f17a92a242c6f2c783517bb3ed34b7b50b1,True,False,,,,,0,1649495118,,0,{},i40ifwg,False,t3_tyz4ax,False,True,t1_i3wgqid,/r/war/comments/tyz4ax/kyiv_citizens_continue_to_show_the_achievements/i40ifwg/,1649495133,1,True,True,False,war,t5_2qhk8,r/war,public,,0,[],,1649466318.0,
[],False,,thermonuke52,,,[],,,,text,t2_jgz35gh2,False,False,"Good question. Russia doesn't appear to be using as much of it's military might against Ukraine as it can, but the fact that they aren't points towards their incompetence.

In addition, the forces that Russia has deployed seem to be performing pretty poorly based off what we can tell. 

Idk if you could say any other country could take Russia's #3 spot as a dominant global power, simply owing to all the military equipment they have access too. I would say Russia is still a major regional power, but they are not a conventional military superpower, if they ever were one.

But to be fair, the only country on earth that can project force globally on a large scale is the US.",4dee54f7749bcf407ad27ba676e6ae91262b2695,True,False,,,,,0,1649495044,,0,{},i40icek,False,t3_tzi9yq,False,True,t3_tzi9yq,/r/war/comments/tzi9yq/has_russia_completely_destroyed_its_reputation_as/i40icek/,1649495059,1,True,True,False,war,t5_2qhk8,r/war,public,,0,[],,1649466244.0,
[],False,,[deleted],,,,,,dark,,,,,[removed],fe993932d6dced4c0a879e9aa5d7a6e0fbb467f5,True,True,,,DELETED,,0,1649495014,,0,{},i40iazd,False,t3_tzi9yq,False,True,t1_i402fsb,/r/war/comments/tzi9yq/has_russia_completely_destroyed_its_reputation_as/i40iazd/,1649495026,1,True,True,False,war,t5_2qhk8,r/war,public,,0,[],,1649466214.0,
[],False,,jakec0311,,,[],,,,text,t2_55evt8wv,False,False,Frozen Chosin,3f4353e68b4c10e6ca07a70567237831a910ca73,True,False,,,,,0,1649494928,,0,{},i40i6zt,False,t3_tzjugg,False,True,t3_tzjugg,/r/war/comments/tzjugg/what_are_the_worst_battle_conditions_americas/i40i6zt/,1649494942,1,True,True,False,war,t5_2qhk8,r/war,public,,0,[],,1649466128.0,
[],False,,b-b-b-beamish,,,[],,,,text,t2_c4ytgjm6,False,False,So if they did that would you then say the same if Russians came and chopped these guys balls off?,4d1d05d8f0c516766cb946304375b1702acd3bee,True,False,,,,,0,1649494794,,0,{},i40i0ve,False,t3_tx3xte,False,True,t1_i3mz1ba,/r/war/comments/tx3xte/captured_russian_bomber_known_for_killing_a_lot/i40i0ve/,1649494810,1,True,True,False,war,t5_2qhk8,r/war,public,,0,[],,1649465994.0,
[],False,,nika_ci,,,[],,,,text,t2_2oude3sl,False,False,Don't engage these morons.,09773578136981a4200f0cbd0ed15cf8e827b991,True,False,,,,,0,1649494647,,0,{},i40hugw,False,t3_tz654x,False,True,t1_i40c840,/r/war/comments/tz654x/pov_actions_of_destroying_russian_armoured/i40hugw/,1649494660,1,True,True,False,war,t5_2qhk8,r/war,public,,0,[],,1649465847.0,
[],False,,ProudRetardA,,,[],,,,text,t2_4yi4cceu,False,False,Ban this guy just spreading propaganda of ukranians surrendering is plain Russian narrative.,50040a55374ff3ff94dec67d5ed2d89b530b4391,True,True,,,,,0,1649494570,,0,{},i40hr25,False,t3_tzbriz,False,False,t3_tzbriz,/r/war/comments/tzbriz/once_again_ukrainian_troops_surrender_in_mariupol/i40hr25/,1649494583,1,True,True,False,war,t5_2qhk8,r/war,public,,0,[],,1649465770.0,
[],False,,SnooblesIRL,,,[],,,,text,t2_c92750u,False,False,"The chain of command is short for nuclear strikes and the people in that chain are intentionally put there because they likely won't refuse the order to launch, of course this is all based on assessments and could be completely wrong but the likelihood is that it's correct",4e437ac18d806b17bf34fefdb23432a2d0894231,True,False,,,,,0,1649494238,,0,{},i40hctb,False,t3_tzi9yq,False,True,t1_i406ybp,/r/war/comments/tzi9yq/has_russia_completely_destroyed_its_reputation_as/i40hctb/,1649494255,1,True,True,False,war,t5_2qhk8,r/war,public,,0,[],,1649465438.0,
[],False,,Mythrilfan,,,[],,,,text,t2_cm5l,False,False,When's the last time the US shot down an Su-27 derivative? Or a non-scud ballistic missile?,c74f2c4227a800dd886827b3d3ee361013e2f6df,True,False,,,,,0,1649494001,,0,{},i40h29k,False,t3_tzi9yq,False,True,t1_i3zv060,/r/war/comments/tzi9yq/has_russia_completely_destroyed_its_reputation_as/i40h29k/,1649494018,1,True,True,False,war,t5_2qhk8,r/war,public,,0,[],,1649465201.0,
[],False,,Mythrilfan,,,[],,,,text,t2_cm5l,False,False,"1) one out of thousands would need to work for everything to get fucked up

2) the retaliatory ones will work",ff066e84b5ff84e10f459579510b18a6ef7823e3,True,False,,,,,0,1649493861,,0,{},i40gw7z,False,t3_tzi9yq,False,True,t1_i401u4o,/r/war/comments/tzi9yq/has_russia_completely_destroyed_its_reputation_as/i40gw7z/,1649493872,1,True,True,False,war,t5_2qhk8,r/war,public,,0,[],,1649465061.0,
[],False,,joachimsverd,,,[],,,,text,t2_22o9xqt1,False,False,"I completely agree with you, but it's not just Putin, he is the last in a 1200 year long list of psychotic strong men who have somehow managed to fuck all of that up.

It takes a very special kind of incompetence to turn something as vast and rich as Russia into what it is. A backwater. A mafia controlled gas station masquerading as a country.

Nobody should be able to touch it with sanctions or embargos, and there should be at least 500mill people living like Scandinavians there. Instead it is what it is.",e49cdb661dbc9110c0dee2d846e015079c251bf7,True,False,,,,,0,1649493851,,0,{},i40gvql,False,t3_tzi9yq,False,True,t1_i4086is,/r/war/comments/tzi9yq/has_russia_completely_destroyed_its_reputation_as/i40gvql/,1649493866,1,True,True,False,war,t5_2qhk8,r/war,public,,0,[],,1649465051.0,
[],False,,New-Baby5471,,,[],,,,text,t2_af8qutsh,False,False,"The question is, has the West destroyed its ""democratic"" values?",ff107ea9c6ae0a428b2bc1fc62786db873105a53,True,False,,,,,0,1649493431,,0,{},i40gcxa,False,t3_tzi9yq,False,True,t3_tzi9yq,/r/war/comments/tzi9yq/has_russia_completely_destroyed_its_reputation_as/i40gcxa/,1649493444,1,True,True,False,war,t5_2qhk8,r/war,public,,0,[],,1649464631.0,
