all_awardings,archived,associated_award,author,author_flair_background_color,author_flair_css_class,author_flair_richtext,author_flair_template_id,author_flair_text,author_flair_text_color,author_flair_type,author_fullname,author_patreon_flair,author_premium,body,body_sha1,can_gild,collapsed,collapsed_because_crowd_control,collapsed_reason,collapsed_reason_code,comment_type,controversiality,created_utc,distinguished,gilded,gildings,id,is_submitter,link_id,locked,no_follow,parent_id,permalink,retrieved_utc,score,score_hidden,send_replies,stickied,subreddit,subreddit_id,subreddit_name_prefixed,subreddit_type,top_awarded_type,total_awards_received,treatment_tags,unrepliable_reason,created,author_cakeday
[],False,,Eternal_Wrath,,,[],,,,text,t2_4gepoqe4,False,False,"Well, that's the point of nuclear deterrent all along",e4da444a14df1b820ba6f85d402e48bd6a9603be,True,False,,,,,0,1649478322,,0,{},i3zv158,False,t3_tzi9yq,False,True,t1_i3ztyul,/r/war/comments/tzi9yq/has_russia_completely_destroyed_its_reputation_as/i3zv158/,1649478335,1,True,True,False,war,t5_2qhk8,r/war,public,,0,[],,1649449522.0,
[],False,,Cannibeans,,,[],,,,text,t2_i88ri,False,False,"Yeah, lol. They went from being perceived as the second most powerful military in the world to the second most powerful military in Ukraine. Third if you count Ukrainian farmers.",7c397c87207594077a2e1eced348a0d82cf4c596,True,False,,,,,0,1649478317,,0,{},i3zv0um,False,t3_tzi9yq,False,True,t3_tzi9yq,/r/war/comments/tzi9yq/has_russia_completely_destroyed_its_reputation_as/i3zv0um/,1649478328,1,True,True,False,war,t5_2qhk8,r/war,public,,0,[],,1649449517.0,
[],False,,FullRegalia,,,[],,,,text,t2_fqhz0,False,False,"US has plenty of experience, thank you very much",cb5f14d875660a2d5160f46ce0d6f99f7f6fef09,True,False,,,,,0,1649478307,,0,{},i3zv060,False,t3_tzi9yq,False,False,t1_i3zj5m5,/r/war/comments/tzi9yq/has_russia_completely_destroyed_its_reputation_as/i3zv060/,1649478321,1,True,True,False,war,t5_2qhk8,r/war,public,,0,[],,1649449507.0,
[],False,,Garricidal747,,,[],,,,text,t2_92ei2ppa,False,False,Your mom surrendered herself to me last night.,dc70f4de8829798d25186791fe68b3136a017419,True,False,,,,,0,1649478282,,0,{},i3zuyoj,False,t3_tzbriz,False,False,t3_tzbriz,/r/war/comments/tzbriz/once_again_ukrainian_troops_surrender_in_mariupol/i3zuyoj/,1649478294,1,True,True,False,war,t5_2qhk8,r/war,public,,0,[],,1649449482.0,
[],False,,Eternal_Wrath,,,[],,,,text,t2_4gepoqe4,False,False,"I think they only lose in Vietnam and Afghanistan though, but i get ur point",223510e9d19d6c1c3edab1bdf473b1ae55ec8d9d,True,False,,,,,0,1649478235,,0,{},i3zuvrj,False,t3_tzi9yq,False,True,t1_i3zsxly,/r/war/comments/tzi9yq/has_russia_completely_destroyed_its_reputation_as/i3zuvrj/,1649478251,1,True,True,False,war,t5_2qhk8,r/war,public,,0,[],,1649449435.0,
[],False,,Eternal_Wrath,,,[],,,,text,t2_4gepoqe4,False,False,"Ah yes, The US totally got shamed in Vietnam lol 🤷🏻",ddc4a764a6ee4fee60129382b749b7dd685d784d,True,False,,,,,0,1649478181,,0,{},i3zusej,False,t3_tzi9yq,False,False,t1_i3zu8d8,/r/war/comments/tzi9yq/has_russia_completely_destroyed_its_reputation_as/i3zusej/,1649478192,1,True,True,False,war,t5_2qhk8,r/war,public,,0,[],,1649449381.0,
[],False,,ColonelFuckface,,,[],,,,text,t2_343oo,False,False,I wouldn't say the US got beaten on the battlefield in any of those.,ec2c1ca44ab569ce56c45feef17a5844a851c704,True,False,,,,,0,1649477856,,0,{},i3zu8d8,False,t3_tzi9yq,False,True,t1_i3zsxly,/r/war/comments/tzi9yq/has_russia_completely_destroyed_its_reputation_as/i3zu8d8/,1649477868,1,True,True,False,war,t5_2qhk8,r/war,public,,0,[],,1649449056.0,
[],False,,Excellent_Emotion204,,,[],,,,text,t2_gtud8neo,False,True,Without the fear of nuclear war nato would be bending Putin over his desk in the kremlin rn,66f24e94407f13d195fd0d2253aa4edfe6faf5a7,True,False,,,,,0,1649477703,,0,{},i3ztyul,False,t3_tzi9yq,False,True,t3_tzi9yq,/r/war/comments/tzi9yq/has_russia_completely_destroyed_its_reputation_as/i3ztyul/,1649477721,1,True,True,False,war,t5_2qhk8,r/war,public,,0,[],,1649448903.0,
[],False,,Scarletking666,,,[],,,,text,t2_hw4u0npm,False,False,I swear it looks like he missed almost like I just fucked up lol,ae01d4bc6ca869f5407cb2b357a87b3e5c47e79a,True,False,,,,,0,1649477638,,0,{},i3ztuu2,False,t3_tz654x,False,True,t3_tz654x,/r/war/comments/tz654x/pov_actions_of_destroying_russian_armoured/i3ztuu2/,1649477652,1,True,True,False,war,t5_2qhk8,r/war,public,,0,[],,1649448838.0,
[],False,,giganticsquid,,,[],,,,text,t2_15pu5v,False,False,"I dunno, was the US finished as a military power after Korea, Vietnam, Iraq parts 1 and 2, Afghanistan and Syria?",a12e91b795cfe3f85755e2390e284b0ee791e23d,True,False,,,,,0,1649477112,,0,{},i3zsxly,False,t3_tzi9yq,False,False,t3_tzi9yq,/r/war/comments/tzi9yq/has_russia_completely_destroyed_its_reputation_as/i3zsxly/,1649477125,1,True,True,False,war,t5_2qhk8,r/war,public,,0,[],,1649448312.0,
[],False,,dfg1992,,,[],,,,text,t2_4kb47ujq,False,False,"On Reddit, it seems like Ukraine is about to take over Moscow. Lol.",1547085f9126520536a404aa77afc6beec989ef6,True,False,,,,,0,1649477105,,0,{},i3zsx7t,False,t3_tzi9yq,False,True,t1_i3zr3ao,/r/war/comments/tzi9yq/has_russia_completely_destroyed_its_reputation_as/i3zsx7t/,1649477118,1,True,True,False,war,t5_2qhk8,r/war,public,,0,[],,1649448305.0,
[],False,,[deleted],,,,,,dark,,,,,[removed],fe993932d6dced4c0a879e9aa5d7a6e0fbb467f5,True,True,,,DELETED,,0,1649477090,,0,{},i3zsw8f,False,t3_tzbw1i,False,True,t3_tzbw1i,/r/war/comments/tzbw1i/russians_tortured_for_3_days_a_79yearold_retired/i3zsw8f/,1649477103,1,True,True,False,war,t5_2qhk8,r/war,public,,0,[],,1649448290.0,
[],False,,Tezcatlipoca_999,,,[],,,,text,t2_bymywlof,False,False,F*&amp;# AZOV F#*&amp; Kremlin,3a66a7de6444d966d7bfd2e376ece646c5466dc0,True,False,,,,,0,1649477048,,0,{},i3zstgz,False,t3_tyzs9k,False,True,t3_tyzs9k,/r/war/comments/tyzs9k/terrible_video_of_the_first_minutes_after_a/i3zstgz/,1649477060,1,True,True,False,war,t5_2qhk8,r/war,public,,0,[],,1649448248.0,
[],False,,dfg1992,,,[],,,,text,t2_4kb47ujq,False,False,"I don’t think so, just like America didn’t when they lost to Vietnam",c9ab9af2b98502857cc06772d80903a21be1a0d5,True,False,,,,,0,1649477003,,0,{},i3zsqhl,False,t3_tzi9yq,False,True,t3_tzi9yq,/r/war/comments/tzi9yq/has_russia_completely_destroyed_its_reputation_as/i3zsqhl/,1649477018,1,True,True,False,war,t5_2qhk8,r/war,public,,0,[],,1649448203.0,
[],False,,Tezcatlipoca_999,,,[],,,,text,t2_bymywlof,False,False,Russian Kremlin,2f6acf91a3013946a2da1aa9327c681e8997fbc9,True,False,,,,,0,1649476960,,0,{},i3zsnih,False,t3_tyzs9k,False,True,t1_i3wagdb,/r/war/comments/tyzs9k/terrible_video_of_the_first_minutes_after_a/i3zsnih/,1649476975,1,True,True,False,war,t5_2qhk8,r/war,public,,0,[],,1649448160.0,
[],False,,drew2872,,,[],,,,text,t2_7l68mql2,False,False,"If they were fine killing civilians they would have shot everyone returning to a town after the US was attacked, especiallyin convoys. All they did was ditch their weapons in the hills and dirt somewhere and come back to look all innocent. Then go back for their weapons after the US left.",4d9746be7025b429ea08759d7aad14c4b8e9be7b,True,False,,,,,0,1649476904,,0,{},i3zsjvi,False,t3_tzi9yq,False,True,t1_i3zrryd,/r/war/comments/tzi9yq/has_russia_completely_destroyed_its_reputation_as/i3zsjvi/,1649476918,1,True,True,False,war,t5_2qhk8,r/war,public,,0,[],,1649448104.0,
[],False,,Jeccg,,,[],,,,text,t2_1164re,False,False,War is logistics and Russia has got nothing.,b7d650049ce784c13b516659ae1ff7e5c7509c8d,True,False,,,,,0,1649476742,,0,{},i3zs8zw,False,t3_tzi9yq,False,True,t1_i3zkse0,/r/war/comments/tzi9yq/has_russia_completely_destroyed_its_reputation_as/i3zs8zw/,1649476757,1,True,True,False,war,t5_2qhk8,r/war,public,,0,[],,1649447942.0,
[],False,,alphex,,,[],,,,text,t2_32n38,False,True,"You’re not wrong that Russia hasn’t lost.  

But at what cost is the victory?",3dccdb45c35eb80c0f70d084cd548d2509d06dd0,True,False,,,,,0,1649476691,,0,{},i3zs5mo,False,t3_tzi9yq,False,False,t1_i3zkse0,/r/war/comments/tzi9yq/has_russia_completely_destroyed_its_reputation_as/i3zs5mo/,1649476707,1,True,True,False,war,t5_2qhk8,r/war,public,,0,[],,1649447891.0,
[],False,,drew2872,,,[],,,,text,t2_7l68mql2,False,False,More Russian War crimes,70189e04881fe053a1c23316ae3f170595234f6f,True,False,,,,,0,1649476645,,0,{},i3zs2jz,False,t3_tyzs9k,False,True,t3_tyzs9k,/r/war/comments/tyzs9k/terrible_video_of_the_first_minutes_after_a/i3zs2jz/,1649476657,1,True,True,False,war,t5_2qhk8,r/war,public,,0,[],,1649447845.0,
[],False,,SirSkinnyPenisUwU,,,[],,,,text,t2_l2gsfeu5,False,False,Obama had an 80% civilian casualty rate.,8d637fbc871eb6040c80d48b964a894c84576455,True,False,,,,,0,1649476486,,0,{},i3zrryd,False,t3_tzi9yq,False,True,t1_i3zropj,/r/war/comments/tzi9yq/has_russia_completely_destroyed_its_reputation_as/i3zrryd/,1649476502,1,True,True,False,war,t5_2qhk8,r/war,public,,0,[],,1649447686.0,
[],False,,drew2872,,,[],,,,text,t2_7l68mql2,False,False,"No country can ever win against guerilla warfare unless you plan on murdering all the civilians. That is all they are, civilians, not a formal military. The US's biggest problem is the leadership in DC running the show and not the military. The first gulf War proved that the military can lead a joint force and win. Vietnam, Iraq, and Afghanistan have proven that DC cannot and should not run wars.",874706a31fb4e170f59e44d0de5a606033b67205,True,False,,,,,0,1649476436,,0,{},i3zropj,False,t3_tzi9yq,False,True,t1_i3zlaj8,/r/war/comments/tzi9yq/has_russia_completely_destroyed_its_reputation_as/i3zropj/,1649476454,1,True,True,False,war,t5_2qhk8,r/war,public,,0,[],,1649447636.0,
[],False,,SirSkinnyPenisUwU,,,[],,,,text,t2_l2gsfeu5,False,False,What a compelling and intelligent response.,23427ebf53e0459855726118cdba43d8b1910517,True,False,,,,,0,1649476315,,0,{},i3zrgra,False,t3_tzi9yq,False,True,t1_i3zoicn,/r/war/comments/tzi9yq/has_russia_completely_destroyed_its_reputation_as/i3zrgra/,1649476331,1,True,True,False,war,t5_2qhk8,r/war,public,,0,[],,1649447515.0,
[],False,,Dfmahone,,,[],,,,text,t2_cc250,False,False,Russia is done. Just a matter of how many of them have to die before it ends.,99ef50517bb9e8a5410809541e3e9d1b3327943c,True,False,,,,,0,1649476257,,0,{},i3zrctv,False,t3_tzi9yq,False,True,t1_i3zkse0,/r/war/comments/tzi9yq/has_russia_completely_destroyed_its_reputation_as/i3zrctv/,1649476273,1,True,True,False,war,t5_2qhk8,r/war,public,,0,[],,1649447457.0,
[],False,,drew2872,,,[],,,,text,t2_7l68mql2,False,False,Lets just say conscripts are not doing a great job right now. Their supply system doesn't look good either.,bd363e92fd104a8ff79b283445825d3d6acd32cb,True,False,,,,,0,1649476192,,0,{},i3zr8hv,False,t3_tzi9yq,False,True,t1_i3zkse0,/r/war/comments/tzi9yq/has_russia_completely_destroyed_its_reputation_as/i3zr8hv/,1649476203,1,True,True,False,war,t5_2qhk8,r/war,public,,0,[],,1649447392.0,
[],False,,Cyberpsychic,,,[],,,,text,t2_3vbvefpc,False,False,"Nicely put. Redditors looking at ""news"" and saying ""the russians are getting their asses kicked lol"" are clearly oblivious to any argument telling otherwise.",aa40728029f0352424d867e078c995e53077bee5,True,False,,,,,0,1649476113,,0,{},i3zr3ao,False,t3_tzi9yq,False,True,t1_i3zkse0,/r/war/comments/tzi9yq/has_russia_completely_destroyed_its_reputation_as/i3zr3ao/,1649476125,1,True,True,False,war,t5_2qhk8,r/war,public,,0,[],,1649447313.0,
[],False,,TheLaughingMan73,,,[],,,,text,t2_8rzugnn5,False,False,Then you are doing this shit for free which is even worse for you. DUMBASS,0db54d84f2c0e801e19a22394e9d5c7ad69f5cd6,True,False,,,,,0,1649475813,,0,{},i3zqjc7,False,t3_tyzs9k,False,True,t1_i3wqma8,/r/war/comments/tyzs9k/terrible_video_of_the_first_minutes_after_a/i3zqjc7/,1649475830,1,True,True,False,war,t5_2qhk8,r/war,public,,0,[],,1649447013.0,
[],False,,pilot2031,,,[],,,,text,t2_59hfgcx5,False,False,"More embarrassing, because Afghanistan was an informal guerrilla war there were no battle lines. 

While Ukraine is a formal war with battle lines and clear military objectives that are accomplishable. It’s even more embarrassing, because Ukraine, Poland and Belarus are flat countries with no natural geography to dissuade invasion or to use as defense. They’ve historically been the easiest countries to invade.

Ukraine’s only natural defense was Rasputitsa, which is the muddy season. Which makes tanks and cars get stuck in the mud, but the Russian leadership was so cocky they decided to invade. Instead of waiting for summer, when they would cool stable grass to roll in with.",498e8deb030ec6ac50cb2c00af533e54833ac172,True,False,,,,,0,1649475615,,0,{},i3zq65c,False,t3_tzi9yq,False,True,t1_i3zkn8h,/r/war/comments/tzi9yq/has_russia_completely_destroyed_its_reputation_as/i3zq65c/,1649475626,1,True,True,False,war,t5_2qhk8,r/war,public,,0,[],,1649446815.0,
[],False,,OriginalAbattoir,,,[],,,,text,t2_9cwa4bku,False,False,?,5bab61eb53176449e25c2c82f172b82cb13ffb9d,True,False,,,,,0,1649475026,,0,{},i3zp2ga,False,t3_twrj77,False,True,t1_i3zfnl9,/r/war/comments/twrj77/emotions_aside_why_does_russia_insist_on_killing/i3zp2ga/,1649475040,1,True,True,False,war,t5_2qhk8,r/war,public,,0,[],,1649446226.0,
[],False,,thatdude4518,,,[],,,,text,t2_3gd503sj,False,False,They did swearziez though can’t argue a swearziez,e474e13dbfb2b50ef325a0ca85400cabacef618d,True,False,,,,,0,1649474967,,0,{},i3zoyi7,False,t3_tzi9yq,False,True,t1_i3zfhdg,/r/war/comments/tzi9yq/has_russia_completely_destroyed_its_reputation_as/i3zoyi7/,1649474983,1,True,True,False,war,t5_2qhk8,r/war,public,,0,[],,1649446167.0,
[],False,,Sirppheadthebig12,,,[],,,,text,t2_68ghh04i,False,False,you clearly know jack shit about what happened other than the US left lol ofc you would think its all military-related and no political reasons,8e2318ffc10f49252d0504b5729ceed3e0ade3e0,True,False,,,,,0,1649474933,,0,{},i3zow4l,False,t3_tzi9yq,False,True,t1_i3zjo6x,/r/war/comments/tzi9yq/has_russia_completely_destroyed_its_reputation_as/i3zow4l/,1649474947,1,True,True,False,war,t5_2qhk8,r/war,public,,0,[],,1649446133.0,
[],False,,20WordsMax,,,[],,,,text,t2_753xkmvg,False,False,The only stuff I can freely is off telegram and/or independent journalists,d73c2483922cfc645ccaeda5aa2bb86ebe9756c2,True,False,,,,,0,1649474933,,0,{},i3zow3j,True,t3_tzbriz,False,True,t1_i3z0fwi,/r/war/comments/tzbriz/once_again_ukrainian_troops_surrender_in_mariupol/i3zow3j/,1649474947,1,True,True,False,war,t5_2qhk8,r/war,public,,0,[],,1649446133.0,
[],False,,20WordsMax,,,[],,,,text,t2_753xkmvg,False,False,Of course i can't support it cause the info is suppressed on the internet,6f35c104f6565a29157aad8887a4a25bf73db5e5,True,False,,,,,0,1649474793,,0,{},i3zompx,True,t3_tzbriz,False,True,t1_i3z0fwi,/r/war/comments/tzbriz/once_again_ukrainian_troops_surrender_in_mariupol/i3zompx/,1649474807,1,True,True,False,war,t5_2qhk8,r/war,public,,0,[],,1649445993.0,
[],False,,DrAdviceMan,,,[],,,,text,t2_ftvapqys,False,False,the Cathedral has a ten foot tall bell.   a worthy bell for tolling for those lives lost :-(,5d65fe69f05c996c9d2a7f03eab04cb123c08c92,True,False,,,,,0,1649474745,,0,{},i3zojh2,False,t3_tzh6tu,False,True,t3_tzh6tu,/r/war/comments/tzh6tu/cologne_there_was_a_rally_in_support_of_the/i3zojh2/,1649474757,1,True,True,False,war,t5_2qhk8,r/war,public,,0,[],,1649445945.0,
[],False,,GreenLights420,,,[],,,,text,t2_8p6f0gzd,False,False,Haha shutup bro youre dumb,9b67cb52b96f80bb7d97bca80897ea8e4f65a277,True,False,,,,,0,1649474728,,0,{},i3zoicn,False,t3_tzi9yq,False,True,t1_i3zlaj8,/r/war/comments/tzi9yq/has_russia_completely_destroyed_its_reputation_as/i3zoicn/,1649474744,1,True,True,False,war,t5_2qhk8,r/war,public,,0,[],,1649445928.0,
[],False,,Bdt357,,,[],,,,text,t2_4rwprn94,False,False,Vast vast vast difference between the US carrying out a war on the other side of the planet in a place without serviceable infrastructure for two full decades and never losing a significant battle… and Russia invading a neighbor and stalling out against Ukrainians while their generals make phone calls on unsecured lines and get vaporized.,745daea773e33054e33be28de3c1bf49169574ba,True,False,,,,,0,1649474728,,0,{},i3zoibn,False,t3_tzi9yq,False,True,t1_i3zjo6x,/r/war/comments/tzi9yq/has_russia_completely_destroyed_its_reputation_as/i3zoibn/,1649474744,1,True,True,False,war,t5_2qhk8,r/war,public,,0,[],,1649445928.0,
[],False,,LeftCoastMetsFan,,,[],,,,text,t2_12xfxj3x,False,False,Idk we could have said this after the Winter War and we all know what happened a few years later. Russia has definitely showed weaknesses but people should wait until after the war ends and when we have a clearer idea of casualties.,6fc66f06da6880cddaeb04678668f3171af03cd1,True,False,,,,,0,1649474336,,0,{},i3znqzy,False,t3_tzi9yq,False,True,t3_tzi9yq,/r/war/comments/tzi9yq/has_russia_completely_destroyed_its_reputation_as/i3znqzy/,1649474348,1,True,True,False,war,t5_2qhk8,r/war,public,,0,[],,1649445536.0,
[],False,,akhiahmed,,,[],,,,text,t2_lg9i2j4m,False,False,Bangladesh 's genocide,acdab1fc4047cfa3cdb73df8b7c51c097bdaeee9,True,False,,,,,0,1649474175,,0,{},i3znfs4,True,t3_tzag5p,False,True,t3_tzag5p,/r/war/comments/tzag5p/even_after_50_years_pakistan_and_china_have/i3znfs4/,1649474186,1,True,True,False,war,t5_2qhk8,r/war,public,,0,[],,1649445375.0,
[],False,,Chris714n_8,,,[],,,,text,t2_3i448jfl,False,False,Yes.,c53c562dab4b33b3e42f3bc4d8e5719439a9c155,True,False,,,,,0,1649473637,,0,{},i3zmebl,False,t3_tzi9yq,False,False,t3_tzi9yq,/r/war/comments/tzi9yq/has_russia_completely_destroyed_its_reputation_as/i3zmebl/,1649473649,1,True,True,False,war,t5_2qhk8,r/war,public,,0,[],,1649444837.0,
[],False,,Quest-at-WF,,,[],,,,text,t2_7kum9wua,False,False,"The U.S. left Afghanistan because of a lack of political support to continue, not because the Taliban defeated them in battle.",caa750a2f6dd2a2914d557d493907145713412a6,True,False,,,,,0,1649473469,,0,{},i3zm25v,False,t3_tzi9yq,False,True,t1_i3zjo6x,/r/war/comments/tzi9yq/has_russia_completely_destroyed_its_reputation_as/i3zm25v/,1649473482,1,True,True,False,war,t5_2qhk8,r/war,public,,0,[],,1649444669.0,
[],False,,EsMi6od,,,[],,,,text,t2_24aev5w,False,False,Nah,78c3dc0e955697c34e9dfcdb511092a48644b44d,True,False,,,,,0,1649473276,,0,{},i3zloa0,False,t3_tzi9yq,False,True,t1_i3zkh9d,/r/war/comments/tzi9yq/has_russia_completely_destroyed_its_reputation_as/i3zloa0/,1649473289,1,True,True,False,war,t5_2qhk8,r/war,public,,0,[],,1649444476.0,
[],False,,moonmyungkyoon,,,[],,,,text,t2_d6w2fzya,False,False,"인간이 얼마나 더 추악해질수 있는가?  
역시 푸틴이네... 곤조가 있어 미사일 쏘고도 우크라이나의 자작극?  
아무리 국제 원조에 눈 멀었다고 해서 제 나라 백성을 죽이다니  
원점이 훤히 다 보이는데도 거짓말 이라니 ... 역시 대단해  
그리고 우크라이나 백성은 이와중에 피난 안가고 뭐하고 있다가 지금가다가 폭격 맞네 짐만 되게  
 확 로보트 태권브이 군단 끌고 가벼려?  
  
이왕지사 이리된거 배신자 중국도치고 일본도 치고 함 갈때까지 가보즈아\~\~\~\~\~",8ef99602066248e62e24a5989c55dd3177fabedf,True,False,,,,,0,1649473201,,0,{},i3zliqk,False,t3_tyzs9k,False,True,t3_tyzs9k,/r/war/comments/tyzs9k/terrible_video_of_the_first_minutes_after_a/i3zliqk/,1649473218,1,True,True,False,war,t5_2qhk8,r/war,public,,0,[],,1649444401.0,
[],False,,[deleted],,,,,,dark,,,,,[removed],fe993932d6dced4c0a879e9aa5d7a6e0fbb467f5,True,True,,,DELETED,,0,1649473199,,0,{},i3zlin5,False,t3_tzi9yq,False,True,t1_i3zkse0,/r/war/comments/tzi9yq/has_russia_completely_destroyed_its_reputation_as/i3zlin5/,1649473210,1,True,True,False,war,t5_2qhk8,r/war,public,,0,[],,1649444399.0,
[],False,,Weird_Ad3611,,,[],,,,text,t2_71lck067,False,False,No one has ever been able to conquer Afghanistan. Nearly every major world power has tried to and failed at some point.,946060cb8aeb8d89ea051a617adbf5b36dfe51e1,True,False,,,,,0,1649473168,,0,{},i3zlge7,False,t3_tzi9yq,False,True,t1_i3zlaj8,/r/war/comments/tzi9yq/has_russia_completely_destroyed_its_reputation_as/i3zlge7/,1649473182,1,True,True,False,war,t5_2qhk8,r/war,public,,0,[],,1649444368.0,
[],False,,Boffinwood,,,[],,,,text,t2_9xovftns,False,False,Apples and potatoes,49537b5891c1e047877640dbfe99fafc025a3178,True,False,,,,,0,1649473098,,0,{},i3zlbbg,False,t3_tzi9yq,False,True,t1_i3zjo6x,/r/war/comments/tzi9yq/has_russia_completely_destroyed_its_reputation_as/i3zlbbg/,1649473110,1,True,True,False,war,t5_2qhk8,r/war,public,,0,[],,1649444298.0,
[],False,,SirSkinnyPenisUwU,,,[],,,,text,t2_l2gsfeu5,False,False,"And the USA is the best equipped, best trained military in the world and had to run away from the Taliban. Some would say that's even more embarrassing. At least Russians kind of have an excuse due to poor leadership and bad equipment.",a979c2fc6c73af5e79c028813b6aaaa663a8f0bf,True,False,,,,,0,1649473087,,0,{},i3zlaj8,False,t3_tzi9yq,False,True,t1_i3zkn8h,/r/war/comments/tzi9yq/has_russia_completely_destroyed_its_reputation_as/i3zlaj8/,1649473104,1,True,True,False,war,t5_2qhk8,r/war,public,,0,[],,1649444287.0,
[],False,,[deleted],,,,,,dark,,,,,[removed],fe993932d6dced4c0a879e9aa5d7a6e0fbb467f5,True,True,,,DELETED,,0,1649473043,,0,{},i3zl7jt,False,t3_tzi9yq,False,True,t1_i3zkse0,/r/war/comments/tzi9yq/has_russia_completely_destroyed_its_reputation_as/i3zl7jt/,1649473056,1,True,True,False,war,t5_2qhk8,r/war,public,,0,[],,1649444243.0,
[],False,,Magnet50,,,[],,,,text,t2_h15fn,False,True,"I looked at the way his pants are rolled, the way his bedroll is secured, and at the magazine case just above his canteen, where one side of the flap is folded up a little. They are the same in both pictures.

Same guy I think.",eadf1eef82f9c1159c8012ac37d58d5617c468ef,True,False,,,,,0,1649472842,,0,{},i3zkt8a,False,t3_tzh2f4,False,True,t3_tzh2f4,/r/war/comments/tzh2f4/same_marines_or_different/i3zkt8a/,1649472856,1,True,True,False,war,t5_2qhk8,r/war,public,,0,[],,1649444042.0,
[],False,,redrabbitRB,,,[],,,,text,t2_2yn3wsb6,False,False,"Last time I check Russia hasn't lost and isn't going to. But wishful thinking is wishful thinking.

All I see on this Reddit page is people saying how Russia is done. You don't get the nickname Bear because you suck at war a wounded bear is still a bear. Ukraine is putting up a good fight but that's just it. People don't fear Russia and china because of nukes and it shows just how little you people understand what makes a country a military power. 

Let's see how this war ends.",d19525844e124f55c6120f8a14e6fcfc97d0a26b,True,False,,,,,0,1649472830,,0,{},i3zkse0,False,t3_tzi9yq,False,True,t3_tzi9yq,/r/war/comments/tzi9yq/has_russia_completely_destroyed_its_reputation_as/i3zkse0/,1649472842,1,True,True,False,war,t5_2qhk8,r/war,public,,0,[],,1649444030.0,
[],False,,Weird_Ad3611,,,[],,,,text,t2_71lck067,False,False,"Both are embarrassing, Russia’s is more emberassing though, they are literally using machine guns and tanks that are 70+ years old",aa3a0bf285624cc3e525acdc52685febda2910dd,True,False,,,,,0,1649472759,,0,{},i3zkn8h,False,t3_tzi9yq,False,True,t1_i3zkh9d,/r/war/comments/tzi9yq/has_russia_completely_destroyed_its_reputation_as/i3zkn8h/,1649472776,1,True,True,False,war,t5_2qhk8,r/war,public,,0,[],,1649443959.0,
[],False,,SirSkinnyPenisUwU,,,[],,,,text,t2_l2gsfeu5,False,False,You're really gonna tell me that retreat wasn't a complete embarrassment?,144fba7ef422a62ec9fa6e45fb08b90a9c162ac4,True,False,,,,,0,1649472674,,0,{},i3zkh9d,False,t3_tzi9yq,False,True,t1_i3zkcbq,/r/war/comments/tzi9yq/has_russia_completely_destroyed_its_reputation_as/i3zkh9d/,1649472690,1,True,True,False,war,t5_2qhk8,r/war,public,,0,[],,1649443874.0,
[],False,,Weird_Ad3611,,,[],,,,text,t2_71lck067,False,False,Not really. Russia borders on Ukraine. Afghanistan was a logistical nightmare.,172e22f9d2b0ef5bab343bd4a3cbdc86714d3bee,True,False,,,,,0,1649472607,,0,{},i3zkcbq,False,t3_tzi9yq,False,True,t1_i3zjo6x,/r/war/comments/tzi9yq/has_russia_completely_destroyed_its_reputation_as/i3zkcbq/,1649472618,1,True,True,False,war,t5_2qhk8,r/war,public,,0,[],,1649443807.0,
[],False,,Beneficial_Refuse_79,,,[],,,,text,t2_3r8kmx99,False,False,Just like how Nazies were hunted down for decades after WW2 by Mossad.I suspect the same will happen to the ones responsible for these crimes...only this time it will be Interpol and the Ukrainian mafia doing the hunting.,c485bdde93fde0583dacb90485aca5d19f8e9503,True,False,,,,,0,1649472592,,0,{},i3zkba1,False,t3_tzagfd,False,True,t1_i3zbvwx,/r/war/comments/tzagfd/a_torture_chamber_in_bucha_here_russians_murdered/i3zkba1/,1649472604,1,True,True,False,war,t5_2qhk8,r/war,public,,0,[],,1649443792.0,
[],False,,[deleted],,,,,,dark,,,,,[removed],fe993932d6dced4c0a879e9aa5d7a6e0fbb467f5,True,True,,,DELETED,,0,1649472538,,0,{},i3zk7e5,False,t3_tzi9yq,False,True,t1_i3zjo6x,/r/war/comments/tzi9yq/has_russia_completely_destroyed_its_reputation_as/i3zk7e5/,1649472554,1,True,True,False,war,t5_2qhk8,r/war,public,,0,[],,1649443738.0,
[],False,,[deleted],,,,,,dark,,,,,[removed],fe993932d6dced4c0a879e9aa5d7a6e0fbb467f5,True,True,,,DELETED,,0,1649472362,,0,{},i3zjukm,False,t3_tz7rz4,False,True,t3_tz7rz4,/r/war/comments/tz7rz4/nuclear_weapons/i3zjukm/,1649472374,1,True,True,False,war,t5_2qhk8,r/war,public,,0,[],,1649443562.0,
[],False,,NeitherHelicopter993,,,[],,,,text,t2_8mpj0exu,False,False,The state of Riga mortise suggests death occurred a couple of weeks ago. Not saying who killed them just suggesting time of death,72a92b193d65fe7f124a1cce4d618bb84e2b3ade,True,False,,,,,0,1649472319,,0,{},i3zjrk9,False,t3_tzagfd,False,True,t1_i3z56fx,/r/war/comments/tzagfd/a_torture_chamber_in_bucha_here_russians_murdered/i3zjrk9/,1649472331,1,True,True,False,war,t5_2qhk8,r/war,public,,0,[],,1649443519.0,
