all_awardings,archived,associated_award,author,author_flair_background_color,author_flair_css_class,author_flair_richtext,author_flair_template_id,author_flair_text,author_flair_text_color,author_flair_type,author_fullname,author_patreon_flair,author_premium,body,body_sha1,can_gild,collapsed,collapsed_because_crowd_control,collapsed_reason,collapsed_reason_code,comment_type,controversiality,created_utc,distinguished,gilded,gildings,id,is_submitter,link_id,locked,no_follow,parent_id,permalink,retrieved_utc,score,score_hidden,send_replies,stickied,subreddit,subreddit_id,subreddit_name_prefixed,subreddit_type,top_awarded_type,total_awards_received,treatment_tags,unrepliable_reason,created,author_cakeday
[],False,,Fireandbud,,,[],,,,text,t2_ybgj5,False,False,"You can maintain equipment without making it more effective and destructive. The US already has enough bombs to end the world anyway. 

As far as how they developed it, you would need to study graduate level nuclear engineering and aerospace engineering to understand how nukes are developed. I’m not qualified to teach that. And frankly it is irrelevant, because no one in the US military or anywhere else is denying that they developed these new capabilities. It’s public fact.",3f296054e50b08db91192b817fc60097f6082c20,True,False,,,,,0,1649519863,,0,{},i41qlji,False,t3_tzi9yq,False,False,t1_i41p9ij,/r/war/comments/tzi9yq/has_russia_completely_destroyed_its_reputation_as/i41qlji/,1649519878,1,True,True,False,war,t5_2qhk8,r/war,public,,0,[],,1649491063.0,
[],False,,[deleted],,,,,,dark,,,,,[removed],fe993932d6dced4c0a879e9aa5d7a6e0fbb467f5,True,True,,,DELETED,,0,1649519851,,0,{},i41qkiz,False,t3_tyyuds,False,True,t1_i400do3,/r/war/comments/tyyuds/a_cluster_rocket_hit_the_kramatorsk_railway/i41qkiz/,1649519863,1,True,True,False,war,t5_2qhk8,r/war,public,,0,[],,1649491051.0,
[],False,,ChiefOfReddit,,,[],,,,text,t2_wable,False,False,"Dominant regional power should still be able to invade their neighbour.

This is embarrassing for Russian military, the failure to win. 

It's embarrassing for all Russians, the war crimes their troops are committing.",5cbbc65ffe654b852d3611fddee100c13c6f28da,True,False,,,,,0,1649519839,,0,{},i41qjgb,False,t3_tzi9yq,False,True,t1_i3zv8eg,/r/war/comments/tzi9yq/has_russia_completely_destroyed_its_reputation_as/i41qjgb/,1649519857,1,True,True,False,war,t5_2qhk8,r/war,public,,0,[],,1649491039.0,
[],False,,chife17,,,[],,,,text,t2_6bsq96cu,False,False,If you look closely the pouches are just covered by the arm.,807be9e79f39b09576199858a2a0bf6e37c64aa3,True,False,,,,,0,1649519697,,0,{},i41q6np,False,t3_tzh2f4,False,True,t1_i407cfn,/r/war/comments/tzh2f4/same_marines_or_different/i41q6np/,1649519709,1,True,True,False,war,t5_2qhk8,r/war,public,,0,[],,1649490897.0,
[],False,,our_cut,,,[],,,,text,t2_5ki3lr5n,False,False,Cope and cry,eeb1f885ebd104230614ea52399be030454b0a6b,True,True,,,,,0,1649519681,,0,{},i41q59k,False,t3_tzppnz,False,True,t3_tzppnz,/r/war/comments/tzppnz/russian_view_on_the_world_and_why_they_can_repeat/i41q59k/,1649519693,1,True,True,False,war,t5_2qhk8,r/war,public,,0,[],,1649490881.0,
[],False,,[deleted],,,,,,dark,,,,,[removed],fe993932d6dced4c0a879e9aa5d7a6e0fbb467f5,True,True,,,DELETED,,0,1649519643,,0,{},i41q1ut,False,t3_t0cdfi,False,True,t3_t0cdfi,/r/war/comments/t0cdfi/beating_on_apartment_houses/i41q1ut/,1649519655,1,True,True,False,war,t5_2qhk8,r/war,public,,0,[],,1649490843.0,
[],False,,Fireandbud,,,[],,,,text,t2_ybgj5,False,False,Nope they made bigger nukes in the 21st century. I’m not a nuclear scientist but the military acknowledges that they have expanded their nuclear strike capacity. It’s a public fact.,82122a86bbb35ae203009aa3660532700b2c54fd,True,False,,,,,0,1649519622,,0,{},i41pzzf,False,t3_tzi9yq,False,True,t1_i41o39m,/r/war/comments/tzi9yq/has_russia_completely_destroyed_its_reputation_as/i41pzzf/,1649519640,1,True,True,False,war,t5_2qhk8,r/war,public,,0,[],,1649490822.0,
[],False,,Kaviliar,,,[],,,,text,t2_55apof6p,False,False,"I really like to read the comments of couch fighters arguing about which Russian army is weak. But the fact remains that the Russian army, which has a smaller number of people, rolls the frame of Ukraine gradually and methodically into the ground.  
But if the author of the topic wants to discuss this issue, let him first present the arguments, otherwise it will fart into the water",26aae7e0e450b52394a50a39c5d039b97a74a83b,True,False,,,,,0,1649519501,,0,{},i41pozc,False,t3_tzi9yq,False,True,t3_tzi9yq,/r/war/comments/tzi9yq/has_russia_completely_destroyed_its_reputation_as/i41pozc/,1649519519,1,True,True,False,war,t5_2qhk8,r/war,public,,0,[],,1649490701.0,
[],False,,[deleted],,,,,,dark,,,,,[removed],fe993932d6dced4c0a879e9aa5d7a6e0fbb467f5,True,True,,,DELETED,,0,1649519438,,0,{},i41pj67,False,t3_tzp57f,False,True,t1_i41mmuv,/r/war/comments/tzp57f/russians_threw_grenades_into_the_basement_and/i41pj67/,1649519450,1,True,True,False,war,t5_2qhk8,r/war,public,,0,[],,1649490638.0,
[],False,,Nickblove,,,[],,,,text,t2_obho8,False,False,"Lol first, and last time Nuclear weapons were used (to stop a World war) showed why they shouldn’t..",7249689869472e36282755060f236578cddae2b5,True,False,,,,,0,1649519426,,0,{},i41pi0o,False,t3_tzi9yq,False,True,t1_i41neib,/r/war/comments/tzi9yq/has_russia_completely_destroyed_its_reputation_as/i41pi0o/,1649519444,1,True,True,False,war,t5_2qhk8,r/war,public,,0,[],,1649490626.0,
[],False,,Paul__Miller,,,[],,,,text,t2_10jucs,False,False,"I highly doubt the Russian civilians know anything about the murder of Ukrainian civilians considering the kremlin outright said “if we wanted to kill civilians, there would be more dead”, or something along those lines. Not to mention they might be okay with it since they are also brainwashed into thinking Ukraine is an enemy taking away there way of life.",029f6bc8ddafaa438172ff8d8cd0e0b564e8e122,True,False,,,,,0,1649519418,,0,{},i41phas,False,t3_tzagfd,False,True,t1_i41p1hv,/r/war/comments/tzagfd/a_torture_chamber_in_bucha_here_russians_murdered/i41phas/,1649519436,1,True,True,False,war,t5_2qhk8,r/war,public,,0,[],,1649490618.0,
[],False,,Fireandbud,,,[],,,,text,t2_ybgj5,False,False,Reducing the nuclear stockpile does not matter if you are replacing it with larger bombs capable of destroying a larger area. The end more small bombs or fewer much larger bombs have the same result: the end of the world.,c44b419c4a98c80ad8a3b8be46337f9a09310341,True,False,,,,,0,1649519398,,0,{},i41pfg0,False,t3_tzi9yq,False,True,t1_i41og7o,/r/war/comments/tzi9yq/has_russia_completely_destroyed_its_reputation_as/i41pfg0/,1649519413,1,True,True,False,war,t5_2qhk8,r/war,public,,0,[],,1649490598.0,
[],False,,Beginning-Shower121,,,[],,,,text,t2_dto8hmc5,False,False,"The problem is if you don’t modernise it they become obsolete and then your arsenal isn’t enough to deter threats like Russia and China. Also how can they make new weapons without testing the,?",62549951a078e98d8e315baf02a039453a969194,True,False,,,,,0,1649519334,,0,{},i41p9ij,False,t3_tzi9yq,False,True,t1_i41p3td,/r/war/comments/tzi9yq/has_russia_completely_destroyed_its_reputation_as/i41p9ij/,1649519346,1,True,True,False,war,t5_2qhk8,r/war,public,,0,[],,1649490534.0,
[],False,,Fireandbud,,,[],,,,text,t2_ybgj5,False,False,"The point is that modernizing the arsenal still expands strike capability. Replacing old weapons with new, more destructive bombs is functionally the same as making new weapons. The end result is you can blow up more stuff, and that is what everyone is worried about.",495567f2f96b23c52c5bcff7c313c839f3550261,True,False,,,,,0,1649519273,,0,{},i41p3td,False,t3_tzi9yq,False,True,t1_i41oo3z,/r/war/comments/tzi9yq/has_russia_completely_destroyed_its_reputation_as/i41p3td/,1649519286,1,True,True,False,war,t5_2qhk8,r/war,public,,0,[],,1649490473.0,
[],False,,AdonteGuisse,,,[],,,,text,t2_25xib58,False,False, Do you think they see the toddler stuff? Or do you think that it doesn't make it too far behind the rusty curtain?,18572bd8e615205ed22bae36a3670eb1ec0894bc,True,False,,,,,0,1649519247,,0,{},i41p1hv,False,t3_tzagfd,False,True,t1_i41nq27,/r/war/comments/tzagfd/a_torture_chamber_in_bucha_here_russians_murdered/i41p1hv/,1649519263,1,True,True,False,war,t5_2qhk8,r/war,public,,0,[],,1649490447.0,
[],False,,Fireandbud,,,[],,,,text,t2_ybgj5,False,False,What is the exact reason? The US expansion of its nuclear weapons arsenal only encourages other countries to expand theirs in a typical arms race.,4cf680f785436fbdd5d935e9d68f4d83c179808b,True,False,,,,,0,1649519129,,0,{},i41or03,False,t3_tzi9yq,False,True,t1_i41mgeb,/r/war/comments/tzi9yq/has_russia_completely_destroyed_its_reputation_as/i41or03/,1649519141,1,True,True,False,war,t5_2qhk8,r/war,public,,0,[],,1649490329.0,
[],False,,Beginning-Shower121,,,[],,,,text,t2_dto8hmc5,False,False,Looking at thta most of that seems to be about modernising the current Arsenal not developing loads of new nukes,af9eb93b3f4afd65ba41c2df298249470ab1c27a,True,False,,,,,0,1649519097,,0,{},i41oo3z,False,t3_tzi9yq,False,True,t1_i41o9st,/r/war/comments/tzi9yq/has_russia_completely_destroyed_its_reputation_as/i41oo3z/,1649519112,1,True,True,False,war,t5_2qhk8,r/war,public,,0,[],,1649490297.0,
[],False,,Nickblove,,,[],,,,text,t2_obho8,False,False,"Since  NPT the US has never threatened to use them.. OF course they did modernize but the delivery methods have not changed. Lol the only two countries to develop different delivery methods is yet again Russia and China.(the whole hypersonic nuclear missiles), (Russia and the nuclear torpedos) 
The US won’t completely disarm until China and Russia do and that seems to be a cold day in hell",e616be5cc9ac213342858543c74f92aaaf7b0232,True,False,,,,,0,1649519008,,0,{},i41og7o,False,t3_tzi9yq,False,True,t1_i41mtv0,/r/war/comments/tzi9yq/has_russia_completely_destroyed_its_reputation_as/i41og7o/,1649519024,1,True,True,False,war,t5_2qhk8,r/war,public,,0,[],,1649490208.0,
[],False,,Fireandbud,,,[],,,,text,t2_ybgj5,False,False,"[information is easy to find!](https://www.armscontrol.org/factsheets/USNuclearModernization)

&gt; these modernized forces are more capable than the originals, and the new systems will include additional capability upgrades. The current and planned U.S. financial investment in nuclear forces is unrivaled by any other nuclear power.

I just googled “US nuclear weapon modernization.” That’s what the US calls it’s programs to expand nuclear strike capacity, in order to avoid treaty violations.",3e1c1c17ab397b446584d30e78b4062b69875747,True,False,,,,,0,1649518938,,0,{},i41o9st,False,t3_tzi9yq,False,True,t1_i41lr94,/r/war/comments/tzi9yq/has_russia_completely_destroyed_its_reputation_as/i41o9st/,1649518958,1,True,True,False,war,t5_2qhk8,r/war,public,,0,[],,1649490138.0,
[],False,,WhyWontYouAnswerMe,,,[],,,,text,t2_kcq0m58m,False,False,Just like they train for the military. Personally I am old school I play pong to train for these types of situations,857a3f14d687178af08b70752c3e01609541bc4c,True,True,,,,,0,1649518889,,0,{},i41o5em,False,t3_tzp60i,False,True,t1_i41elbv,/r/war/comments/tzp60i/is_there_a_book_or_some_kind_of_military_training/i41o5em/,1649518904,1,True,True,False,war,t5_2qhk8,r/war,public,,0,[],,1649490089.0,
[],False,,Beginning-Shower121,,,[],,,,text,t2_dto8hmc5,False,False,Well you need tests to Deleon nukes don’t you? That’s why they were testing nukes durning he cold war,1366f2e8292e6e16f47dfafda630d1fac8bcfd2a,True,False,,,,,0,1649518865,,0,{},i41o39m,False,t3_tzi9yq,False,True,t1_i41nfok,/r/war/comments/tzi9yq/has_russia_completely_destroyed_its_reputation_as/i41o39m/,1649518881,1,True,True,False,war,t5_2qhk8,r/war,public,,0,[],,1649490065.0,
[],False,,AdonteGuisse,,,[],,,,text,t2_25xib58,False,False,And what's the timeline and acceptable cost to the Ukranians?,53985239ba34c0bf5557cf05fc1fd35de2ed1c93,True,False,,,,,0,1649518726,,0,{},i41nqsb,False,t3_tzagfd,False,True,t1_i3yefnk,/r/war/comments/tzagfd/a_torture_chamber_in_bucha_here_russians_murdered/i41nqsb/,1649518740,1,True,True,False,war,t5_2qhk8,r/war,public,,0,[],,1649489926.0,
[],False,,Paul__Miller,,,[],,,,text,t2_10jucs,False,False,"I’m not saying it is equal, this is how I imagine THEY justify it.",45cda8806c740ed594a1092997259c9c182420e4,True,False,,,,,0,1649518717,,0,{},i41nq27,False,t3_tzagfd,False,True,t1_i41nhx0,/r/war/comments/tzagfd/a_torture_chamber_in_bucha_here_russians_murdered/i41nq27/,1649518732,1,True,True,False,war,t5_2qhk8,r/war,public,,0,[],,1649489917.0,
[],False,,Voorniets,,,[],,,,text,t2_813ci01a,False,False,A gun is very nice tool but when you are a fat McUsa with the survival skills of a wet sack of rice you ain't gonna be using that gun for long.,575f60663c2d54817bf7bf5523bbf5bb551c1344,True,False,,,,,0,1649518705,,0,{},i41np0g,False,t3_tzp60i,False,True,t1_i415vvg,/r/war/comments/tzp60i/is_there_a_book_or_some_kind_of_military_training/i41np0g/,1649518717,1,True,True,False,war,t5_2qhk8,r/war,public,,0,[],,1649489905.0,
[],False,,[deleted],,,,,,dark,,,,,[removed],fe993932d6dced4c0a879e9aa5d7a6e0fbb467f5,True,True,,,DELETED,,0,1649518704,,0,{},i41nox9,False,t3_tzoztu,False,True,t1_i40y1l3,/r/war/comments/tzoztu/the_air_force_of_ukraine_shot_down_the_latest/i41nox9/,1649518717,1,True,True,False,war,t5_2qhk8,r/war,public,,0,[],,1649489904.0,
[],False,,AdonteGuisse,,,[],,,,text,t2_25xib58,False,False,"It's not equal, though. How many russian toddler ""nazis"" have been involved?",f17dcb20150455017a3e52bf8a03c8996024433c,True,False,,,,,0,1649518626,,0,{},i41nhx0,False,t3_tzagfd,False,True,t1_i3zfxrz,/r/war/comments/tzagfd/a_torture_chamber_in_bucha_here_russians_murdered/i41nhx0/,1649518641,1,True,True,False,war,t5_2qhk8,r/war,public,,0,[],,1649489826.0,
[],False,,Brogunz13,,,[],,,,text,t2_81rdgreq,False,False,That’s a Novorossiya flag,59017e45b55390efde26fcaf93a7707d4ef15b1d,True,False,,,,,0,1649518601,,0,{},i41nfqa,False,t3_szk1hf,False,True,t1_hy41l55,/r/war/comments/szk1hf/dpr_forces_mobilizing_on_the_ukrainian_frontlines/i41nfqa/,1649518618,1,True,True,False,war,t5_2qhk8,r/war,public,,0,[],,1649489801.0,
[],False,,Fireandbud,,,[],,,,text,t2_ybgj5,False,False,What do tests have to do with anything?,8e934210e8cb498677f74b6c435cfd57ae3ff7a9,True,False,,,,,0,1649518601,,0,{},i41nfok,False,t3_tzi9yq,False,True,t1_i41log7,/r/war/comments/tzi9yq/has_russia_completely_destroyed_its_reputation_as/i41nfok/,1649518618,1,True,True,False,war,t5_2qhk8,r/war,public,,0,[],,1649489801.0,
[],False,,Sufficient-Remote-49,,,[],,,,text,t2_7abn1wkh,False,False,"Well, considering only one country has ever used Nukes, and twice at that, you can see why one might say other nuclear powers have been more responsible than the US so far with their nuclear arsenal. Overall, all nuclear powers have been responsible so far, but if we’re starting to point fingers, the US isn’t on any higher ground than others.",5c57e5f61b6291d562d52e0a4bc5f71a3992f64d,True,False,,,,,0,1649518588,,0,{},i41neib,False,t3_tzi9yq,False,True,t1_i41lavg,/r/war/comments/tzi9yq/has_russia_completely_destroyed_its_reputation_as/i41neib/,1649518603,1,True,True,False,war,t5_2qhk8,r/war,public,,0,[],,1649489788.0,
[],False,,AdonteGuisse,,,[],,,,text,t2_25xib58,False,False,"It's typically a safe bet to assume the invading party is the one killing ukranians, as like, the ukranians weren't killing or missile-striking themselves prior to this.

But I'd be super embarrassed to be affiliated as well. I don't know if I'd lie and double down, but I would be absolutely ashamed. So I don't really blame you.",da59adcba5e8fdc15cc46ed9f25e370a4a325e9a,True,False,,,,,0,1649518549,,0,{},i41nb1k,False,t3_tzagfd,False,True,t1_i4117cy,/r/war/comments/tzagfd/a_torture_chamber_in_bucha_here_russians_murdered/i41nb1k/,1649518565,1,True,True,False,war,t5_2qhk8,r/war,public,,0,[],,1649489749.0,
[],False,,Fireandbud,,,[],,,,text,t2_ybgj5,False,False,"The “modernization” effort by the U.S. under Obama resulted in an overall expansion of the US nuclear strike capacity. Reducing the number of warheads while also expanding your ability to end the world is not non-proliferation, and that is obvious to every country that feels threatened by the USA.",5d6f95d7cddb850710a9158bd37ab564d507bcc6,True,False,,,,,0,1649518355,,0,{},i41mtv0,False,t3_tzi9yq,False,True,t1_i41lavg,/r/war/comments/tzi9yq/has_russia_completely_destroyed_its_reputation_as/i41mtv0/,1649518368,1,True,True,False,war,t5_2qhk8,r/war,public,,0,[],,1649489555.0,
[],False,,jeegte12,,,[],,,,text,t2_aybxj,False,False,"according to this woman.

i'm as anti-russia as it gets and have been for years, but i'm also anti-assuming everything you hear on the internet is true.",aa74796120c13a1e92973106625a6e3f045a0f3e,True,False,,,,,0,1649518277,,0,{},i41mmuv,False,t3_tzp57f,False,True,t3_tzp57f,/r/war/comments/tzp57f/russians_threw_grenades_into_the_basement_and/i41mmuv/,1649518292,1,True,True,False,war,t5_2qhk8,r/war,public,,0,[],,1649489477.0,
[],False,,mynipplesareonfire,,,[],,,,text,t2_4blvw7i2,False,False,"That's the exact reason why North Korea and Iran shouldn't have them.  They would be more likely to say ""fuck it"" and use them.  When they become a superpower then they can have their nukes.  Until then it's in America's and the rest of the world's best interest to not have small rogue nations have them.",44b6d0b5d93b7eee3bc6a7b718ebb5f850f0a389,True,False,,,,,0,1649518204,,0,{},i41mgeb,False,t3_tzi9yq,False,True,t1_i41h8dn,/r/war/comments/tzi9yq/has_russia_completely_destroyed_its_reputation_as/i41mgeb/,1649518216,1,True,True,False,war,t5_2qhk8,r/war,public,,0,[],,1649489404.0,
[],False,,Beginning-Shower121,,,[],,,,text,t2_dto8hmc5,False,False,And why criticise the us I haven’t heard of them expanding there nukes at all same with Russia,e0234c270c20f3f3f35d3950116bd202430face3,True,False,,,,,0,1649517922,,0,{},i41lr94,False,t3_tzi9yq,False,True,t1_i41h8dn,/r/war/comments/tzi9yq/has_russia_completely_destroyed_its_reputation_as/i41lr94/,1649517936,1,True,True,False,war,t5_2qhk8,r/war,public,,0,[],,1649489122.0,
[],False,,Beginning-Shower121,,,[],,,,text,t2_dto8hmc5,False,False,Really? I haven’t heard of nuke tests in ages,5508ebd73071f8e646fd391d17e554af428b8d69,True,False,,,,,0,1649517889,,0,{},i41log7,False,t3_tzi9yq,False,True,t1_i41h8dn,/r/war/comments/tzi9yq/has_russia_completely_destroyed_its_reputation_as/i41log7/,1649517911,1,True,True,False,war,t5_2qhk8,r/war,public,,0,[],,1649489089.0,
[],False,,Beginning-Shower121,,,[],,,,text,t2_dto8hmc5,False,False,Until alquada gets nukes…….,91a9d5ef260827cb3a6e157872cd80ba9dd4d551,True,False,,,,,0,1649517838,,0,{},i41ljzc,False,t3_tzi9yq,False,True,t1_i40et8s,/r/war/comments/tzi9yq/has_russia_completely_destroyed_its_reputation_as/i41ljzc/,1649517857,1,True,True,False,war,t5_2qhk8,r/war,public,,0,[],,1649489038.0,
[],False,,Beginning-Shower121,,,[],,,,text,t2_dto8hmc5,False,False,I don’t think North Korea has nukes yet,a46958c3f9e7174f793f17cb29bb8a16ece59b20,True,False,,,,,0,1649517817,,0,{},i41li3s,False,t3_tzi9yq,False,True,t1_i40dumq,/r/war/comments/tzi9yq/has_russia_completely_destroyed_its_reputation_as/i41li3s/,1649517839,1,True,True,False,war,t5_2qhk8,r/war,public,,0,[],,1649489017.0,
[],False,,Beginning-Shower121,,,[],,,,text,t2_dto8hmc5,False,False,Depends outside of Russia yes but I think invasions of Russia tend to not go well and with the geography and the ammount of reserves and civilians militarised in a invasion they would put up a really big fight,99de6fd503af84f589d77dca5d5f15bda5bea823,True,False,,,,,0,1649517795,,0,{},i41lg4w,False,t3_tzi9yq,False,True,t1_i3zdof9,/r/war/comments/tzi9yq/has_russia_completely_destroyed_its_reputation_as/i41lg4w/,1649517841,1,True,True,False,war,t5_2qhk8,r/war,public,,0,[],,1649488995.0,
[],False,,Frankieandlotsabeans,,,[],,,,text,t2_cbkp8um,False,False,+more dead rapists for Satan to meet,c6f1f56bc91d39f55c74e158c46605ea9ba00a11,True,False,,,,,0,1649517750,,0,{},i41lc8j,False,t3_tz654x,False,True,t3_tz654x,/r/war/comments/tz654x/pov_actions_of_destroying_russian_armoured/i41lc8j/,1649517764,1,True,True,False,war,t5_2qhk8,r/war,public,,0,[],,1649488950.0,
[],False,,Nickblove,,,[],,,,text,t2_obho8,False,False,"The US has done the most disarmament of nuclear weapons, they have not expanded the nuclear arsenal at all.( they have modernized current warheads but have not added new ones ) and they definitely haven’t broken any nuclear weapons treaty. 
Russia( broke treaties)and China ( currently adding weapons) are the only two nations to actively threaten nuclear war, but hey blame the US because they like to enforce the treaty….


So you want to have the US to force nuclear proliferation by military might? Get real man",9a01f785f8c4b22194c6b9a5f0a134b8449c1ffc,True,False,,,,,0,1649517735,,0,{},i41lavg,False,t3_tzi9yq,False,True,t1_i41h8dn,/r/war/comments/tzi9yq/has_russia_completely_destroyed_its_reputation_as/i41lavg/,1649517750,1,True,True,False,war,t5_2qhk8,r/war,public,,0,[],,1649488935.0,
[],False,,Kaviliar,,,[],,,,text,t2_55apof6p,False,False,"Well, BMP 1 is primarily in the army of the Armed Forces of Ukraine and the dombas militias. And I noticed that the militias are often confused with the Russian army. and in Russia, mainly BMP 2 and 3.
In the same trap, journalists have already highlighted the serial number of the missile and they are in service with the Armed Forces of Ukraine. Under a similar number, the point hit in Donetsk",482608b9b57e0344bf2dd945e503e16269c1c220,True,False,,,,,0,1649517442,,0,{},i41kkor,False,t3_tyzs9k,False,True,t1_i3zchey,/r/war/comments/tyzs9k/terrible_video_of_the_first_minutes_after_a/i41kkor/,1649517452,1,True,True,False,war,t5_2qhk8,r/war,public,,0,[],,1649488642.0,
[],False,,Chazzzz13,,,[],,,,text,t2_exnve6l8,False,False,That wouldn’t be dying if they were in their own country.,ebbdf3aa36f26d5debf3042d96faa066ee850993,True,False,,,,,0,1649517232,,0,{},i41k2ce,False,t3_tzaag3,False,True,t1_i41h3yf,/r/war/comments/tzaag3/beautiful_and_clear_hit_of_the_armed_forces_of/i41k2ce/,1649517244,1,True,True,False,war,t5_2qhk8,r/war,public,,0,[],,1649488432.0,
[],False,,GLOCK_PERFECTION,,,[],,,,text,t2_u5dd495,False,False,I wouldn’t be surpris if they are working on a secret nuclear program. They have the technology.,adda9f47e7ed4dfdefcea3c45d2299f4f6af2a40,True,False,,,,,0,1649517220,,0,{},i41k1ci,False,t3_tzi9yq,False,True,t1_i40dumq,/r/war/comments/tzi9yq/has_russia_completely_destroyed_its_reputation_as/i41k1ci/,1649517237,1,True,True,False,war,t5_2qhk8,r/war,public,,0,[],,1649488420.0,
[],False,,[deleted],,,,,,dark,,,,,[removed],fe993932d6dced4c0a879e9aa5d7a6e0fbb467f5,True,True,,,DELETED,,0,1649517179,,0,{},i41jxmv,False,t3_tyzs9k,False,True,t1_i3yos4q,/r/war/comments/tyzs9k/terrible_video_of_the_first_minutes_after_a/i41jxmv/,1649517190,1,True,True,False,war,t5_2qhk8,r/war,public,,0,[],,1649488379.0,
[],False,,mrpoopybuttfart,,,[],,,,text,t2_hrzr5hp2,False,False,"Nope. Do you believe everytthing the mainstream news tells you? Information warfare exists. Im not on the ground, im not going to pretend to have the slightest fucking clue as to whats actually happening. I do know that ukraine is desperate for nato intervention, and i know that russia is capable of committing war crimes. Im not saying russia didn't do it. I'm not going to sit here and jump on this bandwagon of dehumanizing russians just because the media tells me to.",9657feb98230f927d9a869a865301f93c0d52c4a,True,False,,,,,0,1649516954,,0,{},i41jdyu,False,t3_tzppnz,False,True,t1_i41dhqh,/r/war/comments/tzppnz/russian_view_on_the_world_and_why_they_can_repeat/i41jdyu/,1649516967,1,True,True,False,war,t5_2qhk8,r/war,public,,0,[],,1649488154.0,
[],False,,krystiang001,,,[],,,,text,t2_j076u5nn,False,False,"Change the fucking title stop spreading misinformation, mods wtf are you doing.",6bf5760ccb7680e237e6e728237e1091a9a2718d,True,False,,,,,0,1649516821,,0,{},i41j2a0,False,t3_tzc5z5,False,True,t3_tzc5z5,/r/war/comments/tzc5z5/cruel_detention_of_either_russian_sympathizers_or/i41j2a0/,1649516832,1,True,True,False,war,t5_2qhk8,r/war,public,,0,[],,1649488021.0,
[],False,,leli7,,,[],,,,text,t2_13s1vw,False,False,"No one intervened to help Ukraine, do you think they did this because they don't consider Russia as a military power? Biden made it clear the US won't even deploy to save American lives because Russian soldiers and American soldiers shooting each other would mean a world war. Even the EU is not sending any troops. Sure they are supplying Ukraine with weapons and money and sanctions on Russia but no one is putting his troops in Ukraine. So no they have not destroyed their reputation as a military power they have destroyed their reputation as a democracy, if they ever had one.",756ca95a68ad820162167ebd106662358e63c0e6,True,False,,,,,0,1649516703,,0,{},i41irz1,False,t3_tzi9yq,False,True,t3_tzi9yq,/r/war/comments/tzi9yq/has_russia_completely_destroyed_its_reputation_as/i41irz1/,1649516720,1,True,True,False,war,t5_2qhk8,r/war,public,,0,[],,1649487903.0,
