all_awardings,archived,associated_award,author,author_flair_background_color,author_flair_css_class,author_flair_richtext,author_flair_template_id,author_flair_text,author_flair_text_color,author_flair_type,author_fullname,author_patreon_flair,author_premium,body,body_sha1,can_gild,collapsed,collapsed_because_crowd_control,collapsed_reason,collapsed_reason_code,comment_type,controversiality,created_utc,distinguished,gilded,gildings,id,is_submitter,link_id,locked,no_follow,parent_id,permalink,retrieved_utc,score,score_hidden,send_replies,stickied,subreddit,subreddit_id,subreddit_name_prefixed,subreddit_type,top_awarded_type,total_awards_received,treatment_tags,unrepliable_reason,created
[],False,,kpapenbe,,,[],,,,text,t2_ixf7ljmz,False,False,Glad I could make ya chuckle--happy Friday!,add33768ae62659e1d4a89fbb658885e98fdfb3c,True,False,,,,,0,1653656674,,0,{},ia6ssbh,True,t3_uy42om,False,True,t1_ia6snm1,/r/UkraineConflict/comments/uy42om/wait_russia_is_open_to_a_food_corridor_so_that/ia6ssbh/,1653656687,1,True,True,False,UkraineConflict,t5_30oyx,r/UkraineConflict,public,,0,[],,1653627874.0
[],False,,Mr_Joguvaga,,,[],,,,text,t2_1p22gsg6,False,False,Didnt we already try this like 80 years ago... and what did that lead to?,ed79e8e1c82c1fceddb6269b87d00f8a18787ffd,True,False,,,,,0,1653656632,,0,{},ia6sp7d,False,t3_uyv8kq,False,True,t3_uyv8kq,/r/UkraineConflict/comments/uyv8kq/what_do_we_think_of_the_kissinger_comments_why/ia6sp7d/,1653656649,1,True,True,False,UkraineConflict,t5_30oyx,r/UkraineConflict,public,,0,[],,1653627832.0
[],False,,Tigtig01,,,[],,,,text,t2_2ump0b6m,False,False,😂😂,aa06c2cc243bc15792540a3ac685d75dab4670f0,True,False,,,,,0,1653656609,,0,{},ia6snm1,False,t3_uy42om,False,True,t1_ia6sijw,/r/UkraineConflict/comments/uy42om/wait_russia_is_open_to_a_food_corridor_so_that/ia6snm1/,1653656628,1,True,True,False,UkraineConflict,t5_30oyx,r/UkraineConflict,public,,0,[],,1653627809.0
[],False,,kpapenbe,,,[],,,,text,t2_ixf7ljmz,False,False,OOO they should use that in one of their terrible Russian rap songs LOL,81ba1ac919b59c7fd67688dc79457c7a8fba5b71,True,False,,,,,0,1653656539,,0,{},ia6sijw,True,t3_uy42om,False,True,t1_ia6s06f,/r/UkraineConflict/comments/uy42om/wait_russia_is_open_to_a_food_corridor_so_that/ia6sijw/,1653656550,1,True,True,False,UkraineConflict,t5_30oyx,r/UkraineConflict,public,,0,[],,1653627739.0
[],False,,ericallenjett,,,[],,,,text,t2_2fikb5yc,False,False,Kissinger is a war criminal and a disgrace to America. 'Nuff said.,6ce4aaa32a8975341b7feb523ad49e2564641697,True,False,,,,,0,1653656533,,0,{},ia6si6l,False,t3_uyv8kq,False,False,t3_uyv8kq,/r/UkraineConflict/comments/uyv8kq/what_do_we_think_of_the_kissinger_comments_why/ia6si6l/,1653656550,1,True,True,False,UkraineConflict,t5_30oyx,r/UkraineConflict,public,,0,[],,1653627733.0
[],False,,JimBobDwayne,,,[],,,,text,t2_aw31b,False,False,You’re utter fucking moron if you believe Putin motivation for this war was destroying “Nazis.”,d360d09c378528125ccec59dd54b2be2fbc0dbf3,True,False,,,,,0,1653656530,,0,{},ia6shyn,False,t3_uyqnf9,False,True,t1_ia64xh8,/r/UkraineConflict/comments/uyqnf9/arestovych_question_for_the_westdo_you_even_want/ia6shyn/,1653656543,1,True,True,False,UkraineConflict,t5_30oyx,r/UkraineConflict,public,,0,[],,1653627730.0
[],False,,kpapenbe,,,[],,,,text,t2_ixf7ljmz,False,False,"YOU NAILED IT!  But, sadly, you're right...if not this ya-blok-a...well perhaps one in the Baltics or Balkans or Caucuses or Middle East or Central Asia or....",35716b7054f7dfb87a98e194214a9fb9832934d2,True,False,,,,,0,1653656518,,0,{},ia6sh4p,True,t3_uyv8kq,False,True,t1_ia6s69e,/r/UkraineConflict/comments/uyv8kq/what_do_we_think_of_the_kissinger_comments_why/ia6sh4p/,1653656536,1,True,True,False,UkraineConflict,t5_30oyx,r/UkraineConflict,public,,0,[],,1653627718.0
[],False,,kpapenbe,,,[],,,,text,t2_ixf7ljmz,False,False,"So old and so dated and yet all the talking heads / pundits look to him for guidance...

Also, total tangent, I don't know why, but I keep thinking of Elizabeth Holmes and George Shultz and I just don't get HOW these elder statesmen have so much agency--ugh!",bb8b3e6c63476cb8bc6e848c02e5f7c97ab79ce6,True,False,,,,,0,1653656427,,0,{},ia6sapm,True,t3_uyv8kq,False,True,t1_ia6s291,/r/UkraineConflict/comments/uyv8kq/what_do_we_think_of_the_kissinger_comments_why/ia6sapm/,1653656445,1,True,True,False,UkraineConflict,t5_30oyx,r/UkraineConflict,public,,0,[],,1653627627.0
[],False,,CatgoesM00,,,[],,,,text,t2_2vnoz4er,False,False,"Optimistic, I hope it’s realistic",6c058ae77baf083464bad0b130e49c87c47646c7,True,False,,,,,0,1653656413,,0,{},ia6s9q9,False,t3_uyvap2,False,True,t1_ia6j7u2,/r/UkraineConflict/comments/uyvap2/really_600b_usd_to_rebuild_it_will_end_up_being/ia6s9q9/,1653656430,1,True,True,False,UkraineConflict,t5_30oyx,r/UkraineConflict,public,,0,[],,1653627613.0
[],False,,sunshinebread52,,,[],,,,text,t2_kwuj2fvf,False,False,Working for Nixon he did a great job with the Vietnam war.  His cease fire lasted about a week.  He wrote a book that recommended using tactical nukes to settle minor conflicts.  Let the Ukrainians decide how they want to end this war. The Russians will come back for another bite of the apple if they get to keep what they stole.  The old buzzard needs to just shut up and go away.,18b485d32a7bf80be72058e8266d900bd13e3e90,True,False,,,,,0,1653656365,,0,{},ia6s69e,False,t3_uyv8kq,False,False,t3_uyv8kq,/r/UkraineConflict/comments/uyv8kq/what_do_we_think_of_the_kissinger_comments_why/ia6s69e/,1653656376,1,True,True,False,UkraineConflict,t5_30oyx,r/UkraineConflict,public,,0,[],,1653627565.0
[],False,,Yankee_Juliet,,,[],,,,text,t2_6xxwfzts,False,False,Kissinger can fuck off.,259296d9b18a3661619abbe94d14d045da9e2a7f,True,False,,,,,0,1653656308,,0,{},ia6s291,False,t3_uyv8kq,False,True,t3_uyv8kq,/r/UkraineConflict/comments/uyv8kq/what_do_we_think_of_the_kissinger_comments_why/ia6s291/,1653656325,1,True,True,False,UkraineConflict,t5_30oyx,r/UkraineConflict,public,,0,[],,1653627508.0
[],False,,boxingdude,,,[],,,,text,t2_70mnp,False,False,looks more like an M777 Get the fuck outta here.,a952a0017aeda12b3618586fbeb54dab85767c83,True,False,,,,,0,1653656297,,0,{},ia6s1es,False,t3_uy505p,False,True,t1_ia2b5xj,/r/UkraineConflict/comments/uy505p/american_heavy_artillery_enters_the_fight_in/ia6s1es/,1653656318,1,True,True,False,UkraineConflict,t5_30oyx,r/UkraineConflict,public,,0,[],,1653627497.0
[],False,,Tigtig01,,,[],,,,text,t2_2ump0b6m,False,False,It’s blackmail and a lie . If Putin’s lips are moving he’s lying,65520574faa2465fb4b479d6d057f63eb06c6c8d,True,False,,,,,0,1653656279,,0,{},ia6s06f,False,t3_uy42om,False,True,t3_uy42om,/r/UkraineConflict/comments/uy42om/wait_russia_is_open_to_a_food_corridor_so_that/ia6s06f/,1653656319,1,True,True,False,UkraineConflict,t5_30oyx,r/UkraineConflict,public,,0,[],,1653627479.0
[],False,,kpapenbe,,,[],,,,text,t2_ixf7ljmz,False,False,HAHAHAHAH maybe it is in his little world....,de76d25a74daba89ad0c11ae865151aea25184dd,True,False,,,,,0,1653656272,,0,{},ia6rzq4,True,t3_uyv8kq,False,True,t1_ia6lhfc,/r/UkraineConflict/comments/uyv8kq/what_do_we_think_of_the_kissinger_comments_why/ia6rzq4/,1653656289,1,True,True,False,UkraineConflict,t5_30oyx,r/UkraineConflict,public,,0,[],,1653627472.0
[],False,,blue_kit_kat,,,[],,,,text,t2_gofmyd6f,False,False,Could it swore the US sent them a few dozen of those things a couple weeks ago guess I misread something,c70176033baf8dd59b82c2b979c08be90327c04b,True,False,,,,,0,1653655956,,0,{},ia6rdw8,False,t3_uyqnf9,False,True,t1_ia5rjg7,/r/UkraineConflict/comments/uyqnf9/arestovych_question_for_the_westdo_you_even_want/ia6rdw8/,1653655970,1,True,True,False,UkraineConflict,t5_30oyx,r/UkraineConflict,public,,0,[],,1653627156.0
[],False,,Faromme,,,[],,,,text,t2_5k1kzdje,False,False,"Not only that Ukraine will be modernized, the USSR will be in recession for many many years to come, because of their prette bad choices.",c9bfa1ce171e6d46a393c5aaa1de419283c56bc8,True,False,,,,,0,1653655791,,0,{},ia6r2lx,False,t3_uyvap2,False,True,t3_uyvap2,/r/UkraineConflict/comments/uyvap2/really_600b_usd_to_rebuild_it_will_end_up_being/ia6r2lx/,1653655803,1,True,True,False,UkraineConflict,t5_30oyx,r/UkraineConflict,public,,0,[],,1653626991.0
[],False,,zeppelingyrl,,,[],,,,text,t2_b4kigsy1,False,False,"Strange. I got a ""Racoon city"" vibe when I watched that.",b0d394a37bd6a830008879b82d6e65c03da74a2a,True,False,,,,,0,1653653824,,0,{},ia6nis5,False,t3_uy934w,False,True,t3_uy934w,/r/UkraineConflict/comments/uy934w/mariupol_ukraine_ruined_city_these_days_a/ia6nis5/,1653653838,1,True,True,False,UkraineConflict,t5_30oyx,r/UkraineConflict,public,,0,[],,1653625024.0
[],False,,Best-Wall-925,,,[],,,,text,t2_chhctyj5,False,False,Everything is on the table at this point,74a009548d8a3ce66fcd98ac2b35fc4af094505c,True,False,,,,,0,1653653657,,0,{},ia6n8he,False,t3_uyvap2,False,True,t3_uyvap2,/r/UkraineConflict/comments/uyvap2/really_600b_usd_to_rebuild_it_will_end_up_being/ia6n8he/,1653653672,1,True,True,False,UkraineConflict,t5_30oyx,r/UkraineConflict,public,,0,[],,1653624857.0
[],False,,Happy_Natural_7345,,,[],,,,text,t2_k2iug2xz,False,False,Senility,eacd9efec4c56ed40452a0ab5583e3216a80e7c6,True,False,,,,,0,1653653631,,0,{},ia6n6w3,False,t3_uyv8kq,False,True,t3_uyv8kq,/r/UkraineConflict/comments/uyv8kq/what_do_we_think_of_the_kissinger_comments_why/ia6n6w3/,1653653642,1,True,True,False,UkraineConflict,t5_30oyx,r/UkraineConflict,public,,0,[],,1653624831.0
[],False,,CeithreSeasuir,,,[],,,,text,t2_lemiq2jh,False,False,"If propaganda and imperialism bother you, why are you so eager to turn a blind eye to Russian aggression, imperialism and subjugation. If a world beyond war and empire is the goal, you need to be able to condemn the belligerent here.",2f34ae80802869b2b5a0bc67a8d12410416664a6,True,False,,,,,0,1653652810,,0,{},ia6lt97,False,t3_uyv8kq,False,True,t1_ia6hpow,/r/UkraineConflict/comments/uyv8kq/what_do_we_think_of_the_kissinger_comments_why/ia6lt97/,1653652824,1,True,True,False,UkraineConflict,t5_30oyx,r/UkraineConflict,public,,0,[],,1653624010.0
[],False,,Candid-Ad2838,,,[],,,,text,t2_9hi1am4s,False,True,Well generally democracies attack dictators and dictators will attack democracies so I guess getting attacked by Putin is like the ultimate validation you're on the right track. Asl all this guy does is spout what aboutisms like it's 1968.,06b4ac13cc264eceeb6dd5cf1a592b17116edba0,True,False,,,,,0,1653652607,,0,{},ia6lhfc,False,t3_uyv8kq,False,True,t1_ia6ibd0,/r/UkraineConflict/comments/uyv8kq/what_do_we_think_of_the_kissinger_comments_why/ia6lhfc/,1653652623,1,True,True,False,UkraineConflict,t5_30oyx,r/UkraineConflict,public,,0,[],,1653623807.0
[],False,,CeithreSeasuir,,,[],,,,text,t2_lemiq2jh,False,False,"Which side imprisons people for expressing views they don't want to hear? In RussianWorld, people are more abused, disposable and have fewer options than people elsewhere. The Russians are primarily grinding themselves and especially their children's futures into the ground.",633a0e37cb3074380afcc946413f81c05dcfa41d,True,False,,,,,0,1653652155,,0,{},ia6kr9n,False,t3_uyv8kq,False,True,t1_ia6ffc0,/r/UkraineConflict/comments/uyv8kq/what_do_we_think_of_the_kissinger_comments_why/ia6kr9n/,1653652168,1,True,True,False,UkraineConflict,t5_30oyx,r/UkraineConflict,public,,0,[],,1653623355.0
[],False,,TaviscaronLT,,,[],,,,text,t2_ka09hb0,False,False,"Yes, it will be. Tapinas and his organization have already completed several fundraising attempts for Ukraine - armor, Estonian reconnaissance drones, etc. The idea about purchasing Bayraktar has been discussed upon completion of the last fundraiser, talked through with Lithuanian/Turkish authorities and Bayraktar manufacturers.",6eef73d02a9677f63813b19529fbc9b1bef1e72c,True,False,,,,,0,1653651831,,0,{},ia6k8ts,False,t3_uysk9r,False,True,t1_ia63bpd,/r/UkraineConflict/comments/uysk9r/andrius_tapinasin_the_quest_for_bayraktar_2_594/ia6k8ts/,1653651842,1,True,True,False,UkraineConflict,t5_30oyx,r/UkraineConflict,public,,0,[],,1653623031.0
[],False,,kpapenbe,,,[],,,,text,t2_ixf7ljmz,False,False,TYFS!!!!,14eaba0f8834686169602b34d69127f25db416e4,True,False,,,,,0,1653651536,,0,{},ia6js91,True,t3_uyvap2,False,True,t1_ia6jnih,/r/UkraineConflict/comments/uyvap2/really_600b_usd_to_rebuild_it_will_end_up_being/ia6js91/,1653651547,1,True,True,False,UkraineConflict,t5_30oyx,r/UkraineConflict,public,,0,[],,1653622736.0
[],False,,kpapenbe,,,[],,,,text,t2_ixf7ljmz,False,False,I HOPE YOU'RE RIGHT!!!,51f5718e6a6d90c73da87ed6c2cdd8e7b0e07474,True,False,,,,,0,1653651523,,0,{},ia6jrj2,True,t3_uyvap2,False,False,t1_ia6j7u2,/r/UkraineConflict/comments/uyvap2/really_600b_usd_to_rebuild_it_will_end_up_being/ia6jrj2/,1653651539,1,True,True,False,UkraineConflict,t5_30oyx,r/UkraineConflict,public,,0,[],,1653622723.0
[],False,,rentest,,,[],,,,text,t2_jslfhf37,False,False,"yes thats the gameplan

see Arestovich explanation - he predicted a full scale war in 2019 and says it will drag to 2035 

https://www.youtube.com/watch?v=1xNHmHpERH8&amp;t=260s",517e23553afca4734880d337ba99c2de17d8246b,True,False,,,,,0,1653651449,,0,{},ia6jnih,False,t3_uyvap2,False,True,t3_uyvap2,/r/UkraineConflict/comments/uyvap2/really_600b_usd_to_rebuild_it_will_end_up_being/ia6jnih/,1653651467,1,True,True,False,UkraineConflict,t5_30oyx,r/UkraineConflict,public,,0,[],,1653622649.0
[],False,,Candid-Ad2838,,,[],,,,text,t2_9hi1am4s,False,True,If there is one thing that Americans are united on is Henry Kissinger can go fuck himself.,02354aaf0bdf87326cb7ae5204af4c56926adb1b,True,False,,,,,0,1653651405,,0,{},ia6jl2z,False,t3_uyqnf9,False,True,t1_ia6forc,/r/UkraineConflict/comments/uyqnf9/arestovych_question_for_the_westdo_you_even_want/ia6jl2z/,1653651416,1,True,True,False,UkraineConflict,t5_30oyx,r/UkraineConflict,public,,0,[],,1653622605.0
[],False,,FarAcanthocephala,,,[],,,,text,t2_1lizsof1,False,False,Just pointing out that the owner of this twitter account is not actually in Ukraine.,095cfe5390299cc9e37d2ecadefa5ba6c279af3d,True,False,,,,,0,1653651360,,0,{},ia6jimx,False,t3_uysdf8,False,True,t3_uysdf8,/r/UkraineConflict/comments/uysdf8/canadian_ukrainian_volunteer_on_twitterthread/ia6jimx/,1653651373,1,True,True,False,UkraineConflict,t5_30oyx,r/UkraineConflict,public,,0,[],,1653622560.0
[],False,,Hartvigson,,,[],,,,text,t2_fvipc,False,False,"The rebuilding will generate a lot of business once this is all done. Ukraine will end up with a very modern country with new infrastructure and buildings and hopefully Russia will pay for it all. Not that it in any way compensates for all the suffering but Ukraine might do a huge leap forward and be a very different country in 5-10 years from now, like Germany and Japan after WW2. 

Russia will just slide backwards and end up worse than before, a pariah of the world. I think we had our shot at reform and a modern Russia in 1991 and sadly missed it due to corruption etc. Next leader needs to be a modern and honest person, willing to clean up the mess and root out corruption. What we will get is most likely  somebody  tough enough to manage to grab the power and cheat in the elections and then we will have yet another 5 cent dictator there. I see no positive outcome for Russia.",6e890547e829093bbc6bcc840e8564ad12c74033,True,False,,,,,0,1653651165,,0,{},ia6j7u2,False,t3_uyvap2,False,True,t3_uyvap2,/r/UkraineConflict/comments/uyvap2/really_600b_usd_to_rebuild_it_will_end_up_being/ia6j7u2/,1653651176,1,True,True,False,UkraineConflict,t5_30oyx,r/UkraineConflict,public,,0,[],,1653622365.0
[],False,,kpapenbe,,,[],,,,text,t2_ixf7ljmz,False,False,HEAR HEAR!  Putin made some comments about luxury goods still flowing into the country--who is still selling in RU?,a79e281f311d6d59d197a55f30693279d053e263,True,False,,,,,0,1653650619,,0,{},ia6ietu,True,t3_uyvap2,False,True,t1_ia6hm3w,/r/UkraineConflict/comments/uyvap2/really_600b_usd_to_rebuild_it_will_end_up_being/ia6ietu/,1653650630,1,True,True,False,UkraineConflict,t5_30oyx,r/UkraineConflict,public,,0,[],,1653621819.0
[],False,,theprufeshanul,#a06324,,[],afa65fb4-a101-11ec-9a63-02a4aa3dad09,Kremlin Propagandist ,light,text,t2_4pe5n7p,False,False,"Yeah yeah - there’s only one point of view and that’s whatever the White House tells you.

Anything else is paid propaganda - that’s how the world works.",a67d7617bffa77625d90ecaa5ca6b504ca30c083,True,False,,,,,0,1653650612,,0,{},ia6ieha,False,t3_uyqnf9,False,True,t1_ia6hrt5,/r/UkraineConflict/comments/uyqnf9/arestovych_question_for_the_westdo_you_even_want/ia6ieha/,1653650623,1,True,True,False,UkraineConflict,t5_30oyx,r/UkraineConflict,public,,0,[],,1653621812.0
[],False,,kpapenbe,,,[],,,,text,t2_ixf7ljmz,False,False,HEAR HEAR!  Get India and China on side!,85dd3d9b284f2048bea3cc2183dc3ebbecd2a4d7,True,False,,,,,0,1653650590,,0,{},ia6idcx,True,t3_uyvap2,False,True,t1_ia6hv55,/r/UkraineConflict/comments/uyvap2/really_600b_usd_to_rebuild_it_will_end_up_being/ia6idcx/,1653650602,1,True,True,False,UkraineConflict,t5_30oyx,r/UkraineConflict,public,,0,[],,1653621790.0
[],False,,kpapenbe,,,[],,,,text,t2_ixf7ljmz,False,False,"Sadam Gadhafi Assad....they MURDERED their people and needed/need to be stopped...

What did Zelenskii do, bruh?",bf3a46d8565ffb2d2b86ee1e41397ffdd124a493,True,False,,,,,0,1653650551,,0,{},ia6ibd0,True,t3_uyv8kq,False,True,t1_ia6hpow,/r/UkraineConflict/comments/uyv8kq/what_do_we_think_of_the_kissinger_comments_why/ia6ibd0/,1653650567,1,True,True,False,UkraineConflict,t5_30oyx,r/UkraineConflict,public,,0,[],,1653621751.0
[],False,,kpapenbe,,,[],,,,text,t2_ixf7ljmz,False,False,You bring up a good point....who pays?  It's not like you just hand Russia the bill....,6af2d046cbb08d08d8dab17994a5a53fa5b33112,True,False,,,,,0,1653650460,,0,{},ia6i6my,True,t3_uyvap2,False,False,t1_ia6hptq,/r/UkraineConflict/comments/uyvap2/really_600b_usd_to_rebuild_it_will_end_up_being/ia6i6my/,1653650473,1,True,True,False,UkraineConflict,t5_30oyx,r/UkraineConflict,public,,0,[],,1653621660.0
[],False,,LovesReddit2023,,,[],,,,text,t2_j2dziqv2,False,False,Agree 100%. We need every country on board. Europe and USA need to tell countries that still trade with Russia that doing so will get an embargo from both groups on their products and resources. And that embargo goes both ways.,a1f2f27e46a6c2caeb3eb6c43e2ebc2464639034,True,False,,,,,0,1653650241,,0,{},ia6hv55,False,t3_uyvap2,False,True,t1_ia6hm3w,/r/UkraineConflict/comments/uyvap2/really_600b_usd_to_rebuild_it_will_end_up_being/ia6hv55/,1653650258,1,True,True,False,UkraineConflict,t5_30oyx,r/UkraineConflict,public,,0,[],,1653621441.0
[],False,,codespair,,,[],,,,text,t2_113ckg,False,False,How much are they paying you?,7e5c9b14b296726212ff6329da76f3bf85365e91,True,False,,,,,0,1653650175,,0,{},ia6hrt5,False,t3_uyqnf9,False,True,t1_ia6giln,/r/UkraineConflict/comments/uyqnf9/arestovych_question_for_the_westdo_you_even_want/ia6hrt5/,1653650186,1,True,True,False,UkraineConflict,t5_30oyx,r/UkraineConflict,public,,0,[],,1653621375.0
[],False,,LovesReddit2023,,,[],,,,text,t2_j2dziqv2,False,False,Maybe western countries should stop paying Russia for its oil and natural gas and instead send the money to rebuild Ukraine?  Let Russia keep supplying the gas and oil but not see any money out of it until Ukraine is rebuilt. The. And only then lift sanctions off Russia.,aff6643e8aa6c6b73a8d19292a0610e1726fa8a3,True,False,,,,,0,1653650136,,0,{},ia6hptq,False,t3_uyvap2,False,True,t3_uyvap2,/r/UkraineConflict/comments/uyvap2/really_600b_usd_to_rebuild_it_will_end_up_being/ia6hptq/,1653650149,1,True,True,False,UkraineConflict,t5_30oyx,r/UkraineConflict,public,,0,[],,1653621336.0
[],False,,theprufeshanul,#a06324,,[],afa65fb4-a101-11ec-9a63-02a4aa3dad09,Kremlin Propagandist ,light,text,t2_4pe5n7p,False,False,"LOL Hitler 2.0? 

Shows how much propaganda you swallow.

Why aren’t the Americans “Hitler 2.0”? 

Has Putin done anything close to what they did in Iraq? Libya? Syria? Yemen?

Facts bro.",70fd12b022ebabbea0342e4dc0effd8f8c8ce9e2,True,False,,,,,0,1653650133,,0,{},ia6hpow,False,t3_uyv8kq,False,True,t1_ia6h91q,/r/UkraineConflict/comments/uyv8kq/what_do_we_think_of_the_kissinger_comments_why/ia6hpow/,1653650150,1,True,True,False,UkraineConflict,t5_30oyx,r/UkraineConflict,public,,0,[],,1653621333.0
[],False,,DamianLuis,,,[],,,,text,t2_kqe88mnh,False,False,"IMHO it is extremely important to increase the cost of war for Russia with every day that it goes on. This includes the confiscation of frozen Russian assets around the world and their dedication to the reconstruction of Ukraine, but also even tighter economic sanctions.  
Shame on any company which continues to make business with Russia.",ad074ccfa10f54d5a0248ae2501e2216a9554f40,True,False,,,,,0,1653650063,,0,{},ia6hm3w,False,t3_uyvap2,False,True,t3_uyvap2,/r/UkraineConflict/comments/uyvap2/really_600b_usd_to_rebuild_it_will_end_up_being/ia6hm3w/,1653650079,1,True,True,False,UkraineConflict,t5_30oyx,r/UkraineConflict,public,,0,[],,1653621263.0
[],False,,kpapenbe,,,[],,,,text,t2_ixf7ljmz,False,False,"If by understand you mean he's cool with Hitler 2.0, then, er, yea, I guess.....",4ef951e078b0a678595e4bc600cf2bbd295a5b30,True,False,,,,,0,1653649809,,0,{},ia6h91q,True,t3_uyv8kq,False,True,t1_ia6ffc0,/r/UkraineConflict/comments/uyv8kq/what_do_we_think_of_the_kissinger_comments_why/ia6h91q/,1653649821,1,True,True,False,UkraineConflict,t5_30oyx,r/UkraineConflict,public,,0,[],,1653621009.0
[],False,,kpapenbe,,,[],,,,text,t2_ixf7ljmz,False,False,I think it's what happens after they hit the port or before...is there even infrastructure around the port?  Warehouses or roads?  Likely no or at least not in good condition....,48499cebe04223922023bcaa716986de731626e6,True,False,,,,,0,1653649768,,0,{},ia6h70c,True,t3_uy42om,False,True,t1_ia6gsi5,/r/UkraineConflict/comments/uy42om/wait_russia_is_open_to_a_food_corridor_so_that/ia6h70c/,1653649786,1,True,True,False,UkraineConflict,t5_30oyx,r/UkraineConflict,public,,0,[],,1653620968.0
[],False,,Colin_Charteris,,,[],,,,text,t2_k48g8du1,False,False,"Good bless you god sir on this vibrant day! I am Dr. Bakare Tunde, the cousin of Nigerian Astronaut, Air Force Major Abacha Tunde. He was the first African in space when he made a secret flight to the Salyut 6 space station in 1979. He was on a later Soviet spaceflight, Soyuz T-16Z to the secret Soviet military space station Salyut 8T in 1989. He was stranded there in 1990 when the Soviet Union was dissolved. His other Soviet crew members returned to earth on the Soyuz T-16Z, but his place was taken up by return cargo. There have been occasional Progrez supply flights to keep him going since that time. He is in good humor, but wants to come home.",3838d70027e474631352507bb245a29eead0566d,True,False,,,,,0,1653649652,,0,{},ia6h174,False,t3_uysk9r,False,True,t1_ia677sp,/r/UkraineConflict/comments/uysk9r/andrius_tapinasin_the_quest_for_bayraktar_2_594/ia6h174/,1653649667,1,True,True,False,UkraineConflict,t5_30oyx,r/UkraineConflict,public,,0,[],,1653620852.0
[],False,,Magnus_Inebrius,,,[],,,,text,t2_mienl,False,False,Still don't understand why NATO ships can't create a safe shipping route for international bulk cargo vessels to enter and exit the port of Odessa safely.,1d28d980be4db9fad703caa036efec64bb0826d7,True,False,,,,,0,1653649482,,0,{},ia6gsi5,False,t3_uy42om,False,True,t1_ia5ubeh,/r/UkraineConflict/comments/uy42om/wait_russia_is_open_to_a_food_corridor_so_that/ia6gsi5/,1653649494,1,True,True,False,UkraineConflict,t5_30oyx,r/UkraineConflict,public,,0,[],,1653620682.0
[],False,,theprufeshanul,#a06324,,[],afa65fb4-a101-11ec-9a63-02a4aa3dad09,Kremlin Propagandist ,light,text,t2_4pe5n7p,False,False,"LOL, the Russians will blow up the MLRS before they get to the front line. 

Either that, or capture them as they have with huge amounts of other equipment.

Even if they're not intercepted or captured who exactly are they going to be given to?

Thanks to Zelensky and Biden's idiocy the Ukrainian troops are being killed or are surrendering at a horrific rate.

I hope for their sake you stop believing in fairy tales.",c5738314ea7003da461c5964e564f04a0ecf6881,True,False,,,,,0,1653649292,,0,{},ia6giln,False,t3_uyqnf9,False,True,t1_ia5rjg7,/r/UkraineConflict/comments/uyqnf9/arestovych_question_for_the_westdo_you_even_want/ia6giln/,1653649306,1,True,True,False,UkraineConflict,t5_30oyx,r/UkraineConflict,public,,0,[],,1653620492.0
[],False,,Cautious-Computer547,,,[],,,,text,t2_f5r87b8d,False,False,"Shoot and scoot boys, shoot and scoot!

Hopefully they can hit the lines of Russians throughout the luhansk and Doncaster areas making it difficult for then to encircle the ukranians",44284f0b59d2de8349ec17d5bf5bd401ec22e6b7,True,False,,,,,0,1653649241,,0,{},ia6gfwg,False,t3_uyv0s6,False,True,t3_uyv0s6,/r/UkraineConflict/comments/uyv0s6/ukraine_news_live_us_set_to_send_longrange/ia6gfwg/,1653649255,1,True,True,False,UkraineConflict,t5_30oyx,r/UkraineConflict,public,,0,[],,1653620441.0
[],False,,theprufeshanul,#a06324,,[],afa65fb4-a101-11ec-9a63-02a4aa3dad09,Kremlin Propagandist ,light,text,t2_4pe5n7p,False,False,"LOL keep swallowing the bullshit my fren.

Sit back and see what happens.

Even the Americans are now beginning to push back against Biden's disastrous policies - see what the New York Times  and Henry Kissinger have to say.

Above all, WAKE UP.

The American Defence Secretary contacted the Russians last week demanding a ceasefire. Ask yourself why they would be doing that if the Russians were losing.",52b65866f35fd1afda6fc1a857eea203f61a74bf,True,False,,,,,0,1653648693,,0,{},ia6forc,False,t3_uyqnf9,False,True,t1_ia67s5z,/r/UkraineConflict/comments/uyqnf9/arestovych_question_for_the_westdo_you_even_want/ia6forc/,1653648706,1,True,True,False,UkraineConflict,t5_30oyx,r/UkraineConflict,public,,0,[],,1653619893.0
