all_awardings,archived,associated_award,author,author_flair_background_color,author_flair_css_class,author_flair_richtext,author_flair_template_id,author_flair_text,author_flair_text_color,author_flair_type,author_fullname,author_patreon_flair,author_premium,body,body_sha1,can_gild,collapsed,collapsed_because_crowd_control,collapsed_reason,collapsed_reason_code,comment_type,controversiality,created_utc,distinguished,gilded,gildings,id,is_submitter,link_id,locked,no_follow,parent_id,permalink,retrieved_utc,score,score_hidden,send_replies,stickied,subreddit,subreddit_id,subreddit_name_prefixed,subreddit_type,top_awarded_type,total_awards_received,treatment_tags,unrepliable_reason,created
[],False,,theprufeshanul,#a06324,,[],afa65fb4-a101-11ec-9a63-02a4aa3dad09,Kremlin Propagandist ,light,text,t2_4pe5n7p,False,False,"What bit don’t you understand?

It’s America trying to in prison Assange for exposing their war crimes not Russia.

Do you need it acted out with sock puppets bruh?",43b3646e955a52edf50a2871d739eede6b967a38,True,False,,,,,0,1653670657,,0,{},ia7pdc8,False,t3_uyv8kq,False,True,t1_ia7oauk,/r/UkraineConflict/comments/uyv8kq/what_do_we_think_of_the_kissinger_comments_why/ia7pdc8/,1653670671,1,True,True,False,UkraineConflict,t5_30oyx,r/UkraineConflict,public,,0,[],,1653641857.0
[],False,,theprufeshanul,#a06324,,[],afa65fb4-a101-11ec-9a63-02a4aa3dad09,Kremlin Propagandist ,light,text,t2_4pe5n7p,False,False,"Yeah but in dragging it out you’ve directly caused harm to lives and infrastructure. 

So you should pay. Choices have consequences.",e105153eeb7b9b7f565bb55a3af4c8e318de9394,True,False,,,,,0,1653670597,,0,{},ia7p7yf,False,t3_uyvap2,False,True,t1_ia7mhz1,/r/UkraineConflict/comments/uyvap2/really_600b_usd_to_rebuild_it_will_end_up_being/ia7p7yf/,1653670611,1,True,True,False,UkraineConflict,t5_30oyx,r/UkraineConflict,public,,0,[],,1653641797.0
[],False,,d1ndeed,,,[],,,,text,t2_4tgloc15,False,False,In the cold pragmatic practices of realpolitik it is. I didn't listen to his comments and Id be surprised if he buys into any of Putins bullshit but I wouldnt be surprised if he does agree  with Putins/Lavrov rhetoric on a multipolar world.,f1e280728849420cba2e27a996a9055e0385c98e,True,False,,,,,0,1653670493,,0,{},ia7oytd,False,t3_uyv8kq,False,True,t1_ia7n5kr,/r/UkraineConflict/comments/uyv8kq/what_do_we_think_of_the_kissinger_comments_why/ia7oytd/,1653670509,1,True,True,False,UkraineConflict,t5_30oyx,r/UkraineConflict,public,,0,[],,1653641693.0
[],False,,theprufeshanul,#a06324,,[],afa65fb4-a101-11ec-9a63-02a4aa3dad09,Kremlin Propagandist ,light,text,t2_4pe5n7p,False,False,You prolonged the conflict so why should t you pay for it?,9c84e890cfe41dba153f164487b322c09cd4ee26,True,False,,,,,0,1653670477,,0,{},ia7oxh3,False,t3_uyvap2,False,True,t1_ia7ehsv,/r/UkraineConflict/comments/uyvap2/really_600b_usd_to_rebuild_it_will_end_up_being/ia7oxh3/,1653670494,1,True,True,False,UkraineConflict,t5_30oyx,r/UkraineConflict,public,,0,[],,1653641677.0
[],False,,theprufeshanul,#a06324,,[],afa65fb4-a101-11ec-9a63-02a4aa3dad09,Kremlin Propagandist ,light,text,t2_4pe5n7p,False,False,You prolonged the conflict bro. Now you should pay for doing so.,75029078d2ac761603e7a4f17bb6d6bf49f046c7,True,False,,,,,0,1653670451,,0,{},ia7ov5l,False,t3_uyvap2,False,True,t1_ia7ehsv,/r/UkraineConflict/comments/uyvap2/really_600b_usd_to_rebuild_it_will_end_up_being/ia7ov5l/,1653670469,1,True,True,False,UkraineConflict,t5_30oyx,r/UkraineConflict,public,,0,[],,1653641651.0
[],False,,theprufeshanul,#a06324,,[],afa65fb4-a101-11ec-9a63-02a4aa3dad09,Kremlin Propagandist ,light,text,t2_4pe5n7p,False,False,"“free countries” overthrew their democratic government in 2014 in a violent coup bro.

Crack open a book sometime it’s good for you.",ef1b9abcb6342b0fef42036551fc67ee88940732,True,False,,,,,0,1653670392,,0,{},ia7opw4,False,t3_uyvap2,False,True,t1_ia714ue,/r/UkraineConflict/comments/uyvap2/really_600b_usd_to_rebuild_it_will_end_up_being/ia7opw4/,1653670406,1,True,True,False,UkraineConflict,t5_30oyx,r/UkraineConflict,public,,0,[],,1653641592.0
[],False,,KingStarscream91,,,[],,,,text,t2_8ts44n5p,False,False,"An impressive feat of mental gymnastics.

Russian isn't even a race. It's a nationality.",9afaea23bde86363ab203af09f3263f557b6409f,True,False,,,,,0,1653670291,,0,{},ia7oh57,False,t3_uyvap2,False,True,t1_ia7njub,/r/UkraineConflict/comments/uyvap2/really_600b_usd_to_rebuild_it_will_end_up_being/ia7oh57/,1653670303,1,True,True,False,UkraineConflict,t5_30oyx,r/UkraineConflict,public,,0,[],,1653641491.0
[],False,,elaintahra,,,[],,,,text,t2_ek5v6,False,False,They get to be the insurgents they always wanted to be after they saw them in Afghanistan :D,02fdc62ea82420efc65dd70fc970190cada6874d,True,False,,,,,0,1653670240,,0,{},ia7ockj,False,t3_uyz4jg,False,True,t3_uyz4jg,/r/UkraineConflict/comments/uyz4jg/this_is_how_american_joint_forces_volunteers_work/ia7ockj/,1653670257,1,True,True,False,UkraineConflict,t5_30oyx,r/UkraineConflict,public,,0,[],,1653641440.0
[],False,,CeithreSeasuir,,,[],,,,text,t2_lemiq2jh,False,False,"Your comment doesn't make any sense, is off topic and I'm not a bro.",2d2bb4abf2323fc2bf0596c181a24d6cae70ecac,True,False,,,,,0,1653670221,,0,{},ia7oauk,False,t3_uyv8kq,False,True,t1_ia7mzwe,/r/UkraineConflict/comments/uyv8kq/what_do_we_think_of_the_kissinger_comments_why/ia7oauk/,1653670233,1,True,True,False,UkraineConflict,t5_30oyx,r/UkraineConflict,public,,0,[],,1653641421.0
[],False,,kwagenknight,,,[],,,,text,t2_opzwo,False,False,"Yeah some in Congress thought it would be risky as Russia doesnt have as advanced stuff as the US does but then Canada sent 4 and a few other countries I believe also decided to send some with those advanced control units anyway so its kind of a moot point.

They should be sending them as to have a group of say 6 artillery pieces all connected to the same network and anti-battery radar system that can precisely hit and manage multiple targets at the same time would really help push back the Russians and help control the battlefield.

Its normal unfortunately for Congress to think they know better than their Generals but there is always a risk assessment going into figuring what can and cant be sent.",aea898d517012255f887c3958b00aaf0553b5f6c,True,False,,,,,0,1653670021,,0,{},ia7nt5z,False,t3_uy505p,False,True,t1_ia52ccx,/r/UkraineConflict/comments/uy505p/american_heavy_artillery_enters_the_fight_in/ia7nt5z/,1653670036,1,True,True,False,UkraineConflict,t5_30oyx,r/UkraineConflict,public,,0,[],,1653641221.0
[],False,,ericallenjett,,,[],,,,text,t2_2fikb5yc,False,False,SUCCESS!,6c690fcd76c878147a78a08f7f96898a67474b67,True,False,,,,,0,1653669984,,0,{},ia7npxr,False,t3_uywuov,False,True,t3_uywuov,/r/UkraineConflict/comments/uywuov/ukraine_foreign_legion_american_british_canadian/ia7npxr/,1653669996,1,True,True,False,UkraineConflict,t5_30oyx,r/UkraineConflict,public,,0,[],,1653641184.0
[],False,,Innocent__Bystander,,,[],,,,text,t2_758dc,False,False,An impressive double down on the racism.,ed101aef7e81e8e1ba7cd796fbb0c583808cc549,True,False,,,,,0,1653669915,,0,{},ia7njub,False,t3_uyvap2,False,True,t1_ia7ncfy,/r/UkraineConflict/comments/uyvap2/really_600b_usd_to_rebuild_it_will_end_up_being/ia7njub/,1653669933,1,True,True,False,UkraineConflict,t5_30oyx,r/UkraineConflict,public,,0,[],,1653641115.0
[],False,,Wonderful_Number_19,,,[],,,,text,t2_a2ezmxcj,False,False,"The hand that you are biting right now just gave you $40 Billion in aid. The rest of the world has given you more humanitarian, financial and military aid than you're entire GDP. A smart man would perhaps back-peddle his remarks.",4cf33201542203a4107399c0b9ed9e1a53999138,True,False,,,,,0,1653669901,,0,{},ia7nimu,False,t3_uyqnf9,False,True,t3_uyqnf9,/r/UkraineConflict/comments/uyqnf9/arestovych_question_for_the_westdo_you_even_want/ia7nimu/,1653669917,1,True,True,False,UkraineConflict,t5_30oyx,r/UkraineConflict,public,,0,[],,1653641101.0
[],False,,kpapenbe,,,[],,,,text,t2_ixf7ljmz,False,False,Or just experience....,f4c72a7244add5494c2e7ceeea15a49242218bc6,True,False,,,,,0,1653669886,,0,{},ia7nhba,True,t3_uyv8kq,False,True,t1_ia7k76x,/r/UkraineConflict/comments/uyv8kq/what_do_we_think_of_the_kissinger_comments_why/ia7nhba/,1653669901,1,True,True,False,UkraineConflict,t5_30oyx,r/UkraineConflict,public,,0,[],,1653641086.0
[],False,,KingStarscream91,,,[],,,,text,t2_8ts44n5p,False,False,I didn't mean to imply that they were good at being a warrior race.,01058163be35cdf15e7b7c10d42ab2eeae4fbe46,True,False,,,,,0,1653669831,,0,{},ia7ncfy,False,t3_uyvap2,False,True,t1_ia7m7je,/r/UkraineConflict/comments/uyvap2/really_600b_usd_to_rebuild_it_will_end_up_being/ia7ncfy/,1653669845,1,True,True,False,UkraineConflict,t5_30oyx,r/UkraineConflict,public,,0,[],,1653641031.0
[],False,,theprufeshanul,#a06324,,[],afa65fb4-a101-11ec-9a63-02a4aa3dad09,Kremlin Propagandist ,light,text,t2_4pe5n7p,False,False,"Sickening would be a better word.

And they knighted Tony Blair too. 

A million civilians dead - women and children.",6cc2f8de3ae85ca71b5b8d6d94f7cdd91c855c8d,True,False,,,,,0,1653669773,,0,{},ia7n7fp,False,t3_uyv8kq,False,True,t1_ia6z4ig,/r/UkraineConflict/comments/uyv8kq/what_do_we_think_of_the_kissinger_comments_why/ia7n7fp/,1653669792,1,True,True,False,UkraineConflict,t5_30oyx,r/UkraineConflict,public,,0,[],,1653640973.0
[],False,,kpapenbe,,,[],,,,text,t2_ixf7ljmz,False,False,OOO nice use of realpolitik there!,292e4493d4c2037388be0afcf913b896680e5cc4,True,False,,,,,0,1653669753,,0,{},ia7n5kr,True,t3_uyv8kq,False,True,t1_ia7knfq,/r/UkraineConflict/comments/uyv8kq/what_do_we_think_of_the_kissinger_comments_why/ia7n5kr/,1653669767,1,True,True,False,UkraineConflict,t5_30oyx,r/UkraineConflict,public,,0,[],,1653640953.0
[],False,,theprufeshanul,#a06324,,[],afa65fb4-a101-11ec-9a63-02a4aa3dad09,Kremlin Propagandist ,light,text,t2_4pe5n7p,False,False,Julian Assange is going to a Russian Supermax prison bro? You know the CIA had meetings about assassinating him right?,bee8cceda20fa3e3e033ebed455d557a033454da,True,False,,,,,0,1653669687,,0,{},ia7mzwe,False,t3_uyv8kq,False,True,t1_ia6kr9n,/r/UkraineConflict/comments/uyv8kq/what_do_we_think_of_the_kissinger_comments_why/ia7mzwe/,1653669706,1,True,True,False,UkraineConflict,t5_30oyx,r/UkraineConflict,public,,0,[],,1653640887.0
[],False,,Ozar06,,,[],,,,text,t2_9dnyqlyl,False,False,"We've supplied money, weapons and intelligence to help a sovern nation defend itself from tyrants. Fixed it for you.",04ff9d12b271fd5814538339d777f9c789a69f07,True,False,,,,,0,1653669484,,0,{},ia7mhz1,False,t3_uyvap2,False,True,t1_ia6wwxr,/r/UkraineConflict/comments/uyvap2/really_600b_usd_to_rebuild_it_will_end_up_being/ia7mhz1/,1653669503,1,True,True,False,UkraineConflict,t5_30oyx,r/UkraineConflict,public,,0,[],,1653640684.0
[],False,,Innocent__Bystander,,,[],,,,text,t2_758dc,False,False,"Sorry, what? Warrior race? That line of thought goes to the exact kind of places the Russian government is currently at.",0dcf17b014974bd8768aee082fb09f822475e576,True,False,,,,,0,1653669364,,0,{},ia7m7je,False,t3_uyvap2,False,True,t1_ia7la5w,/r/UkraineConflict/comments/uyvap2/really_600b_usd_to_rebuild_it_will_end_up_being/ia7m7je/,1653669383,1,True,True,False,UkraineConflict,t5_30oyx,r/UkraineConflict,public,,0,[],,1653640564.0
[],False,,KingStarscream91,,,[],,,,text,t2_8ts44n5p,False,False,There where always be a new Putin. The Russians have always been a warrior race since the days of Ivan the Terrible. Reminds me of the Saiyans.,d3d77208aeef4859611afcb0a26e6a8cb596499b,True,False,,,,,0,1653668983,,0,{},ia7la5w,False,t3_uyvap2,False,True,t1_ia6z0kj,/r/UkraineConflict/comments/uyvap2/really_600b_usd_to_rebuild_it_will_end_up_being/ia7la5w/,1653669002,1,True,True,False,UkraineConflict,t5_30oyx,r/UkraineConflict,public,,0,[],,1653640183.0
[],False,,d1ndeed,,,[],,,,text,t2_4tgloc15,False,False,Because that's Kissinger for you. It's not too surprising tbh. It is classic realpolitik.,981cd006d01549ae1a333801c4a32d9cbc4ff162,True,False,,,,,0,1653668730,,0,{},ia7knfq,False,t3_uyv8kq,False,True,t3_uyv8kq,/r/UkraineConflict/comments/uyv8kq/what_do_we_think_of_the_kissinger_comments_why/ia7knfq/,1653668749,1,True,True,False,UkraineConflict,t5_30oyx,r/UkraineConflict,public,,0,[],,1653639930.0
[],False,,KingStarscream91,,,[],,,,text,t2_8ts44n5p,False,False,"If somebody is wrong then they are wrong but don't bring age into it. If anything, you should respect their wisdom that often comes with age and experience.",182b18ac546067aa5dbb16a5bb023a97685032ea,True,False,,,,,0,1653668548,,0,{},ia7k76x,False,t3_uyv8kq,False,True,t1_ia6sapm,/r/UkraineConflict/comments/uyv8kq/what_do_we_think_of_the_kissinger_comments_why/ia7k76x/,1653668565,1,True,True,False,UkraineConflict,t5_30oyx,r/UkraineConflict,public,,0,[],,1653639748.0
[],False,,floofnstuff,,,[],,,,text,t2_16vu6d,False,False,People like you are why there isn’t even more support.  I’m sorry my tax dollars are helping people that find it so lacking.,ab6876d9609de0c35562cfeeeaf8ed9d410926e4,True,False,,,,,0,1653667909,,0,{},ia7imvh,False,t3_uyvap2,False,True,t1_ia7h1c8,/r/UkraineConflict/comments/uyvap2/really_600b_usd_to_rebuild_it_will_end_up_being/ia7imvh/,1653667926,1,True,True,False,UkraineConflict,t5_30oyx,r/UkraineConflict,public,,0,[],,1653639109.0
[],False,,smileymalaise,,,[],,,,text,t2_7ri8w,False,False,"it's literally a dictatorship and an oligarchy. what the fuck does this have to do with communism? if anything, this is a far-right government, not a leftist one.",e51e3d47050719a8d3aa9586b7df3063de1e5288,True,False,,,,,0,1653667825,,0,{},ia7ifd4,False,t3_uypx8l,False,True,t1_ia7fxbs,/r/UkraineConflict/comments/uypx8l/sbu_intercepted_call_i_dont_fcking_care_even_if/ia7ifd4/,1653667840,1,True,True,False,UkraineConflict,t5_30oyx,r/UkraineConflict,public,,0,[],,1653639025.0
[],False,,kpapenbe,,,[],,,,text,t2_ixf7ljmz,False,False,I \[know\] that they've been sending weapons to Poland and other frontline countries so that those countries can send their old items to Ukraine....it's indirect....,83262c9b6c79b656fb87bea9b807649c1cdc2fa9,True,False,,,,,0,1653667261,,0,{},ia7h1c8,True,t3_uyvap2,False,True,t1_ia7gryg,/r/UkraineConflict/comments/uyvap2/really_600b_usd_to_rebuild_it_will_end_up_being/ia7h1c8/,1653667273,1,True,True,False,UkraineConflict,t5_30oyx,r/UkraineConflict,public,,0,[],,1653638461.0
[],False,,kpapenbe,,,[],,,,text,t2_ixf7ljmz,False,False,And yet he keeps showing up on TV....argh!,55084b03461b095483f10ca22b032ddbba4d7c62,True,False,,,,,0,1653667180,,0,{},ia7gu0h,True,t3_uyv8kq,False,True,t1_ia7g4ds,/r/UkraineConflict/comments/uyv8kq/what_do_we_think_of_the_kissinger_comments_why/ia7gu0h/,1653667196,1,True,True,False,UkraineConflict,t5_30oyx,r/UkraineConflict,public,,0,[],,1653638380.0
[],False,,floofnstuff,,,[],,,,text,t2_16vu6d,False,False,"The US and EU have done nothing since the invasion of Ukraine in February? Really? The US has provided $54 Billion so far and and I won’t even mention the weapons. 

How do you not no this?",074d90cef019f6723e0095ca2140d6e61587a3cb,True,False,,,,,0,1653667156,,0,{},ia7gryg,False,t3_uyvap2,False,True,t1_ia7f9nq,/r/UkraineConflict/comments/uyvap2/really_600b_usd_to_rebuild_it_will_end_up_being/ia7gryg/,1653667172,1,True,True,False,UkraineConflict,t5_30oyx,r/UkraineConflict,public,,0,[],,1653638356.0
[],False,,[deleted],,,,,,dark,,,,,[deleted],228f7d207920fb84335fac5b2b06ed7b472ece9e,True,False,,,,,0,1653666970,,0,{},ia7gbku,False,t3_uy505p,False,True,t1_ia6s1es,/r/UkraineConflict/comments/uy505p/american_heavy_artillery_enters_the_fight_in/ia7gbku/,1653666989,1,True,True,False,UkraineConflict,t5_30oyx,r/UkraineConflict,public,,0,[],,1653638170.0
[],False,,AxelJShark,,,[],,,,text,t2_6324ybwh,False,False,He hasn't been relevant for decades,3487471f969cbd41e98e6fceebadbe0560070cab,True,False,,,,,0,1653666888,,0,{},ia7g4ds,False,t3_uyv8kq,False,True,t3_uyv8kq,/r/UkraineConflict/comments/uyv8kq/what_do_we_think_of_the_kissinger_comments_why/ia7g4ds/,1653666900,1,True,True,False,UkraineConflict,t5_30oyx,r/UkraineConflict,public,,0,[],,1653638088.0
[],False,,YourNansDirtBox,,,[],,,,text,t2_d8objja,False,False,"That's just normal ruZZians noises, they all sound like that, no more or less sociopathic than any other ruscist, there nation is communist, this is what communism does to people, turns them into demons.",24eadf88951f88d01e2f5ac689b1d8a06e3d7674,True,False,,,,,0,1653666808,,0,{},ia7fxbs,False,t3_uypx8l,False,True,t1_ia6tubj,/r/UkraineConflict/comments/uypx8l/sbu_intercepted_call_i_dont_fcking_care_even_if/ia7fxbs/,1653666821,1,True,True,False,UkraineConflict,t5_30oyx,r/UkraineConflict,public,,0,[],,1653638008.0
[],False,,kpapenbe,,,[],,,,text,t2_ixf7ljmz,False,False,MUAHAHAHHAHA,3755b9d875054cdbbca38216a668ff32765edde4,True,False,,,,,0,1653666549,,0,{},ia7fahg,True,t3_uyv8kq,False,True,t1_ia7eae3,/r/UkraineConflict/comments/uyv8kq/what_do_we_think_of_the_kissinger_comments_why/ia7fahg/,1653666564,1,True,True,False,UkraineConflict,t5_30oyx,r/UkraineConflict,public,,0,[],,1653637749.0
[],False,,kpapenbe,,,[],,,,text,t2_ixf7ljmz,False,False,Isn't that what the US/EU has been doing?,6729007f8b9ae5b8b449d23f1f4459a2e0d216a0,True,False,,,,,0,1653666539,,0,{},ia7f9nq,True,t3_uyvap2,False,True,t1_ia7ercs,/r/UkraineConflict/comments/uyvap2/really_600b_usd_to_rebuild_it_will_end_up_being/ia7f9nq/,1653666556,1,True,True,False,UkraineConflict,t5_30oyx,r/UkraineConflict,public,,0,[],,1653637739.0
[],False,,kpapenbe,,,[],,,,text,t2_ixf7ljmz,False,False,"Good point....and then it will be ""business as usual""",5337b4293faec9ac055ef80b3c9044a08a7fd0e1,True,False,,,,,0,1653666398,,0,{},ia7exhl,True,t3_uyvap2,False,True,t1_ia78svs,/r/UkraineConflict/comments/uyvap2/really_600b_usd_to_rebuild_it_will_end_up_being/ia7exhl/,1653666414,1,True,True,False,UkraineConflict,t5_30oyx,r/UkraineConflict,public,,0,[],,1653637598.0
[],False,,floofnstuff,,,[],,,,text,t2_16vu6d,False,False,"Would it had been better for the people of Ukraine and their infrastructure had the US, EU and NATO countries done nothing?",58b514c18bdbabe849dd7ba6642330420c71e035,True,False,,,,,0,1653666327,,0,{},ia7ercs,False,t3_uyvap2,False,True,t1_ia6u4v2,/r/UkraineConflict/comments/uyvap2/really_600b_usd_to_rebuild_it_will_end_up_being/ia7ercs/,1653666341,1,True,True,False,UkraineConflict,t5_30oyx,r/UkraineConflict,public,,0,[],,1653637527.0
[],False,,AlarmingBlacksmith60,,,[],,,,text,t2_9gh6bqjx,False,False,"""Despite the war the harvest conditions don’t look that dire. That could really mean there's not enough storage capacity in Ukraine, particularly if there's no wheat corridor opening up for export from Ukraine.""",be942ba825c4959a7b3f87c744be9c40c4cc557c,True,False,,,,,0,1653666300,,0,{},ia7ep0c,False,t3_uxx18c,False,True,t1_ia7dloc,/r/UkraineConflict/comments/uxx18c/the_us_state_department_has_said_they_will_not_be/ia7ep0c/,1653666317,1,True,True,False,UkraineConflict,t5_30oyx,r/UkraineConflict,public,,0,[],,1653637500.0
[],False,,floofnstuff,,,[],,,,text,t2_16vu6d,False,False,"Whoa, we provided weapons and artillery but no one from the US used them to break anything. Damage has been done by Russia attacking and Ukraine defending itself. This is the same for all countries that have assisted Ukraine",14722e35e6a86193141433d33a2ba90c2af0751a,True,False,,,,,0,1653666219,,0,{},ia7ehsv,False,t3_uyvap2,False,True,t1_ia6wwxr,/r/UkraineConflict/comments/uyvap2/really_600b_usd_to_rebuild_it_will_end_up_being/ia7ehsv/,1653666231,1,True,True,False,UkraineConflict,t5_30oyx,r/UkraineConflict,public,,0,[],,1653637419.0
[],False,,AlarmingBlacksmith60,,,[],,,,text,t2_9gh6bqjx,False,False,Bless your heart. It must be hard to be you.,8b3f48d8385d72c6f1a27310dd8a152d0b610448,True,False,,,,,0,1653666189,,0,{},ia7ef4t,False,t3_uxx18c,False,False,t1_ia7dloc,/r/UkraineConflict/comments/uxx18c/the_us_state_department_has_said_they_will_not_be/ia7ef4t/,1653666208,1,True,True,False,UkraineConflict,t5_30oyx,r/UkraineConflict,public,,0,[],,1653637389.0
[],False,,zippiskootch,,,[],,,,text,t2_4mips,False,False,I got 99 problems…,f0dbf32cf1da78576941fd4888570e6f046b60fb,True,False,,,,,0,1653666135,,0,{},ia7eae3,False,t3_uyv8kq,False,True,t3_uyv8kq,/r/UkraineConflict/comments/uyv8kq/what_do_we_think_of_the_kissinger_comments_why/ia7eae3/,1653666151,1,True,True,False,UkraineConflict,t5_30oyx,r/UkraineConflict,public,,0,[],,1653637335.0
[],False,,Slava_ukraini_2022_,,,[],,,,text,t2_l03r9w8n,False,False,"Bless, you're trying.

It's OK for someone to correct you.
Its not your fault you don't know fuck all",e23a587664de5e4133018780f737bd4c906a0f8b,True,False,,,,,0,1653665854,,0,{},ia7dloc,False,t3_uxx18c,False,True,t1_ia7da3q,/r/UkraineConflict/comments/uxx18c/the_us_state_department_has_said_they_will_not_be/ia7dloc/,1653665867,1,True,True,False,UkraineConflict,t5_30oyx,r/UkraineConflict,public,,0,[],,1653637054.0
[],False,,Slava_ukraini_2022_,,,[],,,,text,t2_l03r9w8n,False,False,"They do get things right from time to time, those americans.",a6d9c6b9a023b859f6be424225cecd8c52a63ff6,True,False,,,,,0,1653665728,,0,{},ia7dao9,False,t3_uxx18c,False,True,t3_uxx18c,/r/UkraineConflict/comments/uxx18c/the_us_state_department_has_said_they_will_not_be/ia7dao9/,1653665742,1,True,True,False,UkraineConflict,t5_30oyx,r/UkraineConflict,public,,0,[],,1653636928.0
[],False,,AlarmingBlacksmith60,,,[],,,,text,t2_9gh6bqjx,False,False,You are an idiot. https://www.reuters.com/world/europe/nearly-25-mln-tonnes-grain-stuck-ukraine-un-food-agency-2022-05-06/,5f22a16a4dadd51a214131d1d08c827af32bd77f,True,False,,,,,0,1653665722,,0,{},ia7da3q,False,t3_uxx18c,False,True,t1_ia7bqzq,/r/UkraineConflict/comments/uxx18c/the_us_state_department_has_said_they_will_not_be/ia7da3q/,1653665734,1,True,True,False,UkraineConflict,t5_30oyx,r/UkraineConflict,public,,0,[],,1653636922.0
[],False,,Slava_ukraini_2022_,,,[],,,,text,t2_l03r9w8n,False,False,"Stuck in ukraine😂

Seriously, learn something.",7f50c27feefbe6b6c4b9085ecaf665c9f21b5faa,True,False,,,,,0,1653665096,,0,{},ia7bqzq,False,t3_uxx18c,False,True,t1_ia734i2,/r/UkraineConflict/comments/uxx18c/the_us_state_department_has_said_they_will_not_be/ia7bqzq/,1653665108,1,True,True,False,UkraineConflict,t5_30oyx,r/UkraineConflict,public,,0,[],,1653636296.0
[],False,,fishmonger7,#ff66ac,,[],f60e8e14-b5c8-11ec-b08d-8e5399c45361,Complete Idiot-Ignore Me,dark,text,t2_i9miq,False,False,"Nazis had nato aims for Ukraine, and this shows just how the west abandons their proxy countries.",70aba4eb054c149074e95e3ed9b8cf2f17207add,True,False,,,,,0,1653664729,,0,{},ia7auf5,False,t3_uyqnf9,False,True,t1_ia6shyn,/r/UkraineConflict/comments/uyqnf9/arestovych_question_for_the_westdo_you_even_want/ia7auf5/,1653664748,1,True,True,False,UkraineConflict,t5_30oyx,r/UkraineConflict,public,,0,[],,1653635929.0
[],False,,MTKHack,,,[],,,,text,t2_a20qrpb3,False,False,Wonderful,080b16a19af134af3c3acbef800f7e9ad8f710d0,True,False,,,,,0,1653664661,,0,{},ia7aoaf,False,t3_uyz4jg,False,True,t3_uyz4jg,/r/UkraineConflict/comments/uyz4jg/this_is_how_american_joint_forces_volunteers_work/ia7aoaf/,1653664678,1,True,True,False,UkraineConflict,t5_30oyx,r/UkraineConflict,public,,0,[],,1653635861.0
[],False,,CmG2914,,,[],,,,text,t2_h2ypzjiw,False,False,Great job!,a2d4f4d7785d7230b2ad4c875433f26c7996f667,True,False,,,,,0,1653664344,,0,{},ia79wmv,False,t3_uywuov,False,True,t3_uywuov,/r/UkraineConflict/comments/uywuov/ukraine_foreign_legion_american_british_canadian/ia79wmv/,1653664360,1,True,True,False,UkraineConflict,t5_30oyx,r/UkraineConflict,public,,0,[],,1653635544.0
[],False,,Best-Wall-925,,,[],,,,text,t2_chhctyj5,False,False,Most like society won't see the effects of this war until end of summer earliest.,6d416960cbc658335d3a39e53d2c55bd08663a40,True,False,,,,,0,1653663881,,0,{},ia78svs,False,t3_uyvap2,False,True,t1_ia773qz,/r/UkraineConflict/comments/uyvap2/really_600b_usd_to_rebuild_it_will_end_up_being/ia78svs/,1653663899,1,True,True,False,UkraineConflict,t5_30oyx,r/UkraineConflict,public,,0,[],,1653635081.0
[],False,,zhivago6,,,[],,,,text,t2_u4rak,False,False,"Don't forget the Bangladesh Genocide of 1971, and the coup and dirty war in Chile and Argentina.",9b8c31f148cf94fa42b46812005c45030d77cb16,True,False,,,,,0,1653663347,,0,{},ia77iwp,False,t3_uyv8kq,False,True,t1_ia71oyk,/r/UkraineConflict/comments/uyv8kq/what_do_we_think_of_the_kissinger_comments_why/ia77iwp/,1653663365,1,True,True,False,UkraineConflict,t5_30oyx,r/UkraineConflict,public,,0,[],,1653634547.0
[],False,,kpapenbe,,,[],,,,text,t2_ixf7ljmz,False,False,"HAHAHA despite the ""union"" part of the EU....",c421b48e2c1fa846734d2895d8f797b141bdd487,True,False,,,,,0,1653663173,,0,{},ia773qz,True,t3_uyvap2,False,True,t1_ia7670i,/r/UkraineConflict/comments/uyvap2/really_600b_usd_to_rebuild_it_will_end_up_being/ia773qz/,1653663184,1,True,True,False,UkraineConflict,t5_30oyx,r/UkraineConflict,public,,0,[],,1653634373.0
[],False,,Best-Wall-925,,,[],,,,text,t2_chhctyj5,False,False,Completely. All of Europe is a float right now,88e091d34a6ea3dab8f79e79c51d5be9628e52f9,True,False,,,,,0,1653662793,,0,{},ia7670i,False,t3_uyvap2,False,True,t1_ia761f6,/r/UkraineConflict/comments/uyvap2/really_600b_usd_to_rebuild_it_will_end_up_being/ia7670i/,1653662807,1,True,True,False,UkraineConflict,t5_30oyx,r/UkraineConflict,public,,0,[],,1653633993.0
[],False,,kpapenbe,,,[],,,,text,t2_ixf7ljmz,False,False,"And, yet, Russia continues to float along.....",46fd49cf5a6f5258d33c18dc43488dbfd879e307,True,False,,,,,0,1653662728,,0,{},ia761f6,True,t3_uyvap2,False,True,t1_ia74ry9,/r/UkraineConflict/comments/uyvap2/really_600b_usd_to_rebuild_it_will_end_up_being/ia761f6/,1653662745,1,True,True,False,UkraineConflict,t5_30oyx,r/UkraineConflict,public,,0,[],,1653633928.0
