all_awardings,archived,associated_award,author,author_flair_background_color,author_flair_css_class,author_flair_richtext,author_flair_template_id,author_flair_text,author_flair_text_color,author_flair_type,author_fullname,author_patreon_flair,author_premium,body,body_sha1,can_gild,collapsed,collapsed_because_crowd_control,collapsed_reason,collapsed_reason_code,comment_type,controversiality,created_utc,distinguished,gilded,gildings,id,is_submitter,link_id,locked,no_follow,parent_id,permalink,retrieved_utc,score,score_hidden,send_replies,stickied,subreddit,subreddit_id,subreddit_name_prefixed,subreddit_type,top_awarded_type,total_awards_received,treatment_tags,unrepliable_reason,created
[],False,,Efficient_Light350,,,[],,,,text,t2_87tgfohc,False,False,"The defense budget will remain the same no matter what infrastructure needs the US has. Republicans have been blocking all bills that would help US citizens. Plus an infrastructure bill was passed, don’t know if your state benefitted but a lot of states did.",231ebcd7ccb524b8a5bb4541522a34cbf43bc3c1,True,False,,,,,0,1653695611,,0,{},ia97iog,False,t3_uyvap2,False,True,t1_ia6svj3,/r/UkraineConflict/comments/uyvap2/really_600b_usd_to_rebuild_it_will_end_up_being/ia97iog/,1653695627,1,True,True,False,UkraineConflict,t5_30oyx,r/UkraineConflict,public,,0,[],,1653666811.0
[],False,,Efficient_Light350,,,[],,,,text,t2_87tgfohc,False,False,I for one wish they’d hurry. Never thought I’d hope the US would give a country these weapons but I do now. Russia has to be stopped for any hope of defeating autocracy.,beaef901ec65f564d4a8771872bd5333f75943c3,True,False,,,,,0,1653694747,,0,{},ia95u6t,False,t3_uz2ymd,False,False,t3_uz2ymd,/r/UkraineConflict/comments/uz2ymd/us_preparing_to_approve_advanced_longrange_rocket/ia95u6t/,1653694764,1,True,True,False,UkraineConflict,t5_30oyx,r/UkraineConflict,public,,0,[],,1653665947.0
[],False,,wintersdark,,,[],,,,text,t2_ze4uv,False,True,"A violent coup to remove a puppet government that the people didn't want?  Yes.  Yes, I approve of that.  Governments *should* fear their people.  They're supposed to represent the populace not be autocratic rulers, and definitely not autocratic rulers put in place by another country.

Russia is to blame for the invasion and everything after. Ukraine is a sovereign nation, and a sovereign nation deciding their own fate is in no way a valid reason for invasion.   Anything else here is pure victim blaming, a husband beating his wife and saying it's her fault for not behaving as he wished.  

As to how it ends?  Russia has been making very slow, gradual progress.  However, now we're seeing Russia delivering T62's - worse and worse gear, while Ukraine is getting better and better weapons.  

The West has some real investment here, and has *massive* resources remaining.  We're not going to shrug and walk away from Ukraine, because Ukraine is basically a full ally of the West now, whether it's in NATO or not.  Rebuilding Ukraine is big money - costs, yes, but costs that will go to big western contractors.  

Everyone wants a piece of that pie, and no Western moms are losing sons (sucks to be a Russian mom, eh?), so it's very easy to maintain support from home.",dbf11f28e1dad932ed9fd4241c0d2bcd3403deff,True,False,,,,,0,1653694737,,0,{},ia95tjl,False,t3_uyvap2,False,True,t1_ia8z05a,/r/UkraineConflict/comments/uyvap2/really_600b_usd_to_rebuild_it_will_end_up_being/ia95tjl/,1653694749,1,True,True,False,UkraineConflict,t5_30oyx,r/UkraineConflict,public,,0,[],,1653665937.0
[],False,,PkmnGymLeader,,,[],,,,text,t2_54ppqy3c,False,False,"Not directly, but it does go to the rich corporations run by Republican CEOs and funded by Republican shareholders whenever they propose a tax cut. The national debt is always a big issue for Republicans, except when tax cuts are the topic. Then suddenly the national debt isn’t even considered.",119436a2437cb5c9ce0243f4f56a4eaf3a3f98e5,True,False,,,,,0,1653693657,,0,{},ia93pfj,False,t3_uyvap2,False,True,t1_ia90h6d,/r/UkraineConflict/comments/uyvap2/really_600b_usd_to_rebuild_it_will_end_up_being/ia93pfj/,1653693673,1,True,True,False,UkraineConflict,t5_30oyx,r/UkraineConflict,public,,0,[],,1653664857.0
[],False,,bpra93,,,[],,,,text,t2_zy62j,False,True,Unless this war is a cover up for the under water ufo base hmmmmmm,3b62de882575ea793b5ad9e24a9466ba6a7bf6a4,True,False,,,,,0,1653693437,,0,{},ia939q5,True,t3_uz2ymd,False,True,t1_ia8uoln,/r/UkraineConflict/comments/uz2ymd/us_preparing_to_approve_advanced_longrange_rocket/ia939q5/,1653693453,1,True,True,False,UkraineConflict,t5_30oyx,r/UkraineConflict,public,,0,[],,1653664637.0
[],False,,[deleted],,,,,,dark,,,,,[removed],fe993932d6dced4c0a879e9aa5d7a6e0fbb467f5,True,False,,,,,0,1653692203,,0,{},ia90u1j,False,t3_uz9kho,False,True,t3_uz9kho,/r/UkraineConflict/comments/uz9kho/war_update_with_a_dry_ukrainian_humour/ia90u1j/,1653692217,1,True,True,False,UkraineConflict,t5_30oyx,r/UkraineConflict,public,,0,[],,1653663403.0
[],False,,floofnstuff,,,[],,,,text,t2_16vu6d,False,False,😂,df57595309d14b5eb3cca13e4ea172932c1a87dc,True,False,,,,,0,1653692118,,0,{},ia90o0m,False,t3_uyvap2,False,False,t1_ia90hg7,/r/UkraineConflict/comments/uyvap2/really_600b_usd_to_rebuild_it_will_end_up_being/ia90o0m/,1653692134,1,True,True,False,UkraineConflict,t5_30oyx,r/UkraineConflict,public,,0,[],,1653663318.0
[],False,,theprufeshanul,#a06324,,[],afa65fb4-a101-11ec-9a63-02a4aa3dad09,Kremlin Propagandist ,light,text,t2_4pe5n7p,False,False,"If only - It’s the worlds best performing currency despite the ‘nuclear sanctions’.

Should be a hint to you that the West has totally screwed up.",f01f15c1cccd015c42d9637f748071084c53375f,True,False,,,,,0,1653692028,,0,{},ia90hg7,False,t3_uyvap2,False,True,t1_ia8wixl,/r/UkraineConflict/comments/uyvap2/really_600b_usd_to_rebuild_it_will_end_up_being/ia90hg7/,1653692046,1,True,True,False,UkraineConflict,t5_30oyx,r/UkraineConflict,public,,0,[],,1653663228.0
[],False,,Ozar06,,,[],,,,text,t2_9dnyqlyl,False,False,"Into the pockets of the GOP, of course. /s",2af6ca97bc04185f01f53f64cde88e24924d8df2,True,False,,,,,0,1653692024,,0,{},ia90h6d,False,t3_uyvap2,False,True,t1_ia8w2tm,/r/UkraineConflict/comments/uyvap2/really_600b_usd_to_rebuild_it_will_end_up_being/ia90h6d/,1653692038,1,True,True,False,UkraineConflict,t5_30oyx,r/UkraineConflict,public,,0,[],,1653663224.0
[],False,,MTKHack,,,[],,,,text,t2_a20qrpb3,False,False,Lol,a79fd0872d2d79c1e87cdb6157f4ee6abf479479,True,False,,,,,0,1653691749,,0,{},ia8zwwo,False,t3_uz9n9h,False,True,t3_uz9n9h,/r/UkraineConflict/comments/uz9n9h/leaked_conversation_of_kadyrovite_commander_aslan/ia8zwwo/,1653691762,1,True,True,False,UkraineConflict,t5_30oyx,r/UkraineConflict,public,,0,[],,1653662949.0
[],False,,Mac-daddy1960,,,[],,,,text,t2_fyhdh0e7,False,False,BAZINGA!,1ac1c5ce436fb51c051d594843f1ec37039937cf,True,False,,,,,0,1653691735,,0,{},ia8zvyg,False,t3_uyz4jg,False,True,t3_uyz4jg,/r/UkraineConflict/comments/uyz4jg/this_is_how_american_joint_forces_volunteers_work/ia8zvyg/,1653691747,1,True,True,False,UkraineConflict,t5_30oyx,r/UkraineConflict,public,,0,[],,1653662935.0
[],False,,jacklantern867,,,[],,,,text,t2_5f5y77o3,False,False,All the seized Russian bank accts and oligarch yachts will help fund the rebuild.,7a5e2bdc573b1c7f95a97e00fd1b7b0d111ae8f6,True,False,,,,,0,1653691663,,0,{},ia8zqmz,False,t3_uyvap2,False,True,t1_ia6svj3,/r/UkraineConflict/comments/uyvap2/really_600b_usd_to_rebuild_it_will_end_up_being/ia8zqmz/,1653691681,1,True,True,False,UkraineConflict,t5_30oyx,r/UkraineConflict,public,,0,[],,1653662863.0
[],False,,Mac-daddy1960,,,[],,,,text,t2_fyhdh0e7,False,False,And many working folks lives.,ae3b19001a2c54f7d68fa8c9660acd0fc840a8c4,True,False,,,,,0,1653691447,,0,{},ia8zb21,False,t3_uyvap2,False,True,t1_ia8sy63,/r/UkraineConflict/comments/uyvap2/really_600b_usd_to_rebuild_it_will_end_up_being/ia8zb21/,1653691462,1,True,True,False,UkraineConflict,t5_30oyx,r/UkraineConflict,public,,0,[],,1653662647.0
[],False,,theprufeshanul,#a06324,,[],afa65fb4-a101-11ec-9a63-02a4aa3dad09,Kremlin Propagandist ,light,text,t2_4pe5n7p,False,False,"You literally approved of a violent coup to remove a democratic government and replaced it with one which led to a war with Russia which is going to result in the country split down the middle with most of its arable lands and access to the ports conceded? 

OK hun.",d48c32dcf3c2bde626f16eb4338015f59d3dbb5d,True,False,,,,,0,1653691296,,0,{},ia8z05a,False,t3_uyvap2,False,True,t1_ia8pioy,/r/UkraineConflict/comments/uyvap2/really_600b_usd_to_rebuild_it_will_end_up_being/ia8z05a/,1653691312,1,True,True,False,UkraineConflict,t5_30oyx,r/UkraineConflict,public,,0,[],,1653662496.0
[],False,,floofnstuff,,,[],,,,text,t2_16vu6d,False,False,Do you get paid in rubles,b587be562173efea621cf636b400169888e55c28,True,False,,,,,0,1653690072,,0,{},ia8wixl,False,t3_uyvap2,False,True,t1_ia7oxh3,/r/UkraineConflict/comments/uyvap2/really_600b_usd_to_rebuild_it_will_end_up_being/ia8wixl/,1653690082,1,True,True,False,UkraineConflict,t5_30oyx,r/UkraineConflict,public,,0,[],,1653661272.0
[],False,,Topupyourglass,,,[],,,,text,t2_930vcapg,False,False,You'd have spent it on stupid shit anyway,cee7d684517df1ebea7ee6235a0204f15fcb9028,True,False,,,,,0,1653689930,,0,{},ia8w87i,False,t3_uyqnf9,False,True,t1_ia89zxv,/r/UkraineConflict/comments/uyqnf9/arestovych_question_for_the_westdo_you_even_want/ia8w87i/,1653689947,1,True,True,False,UkraineConflict,t5_30oyx,r/UkraineConflict,public,,0,[],,1653661130.0
[],False,,PkmnGymLeader,,,[],,,,text,t2_54ppqy3c,False,False,"We tried to spend our money domestically, and Republicans blocked it. Now we try to spend it abroad, and Republicans again want to block it. If we aren’t to spend our money here or there, where is it supposed to go?",a4854683cb18a5d3b245655fb3d609907c670b4e,True,False,,,,,0,1653689858,,0,{},ia8w2tm,False,t3_uyvap2,False,True,t1_ia6svj3,/r/UkraineConflict/comments/uyvap2/really_600b_usd_to_rebuild_it_will_end_up_being/ia8w2tm/,1653689871,1,True,True,False,UkraineConflict,t5_30oyx,r/UkraineConflict,public,,0,[],,1653661058.0
[],False,,mcanada0711,,,[],,,,text,t2_4poo89ep,False,False,He's the kissinger of putins arse.,cb949f169ebe1f1f85f4c2992787959832122930,True,False,,,,,0,1653689187,,0,{},ia8upim,False,t3_uyv8kq,False,True,t3_uyv8kq,/r/UkraineConflict/comments/uyv8kq/what_do_we_think_of_the_kissinger_comments_why/ia8upim/,1653689198,1,True,True,False,UkraineConflict,t5_30oyx,r/UkraineConflict,public,,0,[],,1653660387.0
[],False,,Berkamin,,,[],,,,text,t2_h20ls,False,True,"Russia has crossed so many red lines, so Russia can shut up and go collect their corpses and go home.",7269e385b9132a63f9d9641d9bbf5c5a5a49ecbb,True,False,,,,,0,1653689176,,0,{},ia8uoln,False,t3_uz2ymd,False,True,t3_uz2ymd,/r/UkraineConflict/comments/uz2ymd/us_preparing_to_approve_advanced_longrange_rocket/ia8uoln/,1653689192,1,True,True,False,UkraineConflict,t5_30oyx,r/UkraineConflict,public,,0,[],,1653660376.0
[],False,,AbsentThatDay,,,[],,,,text,t2_grpq8,False,False,Can someone link to an English translation of Zelensky's reply to Kissinger that they refer to in the news story?,c902d130feeaeed9196b5fc0eea5a3677913d43d,True,False,,,,,0,1653688807,,0,{},ia8twtj,False,t3_uyv8kq,False,True,t3_uyv8kq,/r/UkraineConflict/comments/uyv8kq/what_do_we_think_of_the_kissinger_comments_why/ia8twtj/,1653688820,1,True,True,False,UkraineConflict,t5_30oyx,r/UkraineConflict,public,,0,[],,1653660007.0
[],False,,RickRossi916,,,[],,,,text,t2_jt9v23r6,False,False,That’s nothing. We gave more than that to our banks in 2008 as a reward for destroying our own economy!,20fd534a050aaf8da93b757634cc71925c40a9d4,True,False,,,,,0,1653688342,,0,{},ia8sy63,False,t3_uyvap2,False,True,t3_uyvap2,/r/UkraineConflict/comments/uyvap2/really_600b_usd_to_rebuild_it_will_end_up_being/ia8sy63/,1653688354,1,True,True,False,UkraineConflict,t5_30oyx,r/UkraineConflict,public,,0,[],,1653659542.0
[],False,,floofnstuff,,,[],,,,text,t2_16vu6d,False,False,"It’s either a bitter Bernie Bro or a full on MAGA, oddly enough you can barely tell the difference",c90e507ee24b45a36ff3abc3312abd41d4b736e7,True,False,,,,,0,1653687962,,0,{},ia8s5te,False,t3_uyqnf9,False,True,t1_ia6fljc,/r/UkraineConflict/comments/uyqnf9/arestovych_question_for_the_westdo_you_even_want/ia8s5te/,1653687977,1,True,True,False,UkraineConflict,t5_30oyx,r/UkraineConflict,public,,0,[],,1653659162.0
[],False,,phaelyon,,,[],,,,text,t2_34qnnap1,False,False,Must've been an American poster because I can hear several British accents and one American accent and there were Canadians too. Its a misleading title and I think you're on the money 😉,498a1eba7fc067c4ab856ea136fc76135958bfcb,True,False,,,,,0,1653687869,,0,{},ia8ryx1,False,t3_uyz4jg,False,True,t1_ia8phmc,/r/UkraineConflict/comments/uyz4jg/this_is_how_american_joint_forces_volunteers_work/ia8ryx1/,1653687880,1,True,True,False,UkraineConflict,t5_30oyx,r/UkraineConflict,public,,0,[],,1653659069.0
[],False,,phaelyon,,,[],,,,text,t2_34qnnap1,False,False,Americans and British,38101ed36b92a7aea67489cfa51a294e26ecd4f1,True,False,,,,,0,1653687322,,0,{},ia8qtw6,False,t3_uyz4jg,False,True,t3_uyz4jg,/r/UkraineConflict/comments/uyz4jg/this_is_how_american_joint_forces_volunteers_work/ia8qtw6/,1653687335,1,True,True,False,UkraineConflict,t5_30oyx,r/UkraineConflict,public,,0,[],,1653658522.0
[],False,,wintersdark,,,[],,,,text,t2_ze4uv,False,True,".... with millions of people in support.  And look at Ukraine now, are you seriously going to argue Ukraine wants to be under Russian control?  With those riots Ukraine spoke loud and clear about who they wanted in power.

If Ukrainians actually wanted Russia in control of their country, this would have been over in a day.",7f0a812bca114aa18860f61f0c753471eea22876,True,False,,,,,0,1653686692,,0,{},ia8pioy,False,t3_uyvap2,False,False,t1_ia7opw4,/r/UkraineConflict/comments/uyvap2/really_600b_usd_to_rebuild_it_will_end_up_being/ia8pioy/,1653686706,1,True,True,False,UkraineConflict,t5_30oyx,r/UkraineConflict,public,,0,[],,1653657892.0
[],False,,TerryDuk,,,[],,,,text,t2_1s2tvep0,False,False,"Why was this posted again with a different title. ? American poster ?

The original post was headed

Ukraine Foreign Legion (American, British, Canadian) Team targeted a Russian BTR-80 APC with a RGW-90 HH launcher

Sounds more real, Yanks trying to take the glory again",7759cb74ad9f9286f38678d6540da16c55560806,True,False,,,,,0,1653686678,,0,{},ia8phmc,False,t3_uyz4jg,False,True,t3_uyz4jg,/r/UkraineConflict/comments/uyz4jg/this_is_how_american_joint_forces_volunteers_work/ia8phmc/,1653686691,1,True,True,False,UkraineConflict,t5_30oyx,r/UkraineConflict,public,,0,[],,1653657878.0
[],False,,Lagalag967,,,[],,,,text,t2_ewg31,False,False,https://www.fbtb.net/wp-content/uploads/2011/07/great-success.jpg,491fc5c323476cea5283ecaf986b310d59131867,True,False,,,,,0,1653686361,,0,{},ia8otk8,False,t3_uywuov,False,True,t1_ia7npxr,/r/UkraineConflict/comments/uywuov/ukraine_foreign_legion_american_british_canadian/ia8otk8/,1653686372,1,True,True,False,UkraineConflict,t5_30oyx,r/UkraineConflict,public,,0,[],,1653657561.0
[],False,,93rdindmemecoy,,,[],,,,text,t2_mteursl4,False,False,"&gt;The satellite info and Intel we send over?

You can't quantify that?

Anyway, I find it very difficult to disagree with any of what he said. From Biden turning up in Eastern Europe and playing to the gantry ""Putin can't stay in power""! Remember that declaration?  To the head of the EU hailing their own initial response, a feeble amount of weapons, a 'promise' to end their billion dollars a day food parcel to Russia, and chasing a handful of Russians who don't live in Russia, as 'unprecedented', to Boris thinking he's Churchill, it all shows the West are not prepared to match Russia's willingness to sacrifice their young men with any semblance of discomfort at home.

A war being waged by an autocratic regime in Europe and it's just another topic for western politicals to virtue signal over. They aren't sending presents to Ukrainian orphanages. They began a process to rid Ukraine of the aggressor. If that isn't happening it's their - our - problem just as much as it is Ukraine's.",500a99b41252794a65a2be6f487401cbdad7f478,True,False,,,,,0,1653685719,,0,{},ia8nhgg,False,t3_uyqnf9,False,True,t1_ia7xbvb,/r/UkraineConflict/comments/uyqnf9/arestovych_question_for_the_westdo_you_even_want/ia8nhgg/,1653685735,1,True,True,False,UkraineConflict,t5_30oyx,r/UkraineConflict,public,,0,[],,1653656919.0
[],False,,KingStarscream91,,,[],,,,text,t2_8ts44n5p,False,False,Bad Ass,fad5e9892b298c41108d3a5644e8dc549544fdbc,True,False,,,,,0,1653685470,,0,{},ia8myjq,False,t3_uyvap2,False,True,t1_ia85fjm,/r/UkraineConflict/comments/uyvap2/really_600b_usd_to_rebuild_it_will_end_up_being/ia8myjq/,1653685483,1,True,True,False,UkraineConflict,t5_30oyx,r/UkraineConflict,public,,0,[],,1653656670.0
[],False,,Prairie_drifter,,,[],,,,text,t2_8x57yuuk,False,False,He's a senile old neo-con without an original thought since the Cold War?,b64ee1a18ae435b2ac860fc6427ec23f21066e83,True,False,,,,,0,1653685157,,0,{},ia8maer,False,t3_uyv8kq,False,True,t3_uyv8kq,/r/UkraineConflict/comments/uyv8kq/what_do_we_think_of_the_kissinger_comments_why/ia8maer/,1653685171,1,True,True,False,UkraineConflict,t5_30oyx,r/UkraineConflict,public,,0,[],,1653656357.0
[],False,,The13thReservoirDog,,,[],,,,text,t2_c5y6s7zy,False,False,That the british one?,1ce70978433f37a9e6060b21a0029d66ac984f2b,True,False,,,,,0,1653685088,,0,{},ia8m551,False,t3_uz30kw,False,True,t3_uz30kw,/r/UkraineConflict/comments/uz30kw/the_destruction_of_the_russian_helicopter_k52/ia8m551/,1653685102,1,True,True,False,UkraineConflict,t5_30oyx,r/UkraineConflict,public,,0,[],,1653656288.0
[],False,,Dave-liu-415,,,[],,,,text,t2_4fl5seaw,False,False,"Serf mentality. Just give in to the inevitable hopeless ness of slavery, the sooner, the less damage we will all have, right?",8b27e30ba3b33e8b784b38c6378e3341e2d48d78,True,False,,,,,0,1653684486,,0,{},ia8kv1t,False,t3_uyvap2,False,True,t1_ia7ov5l,/r/UkraineConflict/comments/uyvap2/really_600b_usd_to_rebuild_it_will_end_up_being/ia8kv1t/,1653684499,1,True,True,False,UkraineConflict,t5_30oyx,r/UkraineConflict,public,,0,[],,1653655686.0
[],False,,ereezy1,,,[],,,,text,t2_3ys7dyjd,False,False, He needs his dexterity to be at 100 so any heavy ballistic gear would slow or hinder his efforts,74a8cfa41ecc92b3cc529d4d2c5a6ffa71e4fdc0,True,False,,,,,0,1653684416,,0,{},ia8kpp8,False,t3_u5ko8r,False,True,t1_i53bw47,/r/UkraineConflict/comments/u5ko8r/russians_mined_a_bridge_in_the_village_nova_basan/ia8kpp8/,1653684429,1,True,True,False,UkraineConflict,t5_30oyx,r/UkraineConflict,public,,0,[],,1653655616.0
[],False,,zippiskootch,,,[],,,,text,t2_4mips,False,False,I’m going to humbly recommend a book titled Black Earth by Timothy Snyder as a read on the history of Eastern Europeans and the Holocaust. The conclusion at the end on the book is unbelievably accurate and prescient.,312930465977962f9f68c748066d635dbaa70f7a,True,False,,,,,0,1653683337,,0,{},ia8idkr,False,t3_uysdf8,False,True,t3_uysdf8,/r/UkraineConflict/comments/uysdf8/canadian_ukrainian_volunteer_on_twitterthread/ia8idkr/,1653683354,1,True,True,False,UkraineConflict,t5_30oyx,r/UkraineConflict,public,,0,[],,1653654537.0
[],False,,kpapenbe,,,[],,,,text,t2_ixf7ljmz,False,False,"Oh, the west of the country only....so sad, though true!",16c7390f2059e7c006597738943f89a921f899b3,True,False,,,,,0,1653682478,,0,{},ia8ghpr,True,t3_uyv8kq,False,True,t1_ia8fdxa,/r/UkraineConflict/comments/uyv8kq/what_do_we_think_of_the_kissinger_comments_why/ia8ghpr/,1653682489,1,True,True,False,UkraineConflict,t5_30oyx,r/UkraineConflict,public,,0,[],,1653653678.0
[],False,,PGLife,,,[],,,,text,t2_lkbtz,False,False,"No one said they were entirely peaceful, just that they had created different types of government.",b6da984e397442374db9b085551d449b7771b4de,True,False,,,,,0,1653682031,,0,{},ia8fik4,False,t3_uyvap2,False,False,t1_ia8aqhr,/r/UkraineConflict/comments/uyvap2/really_600b_usd_to_rebuild_it_will_end_up_being/ia8fik4/,1653682051,1,True,True,False,UkraineConflict,t5_30oyx,r/UkraineConflict,public,,0,[],,1653653231.0
[],False,,Link50L,,,[],,,,text,t2_1yljxa35,False,False,"&gt;I think you're right that this is the best one could hope for...though....the probability of just such an outcome is less than promising...

Yeah. Things are never this ""clean"" and this will more likely go on for a grind and never end, with ambiguous and frozen conflict. At least Russia will be back in the stone age, and Ukraine will rebuild (in the west of the country, anyways).",842df6b441587287612c99e727cfa9eac7db9e1e,True,False,,,,,0,1653681973,,0,{},ia8fdxa,False,t3_uyv8kq,False,True,t1_ia8eqsf,/r/UkraineConflict/comments/uyv8kq/what_do_we_think_of_the_kissinger_comments_why/ia8fdxa/,1653681988,1,True,True,False,UkraineConflict,t5_30oyx,r/UkraineConflict,public,,0,[],,1653653173.0
[],False,,Link50L,,,[],,,,text,t2_1yljxa35,False,False,"&gt;Nazis had nato aims for Ukraine, and this shows just how the west abandons their proxy countries.

LOL I had a good laugh thanks",2a54847ad1fc03d2e0fbbab5e98feb20ad569c4b,True,False,,,,,0,1653681843,,0,{},ia8f3gt,False,t3_uyqnf9,False,True,t1_ia7auf5,/r/UkraineConflict/comments/uyqnf9/arestovych_question_for_the_westdo_you_even_want/ia8f3gt/,1653681858,1,True,True,False,UkraineConflict,t5_30oyx,r/UkraineConflict,public,,0,[],,1653653043.0
[],False,,Link50L,,,[],,,,text,t2_1yljxa35,False,False,"&gt;These Nazi azovs are being taken down and using the other Ukrainian patriots as cannon fodder. It’s a real shame because these azovities aren’t why Ukraine is in this mess in the first place. I hope the innocent Ukrainians get spared and only these clowns get what they deserve.

Stick to selling fish.",f7efbd1124aa849feb0ab3b4a725413f7a4dd33d,True,False,,,,,0,1653681814,,0,{},ia8f13l,False,t3_uyqnf9,False,True,t1_ia64xh8,/r/UkraineConflict/comments/uyqnf9/arestovych_question_for_the_westdo_you_even_want/ia8f13l/,1653681827,1,True,True,False,UkraineConflict,t5_30oyx,r/UkraineConflict,public,,0,[],,1653653014.0
[],False,,kpapenbe,,,[],,,,text,t2_ixf7ljmz,False,False,I think you're right that this is the best one could hope for...though....the probability of just such an outcome is less than promising...,99a3d74837c991993b73860ff054b2d47f0951e0,True,False,,,,,0,1653681685,,0,{},ia8eqsf,True,t3_uyv8kq,False,True,t1_ia87p79,/r/UkraineConflict/comments/uyv8kq/what_do_we_think_of_the_kissinger_comments_why/ia8eqsf/,1653681699,1,True,True,False,UkraineConflict,t5_30oyx,r/UkraineConflict,public,,0,[],,1653652885.0
[],False,,kpapenbe,,,[],,,,text,t2_ixf7ljmz,False,False,"Short, sweet, and to the point (while also, sadly, accurate)...",80322ce79f0164d308cf2e029867f7aa2a1aa8c8,True,False,,,,,0,1653681654,,0,{},ia8eo76,True,t3_uyv8kq,False,True,t1_ia7zv67,/r/UkraineConflict/comments/uyv8kq/what_do_we_think_of_the_kissinger_comments_why/ia8eo76/,1653681669,1,True,True,False,UkraineConflict,t5_30oyx,r/UkraineConflict,public,,0,[],,1653652854.0
[],False,,kpapenbe,,,[],,,,text,t2_ixf7ljmz,False,False,"So true...and this, despite social media and 24/7 news cycles....ugh",741acd82dd4323ab492a3d25d71f8e2a2ce82e85,True,False,,,,,0,1653681584,,0,{},ia8eifj,True,t3_uyvap2,False,True,t1_ia88iyu,/r/UkraineConflict/comments/uyvap2/really_600b_usd_to_rebuild_it_will_end_up_being/ia8eifj/,1653681598,1,True,True,False,UkraineConflict,t5_30oyx,r/UkraineConflict,public,,0,[],,1653652784.0
[],False,,AlohaBacon123,,,[],,,,text,t2_3l62nbsg,False,False,Best money we've ever spent.,82e9e2b6e126cf728bd6fa0730afef312b75e864,True,False,,,,,0,1653681242,,0,{},ia8drkr,False,t3_uyqnf9,False,True,t1_ia89zxv,/r/UkraineConflict/comments/uyqnf9/arestovych_question_for_the_westdo_you_even_want/ia8drkr/,1653681261,1,True,True,False,UkraineConflict,t5_30oyx,r/UkraineConflict,public,,0,[],,1653652442.0
[],False,,Nickblove,,,[],,,,text,t2_obho8,False,False,"No, my point is that you said Native Americans were descended from the same people as Russians and implied they didn’t war with other people because they “built large functioning republics from scratch” which they were actually formed after years of territorial expansion and tribe annexations. 
The fact that a few of the tribes that I noted are indeed warrior centric cultures. I am not calling anyone warrior race or whatever you call it I’m just stating facts about the subject matter.",56b92731155be59db6abf380d9951dbe5bc53eac,True,False,,,,,0,1653680990,,0,{},ia8d7g2,False,t3_uyvap2,False,True,t1_ia8bxr6,/r/UkraineConflict/comments/uyvap2/really_600b_usd_to_rebuild_it_will_end_up_being/ia8d7g2/,1653681007,1,True,True,False,UkraineConflict,t5_30oyx,r/UkraineConflict,public,,0,[],,1653652190.0
[],False,,MrMoBidnizz,,,[],,,,text,t2_mn0up7bc,False,False,The need to send it like yesterday,af696a061ca5737bf4ed2a72be50a3548623c086,True,False,,,,,0,1653680419,,0,{},ia8bxrl,False,t3_uz2ymd,False,True,t3_uz2ymd,/r/UkraineConflict/comments/uz2ymd/us_preparing_to_approve_advanced_longrange_rocket/ia8bxrl/,1653680431,1,True,True,False,UkraineConflict,t5_30oyx,r/UkraineConflict,public,,0,[],,1653651619.0
[],False,,DefTheOcelot,,,[],,,,text,t2_bglw5y,False,True,"The point being made here is that you are saying to make war at all makes them a warrior race. The british made war.

The Iroquois confederacy and other complex alliances made sophisticated societies with progressive ideas.",328dcf3f1383e57dcee58b3b1600a49c0c4e61f7,True,False,,,,,0,1653680419,,0,{},ia8bxr6,False,t3_uyvap2,False,True,t1_ia8aqhr,/r/UkraineConflict/comments/uyvap2/really_600b_usd_to_rebuild_it_will_end_up_being/ia8bxr6/,1653680432,1,True,True,False,UkraineConflict,t5_30oyx,r/UkraineConflict,public,,0,[],,1653651619.0
