all_awardings,archived,associated_award,author,author_flair_background_color,author_flair_css_class,author_flair_richtext,author_flair_template_id,author_flair_text,author_flair_text_color,author_flair_type,author_fullname,author_patreon_flair,author_premium,body,body_sha1,can_gild,collapsed,collapsed_because_crowd_control,collapsed_reason,collapsed_reason_code,comment_type,controversiality,created_utc,distinguished,gilded,gildings,id,is_submitter,link_id,locked,no_follow,parent_id,permalink,retrieved_utc,score,score_hidden,send_replies,stickied,subreddit,subreddit_id,subreddit_name_prefixed,subreddit_type,top_awarded_type,total_awards_received,treatment_tags,unrepliable_reason,created
[],False,,kpapenbe,,,[],,,,text,t2_ixf7ljmz,False,False,That's true....how to even begin the process of getting folks repatriated :-(,56babbc417e66a354fa512807a695691c21811a8,True,False,,,,,0,1653662689,,0,{},ia75y3p,True,t3_uyvap2,False,True,t1_ia756zk,/r/UkraineConflict/comments/uyvap2/really_600b_usd_to_rebuild_it_will_end_up_being/ia75y3p/,1653662707,1,True,True,False,UkraineConflict,t5_30oyx,r/UkraineConflict,public,,0,[],,1653633889.0
[],False,,We_m,,,[],,,,text,t2_knjnwdv5,False,False,"I feel exactly the same.. 
Horrible..
I am afraid the person who replied to you ""Director-Insurance"" does not really share our opinion... check the comments in her profile... Celebrating the ""Liberation"" of Mariupol...",20ff42c69e02758b4a3d67f3bdb48dd0fffc70c8,True,False,,,,,0,1653662498,,0,{},ia75hub,False,t3_uwitvs,False,True,t1_i9v0ajo,/r/UkraineConflict/comments/uwitvs/hur_intercepted_call_at_the_front_line_theyre/ia75hub/,1653662516,1,True,True,False,UkraineConflict,t5_30oyx,r/UkraineConflict,public,,0,[],,1653633698.0
[],False,,NewDistrict6824,,,[],,,,text,t2_kd2n1evi,False,False,"Life’s messy and I’m afraid the desire to avoid further economic hardship, food insecurity as well as an end to war is likely to lead to many political accommodations that will be lacking in good sound principles.  Just getting information about PoW and the forcibly relocated civilians in Russia is going to be extremely hard, never mind getting them safely returned home.  The sooner the international community starts thinking and planning on this, with Ukraine, the better.",caf5147bb1dc9c8c9b76bf36d02a1d8758bbfb49,True,False,,,,,0,1653662374,,0,{},ia756zk,False,t3_uyvap2,False,True,t1_ia725w0,/r/UkraineConflict/comments/uyvap2/really_600b_usd_to_rebuild_it_will_end_up_being/ia756zk/,1653662389,1,True,True,False,UkraineConflict,t5_30oyx,r/UkraineConflict,public,,0,[],,1653633574.0
[],False,,Best-Wall-925,,,[],,,,text,t2_chhctyj5,False,False,"I just think so much can happen between now and when that starting to actually make a huge impact. That is definitely very plausible. However, that is a small trickle of water in a ship that has a lot of holes. The ship is going down but which small hole is the one the folds under the pressure to bring the while ship down.",c422558b669ce5b11ac708087e6246c7084280e7,True,False,,,,,0,1653662195,,0,{},ia74ry9,False,t3_uyvap2,False,True,t1_ia6t0fn,/r/UkraineConflict/comments/uyvap2/really_600b_usd_to_rebuild_it_will_end_up_being/ia74ry9/,1653662211,1,True,True,False,UkraineConflict,t5_30oyx,r/UkraineConflict,public,,0,[],,1653633395.0
[],False,,kpapenbe,,,[],,,,text,t2_ixf7ljmz,False,False,That's the general consensus (he isn't dead?!),6332d2d840bbd8fe8fd352a0bfe0b4d1b84d7242,True,False,,,,,0,1653661783,,0,{},ia73td6,True,t3_uyv8kq,False,True,t1_ia718yn,/r/UkraineConflict/comments/uyv8kq/what_do_we_think_of_the_kissinger_comments_why/ia73td6/,1653661795,1,True,True,False,UkraineConflict,t5_30oyx,r/UkraineConflict,public,,0,[],,1653632983.0
[],False,,kpapenbe,,,[],,,,text,t2_ixf7ljmz,False,False,"You're 100% right; sadly, I have no idea why the Ivy League folks love him....gag.....",563910da949bb81dd11a2ef1042137b6899df076,True,False,,,,,0,1653661528,,0,{},ia737vs,True,t3_uyv8kq,False,True,t1_ia71oyk,/r/UkraineConflict/comments/uyv8kq/what_do_we_think_of_the_kissinger_comments_why/ia737vs/,1653661539,1,True,True,False,UkraineConflict,t5_30oyx,r/UkraineConflict,public,,0,[],,1653632728.0
[],False,,AlarmingBlacksmith60,,,[],,,,text,t2_9gh6bqjx,False,False,"Ukraine is struggling to export food. The food is literally stuck in Ukraine. Please, don't call others ignorant when you don't know what you are talking about.",8363847d70659ee66f59cc23f83c6f1a0fa5769e,True,False,,,,,0,1653661488,,0,{},ia734i2,False,t3_uxx18c,False,False,t1_ia6yjah,/r/UkraineConflict/comments/uxx18c/the_us_state_department_has_said_they_will_not_be/ia734i2/,1653661500,1,True,True,False,UkraineConflict,t5_30oyx,r/UkraineConflict,public,,0,[],,1653632688.0
[],False,,kpapenbe,,,[],,,,text,t2_ixf7ljmz,False,False,"I like your first COA, but, yea, maybe he'll just pass from this ""blood cancer"" everyone keeps mentioning, which, to your point....would leave a power vacuum....no bueno...",2856d5b17b09419114e1ff47331341df7a5a6bf4,True,False,,,,,0,1653661071,,0,{},ia725w0,True,t3_uyvap2,False,True,t1_ia710bf,/r/UkraineConflict/comments/uyvap2/really_600b_usd_to_rebuild_it_will_end_up_being/ia725w0/,1653661086,1,True,True,False,UkraineConflict,t5_30oyx,r/UkraineConflict,public,,0,[],,1653632271.0
[],False,,sworlly,,,[],,,,text,t2_6ixsyo0k,False,False,Same with Bill Gates - most generous financial donor in human history i believe.,e7540605d8ec404897c777c5d7d9cb163d4e1c62,True,False,,,,,0,1653660912,,0,{},ia71svq,False,t3_uygrmn,False,True,t1_ia51rd3,/r/UkraineConflict/comments/uygrmn/george_soros_says_that_the_invasion_of_ukraine/ia71svq/,1653660923,1,True,True,False,UkraineConflict,t5_30oyx,r/UkraineConflict,public,,0,[],,1653632112.0
[],False,,globalinvestmentpimp,,,[],,,,text,t2_a0c9pu6t,False,False,"Kissinger is complicit in Genocides and coups, I can certainly start with Cambodia Vietnam East Timor, why isn’t this war criminal dead yet, and why do these Ivy League fucks love him?",dc246c155ab5384e9276734c5b99533531656e12,True,False,,,,,0,1653660862,,0,{},ia71oyk,False,t3_uyv8kq,False,True,t3_uyv8kq,/r/UkraineConflict/comments/uyv8kq/what_do_we_think_of_the_kissinger_comments_why/ia71oyk/,1653660879,1,True,True,False,UkraineConflict,t5_30oyx,r/UkraineConflict,public,,0,[],,1653632062.0
[],False,,LovesReddit2023,,,[],,,,text,t2_j2dziqv2,False,False,It’s because Russia own Kissinger. He is a bought and paid for politician. Personally I assumed he was dead already.,bdce8853cccb27f09b18f3ba918a092f69bd1642,True,False,,,,,0,1653660663,,0,{},ia718yn,False,t3_uyv8kq,False,True,t3_uyv8kq,/r/UkraineConflict/comments/uyv8kq/what_do_we_think_of_the_kissinger_comments_why/ia718yn/,1653660679,1,True,True,False,UkraineConflict,t5_30oyx,r/UkraineConflict,public,,0,[],,1653631863.0
[],False,,Free_Entertainer_996,,,[],,,,text,t2_gq7l84fs,False,False,Wow u must be talking about Russia breaking stuff… free countries are helping defend against the Russian assholes and they should be footing the bill for their barbaric war.,b01aa79adc2f2891a7d24e1279d33de90997a896,True,False,,,,,0,1653660612,,0,{},ia714ue,False,t3_uyvap2,False,True,t1_ia6wwxr,/r/UkraineConflict/comments/uyvap2/really_600b_usd_to_rebuild_it_will_end_up_being/ia714ue/,1653660625,1,True,True,False,UkraineConflict,t5_30oyx,r/UkraineConflict,public,,0,[],,1653631812.0
[],False,,NewDistrict6824,,,[],,,,text,t2_kd2n1evi,False,False,"It has to be Russians that remove Putin. If it is a NATO member state we will see escalation and a further justification for war, in Ukraine, and perhaps beyond Ukraine.

Who removes Putin? Hard one OTP answer but most likely the military and/or FSB; he has made many enemies and he is destroying Russias. Armed Forces and parts of the FSB.

How can they remove him? The best way would be legally. That would enable a trial with a minimum of 20 years (that’s Russian law for planning and executing an illegal war of aggression), adding genocide and he’s in prison for the rest of his life. Moreover, this process enables an action against a criminal enterprise bringing in Lavrov, Shoigu, Peskov, Patrushev, Kozak, and many many more (circa 50-60 minimum in Kremlin) and military operational commander Dvornikov and a few others. This “house cleaning” would enable peace negotiations (following complete withdrawal from ALL Ukraine), and might help lift sanctions. It would also be better for Russia to address all war crimes, crimes against humanity and genocide. This would show the world it’s intention to change and enable all sanctions to be lifted, providing reparations had been agreed and honoured.  However, life is rarely like this. Putin may die from a “natural” illness and the rat will be a messy withdrawal and poor accountability for atrocities etc.",0b2e09f9cbe54b6c46be924208c7f3c5c4e99a39,True,False,,,,,0,1653660555,,0,{},ia710bf,False,t3_uyvap2,False,True,t1_ia6zbij,/r/UkraineConflict/comments/uyvap2/really_600b_usd_to_rebuild_it_will_end_up_being/ia710bf/,1653660570,1,True,True,False,UkraineConflict,t5_30oyx,r/UkraineConflict,public,,0,[],,1653631755.0
[],False,,Illustrious_Warthog,,,[],,,,text,t2_2y0mzwjf,False,False,Cambodia being f'd up.  Someone else sacrifices so Kissinger can sleep easy at night.,c5161d8e0089510ed3da68b4c5fc57e28a3a5479,True,False,,,,,0,1653660148,,0,{},ia703n5,False,t3_uyv8kq,False,True,t1_ia6sp7d,/r/UkraineConflict/comments/uyv8kq/what_do_we_think_of_the_kissinger_comments_why/ia703n5/,1653660160,1,True,True,False,UkraineConflict,t5_30oyx,r/UkraineConflict,public,,0,[],,1653631348.0
[],False,,kpapenbe,,,[],,,,text,t2_ixf7ljmz,False,False,HAHAHAHAHAHAHHA,d464f818324d62d49d9091bac26a97f0538d75ec,True,False,,,,,0,1653659841,,0,{},ia6zf5v,True,t3_uyv8kq,False,True,t1_ia6wf9j,/r/UkraineConflict/comments/uyv8kq/what_do_we_think_of_the_kissinger_comments_why/ia6zf5v/,1653659859,1,True,True,False,UkraineConflict,t5_30oyx,r/UkraineConflict,public,,0,[],,1653631041.0
[],False,,kpapenbe,,,[],,,,text,t2_ixf7ljmz,False,False,RIGHT?!,b67689f859df7e553704ae593ef6caea45c23da7,True,False,,,,,0,1653659826,,0,{},ia6ze2f,True,t3_uyv8kq,False,True,t1_ia6xjnb,/r/UkraineConflict/comments/uyv8kq/what_do_we_think_of_the_kissinger_comments_why/ia6ze2f/,1653659844,1,True,True,False,UkraineConflict,t5_30oyx,r/UkraineConflict,public,,0,[],,1653631026.0
[],False,,AntiGravityBacon,,,[],,,,text,t2_5p5hm,False,False,Hope you have kinder day today friend.,1c7b42068b85e661fa16454aae45300a3690b55a,True,False,,,,,0,1653659821,,0,{},ia6zdod,False,t3_uxx18c,False,True,t1_ia6yrrl,/r/UkraineConflict/comments/uxx18c/the_us_state_department_has_said_they_will_not_be/ia6zdod/,1653659835,1,True,True,False,UkraineConflict,t5_30oyx,r/UkraineConflict,public,,0,[],,1653631021.0
[],False,,kpapenbe,,,[],,,,text,t2_ixf7ljmz,False,False,I did too until I saw him in the video HAHAHAHHAHA,9bf772a6a7141d568af7bd1a913ae35cabfb6967,True,False,,,,,0,1653659817,,0,{},ia6zdcv,True,t3_uyv8kq,False,True,t1_ia6ybxl,/r/UkraineConflict/comments/uyv8kq/what_do_we_think_of_the_kissinger_comments_why/ia6zdcv/,1653659836,1,True,True,False,UkraineConflict,t5_30oyx,r/UkraineConflict,public,,0,[],,1653631017.0
[],False,,kpapenbe,,,[],,,,text,t2_ixf7ljmz,False,False,HEAR HEAR!!!,9f721d6f96ca7097fcdad6925d84e04509f199f1,True,False,,,,,0,1653659804,,0,{},ia6zca1,True,t3_uyv8kq,False,True,t1_ia6ysur,/r/UkraineConflict/comments/uyv8kq/what_do_we_think_of_the_kissinger_comments_why/ia6zca1/,1653659820,1,True,True,False,UkraineConflict,t5_30oyx,r/UkraineConflict,public,,0,[],,1653631004.0
[],False,,kpapenbe,,,[],,,,text,t2_ixf7ljmz,False,False,Your bottom line is the TRUTH--but who will act??,7aab54c6432c9a142e2ddbe14e73fd41a741cb47,True,False,,,,,0,1653659794,,0,{},ia6zbij,True,t3_uyvap2,False,True,t1_ia6z0kj,/r/UkraineConflict/comments/uyvap2/really_600b_usd_to_rebuild_it_will_end_up_being/ia6zbij/,1653659812,1,True,True,False,UkraineConflict,t5_30oyx,r/UkraineConflict,public,,0,[],,1653630994.0
[],False,,kpapenbe,,,[],,,,text,t2_ixf7ljmz,False,False,"As an aside, did you see Bush's gaff about Ukraine and Iraq?  Now that was funny....",7f7b27e16319300d8754c2acbc25d329c2e7fb4b,True,False,,,,,0,1653659704,,0,{},ia6z4ig,True,t3_uyv8kq,False,True,t1_ia6wkf2,/r/UkraineConflict/comments/uyv8kq/what_do_we_think_of_the_kissinger_comments_why/ia6z4ig/,1653659719,1,True,True,False,UkraineConflict,t5_30oyx,r/UkraineConflict,public,,0,[],,1653630904.0
[],False,,NewDistrict6824,,,[],,,,text,t2_kd2n1evi,False,False,"It is genocide. He has already stated there is no country such as Ukraine nor that it’s people are Ukrainian. They have no culture other than Russian, in his mind, and those that think they do are to be destroyed. All the war crimes being committed are systemic and widespread, nearly all arise from direct orders and encouragement rather than badly behaved individuals or units. It is command driven, and all these crimes are sub-elements of Genocide.

Putin cannot stop himself. To do so means his mythical notion of his role in history is flawed. He has many more nations to subjugate and Ukraine is to be the lesson to these nations, to teach them resistance means utter destruction.

Putin is the root of this war. His removal, permanently, is the solution. Sadly it has to be Russians who remove him.",5fb37619a026ea98e48ee4b5cf79cf9d60ba0e77,True,False,,,,,0,1653659654,,0,{},ia6z0kj,False,t3_uyvap2,False,True,t3_uyvap2,/r/UkraineConflict/comments/uyvap2/really_600b_usd_to_rebuild_it_will_end_up_being/ia6z0kj/,1653659666,1,True,True,False,UkraineConflict,t5_30oyx,r/UkraineConflict,public,,0,[],,1653630854.0
[],False,,beniceyoumeany,,,[],,,,text,t2_4sxwgnj3,False,False,Kissinger the loser belongs in a grave,006a8abb6071637bd3446a4ca3999750250da279,True,False,,,,,0,1653659554,,0,{},ia6ysur,False,t3_uyv8kq,False,True,t3_uyv8kq,/r/UkraineConflict/comments/uyv8kq/what_do_we_think_of_the_kissinger_comments_why/ia6ysur/,1653659573,1,True,True,False,UkraineConflict,t5_30oyx,r/UkraineConflict,public,,0,[],,1653630754.0
[],False,,Slava_ukraini_2022_,,,[],,,,text,t2_l03r9w8n,False,False,"How?

How can people with no home, no money, no gas, no heating, etc eat the shit grain that they can't sell? You people make my head hurt. You are beyond stupid.",e4a01cad35bb3ef84aec755fbb4e690fb1fc024f,True,False,,,,,0,1653659540,,0,{},ia6yrrl,False,t3_uxx18c,False,True,t1_ia408i6,/r/UkraineConflict/comments/uxx18c/the_us_state_department_has_said_they_will_not_be/ia6yrrl/,1653659558,1,True,True,False,UkraineConflict,t5_30oyx,r/UkraineConflict,public,,0,[],,1653630740.0
[],False,,Slava_ukraini_2022_,,,[],,,,text,t2_l03r9w8n,False,False,"Sorry what?
A country which is being bombed to hell, where trucks can't go, therefore the shops which are blown to hell, and have no staff, or goods, or roof, or customers, AREN'T out of food???

Were you born dumb or did you work at it?

OF COURSE Ukraine is struggling for food FFS!!!!",a19aa9a2a1f5b7b5fb321efac7864d2c1c5a7351,True,False,,,,,0,1653659430,,0,{},ia6yjah,False,t3_uxx18c,False,True,t1_ia4dsy4,/r/UkraineConflict/comments/uxx18c/the_us_state_department_has_said_they_will_not_be/ia6yjah/,1653659448,1,True,True,False,UkraineConflict,t5_30oyx,r/UkraineConflict,public,,0,[],,1653630630.0
[],False,,tracyschmeck,,,[],,,,text,t2_jn70cxxv,False,False,Honestly thought he was dead already.,d9b674bff3ce968e1dab2e20b7bbffa0d2e383d6,True,False,,,,,0,1653659337,,0,{},ia6ybxl,False,t3_uyv8kq,False,True,t3_uyv8kq,/r/UkraineConflict/comments/uyv8kq/what_do_we_think_of_the_kissinger_comments_why/ia6ybxl/,1653659355,1,True,True,False,UkraineConflict,t5_30oyx,r/UkraineConflict,public,,0,[],,1653630537.0
[],False,,Acewrap,,,[],,,,text,t2_340g7,False,True,How tf is Kissinger still alive?!,9c1ade563bb8c22609358d33c26d52a86b176f7e,True,False,,,,,0,1653658972,,0,{},ia6xjnb,False,t3_uyv8kq,False,True,t3_uyv8kq,/r/UkraineConflict/comments/uyv8kq/what_do_we_think_of_the_kissinger_comments_why/ia6xjnb/,1653658988,1,True,True,False,UkraineConflict,t5_30oyx,r/UkraineConflict,public,,0,[],,1653630172.0
[],False,,theprufeshanul,#a06324,,[],afa65fb4-a101-11ec-9a63-02a4aa3dad09,Kremlin Propagandist ,light,text,t2_4pe5n7p,False,False,"You joking right?

You've supplied weapond, money, intelligence to drag the conflict out and now don't want to pay for the stuff you've broken?

Dude.",d7d0d759051b131cd815adf56433627856956e11,True,False,,,,,0,1653658676,,0,{},ia6wwxr,False,t3_uyvap2,False,False,t1_ia6svj3,/r/UkraineConflict/comments/uyvap2/really_600b_usd_to_rebuild_it_will_end_up_being/ia6wwxr/,1653658693,1,True,True,False,UkraineConflict,t5_30oyx,r/UkraineConflict,public,,0,[],,1653629876.0
[],False,,theprufeshanul,#a06324,,[],afa65fb4-a101-11ec-9a63-02a4aa3dad09,Kremlin Propagandist ,light,text,t2_4pe5n7p,False,False,"Yeah bruh, Saddam was out into power by the Americans to fight Iran.

He was MURDERING his own people just like our other allies MURDER people (did you catch the Journalist who was dismembered whilst alive).

In any case bruh removing Saddam was not the justification for the war “9:11” and “WMDS” were - both proven lies

And to protect “civilians” the killed a million of them bruh. Women and kids.

And the Ukrainians were killing Russian- speakers in the East - burnt 40 of them alive in TV - were shelling the population in Donbass.

Where’s your posts saying that Zelensky should be stopped bruh?

Nah, thought not.",1be75d26efc34d0a5827e04e38b7f5ddf0f42754,True,False,,,,,0,1653658510,,0,{},ia6wkf2,False,t3_uyv8kq,False,True,t1_ia6ibd0,/r/UkraineConflict/comments/uyv8kq/what_do_we_think_of_the_kissinger_comments_why/ia6wkf2/,1653658526,1,True,True,False,UkraineConflict,t5_30oyx,r/UkraineConflict,public,,0,[],,1653629710.0
[],False,,hufforguk,,,[],,,,text,t2_4ddtxlju,False,False,"Didn't Christopher Hitchins suggest that if you gave Kissinger an enema, you could bury him in a matchbox?",accb0fe6605ab6f85f2be9f56ab439d8647b91fe,True,False,,,,,0,1653658443,,0,{},ia6wf9j,False,t3_uyv8kq,False,True,t3_uyv8kq,/r/UkraineConflict/comments/uyv8kq/what_do_we_think_of_the_kissinger_comments_why/ia6wf9j/,1653658456,1,True,True,False,UkraineConflict,t5_30oyx,r/UkraineConflict,public,,0,[],,1653629643.0
[],False,,bacondavis,,,[],,,,text,t2_3zsqb,False,False,Slava Ukraini,2fe5573e00f43496331069e87c645ea96c9a097c,True,False,,,,,0,1653657831,,0,{},ia6v5sc,False,t3_uywuov,False,True,t3_uywuov,/r/UkraineConflict/comments/uywuov/ukraine_foreign_legion_american_british_canadian/ia6v5sc/,1653657843,1,True,True,False,UkraineConflict,t5_30oyx,r/UkraineConflict,public,,0,[],,1653629031.0
[],False,,kpapenbe,,,[],,,,text,t2_ixf7ljmz,False,False,I couldn't agree more....after I left service/DoD I just couldn't fathom going into State....,e0f688b7dcc9056e8eeff2d441d6aaa4073cc8f9,True,False,,,,,0,1653657411,,0,{},ia6ua06,True,t3_uyv8kq,False,True,t1_ia6tio5,/r/UkraineConflict/comments/uyv8kq/what_do_we_think_of_the_kissinger_comments_why/ia6ua06/,1653657426,1,True,True,False,UkraineConflict,t5_30oyx,r/UkraineConflict,public,,0,[],,1653628611.0
[],False,,Disposable_Disposer,,,[],,,,text,t2_a6xbifqa,False,False,"It's taken these ""experts"" 93 days to come to this conclusion?",004b70fcf7464da85db241c68a5ce84fa8747724,True,False,,,,,0,1653657354,,0,{},ia6u5u8,False,t3_uysnn7,False,True,t3_uysnn7,/r/UkraineConflict/comments/uysnn7/leading_experts_accuse_russia_of_inciting/ia6u5u8/,1653657365,1,True,True,False,UkraineConflict,t5_30oyx,r/UkraineConflict,public,,0,[],,1653628554.0
[],False,,kpapenbe,,,[],,,,text,t2_ixf7ljmz,False,False,And in so many places...,fda29d1786ec3ee618986a1843d022ca6a2346f9,True,False,,,,,0,1653657340,,0,{},ia6u4v2,True,t3_uyvap2,False,True,t1_ia6t8pa,/r/UkraineConflict/comments/uyvap2/really_600b_usd_to_rebuild_it_will_end_up_being/ia6u4v2/,1653657358,1,True,True,False,UkraineConflict,t5_30oyx,r/UkraineConflict,public,,0,[],,1653628540.0
[],False,,UngiftigesReddit,,,[],,,,text,t2_kceoxrsc,False,False,"He sounds mentally ill at this point. The monotonous tone, the badly timed laughter, the constant repetition that he doesn’t care, because he knows he should and does not understand why he no longer does, the need to share… I think this is a person who used to care, before they got turned into a monster, and the good part of them is broken.",7647f17c233000e7f07a6276fdbdc5e9aff9c550,True,False,,,,,0,1653657197,,0,{},ia6tubj,False,t3_uypx8l,False,True,t1_ia6av2m,/r/UkraineConflict/comments/uypx8l/sbu_intercepted_call_i_dont_fcking_care_even_if/ia6tubj/,1653657213,1,True,True,False,UkraineConflict,t5_30oyx,r/UkraineConflict,public,,0,[],,1653628397.0
[],False,,Yankee_Juliet,,,[],,,,text,t2_6xxwfzts,False,False,"Yeah, he has immediate name recognition so it’s assumed that he’s the foreign policy oracle. My opinion is biased here, but my feelings towards diplomats have really waned in adulthood. They rarely have to suffer the consequences of their own poor decisions. In the military, if you make a bad call, you might die or your best friend might die. When diplomats make a bad decision, they blame someone else and go on about their lives. They received bad intelligence or the bad guy was just too bad. Rarely any true consequences and rarely and true ownership.",2175c8059fb8b4a5484a72e958f06e7f882656fe,True,False,,,,,0,1653657037,,0,{},ia6tio5,False,t3_uyv8kq,False,True,t1_ia6sapm,/r/UkraineConflict/comments/uyv8kq/what_do_we_think_of_the_kissinger_comments_why/ia6tio5/,1653657056,1,True,True,False,UkraineConflict,t5_30oyx,r/UkraineConflict,public,,0,[],,1653628237.0
[],False,,Ozar06,,,[],,,,text,t2_9dnyqlyl,False,False,Yessirr the list goes on and on. Its honestly sad.,6c24dff044626d9f7c04f30a2e1f084f1c673f33,True,False,,,,,0,1653656899,,0,{},ia6t8pa,False,t3_uyvap2,False,True,t1_ia6t5kz,/r/UkraineConflict/comments/uyvap2/really_600b_usd_to_rebuild_it_will_end_up_being/ia6t8pa/,1653656916,1,True,True,False,UkraineConflict,t5_30oyx,r/UkraineConflict,public,,0,[],,1653628099.0
[],False,,kpapenbe,,,[],,,,text,t2_ixf7ljmz,False,False,👍,78654ffdf2db3ef8dd605074250103f770177eb6,True,False,,,,,0,1653656872,,0,{},ia6t6rp,True,t3_uyv8kq,False,True,t1_ia6n6w3,/r/UkraineConflict/comments/uyv8kq/what_do_we_think_of_the_kissinger_comments_why/ia6t6rp/,1653656884,1,True,True,False,UkraineConflict,t5_30oyx,r/UkraineConflict,public,,0,[],,1653628072.0
[],False,,kpapenbe,,,[],,,,text,t2_ixf7ljmz,False,False,Starting with Internet and water and bridges and....,cc875279a5a23830d84b79e6c7b81346d0ce3b9b,True,False,,,,,0,1653656856,,0,{},ia6t5kz,True,t3_uyvap2,False,True,t1_ia6svj3,/r/UkraineConflict/comments/uyvap2/really_600b_usd_to_rebuild_it_will_end_up_being/ia6t5kz/,1653656869,1,True,True,False,UkraineConflict,t5_30oyx,r/UkraineConflict,public,,0,[],,1653628056.0
[],False,,kpapenbe,,,[],,,,text,t2_ixf7ljmz,False,False,👍,78654ffdf2db3ef8dd605074250103f770177eb6,True,False,,,,,0,1653656831,,0,{},ia6t3om,True,t3_uy42om,False,True,t1_ia6sxae,/r/UkraineConflict/comments/uy42om/wait_russia_is_open_to_a_food_corridor_so_that/ia6t3om/,1653656846,1,True,True,False,UkraineConflict,t5_30oyx,r/UkraineConflict,public,,0,[],,1653628031.0
[],False,,kpapenbe,,,[],,,,text,t2_ixf7ljmz,False,False,Or am I giving Putin too much credit LOL,107d0407a3f8646a06d99e48b76d2b76999605a9,True,False,,,,,0,1653656786,,0,{},ia6t0fn,True,t3_uyvap2,False,True,t1_ia6n8he,/r/UkraineConflict/comments/uyvap2/really_600b_usd_to_rebuild_it_will_end_up_being/ia6t0fn/,1653656801,1,True,True,False,UkraineConflict,t5_30oyx,r/UkraineConflict,public,,0,[],,1653627986.0
[],False,,Tigtig01,,,[],,,,text,t2_2ump0b6m,False,False,Back at ya happy Friday.,b51c90804970a535250d2c5eda4ced538056a304,True,False,,,,,0,1653656742,,0,{},ia6sxae,False,t3_uy42om,False,True,t1_ia6ssbh,/r/UkraineConflict/comments/uy42om/wait_russia_is_open_to_a_food_corridor_so_that/ia6sxae/,1653656755,1,True,True,False,UkraineConflict,t5_30oyx,r/UkraineConflict,public,,0,[],,1653627942.0
[],False,,Ozar06,,,[],,,,text,t2_9dnyqlyl,False,False,As much as I am glad that the US is providing money for weapons we really shouldnt be giving money to rebuild when our own infrastructure is terrible. We should be fixing our own problems here.,c052490b8a11dc1d84271e0708fd9eede2c3da13,True,False,,,,,0,1653656718,,0,{},ia6svj3,False,t3_uyvap2,False,True,t3_uyvap2,/r/UkraineConflict/comments/uyvap2/really_600b_usd_to_rebuild_it_will_end_up_being/ia6svj3/,1653656731,1,True,True,False,UkraineConflict,t5_30oyx,r/UkraineConflict,public,,0,[],,1653627918.0
[],False,,kpapenbe,,,[],,,,text,t2_ixf7ljmz,False,False,Along with the USSA as it were....recession here we come!,f8b25450090331bb6d76ccf5976841f33287ef3a,True,False,,,,,0,1653656718,,0,{},ia6svif,True,t3_uyvap2,False,True,t1_ia6r2lx,/r/UkraineConflict/comments/uyvap2/really_600b_usd_to_rebuild_it_will_end_up_being/ia6svif/,1653656731,1,True,True,False,UkraineConflict,t5_30oyx,r/UkraineConflict,public,,0,[],,1653627918.0
[],False,,kpapenbe,,,[],,,,text,t2_ixf7ljmz,False,False,HEAR HEAR!,16d8fb98fb622252a6025e8ec1facd3717fdd0bd,True,False,,,,,0,1653656700,,0,{},ia6su8t,True,t3_uyv8kq,False,True,t1_ia6si6l,/r/UkraineConflict/comments/uyv8kq/what_do_we_think_of_the_kissinger_comments_why/ia6su8t/,1653656717,1,True,True,False,UkraineConflict,t5_30oyx,r/UkraineConflict,public,,0,[],,1653627900.0
[],False,,kpapenbe,,,[],,,,text,t2_ixf7ljmz,False,False,MIC DROP......,b8bbeec7a244fbbca28424a8f40cf4c59f70165c,True,False,,,,,0,1653656689,,0,{},ia6stff,True,t3_uyv8kq,False,True,t1_ia6sp7d,/r/UkraineConflict/comments/uyv8kq/what_do_we_think_of_the_kissinger_comments_why/ia6stff/,1653656702,1,True,True,False,UkraineConflict,t5_30oyx,r/UkraineConflict,public,,0,[],,1653627889.0
