all_awardings,archived,associated_award,author,author_flair_background_color,author_flair_css_class,author_flair_richtext,author_flair_template_id,author_flair_text,author_flair_text_color,author_flair_type,author_fullname,author_patreon_flair,author_premium,body,body_sha1,can_gild,collapsed,collapsed_because_crowd_control,collapsed_reason,collapsed_reason_code,comment_type,controversiality,created_utc,distinguished,gilded,gildings,id,is_submitter,link_id,locked,no_follow,parent_id,permalink,retrieved_utc,score,score_hidden,send_replies,stickied,subreddit,subreddit_id,subreddit_name_prefixed,subreddit_type,top_awarded_type,total_awards_received,treatment_tags,unrepliable_reason,created
[],False,,human-no560,,,[],,,,text,t2_2rbev1ho,False,False,Those two approaches sound the same,aceabebb563f9fc6b3544c685381b040b23d3d36,True,False,,,,,0,1649440488,,0,{},i3xhesb,False,t3_tz1x8g,False,False,t1_i3x44d1,/r/CredibleDefense/comments/tz1x8g/ukraine_conflict_megathread/i3xhesb/,1649440503,1,False,True,False,CredibleDefense,t5_2y5ib,r/CredibleDefense,public,,0,[],,1649411688.0
[],False,,taw,,,[],,,,text,t2_iiun,False,False,"&gt; Russia can always escalate further.

Except not really. They went in with everything they got, [got wrecked](https://taw.github.io/open-source-adventures/episode-34/) and have maybe two more months before they have to withdraw to Feb 23 lines.

Even total mobilization would come too late, and they don't have equipment for those recruits beyond AKs, RPGs, and some Ural technicals.",fc0d1c0dbb4be15bdabcd6e4cc5c3dc32298deec,True,False,,,,,0,1649440464,,0,{},i3xhcj4,False,t3_tz1x8g,False,True,t1_i3xcw7g,/r/CredibleDefense/comments/tz1x8g/ukraine_conflict_megathread/i3xhcj4/,1649440481,1,False,True,False,CredibleDefense,t5_2y5ib,r/CredibleDefense,public,,0,[],,1649411664.0
[],False,,jollyreaper2112,,,[],,,,text,t2_fhp86,False,False,"The caveat will be how close you are to operate. The larger UAV's have greater range, greater loiter time. So it's kind of the same consideration of a B-52 and an A-4 are both aircraft that drop bombs but are used in different circumstances. 

Though what was funny in Vietnam is you had the B-52, a strategic bomber, flying tactical bombing missions (arc light carpet bombings with tons of dumb bombs) and F-105 tactical bombers flying strategic missions (deep raids into the North to cripple transportation.) 

What I suspect is we're still going to see a mix of drone types and sizes depending on the mission at hand, but will be able to get away with smaller drones vs. the platform they're replacing. Like if we come up with an AWACS drone, it'll likely be smaller than an E-3 and  will relay all the info to a ground station vs. needing to carry the crew along with in the air.",b1ce4edef7c4c82e5eee50c7a3e9321e0424c140,True,False,,,,,0,1649440430,,0,{},i3xh9cy,False,t3_tz1x8g,False,True,t1_i3xdzwi,/r/CredibleDefense/comments/tz1x8g/ukraine_conflict_megathread/i3xh9cy/,1649440444,1,False,True,False,CredibleDefense,t5_2y5ib,r/CredibleDefense,public,,0,[],,1649411630.0
[],False,,Gbdub87,,,[],,,,text,t2_31b362d9,False,False,"It exists just fine if you have sufficient SEAD to protect against bigger-than-MANPAD SAMs and sufficient airborne intelligence and interceptor assets to protect your CAS package. 

It’s basically the definition of air superiority. Cut out the “loiter” part of you can only maintain temporary / local superiority, but otherwise that’s pretty much how it works when you can do CAS with PGMs.",bcdef289ca102d0503a40d8ab8f0b541f4575768,True,False,,,,,0,1649440414,,0,{},i3xh7v3,False,t3_tyoapc,False,True,t1_i3wmt9w,/r/CredibleDefense/comments/tyoapc/getting_serious_about_sead_european_air_forces/i3xh7v3/,1649440428,1,False,True,False,CredibleDefense,t5_2y5ib,r/CredibleDefense,public,,0,[],,1649411614.0
[],False,,Rumezi,,,[],,,,text,t2_521opfr7,False,False,The size of their economy isn't the reason the EU won't let Russia join. It's the reason Russian domestic politics won't let Russia join.,d228a3e378d8a820f40f1970ee09492448f7e12f,True,False,,,,,0,1649440374,,0,{},i3xh46y,False,t3_tyfct0,False,True,t1_i3x5rxl,/r/CredibleDefense/comments/tyfct0/bill_clinton_why_i_expanded_nato/i3xh46y/,1649440392,1,False,True,False,CredibleDefense,t5_2y5ib,r/CredibleDefense,public,,0,[],,1649411574.0
[],False,,FiredForIncompetence,,,[],,,,text,t2_7bjrlekh,False,False,Smuggling diamonds is probably a Portuguese military tradition going back centuries.,655819b63de844f2fc96d75fb4872d2037b26ce4,True,False,,,,,0,1649440338,,0,{},i3xh0v6,False,t3_txvhjd,False,False,t1_i3xgm9m,/r/CredibleDefense/comments/txvhjd/seouls_misguided_desire_for_a_nuclear_submarine/i3xh0v6/,1649440353,1,False,True,False,CredibleDefense,t5_2y5ib,r/CredibleDefense,public,,0,[],,1649411538.0
[],False,,NutDraw,,,[],,,,text,t2_ir5jw,False,False,"Indeed, you are very human. I'll give you that.",28f5abdeca10e1ac5c1d5dc0e8048d088168c7e3,True,False,,,,,0,1649440318,,0,{},i3xgyyz,False,t3_tz1x8g,False,True,t1_i3xgbly,/r/CredibleDefense/comments/tz1x8g/ukraine_conflict_megathread/i3xgyyz/,1649440331,1,False,True,False,CredibleDefense,t5_2y5ib,r/CredibleDefense,public,,0,[],,1649411518.0
[],False,,rayfound,,,[],,,,text,t2_4fhx7,False,False,Indeed.,782b7c9847e0877ea7c75aff53f3af80bb937e06,True,False,,,,,0,1649440307,,0,{},i3xgxwz,False,t3_tz1x8g,False,True,t1_i3xg8zo,/r/CredibleDefense/comments/tz1x8g/ukraine_conflict_megathread/i3xgxwz/,1649440323,1,False,True,False,CredibleDefense,t5_2y5ib,r/CredibleDefense,public,,0,[],,1649411507.0
[],False,,Reibl12,,,[],,,,text,t2_optet,False,False,"Azov Mariupol just released 2 new videos that have been geolocated in what is presented as Russian territory in most maps.

https://twitter.com/GeoConfirmed/status/1512466665983909896?s=20&amp;t=MXl3gzr33qlsDzGjhMdQyg",9301a199bec717e0d710072f7bde4273ababe2b5,True,False,,,,,0,1649440284,,0,{},i3xgvrq,False,t3_tz1x8g,False,True,t3_tz1x8g,/r/CredibleDefense/comments/tz1x8g/ukraine_conflict_megathread/i3xgvrq/,1649440299,1,False,True,False,CredibleDefense,t5_2y5ib,r/CredibleDefense,public,,0,[],,1649411484.0
[],False,,chowieuk,,,[],,,,text,t2_b230l,False,False,"&gt;  they demonstrate to the other states in Europe the inherent risks with the breakup of an 'empire' into smaller dominions.  There were very valid fears in the Baltics and even Poland and other former Warsaw pact countries that Russia could become to them as Serbia was to its neighbours. NATO offers an appealing insurance policy against this.

ehhhhhhhhhh. Those were literal wars of independence. The warsaw pact countries especially were long 'independent' and were never part of the USSR in the first place. The scenarios just aren't comparable",97a79b2dce9913202e71bf5b7cc9cf186e80c8a6,True,False,,,,,0,1649440230,,0,{},i3xgqko,False,t3_tyfct0,False,True,t1_i3se6l1,/r/CredibleDefense/comments/tyfct0/bill_clinton_why_i_expanded_nato/i3xgqko/,1649440244,1,False,True,False,CredibleDefense,t5_2y5ib,r/CredibleDefense,public,,0,[],,1649411430.0
[],False,,IntroductionNeat2746,,,[],,,,text,t2_5bv0y43u,False,False,"Unfortunately, the Portuguese military seems to have deep corruption issues. Last year federal police bust a diamond smuggling operation run by commandos stationed in the Central African Republic. Instead of owning the blame, high brass pulled the most disgusting move and blamed it on the fact that some of the commandos were poor migrants. 

To top it off, only a few weeks ago, a police officer was beaten to death by marines while trying to break a fight in a night club. 

There's little doubt that the lack of imminent threats has take a toll on personal integrity.",1f3832d756314f87dd2c3b5f99c072d9a56af773,True,False,,,,,0,1649440186,,0,{},i3xgm9m,False,t3_txvhjd,False,True,t1_i3xesnx,/r/CredibleDefense/comments/txvhjd/seouls_misguided_desire_for_a_nuclear_submarine/i3xgm9m/,1649440199,1,False,True,False,CredibleDefense,t5_2y5ib,r/CredibleDefense,public,,0,[],,1649411386.0
[],False,,readmypokerface,,,[],,,,text,t2_9ot37,False,False,"Right, I guess what you are saying is that the West could NOT have deniability if they were to launch missiles against Russia (say, from just over the Polish-Ukraine border), because the Russians \*\*would\*\* be able to trace the missiles to NATO territory?",ef2cc90ec37c8bdfcee936df484f07b545abd91e,True,False,,,,,0,1649440163,,0,{},i3xgk5h,False,t3_tz1x8g,False,True,t1_i3xf12x,/r/CredibleDefense/comments/tz1x8g/ukraine_conflict_megathread/i3xgk5h/,1649440176,1,False,True,False,CredibleDefense,t5_2y5ib,r/CredibleDefense,public,,0,[],,1649411363.0
[],False,,Ty-the-Squirtle,,,[],,,,text,t2_n533h,False,False,"What are the chances that the endgame of the war might mirror that of the Winter War? Specifically when the Soviets got their acts together and defeated the Finnish army? That's always in my thought. The Winter War and the Battle of Grozny come to mind. Initially, Russia suffered heavy losses before regrouping and changing tactics to finally win.

If you think that it might end up that way where despite support for Ukraine Russia will ultimately will, what would be the reason?

If Russia's already at the point of no return and no amount of reorganizing or mass mobilization will prevent a final Ukranian victory, what would be the reason?",eb80453e9c80d16a19610700a4498ee972473e5c,True,False,,,,,0,1649440154,,0,{},i3xgj7t,False,t3_tz1x8g,False,True,t3_tz1x8g,/r/CredibleDefense/comments/tz1x8g/ukraine_conflict_megathread/i3xgj7t/,1649440168,1,False,True,False,CredibleDefense,t5_2y5ib,r/CredibleDefense,public,,0,[],,1649411354.0
[],False,,axearm,,,[],,,,text,t2_3wnn6,False,False,It seems like throwing a tarp over those things would have been good opsec.  Anyone have any thoughts on that?,fb67ec48f2923738b5e304b116e786b49e8a71f0,True,False,,,,,0,1649440130,,0,{},i3xggve,False,t3_tz1x8g,False,True,t1_i3w8fon,/r/CredibleDefense/comments/tz1x8g/ukraine_conflict_megathread/i3xggve/,1649440147,1,False,True,False,CredibleDefense,t5_2y5ib,r/CredibleDefense,public,,0,[],,1649411330.0
[],False,,sunny_bear,,,[],,,,text,t2_c8zfnf1,False,False,"&gt; Now that they know they're facing a real war with a determined opponent, they will transition to a more standard practice of advance, secure, &amp; reinforce.

People have been saying this since the start of the war and I still fail to see any evidence of it.",9dcaf481f8daa6daa9747be512a7b286a604046e,True,False,,,,,0,1649440101,,0,{},i3xge5c,False,t3_tz1x8g,False,True,t1_i3xbxfp,/r/CredibleDefense/comments/tz1x8g/ukraine_conflict_megathread/i3xge5c/,1649440117,1,False,True,False,CredibleDefense,t5_2y5ib,r/CredibleDefense,public,,0,[],,1649411301.0
[],False,,Glideer,,,[],,,,text,t2_kpk55,False,False,The desire to put a positive spin on every negative piece of news is very human.,e87ab54ebe9177b81c3feb89fc6c4829bd21504d,True,False,,,,,0,1649440073,,0,{},i3xgbly,False,t3_tz1x8g,False,True,t1_i3x63e8,/r/CredibleDefense/comments/tz1x8g/ukraine_conflict_megathread/i3xgbly/,1649440086,1,False,True,False,CredibleDefense,t5_2y5ib,r/CredibleDefense,public,,0,[],,1649411273.0
[],False,,human-no560,,,[],,,,text,t2_2rbev1ho,False,False,I think you meant to say “wouldn’t be”.,39733cd27598862ba934cfce88cc52cf1507b8c4,True,False,,,,,0,1649440045,,0,{},i3xg8zo,False,t3_tz1x8g,False,True,t1_i3x71co,/r/CredibleDefense/comments/tz1x8g/ukraine_conflict_megathread/i3xg8zo/,1649440064,1,False,True,False,CredibleDefense,t5_2y5ib,r/CredibleDefense,public,,0,[],,1649411245.0
[],False,,chowieuk,,,[],,,,text,t2_b230l,False,False,"Err.. The people being given weapons always want them.

Stop being so short sighted",849b6dab07e8614a695ddf820b9bbaeed274b9da,True,False,,,,,0,1649440031,,0,{},i3xg7oi,False,t3_tybcfi,False,True,t1_i3wqf0n,/r/CredibleDefense/comments/tybcfi/ukraine_conflict_daily_megathread/i3xg7oi/,1649440050,1,False,True,False,CredibleDefense,t5_2y5ib,r/CredibleDefense,public,,0,[],,1649411231.0
[],False,,readmypokerface,,,[],,,,text,t2_9ot37,False,False,"I see, thanks for the explanation. That makes it difficult to create the (dream-)scenario whereby the West supplies Ukraine with anti-ship missiles capable of reaching Sevastopol and sink the entire Russian Black Sea Fleet.",ac6ead0bcd6244511ecda2ee51b2d25ee7fd3a43,True,False,,,,,0,1649439973,,0,{},i3xg1zv,False,t3_tz1x8g,False,True,t1_i3xdzcp,/r/CredibleDefense/comments/tz1x8g/ukraine_conflict_megathread/i3xg1zv/,1649439987,1,False,True,False,CredibleDefense,t5_2y5ib,r/CredibleDefense,public,,0,[],,1649411173.0
[],False,,Duncan-M,,,[],,,,text,t2_2pdwadue,False,False,"I'm not sure. Probably not at the moment. Nor will it be safe until enough rear area troops can protect it. But once they can, minus airstrikes or occasional successful insurgent attacks, it'll greatly simplify logistics.",4dccbb052be46fb019345112180b0dd1ac3e509f,True,False,,,,,0,1649439966,,0,{},i3xg1c2,False,t3_tz1x8g,False,True,t1_i3xdxfc,/r/CredibleDefense/comments/tz1x8g/ukraine_conflict_megathread/i3xg1c2/,1649439980,1,False,True,False,CredibleDefense,t5_2y5ib,r/CredibleDefense,public,,0,[],,1649411166.0
[],False,,FriedrichvdPfalz,,,[],,,,text,t2_ghbt7t5,False,False,"&gt; We should absolutely hand them the tools to fight this war however long they want to, but also those to end it diplomatically, should they choose to.

That's what I wrote literally three comments further up.",dff34d6fe316e3f5ffa9d875900f9b9a6f786681,True,False,,,,,0,1649439925,,0,{},i3xfxgf,False,t3_tybcfi,False,True,t1_i3xeqe0,/r/CredibleDefense/comments/tybcfi/ukraine_conflict_daily_megathread/i3xfxgf/,1649439942,1,False,True,False,CredibleDefense,t5_2y5ib,r/CredibleDefense,public,,0,[],,1649411125.0
[],False,,Glideer,,,[],,,,text,t2_kpk55,False,False,"Which town just 5-10 km from Kherson? What rolling back for weeks? They've started at 20km from Kherson, and have been rolling them back for weeks and are now at 10 km from Kherson? Is that the new battle of the Somme?

I know that being told the facts is painful, but there is no need to try to cope by ad hominem attacks.",143b79e734715e40a72b503d96ce789acb064bbb,True,False,,,,,0,1649439758,,0,{},i3xfhd5,False,t3_tz1x8g,False,True,t1_i3x4acf,/r/CredibleDefense/comments/tz1x8g/ukraine_conflict_megathread/i3xfhd5/,1649439774,1,False,True,False,CredibleDefense,t5_2y5ib,r/CredibleDefense,public,,0,[],,1649410958.0
[],False,,wrosecrans,,,[],,,,text,t2_a99kk,False,False,"&gt; what prevents the Western powers from launching missile strikes against Russian positions?

Not wanting to be in a general war with Russia.",e616d2c814daa3f3c709dd9b8301355fc634d87f,True,False,,,,,0,1649439586,,0,{},i3xf12x,False,t3_tz1x8g,False,True,t1_i3xcgya,/r/CredibleDefense/comments/tz1x8g/ukraine_conflict_megathread/i3xf12x/,1649439601,1,False,True,False,CredibleDefense,t5_2y5ib,r/CredibleDefense,public,,0,[],,1649410786.0
[],False,,sunny_bear,,,[],,,,text,t2_c8zfnf1,False,False,"You can quote the article all you want but nothing there supports your argument. The base literally refused to surrender and was bombarded (you can find aerials of the pock-marked and destroyed island) losing contact with UAF command who understandably assumed they were killed in the bombardment. Nothing about this was in anyway misleading other than Russia's pathetic attempts to make something out of it.

&gt;What his stuff is based on is unverified pictures posted by the Ukrainians. We don't know where the vehicles came from in the pictures, just what the authors of them claimed.

That's how OSINT works. No one assumes these numbers to be 100% accurate and there is always assumed to be some amount of bias in the data. But it is by far the most accurate method available of judging losses until they can be completely verified after the conflict.

Just because the data makes your team look bad doesn't make it bad data.

&gt;If you weren't such a gullible moron maybe you'd realize how stupid you're being.

Just when I thought you couldn't look more pathetic.

Never claimed you were Russian. You just really wish you were one.

&gt;I just am not a gullible fool like yourself.

Yeah, you're really smart and edgy and everyone else are just ignorant sheeple. Go back to your Qanon forums.",abe0c4c30f512380e563be9a2da2d1528cd1ee7f,True,False,,,,,0,1649439578,,0,{},i3xf0c1,False,t3_txlmm4,False,True,t1_i3wd4ev,/r/CredibleDefense/comments/txlmm4/ukraine_megathread_april_6/i3xf0c1/,1649439594,1,False,True,False,CredibleDefense,t5_2y5ib,r/CredibleDefense,public,,0,[],,1649410778.0
[],False,,g2petter,,,[],,,,text,t2_jzl5,False,True,"I've heard it said that the point isn't to convince people that any single story is true, but to present so many different stories that people conclude it's impossible to know the truth.",9ae52314091b3f3f8c7271676cf28b24f9c81640,True,False,,,,,0,1649439518,,0,{},i3xeuqp,False,t3_tz1x8g,False,True,t1_i3x7ncx,/r/CredibleDefense/comments/tz1x8g/ukraine_conflict_megathread/i3xeuqp/,1649439533,1,False,True,False,CredibleDefense,t5_2y5ib,r/CredibleDefense,public,,0,[],,1649410718.0
[],False,,evo_help93,,,[],,,,text,t2_iul8dbh4,False,False,"&gt;I don't see how russia goes beyond the donbass with &lt;200k troops if they're facing a million Ukrainian militiamen and a hostile population.

This depends on a lot of factors. If Putin's fantasy comes true (highly unlikely) and Russian forces are able to destroy the Ukrainian forces in the JFO and strike a massively demoralizing blow to the Ukrainians, we may see things change. Keep in mind that while Ukraine has certainly suffered casualties, they haven't had to deal with a significant *defeat* (and I certainly hope they never do). It's possible Putin may believe that by destroying the forces in the JFO he can turn the tide in this war. 

This also assumes Putin has a similar picture to the war as you or I do. I think we can agree that not only do we have a very one sided and obfuscated view of the war, but Putin's is equally as obfuscated but probably in the opposite direction. There's a real gap between what Putin wants or believes his army can do and what they can actually accomplish in reality.",1072cebd2a2506b7a3e0f20b99f244cb56201a89,True,False,,,,,0,1649439518,,0,{},i3xeuq2,False,t3_tz1x8g,False,True,t1_i3xcwmc,/r/CredibleDefense/comments/tz1x8g/ukraine_conflict_megathread/i3xeuq2/,1649439533,1,False,True,False,CredibleDefense,t5_2y5ib,r/CredibleDefense,public,,0,[],,1649410718.0
[],False,,FiredForIncompetence,,,[],,,,text,t2_7bjrlekh,False,False,"Found an [article in German](https://www.deutschlandfunk.de/bestechungsgeld-fuer-u-boot-auftraege-100.html) about it. Looks a mix between lack of a procurement strategy for the navy, general ineptitude, and corruption. 

There was also a case of corruption involving the [sale of German submarines to Greece](https://www.zeit.de/wirtschaft/unternehmen/2013-08/ruestungsfirmen-u-boote-bestechung). 

The sales team for u-boat seems to know how to grease the right hands.",83457c306b94ef973f452bfae00107e3cee7b379,True,False,,,,,0,1649439497,,0,{},i3xesnx,False,t3_txvhjd,False,True,t1_i3xd3jy,/r/CredibleDefense/comments/txvhjd/seouls_misguided_desire_for_a_nuclear_submarine/i3xesnx/,1649439511,1,False,True,False,CredibleDefense,t5_2y5ib,r/CredibleDefense,public,,0,[],,1649410697.0
[],False,,thisispoopoopeepee,,,[],,,,text,t2_5ylfr1ja,False,False,"So you're suggesting surrender then. 

One of the greatest lessons history tells us that appeasement is doomed to fail, any policy of accommodation is just a pathway towards surrender. Because if you continue to accommodate, continue to retreat, eventually you have to face the final ultimatum.

The Ukrainian people have chosen the liberty and sovereignty as more important than their own lives. That subjugation by a foreign autocracy is unacceptable.

So i say we arm them with everything we can.

People like you would have us living in chains.",bc0dce4ba36f17efe0aa3bfb6af613af1fbbc4ef,True,False,,,,,0,1649439473,,0,{},i3xeqe0,False,t3_tybcfi,False,True,t1_i3xc17l,/r/CredibleDefense/comments/tybcfi/ukraine_conflict_daily_megathread/i3xeqe0/,1649439486,1,False,True,False,CredibleDefense,t5_2y5ib,r/CredibleDefense,public,,0,[],,1649410673.0
[],False,,IntroductionNeat2746,,,[],,,,text,t2_5bv0y43u,False,False,"The thing is, if you're going to air-raid an enemy to start an offensive, you probably need a lot of firepower. Maybe you can swarm the enemy with 1000 small UAVs, but are those uavs going to be effective against armor?",0330c0cbad9ee9d1ca92a0940a7545c2690bc5fd,True,False,,,,,0,1649439471,,0,{},i3xeq8g,False,t3_tz1x8g,False,True,t1_i3xdzwi,/r/CredibleDefense/comments/tz1x8g/ukraine_conflict_megathread/i3xeq8g/,1649439487,1,False,True,False,CredibleDefense,t5_2y5ib,r/CredibleDefense,public,,0,[],,1649410671.0
[],False,,stillobsessed,,,[],,,,text,t2_j54oj,False,False,"The launchers are mobile and likely scoot right after the launch; with the ranges involved, time of flight is measured in minutes.   So merely locating the launch sites isn't enough - you also have to track the launchers as they move, and follow the supply lines to find missiles before they launch.

Read up on the 1991 Gulf War Scud hunts for some of the difficulties involved..",6062e0c9f5b3358b181dba2155464b85ee0b4133,True,False,,,,,0,1649439457,,0,{},i3xeoxo,False,t3_tz1x8g,False,True,t1_i3xcgya,/r/CredibleDefense/comments/tz1x8g/ukraine_conflict_megathread/i3xeoxo/,1649439471,1,False,True,False,CredibleDefense,t5_2y5ib,r/CredibleDefense,public,,0,[],,1649410657.0
[],False,,Solubilityisfun,,,[],,,,text,t2_su9cy,False,False,The last 2 have been via auto mod. Hopefully it can be rigged to add this functionality. I fully agree this is important for archival purposes otherwise this might as well be Discord.,9a41a430695646d7b8be8f8ef526a88878109c24,True,False,,,,,0,1649439405,,0,{},i3xejof,False,t3_tz1x8g,False,True,t1_i3xe3rl,/r/CredibleDefense/comments/tz1x8g/ukraine_conflict_megathread/i3xejof/,1649439418,1,False,True,False,CredibleDefense,t5_2y5ib,r/CredibleDefense,public,,0,[],,1649410605.0
[],False,,Glideer,,,[],,,,text,t2_kpk55,False,False,We have zero idea how bad the casualties ate among the besiegers.,0a9398f191b6c538eaf716fb9a58c03dabce6886,True,False,,,,,0,1649439389,,0,{},i3xei6p,False,t3_tz1x8g,False,True,t1_i3x189y,/r/CredibleDefense/comments/tz1x8g/ukraine_conflict_megathread/i3xei6p/,1649439403,1,False,True,False,CredibleDefense,t5_2y5ib,r/CredibleDefense,public,,0,[],,1649410589.0
[],False,,IntroductionNeat2746,,,[],,,,text,t2_5bv0y43u,False,False,"I think he also overestimates how intimidated foreign politicians are by himself.  I very much doubt he he hasn't tried to intimidate Lukashenko many times into sending troops to Ukraine, yet he won't budge. I almost dare to say Lukashenko is the one playing 3d chess with putin, and putin looks more like one of his pawns than the other player.",e0ce9d6961c9f03f3a64af778da1d852ad3fa7e7,True,False,,,,,0,1649439298,,0,{},i3xe9gf,False,t3_tz1x8g,False,True,t1_i3xcxjs,/r/CredibleDefense/comments/tz1x8g/ukraine_conflict_megathread/i3xe9gf/,1649439315,1,False,True,False,CredibleDefense,t5_2y5ib,r/CredibleDefense,public,,0,[],,1649410498.0
[],False,,mracidglee,,,[],,,,text,t2_3p4e4,False,False,"If you put the date in the post title, it makes it easier to search later.",d9a1e78bbb8b8f98d572ade2837fc981fb9d409e,True,False,,,,,0,1649439238,,0,{},i3xe3rl,False,t3_tz1x8g,False,True,t3_tz1x8g,/r/CredibleDefense/comments/tz1x8g/ukraine_conflict_megathread/i3xe3rl/,1649439253,1,False,True,False,CredibleDefense,t5_2y5ib,r/CredibleDefense,public,,0,[],,1649410438.0
[],False,,axearm,,,[],,,,text,t2_3wnn6,False,False,https://www.aljazeera.com/features/2017/10/29/what-happened-in-marawi,0a1ab7104ac9cb80f256dd1f3168cdfeecffa082,True,False,,,,,0,1649439227,,0,{},i3xe2rn,False,t3_tz1x8g,False,True,t1_i3wppd4,/r/CredibleDefense/comments/tz1x8g/ukraine_conflict_megathread/i3xe2rn/,1649439238,1,False,True,False,CredibleDefense,t5_2y5ib,r/CredibleDefense,public,,0,[],,1649410427.0
[],False,,an_actual_lawyer,,,[],,,,text,t2_6pvo3,False,True,"Do they need to be?   The reason an A-10 is built with armor and redundancies is that pilots are expensive and planes are cheap, relatively. 

I think one of the primary lessons of this war is that it may be more effective to use 100 $100,000 UAVs rather than 1 $10,000,000 UAV. SAMs are expensive and making your enemy use them to shoot down a cheap drone os probably a smart tactic, provided you can get more of them.",0e29b810b24eef890137c1cd910fed3d1977a659,True,False,,,,,0,1649439197,,0,{},i3xdzwi,False,t3_tz1x8g,False,True,t1_i3x8i75,/r/CredibleDefense/comments/tz1x8g/ukraine_conflict_megathread/i3xdzwi/,1649439208,1,False,True,False,CredibleDefense,t5_2y5ib,r/CredibleDefense,public,,0,[],,1649410397.0
[],False,,Solubilityisfun,,,[],,,,text,t2_su9cy,False,False,"Their launches can be estimated. What you are asking for, direct counter battery intervention, that is on par with a no-fly zone in ramifications. Extremely high probability of reprisals leading to direct confrontation or outright kick starting the later.

It's a huge escalation without a sure way out. For lower gain than even a no-fly zone which appetite for among those that matter has been lacking.

Ukraine itself doesn't have the means for long range counter battery itself. The West doesn't have the same delivery methods of cruise missiles as Russia. NATO leans on air and naval delivery methods for shorter range cruise missiles rather than large reserves of ground vehicle delivery methods. It's not something that could be handed over easily to shift responsibility.",d64e6834d655c90ad9a4e79055fb0fc0dd1400d2,True,False,,,,,0,1649439192,,0,{},i3xdzcp,False,t3_tz1x8g,False,True,t1_i3xcgya,/r/CredibleDefense/comments/tz1x8g/ukraine_conflict_megathread/i3xdzcp/,1649439209,1,False,True,False,CredibleDefense,t5_2y5ib,r/CredibleDefense,public,,0,[],,1649410392.0
