all_awardings,archived,associated_award,author,author_flair_background_color,author_flair_css_class,author_flair_richtext,author_flair_template_id,author_flair_text,author_flair_text_color,author_flair_type,author_fullname,author_patreon_flair,author_premium,body,body_sha1,can_gild,collapsed,collapsed_because_crowd_control,collapsed_reason,collapsed_reason_code,comment_type,controversiality,created_utc,distinguished,gilded,gildings,id,is_submitter,link_id,locked,no_follow,parent_id,permalink,retrieved_utc,score,score_hidden,send_replies,stickied,subreddit,subreddit_id,subreddit_name_prefixed,subreddit_type,top_awarded_type,total_awards_received,treatment_tags,unrepliable_reason,created
[],False,,iwanttodrink,,,[],,,,text,t2_qtii3,False,False,"I've been saying forever that China was a paper tiger. Its massive naval buildup can't really do any force projection as its all smaller crafts and not major surface combatants. For reference Japan has 51 major surface combatants. China only has 35 or so major surface combatants. Even South Korea has 23 major surface combatants.

China's carrier operational capabilities pretty much amount to sailing in the South and East China Sea because they can't even sail into the deep Pacific Ocean. 

Most importantly their submarine capabilities are very far behind and have poor anti-submarine warfare (ASW) capabilities. Japan's ASW is top tier, and combined with the alliance of Japan, South, Korea, Taiwan, Philippines geographically there won't be a single submarine that wont be detected and tracked by the alliance and fed to the US. The US' submarines would be shooting fish in a barrel in China's seas and blockading China and there's nothing they can do about it. Assuming any Chinese landing crafts even make it onto Taiwanese beaches, US submarines can just launch missiles on the very few chokepoint beaches and wipe out any invasion force. China is an even bigger paper tiger than Russia.",1d8c89ace65d9fefda0f483c27f284f1fcfdd1f5,True,False,,,,,0,1649429020,,0,{},i3wn6mr,False,t3_tybcfi,False,False,t1_i3vx9uc,/r/CredibleDefense/comments/tybcfi/ukraine_conflict_daily_megathread/i3wn6mr/,1649429034,1,False,True,False,CredibleDefense,t5_2y5ib,r/CredibleDefense,public,,0,[],,1649400220.0
[],False,,DiminishedGravitas,,,[],,,,text,t2_2dhpf0et,False,False,"&gt; most extant US CAS platforms are slow, non-stealth vehicles designed to loiter for long periods of time at relatively low altitudes over a target area. Which is what you want for CAS. You want the planes circling within visual range of the target area, continuously providing intel and ready to strike at a moment's notice once they're needed by ground troops.

This definition of CAS does not exist in (near) peer conflicts. Enjoying a carefree loiter above the battlefield is purely the purvey of COIN operations, you need to stop think anything learned in Afghanistan or Syria is useful in Ukraine. This is precisely the mistake the Russians made.",0b7fc2e94c3ddc07e7044bdb4de93697cacb137f,True,False,,,,,0,1649428880,,0,{},i3wmt9w,False,t3_tyoapc,False,True,t1_i3v47w2,/r/CredibleDefense/comments/tyoapc/getting_serious_about_sead_european_air_forces/i3wmt9w/,1649428895,1,False,True,False,CredibleDefense,t5_2y5ib,r/CredibleDefense,public,,0,[],,1649400080.0
[],False,,Rhauko,,,[],,,,text,t2_fuiqte2,False,False,They assumed pro-Russia Ukrainians would join them / revolt,da2dac2c10ee596dfcc80f5547eb9229efa5140f,True,False,,,,,0,1649428836,,0,{},i3wmp3w,False,t3_tz1x8g,False,True,t1_i3wjeij,/r/CredibleDefense/comments/tz1x8g/ukraine_conflict_megathread/i3wmp3w/,1649428849,1,False,True,False,CredibleDefense,t5_2y5ib,r/CredibleDefense,public,,0,[],,1649400036.0
[],False,,MacchuWA,,,[],,,,text,t2_kflkm,False,False,"I feel like the author is undervaluing the F-35 here. We still don't really have a practical example of modern stealth vs modern SAMs, but it seems inevitable that at the very least they are going to struggle to maintain a kill chain. Hell, they struggle to do that against non-stealthy stuff like TB2, which claimed S-300 kills in Nagorno-Karabakh and there's video evidence for Buk kills in Ukraine.

Not saying it will be easy or bloodless, but the European F-35 fleet is growing every year, and it will give them SEAD options beyond what the author is suggesting, especially when/if the AGM-88G can be carried internally.",82bcd43deb3a5e2232c52ea61ea8bff8d127bfa8,True,False,,,,,0,1649428805,,0,{},i3wmm3s,False,t3_tyoapc,False,True,t3_tyoapc,/r/CredibleDefense/comments/tyoapc/getting_serious_about_sead_european_air_forces/i3wmm3s/,1649428820,1,False,True,False,CredibleDefense,t5_2y5ib,r/CredibleDefense,public,,0,[],,1649400005.0
[],False,,abloblololo,,,[],,,,text,t2_qhbwl,False,False,[Oryx identified](https://www.oryxspioenkop.com/2022/04/new-bayraktar-uavs-spotted-in-ukraine.html) that Ukraine are now using Mini-Bayraktars which are pure reconnaissance / surveillance UAVs. I don't believe this had been made public.,43316007c6b9d37d9157cca28ce26f7916998f31,True,False,,,,,0,1649428794,,0,{},i3wml0w,False,t3_tz1x8g,False,True,t3_tz1x8g,/r/CredibleDefense/comments/tz1x8g/ukraine_conflict_megathread/i3wml0w/,1649428812,1,False,True,False,CredibleDefense,t5_2y5ib,r/CredibleDefense,public,,0,[],,1649399994.0
[],False,,Unlucky-Prize,,,[],,,,text,t2_2ksvu6ky,False,True,"I kind of wonder how effective anti radiation missiles will even remain if we move to a lot of sensor fusion from many sensors  also of several types over time (which pose additional problems for effective stealth). A network of cameras that don’t radiate could theoretically work once something over land you control, and a bunch of small radars of similar power output to a large radar plugged into a very smart computer in some cases may be more accurate than a really big radar….",9f2c7262bfb8ede31bf64db817d4b9ea845b5d6f,True,False,,,,,0,1649428663,,0,{},i3wm8ww,False,t3_tyoapc,False,True,t1_i3tlr7v,/r/CredibleDefense/comments/tyoapc/getting_serious_about_sead_european_air_forces/i3wm8ww/,1649428680,1,False,True,False,CredibleDefense,t5_2y5ib,r/CredibleDefense,public,,0,[],,1649399863.0
[],False,,catinator9000,,,[],,,,text,t2_3v08hnug,False,False,"&gt; You're making the rookie and exceptionally common mistake of thinking that everyone would want to come to the west just because we have a higher quality of life.

No, dude I am not making that mistake. I know what you are talking about and that applies to normal circumstances, yes. Now put yourself in the shoes of some “normal” conscript thrown into this. Even if they don’t want to immigrate in general, they would fuck off instantly. Now for fun consider the less normal conscripts. You know, the ones that are looting washing machines, etc.. I don’t know if you met people like that before but they are not PhD-s with some deep thinking. You could literally offer them $1k and many would fuck off without any long term thought put into it.",09b3bb22e98f26f3c46613db98986ca45dfb4d36,True,False,,,,,0,1649428646,,0,{},i3wm7ef,False,t3_tybcfi,False,True,t1_i3vc3wx,/r/CredibleDefense/comments/tybcfi/ukraine_conflict_daily_megathread/i3wm7ef/,1649428663,1,False,True,False,CredibleDefense,t5_2y5ib,r/CredibleDefense,public,,0,[],,1649399846.0
[],False,,cheetah_swirley,,,[],,,,text,t2_dj9au,False,False,"I think a lot of these historical assumptions have to be questioned from what we've seen.

If you break it down what were the typical advantages of direct fire compared to indirect? I would say it was accuracy and response time (have I missed anything here?)

And the typical advantage of indirect fire would be sheer firepower, safer firing position, and consequent cheapness of platforms as you don't need the defensive capability of tanks (which again allows more firepower per buck)

I think then that it has to be an inevitability that indirect firepower will make direct fire obsolete as soon as technology advances sufficiently to make good on these weaknesses. With all of this drone spotting, laser target designating, and guided shelling we're seeing.. I don't know if we have hit that threshold yet but we must be getting close.",d334bed283446eb9116e143487385fac423112ce,True,False,,,,,0,1649428583,,0,{},i3wm1lk,False,t3_tz1x8g,False,True,t1_i3wdkaa,/r/CredibleDefense/comments/tz1x8g/ukraine_conflict_megathread/i3wm1lk/,1649428601,1,False,True,False,CredibleDefense,t5_2y5ib,r/CredibleDefense,public,,0,[],,1649399783.0
[],False,,DiminishedGravitas,,,[],,,,text,t2_2dhpf0et,False,False,"MANPADS don't need to be suppressed, you can simply use PGMs from altitudes beyond their engagement envelope. CAS doesn't actually require the aircraft to be physically close to the ground. The only reason MANPADS are an issue for the RuAF is their inability to conduct effective SEAD ops, something they have the equipment but not the expertise for.",83348afac11d6f239b1e0b283223f2e75b6ed9a5,True,False,,,,,0,1649428193,,0,{},i3wl1r3,False,t3_tyoapc,False,True,t1_i3v6i0e,/r/CredibleDefense/comments/tyoapc/getting_serious_about_sead_european_air_forces/i3wl1r3/,1649428206,1,False,True,False,CredibleDefense,t5_2y5ib,r/CredibleDefense,public,,0,[],,1649399393.0
[],False,,Glideer,,,[],,,,text,t2_kpk55,False,False,"That tactics of small, highly mobile units was nowhere to be seen in sothern Ukraine. It's still not in evidence.

I don't see the strategic benefit of Mariupol. Russia is in no particular hurry. Once these 7,000-8,000 Ukrainian soldiers are gone they will be able to redeploy their 15,000 elsewhere. The result is the worst defeat for Ukraine since the fall of Crimea in 2014.",a6210305865e492a00b5e1b6714ccdb863fc81fb,True,False,,,,,0,1649428139,,0,{},i3wkwrh,False,t3_tz1x8g,False,True,t1_i3wiz55,/r/CredibleDefense/comments/tz1x8g/ukraine_conflict_megathread/i3wkwrh/,1649428154,1,False,True,False,CredibleDefense,t5_2y5ib,r/CredibleDefense,public,,0,[],,1649399339.0
[],False,,Glideer,,,[],,,,text,t2_kpk55,False,False,"Well, that's also true. I guess we will see now as the front is more or less settled.",69f8d22030223c44b62de4d2f439a8b730415482,True,False,,,,,0,1649427986,,0,{},i3wkiid,False,t3_tz1x8g,False,True,t1_i3wjaig,/r/CredibleDefense/comments/tz1x8g/ukraine_conflict_megathread/i3wkiid/,1649427997,1,False,True,False,CredibleDefense,t5_2y5ib,r/CredibleDefense,public,,0,[],,1649399186.0
[],False,,AndySoc1al,,,[],,,,text,t2_16bxre,False,False,"Most of our games are played on networks above ""unclassified"" levels, with some fairly stringent STIG security requirements. I don't know if CMO is certified by NSA/CSS for SCI level, which is where I run my work ""games."" I do know that the professional version uses DIS, so it could interact with my software (ACE-IOS).",20d570e6df819160862acc8e1c1c7c015ca9413e,True,False,,,,,0,1649427921,,0,{},i3wkckd,False,t3_mxz0rj,False,True,t1_gw0dsmk,/r/CredibleDefense/comments/mxz0rj/how_accurately_do_military_simulations_like_cmo/i3wkckd/,1649427934,1,False,True,False,CredibleDefense,t5_2y5ib,r/CredibleDefense,public,,0,[],,1649399121.0
[],False,,Win32error,,,[],,,,text,t2_wodbs,False,False,"It should be anything but surprising given the way this conflict has been going. Invading from as many directions as the Russians did meant the Ukrainians were best off digging in as best they could, and it paid off. Trying to reach Mariupol would’ve been a massive mistake.

We’ll be seeing how both sides redeploy soon considering the front line basically reduced by about half its length.",1fa988248254035034f1fc090fef2f72db515b30,True,False,,,,,0,1649427856,,0,{},i3wk6mm,False,t3_tz1x8g,False,True,t1_i3whkft,/r/CredibleDefense/comments/tz1x8g/ukraine_conflict_megathread/i3wk6mm/,1649427873,1,False,True,False,CredibleDefense,t5_2y5ib,r/CredibleDefense,public,,0,[],,1649399056.0
[],False,,takishan,,,[],,,,text,t2_3eynj,False,False,"&gt; The perception of their nuclear arsenal is a matter of life or death. And corruption that fools Russian decision makers doesn’t really deteriorate the perception from abroad.

The US and Russia still maintain the New START nuclear treaty where they each individually go and inspect the other's nuclear weapons 18 times a year including a broad range of weapons. It was paused due to COVID but is expected to continue very soon. 

&gt; The treaty provides for 18 on-site inspections per year for U.S. and Russian inspection teams:  Type One inspections focus on sites with deployed and non-deployed strategic systems (up to 10 per year), and Type Two inspections focus on sites with only non-deployed strategic systems (up to 8 per year).  Permitted inspection activities include confirming the number of reentry vehicles on one deployed ICBM or SLBM per Type One inspection, counting nuclear weapons onboard or attached to deployed heavy bombers, counting numbers of non-deployed ICBMs and SLBMs, confirming weapon system conversions or eliminations are conducted in the way proposed, and confirming facility eliminations.

&gt; During inspections of deployed strategic weapon bases/facilities, each side must disclose how many warheads are on each delivery vehicle based at the inspected base, and the inspecting country has the right to inspect the loading on one delivery vehicle (chosen by the inspecting country) to confirm the declaration is accurate

There's more you can read [here](https://www.state.gov/new-start/) if you're curious

But if they wanted to maintain that perception they would either a) have to actually properly maintain their weapons or b) create an elaborate illusion to fool the American inspectors

As has been brought up by other commenters, Russia has shown they have the capacity for high tech in certain areas. Space flight, ICBMs, nuclear weapons are part of this. The Russian miliary and intelligence apparatus views these as mission-critical.",b15948668a89c0a648a126f33e61570add1d3715,True,False,,,,,0,1649427731,,0,{},i3wjv2n,False,t3_tybcfi,False,True,t1_i3vfqh2,/r/CredibleDefense/comments/tybcfi/ukraine_conflict_daily_megathread/i3wjv2n/,1649427748,1,False,True,False,CredibleDefense,t5_2y5ib,r/CredibleDefense,public,,0,[],,1649398931.0
[],False,,harassercat,,,[],,,,text,t2_ml0ua,False,False,"I think that's what we might do, in the current political climate, if a similar situation would come up. But the days before Feb 24 might as well be 10 years ago in terms of the political climate. It would have been impossible to unite NATO members behind such a reaction - Germany and France would notably have been opposed.",523982802a66663e8e6f8a6455e9b1887a8ccc29,True,False,,,,,0,1649427665,,0,{},i3wjovh,False,t3_tyfct0,False,True,t1_i3u7w0f,/r/CredibleDefense/comments/tyfct0/bill_clinton_why_i_expanded_nato/i3wjovh/,1649427678,1,False,True,False,CredibleDefense,t5_2y5ib,r/CredibleDefense,public,,0,[],,1649398865.0
[],False,,othelloblack,,,[],,,,text,t2_llyivao,False,False,"I did some quick research on this, hopefully it adds to discussion: 

per missile: 

Tomahawk cruise missile $1.5 million (news story re: syrian strikes under Trump)  
Russian s300 or s400 $1 million per  
star streak UK laser guided SAM $140k (per Nicholas Drummond on twitter)   
javelin $80k  
kornet RU anti tank missile $26k   
  
NOTE the systems to launch these cost a lot more. A patriot battery might be $1B, a russian S400 system $500M. Manpads might cost $1M.   
  
So basically the more robust SAM missiles about $1M and the shorter man portable maybe under $100k. The russian Mig 35 goes about $40M and the lesser Migs maybe $25",49cd21ce4b7d6eb62e3c2ac3896ab590ba5d0b8e,True,False,,,,,0,1649427616,,0,{},i3wjke9,False,t3_tybcfi,False,True,t1_i3uqgad,/r/CredibleDefense/comments/tybcfi/ukraine_conflict_daily_megathread/i3wjke9/,1649427631,1,False,True,False,CredibleDefense,t5_2y5ib,r/CredibleDefense,public,,0,[],,1649398816.0
[],False,,ATLtinyrick,,,[],,,,text,t2_24hvpn,False,False,Russian military leadership surely must have known that 200k troops is nowhere near enough to take a dozen major cities on several fronts?,2fe6396fb2e7cf2c2326357cd66b3322a95f050b,True,False,,,,,0,1649427553,,0,{},i3wjeij,False,t3_tz1x8g,False,True,t1_i3whli5,/r/CredibleDefense/comments/tz1x8g/ukraine_conflict_megathread/i3wjeij/,1649427575,1,False,True,False,CredibleDefense,t5_2y5ib,r/CredibleDefense,public,,0,[],,1649398753.0
[],False,,ritterteufeltod,,,[],,,,text,t2_8c4i7dmu,False,False,"I am not sure that is true. We have seen the Urkainians fighting an invasion on at least 3 fronts, depending on how you count them, so it makes sense that up to now units haven't moved across the country. Moreover we have very little reporting on Ukrainian troop movements at the operational or strategic level. So we don't know.",c8992b9977d94426ffe1c4330467e0ff400be052,True,False,,,,,0,1649427509,,0,{},i3wjaig,False,t3_tz1x8g,False,True,t1_i3whkft,/r/CredibleDefense/comments/tz1x8g/ukraine_conflict_megathread/i3wjaig/,1649427525,1,False,True,False,CredibleDefense,t5_2y5ib,r/CredibleDefense,public,,0,[],,1649398709.0
[],False,,JTBoom1,,,[],,,,text,t2_5l4vbz,False,False,"If you can spam an area with MLRS, why risk a valuable manned aircraft to strike the same target?",0eed70382ff35c7c68fa3f67fc6d51e513fe9681,True,False,,,,,0,1649427504,,0,{},i3wja0w,False,t3_tyoapc,False,True,t1_i3vcj56,/r/CredibleDefense/comments/tyoapc/getting_serious_about_sead_european_air_forces/i3wja0w/,1649427517,1,False,True,False,CredibleDefense,t5_2y5ib,r/CredibleDefense,public,,0,[],,1649398704.0
[],False,,throwdemawaaay,,,[],,,,text,t2_xzr44,False,False,"&gt;the Ruble is trading at six-week highs and is back to its pre-invasion value.

Not at all. The market is under heavy controls so that price is a fiction, not the actual clearing price. Russia has locked down capital flight, is requiring all business revenue streams abroad be converted to Rubles, and raised the prime bank rate to 20% (it's down to a whole 17% now).

If you're reading commentary saying the Ruble is back to the same strength as before, you need to pick different commentators.",0cf64d1847d621baba57e3d86b5aa5f2c10d911a,True,False,,,,,0,1649427498,,0,{},i3wj9iu,False,t3_tym4w0,False,True,t1_i3vo2n6,/r/CredibleDefense/comments/tym4w0/weaponisation_of_finance_how_the_west_unleashed/i3wj9iu/,1649427510,1,False,True,False,CredibleDefense,t5_2y5ib,r/CredibleDefense,public,,0,[],,1649398698.0
[],False,,sanderudam,,,[],,,,text,t2_6iure,False,False,"This is what I find staggering in the all the predictions that Mariupol will fall in a few weeks or a few days, or well, that Kyiv would have fallen in hours/days. 

As long as the defenders put up a fight in urban setting, it takes ages to smoke them out. And in the case of being surrounded like in Maripol - there is no smoking out possible. Russians can claim (legitimately) of taking control over many tens of square miles of Mariupol territory. Sure. But Ukrainian forces still have so many blocks to fall back on.

It might be possible for Russia to break the Ukrainians in Mariupol into smaller pockets such that Russia could free up some of their units from there. But I do not think Mariupol completely falls in this war.",4685505171807039a5e224ee1b26e07614095de8,True,False,,,,,0,1649427397,,0,{},i3wj0c0,False,t3_tz1x8g,False,True,t1_i3whli5,/r/CredibleDefense/comments/tz1x8g/ukraine_conflict_megathread/i3wj0c0/,1649427413,1,False,True,False,CredibleDefense,t5_2y5ib,r/CredibleDefense,public,,0,[],,1649398597.0
[],False,,NutDraw,,,[],,,,text,t2_ir5jw,False,False,"&gt;There is a strange lack of strategic, even operational, mobility on the Ukrainian side.

That's not true. Ukraine has been so successful because they've relied on small, highly mobile units to eviscerate Russian supply lines. It's been an incredibly mobile force that overall hasn't focused much at all on holding physical territory outside of the JFO.

&gt;That approach is costing them 7,000-8,000 of Ukraine's best soldiers in Mariupol as we speak.

Those soldiers have held down several times that number for well over a month, preventing the encirclement of 60,000+ other troops and inflicting heavy casualties on their opponents. While tragic, it's paid off.",87105521cb716cef33267cae0619b04242d57e74,True,False,,,,,0,1649427384,,0,{},i3wiz55,False,t3_tz1x8g,False,True,t1_i3whkft,/r/CredibleDefense/comments/tz1x8g/ukraine_conflict_megathread/i3wiz55/,1649427397,1,False,True,False,CredibleDefense,t5_2y5ib,r/CredibleDefense,public,,0,[],,1649398584.0
[],False,,aieeegrunt,,,[],,,,text,t2_6xvv1dhp,False,False,"How well they were prepped for storage is a huge factor. If it was essentially “parked in a field with no prep” it’s going to be a lot more work than if they drained the tanks etc

I don’t know how you assess that",f2c877b3177db5171d9757c27786fa49708972ae,True,False,,,,,0,1649427356,,0,{},i3wiwi9,False,t3_tz1x8g,False,True,t1_i3w7kg6,/r/CredibleDefense/comments/tz1x8g/ukraine_conflict_megathread/i3wiwi9/,1649427372,1,False,True,False,CredibleDefense,t5_2y5ib,r/CredibleDefense,public,,0,[],,1649398556.0
[],False,,JTBoom1,,,[],,,,text,t2_5l4vbz,False,False,"I agree with much of what you are saying, but I think that Russia has relatively recently (within the last 20 years) become much more casualty adverse, which may be a reason they are not using mass attacks anymore.  This article from Armor speaks of it:

[https://www.benning.army.mil/armor/earmor/content/issues/2017/spring/2Fiore17.pdf](https://www.benning.army.mil/armor/earmor/content/issues/2017/spring/2Fiore17.pdf)",43ca8007666d6b68713b52cba8d39a871fea7eb2,True,False,,,,,0,1649427319,,0,{},i3wit7m,False,t3_tyoapc,False,True,t1_i3w5w0u,/r/CredibleDefense/comments/tyoapc/getting_serious_about_sead_european_air_forces/i3wit7m/,1649427335,1,False,True,False,CredibleDefense,t5_2y5ib,r/CredibleDefense,public,,0,[],,1649398519.0
[],False,,taw,,,[],,,,text,t2_iiun,False,False,"Tanks would only be necessary for #YOLO Moscow. They're not necessary for defeating Russian invasion. Russia isn't all that deep into Ukraine. Excluding Crimea, Ukraine has at most 150km to push back, the deepest Russia got (forces that tried to encircle Kyiv from the East already got defeated and routed back to Russia).

They'd still be useful part of the counter-offensive.

&gt; they are quite a liability

Tanks are overrated af around here, but they're not completely useless as parts of combined arms, and Russia is bad at antitank warfare.",ce114e68d35008f029902c27d3a6c8fb7cfacf30,True,False,,,,,0,1649426926,,0,{},i3whu6i,False,t3_tz1x8g,False,True,t1_i3w9yy6,/r/CredibleDefense/comments/tz1x8g/ukraine_conflict_megathread/i3whu6i/,1649426937,1,False,True,False,CredibleDefense,t5_2y5ib,r/CredibleDefense,public,,0,[],,1649398126.0
[],False,,AnotherUselessPoster,,,[],,,,text,t2_swcyp,False,False,Exactly right,3051d854669c16a81f5955a63de472f49f68d0ed,True,False,,,,,0,1649426842,,0,{},i3whmp0,False,t3_tz1x8g,False,True,t1_i3wbl1c,/r/CredibleDefense/comments/tz1x8g/ukraine_conflict_megathread/i3whmp0/,1649426854,1,False,True,False,CredibleDefense,t5_2y5ib,r/CredibleDefense,public,,0,[],,1649398042.0
[],False,,kung-flu-fighting,,,[],,,,text,t2_8joey132,False,False,Urban combat is very slow. Fallujah took the US a month.,2d31507ccc03b0bb40a38dbc5f3c57919c97f015,True,False,,,,,0,1649426829,,0,{},i3whli5,False,t3_tz1x8g,False,True,t1_i3wg51c,/r/CredibleDefense/comments/tz1x8g/ukraine_conflict_megathread/i3whli5/,1649426848,1,False,True,False,CredibleDefense,t5_2y5ib,r/CredibleDefense,public,,0,[],,1649398029.0
[],False,,Glideer,,,[],,,,text,t2_kpk55,False,False,"I wasn't referring just to the JFO but overall. There is a strange lack of strategic, even operational, mobility on the Ukrainian side.

Though I am not sure that stubbornly hanging on to every fortified house is the smartest course of action in the JFO either. That approach is costing them 7,000-8,000 of Ukraine's best soldiers in Mariupol as we speak.",3407b291eec1325ec2b25fa1f51cfdde5f09a588,True,False,,,,,0,1649426817,,0,{},i3whkft,False,t3_tz1x8g,False,True,t1_i3wgv69,/r/CredibleDefense/comments/tz1x8g/ukraine_conflict_megathread/i3whkft/,1649426832,1,False,True,False,CredibleDefense,t5_2y5ib,r/CredibleDefense,public,,0,[],,1649398017.0
[],False,,0xF013,,,[],,,,text,t2_85wpj,False,False,I saw the cheering on Ghirkin’s VK page live that day. And then people were telling me it’s absolutely not Russia,dffaa1cb54a04959f567106fd6712b3291bf31b7,True,False,,,,,0,1649426693,,0,{},i3wh9do,False,t3_tz1x8g,False,True,t1_i3wbl1c,/r/CredibleDefense/comments/tz1x8g/ukraine_conflict_megathread/i3wh9do/,1649426711,1,False,True,False,CredibleDefense,t5_2y5ib,r/CredibleDefense,public,,0,[],,1649397893.0
[],False,,NutDraw,,,[],,,,text,t2_ir5jw,False,False,"I find that a particularly strange critique considering Ukrainian objectives in the JFO, which are mainly centered around stalling the Russian advance and making them pay dearly for every km they advance. If it's such a big issue, the Russians certainly haven't demonstrated the mobility to capitalize on it given the slow pace of their advance.

Reads a little like ""the smart thing to do would be to just run away and cede territory to us so obviously that's a problem within the Ukrainian forces.",116dcf392fd0a4e0cee3aba6f79b1b068a76e76d,True,False,,,,,0,1649426530,,0,{},i3wgv69,False,t3_tz1x8g,False,True,t1_i3wfaik,/r/CredibleDefense/comments/tz1x8g/ukraine_conflict_megathread/i3wgv69/,1649426547,1,False,True,False,CredibleDefense,t5_2y5ib,r/CredibleDefense,public,,0,[],,1649397730.0
