all_awardings,archived,associated_award,author,author_flair_background_color,author_flair_css_class,author_flair_richtext,author_flair_template_id,author_flair_text,author_flair_text_color,author_flair_type,author_fullname,author_patreon_flair,author_premium,body,body_sha1,can_gild,collapsed,collapsed_because_crowd_control,collapsed_reason,collapsed_reason_code,comment_type,controversiality,created_utc,distinguished,gilded,gildings,id,is_submitter,link_id,locked,no_follow,parent_id,permalink,retrieved_utc,score,score_hidden,send_replies,stickied,subreddit,subreddit_id,subreddit_name_prefixed,subreddit_type,top_awarded_type,total_awards_received,treatment_tags,unrepliable_reason,created
[],False,,catinator9000,,,[],,,,text,t2_3v08hnug,False,False,that's the joke,af3b5551fbee3f59d144297f8226acfaa9ac4b0c,True,False,,,,,0,1649462249,,0,{},i3yyoy3,False,t3_tz1x8g,False,True,t1_i3yxz6b,/r/CredibleDefense/comments/tz1x8g/ukraine_conflict_megathread/i3yyoy3/,1649462261,1,False,True,False,CredibleDefense,t5_2y5ib,r/CredibleDefense,public,,0,[],,1649433449.0
[],False,,n_random_variables,,,[],,,,text,t2_14mpoq,False,False,"I am not shilling for Russia, but has the Russian air force really failed? [ORYX](https://www.oryxspioenkop.com/2022/02/attack-on-europe-documenting-equipment.html) has the confirmed losses at 20, most of them ground attack types, which does not seem to outlandish against someone with MANPADs.  

We know Ukraine is getting hit with cruise missiles, which are just small subsonic planes that fly low and are otherwise completely defenseless. The fact that these get through means Russia has at least some measure of air superiority, IMO.",749357436ad81e538dffdeccb3a000bbf61b43db,True,False,,,,,0,1649462063,,0,{},i3yyahi,False,t3_tyoapc,False,True,t3_tyoapc,/r/CredibleDefense/comments/tyoapc/getting_serious_about_sead_european_air_forces/i3yyahi/,1649462076,1,False,True,False,CredibleDefense,t5_2y5ib,r/CredibleDefense,public,,0,[],,1649433263.0
[],False,,sponsoredcommenter,,,[],,,,text,t2_fk13v2vo,False,False,None have even been sent yet.,8b5725064cbe5ce4533545e523c21e145416ceb1,True,False,,,,,0,1649461919,,0,{},i3yxz6b,False,t3_tz1x8g,False,True,t1_i3y24ub,/r/CredibleDefense/comments/tz1x8g/ukraine_conflict_megathread/i3yxz6b/,1649461933,1,False,True,False,CredibleDefense,t5_2y5ib,r/CredibleDefense,public,,0,[],,1649433119.0
[],False,,OhSillyDays,,,[],,,,text,t2_h1c0qtwi,False,False,"OOOOR you have a competitive advantage. One of those is Ukraine is not Russia, so they won't threaten to shut off gas if they fall on a stick.",b3aca10626b1d94b26acb8468439fe974f1bf2c8,True,False,,,,,0,1649461914,,0,{},i3yxypv,False,t3_tz1x8g,False,True,t1_i3yrkdd,/r/CredibleDefense/comments/tz1x8g/ukraine_conflict_megathread/i3yxypv/,1649461925,1,False,True,False,CredibleDefense,t5_2y5ib,r/CredibleDefense,public,,0,[],,1649433114.0
[],False,,Casual_Wizard,,,[],,,,text,t2_ioxv7,False,False,"Satellites are predictable, you can give your troops timetables for when to not move big stuff around based on that. Also, you need to know where you suspect something to be, because combing through satellite pictures of a large area takes time, which the target can use to move.",b7a08a4df6591ff51fb4cf30279edc49ae70e2f4,True,False,,,,,0,1649461750,,0,{},i3yxlw6,False,t3_tyoapc,False,False,t1_i3yt8fp,/r/CredibleDefense/comments/tyoapc/getting_serious_about_sead_european_air_forces/i3yxlw6/,1649461764,1,False,True,False,CredibleDefense,t5_2y5ib,r/CredibleDefense,public,,0,[],,1649432950.0
[],False,,catinator9000,,,[],,,,text,t2_3v08hnug,False,False,"I personally don't see them successfully retaking Kyiv. They failed miserably when they were in a much stronger position, I don't see how they will succeed now. Otherwise, IMO anything is possible: from Russia successfully pushing through the rest of Donbas, to experiencing catastrophic failures and losing everything including Crimea (or anything in between these two extremes).",eb18c34679d168950d1b2a478bf123d9bee08dd4,True,False,,,,,0,1649461452,,0,{},i3ywyft,False,t3_tz1x8g,False,True,t1_i3yuyxb,/r/CredibleDefense/comments/tz1x8g/ukraine_conflict_megathread/i3ywyft/,1649461467,1,False,True,False,CredibleDefense,t5_2y5ib,r/CredibleDefense,public,,0,[],,1649432652.0
[],False,,BlackFrags,,,[],,,,text,t2_fwxt1,False,False,Berydansk has shown no signs of activity in satellite images since those 2(?) ships were sunk,babaddba58ff6a852a2df2361dbb16c573c43091,True,False,,,,,0,1649461406,,0,{},i3ywuqj,False,t3_tz1x8g,False,True,t1_i3x93r5,/r/CredibleDefense/comments/tz1x8g/ukraine_conflict_megathread/i3ywuqj/,1649461424,1,False,True,False,CredibleDefense,t5_2y5ib,r/CredibleDefense,public,,0,[],,1649432606.0
[],False,,jinxbob,,,[],,,,text,t2_8dfa2,False,False,"It is clear to me you don't understand enough to hold this discussion

1. F-35's and Reapers are FIXED WING aviation. The first person to mention helicopters was yourself, half way down the thread, clutching at straws. You brought up helicopters. To be clear, helicopters while able to contribute to an air campaign are primarily operated as rapid maneuver elements of the a ground war and should be considered as such. A typical SEAD/DEAD package today would be a combination of EA-18, F-35, and F-16C/J,  with support from the wide variety of resources available (Rivet Joint, Global Hawk, Reapers etc.). All of these are fixed wing! 

2. Lets get another thing clear, helicopters are vulnerable to MANPADS, especially if your operating them like the russians are. Now if we talk about SHORAD, the range of the guided ATGM's used by helicopters is entirely governed by how far away the helicopter needs to be to safeyl snipe the SHORAD's before attacking the forces its guarding. I.e. stand off engagement with precision weapons, which is the thrust of my original comment.

3. Since when are we talking about CAS. You yourself said this was a conversation about SEAD. It's clear you don't understand US doctrine in the slightest. Hell you don't even understand the full set of mission sets that would be undertaken, and what would be the most prevalent mission. Air Interdiction would be the main mission for any US air force in ukraine, enabled by SEAD/DCA/OCA missions. CAS would be a common mission, but the best bombs dropped are those that stop the enemy from even rocking up to fight in the first place, which is the point of the interdiction mission.

4. The advent of precision weapons, and targeting pods, means CAS can be completed from medium and high altitude, since you have both better vision with the targeting pods (zoom, day night, thermal) and more time to build battlefield awareness and/or be talked on to target since you can start the process 50NM away. Then once the target is confirmed, laying a precision weapon (most likely GPS guided, not lasered) on a close in target is much safer for forces on the ground, then the pilot doing it with dumb bombs, cannons and mark 1 eyeball. The only reason people have visions of low-level CAS still being relevant is the prevalence of ""show of force"" missions in afghanistan, and the until recent lack of modern targeting equipment the A-10C Dinosaur.",c42d7c14c5996cc69265107da686d9f1a18866f6,True,False,,,,,0,1649461396,,0,{},i3ywtx9,False,t3_tyoapc,False,True,t1_i3w0apq,/r/CredibleDefense/comments/tyoapc/getting_serious_about_sead_european_air_forces/i3ywtx9/,1649461409,1,False,True,False,CredibleDefense,t5_2y5ib,r/CredibleDefense,public,,0,[],,1649432596.0
[],False,,Tausendberg,,,[],,,,text,t2_w59bt,False,True,"&gt; Is it still realistic that he tries to take all of the east + Kyiv?

no",1b73788434e6ca811067fe56de13084a51f275df,True,False,,,,,0,1649461344,,0,{},i3ywptg,False,t3_tz1x8g,False,True,t1_i3yuyxb,/r/CredibleDefense/comments/tz1x8g/ukraine_conflict_megathread/i3ywptg/,1649461358,1,False,True,False,CredibleDefense,t5_2y5ib,r/CredibleDefense,public,,0,[],,1649432544.0
[],False,,Aeviaan,,,[],,,,text,t2_7ypfh,False,False,"I absolutely agree that counterintelligence here was likely huge, and maybe even helped tip the scales towards an outright invasion, but I think the original post was basically overstating the effect or labeling the entire thing as an engineered war. Let's remember that there was no guarantee it would get to this point, and US/NATO intelligence explicitly warned of Kyiv falling in the first 2 weeks.",7aad728ffe9cfcb3c4e25825fea7b7612d27418b,True,False,,,,,0,1649461311,,0,{},i3ywn6h,False,t3_tz1x8g,False,True,t1_i3yhrk8,/r/CredibleDefense/comments/tz1x8g/ukraine_conflict_megathread/i3ywn6h/,1649461329,1,False,True,False,CredibleDefense,t5_2y5ib,r/CredibleDefense,public,,0,[],,1649432511.0
[],False,,Simonbargiora,,,[],,,,text,t2_6chasa6x,False,False,And none of them seem to be interested in sharing anything.,3abfcd3fdeaf30e43ca379812f7c8d94b1c12731,True,False,,,,,0,1649461089,,0,{},i3yw5au,True,t3_tyok2t,False,True,t1_i3u0p6x,/r/CredibleDefense/comments/tyok2t/what_are_other_countries_versions_of_defence/i3yw5au/,1649461103,1,False,True,False,CredibleDefense,t5_2y5ib,r/CredibleDefense,public,,0,[],,1649432289.0
[],False,,covad_commander,,,[],,,,text,t2_8e3gwkyg,False,False,I wonder if the Russians are using those mobile crematoria to destroy soldier’s bodies so they’re MIA rather than KIA.,e13e3804e26ef97911838cfd5522677ad63263f6,True,False,,,,,0,1649461021,,0,{},i3yvzwf,False,t3_tz1x8g,False,True,t1_i3yueoa,/r/CredibleDefense/comments/tz1x8g/ukraine_conflict_megathread/i3yvzwf/,1649461037,1,False,True,False,CredibleDefense,t5_2y5ib,r/CredibleDefense,public,,0,[],,1649432221.0
[],False,,n_random_variables,,,[],,,,text,t2_14mpoq,False,False,"All very good points, and I recognize that the article in question is specifically about EU air forces minus the US. However, I do not find it very probable that NATO will ever fight the russians A) ever, B) if they do, without the US with them (although the last few years makes this less certain). So I dont know much these short comings matter.",9df728ca1b7795630bb04bfde657f428e3cb5814,True,False,,,,,0,1649460982,,0,{},i3yvwrx,False,t3_tyoapc,False,True,t1_i3y67y9,/r/CredibleDefense/comments/tyoapc/getting_serious_about_sead_european_air_forces/i3yvwrx/,1649461000,1,False,True,False,CredibleDefense,t5_2y5ib,r/CredibleDefense,public,,0,[],,1649432182.0
[],False,,taw,,,[],,,,text,t2_iiun,False,False,"That's NATO thinking. Training standards in Russian army are so far below NATO standards people find it hard to comprehend just how bad Russians are.

Same with Israel vs Arabs.

There's some exceptions, but in general dictators like Putin can't have good armies, as they're too afraid of a coup deposing them.",27ca211467d7dc58d03459a9f97a186e40ffc962,True,False,,,,,0,1649460978,,0,{},i3yvwgo,False,t3_txlmm4,False,True,t1_i3xtzlr,/r/CredibleDefense/comments/txlmm4/ukraine_megathread_april_6/i3yvwgo/,1649460990,1,False,True,False,CredibleDefense,t5_2y5ib,r/CredibleDefense,public,,0,[],,1649432178.0
[],False,,GMHGeorge,,,[],,,,text,t2_5vag7l,False,False,"There was reporting maybe 2 weeks ago that 2,500 bodies had passed thru Belarus on the way back to Russia.",38de7dc6c884ca97028e279322c0af39496ea40d,True,False,,,,,0,1649460864,,0,{},i3yvn8p,False,t3_tz1x8g,False,True,t1_i3yoaik,/r/CredibleDefense/comments/tz1x8g/ukraine_conflict_megathread/i3yvn8p/,1649460879,1,False,True,False,CredibleDefense,t5_2y5ib,r/CredibleDefense,public,,0,[],,1649432064.0
[],False,,abloblololo,,,[],,,,text,t2_qhbwl,False,False,Tbf there’s very little to go on when estimating the local territorial considerations of that siege.,e2ef64f9978d720e270218c5578af7a38c033b93,True,False,,,,,0,1649460863,,0,{},i3yvn7h,False,t3_tz1x8g,False,True,t1_i3yt0i3,/r/CredibleDefense/comments/tz1x8g/ukraine_conflict_megathread/i3yvn7h/,1649460879,1,False,True,False,CredibleDefense,t5_2y5ib,r/CredibleDefense,public,,0,[],,1649432063.0
[],False,,Boring_Ad_3065,,,[],,,,text,t2_8pgbhtgn,False,False,"I’d agree that ATGM would probably work against landing craft, but… the crossing is about to 110 miles, and I think the dday landings were about 25 miles. For China to attempt that landing, they’d need air superiority which means taking out most of the Air Force, SAMs, and anything any allied countries decide to throw in the mix. Plus any dedicated anti-ship weapons. 

And stingers aren’t going to take out jets doing bombing runs (star streak has a 7km engagement range, stingers appear to be 4-5km for earlier generations). 

So by time you get to these weapons, the war is already going very poorly for you and the other side will achieve at least partial victory.",9f55587f317a6106f0d8d192ce97de058ce57bcf,True,False,,,,,0,1649460784,,0,{},i3yvgq4,False,t3_tz1x8g,False,True,t1_i3yoj15,/r/CredibleDefense/comments/tz1x8g/ukraine_conflict_megathread/i3yvgq4/,1649460797,1,False,True,False,CredibleDefense,t5_2y5ib,r/CredibleDefense,public,,0,[],,1649431984.0
[],False,,smt1,,,[],,,,text,t2_4cr5e,False,True,"&gt;but they are still too reliant on the UA in my opinion

though they seem to filter out the worst of UA-propganda. so far ISW seems to have pretty decent predictive power.",5753ea732284b7db2323e2314e4b059d07ff2bb7,True,False,,,,,0,1649460770,,0,{},i3yvfm0,False,t3_tz1x8g,False,True,t1_i3yml41,/r/CredibleDefense/comments/tz1x8g/ukraine_conflict_megathread/i3yvfm0/,1649460783,1,False,True,False,CredibleDefense,t5_2y5ib,r/CredibleDefense,public,,0,[],,1649431970.0
[],False,,NomadRover,,,[],,,,text,t2_2r60xo3y,False,False,"I have said this from the beginning, had Eastern Ukraine been inhabited by Chechens, all the cities would be flat. The Army will be loathe to kill people like them. This will change as more Russians get killed.

The massacre in Bucha is likely to be a result of undertrained troops panicking and shooting everyone. 

I am surprised by how badly the Russians have been trained. All the reports suggested that Russian Army is smaller, better trained version of the Red Army.",3cbc64289a2256a103f51080f995a0b6604c6da5,True,False,,,,,0,1649460711,,0,{},i3yvau8,False,t3_tyoapc,False,True,t1_i3yu9zd,/r/CredibleDefense/comments/tyoapc/getting_serious_about_sead_european_air_forces/i3yvau8/,1649460724,1,False,True,False,CredibleDefense,t5_2y5ib,r/CredibleDefense,public,,0,[],,1649431911.0
[],False,,smt1,,,[],,,,text,t2_4cr5e,False,True,I assume Russia was trying to drum up something similar to [what happened in Odessa in 2014](https://en.wikipedia.org/wiki/2014_pro-Russian_unrest_in_Ukraine#Odessa_Oblast).,e2d9f3fa953f58c9fc8d87ac98a8ade59166d650,True,False,,,,,0,1649460647,,0,{},i3yv5oh,False,t3_tz1x8g,False,True,t1_i3yqskw,/r/CredibleDefense/comments/tz1x8g/ukraine_conflict_megathread/i3yv5oh/,1649460666,1,False,True,False,CredibleDefense,t5_2y5ib,r/CredibleDefense,public,,0,[],,1649431847.0
[],False,,Special-G,,,[],,,,text,t2_135re8,False,False,"JSOC also has the WMD recovery mission set. This was a mission that was extensively trained for, by Delta Force operators, in the 90’s.",3fdcaf3129b9585a0cefe85e4d05d3fc04db108b,True,False,,,,,0,1649460571,,0,{},i3yuzjh,False,t3_tz5e5o,False,True,t3_tz5e5o,/r/CredibleDefense/comments/tz5e5o/loose_nukes_in_the_post_cold_war_nuclear_material/i3yuzjh/,1649460590,1,False,True,False,CredibleDefense,t5_2y5ib,r/CredibleDefense,public,,0,[],,1649431771.0
[],False,,tzirzemi,,,[],,,,text,t2_12gfwp,False,False,"What do you believe to be the outcome of the invasion of Ukraine?

The war has developed in a way most people wouldn’t expect. In what way do you think the invasion will develop? Will Putin take the Donbass and stop after? Is it still realistic that he tries to take all of the east + Kyiv? No one knows for sure of course, just curious what you guys think!

Sorry for my bad English, it isn’t my first language.",174bbabd533431f85cad074fe0bfe1f681865322,True,False,,,,,0,1649460563,,0,{},i3yuyxb,False,t3_tz1x8g,False,True,t3_tz1x8g,/r/CredibleDefense/comments/tz1x8g/ukraine_conflict_megathread/i3yuyxb/,1649460574,1,False,True,False,CredibleDefense,t5_2y5ib,r/CredibleDefense,public,,0,[],,1649431763.0
[],False,,yalloc,,,[],,,,text,t2_7txgb79b,False,False,They have appointed a few pro Russian locals to positions of power there but there doesn't seem to be enough popular will there to even maintain some semblance of legitimacy.,d064e4bc867fda4967415f15d89043499c531622,True,False,,,,,0,1649460392,,0,{},i3yul3p,False,t3_tz1x8g,False,True,t1_i3yqskw,/r/CredibleDefense/comments/tz1x8g/ukraine_conflict_megathread/i3yul3p/,1649460409,1,False,True,False,CredibleDefense,t5_2y5ib,r/CredibleDefense,public,,0,[],,1649431592.0
[],False,,technologyisnatural,,,[],,,,text,t2_3xuv1,False,False,Kherson fell easily due to traitors.  No one would willing become one of Putin’s slaves.,74debad12b9db49c8210d09a0e67151520c23203,True,False,,,,,0,1649460352,,0,{},i3yuhsu,False,t3_tz1x8g,False,True,t1_i3yqskw,/r/CredibleDefense/comments/tz1x8g/ukraine_conflict_megathread/i3yuhsu/,1649460369,1,False,True,False,CredibleDefense,t5_2y5ib,r/CredibleDefense,public,,0,[],,1649431552.0
[],False,,yalloc,,,[],,,,text,t2_7txgb79b,False,False,"Tbh I don't think there is the political will to recover them anyways.

Moscow has promised 5 million rubles (~50,000 USD) to the families of each dead Russian soldier. No body, no death. If this is true, then there is also a great irony in that their slogan for the war in the mainland is ""we don't leave our own behind.""",cd787997e0791efe821e32e64b84542e36b8650e,True,False,,,,,0,1649460314,,0,{},i3yueoa,False,t3_tz1x8g,False,True,t1_i3yseo9,/r/CredibleDefense/comments/tz1x8g/ukraine_conflict_megathread/i3yueoa/,1649460331,1,False,True,False,CredibleDefense,t5_2y5ib,r/CredibleDefense,public,,0,[],,1649431514.0
[],False,,robothistorian,,,[],,,,text,t2_2inubrvw,False,False,"&gt;The Russian army was led by riot police, it shows that Russians weren't expecting the resistance they encountered.

It's interesting you say this. In an earlier post either in this sub or elsewhere I had noted a similar point - not about the Russian forces being spear-headed by riot police, but of this being something akin to a MOOTW. It certainly looks and feels that way. But like in everything else about this conflict, there isn't much that at least I can confirm (or deny).",a7637ec1a43702b51aa0c164495890404febd744,True,False,,,,,0,1649460255,,0,{},i3yu9zd,False,t3_tyoapc,False,True,t1_i3ytnr2,/r/CredibleDefense/comments/tyoapc/getting_serious_about_sead_european_air_forces/i3yu9zd/,1649460272,1,False,True,False,CredibleDefense,t5_2y5ib,r/CredibleDefense,public,,0,[],,1649431455.0
[],False,,Lejeune_Dirichelet,,,[],,,,text,t2_jok2d,False,False,"It's definitely better for the West if Putin stays in power. Russia is about to experience a really harsh decade, with fossil fuels becoming obsolete. A major economic downturn is guaranteed. It's far better if it happens during Putin's tenure, so that he takes the blame, than if it happens during the chaos following the fall of the regime. Or else the Russian population will find a way to somehow turn it around into being victimized by the West, just like how they blame the IMF for the failed and corrupt privatization of Soviet assets, instead of their own leadership, who was in charge of the process.",6f93f1563edbe510346e45e3880387509c70d5d8,True,False,,,,,0,1649460070,,0,{},i3ytupy,False,t3_tz1x8g,False,True,t1_i3yek9l,/r/CredibleDefense/comments/tz1x8g/ukraine_conflict_megathread/i3ytupy/,1649460085,1,False,True,False,CredibleDefense,t5_2y5ib,r/CredibleDefense,public,,0,[],,1649431270.0
[],False,,metarinka,,,[],,,,text,t2_6e7oe,False,False,"Remember to Ukraine has committed ALL of it's troops and national guard, they aren't holding back.   Russia has a material advantage but it's not right for the type of war they are trying to fight.  Sending in more poorly trained concscript units will just get them killed.",874b5619a5cc5a3bb907ac6c5f9b4c8f2e1f1a39,True,False,,,,,0,1649460067,,0,{},i3ytuhj,False,t3_tz1x8g,False,True,t1_i3xxazo,/r/CredibleDefense/comments/tz1x8g/ukraine_conflict_megathread/i3ytuhj/,1649460085,1,False,True,False,CredibleDefense,t5_2y5ib,r/CredibleDefense,public,,0,[],,1649431267.0
[],False,,NomadRover,,,[],,,,text,t2_2r60xo3y,False,False,"&gt;Russian military doctrine lays a lot of emphasis on prepping the battlespace with intensive artillery/rocket strikes. This has been a distinctive feature of their doctrine since WW2. Most recently we saw this in Grozny and also, to some extent, in Georgia. But oddly this has been absent in Ukraine - at least to the extent that we have seen previously. The question is why?

I assumed because the area targeted by Russia had Russian speaking population and they wanted to avoid civilian casualties. Given the resistance Russia has faced, this is changing and I fear will change further. 

The Russian army was led by riot police, it shows that Russians weren't expecting the resistance they encountered.",5300f2a56152b9e7a334043fd89791a97f948963,True,False,,,,,0,1649459985,,0,{},i3ytnr2,False,t3_tyoapc,False,False,t1_i3w5w0u,/r/CredibleDefense/comments/tyoapc/getting_serious_about_sead_european_air_forces/i3ytnr2/,1649459999,1,False,True,False,CredibleDefense,t5_2y5ib,r/CredibleDefense,public,,0,[],,1649431185.0
[],False,,Glideer,,,[],,,,text,t2_kpk55,False,False,"I think we need to be very careful about claims in an environment where everybody is trying to advertise their product.

Every tank kill is a St Javelin, every air to surface kill is a TB-2 (cue the ""Bayraktar"" song) and now every aircraft shot down will be a Starstreak - I saw it claimed for the Mi-28 and now for the Su-35.",5b25fc2448d30522b12d28cc9e8e7f49d10be621,True,False,,,,,0,1649459974,,0,{},i3ytmu8,False,t3_tyoapc,False,True,t1_i3xpoic,/r/CredibleDefense/comments/tyoapc/getting_serious_about_sead_european_air_forces/i3ytmu8/,1649459985,1,False,True,False,CredibleDefense,t5_2y5ib,r/CredibleDefense,public,,0,[],,1649431174.0
[],False,,NomadRover,,,[],,,,text,t2_2r60xo3y,False,False,"Does Russia have a surveillance satellite capability? If they did, wouldn't they have seen these systems being deployed?",c8caf44887909a5d3aebc9dcaec41e0ffc12eb88,True,False,,,,,0,1649459797,,0,{},i3yt8fp,False,t3_tyoapc,False,False,t1_i3w8urz,/r/CredibleDefense/comments/tyoapc/getting_serious_about_sead_european_air_forces/i3yt8fp/,1649459808,1,False,True,False,CredibleDefense,t5_2y5ib,r/CredibleDefense,public,,0,[],,1649430997.0
[],False,,Tausendberg,,,[],,,,text,t2_w59bt,False,True,"If anything, when it comes to Mariupol, they've been pessimistic towards the Ukrainian position to a degree that was not borne out by reality.",85afc53eeadb786336cc5ca475cb488dd9c4369a,True,False,,,,,0,1649459700,,0,{},i3yt0i3,False,t3_tz1x8g,False,True,t1_i3ypfoe,/r/CredibleDefense/comments/tz1x8g/ukraine_conflict_megathread/i3yt0i3/,1649459714,1,False,True,False,CredibleDefense,t5_2y5ib,r/CredibleDefense,public,,0,[],,1649430900.0
[],False,,IcecreamLamp,,,[],,,,text,t2_ej9rs,False,False,"In 8 years they've barely managed to produce a handful of T-14s. If they couldn't before, they definitely can't after all the sanctions.",519315bf9a7ed6b7aeefe5a3577af2335b5f2253,True,False,,,,,0,1649459672,,0,{},i3ysybz,False,t3_tz1x8g,False,True,t1_i3y5bml,/r/CredibleDefense/comments/tz1x8g/ukraine_conflict_megathread/i3ysybz/,1649459684,1,False,True,False,CredibleDefense,t5_2y5ib,r/CredibleDefense,public,,0,[],,1649430872.0
[],False,,BiAsALongHorse,,,[],,,,text,t2_k0qzi,False,False,"Current drones can do enough of the work of dedicated attack aircraft that the remainder can pretty much be done with fighters and fighter bombers. There's an argument that few if any large militaries operate enough heavier drones for them to have no use for attack aircraft in a near-peer war, but I'd argue the tech and capabilities are there already.",c34eb2c6d3fd4f589154224c3acecd5b4c88fbbf,True,False,,,,,0,1649459638,,0,{},i3ysvib,False,t3_tz1x8g,False,True,t1_i3xjy0f,/r/CredibleDefense/comments/tz1x8g/ukraine_conflict_megathread/i3ysvib/,1649459656,1,False,True,False,CredibleDefense,t5_2y5ib,r/CredibleDefense,public,,0,[],,1649430838.0
[],False,,Antique-Bug462,,,[],,,,text,t2_8v8qmux8,False,False,It's possible that russian military leadership also doesn't know the true number. It is probable that many officers underreport kia numbers so they don't get degraded when suffering high losses. Also the russian cc wasn't up to 21st century warfare. There could be many units who lost contact to their commanders and losses there wouldn't be realised until much later. Maybe it is even difficult for them to get all the recorded numbers in one place given the lack of a theatre commander. Apperently the units were commanded by their native military district and not by a single command.,84297f5192a60228f4dd2261b6ae40a1f7aa4bfa,True,False,,,,,0,1649459431,,0,{},i3yseo9,False,t3_tz1x8g,False,True,t1_i3yoaik,/r/CredibleDefense/comments/tz1x8g/ukraine_conflict_megathread/i3yseo9/,1649459444,1,False,True,False,CredibleDefense,t5_2y5ib,r/CredibleDefense,public,,0,[],,1649430631.0
[],False,,BiAsALongHorse,,,[],,,,text,t2_k0qzi,False,False,That self-sufficiency could be a big deal on its own when it comes to Russian influence.,7c37b63743f9b37e05eae5e52b4159f84a217b61,True,False,,,,,0,1649459303,,0,{},i3ys48d,False,t3_tz1x8g,False,True,t1_i3xdmvq,/r/CredibleDefense/comments/tz1x8g/ukraine_conflict_megathread/i3ys48d/,1649459318,1,False,True,False,CredibleDefense,t5_2y5ib,r/CredibleDefense,public,,0,[],,1649430503.0
