all_awardings,archived,associated_award,author,author_flair_background_color,author_flair_css_class,author_flair_richtext,author_flair_template_id,author_flair_text,author_flair_text_color,author_flair_type,author_fullname,author_patreon_flair,author_premium,body,body_sha1,can_gild,collapsed,collapsed_because_crowd_control,collapsed_reason,collapsed_reason_code,comment_type,controversiality,created_utc,distinguished,gilded,gildings,id,is_submitter,link_id,locked,no_follow,parent_id,permalink,retrieved_utc,score,score_hidden,send_replies,stickied,subreddit,subreddit_id,subreddit_name_prefixed,subreddit_type,top_awarded_type,total_awards_received,treatment_tags,unrepliable_reason,created
[],False,,TakoyakiBoxGuy,,,[],,,,text,t2_iz0to,False,False,"That isn't just the Soviet/Russian view. Or even just the view from countries opposed to NATO.

Brzezinski (our own national security advisor under Carter and Johnson) basically called NATO the American protectorate. De Gaulle left the NATO command structure to pursue greater autonomy.

And looking at the NATO command structure, it is completely under American control. The General Secretary is a PR figurehead dedicated to preserving relations among member states, and is always a European, who understands European politics.

But the SACEUR (Supreme Allied Commander Europe) of NATO is **always** a US general, the head of US European Command. In other words, all of NATO's forces report to a US general who reports to the US president. In other words, an American-dominated, American-controlled alliance whose members generally perform roles dictated by the American military (this last part isn't necessarily because of the command structure, but more because of the inability of smaller countries to field militaries that can perform every task; instead, they focus on capabilities within the NATO alliance).

So yes, a very tough sell. Personally, I'd agree with Kennan or Mearsheimer- NATO was to keep the Americans in, the Russians out, and the Germans down. Post Cold War, it should have been dissolved and a new, European-dominated alliance (obviously including the US, because we would not have allowed ourselves to be excluded) based around the EU and with Russia as an active participant, not an outside threat, might have safeguarded the peace better.",47d46dd6ed9cfdbe781d52d94e6efdd419b162b0,True,False,,,,,0,1649401602,,0,{},i3vcpv9,False,t3_tyfct0,False,True,t1_i3sguax,/r/CredibleDefense/comments/tyfct0/bill_clinton_why_i_expanded_nato/i3vcpv9/,1649401618,1,False,True,False,CredibleDefense,t5_2y5ib,r/CredibleDefense,public,,0,[],,1649372802.0
[],False,,hell_jumper9,,,[],,,,text,t2_4x550gu9,False,False,Make it a plus if they defect with an expensive equipment/vehicle. T90 or Su30 series,aa50197ea2fd21647f564832c97843d188e9d310,True,False,,,,,0,1649401499,,0,{},i3vckz4,False,t3_tybcfi,False,True,t1_i3utqku,/r/CredibleDefense/comments/tybcfi/ukraine_conflict_daily_megathread/i3vckz4/,1649401510,1,False,True,False,CredibleDefense,t5_2y5ib,r/CredibleDefense,public,,0,[],,1649372699.0
[],False,,Salty_Bus_2072,,,[],,,,text,t2_8v0yr632,False,False,"The Russians, who don’t care about Collateral damage, could just use MLRS with cluster munitions as SEA MANPADS",4fd00dfd886520840e1f20ce9c5c89aa5582fb8d,True,False,,,,,0,1649401462,,0,{},i3vcj56,False,t3_tyoapc,False,True,t1_i3ux60k,/r/CredibleDefense/comments/tyoapc/getting_serious_about_sead_european_air_forces/i3vcj56/,1649401476,1,False,True,False,CredibleDefense,t5_2y5ib,r/CredibleDefense,public,,0,[],,1649372662.0
[],False,,Glideer,,,[],,,,text,t2_kpk55,False,False,"No, it was not about political support, that's well documented. Both the USA and the UK allowed various Chechen organisations to operate in their countries, collect funds and volunteers and channel them to Chechnya.

This was about former UK officers training Chechens, not as individual volunteers but as members of a state-sanctioned ""NGO"".",43d4d410d9d67c0ca34295a2d07663104e988086,True,False,,,,,0,1649401453,,0,{},i3vcinq,False,t3_tyfct0,False,True,t1_i3uabbo,/r/CredibleDefense/comments/tyfct0/bill_clinton_why_i_expanded_nato/i3vcinq/,1649401470,1,False,True,False,CredibleDefense,t5_2y5ib,r/CredibleDefense,public,,0,[],,1649372653.0
[],False,,chowieuk,,,[],,,,text,t2_b230l,False,False,"Have we heard anything about the international 'volunteer force' since their training camps got bombed to shit?

Did they just learn their lesson, stop 'gramming every 5 seconds and go radio silent?",94cd59779b8c8a2c69191141480bd5d40a7e6408,True,False,,,,,0,1649401402,,0,{},i3vcg3r,False,t3_tybcfi,False,True,t3_tybcfi,/r/CredibleDefense/comments/tybcfi/ukraine_conflict_daily_megathread/i3vcg3r/,1649401415,1,False,True,False,CredibleDefense,t5_2y5ib,r/CredibleDefense,public,,0,[],,1649372602.0
[],False,,Kkbelos,,,[],,,,text,t2_btoh1,False,False,"&gt; * is EU close to being fed up with Germans blocking meaningful sanctions, and at some point going to outvote Germany and actually start meaningful sanctions on Russian oil etc. (as European Parliament vote implies)? Or are there a lot more countries in the EU that are willing to fund the genocide to save a few euros? (as EU overall sanctions being largely symbolic so far imply)?&gt;

EU (and therefore Germany) is probably the one sacrificing the most to impose sanctions, which are not symbolic at all. As opposed to others like the US or the UK who are much less dependent on trade with Russia. I would argue that the EU are the ones making the real effort, whereas others could even get a benefit from these sanctions. 

Germany can't take the last step (Russian oil and gas ban) because that would mean to obliterate the economy and the country. Would the americans accept to stop driving any vehicle plus no heating in winter for 1 year to support Ukraine? Yeah, me neither. It will take years to build up independence from russian energy in Germany and eastern Europe",38785b4fad01d1a027173c690e7ef5b79a2d42f6,True,False,,,,,0,1649401394,,0,{},i3vcfn5,False,t3_tybcfi,False,True,t1_i3u87ss,/r/CredibleDefense/comments/tybcfi/ukraine_conflict_daily_megathread/i3vcfn5/,1649401408,1,False,True,False,CredibleDefense,t5_2y5ib,r/CredibleDefense,public,,0,[],,1649372594.0
[],False,,B0tRank,,,[],,,,text,t2_1z1g03sv,False,False,"Thank you, AvoidPinkHairHippos, for voting on I-AM-PIRATE.

This bot wants to find the best and worst bots on Reddit. [You can view results here](https://botrank.pastimes.eu/).

***

^(Even if I don't reply to your comment, I'm still listening for votes. Check the webpage to see if your vote registered!)",d6061a3cf7abedec943c0f8fbdb469f928990c76,True,False,,,,,0,1649401328,,0,{},i3vcc87,False,t3_tybcfi,False,True,t1_i3vcbbx,/r/CredibleDefense/comments/tybcfi/ukraine_conflict_daily_megathread/i3vcc87/,1649401341,1,False,False,False,CredibleDefense,t5_2y5ib,r/CredibleDefense,public,,0,[],,1649372528.0
[],False,,phoenixbouncing,,,[],,,,text,t2_g1r7s2i,False,False,French spelling.... You got me :),14aa317b8e824447003943b1fc42e6d43b09ae08,True,False,,,,,0,1649401326,,0,{},i3vcc2x,False,t3_tybcfi,False,True,t1_i3vc9zb,/r/CredibleDefense/comments/tybcfi/ukraine_conflict_daily_megathread/i3vcc2x/,1649401342,1,False,True,False,CredibleDefense,t5_2y5ib,r/CredibleDefense,public,,0,[],,1649372526.0
[],False,,AvoidPinkHairHippos,,,[],,,,text,t2_5j4gc60w,False,False,Good bot,48ab7f4f198b6e525e2906baf9d4ec71de74c0d2,True,False,,,,,0,1649401311,,0,{},i3vcbbx,False,t3_tybcfi,False,True,t1_i3ua6og,/r/CredibleDefense/comments/tybcfi/ukraine_conflict_daily_megathread/i3vcbbx/,1649401328,1,False,True,False,CredibleDefense,t5_2y5ib,r/CredibleDefense,public,,0,[],,1649372511.0
[],False,,chowieuk,,,[],,,,text,t2_b230l,False,False,"&gt; Normands

not to nitpick, but they're 'Normans', not Normands :)

Not that i'm still salty about 1066 or anything",a1f554f8077fc58b04e5dde27990adfb474edb71,True,False,,,,,0,1649401285,,0,{},i3vc9zb,False,t3_tybcfi,False,True,t1_i3v4xto,/r/CredibleDefense/comments/tybcfi/ukraine_conflict_daily_megathread/i3vc9zb/,1649401300,1,False,True,False,CredibleDefense,t5_2y5ib,r/CredibleDefense,public,,0,[],,1649372485.0
[],False,,phoenixbouncing,,,[],,,,text,t2_g1r7s2i,False,False,"Yep, the Romans went from Romulus to Romulus, nice way to bookend your civilisation (except for Constantinople obviously)",d3bf0a51db647e4bd169839acc4df552e5b6c735,True,False,,,,,0,1649401258,,0,{},i3vc8is,False,t3_tybcfi,False,True,t1_i3vc1ur,/r/CredibleDefense/comments/tybcfi/ukraine_conflict_daily_megathread/i3vc8is/,1649401273,1,False,True,False,CredibleDefense,t5_2y5ib,r/CredibleDefense,public,,0,[],,1649372458.0
[],False,,alcate,,,[],,,,text,t2_27w989,False,False,"The problem is how is those average Russian escape, when there is report of mass exodus government gonna clamp travel for citizen. There is a big russophobe as well in the west and maybe distrust on immigrant/agent",1645a78355e837ff482ee042b13580bcfcecdbf2,True,False,,,,,0,1649401232,,0,{},i3vc78x,False,t3_tybcfi,False,True,t1_i3v2wr1,/r/CredibleDefense/comments/tybcfi/ukraine_conflict_daily_megathread/i3vc78x/,1649401246,1,False,True,False,CredibleDefense,t5_2y5ib,r/CredibleDefense,public,,0,[],,1649372432.0
[],False,,chowieuk,,,[],,,,text,t2_b230l,False,False,"&gt; I want to live to see the day when we weaponize immigration.

dunno where you're from, but immigration has been weaponised in a political sense since the start of time lol.

&gt; Literally everyone wins.

You're making the rookie and exceptionally common mistake of thinking that everyone would want to come to the west just because we have a higher quality of life.

There's a pretty high barrier to getting someone to abandon their life. Nationalism, cultural familiarity, language barriers, loss of support network, friends, family, job opportunities/transferability of skills etc etc are all things you need to overcome.

I've lived in 7 countries, i find the UK a somewhat negative and depressing place to live, but i always somehow end up coming back, because this is 'home'. I could definitely never abandon my citizenship for instance.

You will also find that for instance with Romanians, basically *all* the kids want to leave the country for western europe in search of opportunities, but they all want to return later once they've obtained valuable skills/ income in order to improve the country they love (despite it having many serious flaws). This is with no meaningful barriers to them just up and leaving permanently.",cd87da8a1eaff6855839b2d80021f25278c439e7,True,False,,,,,0,1649401164,,0,{},i3vc3wx,False,t3_tybcfi,False,True,t1_i3utqku,/r/CredibleDefense/comments/tybcfi/ukraine_conflict_daily_megathread/i3vc3wx/,1649401180,1,False,True,False,CredibleDefense,t5_2y5ib,r/CredibleDefense,public,,0,[],,1649372364.0
[],False,,alcate,,,[],,,,text,t2_27w989,False,False,"Yep, when the last roman king rule is refused by Odoacer.",ea0031bd4abe52fc3761f022bc9ae97dddbe520a,True,False,,,,,0,1649401120,,0,{},i3vc1ur,False,t3_tybcfi,False,True,t1_i3v4xto,/r/CredibleDefense/comments/tybcfi/ukraine_conflict_daily_megathread/i3vc1ur/,1649401136,1,False,True,False,CredibleDefense,t5_2y5ib,r/CredibleDefense,public,,0,[],,1649372320.0
[],False,,TheMoogster,,,[],,,,text,t2_bu10i,False,False,Would it make sense for especially smaller countries to hyper specialize? Like Denmark: only naval or only air force?,bbde7ad29654c3b1b9717ce1bf662be6a34f8cab,True,False,,,,,0,1649400966,,0,{},i3vbu8q,False,t3_tyoapc,False,True,t1_i3v6gjh,/r/CredibleDefense/comments/tyoapc/getting_serious_about_sead_european_air_forces/i3vbu8q/,1649400977,1,False,True,False,CredibleDefense,t5_2y5ib,r/CredibleDefense,public,,0,[],,1649372166.0
[],False,,alcate,,,[],,,,text,t2_27w989,False,False,"TBH its good move by NATO to drown Russia with Ukrainian blood. Hopefully there is stability in UA after this phase of war, so there is no breakaway region in Ukraine or flooding of weapons in black market. It will be funny when palestinian destroy a merkava tank with NLAW.",c1b6d9e2632326a971318ecff03250be5d854c1e,True,False,,,,,0,1649400965,,0,{},i3vbu75,False,t3_tybcfi,False,True,t1_i3uw1lm,/r/CredibleDefense/comments/tybcfi/ukraine_conflict_daily_megathread/i3vbu75/,1649400977,1,False,True,False,CredibleDefense,t5_2y5ib,r/CredibleDefense,public,,0,[],,1649372165.0
[],False,,Duncan-M,,,[],,,,text,t2_2pdwadue,False,False,"He doesn't have the political capital to just blatantly tell the people to fuck off about their concerns as he needs them to not dodge the draft, which they'll start doing as they have on the past. Conscription avoidance was a big issue since the 70s but especially during the Afghan War, where pretty much everyone who had the connections found a way not to serve. That got worse in the 90s between the hazing and corruption scandals and the bloody Chechen Wars, which is why they cut it to only 12 months and made it law they'd not have to serve in foreign conflicts without special declarations made, which Putin is going to have trouble with because of the way he's sold this ""special military operation"" so far. . 

Imagine how much contract enlistments are going to plummet. Even before this they were hard up needing to pressure conscripts to volunteer for an extra year as contract troops to get better pay, treatment, and choices, but it's going to be hard as hell to get them now. Which makes conscription that much more necessary to rely on, as bad as it is.",26f7f88c199802eedae6ddacf2f28b28e36bb998,True,False,,,,,0,1649400845,,0,{},i3vbob0,False,t3_tybcfi,False,True,t1_i3v8mt0,/r/CredibleDefense/comments/tybcfi/ukraine_conflict_daily_megathread/i3vbob0/,1649400860,1,False,True,False,CredibleDefense,t5_2y5ib,r/CredibleDefense,public,,0,[],,1649372045.0
[],False,,chowieuk,,,[],,,,text,t2_b230l,False,False,"&gt; I can see them making sure tactical nuclear weapons and certain low grade ones are actually operational because those might be used as a show of force, but the rest I see no reason to maintain them vs buying another villa somewhere Monaco

alternatively, they feel like they could get away with rampant corruption within the rest of the military because they have a maintained and functional nuclear stockpile?

Strikes me as a question we don't really want to learn the answer to either way tbh",33aff6391b98af868a9b5bb3efb283bf7bc71558,True,False,,,,,0,1649400452,,0,{},i3vb4py,False,t3_tybcfi,False,True,t1_i3v4x1i,/r/CredibleDefense/comments/tybcfi/ukraine_conflict_daily_megathread/i3vb4py/,1649400464,1,False,True,False,CredibleDefense,t5_2y5ib,r/CredibleDefense,public,,0,[],,1649371652.0
[],False,,BadHamsterx,,,[],,,,text,t2_fiqa8,False,False,"For mange kan nok Luksusfellen være 2 undervisning og en vekker om sin egen situasjon.

Siden disse menneskene finnes, må det være mange som ikke har det like ille, men som lurer seg selv",c4f2337528720b01b0add1bdcece45729f83e604,True,False,,,,,0,1649400351,,0,{},i3vazk9,False,t3_tyfct0,False,True,t3_tyfct0,/r/CredibleDefense/comments/tyfct0/bill_clinton_why_i_expanded_nato/i3vazk9/,1649400363,1,False,True,False,CredibleDefense,t5_2y5ib,r/CredibleDefense,public,,0,[],,1649371551.0
[],False,,g2petter,,,[],,,,text,t2_jzl5,False,True,"&gt; Reapers and tomahawks and wild weasels don't suppress MANPADS.

I guess this may be beyond the scopes of the current discussion, but wouldn't using reapers, tomahawks etc. to hammer Russian supply lines have the indirect effect of suppressing MANPADS, at least near the front lines?",b5f84116aed601d48346e9ae27c09c1c1cf97181,True,False,,,,,0,1649400229,,0,{},i3vatm7,False,t3_tyoapc,False,True,t1_i3v6i0e,/r/CredibleDefense/comments/tyoapc/getting_serious_about_sead_european_air_forces/i3vatm7/,1649400241,1,False,True,False,CredibleDefense,t5_2y5ib,r/CredibleDefense,public,,0,[],,1649371429.0
[],False,,robothistorian,,,[],,,,text,t2_2inubrvw,False,False,"Interesting article and on the whole the question of SEAD remains critically important in the context of what Biddle refers to as the ""modern system of war"".

That said, I notice 2 things about this article: (1) It does not take into account whether or not the Russian Air Force (and the Russian High Command) actually actively engaged in a concerted SEAD effort and sought to achieve air dominance across the country. And, if they did then what is the evidence for that? (2) What is the nature of SEAD/DEAD in conditions where counter-air and air-to-ground ops may be waged using drones. And (3) the article is - though a ""commentary"" - is bereft of any meaningful references.

For example, the article asserts: ""In spite of over 1,000 Russian cruise- and ballistic-missile launches, which have had significant success against Ukrainian radars and S-300 long-range SAM batteries, mobile Ukrainian SAMs remain active and so Russian air superiority remains elusive.""

While this may be true (albeit without any corroborating evidence), it does not suggest that the Russian Air Force was actively attempting to engage in serious SEAD operations to achieve air superiority. Why this may have been so is open to speculation (like many other things about this Russian offensive into Ukraine).

What would be interesting to see (though I have no idea how to map this from open sources) is what is the density of Russian air and counter-air operations across the battlespace (though I am sure the US/NATO Intel outfits would have done this) and where it is being concentrated. This would give a fair idea as to where the primary thrust of the Russian AF was/is and what is it that they are trying to achieve.

That said, the.core.quesrion that this article address is indeed important notmsimoly in Europe, but also elsewhere where other ""hot wars"" are expected to flare up.",d4c70978e64d9273cd7e322776e7385b3fd1e916,True,False,,,,,0,1649400040,,0,{},i3vak4z,False,t3_tyoapc,False,True,t1_i3tlr7v,/r/CredibleDefense/comments/tyoapc/getting_serious_about_sead_european_air_forces/i3vak4z/,1649400056,1,False,True,False,CredibleDefense,t5_2y5ib,r/CredibleDefense,public,,0,[],,1649371240.0
[],False,,Venne1150,,,[],,,,text,t2_kyl0ivnq,False,False,"&gt; High ranking generals are not really part of the oligarchs, the way the army embezzles money is a bit different from how the oligarchs do

reference /additional reading?",5a1661b31977083a16805a3dcfaa71c81ee31578,True,False,,,,,0,1649399909,,0,{},i3vadmj,False,t3_tybcfi,False,True,t1_i3v8o9l,/r/CredibleDefense/comments/tybcfi/ukraine_conflict_daily_megathread/i3vadmj/,1649399925,1,False,True,False,CredibleDefense,t5_2y5ib,r/CredibleDefense,public,,0,[],,1649371109.0
[],False,,IntroductionNeat2746,,,[],,,,text,t2_5bv0y43u,False,False,There are troops 20km outside Kherson and all around its North. This troops have also been making small gains as of lately. That's way more exposed than the whole Donbass. Multiple analysts have been saying that Russian troops are preparing to retreat from Kherson if needed.,568d106d06a3c4bdbffa1d5129c2089bc5c6db02,True,False,,,,,0,1649399858,,0,{},i3vab2d,False,t3_tybcfi,False,True,t1_i3u77tt,/r/CredibleDefense/comments/tybcfi/ukraine_conflict_daily_megathread/i3vab2d/,1649399872,1,False,True,False,CredibleDefense,t5_2y5ib,r/CredibleDefense,public,,0,[],,1649371058.0
[],False,,iTomes,,,[],,,,text,t2_6sb4e,False,False,"I think Migs were deemed as too risky due to the question of how we get them over there, not because it would've caused Russia to escalate on their own. They also wouldn't be too useful to the Ukrainians, so its not like it makes a massive difference. A lot of modern equipment isn't going over due to a red line either but because they would require additional training which can't really be provided right now.",a2e5e89ad0bf29936e275b1ce9b4915fafadec63,True,False,,,,,0,1649399770,,0,{},i3va6rt,False,t3_tybcfi,False,True,t1_i3sf2nw,/r/CredibleDefense/comments/tybcfi/ukraine_conflict_daily_megathread/i3va6rt/,1649399787,1,False,True,False,CredibleDefense,t5_2y5ib,r/CredibleDefense,public,,0,[],,1649370970.0
[],False,,sanderudam,,,[],,,,text,t2_6iure,False,False,"Why are your nationalists so extreme?

Asks after centuries of ethnic suppression and after 8 years of war in which the opposing side desires the total extermination of your nation.

I remember a newsreport from my national TV from Zhytomyr in early March where they interviewed a teacher whose classroom had just been bombed.

She said that her whole life she had been a Russian. And then on the 24th of February she became a Ukrainian and a Ukrainian nationalists in particular.

Do people think Bandera rose to prominence after a decade of lovely idyllic peace and prosperity in Ukraine? Or maybe there were some triggers that might have pushed for Ukrainian nationalism?",c03e6955d51f00e8deca8a3b1daad8f710c91828,True,False,,,,,0,1649399552,,0,{},i3v9vx0,False,t3_tybcfi,False,True,t1_i3v1ni9,/r/CredibleDefense/comments/tybcfi/ukraine_conflict_daily_megathread/i3v9vx0/,1649399567,1,False,True,False,CredibleDefense,t5_2y5ib,r/CredibleDefense,public,,0,[],,1649370752.0
[],False,,greyvagabond,,,[],,,,text,t2_37du06ij,False,False,"If Hungary blocks it, too bad, they don't get NATO protection. Kick them out. They add NOTHING to NATO, who needs the liability?",0131b9036938185ae2529e39ded5484c42124c32,True,False,,,,,0,1649399047,,0,{},i3v96l1,False,t3_tybcfi,False,True,t1_i3ukcwk,/r/CredibleDefense/comments/tybcfi/ukraine_conflict_daily_megathread/i3v96l1/,1649399061,1,False,True,False,CredibleDefense,t5_2y5ib,r/CredibleDefense,public,,0,[],,1649370247.0
[],False,,greyvagabond,,,[],,,,text,t2_37du06ij,False,False,Russia doesn't have the equipment. The top-line equipment fielded in Ukraine was already unmaintained garbage; the back-up reserves sitting in a warehouse for 30 years will be even worse.,7606eca25d5a7a0c2b4a53200ee5fc8977613c24,True,False,,,,,0,1649398896,,0,{},i3v8z5r,False,t3_tybcfi,False,True,t1_i3ut4z9,/r/CredibleDefense/comments/tybcfi/ukraine_conflict_daily_megathread/i3v8z5r/,1649398912,1,False,True,False,CredibleDefense,t5_2y5ib,r/CredibleDefense,public,,0,[],,1649370096.0
[],False,,Dissentient,,,[],,,,text,t2_63rsj,False,False,"Yes, there are many documentaries about it, and there's a decent amount of fiction featuring it. Also, S.T.A.L.K.E.R. game series was very popular in post-soviet countries at the time of release. 

But also, a huge number of people's lives were significantly directly affected by disaster, hundreds of thousands were displaced by the fallout and participated in the liquidation.",1dd184ff3c921ffc319fd855654e90b6b193065f,True,False,,,,,0,1649398762,,0,{},i3v8sby,False,t3_tybcfi,False,True,t1_i3tu5v9,/r/CredibleDefense/comments/tybcfi/ukraine_conflict_daily_megathread/i3v8sby/,1649398777,1,False,True,False,CredibleDefense,t5_2y5ib,r/CredibleDefense,public,,0,[],,1649369962.0
[],False,,sanderudam,,,[],,,,text,t2_6iure,False,False,"High ranking generals are not really part of the oligarchs, the way the army embezzles money is a bit different from how the oligarchs do. But obviously, there is massive corruption in the army and there are juicy contracts when it comes to maintaining Russia's nuclear arsenal.

But do not kid yourself, Russia has thousands of functional nuclear warheads that they can get to their destinations.",f35580183169d9ab4f8031f7467ea5425c9d599f,True,False,,,,,0,1649398684,,0,{},i3v8o9l,False,t3_tybcfi,False,True,t1_i3v4x1i,/r/CredibleDefense/comments/tybcfi/ukraine_conflict_daily_megathread/i3v8o9l/,1649398699,1,False,True,False,CredibleDefense,t5_2y5ib,r/CredibleDefense,public,,0,[],,1649369884.0
[],False,,iTomes,,,[],,,,text,t2_6sb4e,False,False,"It's not like Putin gives a crap about his own laws. Plus he can just change them whenever really. There is a point to be made about having to face a backlash from his own population, but they seem to be becoming increasingly fascist from what I've heard.

That said, the very idea of Russia sending conscripts to just sorta casually invade the EU is hilarious to me. Those guys would get massacred no NATO needed.",5ba266c2643ccff2665a2b114cb6f2b0f7b4706c,True,False,,,,,0,1649398655,,0,{},i3v8mt0,False,t3_tybcfi,False,True,t1_i3rw9sw,/r/CredibleDefense/comments/tybcfi/ukraine_conflict_daily_megathread/i3v8mt0/,1649398697,1,False,True,False,CredibleDefense,t5_2y5ib,r/CredibleDefense,public,,0,[],,1649369855.0
[],False,,OhSillyDays,,,[],,,,text,t2_h1c0qtwi,False,False,"That's probably just air force sorties. Ground troops would be moved via helicopter too. 

Nato countries would be operating too, but they will mostly hold off till the USA clears out the SAMS.",e7f66765547f44c6f82c08b603e51d2fe3bdfb50,True,False,,,,,0,1649398194,,0,{},i3v7zo5,False,t3_tyoapc,False,True,t1_i3v63gj,/r/CredibleDefense/comments/tyoapc/getting_serious_about_sead_european_air_forces/i3v7zo5/,1649398208,1,False,True,False,CredibleDefense,t5_2y5ib,r/CredibleDefense,public,,0,[],,1649369394.0
[],False,,[deleted],,,,,,dark,,,,,[removed],fe993932d6dced4c0a879e9aa5d7a6e0fbb467f5,True,True,,,DELETED,,0,1649398134,,0,{},i3v7wpd,False,t3_t8e5zx,False,True,t1_i23ahzd,/r/CredibleDefense/comments/t8e5zx/what_is_the_actual_neonazi_presence_in_ukraine/i3v7wpd/,1649398147,1,False,True,False,CredibleDefense,t5_2y5ib,r/CredibleDefense,public,,0,[],,1649369334.0
[],False,,eidetic,,,[],,,,text,t2_2zxn0,False,False,"MANPADS don't emit anything, they're almost exclusively IR seekers and IR imagining based.",c451cddf594d586fe331ebdf97e3460490c529e4,True,False,,,,,0,1649397883,,0,{},i3v7jp7,False,t3_tyoapc,False,True,t1_i3v5yt3,/r/CredibleDefense/comments/tyoapc/getting_serious_about_sead_european_air_forces/i3v7jp7/,1649397898,1,False,True,False,CredibleDefense,t5_2y5ib,r/CredibleDefense,public,,0,[],,1649369083.0
