all_awardings,archived,associated_award,author,author_flair_background_color,author_flair_css_class,author_flair_richtext,author_flair_template_id,author_flair_text,author_flair_text_color,author_flair_type,author_fullname,author_patreon_flair,author_premium,body,body_sha1,can_gild,collapsed,collapsed_because_crowd_control,collapsed_reason,collapsed_reason_code,comment_type,controversiality,created_utc,distinguished,gilded,gildings,id,is_submitter,link_id,locked,no_follow,parent_id,permalink,retrieved_utc,score,score_hidden,send_replies,stickied,subreddit,subreddit_id,subreddit_name_prefixed,subreddit_type,top_awarded_type,total_awards_received,treatment_tags,unrepliable_reason,created
[],False,,SLdaco,,,[],,,,text,t2_d61t3kcd,False,False,"Russian airplanes a flying in,  Just look at that row of Stingers! Just a waiting to Sting!",7a8ea1c311f5f3c072b80fe3d70116c8c3af918f,True,False,,,,,0,1653334950,,0,{},i9pytc2,False,t3_uw60fp,False,True,t3_uw60fp,/r/UkraineInvasionVideos/comments/uw60fp/ukrainian_paratroopers_destroyed_another_general/i9pytc2/,1653334985,1,False,True,False,UkraineInvasionVideos,t5_5wkihl,r/UkraineInvasionVideos,public,,0,[],,1653306150.0
[],False,,sneakpeekbot,,,[],,,,text,t2_140r4p,False,False,"Here's a sneak peek of /r/FUCKYOUINPARTICULAR using the [top posts](https://np.reddit.com/r/FUCKYOUINPARTICULAR/top/?sort=top&amp;t=year) of the year!

\#1: [FUCK YOU, MEGHAN](https://i.redd.it/ufq9vtrz9x281.jpg) | [925 comments](https://np.reddit.com/r/FUCKYOUINPARTICULAR/comments/r6ddma/fuck_you_meghan/)  
\#2: [F*ck you Tom Cruise](https://i.redd.it/zggi8o3lom971.jpg) | [1066 comments](https://np.reddit.com/r/FUCKYOUINPARTICULAR/comments/oezsvi/fck_you_tom_cruise/)  
\#3: [Fuck you mark](https://i.redd.it/h9uhkt3u6p271.jpg) | [267 comments](https://np.reddit.com/r/FUCKYOUINPARTICULAR/comments/nq0ylx/fuck_you_mark/)

----
^^I'm ^^a ^^bot, ^^beep ^^boop ^^| ^^Downvote ^^to ^^remove ^^| ^^[Contact](https://www.reddit.com/message/compose/?to=sneakpeekbot) ^^| ^^[Info](https://np.reddit.com/r/sneakpeekbot/) ^^| ^^[Opt-out](https://np.reddit.com/r/sneakpeekbot/comments/o8wk1r/blacklist_ix/) ^^| ^^[GitHub](https://github.com/ghnr/sneakpeekbot)",d4fd328eedd4f805ae70e73e416380cbddc31e6b,True,False,,,,,0,1653334541,,0,{},i9pxur5,False,t3_uw4ibd,False,True,t1_i9pxti5,/r/UkraineInvasionVideos/comments/uw4ibd/kill_shot_in_one_ukraines_128th_separate_mountain/i9pxur5/,1653334558,1,False,True,False,UkraineInvasionVideos,t5_5wkihl,r/UkraineInvasionVideos,public,,0,[],,1653305741.0
[],False,,Crafty-Pop-8593,,,[],,,,text,t2_hify0ore,False,True,TL/DR r/fuckyouinparticular,3310af8a3e8b56808a1ec480893aba0f23ae9ca4,True,False,,,,,0,1653334526,,0,{},i9pxti5,False,t3_uw4ibd,False,True,t1_i9pbsnk,/r/UkraineInvasionVideos/comments/uw4ibd/kill_shot_in_one_ukraines_128th_separate_mountain/i9pxti5/,1653334542,1,False,True,False,UkraineInvasionVideos,t5_5wkihl,r/UkraineInvasionVideos,public,,0,[],,1653305726.0
[],False,,shan4fun1244,,,[],,,,text,t2_nieimww7,False,False,"I dont understand what you're trying to say.   Are you under the assumptions that we're sending 50Billion to Ukraine so that we can turn on colored lights?  
Or do you understand there are other benefits, and are just putting in a low effort troll?",6bd80e9382be2b75d4a66bae49bc4ad21b42f7bd,True,False,,,,,0,1653334515,,0,{},i9pxsj2,False,t3_uvo8x2,False,True,t1_i9ntkao,/r/UkraineInvasionVideos/comments/uvo8x2/nyc/i9pxsj2/,1653334526,1,False,True,False,UkraineInvasionVideos,t5_5wkihl,r/UkraineInvasionVideos,public,,0,[],,1653305715.0
[],False,,calabarboy,,,[],,,,text,t2_easek1zb,False,False,He’s head is not in the right place for 30 pieces of roubles 🪙 Shame‼️,87a4bab54c2bb356b2d8fcc4139be5e223ad94a1,True,False,,,,,0,1653334274,,0,{},i9px800,False,t3_uvwuxn,False,True,t3_uvwuxn,/r/UkraineInvasionVideos/comments/uvwuxn/the_man_leaked_the_positions_of_the_armed_forces/i9px800/,1653334288,1,False,True,False,UkraineInvasionVideos,t5_5wkihl,r/UkraineInvasionVideos,public,,0,[],,1653305474.0
[],False,,_tube_,,,[],,,,text,t2_d67lzxs,False,False,"Food for rats, wild dogs and pigs more likely.",0451e36b8fbb3e21fda6fa61208516d47a7eab78,True,False,,,,,0,1653334238,,0,{},i9px517,False,t3_uvw40p,False,True,t1_i9ou0sb,/r/UkraineInvasionVideos/comments/uvw40p/ruzi_paratroopers_demilitarized_by_lviv/i9px517/,1653334250,1,False,True,False,UkraineInvasionVideos,t5_5wkihl,r/UkraineInvasionVideos,public,,0,[],,1653305438.0
[],False,,yablinga,,,[],,,,text,t2_8db8k41m,False,False,"Caesars, Zuzanas, M777s - keep 'em coming, baby.",a5392810f5c0a16f8e2835a9d3b7520cc91e2d87,True,False,,,,,0,1653334169,,0,{},i9pwzaf,False,t3_uw70q2,False,True,t3_uw70q2,/r/UkraineInvasionVideos/comments/uw70q2/caesar_self_propelled_howitzer_are_here/i9pwzaf/,1653334181,1,False,True,False,UkraineInvasionVideos,t5_5wkihl,r/UkraineInvasionVideos,public,,0,[],,1653305369.0
[],False,,_tube_,,,[],,,,text,t2_d67lzxs,False,False,They're into the Where's Waldo look.,667e9fbe96db74cf3126e1899a8cb018db195bdd,True,False,,,,,0,1653334025,,0,{},i9pwn99,False,t3_uvw40p,False,True,t1_i9pnh24,/r/UkraineInvasionVideos/comments/uvw40p/ruzi_paratroopers_demilitarized_by_lviv/i9pwn99/,1653334044,1,False,True,False,UkraineInvasionVideos,t5_5wkihl,r/UkraineInvasionVideos,public,,0,[],,1653305225.0
[],False,,ghost-church,,,[],,,,text,t2_4dwl5b23,False,False,I don’t think this guy‘s *life* is going to last too long and Ukrainian prison.,5ceddbeb1ec18efa52148a4822c2a043bb52884f,True,False,,,,,0,1653333891,,0,{},i9pwbvh,False,t3_uvx0te,False,True,t3_uvx0te,/r/UkraineInvasionVideos/comments/uvx0te/finally_only_1500000_to_go/i9pwbvh/,1653333904,1,False,True,False,UkraineInvasionVideos,t5_5wkihl,r/UkraineInvasionVideos,public,,0,[],,1653305091.0
[],False,,Man_in_the_uk,,,[],,,,text,t2_ac41djtc,False,False,Was Russia experiencing food shortages?,aa8b5eac06e85ecc7f60ad7eb167601995b62149,True,False,,,,,0,1653333885,,0,{},i9pwbdk,False,t3_uvjrfz,False,True,t1_i9pk492,/r/UkraineInvasionVideos/comments/uvjrfz/crazy_bh/i9pwbdk/,1653333897,1,False,True,False,UkraineInvasionVideos,t5_5wkihl,r/UkraineInvasionVideos,public,,0,[],,1653305085.0
[],False,,birbs3,,,[],,,,text,t2_3phy73da,False,False,Looks like he should have took the 7 years in russia for not going to war,89bd5e3295d28396e909dbfe1cd584c312659fdc,True,False,,,,,0,1653333715,,0,{},i9pvwzq,False,t3_uvx0te,False,True,t3_uvx0te,/r/UkraineInvasionVideos/comments/uvx0te/finally_only_1500000_to_go/i9pvwzq/,1653333729,1,False,True,False,UkraineInvasionVideos,t5_5wkihl,r/UkraineInvasionVideos,public,,0,[],,1653304915.0
[],False,,Staatiatwork,,,[],,,,text,t2_l63gz,False,False,It baffles me how someone can have access to all kind of information and chooses the side which jails you for 15 years if you don't agree..,9ec33fb17ad8bbc767bd107274b90975b775693e,True,False,,,,,0,1653333599,,0,{},i9pvmrr,False,t3_uvwuxn,False,True,t3_uvwuxn,/r/UkraineInvasionVideos/comments/uvwuxn/the_man_leaked_the_positions_of_the_armed_forces/i9pvmrr/,1653333616,1,False,True,False,UkraineInvasionVideos,t5_5wkihl,r/UkraineInvasionVideos,public,,0,[],,1653304799.0
[],False,,TheSunflowerSeeds,,,[],,,,text,t2_sldqd7t,False,False,"Sunflowers can be processed into a peanut butter alternative, Sunbutter. In Germany, it is mixed together with rye flour to make Sonnenblumenkernbrot (literally: sunflower whole seed bread), which is quite popular in German-speaking Europe. It is also sold as food for birds and can be used directly in cooking and salads.",9c5202b173f0836372c3c286d40b16bca0aa52e6,True,False,,,,,0,1653333569,,0,{},i9pvkai,False,t3_uw6jk7,False,True,t1_i9pvisp,/r/UkraineInvasionVideos/comments/uw6jk7/russian_garbage/i9pvkai/,1653333586,1,False,True,False,UkraineInvasionVideos,t5_5wkihl,r/UkraineInvasionVideos,public,,0,[],,1653304769.0
[],False,,unfairtoeveryone,,,[],,,,text,t2_5qko0nsv,False,False,Dead drunk or dead sunflower???,cdd608011bef561024bd310fde3f6d93ee96e5e6,True,False,,,,,0,1653333552,,0,{},i9pvisp,False,t3_uw6jk7,False,False,t3_uw6jk7,/r/UkraineInvasionVideos/comments/uw6jk7/russian_garbage/i9pvisp/,1653333570,1,False,True,False,UkraineInvasionVideos,t5_5wkihl,r/UkraineInvasionVideos,public,,0,[],,1653304752.0
[],False,,Brown775,,,[],,,,text,t2_korlik0g,False,False,Putin even outlawed opposition parties and co-opted the entire media.   Not sure how this fascism thing wasn’t discussed before February either.,4ac5f26272274f6671d031b4063bf96ce64446cf,True,False,,,,,0,1653333518,,0,{},i9pvfx1,False,t3_uw77kw,False,True,t3_uw77kw,/r/UkraineInvasionVideos/comments/uw77kw/former_italian_prime_minister_silvio_berlusconi/i9pvfx1/,1653333531,1,False,True,False,UkraineInvasionVideos,t5_5wkihl,r/UkraineInvasionVideos,public,,0,[],,1653304718.0
[],False,,ParralaxError,,,[],,,,text,t2_g793olj6,False,False,"What's happening in Ukrain justifies a lot more than a mere $50bn. Spending that money is the right thing to do, anyone who can't see that is either immoral, amoral, or have a very shallow understanding of what's at stake. The US could spend double or tripple that and it would be a sound investment that increases US prosperity for generations to come.",091e97f9e0ce58a52178308d664f144aae96d045,True,False,,,,,0,1653333493,,0,{},i9pvdny,False,t3_uvo8x2,False,True,t1_i9ntkao,/r/UkraineInvasionVideos/comments/uvo8x2/nyc/i9pvdny/,1653333508,1,False,True,False,UkraineInvasionVideos,t5_5wkihl,r/UkraineInvasionVideos,public,,0,[],,1653304693.0
[],False,,Nice-Serve3811,,,[],,,,text,t2_ei6po3qc,False,False,Another Putin boot licker,946b7e15db600679dbd382fce011a86a8ecb8239,True,False,,,,,0,1653333382,,0,{},i9pv4c0,False,t3_uw77kw,False,True,t3_uw77kw,/r/UkraineInvasionVideos/comments/uw77kw/former_italian_prime_minister_silvio_berlusconi/i9pv4c0/,1653333395,1,False,True,False,UkraineInvasionVideos,t5_5wkihl,r/UkraineInvasionVideos,public,,0,[],,1653304582.0
[],False,,moonicornasaurus,,,[],,,,text,t2_yuiq6,False,False,I love the 🌻 category and 🚜 force one.,981058fb79a945872bf7da65d1d2c11350dcde3b,True,False,,,,,0,1653333086,,0,{},i9pufj5,False,t3_uw5sq0,False,True,t3_uw5sq0,/r/UkraineInvasionVideos/comments/uw5sq0/war_update_230522_oc/i9pufj5/,1653333097,1,False,True,False,UkraineInvasionVideos,t5_5wkihl,r/UkraineInvasionVideos,public,,0,[],,1653304286.0
[],False,,Pitch_Street,,,[],,,,text,t2_5m6so09a,False,False,Bafancoolo,32ebc582383587dd7930448f7186bf1e4d05f651,True,False,,,,,0,1653333069,,0,{},i9pue6k,False,t3_uw77kw,False,True,t3_uw77kw,/r/UkraineInvasionVideos/comments/uw77kw/former_italian_prime_minister_silvio_berlusconi/i9pue6k/,1653333082,1,False,True,False,UkraineInvasionVideos,t5_5wkihl,r/UkraineInvasionVideos,public,,0,[],,1653304269.0
[],False,,mdsign,,,[],,,,text,t2_8d1e4,False,False,Thanks!,1da20795f84bb9c5e16697aea34f14720e38fc37,True,False,,,,,0,1653333065,,0,{},i9pudsi,False,t3_uw70q2,False,True,t1_i9pua6x,/r/UkraineInvasionVideos/comments/uw70q2/caesar_self_propelled_howitzer_are_here/i9pudsi/,1653333082,1,False,True,False,UkraineInvasionVideos,t5_5wkihl,r/UkraineInvasionVideos,public,,0,[],,1653304265.0
[],False,,PnyFr,,,[],,,,text,t2_4pohmm37,False,False,"The howitzer can move by itself and didn't need any truck or car to move from a position to an other. 


https://en.m.wikipedia.org/wiki/Self-propelled_artillery",f02ea0d41e15542c75e9827d91dfe07fa494aa10,True,False,,,,,0,1653333022,,0,{},i9pua6x,True,t3_uw70q2,False,True,t1_i9ptub2,/r/UkraineInvasionVideos/comments/uw70q2/caesar_self_propelled_howitzer_are_here/i9pua6x/,1653333036,1,False,True,False,UkraineInvasionVideos,t5_5wkihl,r/UkraineInvasionVideos,public,,0,[],,1653304222.0
[],False,,vilius_m_lt,,,[],,,,text,t2_k7w4g7am,False,False,Ashamed because the war lasted more than three days,e4ab3fcd45088bc7c02d2ea23c5d3870e377896a,True,False,,,,,0,1653332989,,0,{},i9pu7ca,False,t3_uw675d,False,True,t3_uw675d,/r/UkraineInvasionVideos/comments/uw675d/breaking_russias_counsellor_to_the_united_nations/i9pu7ca/,1653333005,1,False,True,False,UkraineInvasionVideos,t5_5wkihl,r/UkraineInvasionVideos,public,,0,[],,1653304189.0
[],False,,sc2guy87,,,[],,,,text,t2_4omw8t44,False,False,Blaming/punishing foot soldiers will always he stupid. If we locked up every soldier that would commit war crimes if ordered to do so there would be no armies.,c03528f6dd1881ef73b0aeec6b4d2355c508e456,True,False,,,,,0,1653332986,,0,{},i9pu724,False,t3_uvx0te,False,True,t1_i9oq40w,/r/UkraineInvasionVideos/comments/uvx0te/finally_only_1500000_to_go/i9pu724/,1653332998,1,False,True,False,UkraineInvasionVideos,t5_5wkihl,r/UkraineInvasionVideos,public,,0,[],,1653304186.0
[],False,,Brown775,,,[],,,,text,t2_korlik0g,False,False,"Someone needs to tell me he really wore that shirt.  

Someone also needs to send me a link to it",635f577a03fd8492209dc2e050b9a9acda0728e9,True,False,,,,,0,1653332973,,0,{},i9pu5zt,False,t3_uw718k,False,True,t3_uw718k,/r/UkraineInvasionVideos/comments/uw718k/our_hero_oh_yeaaah/i9pu5zt/,1653332990,1,False,True,False,UkraineInvasionVideos,t5_5wkihl,r/UkraineInvasionVideos,public,,0,[],,1653304173.0
[],False,,mdsign,,,[],,,,text,t2_8d1e4,False,False,What does self propelled actually mean?,e1ff878688c4dbbb5beb5037a6e4e263a845ccf0,True,False,,,,,0,1653332829,,0,{},i9ptub2,False,t3_uw70q2,False,True,t3_uw70q2,/r/UkraineInvasionVideos/comments/uw70q2/caesar_self_propelled_howitzer_are_here/i9ptub2/,1653332846,1,False,True,False,UkraineInvasionVideos,t5_5wkihl,r/UkraineInvasionVideos,public,,0,[],,1653304029.0
[],False,,WelshOgre,,,[],,,,text,t2_ubaivf8,False,True,"What is it with all these former this-that-and-the-other making dumb comments? Mainly, as you say, yesterday's man \[in retirement\].",28aa4b16232f2718b87f364088e5324d677e55ed,True,False,,,,,0,1653332791,,0,{},i9ptr6i,False,t3_uw77kw,False,False,t1_i9pqz26,/r/UkraineInvasionVideos/comments/uw77kw/former_italian_prime_minister_silvio_berlusconi/i9ptr6i/,1653332807,1,False,True,False,UkraineInvasionVideos,t5_5wkihl,r/UkraineInvasionVideos,public,,0,[],,1653303991.0
[],False,,DrDoG00d,,,[],,,,text,t2_n3k759rd,False,True,"Good on you Boris, I hope you find peace in all of this. r/Godspeed",12efc53d0775e3d9e90370490ed439557a20ee4b,True,False,,,,,0,1653332596,,0,{},i9ptaun,False,t3_uw675d,False,True,t3_uw675d,/r/UkraineInvasionVideos/comments/uw675d/breaking_russias_counsellor_to_the_united_nations/i9ptaun/,1653332614,1,False,True,False,UkraineInvasionVideos,t5_5wkihl,r/UkraineInvasionVideos,public,,0,[],,1653303796.0
[],False,,NiftyMufti,,,[],,,,text,t2_2kikwcu8,False,False,The striped shirts are quite a legendary symbol. Did you miss that part? Google Telnyashka.,b35ba45fca0d0d87f0e5ff7a9830271164a5c0b2,True,False,,,,,0,1653332097,,0,{},i9ps4er,False,t3_uvw40p,False,True,t1_i9pnh24,/r/UkraineInvasionVideos/comments/uvw40p/ruzi_paratroopers_demilitarized_by_lviv/i9ps4er/,1653332110,1,False,True,False,UkraineInvasionVideos,t5_5wkihl,r/UkraineInvasionVideos,public,,0,[],,1653303297.0
[],False,,wolley_dratsum,,,[],,,,text,t2_lyc2s,False,False,"They can also use a spotter to fire a round, see where it lands and then adjust by “walking” a series of rounds towards the target.

Not sure which method this is, could be either.",d6d6685506d2fce2139921bfdf2a79e963751be4,True,False,,,,,0,1653332094,,0,{},i9ps47n,False,t3_uw4ibd,False,True,t1_i9pbsnk,/r/UkraineInvasionVideos/comments/uw4ibd/kill_shot_in_one_ukraines_128th_separate_mountain/i9ps47n/,1653332110,1,False,True,False,UkraineInvasionVideos,t5_5wkihl,r/UkraineInvasionVideos,public,,0,[],,1653303294.0
[],False,,AssumptionDeep1868,,,[],,,,text,t2_kwf38gsx,False,False,Still not long enough. Let this arsehole rot in hell.,c58b3c7ffcc55bbf9134a9c47e4e7f6e20e6e142,True,False,,,,,0,1653332050,,0,{},i9ps0f5,False,t3_uw4kro,False,True,t3_uw4kro,/r/UkraineInvasionVideos/comments/uw4kro/breaking_news_russian_soldier_shyshimarin_jailed/i9ps0f5/,1653332064,1,False,True,False,UkraineInvasionVideos,t5_5wkihl,r/UkraineInvasionVideos,public,,0,[],,1653303250.0
[],False,,ack1308,,,[],,,,text,t2_5phu4l1k,False,True,"I'm sure the Caesar self propelled howitzer is there.

But that ain't it.

https://youtu.be/MjfKqpmKf\_s",8edb71614dd76a405940615138da80d4960e23ba,True,False,,,,,0,1653332003,,0,{},i9prwkx,False,t3_uw70q2,False,True,t3_uw70q2,/r/UkraineInvasionVideos/comments/uw70q2/caesar_self_propelled_howitzer_are_here/i9prwkx/,1653332018,1,False,True,False,UkraineInvasionVideos,t5_5wkihl,r/UkraineInvasionVideos,public,,0,[],,1653303203.0
[],False,,Newstory_,,,[],,,,text,t2_y3r2j,False,False,"Life sentence? For a single murder? I don't know man, my country gives I think 15 - 20 years of imprisonment for a murder. Here, the guy migth've been ordered by his commander to do so and it's always easier to pull the trigger in a warzone as a soldier when you are used to killing other soldiers on daily basis, than when you are in a civilian setting. I don't think there's a country that gives life sentence for a single murder. But sure, he's Russian, so I guess let's pretend we are delivering justice just like in any other case, sticking to our values and treating him with the same standards as our own people, except not, because we hate him and don't want him to see the light of the day ever again.

I also wonder if the people here on reddit going on witch hunts were organizing the same witch hunts for their own people, who were murdering civilians in Iraq and other states. And I wonder if those soldiers have been also punished for murdering a civilian, more so on a commander's order. With a life imprisonment at that, as everyone applauds. I have a feeling we are forming some double standards here. But feel free to correct me if such cases exist, I just haven't heard of any as such. Only seen some nasty wikileaks videos about the US army.",a3e0dab7f737ca69cdf9eeb588f03a41cc418a06,True,False,,,,,0,1653331926,,0,{},i9prq9k,False,t3_uvx0te,False,True,t3_uvx0te,/r/UkraineInvasionVideos/comments/uvx0te/finally_only_1500000_to_go/i9prq9k/,1653331943,1,False,True,False,UkraineInvasionVideos,t5_5wkihl,r/UkraineInvasionVideos,public,,0,[],,1653303126.0
[],False,,AssistantTemporary81,,,[],,,,text,t2_9g3zkue6,False,False,Payback is gonna be a bitch. The Ukrainian people deserve their revenge. Get ready to bleed,fa5ea139b062f509f285848d42892addf05a75a4,True,False,,,,,0,1653331857,,0,{},i9prklg,False,t3_uvkbm4,False,True,t3_uvkbm4,/r/UkraineInvasionVideos/comments/uvkbm4/i_think_this_picture_should_be_shown_to_every_one/i9prklg/,1653331874,1,False,True,False,UkraineInvasionVideos,t5_5wkihl,r/UkraineInvasionVideos,public,,0,[],,1653303057.0
[],False,,Sid-Hartha,,,[],,,,text,t2_57rj7gx,False,False,Another ‘yesterdays man’. Sooner this lot die off the better for all of us.,399632c3c77038ec683f60a8ecf6b97cc173270f,True,False,,,,,0,1653331598,,0,{},i9pqz26,False,t3_uw77kw,False,True,t3_uw77kw,/r/UkraineInvasionVideos/comments/uw77kw/former_italian_prime_minister_silvio_berlusconi/i9pqz26/,1653331615,1,False,True,False,UkraineInvasionVideos,t5_5wkihl,r/UkraineInvasionVideos,public,,0,[],,1653302798.0
[],False,,Bannerlord268,,,[],,,,text,t2_5odrds2h,False,False,Finally they arrived and in action!,d103b2ab5304ac064003948362725c7dde4e988d,True,False,,,,,0,1653331447,,0,{},i9pqmhe,False,t3_uw70q2,False,True,t3_uw70q2,/r/UkraineInvasionVideos/comments/uw70q2/caesar_self_propelled_howitzer_are_here/i9pqmhe/,1653331464,1,False,True,False,UkraineInvasionVideos,t5_5wkihl,r/UkraineInvasionVideos,public,,0,[],,1653302647.0
[],False,,Rob-Riggle-SWGOAT,,,[],,,,text,t2_dckr7w9h,False,True,I’ve seen this. But I had no frame of reference for when to start adding those. Instead of guess I searched out what other sources put the count as. I included what Russia and what the United States are saying regarding Ukrainian losses. In the end I can only put the numbers I can find in here. If I make them up then it’s all pointless.,6fed1610ee85ee908a8de3ba802d60cb01a276a7,True,False,,,,,0,1653331397,,0,{},i9pqibc,True,t3_uw5sq0,False,True,t1_i9pmd9t,/r/UkraineInvasionVideos/comments/uw5sq0/war_update_230522_oc/i9pqibc/,1653331410,1,False,True,False,UkraineInvasionVideos,t5_5wkihl,r/UkraineInvasionVideos,public,,0,[],,1653302597.0
[],False,,Haunting_Pay_2888,,,[],,,,text,t2_nktg8b5,False,False,"Retired general, probably working for Wagner PMC.",9e1c5afeb7465555bd7122cc35033f4140ee3e63,True,False,,,,,0,1653331329,,0,{},i9pqcli,False,t3_uw60fp,False,True,t3_uw60fp,/r/UkraineInvasionVideos/comments/uw60fp/ukrainian_paratroopers_destroyed_another_general/i9pqcli/,1653331376,1,False,True,False,UkraineInvasionVideos,t5_5wkihl,r/UkraineInvasionVideos,public,,0,[],,1653302529.0
[],False,,Sabotinekes,,,[],,,,text,t2_r77s9,False,False,Woooooah !,8120b529add4b9e28fdc02b5308ffa13da48b524,True,False,,,,,0,1653331063,,0,{},i9ppqhj,False,t3_uw70q2,False,True,t3_uw70q2,/r/UkraineInvasionVideos/comments/uw70q2/caesar_self_propelled_howitzer_are_here/i9ppqhj/,1653331082,1,False,True,False,UkraineInvasionVideos,t5_5wkihl,r/UkraineInvasionVideos,public,,0,[],,1653302263.0
[],False,,DrnkGuy,,,[],,,,text,t2_2zbmm6mh,False,False,Will they give us the Death Star?,2df3c69e3df5ac7ee0354dcdf165e4123f08a6f2,True,False,,,,,0,1653330678,,0,{},i9pou9m,False,t3_uw6l57,False,True,t3_uw6l57,/r/UkraineInvasionVideos/comments/uw6l57/hehe/i9pou9m/,1653330694,1,False,True,False,UkraineInvasionVideos,t5_5wkihl,r/UkraineInvasionVideos,public,,0,[],,1653301878.0
[],False,,Radiant-Twist6903,,,[],,,,text,t2_mjba127m,False,False,Putin's army is running out of pilots....,84ec0b51e2c335c8d49a3c26633c68b8727667ef,True,False,,,,,0,1653330441,,0,{},i9poakx,False,t3_uw60fp,False,True,t3_uw60fp,/r/UkraineInvasionVideos/comments/uw60fp/ukrainian_paratroopers_destroyed_another_general/i9poakx/,1653330456,1,False,True,False,UkraineInvasionVideos,t5_5wkihl,r/UkraineInvasionVideos,public,,0,[],,1653301641.0
[],False,,SnooMacaroons1416,,,[],,,,text,t2_83m1ue3d,False,False,That’s what I was thinking 😂,6d2c595ffe8de1af59cfd1837de42c5af88008b5,True,False,,,,,0,1653330403,,0,{},i9po7gj,False,t3_uvx0te,False,True,t1_i9oic80,/r/UkraineInvasionVideos/comments/uvx0te/finally_only_1500000_to_go/i9po7gj/,1653330417,1,False,True,False,UkraineInvasionVideos,t5_5wkihl,r/UkraineInvasionVideos,public,,0,[],,1653301603.0
[],False,,Secret-Plum149,,,[],,,,text,t2_9r8a7s7i,False,False,"Brave man. Speaking out but also condemning the loss of life &amp; having no regard for the future of his country. 
The truth needed to be spoken from within. 🤝🙏",047633bd35307318306a3cf39061ad556113f594,True,False,,,,,0,1653330365,,0,{},i9po46f,False,t3_uw675d,False,True,t3_uw675d,/r/UkraineInvasionVideos/comments/uw675d/breaking_russias_counsellor_to_the_united_nations/i9po46f/,1653330380,1,False,True,False,UkraineInvasionVideos,t5_5wkihl,r/UkraineInvasionVideos,public,,0,[],,1653301565.0
[],False,,cornthepop,,,[],,,,text,t2_64wr9yd2,False,False,"It's kalled Telnyashka, with a color matching the beret. 

Blue, in this case, is either; russian navy (marines, maritime border troops), russian airborne troops (GRU Spetsnaz, Ryazan guard or KGB border troops)

When FSB or KGB counter intelligence belong to a unit of this colour they also wear blue. 

That's from my understanding at least. Then there are other colours for other units.",b9f9371e5dcf15391a40de9d9c1058356474e118,True,False,,,,,0,1653330253,,0,{},i9pnuv5,True,t3_uvw40p,False,True,t1_i9plq52,/r/UkraineInvasionVideos/comments/uvw40p/ruzi_paratroopers_demilitarized_by_lviv/i9pnuv5/,1653330266,1,False,True,False,UkraineInvasionVideos,t5_5wkihl,r/UkraineInvasionVideos,public,,0,[],,1653301453.0
[],False,,Dimsumchik,,,[],,,,text,t2_t0cmo,False,False,An Su25 pilot having the time of his life,bdc8867911bd1ce17ca97c2380c22660c4c55451,True,False,,,,,0,1653330212,,0,{},i9pnrcj,False,t3_uw6nem,False,True,t3_uw6nem,/r/UkraineInvasionVideos/comments/uw6nem/thats_fun/i9pnrcj/,1653330227,1,False,True,False,UkraineInvasionVideos,t5_5wkihl,r/UkraineInvasionVideos,public,,0,[],,1653301412.0
[],False,,Fabulous_Course_6796,,,[],,,,text,t2_k5d4201o,False,False,Is there a inmate outfit shortage?,3b5a33708af40869d6491386fb2c3bfa6bc7c75d,True,False,,,,,0,1653330091,,0,{},i9pnh24,False,t3_uvw40p,False,True,t1_i9nzvoh,/r/UkraineInvasionVideos/comments/uvw40p/ruzi_paratroopers_demilitarized_by_lviv/i9pnh24/,1653330105,1,False,True,False,UkraineInvasionVideos,t5_5wkihl,r/UkraineInvasionVideos,public,,0,[],,1653301291.0
[],False,,Lachim12,,,[],,,,text,t2_a9ap73nv,False,False,"It's like saying ""they are in Ukraine""",6a93f1f78cf3df99735894d0d887ebf642a34503,True,False,,,,,0,1653330060,,0,{},i9pneei,False,t3_uvw40p,False,True,t1_i9nywwi,/r/UkraineInvasionVideos/comments/uvw40p/ruzi_paratroopers_demilitarized_by_lviv/i9pneei/,1653330076,1,False,True,False,UkraineInvasionVideos,t5_5wkihl,r/UkraineInvasionVideos,public,,0,[],,1653301260.0
[],False,,Fabulous_Course_6796,,,[],,,,text,t2_k5d4201o,False,False,I'm sure that the dead Russians will feel better about fertilizing plants from the  Americas.,f4d436b662c0b6c660623a9763dcc09871c380eb,True,False,,,,,0,1653330034,,0,{},i9pnc3m,False,t3_uvw40p,False,True,t1_i9pcum1,/r/UkraineInvasionVideos/comments/uvw40p/ruzi_paratroopers_demilitarized_by_lviv/i9pnc3m/,1653330053,1,False,True,False,UkraineInvasionVideos,t5_5wkihl,r/UkraineInvasionVideos,public,,0,[],,1653301234.0
[],False,,Quick_samurai,,,[],,,,text,t2_megk6bjj,False,False,Some one told me that given cock too,9fefa7e1f6d24b0ca053662041dffa850701073d,True,False,,,,,0,1653329870,,0,{},i9pmy3s,False,t3_uut13q,False,True,t3_uut13q,/r/UkraineInvasionVideos/comments/uut13q/the_united_states_is_handing_over_patriot_air/i9pmy3s/,1653329887,1,False,True,False,UkraineInvasionVideos,t5_5wkihl,r/UkraineInvasionVideos,public,,0,[],,1653301070.0
