all_awardings,archived,associated_award,author,author_flair_background_color,author_flair_css_class,author_flair_richtext,author_flair_template_id,author_flair_text,author_flair_text_color,author_flair_type,author_fullname,author_patreon_flair,author_premium,body,body_sha1,can_gild,collapsed,collapsed_because_crowd_control,collapsed_reason,collapsed_reason_code,comment_type,controversiality,created_utc,distinguished,gilded,gildings,id,is_submitter,link_id,locked,no_follow,parent_id,permalink,retrieved_utc,score,score_hidden,send_replies,stickied,subreddit,subreddit_id,subreddit_name_prefixed,subreddit_type,top_awarded_type,total_awards_received,treatment_tags,unrepliable_reason,created
[],False,,unholyCrapper,,,[],,,,text,t2_n0f5zg6p,False,False,A lot of things will go through him too I guess.,f504fb5f3f300853adf7ec56ffe38c84bef47e26,True,False,,,,,0,1653320525,,0,{},i9p0pmt,True,t3_uvx0te,False,True,t1_i9oh0vb,/r/UkraineInvasionVideos/comments/uvx0te/finally_only_1500000_to_go/i9p0pmt/,1653320542,1,False,True,False,UkraineInvasionVideos,t5_5wkihl,r/UkraineInvasionVideos,public,,0,[],,1653291725.0
[],False,,unholyCrapper,,,[],,,,text,t2_n0f5zg6p,False,False,"https://edition.cnn.com/europe/live-news/russia-ukraine-war-news-05-23-22/index.html  
  
I'd rather se them in concentration camps, but I guess we could be better than the uncivilized barbarians the Russians are.",9b894acbcfecb4f63838603097ef882c9c8ed8b5,True,False,,,,,0,1653320461,,0,{},i9p0k3w,True,t3_uvx0te,False,True,t3_uvx0te,/r/UkraineInvasionVideos/comments/uvx0te/finally_only_1500000_to_go/i9p0k3w/,1653320473,1,False,True,False,UkraineInvasionVideos,t5_5wkihl,r/UkraineInvasionVideos,public,,0,[],,1653291661.0
[],False,,Please-Do-not-Ban-Me,,,[],,,,text,t2_1b280uii,False,True,I'm not defending him but how do u know u would be brave enough to disobey if u were him?,74ca54203098f0a7c4beeac3c74089d834a39843,True,False,,,,,0,1653320322,,0,{},i9p08b7,False,t3_uvx0te,False,True,t1_i9oq40w,/r/UkraineInvasionVideos/comments/uvx0te/finally_only_1500000_to_go/i9p08b7/,1653320342,1,False,True,False,UkraineInvasionVideos,t5_5wkihl,r/UkraineInvasionVideos,public,,0,[],,1653291522.0
[],False,,Low_Ad_3139,,,[],,,,text,t2_88smidi2,False,False,Did they have video or what kind of proof? I want all guilty sentenced but what about those that surrendered that hadn’t committed crimes yet?,7741e375cb59815659b622535230f4496196c6d8,True,False,,,,,0,1653319945,,0,{},i9ozc7y,False,t3_uvx0te,False,True,t3_uvx0te,/r/UkraineInvasionVideos/comments/uvx0te/finally_only_1500000_to_go/i9ozc7y/,1653319960,1,False,True,False,UkraineInvasionVideos,t5_5wkihl,r/UkraineInvasionVideos,public,,0,[],,1653291145.0
[],False,,FunBobbyMarley,,,[],,,,text,t2_m9xl103l,False,False,"Bottom line - NATO does not want to occupy Russia.  Given Russia’s military performance in Ukraine it looks like it would be feasible to defeat Russia up to their existential use of nuclear arms.  But aside from that, if NATO defeats Russia then we buy all their problems.  We can barely handle our own.   Just like with North Korea, the US &amp; South Korea could defeat them, but my god what a post-war mess that would be just feeding the population.  Russia has to put its big-boy pants on and stop invading its neighbors.",6a5b4a4b507e18d424117a2cf9739a0cb7015401,True,False,,,,,0,1653319824,,0,{},i9oz1xp,False,t3_uvjrfz,False,True,t3_uvjrfz,/r/UkraineInvasionVideos/comments/uvjrfz/crazy_bh/i9oz1xp/,1653319836,1,False,True,False,UkraineInvasionVideos,t5_5wkihl,r/UkraineInvasionVideos,public,,0,[],,1653291024.0
[],False,,BlackKojak,,,[],,,,text,t2_bq3ooco,False,False,Will Ukraine have enough prisons to hold them all?,bc6bb24216470828c699fce2128f531a9df02f12,True,False,,,,,0,1653319608,,0,{},i9oyjl5,False,t3_uvx0te,False,True,t3_uvx0te,/r/UkraineInvasionVideos/comments/uvx0te/finally_only_1500000_to_go/i9oyjl5/,1653319624,1,False,True,False,UkraineInvasionVideos,t5_5wkihl,r/UkraineInvasionVideos,public,,0,[],,1653290808.0
[],False,,Grouchy_Fee_8481,,,[],,,,text,t2_58vmeeff,False,False,"Now that’s what I would call a shit job, did these guys gang bang the defense minister’s daughters to get this gig?",69e6a5c6e39c940c28ba79c5328773b45ccf725b,True,False,,,,,0,1653319455,,0,{},i9oy6qn,False,t3_uv24x3,False,True,t3_uv24x3,/r/UkraineInvasionVideos/comments/uv24x3/russian_forces_looking_for_mines_in_luhansk/i9oy6qn/,1653319473,1,False,True,False,UkraineInvasionVideos,t5_5wkihl,r/UkraineInvasionVideos,public,,0,[],,1653290655.0
[],False,,Vegetable-Contest853,,,[],,,,text,t2_9nz759xz,False,False,Rest In Piss you fucking pig..,ce7c055a1feb8c984d1c1fc7e687047b40ac6f22,True,False,,,,,0,1653318205,,0,{},i9ovbf6,False,t3_uvx0te,False,True,t3_uvx0te,/r/UkraineInvasionVideos/comments/uvx0te/finally_only_1500000_to_go/i9ovbf6/,1653318219,1,False,True,False,UkraineInvasionVideos,t5_5wkihl,r/UkraineInvasionVideos,public,,0,[],,1653289405.0
[],False,,AgentGreen81,,,[],,,,text,t2_216r67fr,False,False,"It definitely sticks for days. I would take handfuls of water and get it inside my nose as far as I could without breathing it and let it soak in for a minute or so and basically try to blow the smell out along with the dirt, ash and everything else clogged in there.",1eafe40b3ddc14817d4f0908bbe8d86507b36181,True,False,,,,,0,1653318045,,0,{},i9ouyct,False,t3_uvw40p,False,True,t1_i9oty9e,/r/UkraineInvasionVideos/comments/uvw40p/ruzi_paratroopers_demilitarized_by_lviv/i9ouyct/,1653318058,1,False,True,False,UkraineInvasionVideos,t5_5wkihl,r/UkraineInvasionVideos,public,,0,[],,1653289245.0
[],False,,Party_Measurement_94,,,[],,,,text,t2_62h0jbg3,False,False,"I wouldnt wanna eat a can of expired patte, but the ammo will come in handy!  Keep fighting the good fight boys n girls, slava ukraini",4f124e981d2822cec4a1924da68ad7cc11dc0c01,True,False,,,,,0,1653318014,,0,{},i9ouvqc,False,t3_tkq46l,False,True,t3_tkq46l,/r/UkraineInvasionVideos/comments/tkq46l/more_russian_ammo_were_captured_by_territorial/i9ouvqc/,1653318027,1,False,True,False,UkraineInvasionVideos,t5_5wkihl,r/UkraineInvasionVideos,public,,0,[],,1653289214.0
[],False,,[deleted],,,,,,dark,,,,,[removed],fe993932d6dced4c0a879e9aa5d7a6e0fbb467f5,True,True,,,DELETED,,0,1653318004,,0,{},i9ouutj,False,t3_uvno5u,False,True,t3_uvno5u,/r/UkraineInvasionVideos/comments/uvno5u/putins_army_getting_obliterated_by_western_weapons/i9ouutj/,1653318021,1,False,True,False,UkraineInvasionVideos,t5_5wkihl,r/UkraineInvasionVideos,public,,0,[],,1653289204.0
[],False,,Nice-Serve3811,,,[],,,,text,t2_ei6po3qc,False,False,Fucking traitors,ee1466f9a4d7c8f0efd98e46abc5096faac6f2b3,True,False,,,,,0,1653317981,,0,{},i9ousx3,False,t3_uvwuxn,False,True,t3_uvwuxn,/r/UkraineInvasionVideos/comments/uvwuxn/the_man_leaked_the_positions_of_the_armed_forces/i9ousx3/,1653317997,1,False,True,False,UkraineInvasionVideos,t5_5wkihl,r/UkraineInvasionVideos,public,,0,[],,1653289181.0
[],False,,panda_enjoi,,,[],,,,text,t2_j3rn68ww,False,True,"If you don't believe that the Russians will do this to any other country they invade, you're an idiot.This kinda stuff has happened in the past, with pretty much every country/peoples doing something similar. War is hell, whether the Geneva Conventions are adhered to or not, it is still",fd9c0f3df390d8684539dbd1e93c6ab508871b74,True,False,,,,,0,1653317829,,0,{},i9ougkq,False,t3_uiuxgw,False,True,t3_uiuxgw,/r/UkraineInvasionVideos/comments/uiuxgw/russian_soldier_discusses_torture_of_ukrainians/i9ougkq/,1653317845,1,False,True,False,UkraineInvasionVideos,t5_5wkihl,r/UkraineInvasionVideos,public,,0,[],,1653289029.0
[],False,,ComradeDrDeclan,,,[],,,,text,t2_j0jy2p08,False,False,"No chance he will be with regular Ukrainian population, not in a million years. I feel like I don't need to explain why but I will: 

\- That would constitute a cruel and unusual punishment and probably leave him dead

\- Ukraine want to keep its reputation good, won't be getting into NATO or EU by killing war prisoners or putting them in situations that are bad for their wellbeing",27f94cb3c654059bf02fdc5f5456b625b8fa7504,True,False,,,,,0,1653317659,,0,{},i9ou2w6,False,t3_uvx0te,False,True,t1_i9oh1d9,/r/UkraineInvasionVideos/comments/uvx0te/finally_only_1500000_to_go/i9ou2w6/,1653317672,1,False,True,False,UkraineInvasionVideos,t5_5wkihl,r/UkraineInvasionVideos,public,,0,[],,1653288859.0
[],False,,TheSunflowerSeeds,,,[],,,,text,t2_sldqd7t,False,False,"While sunflowers are thought to have originated in Mexico and Peru, they are one of the first plants to ever be cultivated in the United States. They have been used for more than 5,000 years by the Native Americans, who not only used the seeds as a food and an oil source, but also used the flowers, roots and stems for varied purposes including as a dye pigment. The Spanish explorers brought sunflowers back to Europe, and after being first grown in Spain, they were subsequently introduced to other neighboring countries. Currently, sunflower oil is one of the most popular oils in the world. Today, the leading commercial producers of sunflower seeds include the Russian Federation, Peru, Argentina, Spain, France and China.",86251a69226c091e559881d34fc64d37fa301c03,True,False,,,,,0,1653317651,,0,{},i9ou280,False,t3_uvw40p,False,True,t1_i9ou0sb,/r/UkraineInvasionVideos/comments/uvw40p/ruzi_paratroopers_demilitarized_by_lviv/i9ou280/,1653317665,1,False,True,False,UkraineInvasionVideos,t5_5wkihl,r/UkraineInvasionVideos,public,,0,[],,1653288851.0
[],False,,KarlDerHammerPrime,,,[],,,,text,t2_2ekykurb,False,False,Yup. Good fertilizer for sunflowers though,bb4b8634471660ee0e374ce24dcb87118cef98be,True,False,,,,,0,1653317634,,0,{},i9ou0sb,False,t3_uvw40p,False,True,t1_i9oa6jk,/r/UkraineInvasionVideos/comments/uvw40p/ruzi_paratroopers_demilitarized_by_lviv/i9ou0sb/,1653317650,1,False,True,False,UkraineInvasionVideos,t5_5wkihl,r/UkraineInvasionVideos,public,,0,[],,1653288834.0
[],False,,KarlDerHammerPrime,,,[],,,,text,t2_2ekykurb,False,False,It lingers in your sinuses for days. In mine at least,9d8ec408dd104ad4742db844674737f9770c8e20,True,False,,,,,0,1653317603,,0,{},i9oty9e,False,t3_uvw40p,False,True,t1_i9ogqfx,/r/UkraineInvasionVideos/comments/uvw40p/ruzi_paratroopers_demilitarized_by_lviv/i9oty9e/,1653317619,1,False,True,False,UkraineInvasionVideos,t5_5wkihl,r/UkraineInvasionVideos,public,,0,[],,1653288803.0
[],False,,Nonamanadus,,,[],,,,text,t2_9uta8,False,False,"Regardless of military training did his parents/society not teach him that murder (shooting innocent people) is wrong? What does it say about a society when it's men degrade to such a state that they rape and murder even children on a large scale. 

Russia the home of degenerates.",c09adc5f54d236a13b8c2e890b0da99b55ba520d,True,False,,,,,0,1653317597,,0,{},i9otxq5,False,t3_uvx0te,False,True,t3_uvx0te,/r/UkraineInvasionVideos/comments/uvx0te/finally_only_1500000_to_go/i9otxq5/,1653317611,1,False,True,False,UkraineInvasionVideos,t5_5wkihl,r/UkraineInvasionVideos,public,,0,[],,1653288797.0
[],False,,ComradeDrDeclan,,,[],,,,text,t2_j0jy2p08,False,False,"Honestly, I might have misread the room but I don't think anyone wishes death on this man. I (personally) find his situation tragic, a waste of a life for a young man who was brought up in a fascist shithole. When I was 21, I was extremely immature - idk seems like a sad situation all around",6941e2c467be308a62d495f07c16b04bc1ffe206,True,False,,,,,0,1653317311,,0,{},i9ota6s,False,t3_uvx0te,False,True,t1_i9ofc0p,/r/UkraineInvasionVideos/comments/uvx0te/finally_only_1500000_to_go/i9ota6s/,1653317327,1,False,True,False,UkraineInvasionVideos,t5_5wkihl,r/UkraineInvasionVideos,public,,0,[],,1653288511.0
[],False,,SgtCO942O,,,[],,,,text,t2_aa64rhj3,False,False,You can when there no cameras around,37576cac9adea14e8b97ad19d54344a667167d90,True,False,,,,,0,1653317058,,0,{},i9ospmh,False,t3_uvwuxn,False,True,t1_i9o3yvd,/r/UkraineInvasionVideos/comments/uvwuxn/the_man_leaked_the_positions_of_the_armed_forces/i9ospmh/,1653317074,1,False,True,False,UkraineInvasionVideos,t5_5wkihl,r/UkraineInvasionVideos,public,,0,[],,1653288258.0
[],False,,SgtCO942O,,,[],,,,text,t2_aa64rhj3,False,False,Wonder how many worthless Rubels (whatever orcs and there nasty ass family’s use as currency in Russia) he got for it…..prolly only got a bottle of canola oil lmao,da4ee2bf5e32e71136e2fee8d4a90964f469c596,True,False,,,,,0,1653317026,,0,{},i9osn3y,False,t3_uvwuxn,False,True,t3_uvwuxn,/r/UkraineInvasionVideos/comments/uvwuxn/the_man_leaked_the_positions_of_the_armed_forces/i9osn3y/,1653317044,1,False,True,False,UkraineInvasionVideos,t5_5wkihl,r/UkraineInvasionVideos,public,,0,[],,1653288226.0
[],False,,greendragon59911,,,[],,,,text,t2_4g4bpbyw,False,False,"Good luck in your quest, can't say it will be a successful endeavor!",7822e8eba19ca003f3b88eb08d1aebe8ce79a165,True,False,,,,,0,1653316952,,0,{},i9osh4s,False,t3_uw0gqk,False,True,t1_i9om49d,/r/UkraineInvasionVideos/comments/uw0gqk/an_ukrainian_stugnap_antitank_guided_missile/i9osh4s/,1653316968,1,False,True,False,UkraineInvasionVideos,t5_5wkihl,r/UkraineInvasionVideos,public,,0,[],,1653288152.0
[],False,,NiftyMufti,,,[],,,,text,t2_2kikwcu8,False,False,"This is still not about Americans. Just more whataboutisms.

Russia has translated news. Where are the sentences?",5c1d878eff946e6b8f171b346db2028fc672c4f5,True,False,,,,,0,1653316280,,0,{},i9oqyml,False,t3_uusaif,False,True,t1_i9o3c2n,/r/UkraineInvasionVideos/comments/uusaif/knock_it_off/i9oqyml/,1653316299,1,False,True,False,UkraineInvasionVideos,t5_5wkihl,r/UkraineInvasionVideos,public,,0,[],,1653287480.0
[],False,,NiftyMufti,,,[],,,,text,t2_2kikwcu8,False,False,"They are still worth (at least) $200 a piece, despite you being a Karen about it.",ae496fdc2b1c5438570700bb8db711b98c01d709,True,False,,,,,0,1653316185,,0,{},i9oqr2f,False,t3_uvw40p,False,True,t1_i9o1ve0,/r/UkraineInvasionVideos/comments/uvw40p/ruzi_paratroopers_demilitarized_by_lviv/i9oqr2f/,1653316199,1,False,True,False,UkraineInvasionVideos,t5_5wkihl,r/UkraineInvasionVideos,public,,0,[],,1653287385.0
[],False,,dc89108,,,[],,,,text,t2_2af8idll,False,False,I think he should be promoted to mine clearing and detection.,b14fb8b9a49db744e1e76aaac8ed2c09d8324ffd,True,False,,,,,0,1653316133,,0,{},i9oqmwy,False,t3_uvwuxn,False,False,t3_uvwuxn,/r/UkraineInvasionVideos/comments/uvwuxn/the_man_leaked_the_positions_of_the_armed_forces/i9oqmwy/,1653316146,1,False,True,False,UkraineInvasionVideos,t5_5wkihl,r/UkraineInvasionVideos,public,,0,[],,1653287333.0
[],False,,Ok-Professor-8323,,,[],,,,text,t2_ilxmnxn6,False,False,Horny 💀,e775f98f81c24b0d85747e13b176c32314e5ce4d,True,False,,,,,0,1653315968,,0,{},i9oq9rx,False,t3_uvjrfz,False,True,t3_uvjrfz,/r/UkraineInvasionVideos/comments/uvjrfz/crazy_bh/i9oq9rx/,1653315979,1,False,True,False,UkraineInvasionVideos,t5_5wkihl,r/UkraineInvasionVideos,public,,0,[],,1653287168.0
[],False,,[deleted],,,,,,dark,,,,,[removed],fe993932d6dced4c0a879e9aa5d7a6e0fbb467f5,True,True,,,DELETED,,0,1653315960,,0,{},i9oq95m,False,t3_uw1es5,False,True,t3_uw1es5,/r/UkraineInvasionVideos/comments/uw1es5/putin_sucks/i9oq95m/,1653315971,1,False,True,False,UkraineInvasionVideos,t5_5wkihl,r/UkraineInvasionVideos,public,,0,[],,1653287160.0
[],False,,Glum-Significance206,,,[],,,,text,t2_dlc98qpn,False,False,short and painful,99013695fe44f6c2947f1f65415b47ca133d4906,True,False,,,,,0,1653315937,,0,{},i9oq7ak,False,t3_uvx0te,False,True,t1_i9ooj58,/r/UkraineInvasionVideos/comments/uvx0te/finally_only_1500000_to_go/i9oq7ak/,1653315948,1,False,True,False,UkraineInvasionVideos,t5_5wkihl,r/UkraineInvasionVideos,public,,0,[],,1653287137.0
[],False,,Glum-Significance206,,,[],,,,text,t2_dlc98qpn,False,False,i’m glad that “following orders” isn’t seen as a good excuse anymore,a5e1eb40c6649fe44cf7f0c9481b32ce197a4e77,True,False,,,,,0,1653315896,,0,{},i9oq40w,False,t3_uvx0te,False,True,t3_uvx0te,/r/UkraineInvasionVideos/comments/uvx0te/finally_only_1500000_to_go/i9oq40w/,1653315910,1,False,True,False,UkraineInvasionVideos,t5_5wkihl,r/UkraineInvasionVideos,public,,0,[],,1653287096.0
[],False,,CDXXRoman,,,[],,,,text,t2_bi5jv,False,False,That doesn't help at all,2463d2298a84b0a1d87fa3d7325aa264529bca76,True,False,,,,,0,1653315792,,0,{},i9opvsy,False,t3_uvw40p,False,True,t1_i9nxbzx,/r/UkraineInvasionVideos/comments/uvw40p/ruzi_paratroopers_demilitarized_by_lviv/i9opvsy/,1653315804,1,False,True,False,UkraineInvasionVideos,t5_5wkihl,r/UkraineInvasionVideos,public,,0,[],,1653286992.0
[],False,,Tharugbaidhmath,,,[],,,,text,t2_67otqdru,False,False,That life sentence is going to be very short I think,e51a0c5785df05a066da0616db10a082d76d3984,True,False,,,,,0,1653315170,,0,{},i9ooj58,False,t3_uvx0te,False,True,t3_uvx0te,/r/UkraineInvasionVideos/comments/uvx0te/finally_only_1500000_to_go/i9ooj58/,1653315184,1,False,True,False,UkraineInvasionVideos,t5_5wkihl,r/UkraineInvasionVideos,public,,0,[],,1653286370.0
[],False,,tiboric,,,[],,,,text,t2_3gkccwi,False,False,Shot an old man for being on the phone.,c51bde9b7ee235e9de6d5cd740ee62a437096d12,True,False,,,,,0,1653314672,,0,{},i9ongkc,False,t3_uvx0te,False,True,t3_uvx0te,/r/UkraineInvasionVideos/comments/uvx0te/finally_only_1500000_to_go/i9ongkc/,1653314683,1,False,True,False,UkraineInvasionVideos,t5_5wkihl,r/UkraineInvasionVideos,public,,0,[],,1653285872.0
[],False,,boojieboy,,,[],,,,text,t2_6pgec,False,False,bUt UkRaInE iS rUsSiA,756694afd158d033284c39e25c416b94966806dd,True,False,,,,,0,1653314600,,0,{},i9onawu,False,t3_uvjrfz,False,True,t1_i9m6ik9,/r/UkraineInvasionVideos/comments/uvjrfz/crazy_bh/i9onawu/,1653314615,1,False,True,False,UkraineInvasionVideos,t5_5wkihl,r/UkraineInvasionVideos,public,,0,[],,1653285800.0
[],False,,69Godzilla69,,,[],,,,text,t2_58ms9cbv,False,False,Might as well trail the entire Russian army,3a1d75307e0b931df49799842d5e07dd1f00b6bc,True,False,,,,,0,1653314036,,0,{},i9om4a6,False,t3_uvx0te,False,True,t3_uvx0te,/r/UkraineInvasionVideos/comments/uvx0te/finally_only_1500000_to_go/i9om4a6/,1653314049,1,False,True,False,UkraineInvasionVideos,t5_5wkihl,r/UkraineInvasionVideos,public,,0,[],,1653285236.0
[],False,,yablinga,,,[],,,,text,t2_8db8k41m,False,False,"Dog bites man - not news. Man bites dog - news.

Stugna hits target - not news. Target hits Stugna - seriously? How is that going to happen?

After almost three months of watching Ukrainians smacking the living daylights out of Russian vehicles with Stugnas, I want to watch a couple of videos with misses, just to comfort myself that Ukrainian Stugna operators are human too, and I'm not the only one who misses occasionally.",910c48bb395de69d32f729493bae579764158156,True,False,,,,,0,1653314036,,0,{},i9om49d,False,t3_uw0gqk,False,True,t3_uw0gqk,/r/UkraineInvasionVideos/comments/uw0gqk/an_ukrainian_stugnap_antitank_guided_missile/i9om49d/,1653314049,1,False,True,False,UkraineInvasionVideos,t5_5wkihl,r/UkraineInvasionVideos,public,,0,[],,1653285236.0
[],False,,davidczar05,,,[],,,,text,t2_1vh3qsxl,False,False,You think he might drop a soap in the shower ?,035862a61c94ced609da57f5849855544e69b519,True,False,,,,,0,1653313935,,0,{},i9olwrm,False,t3_uvx0te,False,True,t3_uvx0te,/r/UkraineInvasionVideos/comments/uvx0te/finally_only_1500000_to_go/i9olwrm/,1653313952,1,False,True,False,UkraineInvasionVideos,t5_5wkihl,r/UkraineInvasionVideos,public,,0,[],,1653285135.0
[],False,,Man_in_the_uk,,,[],,,,text,t2_ac41djtc,False,False,Well then how do they know they aren't wasting them? Or are they targeting a base?,43d97d9ca83939f97732b55424f36b5d0cda97a4,True,False,,,,,0,1653313794,,0,{},i9olm3v,False,t3_uv8ouh,False,True,t1_i9o9fwm,/r/UkraineInvasionVideos/comments/uv8ouh/donbass_the_ukrainian_army_tries_out_for_the/i9olm3v/,1653313810,1,False,True,False,UkraineInvasionVideos,t5_5wkihl,r/UkraineInvasionVideos,public,,0,[],,1653284994.0
[],False,,UncleAugie,,,[],,,,text,t2_dtz47,False,False,"&gt; West will maybe have some sort of peace with Russia, but it will never return to how it was, 

I disagree, over time Russia will be welcomed back to the table, it may take decades, but it will happen eventually.",dbe5348fb865fa8d2d779c3075b13dee410ae006,True,False,,,,,0,1653313622,,0,{},i9ol93u,False,t3_uvjrfz,False,False,t1_i9o48m1,/r/UkraineInvasionVideos/comments/uvjrfz/crazy_bh/i9ol93u/,1653313632,1,False,True,False,UkraineInvasionVideos,t5_5wkihl,r/UkraineInvasionVideos,public,,0,[],,1653284822.0
[],False,,MAUSER_91,,,[],,,,text,t2_lkv5ourz,False,False,"Perfect, next one... 🇺🇦💪",dc139f75f4c65c3acee077522f6d50e691f8459f,True,False,,,,,0,1653313353,,0,{},i9okpbz,False,t3_uvx0te,False,True,t3_uvx0te,/r/UkraineInvasionVideos/comments/uvx0te/finally_only_1500000_to_go/i9okpbz/,1653313370,1,False,True,False,UkraineInvasionVideos,t5_5wkihl,r/UkraineInvasionVideos,public,,0,[],,1653284553.0
[],False,,Voluster,,,[],,,,text,t2_mz2in7ji,False,False,Should have put him down. Traitor,3fd00f52aa977f8b4b6271e815f0e5be44d0902f,True,False,,,,,0,1653313251,,0,{},i9okhwd,False,t3_uvwuxn,False,True,t3_uvwuxn,/r/UkraineInvasionVideos/comments/uvwuxn/the_man_leaked_the_positions_of_the_armed_forces/i9okhwd/,1653313268,1,False,True,False,UkraineInvasionVideos,t5_5wkihl,r/UkraineInvasionVideos,public,,0,[],,1653284451.0
[],False,,TawmanPlays,,,[],,,,text,t2_5vdds1tz,False,False,"Archiving all footages I find on a dedicated channel, if anyone has more please help us keep an updated feed and keep each other aware on recent stuff!   We had to terminate all invites and go under a lockdown for a week cause a bunch of people, likely pro-russians were hopping en-masse and sharing loli stuff trying to get the server banned, the new link is https://discord.gg/56xPUS2yKw",e8be9dad7023051a1b186ca176d126273de47445,True,False,,,,,0,1653313247,,0,{},i9okhlh,True,t3_uw0gqk,False,True,t3_uw0gqk,/r/UkraineInvasionVideos/comments/uw0gqk/an_ukrainian_stugnap_antitank_guided_missile/i9okhlh/,1653313261,1,False,True,False,UkraineInvasionVideos,t5_5wkihl,r/UkraineInvasionVideos,public,,0,[],,1653284447.0
[],False,,aeoliat101,,,[],,,,text,t2_9fyeym93,False,False,"If Russia starts claiming that they won’t use WMDs, then I might start to fear that they will. They like to flex their military might, while blatantly lying about their true intentions.",53805e15848f73d1788e4890f8dc165f7316de4a,True,False,,,,,0,1653312271,,0,{},i9oija4,False,t3_uvjrfz,False,True,t1_i9nbu3h,/r/UkraineInvasionVideos/comments/uvjrfz/crazy_bh/i9oija4/,1653312282,1,False,True,False,UkraineInvasionVideos,t5_5wkihl,r/UkraineInvasionVideos,public,,0,[],,1653283471.0
[],False,,LaughingatRedditors,,,[],,,,text,t2_k3uo7u04,False,False,"Oh yeah, he’s fucked when he gets to prison.",c5588ae6778569a3975dc45c2b51fa9fac3e37e2,True,False,,,,,0,1653312172,,0,{},i9oic80,False,t3_uvx0te,False,True,t3_uvx0te,/r/UkraineInvasionVideos/comments/uvx0te/finally_only_1500000_to_go/i9oic80/,1653312186,1,False,True,False,UkraineInvasionVideos,t5_5wkihl,r/UkraineInvasionVideos,public,,0,[],,1653283372.0
[],False,,kallmekrisfan58,,,[],,,,text,t2_l26pr1kt,False,False,I'm sure it sucks to be him! I think killing him would put him out of his misery too soon. I wish him a long life in hell.,8cb25401cc2a674b2c6e19fbd7f6c038445e1042,True,False,,,,,0,1653311981,,0,{},i9ohyg4,False,t3_uvx0te,False,True,t1_i9oh1d9,/r/UkraineInvasionVideos/comments/uvx0te/finally_only_1500000_to_go/i9ohyg4/,1653311993,1,False,True,False,UkraineInvasionVideos,t5_5wkihl,r/UkraineInvasionVideos,public,,0,[],,1653283181.0
[],False,,ELLESSDEE42O,,,[],,,,text,t2_87y8c2dh,False,False,I wouldn’t be surprised if a few old tanks or IFV’s are repurposed into makeshift playground equipment while the children wait for the playgrounds to be rebuilt(obviously not any that have been blown up or destroyed). The Ukrainian side has already showed how crafty they can be with repurposing items.,a27c2e375f69d61d696c0798b4d69f0e473868b7,True,False,,,,,0,1653311949,,0,{},i9ohw5m,False,t3_uv516m,False,True,t3_uv516m,/r/UkraineInvasionVideos/comments/uv516m/russian_garbage/i9ohw5m/,1653311965,1,False,True,False,UkraineInvasionVideos,t5_5wkihl,r/UkraineInvasionVideos,public,,0,[],,1653283149.0
[],False,,ELLESSDEE42O,,,[],,,,text,t2_87y8c2dh,False,False,Russians wanted a Blitzkrieg and they got a Shitzkrieg,4c7f5dc3f326a2ac35a37b0babbff61315ba10b3,True,False,,,,,0,1653311679,,0,{},i9ohdc6,False,t3_uv968h,False,True,t3_uv968h,/r/UkraineInvasionVideos/comments/uv968h/if_youre_looking_for_a_hilarious_meme_about/i9ohdc6/,1653311694,1,False,True,False,UkraineInvasionVideos,t5_5wkihl,r/UkraineInvasionVideos,public,,0,[],,1653282879.0
[],False,,Tricky_Victory58,,,[],,,,text,t2_d3rghaan,False,False,Will he go to a military prison or regular “state” prison? And where would this prison be? In Ukraine?,6b90e36165e59511560025879a28db9aacc1760e,True,False,,,,,0,1653311563,,0,{},i9oh580,False,t3_uvx0te,False,True,t3_uvx0te,/r/UkraineInvasionVideos/comments/uvx0te/finally_only_1500000_to_go/i9oh580/,1653311576,1,False,True,False,UkraineInvasionVideos,t5_5wkihl,r/UkraineInvasionVideos,public,,0,[],,1653282763.0
[],False,,heavymtlbbq,,,[],,,,text,t2_6a6174lf,False,False,"He's the first, he'll be all alone, and he is kinda cute.",078501a55cd934f394688e7ed031cbea89bfbe7c,True,False,,,,,0,1653311507,,0,{},i9oh1d9,False,t3_uvx0te,False,True,t1_i9ogdms,/r/UkraineInvasionVideos/comments/uvx0te/finally_only_1500000_to_go/i9oh1d9/,1653311524,1,False,True,False,UkraineInvasionVideos,t5_5wkihl,r/UkraineInvasionVideos,public,,0,[],,1653282707.0
[],False,,nimbus76,,,[],,,,text,t2_gfl7l,False,False,He's going to go through some things.,5700abb8c4372534760d57a9506aaa36a6e8441e,True,False,,,,,0,1653311500,,0,{},i9oh0vb,False,t3_uvx0te,False,True,t1_i9o96i4,/r/UkraineInvasionVideos/comments/uvx0te/finally_only_1500000_to_go/i9oh0vb/,1653311516,1,False,True,False,UkraineInvasionVideos,t5_5wkihl,r/UkraineInvasionVideos,public,,0,[],,1653282700.0
