all_awardings,archived,associated_award,author,author_flair_background_color,author_flair_css_class,author_flair_richtext,author_flair_template_id,author_flair_text,author_flair_text_color,author_flair_type,author_fullname,author_patreon_flair,author_premium,body,body_sha1,can_gild,collapsed,collapsed_because_crowd_control,collapsed_reason,collapsed_reason_code,comment_type,controversiality,created_utc,distinguished,gilded,gildings,id,is_submitter,link_id,locked,no_follow,parent_id,permalink,retrieved_utc,score,score_hidden,send_replies,stickied,subreddit,subreddit_id,subreddit_name_prefixed,subreddit_type,top_awarded_type,total_awards_received,treatment_tags,unrepliable_reason,created
[],False,,NiftyMufti,,,[],,,,text,t2_2kikwcu8,False,False,"So no known cases of Russians being sentenced for atrocities then?  
Failing that, your original thesis about  Americans being just as bad as the Russians isn't valid.  At least some Americans are suitably ashamed after they've been given a couple of years to mull about their acts.",98189dccd2b0934626227e96d6eb3ae9b0c2d0eb,True,False,,,,,0,1653350234,,0,{},i9qvzif,False,t3_uusaif,False,True,t1_i9ql5uw,/r/UkraineInvasionVideos/comments/uusaif/knock_it_off/i9qvzif/,1653350249,1,False,True,False,UkraineInvasionVideos,t5_5wkihl,r/UkraineInvasionVideos,public,,0,[],,1653321434.0
[],False,,AggravatingMeeting78,,,[],,,,text,t2_8r5nzfcl,False,False,Stupid,e39be0c6f539f9fad6ff5cc86f393a9ed829ece2,True,False,,,,,0,1653349976,,0,{},i9qvgya,False,t3_ulo96f,False,True,t1_i9q3l8c,/r/UkraineInvasionVideos/comments/ulo96f/russian_ambassador_in_poland_got_tossed_with_red/i9qvgya/,1653349994,1,False,True,False,UkraineInvasionVideos,t5_5wkihl,r/UkraineInvasionVideos,public,,0,[],,1653321176.0
[],False,,Plumbarius65,,,[],,,,text,t2_ld6exeb9,False,False,What gets me is The Nazis considered Russians sub human.,febcb92f622c17009a3aef2dfdd774eed47969c4,True,False,,,,,0,1653349945,,0,{},i9qvepw,False,t3_uwbsgb,False,True,t3_uwbsgb,/r/UkraineInvasionVideos/comments/uwbsgb/ruzzian_nazis/i9qvepw/,1653349957,1,False,True,False,UkraineInvasionVideos,t5_5wkihl,r/UkraineInvasionVideos,public,,0,[],,1653321145.0
[],False,,AggravatingMeeting78,,,[],,,,text,t2_8r5nzfcl,False,False,Slava Russia 🇷🇺,12137537fca5f85f366543b728f188fc7e0faba9,True,False,,,,,0,1653349928,,0,{},i9qvdhs,False,t3_ulo96f,False,True,t1_i9q4x7z,/r/UkraineInvasionVideos/comments/ulo96f/russian_ambassador_in_poland_got_tossed_with_red/i9qvdhs/,1653349942,1,False,True,False,UkraineInvasionVideos,t5_5wkihl,r/UkraineInvasionVideos,public,,0,[],,1653321128.0
[],False,,Kindly-Scar-3224,,,[],,,,text,t2_fcu07ce8,False,False,"I had a few to many White Russians once, on second thought, the headache has become chronic",335d13bfce7ca397a08253257d854cf3019d5467,True,False,,,,,0,1653349889,,0,{},i9qvaoj,False,t3_uwcmew,False,True,t3_uwcmew,/r/UkraineInvasionVideos/comments/uwcmew/the_great_russian_empire/i9qvaoj/,1653349904,1,False,True,False,UkraineInvasionVideos,t5_5wkihl,r/UkraineInvasionVideos,public,,0,[],,1653321089.0
[],False,,Fuckjoesanford,,,[],,,,text,t2_ivt46vj,False,False,I’m thinking the exact same thing,e6c0c1245c6ee8c6f5286f17237966073cf3f2a2,True,False,,,,,0,1653349713,,0,{},i9quxk0,False,t3_uw60fp,False,True,t1_i9qehj8,/r/UkraineInvasionVideos/comments/uw60fp/ukrainian_paratroopers_destroyed_another_general/i9quxk0/,1653349728,1,False,True,False,UkraineInvasionVideos,t5_5wkihl,r/UkraineInvasionVideos,public,,0,[],,1653320913.0
[],False,,Kimchi_boy,,,[],,,,text,t2_hv1d4,False,False,"It fucking works, so...",10688628280e02775551843b58d36f71518605e2,True,False,,,,,0,1653349605,,0,{},i9quppi,False,t3_uw70q2,False,False,t1_i9qirri,/r/UkraineInvasionVideos/comments/uw70q2/caesar_self_propelled_howitzer_are_here/i9quppi/,1653349616,1,False,True,False,UkraineInvasionVideos,t5_5wkihl,r/UkraineInvasionVideos,public,,0,[],,1653320805.0
[],False,,SkysBuilder,,,[],,,,text,t2_mtvxsbcg,False,False,Both sides have Nazis can we move on from this narrative now.,63fb8ae69f83e876e8127277fa2cf65b23e44912,True,False,,,,,0,1653349464,,0,{},i9qufj1,False,t3_uwbsgb,False,True,t3_uwbsgb,/r/UkraineInvasionVideos/comments/uwbsgb/ruzzian_nazis/i9qufj1/,1653349477,1,False,True,False,UkraineInvasionVideos,t5_5wkihl,r/UkraineInvasionVideos,public,,0,[],,1653320664.0
[],False,,ArkanSaadeh,,,[],,,,text,t2_r0k5c,False,False,"[Notice how he isn't openly displaying Nazi symbols in uniform, while being a member of a regiment that uses an SS symbol as it's official patch, which the government hasn't made them change, even though they could, like any reasonable country.](https://azov.org.ua/)",80945c128b7522f356ba6624560d5eaf7414a3b1,True,False,,,,,0,1653349344,,0,{},i9qu6xe,False,t3_uwbgfx,False,True,t3_uwbgfx,/r/UkraineInvasionVideos/comments/uwbgfx/ruzzian_nazis/i9qu6xe/,1653349359,1,False,True,False,UkraineInvasionVideos,t5_5wkihl,r/UkraineInvasionVideos,public,,0,[],,1653320544.0
[],False,,Spare-Cap-3152,,,[],,,,text,t2_ebvmxqkl,False,False,"I read about Spotting Rifles the other day. They fire at the same ballistic trajectory as the large caliber gun you're firing. They're old school, but it allows you to adjust your main gun to target, without having to use its projectiles",d73cd4f0147a43489bc349572a72a5c31e7ca480,True,False,,,,,0,1653349336,,0,{},i9qu6eq,False,t3_uw4ibd,False,True,t1_i9ps47n,/r/UkraineInvasionVideos/comments/uw4ibd/kill_shot_in_one_ukraines_128th_separate_mountain/i9qu6eq/,1653349351,1,False,True,False,UkraineInvasionVideos,t5_5wkihl,r/UkraineInvasionVideos,public,,0,[],,1653320536.0
[],False,,Mike_Michaelson,,,[],,,,text,t2_4zg8d6ah,False,False,"Yeah, that’s the same as any current neo-Nazi who can barely read even a moderately difficult book. Skinhead thought and 20th Nazi ideology are quite distant. Hell, Putin wants to be both Napoleon and Hitler and can barely do anything but blackmail loyalty. He should have remained a mobster instead of pretending to be a leader.",a7d65b1280e53db45c86f61ec8a9bde029bde5b3,True,False,,,,,0,1653349289,,0,{},i9qu2xi,False,t3_uwbgfx,False,True,t1_i9qqinq,/r/UkraineInvasionVideos/comments/uwbgfx/ruzzian_nazis/i9qu2xi/,1653349301,1,False,True,False,UkraineInvasionVideos,t5_5wkihl,r/UkraineInvasionVideos,public,,0,[],,1653320489.0
[],False,,doughtnut2022,,,[],,,,text,t2_lycp8ofg,False,False,"Every western armies tend to attract far-right ""affectionados"" of all sort (neo-nazi, white supremacist), but generalizing ""nazi"" are controlling those armies is just a fallacy.",c7089ae24c7c01f4d526981483fdf64b4022dab6,True,False,,,,,0,1653348561,,0,{},i9qsm2n,False,t3_uwbsgb,False,True,t1_i9qo1v3,/r/UkraineInvasionVideos/comments/uwbsgb/ruzzian_nazis/i9qsm2n/,1653348577,1,False,True,False,UkraineInvasionVideos,t5_5wkihl,r/UkraineInvasionVideos,public,,0,[],,1653319761.0
[],False,,Different_Platform25,,,[],,,,text,t2_akjlpprv,False,False,There’s nazis on both sides lol,77effb00f472a8a83a88bee9bbe2ee96cfeb02a6,True,False,,,,,0,1653348518,,0,{},i9qsixs,False,t3_uwbsgb,False,True,t3_uwbsgb,/r/UkraineInvasionVideos/comments/uwbsgb/ruzzian_nazis/i9qsixs/,1653348531,1,False,True,False,UkraineInvasionVideos,t5_5wkihl,r/UkraineInvasionVideos,public,,0,[],,1653319718.0
[],False,,jomtienislife,,,[],,,,text,t2_47gs0q1z,False,False,Did they wear a black sun or ss symbol tho lol,c47c92373a75bb37ea2437933d46d3f7bc63c405,True,False,,,,,0,1653348095,,0,{},i9qro05,False,t3_uwbgfx,False,False,t3_uwbgfx,/r/UkraineInvasionVideos/comments/uwbgfx/ruzzian_nazis/i9qro05/,1653348111,1,False,True,False,UkraineInvasionVideos,t5_5wkihl,r/UkraineInvasionVideos,public,,0,[],,1653319295.0
[],False,,Tubesofthenorth,,,[],,,,text,t2_cpe0adjm,False,False,"Most munitions are dumb, some are laser guided (so can steer itself during flight to a target aimed at by a spotter) and some are smart (and will accurately seek and destroy a target within its target area). Each gets more exponentially more expensive however...",f08232c23eff307051891d55d1ed029fbd2a414d,True,False,,,,,0,1653348093,,0,{},i9qrntk,False,t3_uw70q2,False,True,t1_i9qnq1k,/r/UkraineInvasionVideos/comments/uw70q2/caesar_self_propelled_howitzer_are_here/i9qrntk/,1653348112,1,False,True,False,UkraineInvasionVideos,t5_5wkihl,r/UkraineInvasionVideos,public,,0,[],,1653319293.0
[],False,,backtotheland76,,,[],,,,text,t2_h4ancfsk,False,False,"This really doesn't mean anything except to point out how absurd Putins justification for the war is. There's a few Nazis in every Western country including Germany,  Poland, America,  Ukraine. 

The real point is that there are no Nazis in any of those countries that have any real political power and are generally loathed by the majority of people.

Another overlooked fact is that in countries like America we allow them to make fools of themselves because we believe in free speech, even for people with repulsive views. Whereas in Russia they ban words like war and invasion. This war in Ukraine is about free speech as much as anything and no one should ever forget that.",42fed8e11eb09f3d972b7e9e2b3a7766c33557eb,True,False,,,,,0,1653347964,,0,{},i9qrdwk,False,t3_uwbgfx,False,True,t3_uwbgfx,/r/UkraineInvasionVideos/comments/uwbgfx/ruzzian_nazis/i9qrdwk/,1653347975,1,False,True,False,UkraineInvasionVideos,t5_5wkihl,r/UkraineInvasionVideos,public,,0,[],,1653319164.0
[],False,,paul19989,,,[],,,,text,t2_69daou89,False,False,"No, Russians are ultra nationalists. They hate jews, muslims, blacks and everyone Else that isnt russian",f58e0ac2107f5fcde6e8722c9242d6f544db773d,True,False,,,,,0,1653347531,,0,{},i9qqinq,False,t3_uwbgfx,False,True,t1_i9qk3vi,/r/UkraineInvasionVideos/comments/uwbgfx/ruzzian_nazis/i9qqinq/,1653347546,1,False,True,False,UkraineInvasionVideos,t5_5wkihl,r/UkraineInvasionVideos,public,,0,[],,1653318731.0
[],False,,Money_Appointment_69,,,[],,,,text,t2_k4xqwfv1,False,False,Haven’t they got loads of Muslims fighting for me doesn’t seem to co in side,7e745a609824d7f9d4c3727606e0db6d84879b1b,True,False,,,,,0,1653346767,,0,{},i9qoy5m,False,t3_uwcmew,False,True,t3_uwcmew,/r/UkraineInvasionVideos/comments/uwcmew/the_great_russian_empire/i9qoy5m/,1653346782,1,False,True,False,UkraineInvasionVideos,t5_5wkihl,r/UkraineInvasionVideos,public,,0,[],,1653317967.0
[],False,,Lemus_,,,[],,,,text,t2_k6ivk1x7,False,False,"Honestly, it is absurd to say that the Ukrainians are Nazis and it is also absurd to say that the Russians are... it is evident that there are some Nazis in the Russian exercise and there are also in the Ukrainian one.",83ecbe1f38536ed9e17f77d797227c64a8f2c4ba,True,False,,,,,0,1653346330,,0,{},i9qo1v3,False,t3_uwbsgb,False,True,t3_uwbsgb,/r/UkraineInvasionVideos/comments/uwbsgb/ruzzian_nazis/i9qo1v3/,1653346347,1,False,True,False,UkraineInvasionVideos,t5_5wkihl,r/UkraineInvasionVideos,public,,0,[],,1653317530.0
[],False,,Opening_Put_8944,,,[],,,,text,t2_lnwl7fh4,False,False,Heil Russia,7cc5baa6f21fd88f8567c369473a3f243ff40709,True,False,,,,,0,1653346240,,0,{},i9qnv6q,False,t3_uwbgfx,False,True,t3_uwbgfx,/r/UkraineInvasionVideos/comments/uwbgfx/ruzzian_nazis/i9qnv6q/,1653346255,1,False,True,False,UkraineInvasionVideos,t5_5wkihl,r/UkraineInvasionVideos,public,,0,[],,1653317440.0
[],False,,wings22,,,[],,,,text,t2_dfj6n,False,False,Man I was thinking the projectile was self propelled and.. isn't that just a rocket?,1cedddae3d7feeb5fae3db0c613fe768dcc9aee1,True,False,,,,,0,1653346172,,0,{},i9qnq1k,False,t3_uw70q2,False,True,t1_i9pua6x,/r/UkraineInvasionVideos/comments/uw70q2/caesar_self_propelled_howitzer_are_here/i9qnq1k/,1653346187,1,False,True,False,UkraineInvasionVideos,t5_5wkihl,r/UkraineInvasionVideos,public,,0,[],,1653317372.0
[],False,,Lemus_,,,[],,,,text,t2_k6ivk1x7,False,False,Does the Russian have an eagle with a swastika tattooed on his back and the A for anarchist on his chest? seems a bit strange to me,d404f06d43c72aaf7ee92a5c46a265397e1dc61f,True,False,,,,,0,1653346092,,0,{},i9qnk2i,False,t3_uwbsgb,False,True,t3_uwbsgb,/r/UkraineInvasionVideos/comments/uwbsgb/ruzzian_nazis/i9qnk2i/,1653346103,1,False,True,False,UkraineInvasionVideos,t5_5wkihl,r/UkraineInvasionVideos,public,,0,[],,1653317292.0
[],False,,vilius_m_lt,,,[],,,,text,t2_k7w4g7am,False,False,Boy likes to be cringey af,de5e0c8d358f5a0781e46c7752f016ac1faafc35,True,False,,,,,0,1653345806,,0,{},i9qmyut,False,t3_uwbsgb,False,True,t1_i9qjb7m,/r/UkraineInvasionVideos/comments/uwbsgb/ruzzian_nazis/i9qmyut/,1653345822,1,False,True,False,UkraineInvasionVideos,t5_5wkihl,r/UkraineInvasionVideos,public,,0,[],,1653317006.0
[],False,,nin_son_god,,,[],,,,text,t2_5gztldxm,False,False,Knife in the eye is waiting,5376673427a27e57d512b39ccbedb453042903f9,True,False,,,,,0,1653345641,,0,{},i9qmmgk,False,t3_uvwuxn,False,True,t3_uvwuxn,/r/UkraineInvasionVideos/comments/uvwuxn/the_man_leaked_the_positions_of_the_armed_forces/i9qmmgk/,1653345652,1,False,True,False,UkraineInvasionVideos,t5_5wkihl,r/UkraineInvasionVideos,public,,0,[],,1653316841.0
[],False,,TheBlacksmith64,,,[],,,,text,t2_7ra10,False,False,I love that there are at least 6 orcs on top. Love me a happy ending!,e64b5c73cb340fa221505c27007011bebfb1ad3a,True,False,,,,,0,1653345416,,0,{},i9qm5kz,False,t3_uw0gqk,False,True,t3_uw0gqk,/r/UkraineInvasionVideos/comments/uw0gqk/an_ukrainian_stugnap_antitank_guided_missile/i9qm5kz/,1653345435,1,False,True,False,UkraineInvasionVideos,t5_5wkihl,r/UkraineInvasionVideos,public,,0,[],,1653316616.0
[],False,,Mindless-Camp1320,,,[],,,,text,t2_a0z1kty0,False,False,Crazy what 1 misale can do...rip,03416d217f0a31d98c9382569e427e7352155862,True,False,,,,,0,1653345166,,0,{},i9qlmm5,False,t3_uw6iwz,False,True,t3_uw6iwz,/r/UkraineInvasionVideos/comments/uw6iwz/official_we_have_78_dead_soldiers_after_missile/i9qlmm5/,1653345182,1,False,True,False,UkraineInvasionVideos,t5_5wkihl,r/UkraineInvasionVideos,public,,0,[],,1653316366.0
[],False,,Ooki_Jumoku,,,[],,,,text,t2_hv55e1nt,False,False,"&gt;He and the other foreigners were “shocked,” he says. “But the Ukrainian military was … calm, cool, collected. As they say, like, ‘This is normal, don’t worry about it.'”  
&gt;  
&gt;He is in awe of the Ukrainian soldiers’ efforts.  
&gt;  
&gt;“They are masters of terrain denial,” he says. “They know every inch of the area. They know the little alleyway that we can wait. They know how to get there. They know this is where we can hide. They know which building to go to. And they’ll tell you before we get there, hey, five houses over has a real nice basement. That’s where we should go.”

Stunning write up by this guy.

Interesting to see the viewpoint of someone who was on the side with overwhelming force in Syria and Afghanistan and now fighting on the other side against that overwhelming force.

Also interesting is how close the lines are to each other",60ffed7c74d4e3ea8c763cbb3406ef912fbac5ea,True,False,,,,,0,1653345065,,0,{},i9qlf07,True,t3_uwc6gw,False,True,t3_uwc6gw,/r/UkraineInvasionVideos/comments/uwc6gw/former_us_soldier_now_fighting_in_ukraine_tells/i9qlf07/,1653345076,1,False,True,False,UkraineInvasionVideos,t5_5wkihl,r/UkraineInvasionVideos,public,,0,[],,1653316265.0
[],False,,Mindless-Camp1320,,,[],,,,text,t2_a0z1kty0,False,False,I trust zelensky the same as putin,fb44c8a05bb1a00d8265bec5f3ca06a0a32caad4,True,False,,,,,0,1653345056,,0,{},i9qlect,False,t3_uw5sq0,False,True,t1_i9qegig,/r/UkraineInvasionVideos/comments/uw5sq0/war_update_230522_oc/i9qlect/,1653345070,1,False,True,False,UkraineInvasionVideos,t5_5wkihl,r/UkraineInvasionVideos,public,,0,[],,1653316256.0
[],False,,Mike_Michaelson,,,[],,,,text,t2_4zg8d6ah,False,False,By a lack of understanding of either.,b4cc515d4ddf86c1e7beb4b32e521515c855f245,True,False,,,,,0,1653345004,,0,{},i9qlag1,False,t3_uwbsgb,False,True,t1_i9qjb7m,/r/UkraineInvasionVideos/comments/uwbsgb/ruzzian_nazis/i9qlag1/,1653345017,1,False,True,False,UkraineInvasionVideos,t5_5wkihl,r/UkraineInvasionVideos,public,,0,[],,1653316204.0
[],False,,Acid_M0nkey,,,[],,,,text,t2_drxn4rb,False,False,"Is this still a reason to enjoy on dead soldiers ? Whatever the side?  Not all are scums. They are mostly kids and brainwashed most often.

Let's not loose our common sense when emotions is around.
That's how you get Idiocracy.",aee661e468f2513a28dae17906a1a916e0b4fdee,True,False,,,,,0,1653344942,,0,{},i9ql5uw,False,t3_uusaif,False,True,t1_i9oqyml,/r/UkraineInvasionVideos/comments/uusaif/knock_it_off/i9ql5uw/,1653344954,1,False,True,False,UkraineInvasionVideos,t5_5wkihl,r/UkraineInvasionVideos,public,,0,[],,1653316142.0
[],False,,Mike_Michaelson,,,[],,,,text,t2_4zg8d6ah,False,False,"Yes, like a Scarface poster in a dorm room. Admiration without understanding.",ddd18eb5f63a54e5889a5e66725445056648eec2,True,False,,,,,0,1653344912,,0,{},i9ql3kg,False,t3_uwbgfx,False,True,t1_i9qk9ln,/r/UkraineInvasionVideos/comments/uwbgfx/ruzzian_nazis/i9ql3kg/,1653344925,1,False,True,False,UkraineInvasionVideos,t5_5wkihl,r/UkraineInvasionVideos,public,,0,[],,1653316112.0
[],False,,Gedekid123,,,[],,,,text,t2_h7f7ezqn,False,False,Thank you! I'm really happy you like my content :),a302c5ae7d5e95c414a0db9b2af39961dc4215a0,True,False,,,,,0,1653344734,,0,{},i9qkq96,True,t3_uwa59u,False,True,t1_i9qjtfb,/r/UkraineInvasionVideos/comments/uwa59u/hey_guys_i_made_a_video_on_the_current_amount_of/i9qkq96/,1653344745,1,False,True,False,UkraineInvasionVideos,t5_5wkihl,r/UkraineInvasionVideos,public,,0,[],,1653315934.0
[],False,,notakebab,,,[],,,,text,t2_9atswz5d,False,False,Do we need more evidence?,f891d7565e3486ede38a5aaf5e196b0f3c8c84a8,True,False,,,,,0,1653344640,,0,{},i9qkj5p,False,t3_uwbsgb,False,True,t3_uwbsgb,/r/UkraineInvasionVideos/comments/uwbsgb/ruzzian_nazis/i9qkj5p/,1653344658,1,False,True,False,UkraineInvasionVideos,t5_5wkihl,r/UkraineInvasionVideos,public,,0,[],,1653315840.0
[],False,,Pecker_headed,,,[],,,,text,t2_l1dkok6s,False,False,That's what happens when you let Russia help you.. this is Ukraine,73867ece55f890c8ecdc85e3d26de08c14149f29,True,False,,,,,0,1653344631,,0,{},i9qkii7,False,t3_uvh4jl,False,True,t3_uvh4jl,/r/UkraineInvasionVideos/comments/uvh4jl/the_shelling_of_the_settlements_of_luhansk_region/i9qkii7/,1653344650,1,False,True,False,UkraineInvasionVideos,t5_5wkihl,r/UkraineInvasionVideos,public,,0,[],,1653315831.0
[],False,,PatrickPJM,,,[],,,,text,t2_f519w,False,False,Strongman like strongman. Strongman not smart.,e0c473dfb2f11d29867abe96d5a89cfbf0a3c940,True,False,,,,,0,1653344617,,0,{},i9qkhcq,False,t3_uwbgfx,False,True,t1_i9qiby2,/r/UkraineInvasionVideos/comments/uwbgfx/ruzzian_nazis/i9qkhcq/,1653344635,1,False,True,False,UkraineInvasionVideos,t5_5wkihl,r/UkraineInvasionVideos,public,,0,[],,1653315817.0
[],False,,cjohc,,,[],,,,text,t2_kklwnm3f,False,False,BS post,3138fad8ce3c068814034d7a9f0a1ff48858f1cf,True,False,,,,,0,1653344595,,0,{},i9qkfor,False,t3_uw60fp,False,True,t3_uw60fp,/r/UkraineInvasionVideos/comments/uw60fp/ukrainian_paratroopers_destroyed_another_general/i9qkfor/,1653344605,1,False,True,False,UkraineInvasionVideos,t5_5wkihl,r/UkraineInvasionVideos,public,,0,[],,1653315795.0
[],False,,Pecker_headed,,,[],,,,text,t2_l1dkok6s,False,False,Hopefully now a bunch or burnt BBQ rusky,b5a2f3ab66793bf8e6446a028209fafff78cd132,True,False,,,,,0,1653344584,,0,{},i9qkevn,False,t3_uw0gqk,False,True,t1_i9pesyb,/r/UkraineInvasionVideos/comments/uw0gqk/an_ukrainian_stugnap_antitank_guided_missile/i9qkevn/,1653344598,1,False,True,False,UkraineInvasionVideos,t5_5wkihl,r/UkraineInvasionVideos,public,,0,[],,1653315784.0
[],False,,Pecker_headed,,,[],,,,text,t2_l1dkok6s,False,False,That's a BBQ party,1292300a8fb9f2a386bda7e7ccb348b0b97d9b62,True,False,,,,,0,1653344534,,0,{},i9qkb7d,False,t3_uw0gqk,False,True,t3_uw0gqk,/r/UkraineInvasionVideos/comments/uw0gqk/an_ukrainian_stugnap_antitank_guided_missile/i9qkb7d/,1653344545,1,False,True,False,UkraineInvasionVideos,t5_5wkihl,r/UkraineInvasionVideos,public,,0,[],,1653315734.0
[],False,,Piercespositivepizza,,,[],,,,text,t2_95lzddgk,False,False,Luke a Scarface poster in a dorm room?,d26379b2e37967e72aacd37dece6c0c70daccfac,True,False,,,,,0,1653344513,,0,{},i9qk9ln,False,t3_uwbgfx,False,True,t1_i9qk3vi,/r/UkraineInvasionVideos/comments/uwbgfx/ruzzian_nazis/i9qk9ln/,1653344531,1,False,True,False,UkraineInvasionVideos,t5_5wkihl,r/UkraineInvasionVideos,public,,0,[],,1653315713.0
[],False,,Mike_Michaelson,,,[],,,,text,t2_4zg8d6ah,False,False,I think it has more to do with an admiration for their (the Nazis) means of expressing power and less with ideology.,dae77257c30aa5d72c86352d928a4147cf2238f6,True,False,,,,,0,1653344439,,0,{},i9qk3vi,False,t3_uwbgfx,False,True,t1_i9qiby2,/r/UkraineInvasionVideos/comments/uwbgfx/ruzzian_nazis/i9qk3vi/,1653344450,1,False,True,False,UkraineInvasionVideos,t5_5wkihl,r/UkraineInvasionVideos,public,,0,[],,1653315639.0
[],False,,CptCheerios,,,[],,,,text,t2_kqsaq,False,False,I'd give you 100 upvotes if I could just because you took time to narrate and generate real content compared to all those robovoice no effort spammers.,53c2f6dd303d574d8525f7a767c2b450b9569536,True,False,,,,,0,1653344305,,0,{},i9qjtfb,False,t3_uwa59u,False,True,t3_uwa59u,/r/UkraineInvasionVideos/comments/uwa59u/hey_guys_i_made_a_video_on_the_current_amount_of/i9qjtfb/,1653344317,1,False,True,False,UkraineInvasionVideos,t5_5wkihl,r/UkraineInvasionVideos,public,,0,[],,1653315505.0
[],False,,Virtuaali-Seppo,,,[],,,,text,t2_72uycoao,False,False,Change that to last 500 years and you are a lot closer.,c676208400e7de360cb7a13685e6dcda6d22866c,True,False,,,,,0,1653344255,,0,{},i9qjpla,True,t3_uw675d,False,True,t1_i9qjg61,/r/UkraineInvasionVideos/comments/uw675d/breaking_russias_counsellor_to_the_united_nations/i9qjpla/,1653344272,1,False,True,False,UkraineInvasionVideos,t5_5wkihl,r/UkraineInvasionVideos,public,,0,[],,1653315455.0
[],False,,josbossboboss,,,[],,,,text,t2_8mg51i3e,False,False,That's really saying something.  There is so much for Russia to be ashamed about over the last 20 years.,06624de736d3be8350480e5cf0ea9a39352b4461,True,False,,,,,0,1653344131,,0,{},i9qjg61,False,t3_uw675d,False,True,t3_uw675d,/r/UkraineInvasionVideos/comments/uw675d/breaking_russias_counsellor_to_the_united_nations/i9qjg61/,1653344145,1,False,True,False,UkraineInvasionVideos,t5_5wkihl,r/UkraineInvasionVideos,public,,0,[],,1653315331.0
[],False,,Mindless-Artichoke71,,,[],,,,text,t2_jf2zh75b,False,False,How can you have both a Swazi and an anarchy a at the same time?,21aedc1b31863beeed80aed4e346b7711f5a5df0,True,False,,,,,0,1653344067,,0,{},i9qjb7m,False,t3_uwbsgb,False,False,t3_uwbsgb,/r/UkraineInvasionVideos/comments/uwbsgb/ruzzian_nazis/i9qjb7m/,1653344078,1,False,True,False,UkraineInvasionVideos,t5_5wkihl,r/UkraineInvasionVideos,public,,0,[],,1653315267.0
[],False,,Virtual-Employee9881,,,[],,,,text,t2_9mka45yt,False,False,Lol this dude is dead everyone knows espionage during war treason = death,3da042596eb10be2389e5aca8bf43b6be62be5e2,True,False,,,,,0,1653343849,,0,{},i9qiv3p,False,t3_uvwuxn,False,True,t3_uvwuxn,/r/UkraineInvasionVideos/comments/uvwuxn/the_man_leaked_the_positions_of_the_armed_forces/i9qiv3p/,1653343861,1,False,True,False,UkraineInvasionVideos,t5_5wkihl,r/UkraineInvasionVideos,public,,0,[],,1653315049.0
[],False,,josbossboboss,,,[],,,,text,t2_8mg51i3e,False,False,Still crazy that in 2021 we still have to resort to hurling chunks of metal at each other to settle disputes.,644c1654bdf77758adf09141ccf30f498070e1f6,True,False,,,,,0,1653343805,,0,{},i9qirri,False,t3_uw70q2,False,True,t3_uw70q2,/r/UkraineInvasionVideos/comments/uw70q2/caesar_self_propelled_howitzer_are_here/i9qirri/,1653343817,1,False,True,False,UkraineInvasionVideos,t5_5wkihl,r/UkraineInvasionVideos,public,,0,[],,1653315005.0
[],False,,gedai,,,[],,,,text,t2_11i9ge,False,False,I can’t believe the Russian people believe only 1000 russians have died.,8f0326736e8b02f58942adf5199aeebfb4e518ba,True,False,,,,,0,1653343721,,0,{},i9qilg8,False,t3_uw5sq0,False,True,t3_uw5sq0,/r/UkraineInvasionVideos/comments/uw5sq0/war_update_230522_oc/i9qilg8/,1653343733,1,False,True,False,UkraineInvasionVideos,t5_5wkihl,r/UkraineInvasionVideos,public,,0,[],,1653314921.0
[],False,,Piercespositivepizza,,,[],,,,text,t2_95lzddgk,False,False,"I don’t really understand this, I’ve seen a lot of Russians holding the nazi flag, giving the Roman salute. Russians and Germans hated each other.. is this a knee jerk reaction in Russia to anti communists? Is there a German population inside Russia? What’s the appeal for a Russian of all people to be a nazi? 

You can say what’s the appeal for anyone, I get that. For a Russian it seems like it would be like a Palestinian holding the Israeli flag etc. 

There’s idiots in America, British people who are “Nazis”. So I understand.. but I guess I always just thought Russians were very anti German/ Nazis.",f1d3ff12ab3a86e5d8623c65416b8ccd8562b5fb,True,False,,,,,0,1653343598,,0,{},i9qiby2,False,t3_uwbgfx,False,True,t3_uwbgfx,/r/UkraineInvasionVideos/comments/uwbgfx/ruzzian_nazis/i9qiby2/,1653343614,1,False,True,False,UkraineInvasionVideos,t5_5wkihl,r/UkraineInvasionVideos,public,,0,[],,1653314798.0
[],False,,Valantur,,,[],,,,text,t2_113rzd,False,False,an order of polonium tea coming right up!,3a24d5115563441bb37c661c98fd40e6b4e083d0,True,False,,,,,0,1653343526,,0,{},i9qi6d0,False,t3_uw675d,False,True,t3_uw675d,/r/UkraineInvasionVideos/comments/uw675d/breaking_russias_counsellor_to_the_united_nations/i9qi6d0/,1653343540,1,False,True,False,UkraineInvasionVideos,t5_5wkihl,r/UkraineInvasionVideos,public,,0,[],,1653314726.0
[],False,,chasewright07,,,[],,,,text,t2_dtf6yh5j,False,False,Cringe edit.,a444e10a25bfe5c57c3566836e94827b6fa14bbb,True,False,,,,,0,1653343362,,0,{},i9qhts5,False,t3_uw70q2,False,True,t3_uw70q2,/r/UkraineInvasionVideos/comments/uw70q2/caesar_self_propelled_howitzer_are_here/i9qhts5/,1653343375,1,False,True,False,UkraineInvasionVideos,t5_5wkihl,r/UkraineInvasionVideos,public,,0,[],,1653314562.0
