all_awardings,archived,associated_award,author,author_flair_background_color,author_flair_css_class,author_flair_richtext,author_flair_template_id,author_flair_text,author_flair_text_color,author_flair_type,author_fullname,author_patreon_flair,author_premium,body,body_sha1,can_gild,collapsed,collapsed_because_crowd_control,collapsed_reason,collapsed_reason_code,comment_type,controversiality,created_utc,distinguished,gilded,gildings,id,is_submitter,link_id,locked,no_follow,parent_id,permalink,retrieved_utc,score,score_hidden,send_replies,stickied,subreddit,subreddit_id,subreddit_name_prefixed,subreddit_type,top_awarded_type,total_awards_received,treatment_tags,unrepliable_reason,created,author_cakeday
[],False,,StevenMaurer,,,[],,,,text,t2_gsqva,False,False,"That after 20 years, the US left? That was negotiated by Trump and continued by Biden. About as bi-partisan as you can get.

That the US military left equipment for the ANA (Afghan National Army) with which to fight the Taliban? Should the military have left them high and dry?

That the ANA decided that they really didn't want to fight?

Or that the US military disabled all the actually useful equipment (MRAPs are not, as Ukraine has proven, very militarily useful)?

Most of the American conservatives whining about Afghanistan are like Russian ""Z""s: cowards who want foreign wars for their own sick entertainment, and who deliberately lie to both others and themselves about the reality on the ground.",7db7630f8e40ef2a89b2a3aa7daa1394ec1060df,True,False,,,,,0,1647982782,,0,{},i1pm93l,False,t3_tjstkw,False,True,t1_i1nzmed,/r/UkraineConflict/comments/tjstkw/has_anyone_called_up_afghanistan_and_asked_them/i1pm93l/,1647982794,1,True,True,False,UkraineConflict,t5_30oyx,r/UkraineConflict,public,,0,[],,1647953982.0,
[],False,,it__wasnt__me__,,,[],,,,text,t2_d3u10l4e,False,False,"Come on now that's not the case is it?
Renault are scared of going bankrupt as a result of the Russians stealing their business interest inside Russia. The French government are going along with it because they don't want to lose a ton of wonga.
Btw I don't personally like the decision.",63a0b62d67df76093db84686d38ee45f7c530541,True,False,,,,,0,1647982777,,0,{},i1pm8m5,False,t3_tkcvix,False,True,t3_tkcvix,/r/UkraineConflict/comments/tkcvix/renault_car_brand_supports_russia_and_the_war/i1pm8m5/,1647982794,1,True,True,False,UkraineConflict,t5_30oyx,r/UkraineConflict,public,,0,[],,1647953977.0,
[],False,,WhiteNoise_1981,,,[],,,,text,t2_k4taogwg,False,False,I used a reference to a grenade for the purpose that this video doesn’t show us enough it could quite easily be in any country on any given day in a gravel lot. A better video showing the multiple impact points of the WP which there would be with Air burst WP in such a location that would suggest it wasn’t used for the legal use of WP would of been a lot better for the purpose of claiming war crimes.,676cd4d99681469d5620bbe451f26e8deafe1258,True,False,,,,,0,1647982687,,0,{},i1pm0a3,False,t3_tjw0xv,False,True,t1_i1pgchc,/r/UkraineConflict/comments/tjw0xv/deputy_head_of_the_patrol_police_of_kiev_oleksiy/i1pm0a3/,1647982711,1,True,True,False,UkraineConflict,t5_30oyx,r/UkraineConflict,public,,0,[],,1647953887.0,
[],False,,iwonss,,,[],,,,text,t2_8wnerev7,False,False,"So in other words: they are creating  fire spots in schools, hospitals, kindergartens - exactly how Russia TV says. And preventing civilians to leave the city exactly how Russians says? Hmmm. And more over this article uses Russian ""Odessa"" not international Ukrainian ""Odesa""?

&amp;#x200B;

I live 30 km from Odesa and almost every day I ride to the city and back without any problems: all checkpoints are open for everyone and usual car traffic passes through them.",63b09f321d47ce5ed0b783ca03471718f7ebcd8e,True,False,,,,,0,1647982614,,0,{},i1pltgz,False,t3_tkbscu,False,True,t3_tkbscu,/r/UkraineConflict/comments/tkbscu/is_this_true/i1pltgz/,1647982629,1,True,True,False,UkraineConflict,t5_30oyx,r/UkraineConflict,public,,0,[],,1647953814.0,
[],False,,Beta_Syndicate,,,[],,,,text,t2_h9g6yzvm,False,False,"God Bless the strength, the resilience and heart of the Ukrainian people.",81a33be395f31f8a0c0a5264bd758b549e3b0197,True,False,,,,,0,1647982560,,0,{},i1ploeb,False,t3_tk8wf9,False,True,t3_tk8wf9,/r/UkraineConflict/comments/tk8wf9/musicians_are_inspirating_people_to_build/i1ploeb/,1647982584,1,True,True,False,UkraineConflict,t5_30oyx,r/UkraineConflict,public,,0,[],,1647953760.0,
[],False,,Vejasple,,,[],,,,text,t2_bxxiq,False,False,"If the corridor only leads to captivity in Russian territory, such policy would make sense.  They should less residents pass into Ukraine.",0e53b30a40185fbf88f67602e67f35dcb9193a8c,True,False,,,,,0,1647982558,,0,{},i1plo9i,False,t3_tkbscu,False,True,t3_tkbscu,/r/UkraineConflict/comments/tkbscu/is_this_true/i1plo9i/,1647982571,1,True,True,False,UkraineConflict,t5_30oyx,r/UkraineConflict,public,,0,[],,1647953758.0,
[],False,,The_Texican,,,[],,,,text,t2_3zqya,False,False,Thomas Sowell?,f1ac78df3014c15d4209bcf08dafff615ef418ee,True,False,,,,,0,1647982427,,0,{},i1plc27,False,t3_tjr25e,False,True,t3_tjr25e,/r/UkraineConflict/comments/tjr25e/watch_mehdi_hasan_introduces_you_to_putins/i1plc27/,1647982448,1,True,True,False,UkraineConflict,t5_30oyx,r/UkraineConflict,public,,0,[],,1647953627.0,
[],False,,catsinbananahats,,,[],,,,text,t2_di98lym9,False,True,Okay but what does modern day Russia have to do with what the Soviet Union did because the Soviet Union wasn't just Russia.,f227d46aebf38e12c89b5620e7e8e547d5d0d3f7,True,False,,,,,0,1647982398,,0,{},i1pl9f1,False,t3_tkazab,False,True,t3_tkazab,/r/UkraineConflict/comments/tkazab/well_russians_love_history_a_lot_so_maybe/i1pl9f1/,1647982418,1,True,True,False,UkraineConflict,t5_30oyx,r/UkraineConflict,public,,0,[],,1647953598.0,
[],False,,Beta_Syndicate,,,[],,,,text,t2_h9g6yzvm,False,False,"You nailed it. Look at the lines drawn in the sand my friend. 

One line drawn clearly states, ""We stand for everyone's Freedom and Ukraine.""

One line drawn clearly states, ""We stand for OUR Freedom to deny science, create insane conspiracies, worship crooks, loons, Putin, Hitler and we love the Social acceptance when you wear a red hat. Fuck Ukraine, fuck NATO, fuck world peace, fuck you and we love Donald Trump!!""

Basically.",cdee633eedd289c38cc882eb83ac436e1508a3f9,True,False,,,,,0,1647982325,,0,{},i1pl2mc,False,t3_tk57tb,False,True,t1_i1p9l26,/r/UkraineConflict/comments/tk57tb/members_of_russian_policital_party_ldpr_announced/i1pl2mc/,1647982337,1,True,True,False,UkraineConflict,t5_30oyx,r/UkraineConflict,public,,0,[],,1647953525.0,
[],False,,Parapolikala,,,[],,,,text,t2_jljku,False,False,No one seems to have posted this long and very detailed analysis from just before the present escalation.,c24f6d7db353c74a43ca7c989445614811bee18e,True,False,,,,,0,1647982285,,0,{},i1pkywt,True,t3_tkcsn2,False,True,t3_tkcsn2,/r/UkraineConflict/comments/tkcsn2/moscows_compellence_strategy_foreign_policy/i1pkywt/,1647982299,1,True,True,False,UkraineConflict,t5_30oyx,r/UkraineConflict,public,,0,[],,1647953485.0,
[],False,,The_Texican,,,[],,,,text,t2_3zqya,False,False,"There’s a large number of hateful and ignorant people in the US. 

They are easily manipulated, as evidenced by their behavior.",8aa8f2376b69289707aaf2bfe0716bc68089f57a,True,False,,,,,0,1647982196,,0,{},i1pkqqb,False,t3_tk57tb,False,True,t1_i1p9l26,/r/UkraineConflict/comments/tk57tb/members_of_russian_policital_party_ldpr_announced/i1pkqqb/,1647982207,1,True,True,False,UkraineConflict,t5_30oyx,r/UkraineConflict,public,,0,[],,1647953396.0,
[],False,,gkarq,,,[],,,,text,t2_62el3dhz,False,False,"Your average Russian will tell you they have nothing to do with this, that they are killing nazis and actually doing a good thing. What a fucking bunch of debils.",ce9af6cc699a26cb5976bd8cba48628c66bb6977,True,False,,,,,0,1647982147,,0,{},i1pkm3h,False,t3_tkazab,False,True,t3_tkazab,/r/UkraineConflict/comments/tkazab/well_russians_love_history_a_lot_so_maybe/i1pkm3h/,1647982161,1,True,True,False,UkraineConflict,t5_30oyx,r/UkraineConflict,public,,0,[],,1647953347.0,
[],False,,ninjabean,,,[],,,,text,t2_6meu5,False,False,This is awesome. You can FEEL the patriotism just by watching the video,82d3a3870e27c9c7fa4be39cec19c5163e005d51,True,False,,,,,0,1647982010,,0,{},i1pk992,False,t3_tk8wf9,False,True,t3_tk8wf9,/r/UkraineConflict/comments/tk8wf9/musicians_are_inspirating_people_to_build/i1pk992/,1647982023,1,True,True,False,UkraineConflict,t5_30oyx,r/UkraineConflict,public,,0,[],,1647953210.0,
[],False,,JJslo,#a06324,,[],afa65fb4-a101-11ec-9a63-02a4aa3dad09,Kremlin Propagandist ,light,text,t2_299g2zkt,False,False,"Please share this well documented articles, and please do reverse image source on those images, if anything comes as older than feb 2022 it's propaganda.",91cbb002f54184e65e582789e42b5d3f97376123,True,False,,,,,0,1647981981,,0,{},i1pk6jd,True,t3_tk373m,False,True,t1_i1pjjwz,/r/UkraineConflict/comments/tk373m/its_a_child_ffs_lvov_volkssturm/i1pk6jd/,1647981992,1,True,True,False,UkraineConflict,t5_30oyx,r/UkraineConflict,public,,0,[],,1647953181.0,
[],False,,Successful_Swing_465,,,[],,,,text,t2_4hhrkvvg,False,False,Depends on who you're asking...,152542b49992e4b5fdcba77edbb127f34c62941e,True,False,,,,,0,1647981908,,0,{},i1pjzs2,False,t3_tkbscu,False,True,t3_tkbscu,/r/UkraineConflict/comments/tkbscu/is_this_true/i1pjzs2/,1647981925,1,True,True,False,UkraineConflict,t5_30oyx,r/UkraineConflict,public,,0,[],,1647953108.0,
[],False,,Smithy6482,,,[],,,,text,t2_wd79u,False,False,"It's also better to be conservative vs overly optimistic. For example, see Putin's invasion timeline.",4406f8f36b1e8073c94ad2f469dfc3037944017b,True,False,,,,,0,1647981828,,0,{},i1pjsb2,False,t3_tk37c0,False,True,t1_i1ouccu,/r/UkraineConflict/comments/tk37c0/why_cant_the_west_admit_that_ukraine_is_winning/i1pjsb2/,1647981841,1,True,True,False,UkraineConflict,t5_30oyx,r/UkraineConflict,public,,0,[],,1647953028.0,
[],False,,Borderline_Nevrous,,,[],,,,text,t2_k3souphk,False,False,LOVE the Ukrainian fog colors on their logo.,992d65db1916eec9655c81f8fe24a1cffe64357d,True,False,,,,,0,1647981792,,0,{},i1pjp1m,False,t3_tk5dac,False,True,t3_tk5dac,/r/UkraineConflict/comments/tk5dac/russia_wants_to_launch_its_ikea_counterpart_they/i1pjp1m/,1647981810,1,True,True,False,UkraineConflict,t5_30oyx,r/UkraineConflict,public,,0,[],,1647952992.0,
[],False,,Gellion_Kraus,,,[],,,,text,t2_8c004wnc,False,False,"You mean the butterfly mines well documented and covered by many sources and independent journalists as far back as the Afghanistan invasion in the 80's? Sure do bud. 👍

Putin is a dead man on borrowed time and Russia will be far better off without him. The Russians don't want this shit either. Go ahead, try to justify the invasion, justify the meaningless deaths of thousands for one senile old fucks fevered dreams of reviving something long dead for good reason.",a214241300df1c0254d429ec7ea4e32dfa92f7b7,True,False,,,,,0,1647981778,,0,{},i1pjnrf,False,t3_tk373m,False,True,t3_tk373m,/r/UkraineConflict/comments/tk373m/its_a_child_ffs_lvov_volkssturm/i1pjnrf/,1647981795,1,True,True,False,UkraineConflict,t5_30oyx,r/UkraineConflict,public,,0,[],,1647952978.0,
[],False,,shadyridge,,,[],,,,text,t2_5r9g45fy,False,False,So obvious …Russians are pumping for Chinese bin return for economic support and weapons….so obvious and transparent,0cc2d7b1ec6d681a0c6b10165a6af71bc0813a33,True,False,,,,,0,1647981769,,0,{},i1pjmwc,False,t3_tk57tb,False,True,t3_tk57tb,/r/UkraineConflict/comments/tk57tb/members_of_russian_policital_party_ldpr_announced/i1pjmwc/,1647981787,1,True,True,False,UkraineConflict,t5_30oyx,r/UkraineConflict,public,,0,[],,1647952969.0,
[],False,,Gellion_Kraus,,,[],,,,text,t2_8c004wnc,False,False,"You mean the butterfly mines well documented and covered by many sources and independent journalists as far back as the Afghanistan invasion in the 80's? Sure do bud. 👍

Putin is a dead man on borrowed time and Russia will be far better off without him. The Russians don't want this shit either. Go ahead, try to justify the invasion, justify the meaningless deaths of thousands for one senile old fucks fevered dreams of reviving something long dead for good reason.",a214241300df1c0254d429ec7ea4e32dfa92f7b7,True,False,,,,,0,1647981737,,0,{},i1pjjwz,False,t3_tk373m,False,True,t3_tk373m,/r/UkraineConflict/comments/tk373m/its_a_child_ffs_lvov_volkssturm/i1pjjwz/,1647981751,1,True,True,False,UkraineConflict,t5_30oyx,r/UkraineConflict,public,,0,[],,1647952937.0,
[],False,,shadyridge,,,[],,,,text,t2_5r9g45fy,False,False,Excuse the choice of words but this is bat shit crazy ….,e26d0d9ff651fe8c610b009117d6c233d4a54afc,True,False,,,,,0,1647981666,,0,{},i1pjdfy,False,t3_tk57tb,False,True,t3_tk57tb,/r/UkraineConflict/comments/tk57tb/members_of_russian_policital_party_ldpr_announced/i1pjdfy/,1647981682,1,True,True,False,UkraineConflict,t5_30oyx,r/UkraineConflict,public,,0,[],,1647952866.0,
[],False,,lobsterest,,,[],,,,text,t2_28higasj,False,False,imagine how braindead you have to be to believe this bs. smh,a0083b9b5c9aef73cd57ab5dd49b7491dbd5fa46,True,False,,,,,0,1647981434,,0,{},i1pisms,False,t3_tk57tb,False,True,t3_tk57tb,/r/UkraineConflict/comments/tk57tb/members_of_russian_policital_party_ldpr_announced/i1pisms/,1647981449,1,True,True,False,UkraineConflict,t5_30oyx,r/UkraineConflict,public,,0,[],,1647952634.0,
[],False,,Nigwardzo,,,[],,,,text,t2_5wnaqb8m,False,False,Dont mean to be a smartass but its lebensraum,5ab86d0456d7f434ad1f7e3c027665ed0f2bfc4c,True,False,,,,,0,1647981330,,0,{},i1pij65,False,t3_tk7122,False,True,t1_i1patco,/r/UkraineConflict/comments/tk7122/right_but_of_course_putin_will_keep_going_moldova/i1pij65/,1647981344,1,True,True,False,UkraineConflict,t5_30oyx,r/UkraineConflict,public,,0,[],,1647952530.0,
[],False,,StevenMaurer,,,[],,,,text,t2_gsqva,False,False,Why are people downvoting this? It's relevant news and President Biden is saying the truth.,bd768a4a5a827bae77969b872320a1351f968203,True,False,,,,,0,1647981328,,0,{},i1piiyi,False,t3_tk24yo,False,True,t3_tk24yo,/r/UkraineConflict/comments/tk24yo/biden_says_india_somewhat_shaky_on_russia/i1piiyi/,1647981345,1,True,True,False,UkraineConflict,t5_30oyx,r/UkraineConflict,public,,0,[],,1647952528.0,
[],False,,iluvbosco0909,,,[],,,,text,t2_kvo1etpp,False,False,this made me so upset i started crying. fuck russia and putin..i'm upset this war/genocide is still going on,a7e34f18177bbef74cc8e5e191ef421aa399812a,True,False,,,,,0,1647981251,,0,{},i1pic1x,False,t3_tk5r9q,False,True,t3_tk5r9q,/r/UkraineConflict/comments/tk5r9q/in_gostomel_russian_troops_destroyed_the/i1pic1x/,1647981268,1,True,True,False,UkraineConflict,t5_30oyx,r/UkraineConflict,public,,0,[],,1647952451.0,
[],False,,StevenMaurer,,,[],,,,text,t2_gsqva,False,False,"Just because airbases are nearby doesn't keep Russian aircraft from being shot down, thankfully.",170f25989bbbc4686411b362b3acbbfe04fe26ae,True,False,,,,,0,1647981221,,0,{},i1pi98u,False,t3_tjodgc,False,True,t3_tjodgc,/r/UkraineConflict/comments/tjodgc/russia_uses_about_40_airfields_in_russia_belarus/i1pi98u/,1647981238,1,True,True,False,UkraineConflict,t5_30oyx,r/UkraineConflict,public,,0,[],,1647952421.0,
[],False,,mrlouiev,,,[],,,,text,t2_p85zb,False,False,It’s because the majority of White American Republicans are racist and the fear of their daughter marrying a black guy takes priority over the preservation of American Democracy.,7d18dfb7756b0b458fef5d3322365cb3ad26e979,True,False,,,,,0,1647981166,,0,{},i1pi453,False,t3_tk57tb,False,True,t1_i1p9l26,/r/UkraineConflict/comments/tk57tb/members_of_russian_policital_party_ldpr_announced/i1pi453/,1647981178,1,True,True,False,UkraineConflict,t5_30oyx,r/UkraineConflict,public,,0,[],,1647952366.0,
[],False,,SnowflowerSixtyFour,,,[],,,,text,t2_x4vrc,False,False,"Believable.  More civilians in the city means less supplies per capita in the city.  If your plan is to starve a city into capitulation, you want as many mouths to feed in that city as possible.",f416a33a9b97c1bd78a705a1836c770a60284823,True,False,,,,,0,1647980967,,0,{},i1phm49,False,t3_tkbscu,False,True,t3_tkbscu,/r/UkraineConflict/comments/tkbscu/is_this_true/i1phm49/,1647980982,1,True,True,False,UkraineConflict,t5_30oyx,r/UkraineConflict,public,,0,[],,1647952167.0,
[],False,,SnowflowerSixtyFour,,,[],,,,text,t2_x4vrc,False,False,I like this.  I think for a while now the world of international politics has been operating in the principle that ideas are somewhat irrelevant.  But that is obviously not true.,da6b9c0af902aaf6807faf3e0552cd31058b5078,True,False,,,,,0,1647980596,,0,{},i1pgnzx,False,t3_tjwe1i,False,True,t3_tjwe1i,/r/UkraineConflict/comments/tjwe1i/the_intellectual_catastrophe_of_vladimir_putin/i1pgnzx/,1647980615,1,True,True,False,UkraineConflict,t5_30oyx,r/UkraineConflict,public,,0,[],,1647951796.0,
[],False,,pastebluepaste,,,[],,,,text,t2_zlcdm,False,False,"It’s unlikely to be grenades, the city was bombed from the air and shelled by artillery. I’ve seen the way it disperses in the air before it lands on videos of its use in Israel.",b784f65123af69703833b8d271f8afca6432b7b2,True,False,,,,,0,1647980472,,0,{},i1pgchc,True,t3_tjw0xv,False,True,t1_i1n9kty,/r/UkraineConflict/comments/tjw0xv/deputy_head_of_the_patrol_police_of_kiev_oleksiy/i1pgchc/,1647980485,1,True,True,False,UkraineConflict,t5_30oyx,r/UkraineConflict,public,,0,[],,1647951672.0,
[],False,,akyriacou92,,,[],,,,text,t2_awa1io0,False,False,"I doubt Putin will even conquer Ukraine. That being said, Moldova would be the next target, aa there’s already Russian forces there. Then Georgia and the Baltics.",613fa020511c2e7585fef946661c6dcd63e2bfd1,True,False,,,,,0,1647980226,,0,{},i1pfpo0,False,t3_tk7122,False,True,t3_tk7122,/r/UkraineConflict/comments/tk7122/right_but_of_course_putin_will_keep_going_moldova/i1pfpo0/,1647980240,1,True,True,False,UkraineConflict,t5_30oyx,r/UkraineConflict,public,,0,[],,1647951426.0,
[],False,,jeremythelee,,,[],,,,text,t2_4ecek,False,False,Bards IRL.,baef80e2bcb69acccda424bb2b01f642ca051ccf,True,False,,,,,0,1647980194,,0,{},i1pfmn2,False,t3_tk8wf9,False,True,t3_tk8wf9,/r/UkraineConflict/comments/tk8wf9/musicians_are_inspirating_people_to_build/i1pfmn2/,1647980210,1,True,True,False,UkraineConflict,t5_30oyx,r/UkraineConflict,public,,0,[],,1647951394.0,
[],False,,flmao,,,[],,,,text,t2_p2qvc0t,False,False,"at4 is not an anti tank weapon, at4=84mm and designed to take out lighter armored vehicles.
of course you can use it to shoot the tracks or external fuel barrels the russians carry.",5de625fa41f2bd84282bc352d88c2698b721edf3,True,False,,,,,0,1647980136,,0,{},i1pfh7h,False,t3_tkar8w,False,True,t3_tkar8w,/r/UkraineConflict/comments/tkar8w/at4_americas_antitank_weapon_used_to_destroy/i1pfh7h/,1647980151,1,True,True,False,UkraineConflict,t5_30oyx,r/UkraineConflict,public,,0,[],,1647951336.0,
[],False,,JJslo,#a06324,,[],afa65fb4-a101-11ec-9a63-02a4aa3dad09,Kremlin Propagandist ,light,text,t2_299g2zkt,False,False,"And yet you believe russians just dropped butterfly mines to kill fleeing civilians from Mariupol, with no proof it was russians whatsoever, here you think this is just propaganda and all evidence is on the picture.
I'm sure you can justify scar leaving chemical on their face somehow, I would like to hear it.

And then you wont believe thousands of Mariupol civilians who say the national guards wouldn't let them leave the city. 
Even the fact that Mariupol is the center of Azov battalion and the same city is the only city which has problems with evacuation corridors. Literally most who manage to get out of the city did so by bypassing Ukraine side of the corridor. Propaganda again right?",221664695c6d06650beb2fde847d880fdf0e5097,True,False,,,,,0,1647980078,,0,{},i1pfbv3,True,t3_tk373m,False,True,t1_i1pdcij,/r/UkraineConflict/comments/tk373m/its_a_child_ffs_lvov_volkssturm/i1pfbv3/,1647980091,1,True,True,False,UkraineConflict,t5_30oyx,r/UkraineConflict,public,,0,[],,1647951278.0,
[],False,,Rastaman-coo,,,[],,,,text,t2_64c1fcsg,False,False,Normal yes but you would be suprised by the ones that do. Not just Russians.  But Chinese. Indians. Africans.  Middle Eastern. Lots of people who hate the west.  I've seen way to many anti ukraine posts and one thing I noticed is they all hate the west.,4359805d058dc87b278b085239385b4b529f6807,True,False,,,,,0,1647980027,,0,{},i1pf76m,False,t3_tk57tb,False,True,t1_i1ooyg1,/r/UkraineConflict/comments/tk57tb/members_of_russian_policital_party_ldpr_announced/i1pf76m/,1647980039,1,True,True,False,UkraineConflict,t5_30oyx,r/UkraineConflict,public,,0,[],,1647951227.0,
[],False,,AlexCoventry,,,[],,,,text,t2_6yfwg,False,False,"It might be reasonable to say that Ukraine is ""winning"", but it would be the height of folly to claim they've won. The RF has a lot more resources, and correspondingly more room for mistakes. They still have the potential to adapt, and they still have enough forces to potentially crush Ukraine, if they adapt effectively. And their gains in the South and East, at least, are starting to look pretty durable.

Also, I don't know where the idea that the West can't admit that Ukraine is ""winning"" is coming from. I pretty much only hear Ukraine-positive news.",4a9898baa05e44d3861d3a5dc920c938e306700c,True,False,,,,,0,1647979977,,0,{},i1pf2lm,False,t3_tk37c0,False,True,t1_i1nrk37,/r/UkraineConflict/comments/tk37c0/why_cant_the_west_admit_that_ukraine_is_winning/i1pf2lm/,1647979994,1,True,True,False,UkraineConflict,t5_30oyx,r/UkraineConflict,public,,0,[],,1647951177.0,
[],False,,Rastaman-coo,,,[],,,,text,t2_64c1fcsg,False,False,It's because most American politicians are weak and putin makes himself look tough.  The people who see putin in that light are the ones you speak of.,9721aa724dab432cc3035fd5457ec01884573826,True,False,,,,,0,1647979869,,0,{},i1pesqd,False,t3_tk57tb,False,True,t1_i1p9l26,/r/UkraineConflict/comments/tk57tb/members_of_russian_policital_party_ldpr_announced/i1pesqd/,1647979880,1,True,True,False,UkraineConflict,t5_30oyx,r/UkraineConflict,public,,0,[],,1647951069.0,
[],False,,rentest,,,[],,,,text,t2_jslfhf37,False,False,"they dont have ammunition at the front 

logistics is broken 

tank factory closed because spare parts ended",a7db2cc251fa8c01fc4a524a8544caf6f894e486,True,False,,,,,0,1647979767,,0,{},i1pejbs,True,t3_tk37c0,False,True,t1_i1pattu,/r/UkraineConflict/comments/tk37c0/why_cant_the_west_admit_that_ukraine_is_winning/i1pejbs/,1647979780,1,True,True,False,UkraineConflict,t5_30oyx,r/UkraineConflict,public,,0,[],,1647950967.0,
[],False,,Tiger-B,,,[],,,,text,t2_zd70a,False,False,"Possible. The last time civilians tried to flee, Orcs shot at them. It is saver inside the city.",68411168bbb629f14447665f8babb88f2f5b92e1,True,False,,,,,0,1647979733,,0,{},i1peg5w,False,t3_tkbscu,False,True,t3_tkbscu,/r/UkraineConflict/comments/tkbscu/is_this_true/i1peg5w/,1647979749,1,True,True,False,UkraineConflict,t5_30oyx,r/UkraineConflict,public,,0,[],,1647950933.0,
[],False,,iwonss,,,[],,,,text,t2_8wnerev7,False,False,"Well said, Soviet prosecutors",b1ddc9f836a39b0cf57d294d5b804c07a811913c,True,False,,,,,0,1647979701,,0,{},i1ped6k,False,t3_tkazab,False,True,t3_tkazab,/r/UkraineConflict/comments/tkazab/well_russians_love_history_a_lot_so_maybe/i1ped6k/,1647979711,1,True,True,False,UkraineConflict,t5_30oyx,r/UkraineConflict,public,,0,[],,1647950901.0,
[],False,,rentest,,,[],,,,text,t2_jslfhf37,False,False,"some countries will set a visa ban to this guy I assume 

  
he wont be playing in some tournaments because of revoked visa",d69eae0ef5fddaf1bd2814ed49f2af79ba18de7f,True,False,,,,,0,1647979660,,0,{},i1pe9df,False,t3_tjyqxc,False,True,t1_i1n4ncj,/r/UkraineConflict/comments/tjyqxc/russian_grandmaster_who_joked_about_the_war_on/i1pe9df/,1647979675,1,True,True,False,UkraineConflict,t5_30oyx,r/UkraineConflict,public,,0,[],,1647950860.0,
[],False,,GetPhkt,,,[],,,,text,t2_igdju,False,False,"&gt;Enemies of the democrats is republicans friend, like always? I dont get it.

Nailed it. Plus much of what used to be conservativism in the states has shifted into pure pro-Trumpism rather than having any semblance of a philosophy, and Trump is an admirer of Putin",057414afb6e937d9ca0bb049550b8d4fee60f3d7,True,False,,,,,0,1647979539,,0,{},i1pdxz6,False,t3_tk57tb,False,True,t1_i1p9l26,/r/UkraineConflict/comments/tk57tb/members_of_russian_policital_party_ldpr_announced/i1pdxz6/,1647979555,1,True,True,False,UkraineConflict,t5_30oyx,r/UkraineConflict,public,,0,[],,1647950739.0,
[],False,,AlexCoventry,,,[],,,,text,t2_6yfwg,False,False,Is the infrared footage for those attacks available? It would make the point more clearly.,1500892e52b54974182c63618a02d782946891f1,True,False,,,,,0,1647979434,,0,{},i1pdo88,False,t3_tk0t73,False,True,t1_i1nlltu,/r/UkraineConflict/comments/tk0t73/sheltering_under_a_tree_is_just_about_the_worst/i1pdo88/,1647979447,1,True,True,False,UkraineConflict,t5_30oyx,r/UkraineConflict,public,,0,[],,1647950634.0,
[],False,,JJslo,#a06324,,[],afa65fb4-a101-11ec-9a63-02a4aa3dad09,Kremlin Propagandist ,light,text,t2_299g2zkt,False,False,That chemical on the skin is definitely taking it too far.,69effdb7fbf29e63444e550bf305d4e5f082e755,True,False,,,,,0,1647979355,,0,{},i1pdgn3,True,t3_tk373m,False,True,t1_i1o0vci,/r/UkraineConflict/comments/tk373m/its_a_child_ffs_lvov_volkssturm/i1pdgn3/,1647979371,1,True,True,False,UkraineConflict,t5_30oyx,r/UkraineConflict,public,,0,[],,1647950555.0,
[],False,,Gellion_Kraus,,,[],,,,text,t2_8c004wnc,False,False,Disgusting propaganda.,7ac0c14e2b444e504d9ae34986073bf0190295d3,True,False,,,,,0,1647979312,,0,{},i1pdcij,False,t3_tk373m,False,True,t3_tk373m,/r/UkraineConflict/comments/tk373m/its_a_child_ffs_lvov_volkssturm/i1pdcij/,1647979325,1,True,True,False,UkraineConflict,t5_30oyx,r/UkraineConflict,public,,0,[],,1647950512.0,
