all_awardings,archived,associated_award,author,author_flair_background_color,author_flair_css_class,author_flair_richtext,author_flair_template_id,author_flair_text,author_flair_text_color,author_flair_type,author_fullname,author_patreon_flair,author_premium,body,body_sha1,can_gild,collapsed,collapsed_because_crowd_control,collapsed_reason,collapsed_reason_code,comment_type,controversiality,created_utc,distinguished,gilded,gildings,id,is_submitter,link_id,locked,no_follow,parent_id,permalink,retrieved_utc,score,score_hidden,send_replies,stickied,subreddit,subreddit_id,subreddit_name_prefixed,subreddit_type,top_awarded_type,total_awards_received,treatment_tags,unrepliable_reason,created,author_cakeday
[],False,,vaidisl,,,[],,,,text,t2_896f1y8c,False,False,Same youtuber 'Historic\_ly' from where he took this video.,2e9abdf92276f71cd996b55459f7f8daaa1ea176,True,False,,,,,0,1648051070,,0,{},i1t5czj,True,t3_tkx4zk,False,True,t1_i1t4me1,/r/UkraineConflict/comments/tkx4zk/is_youtube_numuves_reliable_resource_or_not/i1t5czj/,1648051084,1,True,True,False,UkraineConflict,t5_30oyx,r/UkraineConflict,public,,0,[],,1648022270.0,
[],False,,Ok_Science4916,,,[],,,,text,t2_el05iasx,False,False,Where can i get something like this?,d5f80937bfa2f59516d637128e93160d559608de,True,False,,,,,0,1648050934,,0,{},i1t509n,False,t3_tkwkhw,False,True,t3_tkwkhw,/r/UkraineConflict/comments/tkwkhw/supporting_ukraine_in_kentucky_usa/i1t509n/,1648050947,1,True,True,False,UkraineConflict,t5_30oyx,r/UkraineConflict,public,,0,[],,1648022134.0,
[],False,,vaidisl,,,[],,,,text,t2_896f1y8c,False,False,"Just saw this video where it says Ukrainians attacking their own people. So just want to find out if this is true, and if not can somebody help me disapprove to what is said in a video ?",6bb640c43d8dbd56ac966f0270120f56a76c2ea0,True,False,,,,,0,1648050789,,0,{},i1t4me1,True,t3_tkx4zk,False,True,t3_tkx4zk,/r/UkraineConflict/comments/tkx4zk/is_youtube_numuves_reliable_resource_or_not/i1t4me1/,1648050801,1,True,True,False,UkraineConflict,t5_30oyx,r/UkraineConflict,public,,0,[],,1648021989.0,
[],False,,ElNeekster,,,[],,,,text,t2_8munxtog,False,False,Those falling ordinance are way too slow to be artillery or rockets,2421d388670d90a25b96614069b113b4b6998a43,True,False,,,,,0,1648050661,,0,{},i1t49zr,False,t3_tkv05o,False,True,t3_tkv05o,/r/UkraineConflict/comments/tkv05o/ukrainian_bayraktar_tb2_drones_directing/i1t49zr/,1648050673,1,True,True,False,UkraineConflict,t5_30oyx,r/UkraineConflict,public,,0,[],,1648021861.0,
[],False,,wudntulik2no,,,[],,,,text,t2_dbdevlqd,False,False,"They should join Mastodon. Because it's decentralized, it can't be blocked by governments",2db17bd6d9c3f2c091e45ce4702a0fc13da7174b,True,False,,,,,0,1648050305,,0,{},i1t3bz1,False,t3_tkvyp9,False,True,t3_tkvyp9,/r/UkraineConflict/comments/tkvyp9/russian_bloggers_and_businesses_scramble_after/i1t3bz1/,1648050315,1,True,True,False,UkraineConflict,t5_30oyx,r/UkraineConflict,public,,0,[],,1648021505.0,
[],False,,Western_Beat_6805,,,[],,,,text,t2_ea52j9h4,False,False,Where did you find that? Is it streaming? Or cable,c22b0836ac2ffd0f5540e567e4bd484dc41fdeda,True,False,,,,,0,1648050154,,0,{},i1t2xq7,False,t3_tkazab,False,True,t1_i1sij7u,/r/UkraineConflict/comments/tkazab/well_russians_love_history_a_lot_so_maybe/i1t2xq7/,1648050169,1,True,True,False,UkraineConflict,t5_30oyx,r/UkraineConflict,public,,0,[],,1648021354.0,
[],False,,deathtoputin31,,,[],,,,text,t2_kmmm8us5,False,False,you know what is stupid? being one of putin's slaves... this guy is the only one with a brain in moscow,2b31cd79273452225a5836a19b2ca37674b7bb58,True,False,,,,,0,1648050049,,0,{},i1t2nw6,False,t3_tks6cw,False,True,t1_i1sd1is,/r/UkraineConflict/comments/tks6cw/in_the_center_of_moscow_an_unknown_person_threw_a/i1t2nw6/,1648050062,1,True,True,False,UkraineConflict,t5_30oyx,r/UkraineConflict,public,,0,[],,1648021249.0,
[],False,,deathtoputin31,,,[],,,,text,t2_kmmm8us5,False,False,now if only a thousand more were willing to do the same at the same time,118a06098c74ba1ffdfa9a65b5d31202313da320,True,False,,,,,0,1648050016,,0,{},i1t2ks5,False,t3_tks6cw,False,True,t3_tks6cw,/r/UkraineConflict/comments/tks6cw/in_the_center_of_moscow_an_unknown_person_threw_a/i1t2ks5/,1648050031,1,True,True,False,UkraineConflict,t5_30oyx,r/UkraineConflict,public,,0,[],,1648021216.0,
[],False,,NewDistrict6824,,,[],,,,text,t2_kd2n1evi,False,False,"I only gave this bilge an uptick because it reinforces the notion that Puint's talking heads are idiots. In this case Idiot's in suits, as if that makes them any more believable... anyway, here's a misquote from the Bard....

***They are just Putin's poor players***  
***That strut and fret their hour upon the stage***  
***And then are heard no more: Their's is a tale***  
***Told by idiots, full of sound and fury,***  
***Signifying nothing.***",71a9560aee7a033a3fabbdc97ec99dbf05976f2b,True,False,,,,,0,1648049910,,0,{},i1t2ayb,False,t3_tk57tb,False,True,t3_tk57tb,/r/UkraineConflict/comments/tk57tb/members_of_russian_policital_party_ldpr_announced/i1t2ayb/,1648049924,1,True,True,False,UkraineConflict,t5_30oyx,r/UkraineConflict,public,,0,[],,1648021110.0,
[],False,,Virtual_Cod_1840,,,[],,,,text,t2_8duytmgl,False,False,"Wow, Putin’s ex is really passed.",47d123e1dbc6fbd7d0b87380e15e31cc3d17970a,True,False,,,,,0,1648049559,,0,{},i1t1eb3,False,t3_tks6cw,False,True,t3_tks6cw,/r/UkraineConflict/comments/tks6cw/in_the_center_of_moscow_an_unknown_person_threw_a/i1t1eb3/,1648049579,1,True,True,False,UkraineConflict,t5_30oyx,r/UkraineConflict,public,,0,[],,1648020759.0,
[],False,,infodawg,,,[],,,,text,t2_1ryjw,False,False,Booyakasha!,e5cbed16b08a2da006b33758d7c12bc8a341d134,True,False,,,,,0,1648049540,,0,{},i1t1cj1,False,t3_tknghy,False,True,t3_tknghy,/r/UkraineConflict/comments/tknghy/putin_is_at_risk_of_poisoning_thousands_of/i1t1cj1/,1648049552,1,True,True,False,UkraineConflict,t5_30oyx,r/UkraineConflict,public,,0,[],,1648020740.0,
[],False,,mattjones73,,,[],,,,text,t2_5un2pu48,False,False,He only needs to look in the mirror..,1114de495cb5a3d10bba19c1b137a40f07c353ce,True,False,,,,,0,1648049480,,0,{},i1t16ty,False,t3_tkruh7,False,True,t3_tkruh7,/r/UkraineConflict/comments/tkruh7/several_of_vladimir_putins_inner_circle_are_said/i1t16ty/,1648049497,1,True,True,False,UkraineConflict,t5_30oyx,r/UkraineConflict,public,,0,[],,1648020680.0,
[],False,,Number4extraDip,,,[],,,,text,t2_4p7lra,False,False,"We heard that Ukraine has sent an interstellar email to Thanos and asked him to snap out Russians, so we will continue bombing as usual, until we think of something funnier to say",cf9a5dcb0280b1f113ef0014ce2893dc9fedda84,True,False,,,,,0,1648049369,,0,{},i1t0wde,False,t3_tk57tb,False,True,t3_tk57tb,/r/UkraineConflict/comments/tk57tb/members_of_russian_policital_party_ldpr_announced/i1t0wde/,1648049382,1,True,True,False,UkraineConflict,t5_30oyx,r/UkraineConflict,public,,0,[],,1648020569.0,
[],False,,infodawg,,,[],,,,text,t2_1ryjw,False,False,the impact of working for a tyrant. fun.,d64d3a505a296691a6602b3a652afb566d77a91b,True,False,,,,,0,1648049364,,0,{},i1t0vx8,False,t3_tkruh7,False,True,t3_tkruh7,/r/UkraineConflict/comments/tkruh7/several_of_vladimir_putins_inner_circle_are_said/i1t0vx8/,1648049382,1,True,True,False,UkraineConflict,t5_30oyx,r/UkraineConflict,public,,0,[],,1648020564.0,
[],False,,Mercury0001,,,[],,,,text,t2_hjgllsks,False,False,"""Incandescent means candescent? What a country!""",bcbc2f197c964070bd86be495fa043ce3fd9ff6a,True,False,,,,,0,1648049244,,0,{},i1t0kh6,False,t3_tkruh7,False,True,t1_i1sd7fo,/r/UkraineConflict/comments/tkruh7/several_of_vladimir_putins_inner_circle_are_said/i1t0kh6/,1648049263,1,True,True,False,UkraineConflict,t5_30oyx,r/UkraineConflict,public,,0,[],,1648020444.0,
[],False,,Number4extraDip,,,[],,,,text,t2_4p7lra,False,False,"But he has the coolest ""pope hat"" of them all 😩",df457002c29057d0f7296c995b9ebd5eb46bf3a1,True,False,,,,,0,1648048960,,0,{},i1sztgj,False,t3_tkqqly,False,True,t1_i1s0o0l,/r/UkraineConflict/comments/tkqqly/russian_orthodox_church_primate_cyril_accomplices/i1sztgj/,1648048977,1,True,True,False,UkraineConflict,t5_30oyx,r/UkraineConflict,public,,0,[],,1648020160.0,
[],False,,NewDistrict6824,,,[],,,,text,t2_kd2n1evi,False,False,"but please can it be in stages, where Putin

1.  Has to tell the truth - this should last for at least a week so that he can get all his atrocities accounted for;
2. Loses control of his bowels and is constantly doing massive and smelly farts, is doubly incontinent... remedy - a nappy changed every 30 minutes;
3. Produces large amounts of green mucus whilst speaking, with sticky green snot trails constantly running into his mouth;
4. Develops a version of Tourette's Syndrome, an extreme version in which he involuntarily gives Nazi salutes and clicks his heels and shouts ""Clop"";
5. Starts to self harm with his preference being to shove broomsticks up his anus;
6. Constantly stubs his toes and fingers;
7. Cannot stop picking his boggies and eating them;
8. Cannot stop the urge to masturbate in public;
9. Develops a Monty Pythonesque silly walk syndrome and eventually walks off his balcony to land on his head while his backbone goes through his brain.

Hopefully all the above being captured live on Russian TV and constantly on a loop for a month or so until Russians realise what a twat Putin is/was.",451540bcff80e4ef7c2839f8e8990ab082ca154d,True,False,,,,,0,1648048769,,0,{},i1szb8c,False,t3_tknghy,False,True,t1_i1rjuwj,/r/UkraineConflict/comments/tknghy/putin_is_at_risk_of_poisoning_thousands_of/i1szb8c/,1648048782,1,True,True,False,UkraineConflict,t5_30oyx,r/UkraineConflict,public,,0,[],,1648019969.0,
[],False,,Number4extraDip,,,[],,,,text,t2_4p7lra,False,False,"Oh yes, I too heard from credible sources that he has that common ""bullet allergy""",3e458dfe8b9e983f1b72a165a11d222725507737,True,False,,,,,0,1648048728,,0,{},i1sz7ay,False,t3_tknghy,False,True,t1_i1rli0f,/r/UkraineConflict/comments/tknghy/putin_is_at_risk_of_poisoning_thousands_of/i1sz7ay/,1648048739,1,True,True,False,UkraineConflict,t5_30oyx,r/UkraineConflict,public,,0,[],,1648019928.0,
[],False,,colovianfurhelm,,,[],,,,text,t2_n6cmg,False,False,"Must also be Navalny supporter, da",ee5324f421fd322faf851f7d149fecd2feba689a,True,False,,,,,0,1648048565,,0,{},i1sys0b,False,t3_tks6cw,False,True,t1_i1ssatd,/r/UkraineConflict/comments/tks6cw/in_the_center_of_moscow_an_unknown_person_threw_a/i1sys0b/,1648048579,1,True,True,False,UkraineConflict,t5_30oyx,r/UkraineConflict,public,,0,[],,1648019765.0,
[],False,,deathtoputin31,,,[],,,,text,t2_kmmm8us5,False,False,put polonium in his underwear,fd27e42c7412a2f330668136f4b7a69dd80fbd0c,True,False,,,,,0,1648048203,,0,{},i1sxuu0,False,t3_tknghy,False,True,t3_tknghy,/r/UkraineConflict/comments/tknghy/putin_is_at_risk_of_poisoning_thousands_of/i1sxuu0/,1648048222,1,True,True,False,UkraineConflict,t5_30oyx,r/UkraineConflict,public,,0,[],,1648019403.0,
[],False,,Number4extraDip,,,[],,,,text,t2_4p7lra,False,False,"Oh, im sure he has a vagazzle of a hammer and sicle down there",56b62c90a241233d2d138596100d2a5e4df038d7,True,False,,,,,0,1648047847,,0,{},i1swyl9,False,t3_tkruh7,False,True,t1_i1suciw,/r/UkraineConflict/comments/tkruh7/several_of_vladimir_putins_inner_circle_are_said/i1swyl9/,1648047857,1,True,True,False,UkraineConflict,t5_30oyx,r/UkraineConflict,public,,0,[],,1648019047.0,
[],False,,AHoffmanPhotography,,,[],,,,text,t2_k419qjad,False,False,We already know it came from the Wuhan lab in Communist China. Just saving you some time.,24086833c8efb04dd820abd3a70ceeb2c4745a03,True,False,,,,,0,1648047816,,0,{},i1swvpo,False,t3_tk57tb,False,True,t3_tk57tb,/r/UkraineConflict/comments/tk57tb/members_of_russian_policital_party_ldpr_announced/i1swvpo/,1648047831,1,True,True,False,UkraineConflict,t5_30oyx,r/UkraineConflict,public,,0,[],,1648019016.0,
[],False,,Griffindoriangy,,,[],,,,text,t2_jxcc18oh,False,False,"Opposition in Russia is weak. Most russiams genuinely support Putin and disapprove of Navalny. 
In Jan. 2021, 39% had a negative attitude to the protests and 37% were indifferent toward protesters. This despite more than 1/4 Russians having watched the oppositions expose of Putins corruption according to polls. 
 Russia is also near the top of the countries when asked ""I support my government even if it's in the wrong"". Nationalism and militarism is deeply ingrained in culture. 

You can see this when comparing it to what is dubbed Europe last dictatorship Belarus where 500,000 protested in a country of less than 10 million. They needed 100k police and soldiers including sent from Russia to quell the protests.",bc72608cdf6613fc4502e3c8a3224d4f2cfb7e26,True,False,,,,,0,1648047739,,0,{},i1swot8,False,t3_tkazab,False,True,t1_i1rqc0x,/r/UkraineConflict/comments/tkazab/well_russians_love_history_a_lot_so_maybe/i1swot8/,1648047752,1,True,True,False,UkraineConflict,t5_30oyx,r/UkraineConflict,public,,0,[],,1648018939.0,
[],False,,loveforallhumanity,,,[],,,,text,t2_kwoep2tl,False,False,Someone needs to throw Putin off of a balcony.,6ca48fd850843223b04a7d0752f7f71df8bf2524,True,False,,,,,0,1648047661,,0,{},i1swhk3,False,t3_tkazab,False,True,t1_i1s0v19,/r/UkraineConflict/comments/tkazab/well_russians_love_history_a_lot_so_maybe/i1swhk3/,1648047677,1,True,True,False,UkraineConflict,t5_30oyx,r/UkraineConflict,public,,0,[],,1648018861.0,
[],False,,loveforallhumanity,,,[],,,,text,t2_kwoep2tl,False,False,Nah. US marked the casualties way lower. UN lower too. Ukraine is inflating casualties for propaganda. Nice 2nd grade pun though.,6b7aa5df7fb3c0a5e97909e049a5ecde0b7d079a,True,False,,,,,0,1648047631,,0,{},i1swepg,False,t3_tkq02k,False,True,t1_i1s3dtz,/r/UkraineConflict/comments/tkq02k/the_orcs_are_taking_a_beating_they_will_not_last/i1swepg/,1648047642,1,True,True,False,UkraineConflict,t5_30oyx,r/UkraineConflict,public,,0,[],,1648018831.0,
[],False,,Flushmush,,,[],,,,text,t2_izpdvcjz,False,False,Military plans are irrelevant if you underestimate the force you are going against and the armed forces you charge to complete those plans are incompetent,b21e32dd96cebce9945df89a7a1f1d7a0f8b9c8d,True,False,,,,,0,1648047507,,0,{},i1sw35d,False,t3_tkruh7,False,True,t3_tkruh7,/r/UkraineConflict/comments/tkruh7/several_of_vladimir_putins_inner_circle_are_said/i1sw35d/,1648047519,1,True,True,False,UkraineConflict,t5_30oyx,r/UkraineConflict,public,,0,[],,1648018707.0,
[],False,,CMaster_16,,,[],,,,text,t2_jr5f87tk,False,False,"Phobia - an extreme or irrational fear of or aversion to something

Aversion - a strong dislike or disinclination.

You are Russophobic.",54b883a67e4a64a1855b1c2215b8a7542dc6e4fc,True,False,,,,,0,1648047237,,0,{},i1svedt,False,t3_tkazab,False,True,t1_i1su9yb,/r/UkraineConflict/comments/tkazab/well_russians_love_history_a_lot_so_maybe/i1svedt/,1648047266,1,True,True,False,UkraineConflict,t5_30oyx,r/UkraineConflict,public,,0,[],,1648018437.0,
[],False,,Fufify,,,[],,,,text,t2_4hp2al57,False,False,"
The whole story is told in comic, sarcastic ways like South Park. Lots of masterpiece jokes that despises the war and president.


Masyanya (wife) comes home to find out someone is sleeping in their bedroom. Husband tell her he gave their Ukranian friend (Lokhmatiy - 'Hairy',, last name Lokhmatenko) Lots of Tequila so he won't find out that Russia attacked Ukraniane because he has family there. He says that Lokhmatiy ha shears condition and it will kill him. He also says that friend's family is ok and in Poland now.

Husband urges Masyanya not to tell Lokhmatiy anything. They removed him from Internet,  took his phone, no TV, won't let him go to work because of covid, tried to infect him with covid (which Masyanya was scolding her husband that he is stupid just like their czar-president), finally they put sticker on the thermometer and hid Lokhmatiy's glasses.

They go outside on the balcony to smoke (which Masyanya didn't do before, but there is another joke about the times they live in). Husband tells her that everything is really very bad, thousands are killed, war is raging, 'cleansing' from traitors is gonna start soon.

Masyanya tell her husband good bye and take care of their kids and goes to Moscow. There she sees lots of pro-war and glorifying of the president and Z. She comes to the president's place. Tells the quards that she wants to see the president, she has a present for him from all the humans.

Meanwhile Ukranian friend demands explanation and husband telling him truth. Lokhmatiy is devastated, shocked.  Husband builds him a hiding place, there is a comparison - like Anne Frank.

While sending kids to school and telling them not to tell they hide anyone (joke here) from 'not a real nation' the special forces raid their house. Someone told on them. The ringer on Ukranian friend's phone comes off ....

In Moscow - guards jokingly tell Masyanya they will go for a smoke break. Masyanya looking for the president.  There is a whole convo between them, jokes exchanged,  they are clever and a lot of Russian culture digging, like there is a dig at one movie song that president quotes - 'who helps people, wasting time, doing good one won't be famous'.... finally Masyanya tells him he has only one choice left - gives him Japanese sword.

She returnes home,  husband and Lokhmatiy meet her quietly, looking stunned.  They joke she must have no battery in her phone and missed everything. Husband tells her about the president. Masyanya pretends she has nothing to do with it ....


Lots of jokes in there that Russians understand and very accurate description of the situation as on local and government level.

Sorry for grammar and other mistakes. English is not my first language.  Sadly Ruscommitting.

So glad I'm not a part of them for a long-long time. I left during Eltsin times. It is very said how the whole country was brainwashed by Putin's propaganda for two decades. It caused rift in my family. I can't talk to them anymore. I hope they wake up finally and see this crime against humanity their leaders and they  themselves are comitting.

Слава Украине! Glory to Ukranian! 🇺🇦  💙💛",aa34ac4640fdf2e6788e6bdff35e598db50427ba,True,False,,,,,0,1648047191,,0,{},i1sva2e,False,t3_tkg5hm,False,False,t3_tkg5hm,/r/UkraineConflict/comments/tkg5hm/russian_cartoon_character_against_war_in_ukraine/i1sva2e/,1648047208,1,True,True,False,UkraineConflict,t5_30oyx,r/UkraineConflict,public,,0,[],,1648018391.0,
[],False,,[deleted],,,,,,dark,,,,,[removed],fe993932d6dced4c0a879e9aa5d7a6e0fbb467f5,True,False,,,,,0,1648046989,,0,{},i1sur9c,False,t3_tk37c0,False,True,t1_i1ou1bv,/r/UkraineConflict/comments/tk37c0/why_cant_the_west_admit_that_ukraine_is_winning/i1sur9c/,1648047002,1,True,True,False,UkraineConflict,t5_30oyx,r/UkraineConflict,public,,0,[],,1648018189.0,
[],False,,smileymalaise,,,[],,,,text,t2_7ri8w,False,True,I like to think Putin was Vagazzling.,ac25d2da08110a1639d5c9d92e1c0d41408967dd,True,False,,,,,0,1648046827,,0,{},i1suciw,False,t3_tkruh7,False,True,t1_i1slird,/r/UkraineConflict/comments/tkruh7/several_of_vladimir_putins_inner_circle_are_said/i1suciw/,1648046843,1,True,True,False,UkraineConflict,t5_30oyx,r/UkraineConflict,public,,0,[],,1648018027.0,
[],False,,Fancy_Music417,,,[],,,,text,t2_94u1gu8m,False,False,I am not afraid of russia (-phobe from word phobia); I hate them,e0725c847705632badf5b954b48b25408c9ebc90,True,False,,,,,0,1648046798,,0,{},i1su9yb,True,t3_tkazab,False,True,t1_i1st433,/r/UkraineConflict/comments/tkazab/well_russians_love_history_a_lot_so_maybe/i1su9yb/,1648046814,1,True,True,False,UkraineConflict,t5_30oyx,r/UkraineConflict,public,,0,[],,1648017998.0,
[],False,,South-Read5492,,,[],,,,text,t2_ejyo1mei,False,False,Busy directing the Military fiasco from a bunker?,457c9baa795a3be662f48bca1228b205ddf3582e,True,False,,,,,0,1648046677,,0,{},i1stz20,False,t3_tkrtc5,False,True,t3_tkrtc5,/r/UkraineConflict/comments/tkrtc5/russian_defence_minister_sergei_shoigu_and_chief/i1stz20/,1648046693,1,True,True,False,UkraineConflict,t5_30oyx,r/UkraineConflict,public,,0,[],,1648017877.0,
[],False,,[deleted],,,,,,dark,,,,,[removed],fe993932d6dced4c0a879e9aa5d7a6e0fbb467f5,True,False,,,,,0,1648046672,,0,{},i1stykn,False,t3_tk37c0,False,True,t3_tk37c0,/r/UkraineConflict/comments/tk37c0/why_cant_the_west_admit_that_ukraine_is_winning/i1stykn/,1648046685,1,True,True,False,UkraineConflict,t5_30oyx,r/UkraineConflict,public,,0,[],,1648017872.0,
[],False,,CMaster_16,,,[],,,,text,t2_jr5f87tk,False,False,Silence Russophobe,99c4cd511bd4728c936585044c90652dfff15d23,True,False,,,,,0,1648046336,,0,{},i1st433,False,t3_tkazab,False,True,t1_i1ssr19,/r/UkraineConflict/comments/tkazab/well_russians_love_history_a_lot_so_maybe/i1st433/,1648046351,1,True,True,False,UkraineConflict,t5_30oyx,r/UkraineConflict,public,,0,[],,1648017536.0,
[],False,,Fancy_Music417,,,[],,,,text,t2_94u1gu8m,False,False,"Ha! That was first time! And! Only one person. As one russian told me: if we use Molotov, majority of people will be against it. And after that he told that he will escape russia when a moment appear… well.. someone just does not want protest",32c164fdd169a44fcc0b8aa96e9bc7b550051596,True,False,,,,,0,1648046192,,0,{},i1ssr19,True,t3_tkazab,False,True,t1_i1sgn4r,/r/UkraineConflict/comments/tkazab/well_russians_love_history_a_lot_so_maybe/i1ssr19/,1648046208,1,True,True,False,UkraineConflict,t5_30oyx,r/UkraineConflict,public,,0,[],,1648017392.0,
[],False,,mattwilliams,,,[],,,,text,t2_3ndal,False,False,There was a plan?,f73d65667dedcafc7a74e25754d6c3c372672217,True,False,,,,,0,1648046057,,0,{},i1ssevm,False,t3_tkruh7,False,True,t3_tkruh7,/r/UkraineConflict/comments/tkruh7/several_of_vladimir_putins_inner_circle_are_said/i1ssevm/,1648046070,1,True,True,False,UkraineConflict,t5_30oyx,r/UkraineConflict,public,,0,[],,1648017257.0,
[],False,,monoblanco10,,,[],,,,text,t2_84mks7qq,False,False,"Well... it's safe to say, that will be blamed on Ukrainians, probably Azov specifically.",28c270430ccb67d89fba2535ba0c4ff4d7114453,True,False,,,,,0,1648046013,,0,{},i1ssatd,False,t3_tks6cw,False,True,t3_tks6cw,/r/UkraineConflict/comments/tks6cw/in_the_center_of_moscow_an_unknown_person_threw_a/i1ssatd/,1648046026,1,True,True,False,UkraineConflict,t5_30oyx,r/UkraineConflict,public,,0,[],,1648017213.0,
[],False,,BoilerButtSlut,,,[],,,,text,t2_5lwx3,False,False,"If I'm a coward for NOT wanting to die in a nuclear wasteland just because some overgrown toddler on here can't get what they want, then yeah sign me up.",5e6bb61baf331688df1a9fe12dcdff11601bb711,True,False,,,,,0,1648045846,,0,{},i1srvj0,False,t3_tdwt87,False,True,t1_i1sq43i,/r/UkraineConflict/comments/tdwt87/dad_and_son_ambushed_by_russian_soldiers_with_3/i1srvj0/,1648045862,1,True,True,False,UkraineConflict,t5_30oyx,r/UkraineConflict,public,,0,[],,1648017046.0,
[],False,,swordfishunter,,,[],,,,text,t2_52itk7f,False,True,Must be those damn Russian windows.,3f9c25fbc5753716c343b0dece87e7b1dbf56aa6,True,False,,,,,0,1648045801,,0,{},i1srrk1,False,t3_tkrtc5,False,True,t3_tkrtc5,/r/UkraineConflict/comments/tkrtc5/russian_defence_minister_sergei_shoigu_and_chief/i1srrk1/,1648045818,1,True,True,False,UkraineConflict,t5_30oyx,r/UkraineConflict,public,,0,[],,1648017001.0,
[],False,,swordfishunter,,,[],,,,text,t2_52itk7f,False,True,Incandescent huh? Well time for some Ukrainian Ukrainium pipe hitters to Light him up.,dc7d5d1f044f153dc18c0e2c550be45b48938539,True,False,,,,,0,1648045742,,0,{},i1srmbo,False,t3_tkruh7,False,True,t3_tkruh7,/r/UkraineConflict/comments/tkruh7/several_of_vladimir_putins_inner_circle_are_said/i1srmbo/,1648045758,1,True,True,False,UkraineConflict,t5_30oyx,r/UkraineConflict,public,,0,[],,1648016942.0,
[],False,,Tasty_Abroad3998,,,[],,,,text,t2_75hjx0ff,False,False,"Only reason Russia isn't losing is because Russian leadership, one man Putin, does't value life.  He will keep sending his men into the meat grinder, beating a dead horse, as he will do anything to save face.  If that means sacrifice 50k more Russian soldiers for now logical reason, so be it.  So Russia may not have altered their strategy, but that is obviously not a good thing for Russia""s military effort.  Nobody wins, but the Russian military exposed itself as.

The amount of support and worldwide guilt money that will flow into Ukraine in the future will one day see Ukraine flourish again, while Russia will be struggling eternally.  This current conflict is the battle, I believe the ""war"" is much bigger and has already been decided.",85ca17145a2f457f7016a489769b587e91965f0f,True,False,,,,,0,1648045480,,0,{},i1sqyx0,False,t3_tk37c0,False,True,t1_i1spsj8,/r/UkraineConflict/comments/tk37c0/why_cant_the_west_admit_that_ukraine_is_winning/i1sqyx0/,1648045495,1,True,True,False,UkraineConflict,t5_30oyx,r/UkraineConflict,public,,0,[],,1648016680.0,
[],False,,kodaks142,,,[],,,,text,t2_g3yu7x91,False,False,"Blue eyed hero, I salute",db63aff02c573b5a7afeaaebda4eb743860ff1ad,True,False,,,,,0,1648045363,,0,{},i1sqoej,False,t3_tkt1rf,False,True,t3_tkt1rf,/r/UkraineConflict/comments/tkt1rf/kicked_out_of_the_italian_air_force_after_having/i1sqoej/,1648045375,1,True,True,False,UkraineConflict,t5_30oyx,r/UkraineConflict,public,,0,[],,1648016563.0,
[],False,,[deleted],,,,,,dark,,,,,[removed],fe993932d6dced4c0a879e9aa5d7a6e0fbb467f5,True,False,,,,,0,1648045247,,0,{},i1sqe9t,False,t3_tkt1rf,False,True,t1_i1soyco,/r/UkraineConflict/comments/tkt1rf/kicked_out_of_the_italian_air_force_after_having/i1sqe9t/,1648045263,1,True,True,False,UkraineConflict,t5_30oyx,r/UkraineConflict,public,,0,[],,1648016447.0,
