all_awardings,archived,associated_award,author,author_flair_background_color,author_flair_css_class,author_flair_richtext,author_flair_template_id,author_flair_text,author_flair_text_color,author_flair_type,author_fullname,author_patreon_flair,author_premium,body,body_sha1,can_gild,collapsed,collapsed_because_crowd_control,collapsed_reason,collapsed_reason_code,comment_type,controversiality,created_utc,distinguished,gilded,gildings,id,is_submitter,link_id,locked,no_follow,parent_id,permalink,retrieved_utc,score,score_hidden,send_replies,stickied,subreddit,subreddit_id,subreddit_name_prefixed,subreddit_type,top_awarded_type,total_awards_received,treatment_tags,unrepliable_reason,created,author_cakeday
[],False,,WikiMobileLinkBot,,,[],,,,text,t2_ctj9ecbj,False,False,"Desktop version of /u/pouch_cotato_'s links:

 * &lt;https://en.wikipedia.org/wiki/White_Rose&gt;

 * &lt;https://en.wikipedia.org/wiki/German_resistance_to_Nazism&gt;

 --- 

 ^([)[^(opt out)](https://reddit.com/message/compose?to=WikiMobileLinkBot&amp;message=OptOut&amp;subject=OptOut)^(]) ^(Beep Boop.  Downvote to delete)",963d9a6148cf2e106e394ab4013d1e5a61accc9a,True,False,,,,,0,1648024351,,0,{},i1rs7ph,False,t3_tkazab,False,False,t1_i1rs6ey,/r/UkraineConflict/comments/tkazab/well_russians_love_history_a_lot_so_maybe/i1rs7ph/,1648024366,1,True,True,False,UkraineConflict,t5_30oyx,r/UkraineConflict,public,,0,[],,1647995551.0,
[],False,,pouch_cotato_,,,[],,,,text,t2_hxuwn020,False,False,"Well, there was the student resistance group the [White Rose](https://en.m.wikipedia.org/wiki/White_Rose), to name one famous example.
There was also several attempts on Hitlers life and many separate groups resisting. Here’s a bit more info on [the German resistance to Nazism](https://en.m.wikipedia.org/wiki/German_resistance_to_Nazism).",bb7156af59f81f74abf8f53f59d3a4ff40184679,True,False,,,,,0,1648024319,,0,{},i1rs6ey,False,t3_tkazab,False,True,t1_i1rks5z,/r/UkraineConflict/comments/tkazab/well_russians_love_history_a_lot_so_maybe/i1rs6ey/,1648024334,1,True,True,False,UkraineConflict,t5_30oyx,r/UkraineConflict,public,,0,[],,1647995519.0,
[],False,,rentest,,,[],,,,text,t2_jslfhf37,False,False,"I just heard the number of dead + wounded crossed 50 000 soldiers 

therefore they are seeking new soldiers from Syria, Chechnya etc",13e8269be97036ea06c3f2a49d1e2944768f234d,True,False,,,,,0,1648024235,,0,{},i1rs32g,True,t3_tk37c0,False,True,t1_i1rnv11,/r/UkraineConflict/comments/tk37c0/why_cant_the_west_admit_that_ukraine_is_winning/i1rs32g/,1648024250,1,True,True,False,UkraineConflict,t5_30oyx,r/UkraineConflict,public,,0,[],,1647995435.0,
[],False,,greenkernel,,,[],,,,text,t2_xpwmt,False,False,Ask the residents of Mariupol,da4844f334bc3dc9a962e9f56997a1764d527223,True,False,,,,,0,1648024053,,0,{},i1rrvsu,False,t3_thz28d,False,True,t1_i1dsxjl,/r/UkraineConflict/comments/thz28d/the_un_confirmed_that_there_are_no_laboratories/i1rrvsu/,1648024068,1,True,True,False,UkraineConflict,t5_30oyx,r/UkraineConflict,public,,0,[],,1647995253.0,
[],False,,picardo85,,,[],,,,text,t2_65pw2,False,False,Do we have a better source than this Blog ?,47706947b42217ab48b2598f45f1593a90456a8d,True,False,,,,,0,1648024014,,0,{},i1rru7r,False,t3_tknghy,False,True,t3_tknghy,/r/UkraineConflict/comments/tknghy/putin_is_at_risk_of_poisoning_thousands_of/i1rru7r/,1648024030,1,True,True,False,UkraineConflict,t5_30oyx,r/UkraineConflict,public,,0,[],,1647995214.0,
[],False,,merzota,,,[],,,,text,t2_1mdp94cu,False,False,"While I cannot agree with the gun sentiment, I understand where you’re coming from.

But the Viking schooling is quite an interesting read. I never connected Varangians and Vikings, however it seems logical.

Take my upvote! New cool history research is the shit.",994c262681b4fcdd7ca271e56936c70939569b82,True,False,,,,,0,1648023927,,0,{},i1rrqpp,False,t3_tkazab,False,True,t1_i1rpwpw,/r/UkraineConflict/comments/tkazab/well_russians_love_history_a_lot_so_maybe/i1rrqpp/,1648023940,1,True,True,False,UkraineConflict,t5_30oyx,r/UkraineConflict,public,,0,[],,1647995127.0,
[],False,,pvypvMoonFlyer,,,[],,,,text,t2_8zy79x3o,False,False,"That’s the reality of the situation, sadly some seem to believe things are black and white.",7d05edee869f2cc5efc436900ef137ea45f1a9f0,True,False,,,,,0,1648023647,,0,{},i1rrfi8,False,t3_tkazab,False,True,t1_i1qp6pp,/r/UkraineConflict/comments/tkazab/well_russians_love_history_a_lot_so_maybe/i1rrfi8/,1648023661,1,True,True,False,UkraineConflict,t5_30oyx,r/UkraineConflict,public,,0,[],,1647994847.0,
[],False,,pvypvMoonFlyer,,,[],,,,text,t2_8zy79x3o,False,False,"Exactly, that’s why the poll that was done with the 70% is complete rubbish as well. 

Conducted over the phone, they talked to less than 2000 people, they asked very oriented questions and it surprisingly helps Putin’s propaganda and the western media’s who want to put the blame on the whole Russian population without any discernment.",c954f9a919e448d9f9ea748b6b082e1f58ee80da,True,False,,,,,0,1648023603,,0,{},i1rrdo5,False,t3_tkazab,False,True,t1_i1q93nf,/r/UkraineConflict/comments/tkazab/well_russians_love_history_a_lot_so_maybe/i1rrdo5/,1648023617,1,True,True,False,UkraineConflict,t5_30oyx,r/UkraineConflict,public,,0,[],,1647994803.0,
[],False,,pvypvMoonFlyer,,,[],,,,text,t2_8zy79x3o,False,False,"Exactly, this kind of brainwashing seems to be constantly downplayed around here. 

I support Russian opposition groups and I am against those that support the war knowingly, yet I’m not gonna pretend that those who support the war due to believing the propaganda are to blame. 

They had to be lied to in order to support it, we are talking about people being brainwashed, hence why the German nation wasn’t blamed for initiating the Second World War and the Holocaust.",40d4ba4bac873e9a9282780be04031392a51ec22,True,False,,,,,0,1648023476,,0,{},i1rr8f4,False,t3_tkazab,False,True,t1_i1qpsbf,/r/UkraineConflict/comments/tkazab/well_russians_love_history_a_lot_so_maybe/i1rr8f4/,1648023488,1,True,True,False,UkraineConflict,t5_30oyx,r/UkraineConflict,public,,0,[],,1647994676.0,
[],False,,merzota,,,[],,,,text,t2_1mdp94cu,False,False,"I think your logic checks out and what happened in 2014 was enabled by the whole world. Ukraine held up its end of the bargain when they disarmed, the world did not.

Slightly off topic, but if I was NK or Iran right now, I would double up on getting those nukes, cause clearly treaties and agreements are not worth the paper they are written on.",d9239025aca038da1839e20e31bbab7b205b3bfd,True,False,,,,,0,1648023473,,0,{},i1rr8ad,False,t3_tkazab,False,True,t1_i1rqc0x,/r/UkraineConflict/comments/tkazab/well_russians_love_history_a_lot_so_maybe/i1rr8ad/,1648023488,1,True,True,False,UkraineConflict,t5_30oyx,r/UkraineConflict,public,,0,[],,1647994673.0,
[],False,,Fancy_Music417,,,[],,,,text,t2_94u1gu8m,False,False,On YouTube I found only parts,7c2e41f7ed5ed8014fd09dcfa8d9997450c670dc,True,False,,,,,0,1648023424,,0,{},i1rr689,True,t3_thr26n,False,True,t1_i1rr1lu,/r/UkraineConflict/comments/thr26n/prowar_concert_in_russia_18032022/i1rr689/,1648023436,1,True,True,False,UkraineConflict,t5_30oyx,r/UkraineConflict,public,,0,[],,1647994624.0,
[],False,,StefooK,,,[],,,,text,t2_8870yfk,False,False,"Just one difference. On the ground the writing says ""for a world without nazis"".",d654eb7477435874f4e9350159ba915f27142eb2,True,False,,,,,0,1648023372,,0,{},i1rr45e,False,t3_thr26n,False,False,t1_i19fgme,/r/UkraineConflict/comments/thr26n/prowar_concert_in_russia_18032022/i1rr45e/,1648023384,1,True,True,False,UkraineConflict,t5_30oyx,r/UkraineConflict,public,,0,[],,1647994572.0,
[],False,,pppjurac,,,[],,,,text,t2_36ooa,False,False,"Actually, last one who did that in organised fashion were paramilitary &amp; private groups in former Yugoslavia during Yugoslav wars. 

https://en.wikipedia.org/wiki/Arkan",3b9c57d00f2cf2aea8842b5cd6d05f235777ac0b,True,False,,,,,0,1648023342,,0,{},i1rr2y0,False,t3_tkasts,False,True,t3_tkasts,/r/UkraineConflict/comments/tkasts/near_kyiv_there_are_several_groups_of_russian/i1rr2y0/,1648023358,1,True,True,False,UkraineConflict,t5_30oyx,r/UkraineConflict,public,,0,[],,1647994542.0,
[],False,,StefooK,,,[],,,,text,t2_8870yfk,False,False,Does anyone have a link to the full concert?,77a71e60c53c7ffa2673dd9b9f1df42a5d61adae,True,False,,,,,0,1648023309,,0,{},i1rr1lu,False,t3_thr26n,False,True,t3_thr26n,/r/UkraineConflict/comments/thr26n/prowar_concert_in_russia_18032022/i1rr1lu/,1648023319,1,True,True,False,UkraineConflict,t5_30oyx,r/UkraineConflict,public,,0,[],,1647994509.0,
[],False,,pvypvMoonFlyer,,,[],,,,text,t2_8zy79x3o,False,False,"I agree, but people tend to enjoy simplifying things to the point where it becomes just…wrong.

The downplay the power of propaganda, the existence of Russian opposition, and the oppression and then call Russians enablers and cowards.

They are playing with facts to blame the whole country🤦",acd4c3e5f749c7302867d5ce7ecf312c8cd637fb,True,False,,,,,0,1648023198,,0,{},i1rqx44,False,t3_tkazab,False,True,t1_i1r6y0i,/r/UkraineConflict/comments/tkazab/well_russians_love_history_a_lot_so_maybe/i1rqx44/,1648023214,1,True,True,False,UkraineConflict,t5_30oyx,r/UkraineConflict,public,,0,[],,1647994398.0,
[],False,,pvypvMoonFlyer,,,[],,,,text,t2_8zy79x3o,False,False,"Cult and dictatorship brainwash people in such effective ways that even with access to the truth, people won’t acknowledge it.

Ever wondered why cult members don’t seem to be open to a different outlook? They are brainwashed and the same happens in dictatorships like in Russia or North Korea.

You may wanna do some reading on that. 

The ramifications of this kind of brainwashing are forever to be dealt with by the subjects.",7c8853234c382c69a336ed464cc890a4fc77d5a5,True,False,,,,,0,1648022996,,0,{},i1rqosa,False,t3_tkazab,False,True,t1_i1r0ds2,/r/UkraineConflict/comments/tkazab/well_russians_love_history_a_lot_so_maybe/i1rqosa/,1648023011,1,True,True,False,UkraineConflict,t5_30oyx,r/UkraineConflict,public,,0,[],,1647994196.0,
[],False,,rentest,,,[],,,,text,t2_jslfhf37,False,False,"yes - correction needed - 1000 = dead + wounded a day -

thats Western conservative estimation",2acc04bb2f90f9e195ac5e64dcdcc02bc814c07a,True,False,,,,,0,1648022982,,0,{},i1rqo7d,True,t3_tk37c0,False,True,t1_i1ro9p6,/r/UkraineConflict/comments/tk37c0/why_cant_the_west_admit_that_ukraine_is_winning/i1rqo7d/,1648022998,1,True,True,False,UkraineConflict,t5_30oyx,r/UkraineConflict,public,,0,[],,1647994182.0,
[],False,,Nk-O,,,[],,,,text,t2_m2i3o,False,False,KÖNIGSBERG ZU OSTPREUSSEN!,dbb8475eb047ed124c93d2e35d72511e9bb6eeee,True,False,,,,,0,1648022859,,0,{},i1rqizj,False,t3_tk7122,False,False,t3_tk7122,/r/UkraineConflict/comments/tk7122/right_but_of_course_putin_will_keep_going_moldova/i1rqizj/,1648022874,1,True,True,False,UkraineConflict,t5_30oyx,r/UkraineConflict,public,,0,[],,1647994059.0,
[],False,,pvypvMoonFlyer,,,[],,,,text,t2_8zy79x3o,False,False,"They aren’t, opposition has existed for quite some time, garnered a lot of support, people have been protesting in the past, the repression has just been very violent and efficient in deterring people from standing up.

If Russia as a whole is to blame for enabling Putin, then by the same logic, the rest of the world is at fault as well since we didn’t do anything about Crimea.

Putin infringed international law, yet he was then welcomed in the UK by the queen. 

World leaders didn’t care that he took Crimea, western nations didn’t protest either. By your logic, we all enabled this dictator to feel that he could do whatever he wants to Ukraine, we all share the blame for not standing up to him since 2014.",009a1356dbd1624971cb2e7373ed2dc9a6dc1f65,True,False,,,,,0,1648022689,,0,{},i1rqc0x,False,t3_tkazab,False,True,t1_i1rmaj1,/r/UkraineConflict/comments/tkazab/well_russians_love_history_a_lot_so_maybe/i1rqc0x/,1648022699,1,True,True,False,UkraineConflict,t5_30oyx,r/UkraineConflict,public,,0,[],,1647993889.0,
[],False,,Ok_Tangerine346,,,[],,,,text,t2_in4mw36m,False,True,Great. The kids in my sons school are doing a charity event. I will point this out.,aa38e4a8387ec5ce6297dae07eeee36857dcd41b,True,False,,,,,0,1648022638,,0,{},i1rq9tz,False,t3_tkh5c3,False,True,t3_tkh5c3,/r/UkraineConflict/comments/tkh5c3/to_simplify_the_process_as_much_as_possible_the/i1rq9tz/,1648022654,1,True,True,False,UkraineConflict,t5_30oyx,r/UkraineConflict,public,,0,[],,1647993838.0,
[],False,,JimMarch,,,[],,,,text,t2_311fc,False,False,"Really?

If you guys had an established gun culture at least as strong as Finland you would have been in much better shape.

If you had a gun culture equivalent to the US, especially some place like Texas, Putin's invasion would have looked about like this:

https://youtu.be/KNoyStVjWFE

:)

Only a slight exaggeration...",cc233a9ccb482403972eb5c0ec6206f0ff795ad4,True,False,,,,,0,1648022579,,0,{},i1rq76w,False,t3_tkazab,False,True,t1_i1rph4q,/r/UkraineConflict/comments/tkazab/well_russians_love_history_a_lot_so_maybe/i1rq76w/,1648022594,1,True,True,False,UkraineConflict,t5_30oyx,r/UkraineConflict,public,,0,[],,1647993779.0,
[],False,,JimMarch,,,[],,,,text,t2_311fc,False,False,"https://www.medieval.eu/rus-or-varangians-vikings-of-the-east/

Of course, we're talking about a period before the split between Ukraine and Russia when the capital of what's now the Russian culture was Kiev.

https://www.history.com/news/vikings-in-russia-kiev-rus-varangians-prince-oleg

&gt;It was after 840 that Scandanavian Vikings—who were known in Eastern Europe as “Varangians” or “Rus”—established Viking rule over Slavic tribes in what came to be called Kievan Rus. At first, the region was divided between three noble brothers.
&gt;
&gt;“The oldest, Rurik, located himself at Novgorod; the second, Sineus, at Beloozero; and the third, Truvor, in Izborsk,” recounts the Russian Primary Chronicle, a history of the region completed in the 12th century by Kievan monks. “On account of these Varangians, the district of Novgorod became known as the land of Rus.” (“Rus,” which is where the name “Russia” comes from, purportedly derives from an old Nordic word for “men who row.”)

Yes, the first organized government of anything like we can call Russia we're a bunch of fucking Vikings.

First decent government any of you have had in the thousand plus years since is Zelenskyy.  And when you finally kicked enough Russian ass that they wander home with whatever is left of their logistics, you're going to have to politely and firmly tell Zelenskyy you're not giving up your guns ever again.

**When you do, you'll be the first free people among your branch of the Slavic tribes (which also includes Russia and Belarus) that have ever existed since 840AD.**",2542e54ed17552c2da78fd0bee9040ebac3d2ea1,True,False,,,,,0,1648022330,,0,{},i1rpwpw,False,t3_tkazab,False,True,t1_i1rnsml,/r/UkraineConflict/comments/tkazab/well_russians_love_history_a_lot_so_maybe/i1rpwpw/,1648022344,1,True,True,False,UkraineConflict,t5_30oyx,r/UkraineConflict,public,,0,[],,1647993530.0,
[],False,,pvypvMoonFlyer,,,[],,,,text,t2_8zy79x3o,False,False,"Russia has had many opposition leaders, supported them and they have been incapacitated.

Please stop spreading inaccuracies.

People have for instance protested against Poutine when he has rigged elections around 10 years ago (more than 100k people).

You either know the work of the opposition in Russia and decided to pretend it didn’t exist or you don’t and should educate yourself.",29012cf9e35a626a1a2220b9ba719f0286d9c409,True,False,,,,,0,1648022316,,0,{},i1rpw4d,False,t3_tkazab,False,True,t1_i1pp9jq,/r/UkraineConflict/comments/tkazab/well_russians_love_history_a_lot_so_maybe/i1rpw4d/,1648022331,1,True,True,False,UkraineConflict,t5_30oyx,r/UkraineConflict,public,,0,[],,1647993516.0,
[],False,,pvypvMoonFlyer,,,[],,,,text,t2_8zy79x3o,False,False,"Exactly, we are basically seeing simple minded people blaming the whole country and smart people seeing the nuance and blaming only those who are directly responsible.",0aaa33ebaa18eba35871a8140983493032a13fcb,True,False,,,,,0,1648022037,,0,{},i1rpkns,False,t3_tkazab,False,False,t1_i1qpmz6,/r/UkraineConflict/comments/tkazab/well_russians_love_history_a_lot_so_maybe/i1rpkns/,1648022048,1,True,True,False,UkraineConflict,t5_30oyx,r/UkraineConflict,public,,0,[],,1647993237.0,
[],False,,No_Commission_1736,,,[],,,,text,t2_4e52wbf3,False,False,"They kept removing this from Vk when I kept posting, but Dubrov brothers so Telegram/Vk mine the life out you so if use any do from an Onion or old mobile device that has been reset &amp; encrypted at least 3-4 times.",e22afe8212a5efad503cb7cde9b041d5be43f6b7,True,False,,,,,0,1648021995,,0,{},i1rpiwh,False,t3_tft8fw,False,True,t3_tft8fw,/r/UkraineConflict/comments/tft8fw/ukraine_soldiers_walking_trough_a_tank_battle/i1rpiwh/,1648022009,1,True,True,False,UkraineConflict,t5_30oyx,r/UkraineConflict,public,,0,[],,1647993195.0,
[],False,,pvypvMoonFlyer,,,[],,,,text,t2_8zy79x3o,False,False,"This isn’t about gun rights, enough with your nonsense.",d5f908d23d07279840c85304d50ec2cf3a423768,True,False,,,,,0,1648021954,,0,{},i1rph4q,False,t3_tkazab,False,False,t1_i1rkjdz,/r/UkraineConflict/comments/tkazab/well_russians_love_history_a_lot_so_maybe/i1rph4q/,1648021969,1,True,True,False,UkraineConflict,t5_30oyx,r/UkraineConflict,public,,0,[],,1647993154.0,
[],False,,gr0mstea,,,[],,,,text,t2_2bep3od7,False,False,"Imo there's more to this than meets the eye. Theoretically, right, and this is hypothetical, by continuing work they could stall production and/or sabotage from the inside, but I doubt that's what's going on. 

I guess we'll never know.",618e8896c02a0c58d2d9300e6271f316d5349218,True,False,,,,,0,1648021736,,0,{},i1rp84b,False,t3_tkcvix,False,True,t3_tkcvix,/r/UkraineConflict/comments/tkcvix/renault_car_brand_supports_russia_and_the_war/i1rp84b/,1648021750,1,True,True,False,UkraineConflict,t5_30oyx,r/UkraineConflict,public,,0,[],,1647992936.0,
[],False,,Ok_Tangerine346,,,[],,,,text,t2_in4mw36m,False,True,Thaat shopkeeper loved battle,0fbeab572b9092d816f8ab890a99f40045985911,True,False,,,,,0,1648021594,,0,{},i1rp1zq,False,t3_tkn3rq,False,True,t3_tkn3rq,/r/UkraineConflict/comments/tkn3rq/watch_the_small_town_in_ukraine_which_saw_off_the/i1rp1zq/,1648021607,1,True,True,False,UkraineConflict,t5_30oyx,r/UkraineConflict,public,,0,[],,1647992794.0,
[],False,,Z0MGbies,,,[],,,,text,t2_6ok1w,False,False,Imagine having to say all that shit ... like does it not just fucking eat at your soul (or at least the husk in its place)?,6bb96d3b326c3138e81c3caf026b45d861b9c7cc,True,False,,,,,0,1648021534,,0,{},i1rozga,False,t3_tk57tb,False,True,t3_tk57tb,/r/UkraineConflict/comments/tk57tb/members_of_russian_policital_party_ldpr_announced/i1rozga/,1648021549,1,True,True,False,UkraineConflict,t5_30oyx,r/UkraineConflict,public,,0,[],,1647992734.0,
[],False,,absentia123,,,[],,,,text,t2_9sj4xt5b,False,False,Obama was one,8963a3ff797dfb5501c3bb9e54cdbc6ecfc444a6,False,False,,,,,0,1648021519,,0,{},i1roysx,False,t3_t1huns,False,True,t3_t1huns,/r/UkraineConflict/comments/t1huns/list_of_evil_world_leaders/i1roysx/,1648021535,1,False,True,False,UkraineConflict,t5_30oyx,r/UkraineConflict,public,,0,[],,1647992719.0,
[],False,,Z0MGbies,,,[],,,,text,t2_6ok1w,False,False,Pure unabated wild as shit machiavellianism,777df5eaa8dbe4ddc4ef648231da948ec1e1aff1,True,False,,,,,0,1648021095,,0,{},i1rohcc,False,t3_tkhjw1,False,True,t1_i1qwsl2,/r/UkraineConflict/comments/tkhjw1/insane_russian_tv_journalist_threatens_europe/i1rohcc/,1648021108,1,True,True,False,UkraineConflict,t5_30oyx,r/UkraineConflict,public,,0,[],,1647992295.0,
[],False,,Z0MGbies,,,[],,,,text,t2_6ok1w,False,False,Tukorlov Carlinksi,2151f05b6a8bb606247ed7ff9aa7ef61ea871f2e,True,False,,,,,0,1648021036,,0,{},i1roexx,False,t3_tkhjw1,False,True,t3_tkhjw1,/r/UkraineConflict/comments/tkhjw1/insane_russian_tv_journalist_threatens_europe/i1roexx/,1648021051,1,True,True,False,UkraineConflict,t5_30oyx,r/UkraineConflict,public,,0,[],,1647992236.0,
[],False,,rentest,,,[],,,,text,t2_jslfhf37,False,False,"What is the success of Russians then ?

You are aware that using chemical weapons, thermobarbaric weapons , carpet bombing civilians - are all war crimes right ?

I mean these are the methods of warfare that will erase their country - Russia -  for the next 30 years .. ?",6f0f513b61f5763b639a63b05c166e2fd8a48925,True,False,,,,,0,1648021004,,0,{},i1rodn9,True,t3_tk37c0,False,True,t1_i1rnv11,/r/UkraineConflict/comments/tk37c0/why_cant_the_west_admit_that_ukraine_is_winning/i1rodn9/,1648021020,1,True,True,False,UkraineConflict,t5_30oyx,r/UkraineConflict,public,,0,[],,1647992204.0,
[],False,,TThrowaway144,,,[],,,,text,t2_c1wadq5n,False,False,1000 russians die in a day? Thats pure fanatsy,b9bf4b6c59f11b3abbd5f45050f5f2cc6e03e201,True,False,,,,,0,1648020910,,0,{},i1ro9p6,False,t3_tk37c0,False,True,t1_i1rki9i,/r/UkraineConflict/comments/tk37c0/why_cant_the_west_admit_that_ukraine_is_winning/i1ro9p6/,1648020923,1,True,True,False,UkraineConflict,t5_30oyx,r/UkraineConflict,public,,0,[],,1647992110.0,
[],False,,Z0MGbies,,,[],,,,text,t2_6ok1w,False,False,"I usually daydream about donations to various causes but rarely end up following through.

But not this time.  Now officially live out the ""I'm doing my part"" meme.  

Now instead I can daydream that bullets I helped purchase get shot at the russian soldier fuckheads.",d75da1bdfeb6560b2c00f791a0004d27af4e9a06,True,False,,,,,0,1648020814,,0,{},i1ro5rg,False,t3_tkh5c3,False,True,t3_tkh5c3,/r/UkraineConflict/comments/tkh5c3/to_simplify_the_process_as_much_as_possible_the/i1ro5rg/,1648020826,1,True,True,False,UkraineConflict,t5_30oyx,r/UkraineConflict,public,,0,[],,1647992014.0,
[],False,,TThrowaway144,,,[],,,,text,t2_c1wadq5n,False,False,This is why Ukraine is doing its damndest to portray the image that they are having successes on the battlefield,6ce5744335248cd1034b80e3df7efc4c6c23b332,True,False,,,,,0,1648020604,,0,{},i1rnx27,False,t3_tk37c0,False,True,t1_i1o1hc4,/r/UkraineConflict/comments/tk37c0/why_cant_the_west_admit_that_ukraine_is_winning/i1rnx27/,1648020619,1,True,True,False,UkraineConflict,t5_30oyx,r/UkraineConflict,public,,0,[],,1647991804.0,
[],False,,TThrowaway144,,,[],,,,text,t2_c1wadq5n,False,False,Are you not aware that the Russian paras captured the Hostomel airport and that russia never lost it. Your russian casualty number is most likely very over inflated,633b3146fbea8581baacc7e02f11e1176e681a99,True,False,,,,,0,1648020555,,0,{},i1rnv11,False,t3_tk37c0,False,True,t1_i1nr3xw,/r/UkraineConflict/comments/tk37c0/why_cant_the_west_admit_that_ukraine_is_winning/i1rnv11/,1648020566,1,True,True,False,UkraineConflict,t5_30oyx,r/UkraineConflict,public,,0,[],,1647991755.0,
[],False,,merzota,,,[],,,,text,t2_1mdp94cu,False,False,"What the actual fuck, lol

Russia didn’t exist 1000 years ago. Also Vikings? lol what?

Speaking of guns, Ukraine didn’t need gun rights to have its revolutions. This isn’t about gun rights…",fabb015110e326753e19b87f98519d1b1bd0f91b,True,False,,,,,0,1648020496,,0,{},i1rnsml,False,t3_tkazab,False,True,t1_i1rm8gy,/r/UkraineConflict/comments/tkazab/well_russians_love_history_a_lot_so_maybe/i1rnsml/,1648020510,1,True,True,False,UkraineConflict,t5_30oyx,r/UkraineConflict,public,,0,[],,1647991696.0,
[],False,,TThrowaway144,,,[],,,,text,t2_c1wadq5n,False,False,This is why Zakenskii is making overtures to Putin. He knows that they replicate the early success for long,ade9d23537c8aeb6adedd0290b1edbbf0d9967d2,True,False,,,,,0,1648020410,,0,{},i1rnp63,False,t3_tk37c0,False,True,t1_i1qjhky,/r/UkraineConflict/comments/tk37c0/why_cant_the_west_admit_that_ukraine_is_winning/i1rnp63/,1648020426,1,True,True,False,UkraineConflict,t5_30oyx,r/UkraineConflict,public,,0,[],,1647991610.0,
[],False,,Calimore,,,[],,,,text,t2_b1r2l,False,False,You should pick up a book once in a while.,016ac8f151aba3f00a0653e791b5b985eac42214,True,False,,,,,0,1648019886,,0,{},i1rn36s,False,t3_tkazab,False,True,t1_i1rks5z,/r/UkraineConflict/comments/tkazab/well_russians_love_history_a_lot_so_maybe/i1rn36s/,1648019901,1,True,True,False,UkraineConflict,t5_30oyx,r/UkraineConflict,public,,0,[],,1647991086.0,True
[],False,,merzota,,,[],,,,text,t2_1mdp94cu,False,False,It’s literally history repeating. Maybe do some research?,92070fb6cfddd859a057e10f05bb080830c4cfc3,True,False,,,,,0,1648019583,,0,{},i1rmqh7,False,t3_tkazab,False,True,t1_i1rks5z,/r/UkraineConflict/comments/tkazab/well_russians_love_history_a_lot_so_maybe/i1rmqh7/,1648019595,1,True,True,False,UkraineConflict,t5_30oyx,r/UkraineConflict,public,,0,[],,1647990783.0,
[],False,,RicheyrooNZ,,,[],,,,text,t2_cb7aart,False,False,"These suckers go a long way. I've heard speculation that ammo for total city destruction is running low. So they will use Navy weapons more and more, especially now they have given up pretending it's Ukranian military bombing cities",0f5543e04fc41cee6f5c66f2a4cbd6cb848cc8c2,True,False,,,,,0,1648019295,,0,{},i1rmeaj,False,t3_tkgpjy,False,True,t1_i1rhamn,/r/UkraineConflict/comments/tkgpjy/russian_warships_launch_missiles_in_sevastopol/i1rmeaj/,1648019307,1,True,True,False,UkraineConflict,t5_30oyx,r/UkraineConflict,public,,0,[],,1647990495.0,
[],False,,merzota,,,[],,,,text,t2_1mdp94cu,False,False,"I’m not convinced that Russians ever really wanted freedom or democracy. Shit, I don’t believe they’ve ever even tasted freedom as a people. Otherwise, they wouldn’t go from tsars to dictators under Soviet regime to a dictator currently.

They are perfectly happy living this way IMO.",0d0ef7aaa9a6329e85a33213a2cd6d5f89a4081a,True,False,,,,,0,1648019206,,0,{},i1rmaj1,False,t3_tkazab,False,True,t1_i1r068i,/r/UkraineConflict/comments/tkazab/well_russians_love_history_a_lot_so_maybe/i1rmaj1/,1648019220,1,True,True,False,UkraineConflict,t5_30oyx,r/UkraineConflict,public,,0,[],,1647990406.0,
