all_awardings,archived,associated_award,author,author_flair_background_color,author_flair_css_class,author_flair_richtext,author_flair_template_id,author_flair_text,author_flair_text_color,author_flair_type,author_fullname,author_patreon_flair,author_premium,body,body_sha1,can_gild,collapsed,collapsed_because_crowd_control,collapsed_reason,collapsed_reason_code,comment_type,controversiality,created_utc,distinguished,gilded,gildings,id,is_submitter,link_id,locked,no_follow,parent_id,permalink,retrieved_utc,score,score_hidden,send_replies,stickied,subreddit,subreddit_id,subreddit_name_prefixed,subreddit_type,top_awarded_type,total_awards_received,treatment_tags,unrepliable_reason,created,author_cakeday
[],False,,kwagenknight,,,[],,,,text,t2_opzwo,False,False,"Thanks for bringing that to my attention but Im not sure, it has been unstickied! Im on mobile so cant see who sticked it but it shouldnt have been.",402c47cd783fdb00ecb247a9783ce6e5d38ef24e,True,False,,,,,0,1648000705,,0,{},i1qs04y,False,t3_tk373m,False,True,t1_i1qrngl,/r/UkraineConflict/comments/tk373m/its_a_child_ffs_lvov_volkssturm/i1qs04y/,1648000721,1,True,True,False,UkraineConflict,t5_30oyx,r/UkraineConflict,public,,0,[],,1647971905.0,
[],False,,loveforallhumanity,,,[],,,,text,t2_kwoep2tl,False,False,Alright good. Yeah - fortunately I grew up in America and am also trying to raise awareness. Wish we could get rid of Putin. I'm just scared that a decent chunk of Russia still doesn't want to live in the 21st century. You'd think after being oppressed for centuries you'd want to make a change....yet here we are. Hope all is well with you and your family.,b1fafd1b69dcabc303cfbdbb202fda09f1c063af,True,False,,,,,0,1648000578,,0,{},i1qrq9z,False,t3_tkazab,False,True,t1_i1qq1h2,/r/UkraineConflict/comments/tkazab/well_russians_love_history_a_lot_so_maybe/i1qrq9z/,1648000588,1,True,True,False,UkraineConflict,t5_30oyx,r/UkraineConflict,public,,0,[],,1647971778.0,
[],False,,Mejari,,,[],,,,text,t2_8jkkf,False,False,So why is this now a pinned post?,9bb03c8e7ba97beeecc5f61e6b3908eaf1fb741c,True,False,,,,,0,1648000541,,0,{},i1qrngl,False,t3_tk373m,False,True,t1_i1qgph2,/r/UkraineConflict/comments/tk373m/its_a_child_ffs_lvov_volkssturm/i1qrngl/,1648000552,1,True,True,False,UkraineConflict,t5_30oyx,r/UkraineConflict,public,,0,[],,1647971741.0,
[],False,,Congruences,,,[],,,,text,t2_ft84m,False,False,"Exploiting MAD requires the opposition to believe you are unstable enough to accept and enact it. Selling the bluff requires you to look unhinged but invading or doing ""special local military operations"" based on economic links to territories sure makes it seem like you actually care about what is still left behind.",02e322864f5c078f20dde63af6b9cab9c73292eb,True,False,,,,,0,1648000403,,0,{},i1qrcmt,False,t3_tkhjw1,False,True,t3_tkhjw1,/r/UkraineConflict/comments/tkhjw1/insane_russian_tv_journalist_threatens_europe/i1qrcmt/,1648000416,1,True,True,False,UkraineConflict,t5_30oyx,r/UkraineConflict,public,,0,[],,1647971603.0,True
[],False,,pmmeaslice,,,[],,,,text,t2_k33tinpw,False,False,"This is not a war zone, this was Lviv. Presumably (allegedly) they were looting people's abandoned houses. Because even though Lviv is not close to the front there has still been shelling. There are no food shortages there. This girl  was allegedly in a gang of looters (we don't know how old this person is, fyi I've seen adult women with 4 foot 2 height that look like this).

Besides her getting her face painted green and tied to a pole we don't know anything else. I think its fair to do that to looters in a time of war.",d81c644a94da609803965fca0d6859f7afba0903,True,False,,,,,0,1648000263,,0,{},i1qr1ih,False,t3_tk373m,False,True,t1_i1nt4y3,/r/UkraineConflict/comments/tk373m/its_a_child_ffs_lvov_volkssturm/i1qr1ih/,1648000278,1,True,True,False,UkraineConflict,t5_30oyx,r/UkraineConflict,public,,0,[],,1647971463.0,
[],False,,Sup3rScottyB,,,[],,,,text,t2_kj8a375e,False,False,Fuck Putin this is sooo sad,38bd6f3ef7fd75644c237c05c251be673a6e6f11,True,False,,,,,0,1647999937,,0,{},i1qqb7y,False,t3_tdwt87,False,True,t3_tdwt87,/r/UkraineConflict/comments/tdwt87/dad_and_son_ambushed_by_russian_soldiers_with_3/i1qqb7y/,1647999950,1,True,True,False,UkraineConflict,t5_30oyx,r/UkraineConflict,public,,0,[],,1647971137.0,
[],False,,BidRevolutionary897,,,[],,,,text,t2_c9enshqs,False,False,"Another sad result of war, a war in which Russia escalated to a point of no return. Terrific reporting as ususal with zero context or sourcing.",9cfc2d817bf01cb6cccf7af6fc03dd4a3c693153,True,False,,,,,0,1647999851,,0,{},i1qq4bb,False,t3_tk373m,False,True,t1_i1ns1j9,/r/UkraineConflict/comments/tk373m/its_a_child_ffs_lvov_volkssturm/i1qq4bb/,1647999864,1,True,True,False,UkraineConflict,t5_30oyx,r/UkraineConflict,public,,0,[],,1647971051.0,
[],False,,gkarq,,,[],,,,text,t2_62el3dhz,False,False,"I perfectly know that, I am a Russian citizen myself and I have family in Russia. Fortunately, I do not live in Russia so I am still able to raise awareness about the clusterfuck of a country Russia actually is.",776a6df5fb8cac14f5e0dca64df921ed88253fa0,True,False,,,,,0,1647999815,,0,{},i1qq1h2,False,t3_tkazab,False,True,t1_i1qpmz6,/r/UkraineConflict/comments/tkazab/well_russians_love_history_a_lot_so_maybe/i1qq1h2/,1647999832,1,True,True,False,UkraineConflict,t5_30oyx,r/UkraineConflict,public,,0,[],,1647971015.0,
[],False,,xXbenadryl_mukbangXx,,,[],,,,text,t2_9cspyrpy,False,True,"This is such a Reddit move “well what’s the context?” Big fat go fuck yourself, they’re abusing a child. Kill yourself.",b0aefbda69b532b5ad9ba8906910ae8bcc4fc918,True,False,,,,,0,1647999774,,0,{},i1qpy5l,False,t3_tk373m,False,True,t1_i1ojcgy,/r/UkraineConflict/comments/tk373m/its_a_child_ffs_lvov_volkssturm/i1qpy5l/,1647999791,1,True,True,False,UkraineConflict,t5_30oyx,r/UkraineConflict,public,,0,[],,1647970974.0,
[],False,,loveforallhumanity,,,[],,,,text,t2_kwoep2tl,False,False,"Exactly. The Russian people have been brainwashed. I wish there was something more that I could do to help my home country, but I'm afraid I would be arrested on sight.",708651e09b44fa59ad2b6f592cad50df341d9c58,True,False,,,,,0,1647999701,,0,{},i1qpsbf,False,t3_tkazab,False,True,t1_i1pw8re,/r/UkraineConflict/comments/tkazab/well_russians_love_history_a_lot_so_maybe/i1qpsbf/,1647999718,1,True,True,False,UkraineConflict,t5_30oyx,r/UkraineConflict,public,,0,[],,1647970901.0,
[],False,,loveforallhumanity,,,[],,,,text,t2_kwoep2tl,False,False,"Considering their sources of non-state information are cut off and this is all they're shown on the TV - what do you expect? My friend went protesting in Moscow 2 weeks ago and got 5 years in jail. Both my grandma and older brother said to not text them anything political because there's people going door to door checking phones and making sure there's support for the war. Russias best chance of toppling Putin got 9 more years in prison today. It's not as black and white as you're painting it out to be. Yes - this war is completely fucked up and I'm 1100000% against it. Fuck Putin - that piece of shit. But, you have to understand how terrified regular Russians are to do anything for fear of being purged.",875baa16c3e99a417ee8d40cdb91d28144ebf471,True,False,,,,,0,1647999647,,0,{},i1qpo12,False,t3_tkazab,False,True,t1_i1pp9jq,/r/UkraineConflict/comments/tkazab/well_russians_love_history_a_lot_so_maybe/i1qpo12/,1647999664,1,True,True,False,UkraineConflict,t5_30oyx,r/UkraineConflict,public,,0,[],,1647970847.0,
[],False,,loveforallhumanity,,,[],,,,text,t2_kwoep2tl,False,False,"Considering their sources of non-state information are cut off and this is all they're shown on the TV - what do you expect? My friend went protesting in Moscow 2 weeks ago and got 5 years in jail. Both my grandma and older brother said to not text them anything political because there's people going door to door checking phones and making sure there's support for the war. Russias best chance of toppling Putin got 9 more years in prison today. It's not as black and white as you're painting it out to be. Yes - this war is completely fucked up and I'm 1100000% against it. Fuck Putin - that piece of shit. But, you have to understand how terrified regular Russians are to do anything for fear of being purged.",875baa16c3e99a417ee8d40cdb91d28144ebf471,True,False,,,,,0,1647999633,,0,{},i1qpmz6,False,t3_tkazab,False,True,t1_i1pkm3h,/r/UkraineConflict/comments/tkazab/well_russians_love_history_a_lot_so_maybe/i1qpmz6/,1647999649,1,True,True,False,UkraineConflict,t5_30oyx,r/UkraineConflict,public,,0,[],,1647970833.0,
[],False,,loveforallhumanity,,,[],,,,text,t2_kwoep2tl,False,False,There's a lot of Russians standing up against this madness.,79f6cf481f766ddfa56538f21e1ab567e7e4c4f7,True,False,,,,,0,1647999426,,0,{},i1qp6pp,False,t3_tkazab,False,True,t3_tkazab,/r/UkraineConflict/comments/tkazab/well_russians_love_history_a_lot_so_maybe/i1qp6pp/,1647999443,1,True,True,False,UkraineConflict,t5_30oyx,r/UkraineConflict,public,,0,[],,1647970626.0,
[],False,,kwagenknight,,,[],,,,text,t2_opzwo,False,False,Good question. My guess is maybe talking about the reports of Russian mobile anti air assets that the US is collecting to bring into Ukraine but Im not sure.,b51f4b838f9df47e83c3f0a72249382bf285b06f,True,False,,,,,0,1647999154,,0,{},i1qokv4,False,t3_tk8uju,False,True,t1_i1q1tfe,/r/UkraineConflict/comments/tk8uju/weapons_for_kyiv_america_send_weapons_to_the/i1qokv4/,1647999166,1,True,True,False,UkraineConflict,t5_30oyx,r/UkraineConflict,public,,0,[],,1647970354.0,
[],False,,LindaF144954,,,[],,,,text,t2_crmfkou7,False,False,U.S.,7a3239093dfb08794cb19c9384e0c48f9d0d5f0b,True,False,,,,,0,1647999055,,0,{},i1qoczl,False,t3_tk7122,False,True,t1_i1pzd7r,/r/UkraineConflict/comments/tk7122/right_but_of_course_putin_will_keep_going_moldova/i1qoczl/,1647999070,1,True,True,False,UkraineConflict,t5_30oyx,r/UkraineConflict,public,,0,[],,1647970255.0,
[],False,,PaulJames333,,,[],,,,text,t2_4tdg6mnv,False,False,"The racists on the right, yes, but not every right wing person is racist. Many on the right still hate Russia.",049d994cbbfd85b59b0eeeda92f5c61d5cc5e24a,True,False,,,,,0,1647998920,,0,{},i1qo2eq,False,t3_tk57tb,False,False,t1_i1qfg24,/r/UkraineConflict/comments/tk57tb/members_of_russian_policital_party_ldpr_announced/i1qo2eq/,1647998939,1,True,True,False,UkraineConflict,t5_30oyx,r/UkraineConflict,public,,0,[],,1647970120.0,
[],False,,Podsly,,,[],,,,text,t2_26au0mcw,False,False,"Ahhh thank you. I had assumed the second was the same but from different vantage.

Also, i still couldn't really see the explosion on the first shot - too blurry. I wonder where they got that image from.",c39a44c4b8bb7c95b51b481025f824039c127a9b,True,False,,,,,0,1647998659,,0,{},i1qnhxe,False,t3_tk7o8z,False,True,t1_i1qn39c,/r/UkraineConflict/comments/tk7o8z/russian_patrol_boat_taken_out_by_anti_tank/i1qnhxe/,1647998673,1,True,True,False,UkraineConflict,t5_30oyx,r/UkraineConflict,public,,0,[],,1647969859.0,
[],False,,marcus_lepricus,,,[],,,,text,t2_7ncro,False,False,They fired two missiles at two boats. First hit and second missed.,af1d05ae83b88bf82ee565a6815d6c757f1d7de5,True,False,,,,,0,1647998472,,0,{},i1qn39c,False,t3_tk7o8z,False,True,t1_i1qlv7o,/r/UkraineConflict/comments/tk7o8z/russian_patrol_boat_taken_out_by_anti_tank/i1qn39c/,1647998485,1,True,True,False,UkraineConflict,t5_30oyx,r/UkraineConflict,public,,0,[],,1647969672.0,
[],False,,robinsolent,,,[],,,,text,t2_1706fl,False,False,"Well, the horses were clearly Nazis!  To the bone, I say!  Thank Trotsky they were liberated from this mortal coil!

I just don't know how to cope anymore so I see it all as a Monty Python skit now....",4434867d149371fe9f6ec421d4d94bbc1212a805,True,False,,,,,0,1647998068,,0,{},i1qm6tj,False,t3_tk5r9q,False,True,t3_tk5r9q,/r/UkraineConflict/comments/tk5r9q/in_gostomel_russian_troops_destroyed_the/i1qm6tj/,1647998083,1,True,True,False,UkraineConflict,t5_30oyx,r/UkraineConflict,public,,0,[],,1647969268.0,
[],False,,kpapenbe,,,[],,,,text,t2_ixf7ljmz,False,False,"Very, very good call.  Not an eye for an eye situation at all--thank you for this.  

Though, there are striking historical similarities between taking (appropriating) what one considers rightfully his (Stalin and Putin?) and forcibly removing or coercing the population to leave....but at the end of the day you're right:  there are better ways to go about these things (and who can really ""right"" (write?) history)....",27a09554f23828f6c22c2f38dfe228e7c4b0a8e6,True,False,,,,,0,1647997940,,0,{},i1qlwm9,True,t3_tk7122,False,True,t1_i1qkd7k,/r/UkraineConflict/comments/tk7122/right_but_of_course_putin_will_keep_going_moldova/i1qlwm9/,1647997951,1,True,True,False,UkraineConflict,t5_30oyx,r/UkraineConflict,public,,0,[],,1647969140.0,
[],False,,Podsly,,,[],,,,text,t2_26au0mcw,False,False,"Huh?

Didn't he say Nyet Nyet at the end of the video - suggesting they didn't hit it? Also, in the video there is no scene where you can see that pictured in the thumbnail!",65eb4ca11fd0ab7145692a9fc2adecf639c78622,True,False,,,,,0,1647997923,,0,{},i1qlv7o,False,t3_tk7o8z,False,True,t3_tk7o8z,/r/UkraineConflict/comments/tk7o8z/russian_patrol_boat_taken_out_by_anti_tank/i1qlv7o/,1647997941,1,True,True,False,UkraineConflict,t5_30oyx,r/UkraineConflict,public,,0,[],,1647969123.0,
[],False,,eric_mason,,,[],,,,text,t2_krucait3,False,False,"Sadly, I know that.",4fa34f8f4e459941064e5f58a3b22c00efdf75da,True,False,,,,,0,1647997782,,0,{},i1qlk3t,False,t3_tji8n2,False,True,t1_i1nhwjk,/r/UkraineConflict/comments/tji8n2/moldovan_president_demands_immediate_withdrawal/i1qlk3t/,1647997798,1,True,True,False,UkraineConflict,t5_30oyx,r/UkraineConflict,public,,0,[],,1647968982.0,
[],False,,Ok_Shine7260,,,[],,,,text,t2_brvkx9mj,False,False,heard they going back home now lol,9dd99fed7edd42a2d5d4f50660920b5967affebb,True,False,,,,,0,1647997593,,0,{},i1ql54w,False,t3_tk7p45,False,True,t1_i1p0v4c,/r/UkraineConflict/comments/tk7p45/chechen_soldiers_dancing_before_going_into_battle/i1ql54w/,1647997609,1,True,True,False,UkraineConflict,t5_30oyx,r/UkraineConflict,public,,0,[],,1647968793.0,
[],False,,TimLeery,,,[],,,,text,t2_jpagr43n,False,False,Pour it on  Ukraine !!!,b566b8a089788303404844bfe7afac32366968bd,True,False,,,,,0,1647997503,,0,{},i1qky5m,False,t3_tfn3u1,False,True,t3_tfn3u1,/r/UkraineConflict/comments/tfn3u1/ukrainian_artillery_in_action/i1qky5m/,1647997519,1,True,True,False,UkraineConflict,t5_30oyx,r/UkraineConflict,public,,0,[],,1647968703.0,
[],False,,Nickblove,,,[],,,,text,t2_obho8,False,False,If English isn’t your first language then it’s ok.I kind of do get what your trying to say.,4bf8c26091408e6dbd58becf64888ca62cac2dad,True,False,,,,,0,1647997413,,0,{},i1qkqyn,False,t3_tji8n2,False,True,t1_i1owzvb,/r/UkraineConflict/comments/tji8n2/moldovan_president_demands_immediate_withdrawal/i1qkqyn/,1647997428,1,True,True,False,UkraineConflict,t5_30oyx,r/UkraineConflict,public,,0,[],,1647968613.0,
[],False,,kpapenbe,,,[],,,,text,t2_ixf7ljmz,False,False,"I know.....I feel responsible because they keep opening the aperture on what qualifies as a millennial and, so, I think it is 80% of the world's population at this point HA!",7194d0f2293390e2f9e0e8b4eec42532d0b2839a,True,False,,,,,0,1647997307,,0,{},i1qkihd,True,t3_tk7122,False,True,t1_i1q96fa,/r/UkraineConflict/comments/tk7122/right_but_of_course_putin_will_keep_going_moldova/i1qkihd/,1647997324,1,True,True,False,UkraineConflict,t5_30oyx,r/UkraineConflict,public,,0,[],,1647968507.0,
[],False,,Podsly,,,[],,,,text,t2_26au0mcw,False,False,"Absolutely not. 

This may be a landgrab for putin, but that doesn't mean we need to act in the same way. Democracies don't land grab, we free people.

Do people in Kalangrad want to be under Russian order? If so, who are we to interfeer.",43524eed5ea80f415bbaf38442c22d7707f5665d,True,False,,,,,0,1647997241,,0,{},i1qkd7k,False,t3_tk7122,False,True,t3_tk7122,/r/UkraineConflict/comments/tk7122/right_but_of_course_putin_will_keep_going_moldova/i1qkd7k/,1647997256,1,True,True,False,UkraineConflict,t5_30oyx,r/UkraineConflict,public,,0,[],,1647968441.0,
[],False,,SlimReaper85,,,[],,,,text,t2_sd7mgy,False,False,I KNEW IT!!!🤬,4c14cbfeb2f409a27eef16aa9d2f3026a10e8586,True,False,,,,,0,1647997104,,0,{},i1qk28q,False,t3_tk57tb,False,True,t1_i1o5xfg,/r/UkraineConflict/comments/tk57tb/members_of_russian_policital_party_ldpr_announced/i1qk28q/,1647997114,1,True,True,False,UkraineConflict,t5_30oyx,r/UkraineConflict,public,,0,[],,1647968304.0,
[],False,,xXbenadryl_mukbangXx,,,[],,,,text,t2_9cspyrpy,False,True,"It’s not unclear, theres clearly a Ukrainian soldier standing next to a young girl tied to a pole being humiliated. You want to find a way to justify a young girl being tied to a pole? There are more than plenty examples of the Ukrainian army humiliating POWs, you make me sick. Trying to justify what’s being done to a girl.",3690ebbb7598673d95b075025688e9a976473205,True,False,,,,,0,1647996990,,0,{},i1qjt80,False,t3_tk373m,False,True,t1_i1ojcgy,/r/UkraineConflict/comments/tk373m/its_a_child_ffs_lvov_volkssturm/i1qjt80/,1647997008,1,True,True,False,UkraineConflict,t5_30oyx,r/UkraineConflict,public,,0,[],,1647968190.0,
[],False,,Podsly,,,[],,,,text,t2_26au0mcw,False,False,"It's because of Trump. He said things like ""Putin is a great guy"" and ""we're great friends"" etc, people are now basically parroting sentiments of Trump. Trumpism is here to stay.",837823facd372cf9a067569f214fdb52b60d1c48,True,False,,,,,0,1647996970,,0,{},i1qjrkt,False,t3_tk57tb,False,True,t1_i1p9l26,/r/UkraineConflict/comments/tk57tb/members_of_russian_policital_party_ldpr_announced/i1qjrkt/,1647996982,1,True,True,False,UkraineConflict,t5_30oyx,r/UkraineConflict,public,,0,[],,1647968170.0,
[],False,,Podsly,,,[],,,,text,t2_26au0mcw,False,False,"Wow, they really know how to discredit themselves",6aff900960b3e8a938969e95b3849754e6b80616,True,False,,,,,0,1647996853,,0,{},i1qjidb,False,t3_tk57tb,False,True,t3_tk57tb,/r/UkraineConflict/comments/tk57tb/members_of_russian_policital_party_ldpr_announced/i1qjidb/,1647996869,1,True,True,False,UkraineConflict,t5_30oyx,r/UkraineConflict,public,,0,[],,1647968053.0,
[],False,,Icedanielization,,,[],,,,text,t2_b94pa,False,False,"Whilst true, lets not cast this as a shadow over Russia's invasion progress, it is gradually eating away at Ukraine despite all the success Ukraine has had thus far. The war is not over and it is not receding, it has been significantly slowed, but sadly the Russian river will flow hard and I fear the Ukrainians plus the current level of the Wests help will not build a dam fast enough; and that must be why Zelensky is wanting the no fly zone, it appears to be at the top of his list because he knows only with NATO involved will that muddy river stop flowing.",fe7aa7fafb459fc0059e0bdbd0a653001c5cfb05,True,False,,,,,0,1647996843,,0,{},i1qjhky,False,t3_tk37c0,False,True,t1_i1ns94o,/r/UkraineConflict/comments/tk37c0/why_cant_the_west_admit_that_ukraine_is_winning/i1qjhky/,1647996854,1,True,True,False,UkraineConflict,t5_30oyx,r/UkraineConflict,public,,0,[],,1647968043.0,
[],False,,GreyFox-AFCA,,,[],,,,text,t2_5p625avf,False,False,"I played this game like a maniac back in the day.
Great memories, simpler times.",863a05f4bacef289813fb834b045a2274e08a06c,True,False,,,,,0,1647996828,,0,{},i1qjge8,False,t3_tk2twx,False,True,t3_tk2twx,/r/UkraineConflict/comments/tk2twx/someone_made_a_nice_montage_of_the_war/i1qjge8/,1647996840,1,True,True,False,UkraineConflict,t5_30oyx,r/UkraineConflict,public,,0,[],,1647968028.0,
[],False,,it__wasnt__me__,,,[],,,,text,t2_d3u10l4e,False,False,"Sorry didn't realize your idea of decency was advocating for genocide. 
Again,who farmed your dinner? Who made your clothes?
How many Asian kids were poorly treated while making your computer or your phone?",01ee50deec239e3e2e2d05ab30b72159a5564ed6,True,False,,,,,0,1647996631,,0,{},i1qj0vh,False,t3_tkcvix,False,False,t1_i1qikdu,/r/UkraineConflict/comments/tkcvix/renault_car_brand_supports_russia_and_the_war/i1qj0vh/,1647996645,1,True,True,False,UkraineConflict,t5_30oyx,r/UkraineConflict,public,,0,[],,1647967831.0,
[],False,,jpcostach,,,[],,,,text,t2_5i2c8398,False,False,"My car is Swedis, not this French piece of crap. Russia must die in isolation from the west.",6bf6a8d19b2e0f2fe5b9839a0bd768b5a69cf453,True,False,,,,,0,1647996423,,0,{},i1qikdu,True,t3_tkcvix,False,True,t1_i1prloz,/r/UkraineConflict/comments/tkcvix/renault_car_brand_supports_russia_and_the_war/i1qikdu/,1647996434,1,True,True,False,UkraineConflict,t5_30oyx,r/UkraineConflict,public,,0,[],,1647967623.0,
[],False,,kwagenknight,,,[],,,,text,t2_opzwo,False,False,"Always look at the user flair to judge the posters agenda as we try to keep up with who is a diehard propagandist for either side.

This happened, so we don't want to remove it, but you are 1000% correct; we have no idea of any context.

 Also, imagine you are in a warzone where the invading army indiscriminately bombs and shells cities and you have looters and other lawbreakers. To keep public safety at a level bareable they are shaming people rather than putting them in jail indefinitely (no courts available) where they would have to be fed and cared for their safety that they cant be sure of because of the indiscriminate bombing, shelling and all around murder of civilians.

It may not be the most humane thing but it sure is more humane than locking them up without trial and possibly leading to their death for looting.",8848ec546b61ec7a4e122bfc0c1287e5fc70c919,True,False,,,,,0,1647996246,,0,{},i1qi67f,False,t3_tk373m,False,True,t1_i1nrpgk,/r/UkraineConflict/comments/tk373m/its_a_child_ffs_lvov_volkssturm/i1qi67f/,1647996260,1,True,True,False,UkraineConflict,t5_30oyx,r/UkraineConflict,public,,0,[],,1647967446.0,
[],False,,Bandido-Joe,,,[],,,,text,t2_o3q3u1g,False,False,Name one world leader that has ever presented themselves to The Hague and been even tried for a war crime. If your talking a head of state.,7905f82a04acd42f9b4b41de48e46d123f45b6c9,True,False,,,,,0,1647995911,,0,{},i1qhffi,False,t3_tk62do,False,True,t3_tk62do,/r/UkraineConflict/comments/tk62do/can_ukraine_negotiate_with_a_war_criminal_as/i1qhffi/,1647995924,1,True,True,False,UkraineConflict,t5_30oyx,r/UkraineConflict,public,,0,[],,1647967111.0,
[],False,,GreyFox-AFCA,,,[],,,,text,t2_5p625avf,False,False,"Is this the correct translation?
Because if it is, these guys are total nutjobs.",dfc15996bcd5eb5a487e7f2133fa7dd351bba7ac,True,False,,,,,0,1647995803,,0,{},i1qh6qx,False,t3_tkhjw1,False,True,t3_tkhjw1,/r/UkraineConflict/comments/tkhjw1/insane_russian_tv_journalist_threatens_europe/i1qh6qx/,1647995817,1,True,True,False,UkraineConflict,t5_30oyx,r/UkraineConflict,public,,0,[],,1647967003.0,
[],False,,RationalRobot,,,[],,,,text,t2_7935u,False,False,Running out of ideas already.,b947e33a2bbc5295bd23b9469c8b585bb441f8a7,True,False,,,,,0,1647995692,,0,{},i1qgxyp,False,t3_tk57tb,False,True,t3_tk57tb,/r/UkraineConflict/comments/tk57tb/members_of_russian_policital_party_ldpr_announced/i1qgxyp/,1647995708,1,True,True,False,UkraineConflict,t5_30oyx,r/UkraineConflict,public,,0,[],,1647966892.0,
[],False,,kwagenknight,,,[],,,,text,t2_opzwo,False,False,"This is your warning, stop spreading misinformation or propaganda as its in too many comments.",a19547862b99809586f0b4bb1dbb1a827b23bde6,True,False,,,,,0,1647995585,moderator,0,{},i1qgph2,False,t3_tk373m,False,True,t1_i1pfbv3,/r/UkraineConflict/comments/tk373m/its_a_child_ffs_lvov_volkssturm/i1qgph2/,1647995601,1,True,True,False,UkraineConflict,t5_30oyx,r/UkraineConflict,public,,0,[],,1647966785.0,
[],False,,kwagenknight,,,[],,,,text,t2_opzwo,False,False,A few prisoners who would die because they would be locked up vs at least 30+% of the Russian army being criminals and conscripts is a small number vs the rapist and murderes being paid for by Putin.,c68c2aad5c4179a260468ba79e29d159b81a6ed9,True,False,,,,,0,1647995529,,0,{},i1qgkyn,False,t3_tk373m,False,True,t1_i1nvbgi,/r/UkraineConflict/comments/tk373m/its_a_child_ffs_lvov_volkssturm/i1qgkyn/,1647995543,1,True,True,False,UkraineConflict,t5_30oyx,r/UkraineConflict,public,,0,[],,1647966729.0,
[],False,,heatrealist,,,[],,,,text,t2_17z95qpe,False,False,He got banned for laughing about what a taxi driver in dubai said I guess.,20a7032434ffb6b5f650e5f57335c9a478e000aa,True,False,,,,,0,1647995459,,0,{},i1qgfb6,False,t3_tjyqxc,False,True,t1_i1nsvn8,/r/UkraineConflict/comments/tjyqxc/russian_grandmaster_who_joked_about_the_war_on/i1qgfb6/,1647995472,1,True,True,False,UkraineConflict,t5_30oyx,r/UkraineConflict,public,,0,[],,1647966659.0,
[],False,,CFlower240,,,[],,,,text,t2_ir38updv,False,False,Amen brother,f97f6d276400b95de7cdad02bf032ac8ab5b2c14,True,False,,,,,0,1647995409,,0,{},i1qgbb7,True,t3_tkh5fw,False,True,t1_i1qezxd,/r/UkraineConflict/comments/tkh5fw/russian_soldiers_head_completely_blown_off_from/i1qgbb7/,1647995420,1,True,True,False,UkraineConflict,t5_30oyx,r/UkraineConflict,public,,0,[],,1647966609.0,
[],False,,kwagenknight,,,[],,,,text,t2_opzwo,False,False,The problem is there isnt many Ukranians that think like him. Theyre usually Russians who are either paid to relocate to those break away areas or bused in to provide work and housing. Then they are considered part of the area and can vote how Putin wants. Others just like sucking Putins lil ole dick and stan for him from afar. You also have a few in those areas that dont have anywhere else to go for various reasons so they stay but just want this invasion over.,feab1dbab5257b327c0ed3b6c783705deb8c6874,True,False,,,,,0,1647995325,,0,{},i1qg4lg,False,t3_tk5sz6,False,True,t1_i1q89xd,/r/UkraineConflict/comments/tk5sz6/kharkov_resident_gives_first_hand_account_on_azov/i1qg4lg/,1647995340,1,True,True,False,UkraineConflict,t5_30oyx,r/UkraineConflict,public,,0,[],,1647966525.0,
