Unnamed: 0,all_awardings,archived,associated_award,author,author_flair_background_color,author_flair_css_class,author_flair_richtext,author_flair_template_id,author_flair_text,author_flair_text_color,author_flair_type,author_fullname,author_patreon_flair,author_premium,body,body_sha1,can_gild,collapsed,collapsed_because_crowd_control,collapsed_reason,collapsed_reason_code,comment_type,controversiality,created_utc,distinguished,gilded,gildings,id,is_submitter,link_id,locked,no_follow,parent_id,permalink,retrieved_utc,score,score_hidden,send_replies,stickied,subreddit,subreddit_id,subreddit_name_prefixed,subreddit_type,top_awarded_type,total_awards_received,treatment_tags,unrepliable_reason,created,author_cakeday,edited,editable,media_metadata
,[],False,,RayGRVTY,,,[],,,,text,t2_1m2n2elh,False,False,Russian covert reddit operator?,436fe50b0c6d6705b0fa26fac0b5ebb5b4007962,True,False,,,,,0,1648718659,,0,{},i2tsacq,False,t3_tsc3hq,False,False,t1_i2r5xw8,/r/war/comments/tsc3hq/hello_i_am_an_ordinary_resident_of_mariupol_at/i2tsacq/,1648718672,1,True,True,False,war,t5_2qhk8,r/war,public,,0,[],,1648689859.0,,,,
,[],False,,Accomplished_Ad_828,,,[],,,,text,t2_8pro6t69,False,False,"Do I see correctly that the last rocket fired but didnt leave ""the pipe""?",73bbfc18ab20a73b6be5e8fdf9101500b8d7cdd7,True,False,,,,,0,1648718600,,0,{},i2ts7w3,False,t3_tsl4hg,False,True,t3_tsl4hg,/r/war/comments/tsl4hg/chechens_laying_down_a_rocket_barrage_on_a/i2ts7w3/,1648718618,1,True,True,False,war,t5_2qhk8,r/war,public,,0,[],,1648689800.0,,,,
,[],False,,gsrmn,,,[],,,,text,t2_8m8qg,False,False,These guys are so bored just standing around the have time to shoot at the street  lights..,8ab11bf67da20f426ea394f3169d381dcc2846e4,True,False,,,,,0,1648718205,,0,{},i2trrae,False,t3_tssy9v,False,True,t3_tssy9v,/r/war/comments/tssy9v/kadyrov_occupiers_spotted_traffic_lights_for_the/i2trrae/,1648718218,1,True,True,False,war,t5_2qhk8,r/war,public,,0,[],,1648689405.0,,,,
,[],False,,Local-Zone-6723,,,[],,,,text,t2_9wbh3zjc,False,False,Maybe a donated combat uniform,e4a8f63761b6f4bfee15bc43173da641c8eca867,True,False,,,,,0,1648718105,,0,{},i2trn8y,False,t3_ts3hx6,False,True,t1_i2spjxm,/r/war/comments/ts3hx6/cats_also_love_ukrainian_army/i2trn8y/,1648718126,1,True,True,False,war,t5_2qhk8,r/war,public,,0,[],,1648689305.0,,,,
,[],False,,Faraya97,,,[],,,,text,t2_ijbfodkm,False,False,What are you talking about then? Explain,216fc1fe5d6d213ed4e15b94be7f782f8c0eb869,True,False,,,,,0,1648718066,,0,{},i2trlpl,True,t3_ts6dmp,False,True,t1_i2tqowd,/r/war/comments/ts6dmp/why_the_west_got_rid_of_gadaffi/i2trlpl/,1648718084,1,True,True,False,war,t5_2qhk8,r/war,public,,0,[],,1648689266.0,,,,
,[],False,,GREATD4NNY,,,[],,,,text,t2_7i07oyg5,False,False,Sometimes traffic lights suck. So they are putting all their anger from previous years rn,06f989ef1dfcacb986b930b239f0c569e8449227,True,False,,,,,0,1648717611,,0,{},i2tr348,False,t3_tssy9v,False,True,t3_tssy9v,/r/war/comments/tssy9v/kadyrov_occupiers_spotted_traffic_lights_for_the/i2tr348/,1648717623,1,True,True,False,war,t5_2qhk8,r/war,public,,0,[],,1648688811.0,,,,
,[],False,,Axel_Voss279,,,[],,,,text,t2_k24v6zww,False,False,"They already have a land corridor, one of the first things they did was build a bridge.",9e1ebdeeb57dad89a856944c9558941d889e5156,True,False,,,,,0,1648717470,,0,{},i2tqxdi,False,t3_tsk0yx,False,True,t1_i2s0fs3,/r/war/comments/tsk0yx/will_russia_lose/i2tqxdi/,1648717485,1,True,True,False,war,t5_2qhk8,r/war,public,,0,[],,1648688670.0,,,,
,[],False,,-Deathstalker-,,,[],,,,text,t2_7zpvf773,False,False,Not talking about your shitpost.,6c9e9321e8ba8d17f345321534d44c3819a18d92,True,False,,,,,0,1648717270,,0,{},i2tqowd,False,t3_ts6dmp,False,True,t1_i2tqima,/r/war/comments/ts6dmp/why_the_west_got_rid_of_gadaffi/i2tqowd/,1648717281,1,True,True,False,war,t5_2qhk8,r/war,public,,0,[],,1648688470.0,,,,
,[],False,,Helpful-Tradition990,,,[],,,,text,t2_9yp98e2c,False,False,Target practice.,7fb44acea5b44dc39955ccc9603062fa26c4ba72,True,False,,,,,0,1648717233,,0,{},i2tqnb1,False,t3_tssy9v,False,True,t3_tssy9v,/r/war/comments/tssy9v/kadyrov_occupiers_spotted_traffic_lights_for_the/i2tqnb1/,1648717246,1,True,True,False,war,t5_2qhk8,r/war,public,,0,[],,1648688433.0,,,,
,[],False,,irespectcookies,,,[],,,,text,t2_i1fyqfwq,False,False,Hope they die slowly :),0c03078a47a380474e999a8f7756f69204e95408,True,False,,,,,0,1648717231,,0,{},i2tqn9h,False,t3_tsl4hg,False,True,t3_tsl4hg,/r/war/comments/tsl4hg/chechens_laying_down_a_rocket_barrage_on_a/i2tqn9h/,1648717246,1,True,True,False,war,t5_2qhk8,r/war,public,,0,[],,1648688431.0,,,,
,[],False,,Faraya97,,,[],,,,text,t2_ijbfodkm,False,False,How is this propaganda? Just because CNN doesn’t show it doesn’t mean it’s propaganda.,fc01c897c53f137f7b27a7e4abe77346a792d4fc,True,False,,,,,0,1648717117,,0,{},i2tqima,True,t3_ts6dmp,False,True,t1_i2tq2sb,/r/war/comments/ts6dmp/why_the_west_got_rid_of_gadaffi/i2tqima/,1648717131,1,True,True,False,war,t5_2qhk8,r/war,public,,0,[],,1648688317.0,,,,
,[],False,,woahnicecock-com,,,[],,,,text,t2_6yxz9980,False,False,"Not south sudan, says baghdad at the end of the video.",88d3d70ee519c6c6159122b7c474658dd9d71ef0,True,False,,,,,0,1648717036,,0,{},i2tqfbv,False,t3_ts3xy4,False,True,t1_i2rq0id,/r/war/comments/ts3xy4/us_soldier_gets_a_headshot_from_the_juba_sniper/i2tqfbv/,1648717051,1,True,True,False,war,t5_2qhk8,r/war,public,,0,[],,1648688236.0,,,,
,[],False,,OwlKing23,,,[],,,,text,t2_bmk5lwu,False,False,"Did the sanctions succeed in defeating Iran's nuclear program, or did Iran's nuclear program succeed in defeating American sanctions? Regardless, most of the world has had heavy sanctions on Iran since the revolution in '79 but they keep chugging along decade after decade. Living standards of the common people are the main victim of sanctions and the type of regimes we usually slap sanctions on aren't bothered too much by that.",6302b0bf2925186713b08a92e823c46d6dc4071d,True,False,,,,,0,1648716942,,0,{},i2tqbfo,False,t3_tsk0yx,False,True,t1_i2tpwwj,/r/war/comments/tsk0yx/will_russia_lose/i2tqbfo/,1648716962,1,True,True,False,war,t5_2qhk8,r/war,public,,0,[],,1648688142.0,,,,
,[],False,,Sockrockit93,,,[],,,,text,t2_gtlg8gu1,False,False,"Fine, trinkets then.",68cac25caf7a2c015aa77204d408c80f809fe108,True,False,,,,,0,1648716794,,0,{},i2tq5f5,False,t3_tsa49p,False,True,t1_i2tq3es,/r/war/comments/tsa49p/mariupol_maternity_hospital_forcibly_evacuated_to/i2tq5f5/,1648716810,1,True,True,False,war,t5_2qhk8,r/war,public,,0,[],,1648687994.0,,,,
,[],False,,redmadrat,,,[],,,,text,t2_kl0cmomy,False,False,"But if they attack, they don't need hostages, do they?",656fdd8169d925b6b6197c0847ac09f29f53cbef,True,False,,,,,0,1648716743,,0,{},i2tq3es,False,t3_tsa49p,False,True,t1_i2tpyki,/r/war/comments/tsa49p/mariupol_maternity_hospital_forcibly_evacuated_to/i2tq3es/,1648716755,1,True,True,False,war,t5_2qhk8,r/war,public,,0,[],,1648687943.0,,,,
,[],False,,-Deathstalker-,,,[],,,,text,t2_7zpvf773,False,False,Its mandatory when we are facing ridiculous amounts of propaganda. You cant just vomit hate and expect ppl to blindly accept it.,77334036ae7a00f8ed1d21e3590a41e2886ffb9b,True,False,,,,,0,1648716727,,0,{},i2tq2sb,False,t3_ts6dmp,False,True,t1_i2tpsyu,/r/war/comments/ts6dmp/why_the_west_got_rid_of_gadaffi/i2tq2sb/,1648716744,1,True,True,False,war,t5_2qhk8,r/war,public,,0,[],,1648687927.0,,,,
,[],False,,Sockrockit93,,,[],,,,text,t2_gtlg8gu1,False,False,It's just special operations terminology. It translates to hostages.,592eee93e68e5a037e962a2a2bd9957aaac6ad90,True,False,,,,,0,1648716623,,0,{},i2tpyki,False,t3_tsa49p,False,True,t1_i2qh537,/r/war/comments/tsa49p/mariupol_maternity_hospital_forcibly_evacuated_to/i2tpyki/,1648716638,1,True,True,False,war,t5_2qhk8,r/war,public,,0,[],,1648687823.0,,,,
,[],False,,Ok_Canary3870,,,[],,,,text,t2_bv10o4er,False,False,Why else was Iran willing to make a deal - a deal that involved the lifting of sanctions,f5e8a52f0c19c9c95fcf6bac1bb3f780e0268d74,True,False,,,,,0,1648716582,,0,{},i2tpwwj,False,t3_tsk0yx,False,True,t1_i2tp15s,/r/war/comments/tsk0yx/will_russia_lose/i2tpwwj/,1648716603,1,True,True,False,war,t5_2qhk8,r/war,public,,0,[],,1648687782.0,,,,
,[],False,,Faraya97,,,[],,,,text,t2_ijbfodkm,False,False,Checking my comment history? You have too much time 😂,cbc601467f56e479ce2b5e3ac8d89283e5d4d6bc,True,False,,,,,0,1648716489,,0,{},i2tpsyu,True,t3_ts6dmp,False,True,t1_i2rpmwx,/r/war/comments/ts6dmp/why_the_west_got_rid_of_gadaffi/i2tpsyu/,1648716507,1,True,True,False,war,t5_2qhk8,r/war,public,,0,[],,1648687689.0,,,,
,[],False,,BunbunProch,,,[],,,,text,t2_4dwlt20k,False,False,IIRC ATGMs are hard to see when they are incoming because of the speed that they travel at,5841c000bddd19553c67b7a6a4d42c32a72c3cfc,True,False,,,,,0,1648715974,,0,{},i2tp860,False,t3_tshclo,False,True,t1_i2ru10q,/r/war/comments/tshclo/taking_out_a_ukrainian_machine_gun_nest_with_a/i2tp860/,1648715994,1,True,True,False,war,t5_2qhk8,r/war,public,,0,[],,1648687174.0,,,,
,[],False,,our_cut,#ea0027,,[],d2689012-a480-11ec-a36a-ee7ad68e049d,Verfied Russian,dark,text,t2_5ki3lr5n,False,False,People will just justify that Russia lost no matter what,2c72f34c7f4ff58cb447afca49029dc94056ee1e,True,False,,,,,0,1648715810,,0,{},i2tp1ix,False,t3_tsk0yx,False,True,t3_tsk0yx,/r/war/comments/tsk0yx/will_russia_lose/i2tp1ix/,1648715829,1,True,True,False,war,t5_2qhk8,r/war,public,,0,[],,1648687010.0,,,,
,[],False,,OwlKing23,,,[],,,,text,t2_bmk5lwu,False,False,"I'm trying to keep up but your mega brain is too swift for me, sorry. Are you claiming that sanctions succeeded because Iran was willing to make a deal?",fc981fdf6e25e01fbfa8388d15cf8f6c42d06beb,True,False,,,,,0,1648715801,,0,{},i2tp15s,False,t3_tsk0yx,False,True,t1_i2toxst,/r/war/comments/tsk0yx/will_russia_lose/i2tp15s/,1648715814,1,True,True,False,war,t5_2qhk8,r/war,public,,0,[],,1648687001.0,,,,
,[],False,,Asandena,,,[],,,,text,t2_4cfydpdf,False,False,In 2013?,ba15612716aaf6a2220c091b5f840b000cf130b5,True,False,,,,,0,1648715722,,0,{},i2toy1b,False,t3_tokdgv,False,True,t1_i2tllnq,/r/war/comments/tokdgv/ukraine_will_not_give_up_territory_as_the_price/i2toy1b/,1648715737,1,True,True,False,war,t5_2qhk8,r/war,public,,0,[],,1648686922.0,,,,
,[],False,,Ok_Canary3870,,,[],,,,text,t2_bv10o4er,False,False,That sanctions do work in the right circumstances. Keep up,1066158115620bb4e727adbe4da759430993d449,True,False,,,,,0,1648715716,,0,{},i2toxst,False,t3_tsk0yx,False,True,t1_i2towut,/r/war/comments/tsk0yx/will_russia_lose/i2toxst/,1648715730,1,True,True,False,war,t5_2qhk8,r/war,public,,0,[],,1648686916.0,,,,
,[],False,,OwlKing23,,,[],,,,text,t2_bmk5lwu,False,False,Not sure what point you're trying to make here,e1284cea4ceeae070055ba04e465ca6f7d2db195,True,False,,,,,0,1648715694,,0,{},i2towut,False,t3_tsk0yx,False,True,t1_i2tot6j,/r/war/comments/tsk0yx/will_russia_lose/i2towut/,1648715710,1,True,True,False,war,t5_2qhk8,r/war,public,,0,[],,1648686894.0,,,,
,[],False,,Ok_Canary3870,,,[],,,,text,t2_bv10o4er,False,False,Even though Iran went to the negotiating table and actually got a deal,022337f8f31a1715a1171543ea3c35236e6548fe,True,False,,,,,0,1648715606,,0,{},i2tot6j,False,t3_tsk0yx,False,True,t1_i2torwz,/r/war/comments/tsk0yx/will_russia_lose/i2tot6j/,1648715623,1,True,True,False,war,t5_2qhk8,r/war,public,,0,[],,1648686806.0,,,,
,[],False,,OwlKing23,,,[],,,,text,t2_bmk5lwu,False,False,"We have very different definitions of ""working"" then",3aa33ef3ffb765ec2395d31bc91d3432f5b3043e,True,False,,,,,0,1648715576,,0,{},i2torwz,False,t3_tsk0yx,False,False,t1_i2to5iq,/r/war/comments/tsk0yx/will_russia_lose/i2torwz/,1648715587,1,True,True,False,war,t5_2qhk8,r/war,public,,0,[],,1648686776.0,,,,
,[],False,,0km1,,,[],,,,text,t2_3vbf8p1y,False,False,You speak of the seperated territories as if they wanted to be apart of Ukraine,517b20480f045920abbd1cc837e179e6e287cde2,True,False,,,,,0,1648715342,,0,{},i2toid8,False,t3_tsk0yx,False,True,t1_i2sir4x,/r/war/comments/tsk0yx/will_russia_lose/i2toid8/,1648715372,1,True,True,False,war,t5_2qhk8,r/war,public,,0,[],,1648686542.0,,,,
,[],False,,Ok_Canary3870,,,[],,,,text,t2_bv10o4er,False,False,Conveniently at a time that they’re on the counter-offensive again,1055db5b84a65fdf483f8f73b7ac7eaaf2c9b127,True,False,,,,,0,1648715167,,0,{},i2tob6v,False,t3_tsk0yx,False,True,t1_i2to96r,/r/war/comments/tsk0yx/will_russia_lose/i2tob6v/,1648715184,1,True,True,False,war,t5_2qhk8,r/war,public,,0,[],,1648686367.0,,,,
,[],False,,35tentacles,,,[],,,,text,t2_i6ifs44a,False,False,"They only stopped asking after a good portion of ""no""s",f8891e8124933ec42b86444c3f098b8d443b74ce,True,False,,,,,0,1648715116,,0,{},i2to96r,False,t3_tsk0yx,False,True,t1_i2tnro5,/r/war/comments/tsk0yx/will_russia_lose/i2to96r/,1648715130,1,True,True,False,war,t5_2qhk8,r/war,public,,0,[],,1648686316.0,,,,
,[],False,,Ok_Canary3870,,,[],,,,text,t2_bv10o4er,False,False,On the contrary this sub is full of whataboutisms. It’s not really a both sides issue here,f9acb82eae133a23cac86c80ffa09aeff1347304,True,False,,,,,0,1648715061,,0,{},i2to703,False,t3_tsk0yx,False,True,t1_i2szn5d,/r/war/comments/tsk0yx/will_russia_lose/i2to703/,1648715073,1,True,True,False,war,t5_2qhk8,r/war,public,,0,[],,1648686261.0,,,,
,[],False,,Ok_Canary3870,,,[],,,,text,t2_bv10o4er,False,False,It worked on Iran until 2015,1639f1884244c949d1ce5c8764c002f5648b7530,True,False,,,,,0,1648715025,,0,{},i2to5iq,False,t3_tsk0yx,False,True,t1_i2sqo6o,/r/war/comments/tsk0yx/will_russia_lose/i2to5iq/,1648715039,1,True,True,False,war,t5_2qhk8,r/war,public,,0,[],,1648686225.0,,,,
,[],False,,Ok_Canary3870,,,[],,,,text,t2_bv10o4er,False,False,They had a lot more puppet states when they were losing in Afghanistan as well as way more territory that helped it be self sufficient somewhat. Russia’s economy today is pathetic without any sanctions,3f00b0a870279d41551894090474322ba32dc8b6,True,False,,,,,0,1648714938,,0,{},i2to207,False,t3_tsk0yx,False,True,t1_i2tarsv,/r/war/comments/tsk0yx/will_russia_lose/i2to207/,1648714959,1,True,True,False,war,t5_2qhk8,r/war,public,,0,[],,1648686138.0,,,,
,[],False,,lockyourdoor24,,,[],,,,text,t2_j0dt9,False,False,Dead,9f8a73ef1399d06aed0e56075cf200d4f5eed2af,True,False,,,,,0,1648714844,,0,{},i2tny8x,False,t3_trkfe7,False,True,t1_i2pzhp5,/r/war/comments/trkfe7/three_hypothetical_scenarios_for_a_russian/i2tny8x/,1648714859,1,True,True,False,war,t5_2qhk8,r/war,public,,0,[],,1648686044.0,,,,
,[],False,,Ok_Canary3870,,,[],,,,text,t2_bv10o4er,False,False,Since Ukraine has been able to make counter-advances there’s been a lot less asking for things like no-fly-zones. The Russians are already having to change their strategy,c8f1325a94079e22450ac2af28cdf1ca7bce3709,True,False,,,,,0,1648714693,,0,{},i2tnro5,False,t3_tsk0yx,False,True,t1_i2tl2q3,/r/war/comments/tsk0yx/will_russia_lose/i2tnro5/,1648714709,1,True,True,False,war,t5_2qhk8,r/war,public,,0,[],,1648685893.0,,,,
,[],False,,Kandusha,,,[],,,,text,t2_k6lmjv6g,False,False,But yes he was not a good man for sure. Like bush was not a good man. And many others. There is always the right of the people to overthrow there government ( but they also have to life with the consequences) but in many cases the driven power comes from outside and supports a group that is the minority.. and who is ready to kill.,c4569e27b6270ea2805557adc91ae2cf732a3480,True,False,,,,,0,1648714513,,0,{},i2tnkdh,False,t3_ts6dmp,False,True,t1_i2tnb6l,/r/war/comments/ts6dmp/why_the_west_got_rid_of_gadaffi/i2tnkdh/,1648714530,1,True,True,False,war,t5_2qhk8,r/war,public,,0,[],,1648685713.0,,,,
,[],False,,Kandusha,,,[],,,,text,t2_k6lmjv6g,False,False,"All you folks are much to emotional. That the west attracted Libya and financed the “rebels” has absolutely nothing to do with what he was doing or not. And there is always a easy answer to all the “ he was a criminal blablabla” how was people living, how was the economy, how was the infrastructure and so on before the USA delivered “freedom”? And how is it now ?  Ah yes… did. so much better for the people. Same in all other countries where the USA delivered peace and democracy.",20a2118b21452e31319925565a6baa142ea7b9d9,True,False,,,,,0,1648714288,,0,{},i2tnb6l,False,t3_ts6dmp,False,True,t3_ts6dmp,/r/war/comments/ts6dmp/why_the_west_got_rid_of_gadaffi/i2tnb6l/,1648714301,1,True,True,False,war,t5_2qhk8,r/war,public,,0,[],,1648685488.0,,,,
,[],False,,Ok_Professional2346,,,[],,,,text,t2_l4t3j4sr,False,False,"Thats Mr. Lancaster, a great imposter working for the FSB on disinformation für the Orks. I hope he will find his destiny in Mariupol....",b13b9ec6b3b37b44f676528dfe76049faa9f2a30,True,False,,,,,0,1648713714,,0,{},i2tmnaa,False,t3_tsro8g,False,True,t3_tsro8g,/r/war/comments/tsro8g/mariupol_interview_with_people/i2tmnaa/,1648713729,1,True,True,False,war,t5_2qhk8,r/war,public,,0,[],,1648684914.0,,,,
,[],False,,[deleted],,,,,,dark,,,,,[removed],fe993932d6dced4c0a879e9aa5d7a6e0fbb467f5,True,True,,,DELETED,,0,1648713419,,0,{},i2tmazq,False,t3_tssy9v,False,True,t3_tssy9v,/r/war/comments/tssy9v/kadyrov_occupiers_spotted_traffic_lights_for_the/i2tmazq/,1648713433,1,True,True,False,war,t5_2qhk8,r/war,public,,0,[],,1648684619.0,,,,
,[],False,,35tentacles,,,[],,,,text,t2_i6ifs44a,False,False,"True, but in fact only as long as the current government is alive

All of what 90% of people there want is peace in whatever form, I assure you",ff93d72124e23f91862963cab1fedd77ef7647ff,True,False,,,,,0,1648713112,,0,{},i2tly64,False,t3_tsk0yx,False,True,t1_i2rsmqg,/r/war/comments/tsk0yx/will_russia_lose/i2tly64/,1648713130,1,True,True,False,war,t5_2qhk8,r/war,public,,0,[],,1648684312.0,,,,
,[],False,,TheWitac,,,[],,,,text,t2_bocrmv0h,False,False,What are you talking about? Crimea was a autonomous state. Not a Ukranian land.,967f695d961af5f965c0d4eca1c74f7feedbb86c,True,False,,,,,0,1648712818,,0,{},i2tllnq,False,t3_tokdgv,False,True,t1_i2tk537,/r/war/comments/tokdgv/ukraine_will_not_give_up_territory_as_the_price/i2tllnq/,1648712834,1,True,True,False,war,t5_2qhk8,r/war,public,,0,[],,1648684018.0,,,,
,[],False,,TheWitac,,,[],,,,text,t2_bocrmv0h,False,False,"Past imperialism makes one's country great if you were one of the longest living and one of the biggest empires and still has the power to do shit. Why aren't you telling where are you from? Are you shamed of it? We have shit tons of military power and a power to invade other countries and change the balance in our region. I'm not glorifiying it, i'm telling you we are not a small village country like yours.",91c7ef3aed6f5caed57198c29b83c2d33df588d4,True,False,,,,,0,1648712732,,0,{},i2tli4b,False,t3_tnxc9a,False,True,t1_i2t50ec,/r/war/comments/tnxc9a/ukrainian_serviceman_makes_a_videocall_to_mock/i2tli4b/,1648712747,1,True,True,False,war,t5_2qhk8,r/war,public,,0,[],,1648683932.0,,,,
,[],False,,OwlKing23,,,[],,,,text,t2_bmk5lwu,False,False,Good luck with that man. Hope you're correct but I doubt it,5c52ddfdf4d672d1fc1455c6d6e0d02c29165d54,True,False,,,,,0,1648712512,,0,{},i2tl8vx,False,t3_tsk0yx,False,True,t1_i2t8rmo,/r/war/comments/tsk0yx/will_russia_lose/i2tl8vx/,1648712528,1,True,True,False,war,t5_2qhk8,r/war,public,,0,[],,1648683712.0,,,,
,[],False,,35tentacles,,,[],,,,text,t2_i6ifs44a,False,False,"Well, I don't  want to say that you're wrong, but the forces Russians prepared for the invasion are only 10-20% of their whole military potential and they have been in fact advancing all this time, while Ukraine keeps asking for military help. This fact alone makes me doubt the assumption that Russia is loosing with the majority of my resources being western media.",ac3f46f4238b69de4bc8350367d351a1adc00270,True,False,,,,,0,1648712368,,0,{},i2tl2q3,False,t3_tsk0yx,False,True,t1_i2sjttv,/r/war/comments/tsk0yx/will_russia_lose/i2tl2q3/,1648712385,1,True,True,False,war,t5_2qhk8,r/war,public,,0,[],,1648683568.0,,,,
,[],False,,ZgnilekZasmiecacz,,,[],,,,text,t2_9eu6fxpy,False,False,F russia! they will never forget what you did,69d373e0530f63fa7b1440045fe93706b2b67a1a,True,False,,,,,0,1648711875,,0,{},i2tki7m,False,t3_ts4vjs,False,True,t3_ts4vjs,/r/war/comments/ts4vjs/this_is_mariupol_just_to_put_things_into/i2tki7m/,1648711887,1,True,True,False,war,t5_2qhk8,r/war,public,,0,[],,1648683075.0,,,,
,[],False,,[deleted],,,,,,dark,,,,,[removed],fe993932d6dced4c0a879e9aa5d7a6e0fbb467f5,True,True,,,DELETED,,0,1648711601,,0,{},i2tk6lx,False,t3_tsk0yx,False,True,t3_tsk0yx,/r/war/comments/tsk0yx/will_russia_lose/i2tk6lx/,1648711615,1,True,True,False,war,t5_2qhk8,r/war,public,,0,[],,1648682801.0,,,,
,[],False,,Asandena,,,[],,,,text,t2_4cfydpdf,False,False,"Bro Crimea was part of Ukraine. Russia annexed Crimea, if you can’t base your arguments around logic, than there is no point in arguing with you.",ba36986b151159ca52a77085466d30a15e5009b5,True,False,,,,,0,1648711566,,0,{},i2tk537,False,t3_tokdgv,False,True,t1_i2sw57d,/r/war/comments/tokdgv/ukraine_will_not_give_up_territory_as_the_price/i2tk537/,1648711585,1,True,True,False,war,t5_2qhk8,r/war,public,,0,[],,1648682766.0,,,,
,[],False,,Regular-Evidence-929,,,[],,,,text,t2_gqivjt00,False,False,I feel like doing this at every red light that last longer than 30 seconds,e372956d1cedcab4da6103f7955b4e183bb9aafb,True,False,,,,,0,1648711021,,0,{},i2tjhnt,False,t3_tssy9v,False,True,t3_tssy9v,/r/war/comments/tssy9v/kadyrov_occupiers_spotted_traffic_lights_for_the/i2tjhnt/,1648711038,1,True,True,False,war,t5_2qhk8,r/war,public,,0,[],,1648682221.0,,,,
,[],False,,Helpful-Tradition990,,,[],,,,text,t2_9yp98e2c,False,False,I defend Gaddafi because life under him was better then the Libya today,46f309f701ec0738c368ea2ad53f4c3ca513f36b,True,False,,,,,0,1648710993,,0,{},i2tjgfu,False,t3_ts6dmp,False,False,t1_i2rkpu9,/r/war/comments/ts6dmp/why_the_west_got_rid_of_gadaffi/i2tjgfu/,1648711004,1,True,True,False,war,t5_2qhk8,r/war,public,,0,[],,1648682193.0,,,,
,[],False,,marcueu,,,[],,,,text,t2_2sptnsqn,False,False,u/savevideobot,f195b0d1f5ce50b9b3e9029a442e58db08d61512,True,False,,,,,0,1648710662,,0,{},i2tj206,False,t3_tscls1,False,True,t3_tscls1,/r/war/comments/tscls1/like_he_said_welcome_to_ukraine_ukrainian/i2tj206/,1648710682,1,True,True,False,war,t5_2qhk8,r/war,public,,0,[],,1648681862.0,,,,
,[],False,,Helpful-Tradition990,,,[],,,,text,t2_9yp98e2c,False,False,All the military and diplomatic experts in comments sure are something to behold.,837a4f4207914b8f1a5b984035e7611d15029b7b,True,False,,,,,0,1648710606,,0,{},i2tizjz,False,t3_tsk0yx,False,True,t3_tsk0yx,/r/war/comments/tsk0yx/will_russia_lose/i2tizjz/,1648710620,1,True,True,False,war,t5_2qhk8,r/war,public,,0,[],,1648681806.0,,,,
,[],False,,599Ninja,,,[],,,,text,t2_64fd20fi,False,False,Finally getting payback for all those reds,38db8b9439f48286bb1dde197a2916693bb2a514,True,False,,,,,0,1648710443,,0,{},i2tisdl,False,t3_tssy9v,False,True,t3_tssy9v,/r/war/comments/tssy9v/kadyrov_occupiers_spotted_traffic_lights_for_the/i2tisdl/,1648710459,1,True,True,False,war,t5_2qhk8,r/war,public,,0,[],,1648681643.0,,,,
,[],False,,lightwell,,,[],,,,text,t2_awrjy,False,False,"I live in a time, a time when war videos are posted to tiktok.",a12565422bbc4230a67ee77156758ae7826c8246,True,False,,,,,0,1648710308,,0,{},i2timfj,False,t3_tscls1,False,True,t1_i2sn2p8,/r/war/comments/tscls1/like_he_said_welcome_to_ukraine_ukrainian/i2timfj/,1648710321,1,True,True,False,war,t5_2qhk8,r/war,public,,0,[],,1648681508.0,,,,
,[],False,,Ajezon,,,[],,,,text,t2_4w6ovanr,False,False,"&lt;thinks of at all those starving children&gt;

...ok",9e3b95f29c8f8fd4541aacd42fcd6f7f665db18b,True,False,,,,,0,1648710056,,0,{},i2tib5g,False,t3_tsl4hg,False,True,t1_i2sz2gu,/r/war/comments/tsl4hg/chechens_laying_down_a_rocket_barrage_on_a/i2tib5g/,1648710072,1,True,True,False,war,t5_2qhk8,r/war,public,,0,[],,1648681256.0,,,,
,[],False,,_BaldyLocks_,,,[],,,,text,t2_5d0jbynz,False,False,That's not Iskander but Tochka and the video is fake as hell.,32c0c1934a51a7fd402fcaa4a0a18bd4812ce1de,True,False,,,,,0,1648710020,,0,{},i2ti9jd,False,t3_tsjoma,False,True,t3_tsjoma,/r/war/comments/tsjoma/the_epic_destruction_of_the_buk_air_defense/i2ti9jd/,1648710038,1,True,True,False,war,t5_2qhk8,r/war,public,,0,[],,1648681220.0,,,,
,[],False,,[deleted],,,,,,dark,,,,,[removed],fe993932d6dced4c0a879e9aa5d7a6e0fbb467f5,True,True,,,DELETED,,0,1648709609,,0,{},i2thraa,False,t3_tssy9v,False,True,t3_tssy9v,/r/war/comments/tssy9v/kadyrov_occupiers_spotted_traffic_lights_for_the/i2thraa/,1648709625,1,True,True,False,war,t5_2qhk8,r/war,public,,0,[],,1648680809.0,,,,
,[],False,,IjonTichy85,,,[],,,,text,t2_51ioz,False,False,Lol nukes on nato? Yeah good luck with that,04ebf6737ca57f9db2dcdd7d781c0360b377ddef,True,False,,,,,0,1648709408,,0,{},i2thi8z,False,t3_tsk0yx,False,True,t1_i2tfojt,/r/war/comments/tsk0yx/will_russia_lose/i2thi8z/,1648709422,1,True,True,False,war,t5_2qhk8,r/war,public,,0,[],,1648680608.0,,,,
,[],False,,[deleted],,,,,,dark,,,,,[removed],fe993932d6dced4c0a879e9aa5d7a6e0fbb467f5,True,True,,,DELETED,,0,1648709259,,0,{},i2thbd7,False,t3_tsk0yx,False,True,t1_i2sir4x,/r/war/comments/tsk0yx/will_russia_lose/i2thbd7/,1648709274,1,True,True,False,war,t5_2qhk8,r/war,public,,0,[],,1648680459.0,,,,
,[],False,,DarthPopoX,,,[],,,,text,t2_8pbl3fyw,False,False,Lol putin is not a christian. He appeases the orthodox church that's about it.,10225740ee50670781fdfcd5b623be0b34e173e3,True,False,,,,,0,1648709045,,0,{},i2th1js,False,t3_tsl4hg,False,True,t1_i2s374e,/r/war/comments/tsl4hg/chechens_laying_down_a_rocket_barrage_on_a/i2th1js/,1648709058,1,True,True,False,war,t5_2qhk8,r/war,public,,0,[],,1648680245.0,,,,
,[],False,,[deleted],,,,,,dark,,,,,[removed],fe993932d6dced4c0a879e9aa5d7a6e0fbb467f5,True,True,,,DELETED,,0,1648709001,,0,{},i2tgzn0,False,t3_tsl4hg,False,True,t1_i2te6ti,/r/war/comments/tsl4hg/chechens_laying_down_a_rocket_barrage_on_a/i2tgzn0/,1648709020,1,True,True,False,war,t5_2qhk8,r/war,public,,0,[],,1648680201.0,,,,
