Unnamed: 0,all_awardings,archived,associated_award,author,author_flair_background_color,author_flair_css_class,author_flair_richtext,author_flair_template_id,author_flair_text,author_flair_text_color,author_flair_type,author_fullname,author_patreon_flair,author_premium,body,body_sha1,can_gild,collapsed,collapsed_because_crowd_control,collapsed_reason,collapsed_reason_code,comment_type,controversiality,created_utc,distinguished,gilded,gildings,id,is_submitter,link_id,locked,no_follow,parent_id,permalink,retrieved_utc,score,score_hidden,send_replies,stickied,subreddit,subreddit_id,subreddit_name_prefixed,subreddit_type,top_awarded_type,total_awards_received,treatment_tags,unrepliable_reason,created,author_cakeday,edited,editable,media_metadata
591.0,[],False,,Holiday_Wench,,,[],,,,text,t2_bmsk4qdr,False,False,"'As long as there is 2 people on this planet, someone is gonna want someone dead' - sniper tf2

War settles any disagreement that can't be democratically solved. If you want to solve a dispute or if you want something of someone elses more then their gonna settle you need force.",b91be96e99a7017d3d87e274326e14231bd4c2c4,True,False,,,,,0,1648771016,,0,{},i2x25nq,False,t3_tt97co,False,True,t3_tt97co,/r/war/comments/tt97co/why_in_2022_do_we_still_have_war_in_the_world/i2x25nq/,1648771033,1,True,True,False,war,t5_2qhk8,r/war,public,,0,[],,1648742216.0,,,,
592.0,[],False,,iwweitlat,,,[],,,,text,t2_hjst0dna,False,False,so you're telling me they're using the idea of killing civilians as bait or a human shield?,8e188cabb8a615e7ef133c6bf959d605e1b33b88,True,False,,,,,0,1648771008,,0,{},i2x2513,False,t3_tt8owj,False,True,t1_i2watun,/r/war/comments/tt8owj/aljazeera_news_shows_ukrainian_troops_using_red/i2x2513/,1648771024,1,True,True,False,war,t5_2qhk8,r/war,public,,0,[],,1648742208.0,,,,
593.0,[],False,,iwweitlat,,,[],,,,text,t2_hjst0dna,False,False,lol whoops!,2d8aa2759d60409294d30853dac098932876474f,True,False,,,,,0,1648770966,,0,{},i2x21of,False,t3_tt8owj,False,True,t3_tt8owj,/r/war/comments/tt8owj/aljazeera_news_shows_ukrainian_troops_using_red/i2x21of/,1648770979,1,True,True,False,war,t5_2qhk8,r/war,public,,0,[],,1648742166.0,,,,
594.0,[],False,,Ram_1979,,,[],,,,text,t2_1vx7of16,False,False,whats the music?,6adc981e3f5dcaf2be791c7f01dd1208284ec464,True,False,,,,,0,1648770937,,0,{},i2x1zc9,False,t3_tszf3z,False,True,t3_tszf3z,/r/war/comments/tszf3z/ukrainian_tank_after_direct_hit_tank_and_crew/i2x1zc9/,1648770959,1,True,True,False,war,t5_2qhk8,r/war,public,,0,[],,1648742137.0,,,,
595.0,[],False,,miguelr503,,,[],,,,text,t2_2v5vc77j,False,False,Then this sub starts crying when they get bombed 😆😆,f1720c44a34ce25951e57130bc2b757e2b47e1b3,True,False,,,,,0,1648770874,,0,{},i2x1uag,False,t3_tt8owj,False,True,t3_tt8owj,/r/war/comments/tt8owj/aljazeera_news_shows_ukrainian_troops_using_red/i2x1uag/,1648770889,1,True,True,False,war,t5_2qhk8,r/war,public,,0,[],,1648742074.0,,,,
596.0,[],False,,Special_Rice9539,,,[],,,,text,t2_7dlqy0rl,False,False,This sub is unreal man.  Wow,12a07e87b0dbd9fe21d95779c3ce969e34f90e10,True,False,,,,,0,1648770855,,0,{},i2x1sqz,False,t3_tszswx,False,True,t3_tszswx,/r/war/comments/tszswx/turkish_army_squad_gets_wiped_out_and_looted/i2x1sqz/,1648770873,1,True,True,False,war,t5_2qhk8,r/war,public,,0,[],,1648742055.0,,,,
597.0,[],False,,bonesbuto21,,,[],,,,text,t2_e3yuyr77,False,False,u/savevideo,70a0f94b1709054e8c936673e18a6bab7d60f29f,True,False,,,,,0,1648770795,,0,{},i2x1nxd,False,t3_tszswx,False,True,t3_tszswx,/r/war/comments/tszswx/turkish_army_squad_gets_wiped_out_and_looted/i2x1nxd/,1648770824,1,True,True,False,war,t5_2qhk8,r/war,public,,0,[],,1648741995.0,,,,
598.0,[],False,,OkCalligrapher1340,,,[],,,,text,t2_cls1g10h,False,False,Or I could add up all “non western” and “western” wars abs come to the conclusion that humans kill and conquer constantly since the beginning. Capitalism isn’t the problem. Humans will always be humans.,272bd7517056652bd37de711fbd3892424fdaa80,True,False,,,,,0,1648770776,,0,{},i2x1mgz,False,t3_tt97co,False,True,t1_i2wvnkv,/r/war/comments/tt97co/why_in_2022_do_we_still_have_war_in_the_world/i2x1mgz/,1648770790,1,True,True,False,war,t5_2qhk8,r/war,public,,0,[],,1648741976.0,,,,
599.0,[],False,,Best-Refrigerator834,,,[],,,,text,t2_6ogd21p9,False,False,"Very convenient that Al-Jazeera journalist were exactly there, just when those UkRaNiAn NaZiS were getting off nonchalantly from the ambulances. I remember also Peter Maurer talking cheerfully and smiling with Lavrov a week ago. Could be true, could be not.",49706ea7b1c314d7d170fc68b95ac09b8af57859,True,False,,,,,0,1648770771,,0,{},i2x1m2h,False,t3_tt8owj,False,True,t3_tt8owj,/r/war/comments/tt8owj/aljazeera_news_shows_ukrainian_troops_using_red/i2x1m2h/,1648770791,1,True,True,False,war,t5_2qhk8,r/war,public,,0,[],,1648741971.0,,,,
600.0,[],False,,AlternativeInjury804,,,[],,,,text,t2_4w1dhfml,False,False,Should**,34ee615fb176d212dda0a9c9bacb091d1c07951f,True,False,,,,,0,1648770448,,0,{},i2x0waj,False,t3_tt4rxz,False,True,t1_i2vrc3d,/r/war/comments/tt4rxz/georgian_soldier_in_ukraine/i2x0waj/,1648770468,1,True,True,False,war,t5_2qhk8,r/war,public,,0,[],,1648741648.0,,,,
601.0,[],False,,AdSuspicious4309,,,[],,,,text,t2_8zixvhyr,False,False,"The only bad thing I can draw from it is Russians will say see, we are right to bomb this civilian building and that hospital. They will be doing it anyway. I don’t think Ukrainians care though, they just want to survive.",a73926cbd6b5e32e6bb84d2b1cb375c0bf1b0883,True,False,,,,,0,1648770357,,0,{},i2x0p0s,False,t3_tt8owj,False,True,t1_i2wz9wa,/r/war/comments/tt8owj/aljazeera_news_shows_ukrainian_troops_using_red/i2x0p0s/,1648770374,1,True,True,False,war,t5_2qhk8,r/war,public,,0,[],,1648741557.0,,,,
602.0,[],False,,Scotty_scd40,,,[],,,,text,t2_3q0hgube,False,False,Not saying there are no neo-nazis in azov but this battalion since 2014 has changed a lot and became actual army regiment. A lot of casual soldiers without far-right connections are there,184624c52f3f8741a848165ff8ec4f21f0ac05be,True,False,,,,,0,1648770201,,0,{},i2x0c9g,False,t3_tt0a5n,False,True,t1_i2w1pbx,/r/war/comments/tt0a5n/russian_army_shot_down_a_ukrainian_helicopter/i2x0c9g/,1648770213,1,True,True,False,war,t5_2qhk8,r/war,public,,0,[],,1648741401.0,,,,
603.0,[],False,,20WordsMax,,,[],,,,text,t2_753xkmvg,False,False,They seem to be treating people and prisoners for more better than the UA are :/,ee2b1743941763cc7a72e81bb4112c44a4df32ff,True,False,,,,,0,1648770171,,0,{},i2x09ti,True,t3_tt8owj,False,True,t1_i2wz9wa,/r/war/comments/tt8owj/aljazeera_news_shows_ukrainian_troops_using_red/i2x09ti/,1648770189,1,True,True,False,war,t5_2qhk8,r/war,public,,0,[],,1648741371.0,,,,
604.0,[],False,,AdSuspicious4309,,,[],,,,text,t2_8zixvhyr,False,False,"Yeah I addressed that, it’s not ok. However I’ve seen Russians doing exactly the same thing and they aren’t the aggressors 🤷🏻‍♂️ if you got a big guy hitting you and threatening your family in your home you better throw dirt in his eye and glass him when he’s not looking. What’s at stake is too great! 

Also coke one now, russian are literally proven to be shooting at everything regardless of markings. Just like they did in Syria 🇸🇾",40ba060eccd4e3b90d90ab3953bb958f5305e624,True,False,,,,,0,1648770096,,0,{},i2x03sr,False,t3_tt8owj,False,False,t1_i2wxb4p,/r/war/comments/tt8owj/aljazeera_news_shows_ukrainian_troops_using_red/i2x03sr/,1648770110,1,True,True,False,war,t5_2qhk8,r/war,public,,0,[],,1648741296.0,,,,
605.0,[],False,,RaiDeiNz,,,[],,,,text,t2_97szf6w9,False,False,"&gt;Yet you’re cutting off water to an entire nation and murdering Kurdish journalists that cover your war crimes? Ok propaganda machine

Shut up you fucking idiot. Stop cutting their water off, we're giving the guys free electricity. The East is the least taxed region of the country. What are you talking about without knowing Turkey, AMK, I'm going crazy!",6b93a143ec785bd6fe6348987f3662cf708002aa,True,False,,,,,0,1648770037,,0,{},i2wzz4a,False,t3_tszswx,False,True,t1_i2wr9et,/r/war/comments/tszswx/turkish_army_squad_gets_wiped_out_and_looted/i2wzz4a/,1648770054,1,True,True,False,war,t5_2qhk8,r/war,public,,0,[],,1648741237.0,,,,
606.0,[],False,,Definitlynotquin,,,[],,,,text,t2_krkkscur,False,False,Oh yeah. Cause haji news never lies,9b41a6899ab3614d5857f416cd7c6662c5022dde,True,False,,,,,0,1648770027,,0,{},i2wzybh,False,t3_tt8owj,False,True,t3_tt8owj,/r/war/comments/tt8owj/aljazeera_news_shows_ukrainian_troops_using_red/i2wzybh/,1648770046,1,True,True,False,war,t5_2qhk8,r/war,public,,0,[],,1648741227.0,,,,
607.0,[],False,,Holiday_Wench,,,[],,,,text,t2_bmsk4qdr,False,False,What are the chances the russians have civs compared to a ukraine one.,1768df39280a31c8dfc354e84d88d657ce9f7619,True,False,,,,,0,1648769894,,0,{},i2wznn4,False,t3_tt8owj,False,True,t1_i2wz9wa,/r/war/comments/tt8owj/aljazeera_news_shows_ukrainian_troops_using_red/i2wznn4/,1648769911,1,True,True,False,war,t5_2qhk8,r/war,public,,0,[],,1648741094.0,,,,
608.0,[],False,,20WordsMax,,,[],,,,text,t2_753xkmvg,False,False,Dude what you said is complete BS using humanitarian aid vehicles for warfare is against the GC and logic,da0a0a1a9ccd7679bba9e08e638154211db94a9f,True,False,,,,,0,1648769845,,0,{},i2wzjqx,True,t3_tt8owj,False,True,t1_i2wyuis,/r/war/comments/tt8owj/aljazeera_news_shows_ukrainian_troops_using_red/i2wzjqx/,1648769860,1,True,True,False,war,t5_2qhk8,r/war,public,,0,[],,1648741045.0,,,,
609.0,[],False,,Holiday_Wench,,,[],,,,text,t2_bmsk4qdr,False,False,A ukraine red cross vehicle will have soldiers or civilians wounded. A russian red cross vehicle will have only wounded soldiers.,2f45522a7339b365b8fc0654c59307121f3630d4,True,False,,,,,0,1648769841,,0,{},i2wzjfv,False,t3_tt8owj,False,True,t1_i2wyuis,/r/war/comments/tt8owj/aljazeera_news_shows_ukrainian_troops_using_red/i2wzjfv/,1648769860,1,True,True,False,war,t5_2qhk8,r/war,public,,0,[],,1648741041.0,,,,
610.0,[],False,,grade_33,,,[],,,,text,t2_cm38bzuh,False,False,u/savevideobot,f195b0d1f5ce50b9b3e9029a442e58db08d61512,True,False,,,,,0,1648769738,,0,{},i2wzb75,False,t3_tszswx,False,True,t3_tszswx,/r/war/comments/tszswx/turkish_army_squad_gets_wiped_out_and_looted/i2wzb75/,1648769764,1,True,True,False,war,t5_2qhk8,r/war,public,,0,[],,1648740938.0,,,,
611.0,[],False,,Opposite-Shoulder260,,,[],,,,text,t2_g2t09alw,False,False,"The Russians already do it, thats the problem. Is it even worth to have the moral high ground if your enemy has no moral to start with?",d7aad8bed22077634422e738c34b67956e3c7394,True,False,,,,,0,1648769721,,0,{},i2wz9wa,False,t3_tt8owj,False,True,t1_i2wz4wp,/r/war/comments/tt8owj/aljazeera_news_shows_ukrainian_troops_using_red/i2wz9wa/,1648769743,1,True,True,False,war,t5_2qhk8,r/war,public,,0,[],,1648740921.0,,,,
612.0,[],False,,Holiday_Wench,,,[],,,,text,t2_bmsk4qdr,False,False,It only does the people harm then good. After the russians shoot a red cross vehicle with combatants. The next time that might be a injured mom and child.  Its like a gamble from hell.,b47b5618c12c5e4dc0be5c6c65110142bfc6f7a4,True,False,,,,,0,1648769661,,0,{},i2wz4wp,False,t3_tt8owj,False,True,t1_i2wxeq7,/r/war/comments/tt8owj/aljazeera_news_shows_ukrainian_troops_using_red/i2wz4wp/,1648769681,1,True,True,False,war,t5_2qhk8,r/war,public,,0,[],,1648740861.0,,,,
613.0,[],False,,FrankFranly,,,[],,,,text,t2_yia0w,False,False,Russian propaganda. Downvote!,820b0248db2f761738047cb9a5eff6a81e6a8311,True,False,,,,,0,1648769582,,0,{},i2wyyj3,False,t3_tt8owj,False,True,t3_tt8owj,/r/war/comments/tt8owj/aljazeera_news_shows_ukrainian_troops_using_red/i2wyyj3/,1648769607,1,True,True,False,war,t5_2qhk8,r/war,public,,0,[],,1648740782.0,,,,
614.0,[],False,,Victory_Point,,,[],,,,text,t2_eirtwsd3,False,False,"Wrong. This is a completely naive western stance. The Russians have consistently used indiscriminate artillery attacks on civilian areas, blown up hospitals, children etc. They have also been using vehicles marked up with red crosses to transport ammunition and war materiel.
This is not a fair war where two imperial powers are duking it out over some coveted prize, it's a fascist invasion where brutal thugs have used mass propaganda  on themselves in order to reduce the indigenous population in their minds to the status of subhuman in order to murder them and remove them from the land they want to steal. 
Before you pretend that this is in any way a fair fight, remember whose boots crossed the border first.",261e492177030f1bca3b702fc519373b61f1dbf1,True,True,,,,,0,1648769532,,0,{},i2wyuis,False,t3_tt8owj,False,True,t1_i2wxikz,/r/war/comments/tt8owj/aljazeera_news_shows_ukrainian_troops_using_red/i2wyuis/,1648769554,1,True,True,False,war,t5_2qhk8,r/war,public,,0,[],,1648740732.0,,,,
615.0,[],False,,Holiday_Wench,,,[],,,,text,t2_bmsk4qdr,False,False,I'm glad I'm not the only one who feels this way,813b98e3ac5c23928609a582054401d69a029923,True,False,,,,,0,1648769374,,0,{},i2wyhqj,False,t3_tsurol,False,True,t1_i2v1lws,/r/war/comments/tsurol/mariupol_the_russian_occupiers_are_not_shy_at_all/i2wyhqj/,1648769390,1,True,True,False,war,t5_2qhk8,r/war,public,,0,[],,1648740574.0,,,,
616.0,[],False,,Holiday_Wench,,,[],,,,text,t2_bmsk4qdr,False,False,Probably the intent,cc4c3f6c3def698698fcc5384bfd245253a5e95b,True,False,,,,,0,1648769277,,0,{},i2wy9u7,False,t3_tswfnv,False,True,t1_i2uthd6,/r/war/comments/tswfnv/denazification_and_demilitarization_of_a_barn_in/i2wy9u7/,1648769296,1,True,True,False,war,t5_2qhk8,r/war,public,,0,[],,1648740477.0,,,,
617.0,[],False,,[deleted],,,,,,dark,,,,,[removed],fe993932d6dced4c0a879e9aa5d7a6e0fbb467f5,True,True,,,DELETED,,0,1648769254,,0,{},i2wy7xv,False,t3_tqai89,False,True,t1_i2jtd4w,/r/war/comments/tqai89/even_ukrainian_birds_taking_a_part_in_shelling_on/i2wy7xv/,1648769266,1,True,True,False,war,t5_2qhk8,r/war,public,,0,[],,1648740454.0,,,,
618.0,[],False,,Holiday_Wench,,,[],,,,text,t2_bmsk4qdr,False,False,Fucking dumbasses. You don't fuck around and find out in a place home to one of the worst nuclear disasters.,0fa07c25df22b4ea66871ff9c67f815d7bd3c682,True,False,,,,,0,1648769214,,0,{},i2wy4t6,False,t3_tt3518,False,True,t3_tt3518,/r/war/comments/tt3518/russian_troops_reportedly_fall_ill_after_being/i2wy4t6/,1648769230,1,True,True,False,war,t5_2qhk8,r/war,public,,0,[],,1648740414.0,,,,
619.0,[],False,,Holiday_Wench,,,[],,,,text,t2_bmsk4qdr,False,False,The middle east is more obscure and less well documented.,9568d89cd1714897f6c11511ce6ba87033f5a3a9,True,False,,,,,0,1648769133,,0,{},i2wxy3l,False,t3_tt3ivz,False,True,t1_i2wv9bd,/r/war/comments/tt3ivz/this_video_shows_how_russians_bombed_ukraine/i2wxy3l/,1648769147,1,True,True,False,war,t5_2qhk8,r/war,public,,0,[],,1648740333.0,,,,
620.0,[],False,,irespectcookies,,,[],,,,text,t2_i1fyqfwq,False,False,Effective fighters.,8d69756e3b8c459f9ac30d0433a6a5df01ceb6a4,True,False,,,,,0,1648769077,,0,{},i2wxthm,False,t3_tszswx,False,True,t3_tszswx,/r/war/comments/tszswx/turkish_army_squad_gets_wiped_out_and_looted/i2wxthm/,1648769094,1,True,True,False,war,t5_2qhk8,r/war,public,,0,[],,1648740277.0,,,,
621.0,[],False,,Holiday_Wench,,,[],,,,text,t2_bmsk4qdr,False,False,The more you blur the line between civilian and soldier the more unnecessary suffering you will get.,9d0c5b197cca03ef3b6efaf3c131c7bea5b00e02,True,False,,,,,0,1648768947,,0,{},i2wxikz,False,t3_tt8owj,False,True,t1_i2wwvsb,/r/war/comments/tt8owj/aljazeera_news_shows_ukrainian_troops_using_red/i2wxikz/,1648768966,1,True,True,False,war,t5_2qhk8,r/war,public,,0,[],,1648740147.0,,,,
622.0,[],False,,Opposite-Shoulder260,,,[],,,,text,t2_g2t09alw,False,False,"Yes.

This is obviously a war crime... But can you even judge them? I mean they are trying to survive an invasion, I would probably do the same. 

However, at the end of the war the ones judged by war crimes are usually the losers.",6e47fb5deefe000d908dfe3254f38ddcb77b28f5,True,False,,,,,0,1648768901,,0,{},i2wxeq7,False,t3_tt8owj,False,True,t1_i2ww0qk,/r/war/comments/tt8owj/aljazeera_news_shows_ukrainian_troops_using_red/i2wxeq7/,1648768921,1,True,True,False,war,t5_2qhk8,r/war,public,,0,[],,1648740101.0,,,,
623.0,[],False,,Holiday_Wench,,,[],,,,text,t2_bmsk4qdr,False,False,So when the actual red cross comes along you will see innocent people trying to help get blown up. So any red cross thing will be shot. Look i get it. All sympathy to ukraine. BUT THIS IS HOW YOU GET MORE HOSPITAL BOMBINGS.,8b600619a3ff1d3ba28fe60d11429bc075d4e408,True,False,,,,,0,1648768857,,0,{},i2wxb4p,False,t3_tt8owj,False,True,t1_i2ww0qk,/r/war/comments/tt8owj/aljazeera_news_shows_ukrainian_troops_using_red/i2wxb4p/,1648768876,1,True,True,False,war,t5_2qhk8,r/war,public,,0,[],,1648740057.0,,,,
624.0,[],False,,Victory_Point,,,[],,,,text,t2_eirtwsd3,False,False,Oh yeah man... This is so bad... Almost as bad as illegally invading somebodies country and using cruise missiles on civilian targets.,9920c35b4cbb8359f67b01c94e3f7fb2df38f883,True,False,,,,,0,1648768674,,0,{},i2wwvsb,False,t3_tt8owj,False,True,t3_tt8owj,/r/war/comments/tt8owj/aljazeera_news_shows_ukrainian_troops_using_red/i2wwvsb/,1648768689,1,True,True,False,war,t5_2qhk8,r/war,public,,0,[],,1648739874.0,,,,
625.0,[],False,,yesil12k,,,[],,,,text,t2_8wwnuy3i,False,False,"I don't think anyone need to do anything to boost Turkish morale. The event that showed in video was popular once and most of the time countries who have air dominance revenge it in a short time. For Turks when it comes to morale, It is already a country who identified their roots and morales already. I don't believe in humanitarian shits, the truth is they are the most savage people thats why while Turks are sitting on their pink asses and living in the normal rush of ordinary life while Kurds cracking some weeds to get couraged enough to die with a Turkish, Russian or American strike.

What Kurds trying to do on the other hand is find their national identifies, they are trying to do such thing that many of the countries did thousends of years ago. If they won't achieve their goals, they will remain supressed by others, if they will succeed someone will crush it again. Simpy it is impossible for them to live under their own flags and it is kinda sad they can't even speak their language to seperated Kurds who live in different countries. What is happening right now and what will happen in the future is they will get killed by either sides who have benefits to use them, i don't know if it'd be Turks, Russians, Iranians, Arabs, Americans or others. Thats why Kurds need such videos to boost their morale up.",c8d51d3744cc5187880b402db54b66eba2db5eda,True,False,,,,,0,1648768510,,0,{},i2wwi77,False,t3_tszswx,False,True,t1_i2wr2kz,/r/war/comments/tszswx/turkish_army_squad_gets_wiped_out_and_looted/i2wwi77/,1648768524,1,True,True,False,war,t5_2qhk8,r/war,public,,0,[],,1648739710.0,,,,
626.0,[],False,,[deleted],,,,,,dark,,,,,[removed],fe993932d6dced4c0a879e9aa5d7a6e0fbb467f5,True,True,,,DELETED,,0,1648768312,,0,{},i2ww1n8,False,t3_tssy9v,False,True,t3_tssy9v,/r/war/comments/tssy9v/kadyrov_occupiers_spotted_traffic_lights_for_the/i2ww1n8/,1648768330,1,True,True,False,war,t5_2qhk8,r/war,public,,0,[],,1648739512.0,,,,
627.0,[],False,,AdSuspicious4309,,,[],,,,text,t2_8zixvhyr,False,False,Tbh when you’re the defender in an aggressive act and outgunned… how could someone judge them? They are fighting for their lives and existence. Every advantage they can gain is vital to fighting off Russia. It’s not morally right but they didn’t start this war and they sure as hell don’t want it. Russia is playing dirty and they will do the same. Yes they lose the moral high ground which in many senses is unfair but the stakes are high and their civilians dying.,d1ccacb6d4992652f64e5bba91205d887df25260,True,False,,,,,0,1648768302,,0,{},i2ww0qk,False,t3_tt8owj,False,True,t3_tt8owj,/r/war/comments/tt8owj/aljazeera_news_shows_ukrainian_troops_using_red/i2ww0qk/,1648768317,1,True,True,False,war,t5_2qhk8,r/war,public,,0,[],,1648739502.0,,,,
628.0,[],False,,[deleted],,,,,,dark,,,,,[removed],fe993932d6dced4c0a879e9aa5d7a6e0fbb467f5,True,True,,,DELETED,,0,1648768291,,0,{},i2wvzru,False,t3_tssy9v,False,True,t1_i2ul5qx,/r/war/comments/tssy9v/kadyrov_occupiers_spotted_traffic_lights_for_the/i2wvzru/,1648768309,1,True,True,False,war,t5_2qhk8,r/war,public,,0,[],,1648739491.0,,,,
629.0,[],False,,[deleted],,,,,,dark,,,,,[removed],fe993932d6dced4c0a879e9aa5d7a6e0fbb467f5,True,True,,,DELETED,,0,1648768254,,0,{},i2wvwlx,False,t3_tt77nn,False,True,t3_tt77nn,/r/war/comments/tt77nn/russian_soldiers_moving_captured_ukrainian/i2wvwlx/,1648768271,1,True,True,False,war,t5_2qhk8,r/war,public,,0,[],,1648739454.0,,,,
630.0,[],False,,ragepaperbonsai,,,[],,,,text,t2_1jy79rxp,False,False,"List all 'western world' imperial wars or offensive conflicts for resources, power, control or anything else. Then speak. Its not the good vs the evil...",f820faa665fe8de796d8af053c466de78eb98c0b,True,False,,,,,0,1648768145,,0,{},i2wvnkv,False,t3_tt97co,False,True,t1_i2wpex4,/r/war/comments/tt97co/why_in_2022_do_we_still_have_war_in_the_world/i2wvnkv/,1648768160,1,True,True,False,war,t5_2qhk8,r/war,public,,0,[],,1648739345.0,,,,
631.0,[],False,,Herbringer,,,[],,,,text,t2_i3pq9oiy,False,False,Interesting... Could you make one about Middle east? It would be nice to see how many things US bombed,59584ac08ad9702d387b85a4d2f29c0af7a74a5d,True,False,,,,,0,1648767974,,0,{},i2wv9bd,False,t3_tt3ivz,False,False,t3_tt3ivz,/r/war/comments/tt3ivz/this_video_shows_how_russians_bombed_ukraine/i2wv9bd/,1648767986,1,True,True,False,war,t5_2qhk8,r/war,public,,0,[],,1648739174.0,,,,
632.0,[],False,,juvenile-man,,,[],,,,text,t2_1o50ajez,False,False,I don't think covid shots are a priority in the middle of the war,583457738503722f61877771a27cd5f7842e5826,True,False,,,,,0,1648767963,,0,{},i2wv8dq,False,t3_tt8owj,False,True,t1_i2wm6si,/r/war/comments/tt8owj/aljazeera_news_shows_ukrainian_troops_using_red/i2wv8dq/,1648767982,1,True,True,False,war,t5_2qhk8,r/war,public,,0,[],,1648739163.0,,,,
633.0,[],False,,Voorniets,,,[],,,,text,t2_813ci01a,False,False,"You didn't go to school for very long either it seems. Ever heard of grammar? Who believes in the right god? Christians? Jews? Muslims? Why do you believe in one but not the other? Can you prove the Vikings were wong and there aren't more gods? Religion rose up because of human need for explanation. Humans are scared of the world. We invented gods to give ourselves someone to blame when things go wrong. We invented gods to give us comfort when scared of the unknown. A few smart people saw the power of a common believe and used it to gain power and influence. They invented religions to get a grip on the common people. You have to imagine this happening in a time where people were limited to hearsay and rumor. There was no way to communicate with distant people to challenge your way of thinking. It outgrew us and when a few people gained the ability to write and the big lasses did not it was very easy to create 'holy' books and other nonsense. We are in the proces to scientifically explain more and more and more of the world. We come from a point where we knew nothing and thought it was all created and managed by a 'god',and we are evolving towards a theoretical future where everything is known and explained. Will we ever get there? Probably not. But at this point in human history it's more than clear there are no gods. With all we've learned and know right now you are an absolute baboon of an idiot if you believe in one or more gods. End of story time kids, grow up.",fb7bce841c89fb7c86b32805ee146993df84da44,True,False,,,,,0,1648767553,,0,{},i2wuag3,False,t3_tsl4hg,False,True,t1_i2wninp,/r/war/comments/tsl4hg/chechens_laying_down_a_rocket_barrage_on_a/i2wuag3/,1648767572,1,True,True,False,war,t5_2qhk8,r/war,public,,0,[],,1648738753.0,,,,
634.0,[],False,,Voorniets,,,[],,,,text,t2_813ci01a,False,False,I think the guy I was responding too deleted his comment when I was typing,0178cddb11ec94e94927359031625efa08c7f7fc,True,False,,,,,0,1648767514,,0,{},i2wu786,False,t3_tsl4hg,False,True,t1_i2wtw4j,/r/war/comments/tsl4hg/chechens_laying_down_a_rocket_barrage_on_a/i2wu786/,1648767527,1,True,True,False,war,t5_2qhk8,r/war,public,,0,[],,1648738714.0,,,,
635.0,[],False,,Holiday_Wench,,,[],,,,text,t2_bmsk4qdr,False,False,Americans are 50/50 on amout anything. If someone hates it. Someone  loves it.,7a45f7363c177dd960450cd47a98c74694d43e70,True,False,,,,,0,1648767418,,0,{},i2wtzgd,False,t3_tszswx,False,True,t1_i2vvdvw,/r/war/comments/tszswx/turkish_army_squad_gets_wiped_out_and_looted/i2wtzgd/,1648767431,1,True,True,False,war,t5_2qhk8,r/war,public,,0,[],,1648738618.0,,,,
636.0,[],False,,Vovkovych,,,[],,,,text,t2_15ohury2,False,True,What the hell you talking about ? Did you reply to the wrong thing ?,e0cc768612844ee4dfd4445d647cca466c633e87,True,False,,,,,0,1648767378,,0,{},i2wtw4j,True,t3_tsl4hg,False,True,t1_i2wtqlf,/r/war/comments/tsl4hg/chechens_laying_down_a_rocket_barrage_on_a/i2wtw4j/,1648767391,1,True,True,False,war,t5_2qhk8,r/war,public,,0,[],,1648738578.0,,,,
637.0,[],False,,[deleted],,,,,,dark,,,,,[removed],fe993932d6dced4c0a879e9aa5d7a6e0fbb467f5,True,True,,,DELETED,,0,1648767311,,0,{},i2wtqlp,False,t3_dmfdcq,False,True,t3_dmfdcq,/r/war/comments/dmfdcq/for_those_still_wondering_if_turkey_is_committing/i2wtqlp/,1648767329,1,True,True,False,war,t5_2qhk8,r/war,public,,0,[],,1648738511.0,,,,
