Unnamed: 0,all_awardings,archived,associated_award,author,author_flair_background_color,author_flair_css_class,author_flair_richtext,author_flair_template_id,author_flair_text,author_flair_text_color,author_flair_type,author_fullname,author_patreon_flair,author_premium,body,body_sha1,can_gild,collapsed,collapsed_because_crowd_control,collapsed_reason,collapsed_reason_code,comment_type,controversiality,created_utc,distinguished,gilded,gildings,id,is_submitter,link_id,locked,no_follow,parent_id,permalink,retrieved_utc,score,score_hidden,send_replies,stickied,subreddit,subreddit_id,subreddit_name_prefixed,subreddit_type,top_awarded_type,total_awards_received,treatment_tags,unrepliable_reason,created,author_cakeday,edited,editable,media_metadata
,[],False,,Antonioooooo0,,,[],,,,text,t2_2jajzrr4,False,False,"Well of that's the goal, it's clearly not working.",d1406f2d5852ef5e33e3ecbe0a0482df2a752aff,True,False,,,,,0,1648740926,,0,{},i2uxur0,False,t3_tsnbqi,False,True,t1_i2udqeu,/r/war/comments/tsnbqi/ukrainian_drivers_goes_thru_antitank_mines_near/i2uxur0/,1648740946,1,True,True,False,war,t5_2qhk8,r/war,public,,0,[],,1648712126.0,,,,
,[],False,,[deleted],,,,,,dark,,,,,[removed],fe993932d6dced4c0a879e9aa5d7a6e0fbb467f5,True,True,,,DELETED,,0,1648740902,,0,{},i2uxsgl,False,t3_ts4vjs,False,True,t1_i2q9bev,/r/war/comments/ts4vjs/this_is_mariupol_just_to_put_things_into/i2uxsgl/,1648740921,1,True,True,False,war,t5_2qhk8,r/war,public,,0,[],,1648712102.0,,,,
,[],False,,IceLArk,,,[],,,,text,t2_vhgn3g,False,False,"I have a headache from facepalms) Ok, bro, you must be very in these theme, even more than Ukrainian Army and citizens) But, you still don't have any proof.",8e822324e929eb8624e8887a98c214f1265ef899,True,False,,,,,0,1648740873,,0,{},i2uxpu9,True,t3_tsnbqi,False,True,t1_i2ux2yn,/r/war/comments/tsnbqi/ukrainian_drivers_goes_thru_antitank_mines_near/i2uxpu9/,1648740891,1,True,True,False,war,t5_2qhk8,r/war,public,,0,[],,1648712073.0,,,,
,[],False,,kalrune1,,,[],,,,text,t2_bljnab9d,False,False,"&gt;You call terrorist to millions of people because they don't accept your mentality. I'm one of them and we'll see eachother on the day of judgment.

fare gibi deliklerde saklanıp masum insanları öldürmek hiçbir ideolojinin savunması olamaz. hesap günü diye bir şey yok kürdistan asla varolmayacak bu ülkeyi kanlarımızla kurduk saçma bir hayal uğruna da vermeyiz. terörist.",a53ea6e05910b12c4ef01011688259f01444d3dd,True,False,,,,,0,1648740865,,0,{},i2uxp3r,False,t3_tszswx,False,True,t1_i2uwvjo,/r/war/comments/tszswx/turkish_army_squad_gets_wiped_out_and_looted/i2uxp3r/,1648740883,1,True,True,False,war,t5_2qhk8,r/war,public,,0,[],,1648712065.0,,,,
,[],False,,SheepPez,,,[],,,,text,t2_1o77iap4,False,False,Holy hell. I've never seen combat footage this close up before.,80d98ecab63213a4a0d846181ee6e0f0b0a81ae8,True,False,,,,,0,1648740827,,0,{},i2uxlk3,False,t3_tszswx,False,True,t3_tszswx,/r/war/comments/tszswx/turkish_army_squad_gets_wiped_out_and_looted/i2uxlk3/,1648740840,1,True,True,False,war,t5_2qhk8,r/war,public,,0,[],,1648712027.0,,,,
,[],False,,Euqcor,,,[],,,,text,t2_2wlh2ksf,False,False,"Debate about war crimes aside, just how bad are these Russians?  I didn't see a single infantryman in that clip.  You hear a few shots, but no idea if there are any friendlies near this tank.

Got an MBT just sitting with its ass hanging out in a built up area.  Any Ukrainian would have an NLAW sized hard on seeing that.

Tanks are supposed to support the infantry in built up areas.  Infantry should be clearing those buildings while the tanks hang out waiting to move up and blast anything that's slowing the infantry down.  It amazes me how little they've learned from Chechnya.",2bdbbcabc269c3dd75986b4576b840e1eed81f3c,True,False,,,,,0,1648740773,,0,{},i2uxgfv,False,t3_tsurol,False,False,t3_tsurol,/r/war/comments/tsurol/mariupol_the_russian_occupiers_are_not_shy_at_all/i2uxgfv/,1648740789,1,True,True,False,war,t5_2qhk8,r/war,public,,0,[],,1648711973.0,,,,
,[],False,,sernameistaken420,,,[],,,,text,t2_h8txeo49,False,False,lte goes hard,4236c893c86eabedf5116c4fd54a94b6fe4e1ebd,True,False,,,,,0,1648740742,,0,{},i2uxdim,False,t3_tscls1,False,True,t1_i2sn2p8,/r/war/comments/tscls1/like_he_said_welcome_to_ukraine_ukrainian/i2uxdim/,1648740755,1,True,True,False,war,t5_2qhk8,r/war,public,,0,[],,1648711942.0,,,,
,[],False,,Few_Ask_4823,,,[],,,,text,t2_kdw37h6a,False,False,Proof that he is a liar?,a2c8a74821ebce994b79f2b51f5c1aedaa3607a4,True,False,,,,,0,1648740674,,0,{},i2ux78p,False,t3_tsro8g,False,True,t1_i2u687g,/r/war/comments/tsro8g/mariupol_interview_with_people/i2ux78p/,1648740688,1,True,True,False,war,t5_2qhk8,r/war,public,,0,[],,1648711874.0,,,,
,[],False,,[deleted],,,,,,dark,,,,,[removed],fe993932d6dced4c0a879e9aa5d7a6e0fbb467f5,True,True,,,DELETED,,0,1648740671,,0,{},i2ux6y8,False,t3_ts4vjs,False,True,t1_i2qtm1i,/r/war/comments/ts4vjs/this_is_mariupol_just_to_put_things_into/i2ux6y8/,1648740689,1,True,True,False,war,t5_2qhk8,r/war,public,,0,[],,1648711871.0,,,,
,[],False,,Hero771,,,[],,,,text,t2_l6y7q7l7,False,False,"Russian attacks not defending, they don't need to put mines in their back. Where is your logic, stop listen Ukrainian propaganda",8620951df0e8fe33766d29260cf518b71676065a,True,True,,,,,0,1648740628,,0,{},i2ux2yn,False,t3_tsnbqi,False,True,t1_i2ur9al,/r/war/comments/tsnbqi/ukrainian_drivers_goes_thru_antitank_mines_near/i2ux2yn/,1648740644,1,True,True,False,war,t5_2qhk8,r/war,public,,0,[],,1648711828.0,,,,
,[],False,,VeterinarianNaive278,,,[],,,,text,t2_bc0ltum4,False,False,Good eye. Can barely make it out even when looking at it lol.,5ed683847ca1c6659e043303e21ac9ea7b8855f3,True,False,,,,,0,1648740620,,0,{},i2ux25i,False,t3_ts3xy4,False,True,t1_i2u4xjw,/r/war/comments/ts3xy4/us_soldier_gets_a_headshot_from_the_juba_sniper/i2ux25i/,1648740644,1,True,True,False,war,t5_2qhk8,r/war,public,,0,[],,1648711820.0,,,,
,[],False,,DryYesterday6730,,,[],,,,text,t2_6ghe4i5r,False,False,Heart eyes motherfucker,4ad02f9dfbcf520cf7710bf8535c31324cb9ca86,True,False,,,,,0,1648740579,,0,{},i2uwyar,False,t3_tssy9v,False,True,t1_i2uwda9,/r/war/comments/tssy9v/kadyrov_occupiers_spotted_traffic_lights_for_the/i2uwyar/,1648740595,1,True,True,False,war,t5_2qhk8,r/war,public,,0,[],,1648711779.0,,,,
,[],False,,YZY21,,,[],,,,text,t2_chfipqp8,False,False,You call terrorist to millions of people because they don't accept your mentality. I'm one of them and we'll see eachother on the day of judgment.,809563ea4817eb42f6b34560e908fed6bf6fc590,True,False,,,,,0,1648740551,,0,{},i2uwvjo,False,t3_tszswx,False,True,t1_i2uwiyw,/r/war/comments/tszswx/turkish_army_squad_gets_wiped_out_and_looted/i2uwvjo/,1648740565,1,True,True,False,war,t5_2qhk8,r/war,public,,0,[],,1648711751.0,,,,
,[],False,,YZY21,,,[],,,,text,t2_chfipqp8,False,False,Most of the time only permenant soldiers goes to war areas in Turkey.,b6ccf1cfb0502144f1b29dd7493bed8927021026,True,False,,,,,0,1648740463,,0,{},i2uwncb,False,t3_tszswx,False,True,t1_i2utw9f,/r/war/comments/tszswx/turkish_army_squad_gets_wiped_out_and_looted/i2uwncb/,1648740477,1,True,True,False,war,t5_2qhk8,r/war,public,,0,[],,1648711663.0,,,,
,[],False,,kalrune1,,,[],,,,text,t2_bljnab9d,False,False,"this is your problem, every people in my country loves kurds. we don't love terrorists it's all",c223491ce765d99aa2fea0b4f6dc6fa78e75d658,True,True,,,,,0,1648740416,,0,{},i2uwiyw,False,t3_tszswx,False,True,t1_i2uw9v6,/r/war/comments/tszswx/turkish_army_squad_gets_wiped_out_and_looted/i2uwiyw/,1648740431,1,True,True,False,war,t5_2qhk8,r/war,public,,0,[],,1648711616.0,,,,
,[],False,,YZY21,,,[],,,,text,t2_chfipqp8,False,False,Go learn English idiot. Mine Turkish is already perfect.,6e5ab064550f015c0d5c79763cd493569d1a2d39,True,False,,,,,0,1648740371,,0,{},i2uwesp,False,t3_tszswx,False,True,t1_i2uw92m,/r/war/comments/tszswx/turkish_army_squad_gets_wiped_out_and_looted/i2uwesp/,1648740385,1,True,True,False,war,t5_2qhk8,r/war,public,,0,[],,1648711571.0,,,,
,[],False,,lph26,,,[],,,,text,t2_4rjbkyji,False,False,Some fries motherfucker,52589647ba1644a43474f2c8b264519de633e1a4,True,False,,,,,0,1648740355,,0,{},i2uwda9,False,t3_tssy9v,False,True,t1_i2tt1c9,/r/war/comments/tssy9v/kadyrov_occupiers_spotted_traffic_lights_for_the/i2uwda9/,1648740372,1,True,True,False,war,t5_2qhk8,r/war,public,,0,[],,1648711555.0,,,,
,[],False,,YZY21,,,[],,,,text,t2_chfipqp8,False,False,I'm a Kurd and I didn't live in peace with you. I want free Kurdistan and that's why you'll call me terrorist. May be curse upon you.,6c71adbbccb80e08927df1f93a981945ff204342,True,False,,,,,0,1648740318,,0,{},i2uw9v6,False,t3_tszswx,False,True,t1_i2uvuu8,/r/war/comments/tszswx/turkish_army_squad_gets_wiped_out_and_looted/i2uw9v6/,1648740331,1,True,True,False,war,t5_2qhk8,r/war,public,,0,[],,1648711518.0,,,,
,[],False,,kalrune1,,,[],,,,text,t2_bljnab9d,False,False,Atatürk her okul kitabında var çünkü o cumhuriyetimizin kurucusu. hak ettiği değeri veriyoruz. go translate this and don't support rats anymore.,6bb8d0a1d3556054e6ecdf4cbac9ea6456215d1b,True,True,,,,,0,1648740310,,0,{},i2uw92m,False,t3_tszswx,False,True,t1_i2uook0,/r/war/comments/tszswx/turkish_army_squad_gets_wiped_out_and_looted/i2uw92m/,1648740326,1,True,True,False,war,t5_2qhk8,r/war,public,,0,[],,1648711510.0,,,,
,[],False,,kalrune1,,,[],,,,text,t2_bljnab9d,False,False,"they dont have to be Turk, we are already living in peace with Kurdish people. they want all Turkish lands. there is no Kurdistan. there is no land for terrorists.",942161c106519d1aac492f8eb340e63afbf8d2c7,True,True,,,,,0,1648740156,,0,{},i2uvuu8,False,t3_tszswx,False,True,t1_i2uo64g,/r/war/comments/tszswx/turkish_army_squad_gets_wiped_out_and_looted/i2uvuu8/,1648740170,1,True,True,False,war,t5_2qhk8,r/war,public,,0,[],,1648711356.0,,,,
,[],False,,TheCommies-backp,,,[],,,,text,t2_788do8ty,False,False,"I'm literally Canadian fuck you, and I have looked at the war crimes. I've seen the marine testimonials, that's why I'm telling you that it is extremely hard to identify actual threats when the threats go out of their way to blend in with innocence. I've seen Marines throw dogs off a cliff, I've seen them taunt dying children with water bottles, have you any idea the methods of information extraction they used on innocent informants? Is inexcusable, but the fact you think that they just went there and started shooting brown people is absurd and you need a reality check. It was hell for both parties involved, and the innocent took the impact. But that doesnt negate my point that the majority of civilian casualties in the Afghanistan war was due to the extremely hard conditions in which targets were able to identified.  In most cases, armed combatants were in groups on unarmed ones, and I've seen 3 separate videos of child soldiers being used as pawns because they know that the soldiers won't shoot a child. Your literally talking to someone who's seen the testimonies your flaunting, and they only reinforce my Point that A) nobody wanted to be there and B) Civilian casualties were from misidentified Civilians because again, the combatants intentionally blended with Civilians for the purpose of A) Camouflage and protection and B) when a civilian is eventually killed because the solders literally cannot tell who is about to pull a weapon on IED out from under their clothing. So when they are killed they can blame the soldiers, and convince more Civilians to become combatants by convincing them it was the US who perpetrated the violence. And you just automatically assume I'm in support of the war or something, I've always held a very strong belief that intervention I foreign affairs drastically exacerbated the already bloody conflict. The whole war was a joke that should never have been made, and you my friend, are completely fucking ignorant",5626e6cc4e56be056945e9a4352348db7a9cff82,True,False,,,,,0,1648740103,,0,{},i2uvpw0,False,t3_tnj0d8,False,True,t1_i2utgoi,/r/war/comments/tnj0d8/russian_army_and_dpr_forces_patrol_the_streets_of/i2uvpw0/,1648740116,1,True,True,False,war,t5_2qhk8,r/war,public,,0,[],,1648711303.0,,,,
,[],False,,Boonaki,,,[],,,,text,t2_8kj4t,False,True,"No modern military should be suffering from the logistics and maintenance issues the Russians have been facing. It's highly likely the issues are due to corruption, military leaders pocketing money that should have been going to equipment.

If you can't move food, fuel, and ammunition, you aren't going to be able to fight effectively.",8933c1a4692e747b35b98324cb746f89ac94768c,True,False,,,,,0,1648739865,,0,{},i2uv3r4,False,t3_tsk0yx,False,False,t1_i2utxic,/r/war/comments/tsk0yx/will_russia_lose/i2uv3r4/,1648739880,1,True,True,False,war,t5_2qhk8,r/war,public,,0,[],,1648711065.0,,,,
,[],False,,Ok_Professional2346,,,[],,,,text,t2_l4t3j4sr,False,False,God/allah will judge these criminal looters and mfkrs!,9029a97ca31a52c0924cbaedbc108ad5c546dc60,True,False,,,,,0,1648739818,,0,{},i2uuzdz,False,t3_tswt7y,False,True,t3_tswt7y,/r/war/comments/tswt7y/watch_absolutely_wild_kadyrovtsy_tiktok_chechens/i2uuzdz/,1648739834,1,True,True,False,war,t5_2qhk8,r/war,public,,0,[],,1648711018.0,,,,
,[],False,,[deleted],,,,,,dark,,,,,[removed],fe993932d6dced4c0a879e9aa5d7a6e0fbb467f5,True,True,,,DELETED,,0,1648739765,,0,{},i2uuuis,False,t3_tsnbqi,False,True,t1_i2udqeu,/r/war/comments/tsnbqi/ukrainian_drivers_goes_thru_antitank_mines_near/i2uuuis/,1648739780,1,True,True,False,war,t5_2qhk8,r/war,public,,0,[],,1648710965.0,,,,
,[],False,,kalrune1,,,[],,,,text,t2_bljnab9d,False,False,"don't call them rebels, they are just terrorists.",6833cb83868dee4769bee3e64f0333f7be7c3a6d,True,False,,,,,0,1648739730,,0,{},i2uur9t,False,t3_tszswx,False,True,t3_tszswx,/r/war/comments/tszswx/turkish_army_squad_gets_wiped_out_and_looted/i2uur9t/,1648739742,1,True,True,False,war,t5_2qhk8,r/war,public,,0,[],,1648710930.0,,,,
,[],False,,max____payne,,,[],,,,text,t2_2v97mwct,False,False,Hey guys check your backstop,b689682f29d34242290bfe7efd37b1139b4d98a1,True,False,,,,,0,1648739671,,0,{},i2uum0f,False,t3_tssy9v,False,True,t3_tssy9v,/r/war/comments/tssy9v/kadyrov_occupiers_spotted_traffic_lights_for_the/i2uum0f/,1648739692,1,True,True,False,war,t5_2qhk8,r/war,public,,0,[],,1648710871.0,,,,
,[],False,,kalrune1,,,[],,,,text,t2_bljnab9d,False,False,terrorists. hide like a mouse.,8cf178542003147eb7782496c8916658a05b6b3b,True,False,,,,,0,1648739656,,0,{},i2uukod,False,t3_tszswx,False,True,t3_tszswx,/r/war/comments/tszswx/turkish_army_squad_gets_wiped_out_and_looted/i2uukod/,1648739675,1,True,True,False,war,t5_2qhk8,r/war,public,,0,[],,1648710856.0,,,,
,[],False,,marianass,,,[],,,,text,t2_36h7g,False,False,"In another thread somebody said that the video of Ukrainians shooting the legs of Russian soldiers was recorded in a dairy farm, could it be related?",21b639e4f6ae0722e65eefc60f2e961bf1ab544a,True,False,,,,,0,1648739652,,0,{},i2uukbp,False,t3_tswfnv,False,True,t3_tswfnv,/r/war/comments/tswfnv/denazification_and_demilitarization_of_a_barn_in/i2uukbp/,1648739667,1,True,True,False,war,t5_2qhk8,r/war,public,,0,[],,1648710852.0,,,,
,[],False,,[deleted],,,,,,dark,,,,,[removed],fe993932d6dced4c0a879e9aa5d7a6e0fbb467f5,True,True,,,DELETED,,0,1648739651,,0,{},i2uuk99,False,t3_tszswx,False,True,t3_tszswx,/r/war/comments/tszswx/turkish_army_squad_gets_wiped_out_and_looted/i2uuk99/,1648739667,1,True,True,False,war,t5_2qhk8,r/war,public,,0,[],,1648710851.0,,,,
,[],False,,randomTeets,,,[],,,,text,t2_a1hww59d,False,False,Chechens can't do the grenade trick with their vehicles like in Halo,478be3b47e3f04901caba4a78b31f6c9201eb4b5,True,False,,,,,0,1648739572,,0,{},i2uud11,False,t3_tswt7y,False,True,t3_tswt7y,/r/war/comments/tswt7y/watch_absolutely_wild_kadyrovtsy_tiktok_chechens/i2uud11/,1648739591,1,True,True,False,war,t5_2qhk8,r/war,public,,0,[],,1648710772.0,,,,
,[],False,,Faraya97,,,[],,,,text,t2_ijbfodkm,False,False,Source brah,eca65cd4cb076eb384740ff51069e34aebcae7b5,True,False,,,,,0,1648739549,,0,{},i2uuast,False,t3_tswi2e,False,True,t3_tswi2e,/r/war/comments/tswi2e/russian_scum_kidnapped_a_12yearold_girl_from/i2uuast/,1648739566,1,True,True,False,war,t5_2qhk8,r/war,public,,0,[],,1648710749.0,,,,
,[],False,,ironiccapslock,,,[],,,,text,t2_rjygs,False,False,"Did they though? Maybe on paper, but if that paper was based on lies and presumptions, what is that worth?  We may be discovering the true state of their military in real time.",b984b0262ca52e9fbee6b4bf27d7c787620bcb04,True,False,,,,,0,1648739403,,0,{},i2utxic,False,t3_tsk0yx,False,True,t1_i2rsryp,/r/war/comments/tsk0yx/will_russia_lose/i2utxic/,1648739419,1,True,True,False,war,t5_2qhk8,r/war,public,,0,[],,1648710603.0,,,,
,[],False,,max____payne,,,[],,,,text,t2_2v97mwct,False,False,Anything is possible,96a7c60131f52aaa0908ac2e27db50894ab716a6,True,False,,,,,0,1648739402,,0,{},i2utxfm,False,t3_tscls1,False,True,t1_i2sn2p8,/r/war/comments/tscls1/like_he_said_welcome_to_ukraine_ukrainian/i2utxfm/,1648739419,1,True,True,False,war,t5_2qhk8,r/war,public,,0,[],,1648710602.0,,,,
,[],False,,1inlittlefort,,,[],,,,text,t2_a7fmdtqy,False,False,"Nobody wins when nukes are used. There's to many nukes on both sides for anyone to survive. Hitler did it right, don't know if Putin will, he may decide to take everyone with him.",b210e97dbdcf55db1ce84c38dff7bd7281e44f33,True,False,,,,,0,1648739396,,0,{},i2utwwg,False,t3_tsk0yx,False,True,t1_i2tfojt,/r/war/comments/tsk0yx/will_russia_lose/i2utwwg/,1648739415,1,True,True,False,war,t5_2qhk8,r/war,public,,0,[],,1648710596.0,,,,
,[],False,,BrokeRunner44,,,[],,,,text,t2_24w6ijgu,False,False,Military service is compulsory in Turkey.,3bdc1d4c43fe0b4dd7c4f17ee4c016d542882bbf,True,False,,,,,0,1648739389,,0,{},i2utw9f,False,t3_tszswx,False,True,t1_i2unpw9,/r/war/comments/tszswx/turkish_army_squad_gets_wiped_out_and_looted/i2utw9f/,1648739406,1,True,True,False,war,t5_2qhk8,r/war,public,,0,[],,1648710589.0,,,,
,[],False,,Lost_CrusaderX,,,[],,,,text,t2_apkac7gd,False,False,I'm not well informed but farms are valuable sources for food so perhaps the idea was to try starve the local area? Probably just shelled it because they could and they wanted to though,7b61454e02fe9aa1b2c25156c3eb3b41726d0460,True,False,,,,,0,1648739225,,0,{},i2uthd6,False,t3_tswfnv,False,True,t1_i2upxwp,/r/war/comments/tswfnv/denazification_and_demilitarization_of_a_barn_in/i2uthd6/,1648739238,1,True,True,False,war,t5_2qhk8,r/war,public,,0,[],,1648710425.0,,,,
,[],False,,OpeningNorth452,,,[],,,,text,t2_9f8r9nx9,False,False," And you wonder why the world hates America  do as I say not as I do  bullshit   You can look the war crimes that happen there even from marine 
Testimony",f30d1b2816479f2b19f838cf745c5993f84a1387,True,False,,,,,0,1648739216,,0,{},i2utgoi,False,t3_tnj0d8,False,True,t1_i2usoxs,/r/war/comments/tnj0d8/russian_army_and_dpr_forces_patrol_the_streets_of/i2utgoi/,1648739230,1,True,True,False,war,t5_2qhk8,r/war,public,,0,[],,1648710416.0,,,,
,[],False,,Few_Ask_4823,,,[],,,,text,t2_kdw37h6a,False,False,Baghdad,3d5e74238f68cc7d56a1299758895bfa575c05a3,True,False,,,,,0,1648739169,,0,{},i2utcdq,False,t3_ts4vjs,False,True,t1_i2qtm1i,/r/war/comments/ts4vjs/this_is_mariupol_just_to_put_things_into/i2utcdq/,1648739184,1,True,True,False,war,t5_2qhk8,r/war,public,,0,[],,1648710369.0,,,,
,[],False,,Ok_Professional2346,,,[],,,,text,t2_l4t3j4sr,False,False,"puh... thats close combat.. i forst thought it was CStrike gaming, but its real...",7d56c61170e3327bf0c5ca89351957562bc375db,True,False,,,,,0,1648739160,,0,{},i2utbl3,False,t3_tszswx,False,True,t3_tszswx,/r/war/comments/tszswx/turkish_army_squad_gets_wiped_out_and_looted/i2utbl3/,1648739175,1,True,True,False,war,t5_2qhk8,r/war,public,,0,[],,1648710360.0,,,,
,[],False,,RegionOpposite2318,,,[],,,,text,t2_8j189k4d,False,False,"Turkey is not kemalist, it’s rather Muslim.Nearly every person who is Muslim and supports Akp hates Atashirk. They praise him like he is some type of god🤦🏻‍♂️I wish every kurdish person freedom except the ones who support terrorism and israel.The statues and pictures of Atatürk are still there cause people who still do support Atatürk would get upset and start another coup",16bc5ac57f97138e8fd0403c9ef3d1a2404003aa,True,False,,,,,0,1648739055,,0,{},i2ut20o,False,t3_tszswx,False,True,t1_i2uo64g,/r/war/comments/tszswx/turkish_army_squad_gets_wiped_out_and_looted/i2ut20o/,1648739070,1,True,True,False,war,t5_2qhk8,r/war,public,,0,[],,1648710255.0,,,,
,[],False,,yigit-b1,,,[],,,,text,t2_ev86e033,False,False,"Call your cousin or other relative, because they're the people you can marry as a donkey.",fafea91116231972410a5e20016a25b29b27a52e,True,False,,,,,0,1648739013,,0,{},i2usy3o,False,t3_tszswx,False,False,t1_i2usn6q,/r/war/comments/tszswx/turkish_army_squad_gets_wiped_out_and_looted/i2usy3o/,1648739028,1,True,True,False,war,t5_2qhk8,r/war,public,,0,[],,1648710213.0,,,,
,[],False,,TheCommies-backp,,,[],,,,text,t2_788do8ty,False,False,"Yes because I said that the US never shot anyone. And I completely condone the invasion of Iraq, that's totally exactly what I meant. My point is there wasn't US officials giving orders to shoot civilian, the majority of civilian casualties is because the combatants are wearing civilian clothing, in civilian areas, in a heavily populated area, so it's hard to identify the person with a bomb. Plus, I don't think Ukraine used child soldiers and women bomb carriers. So go fuck yourself",107d40af83030e754164c8869ef09421a1a78f04,True,False,,,,,0,1648738913,,0,{},i2usoxs,False,t3_tnj0d8,False,False,t1_i2sfs3z,/r/war/comments/tnj0d8/russian_army_and_dpr_forces_patrol_the_streets_of/i2usoxs/,1648738931,1,True,True,False,war,t5_2qhk8,r/war,public,,0,[],,1648710113.0,,,,
,[],False,,YZY21,,,[],,,,text,t2_chfipqp8,False,False,Ok I'm calling your mum,a7e0733189627debd057bacae2b7cec3c77b7564,True,False,,,,,0,1648738894,,0,{},i2usn6q,False,t3_tszswx,False,True,t1_i2usi33,/r/war/comments/tszswx/turkish_army_squad_gets_wiped_out_and_looted/i2usn6q/,1648738915,1,True,True,False,war,t5_2qhk8,r/war,public,,0,[],,1648710094.0,,,,
,[],False,,TheMotorcycleBoy,,,[],,,,text,t2_b1opg,False,False,"Doesn't make it wrong tho. (Of itself.)

Where a country has internal divisions and (as you see it) one side more readily aligns with your own world-view outlook and interests and the other side aligns with a contrary and opposing view, it's natural to use whatever means you have at your disposal to ensure the 'right' side comes out on top.

Don't forget there was a literal war going on for global control over most of the 20th century: the US and its allies propping up the Korean democracy, fighting communism in Vietnam, helping the Afghans repulse the Soviets. Meanwhile China and Russia were fighting (Korea and planes in Vietnam) and supplying the other side in all those conflicts.

That's how it's been. Welcome to the world!",3ed854fe031a4c10d37148ff3e5ab698f8c895ab,True,False,,,,,0,1648738860,,0,{},i2usk6v,False,t3_ts6dmp,False,True,t1_i2sdcbo,/r/war/comments/ts6dmp/why_the_west_got_rid_of_gadaffi/i2usk6v/,1648738876,1,True,True,False,war,t5_2qhk8,r/war,public,,0,[],,1648710060.0,,,,
,[],False,,yigit-b1,,,[],,,,text,t2_ev86e033,False,False,Go f*ck you donkey dont speak with me,11da392307afc572c7c2e21d45d80bf04e1ff8ee,True,False,,,,,0,1648738837,,0,{},i2usi33,False,t3_tszswx,False,True,t1_i2us1d1,/r/war/comments/tszswx/turkish_army_squad_gets_wiped_out_and_looted/i2usi33/,1648738851,1,True,True,False,war,t5_2qhk8,r/war,public,,0,[],,1648710037.0,,,,
,[],False,,hybex,,,[],,,,text,t2_6jdfdi0l,False,False,I would assume they are shooting at possibly still intact road safety cameras?,c22ed1a8ddd1dbdf5f13ece96c5863d7b84ad721,True,False,,,,,0,1648738729,,0,{},i2us88v,False,t3_tssy9v,False,True,t3_tssy9v,/r/war/comments/tssy9v/kadyrov_occupiers_spotted_traffic_lights_for_the/i2us88v/,1648738744,1,True,True,False,war,t5_2qhk8,r/war,public,,0,[],,1648709929.0,,,,
,[],False,,YZY21,,,[],,,,text,t2_chfipqp8,False,False,Wtf? What the hell is this mentality?? Did you created?? You would wandering with Mongolians if you wouldn't have the power of Islam. There are our bloods too. I don't wanna talk anymore because I don't feel good while talking such mentality people.,0bf09115a13a97262f91a74608dfba445fb6da04,True,False,,,,,0,1648738653,,0,{},i2us1d1,False,t3_tszswx,False,True,t1_i2urlgs,/r/war/comments/tszswx/turkish_army_squad_gets_wiped_out_and_looted/i2us1d1/,1648738665,1,True,True,False,war,t5_2qhk8,r/war,public,,0,[],,1648709853.0,,,,
,[],False,,yigit-b1,,,[],,,,text,t2_ev86e033,False,False,"We Turks created this homeland with our lives and blood, and of course, our language in this country and this state, and the language of those who were martyred in Çanakkale, will dominate. I said that we could not completely expel Kemalism, but you still say that it is dominant, but it is not like that. If you want to see Kemalism, look at the one-party period of the republic and see. Many Kurds, Turks and imams were destroyed for the sake of one-party rule... If you really want to see Kemalism, you will see the apocalypse.
Aga Türkçe biliyosun Türkçe konuş.",836a7c992409c4dc94a876ec2633f176e17f86bf,True,False,,,,,0,1648738477,,0,{},i2urlgs,False,t3_tszswx,False,True,t1_i2uqgz0,/r/war/comments/tszswx/turkish_army_squad_gets_wiped_out_and_looted/i2urlgs/,1648738492,1,True,True,False,war,t5_2qhk8,r/war,public,,0,[],,1648709677.0,,,,
,[],False,,StationFar6396,,,[],,,,text,t2_k2hxuz6k,False,False,"Are you ten years old? 

""British and france is not big, one nuke will nearly destroy the whole country.""

Wtf are you talking about?",06c25ef8991e38e717917c24b696375a3ca6b95a,True,False,,,,,0,1648738433,,0,{},i2urhei,False,t3_tstixf,False,True,t3_tstixf,/r/war/comments/tstixf/what_if_russia_goes_mad/i2urhei/,1648738455,1,True,True,False,war,t5_2qhk8,r/war,public,,0,[],,1648709633.0,,,,
