Unnamed: 0,all_awardings,archived,associated_award,author,author_flair_background_color,author_flair_css_class,author_flair_richtext,author_flair_template_id,author_flair_text,author_flair_text_color,author_flair_type,author_fullname,author_patreon_flair,author_premium,body,body_sha1,can_gild,collapsed,collapsed_because_crowd_control,collapsed_reason,collapsed_reason_code,comment_type,controversiality,created_utc,distinguished,gilded,gildings,id,is_submitter,link_id,locked,no_follow,parent_id,permalink,retrieved_utc,score,score_hidden,send_replies,stickied,subreddit,subreddit_id,subreddit_name_prefixed,subreddit_type,top_awarded_type,total_awards_received,treatment_tags,unrepliable_reason,created,author_cakeday,edited,editable,media_metadata
811.0,[],False,,ragepaperbonsai,,,[],,,,text,t2_1jy79rxp,False,False,"Installed by ukrainian forces. If they wanna get rid of it, they should just send some empty car over it like a slavs... Or simply move it away by hands...",350db2a09a29fde9aee8cd8ebb3760aad1a6927c,True,False,,,,,0,1648754683,,0,{},i2vxuew,False,t3_tsnbqi,False,True,t3_tsnbqi,/r/war/comments/tsnbqi/ukrainian_drivers_goes_thru_antitank_mines_near/i2vxuew/,1648754703,1,True,True,False,war,t5_2qhk8,r/war,public,,0,[],,1648725883.0,,,,
812.0,[],False,,Memoshka,,,[],,,,text,t2_j1m1tys,False,False,Ananı sikeyim o zaman orospunun evladı,8f250a60dadceca4073dd3bbf48d5b91bc421b75,True,False,,,,,0,1648754578,,0,{},i2vxkkx,False,t3_tszswx,False,True,t1_i2vlxi4,/r/war/comments/tszswx/turkish_army_squad_gets_wiped_out_and_looted/i2vxkkx/,1648754593,1,True,True,False,war,t5_2qhk8,r/war,public,,0,[],,1648725778.0,,,,
813.0,[],False,,ARschoolAK,,,[],,,,text,t2_6m8f160h,False,False,Getting high and smoking guys,1d7e09b9d0abdcf041a83deeeec63dd320531956,True,False,,,,,0,1648754535,,0,{},i2vxgmp,False,t3_tt4rxz,False,True,t3_tt4rxz,/r/war/comments/tt4rxz/georgian_soldier_in_ukraine/i2vxgmp/,1648754556,1,True,True,False,war,t5_2qhk8,r/war,public,,0,[],,1648725735.0,,,,
814.0,[],False,,wozirix,,,[],,,,text,t2_jnomhf0,False,False,Same reason they still have the heads of Algerian martyrs for you to go see them in in a museum in Paris. Even though the Algerian government strictly asked for them just like the maps.,b52b80153fb2609fd2b5e26d1f9696e7edf02f22,True,False,,,,,0,1648754426,,0,{},i2vx6co,True,t3_tq6qs3,False,True,t1_i2j9172,/r/war/comments/tq6qs3/a_small_depiction_of_france_genocide_in_algeria/i2vx6co/,1648754446,1,True,True,False,war,t5_2qhk8,r/war,public,,0,[],,1648725626.0,,,,
815.0,[],False,,Daniels_2003,,,[],,,,text,t2_44up5lts,False,False,"A pea sized piece of shrapnel will make a nice labirint in your brain and drop you instantly like a sack of potatoes, eyes open, mouth half closed. 

It can be stopped by old WW2 helmets but not by your skull. 

Even rock fragments from the explosion can crack your skull, at times fatally so, and those may be stopped by a plastic construction helmet. 

That's why any helmet is better than no helmet, and why the helmet must be worn at all times if the danger of enemy fire is present.",1fbe0b8083693c399c1328d7250db62c9b7e54dc,True,False,,,,,0,1648754425,,0,{},i2vx69l,False,t3_tt4rxz,False,True,t1_i2vrc3d,/r/war/comments/tt4rxz/georgian_soldier_in_ukraine/i2vx69l/,1648754446,1,True,True,False,war,t5_2qhk8,r/war,public,,0,[],,1648725625.0,,,,
816.0,[],False,,AssAssiNovA846,,,[],,,,text,t2_dnrx0g4q,False,False,I see now you are dog of sex said. Go ahead learn your shitty history from terrorism,1d0c2afa741ed9816473c00ad7ef95a04faff838,True,False,,,,,0,1648754384,,0,{},i2vx2fi,False,t3_tszswx,False,True,t1_i2vq956,/r/war/comments/tszswx/turkish_army_squad_gets_wiped_out_and_looted/i2vx2fi/,1648754399,1,True,True,False,war,t5_2qhk8,r/war,public,,0,[],,1648725584.0,,,,
817.0,[],False,,The-Deacon,,,[],,,,text,t2_3zgm7u,False,False,Do you have similar projections for Russia?,f61552c3197950709b2261b0843253259ed71041,True,False,,,,,0,1648754263,,0,{},i2vwr1m,False,t3_trkfe7,False,True,t3_trkfe7,/r/war/comments/trkfe7/three_hypothetical_scenarios_for_a_russian/i2vwr1m/,1648754281,1,True,True,False,war,t5_2qhk8,r/war,public,,0,[],,1648725463.0,,,,
818.0,[],False,,minioflam,,,[],,,,text,t2_6y093pev,False,False,Could have died then the bodies burned,a0f698a1a9455b0207d726f26e6afc9fa1719eb0,True,False,,,,,0,1648754258,,0,{},i2vwqlz,False,t3_tt0a5n,False,True,t1_i2vl735,/r/war/comments/tt0a5n/russian_army_shot_down_a_ukrainian_helicopter/i2vwqlz/,1648754272,1,True,True,False,war,t5_2qhk8,r/war,public,,0,[],,1648725458.0,,,,
819.0,[],False,,Alessio-c137,,,[],,,,text,t2_6jdzsid2,False,False,"Good fucking job, this shows a great change in humanity, many people took their home animals with them, and some even go back to take other animals to safety, something unthinkable in other wars",a8515241241d3c4dbe05fd9a2bd9b3040e6141c9,True,False,,,,,0,1648754209,,0,{},i2vwm57,False,t3_ts0wzi,False,True,t3_ts0wzi,/r/war/comments/ts0wzi/ecoactivists_finally_got_to_the_yasnogorodskaya/i2vwm57/,1648754226,1,True,True,False,war,t5_2qhk8,r/war,public,,0,[],,1648725409.0,,,,
820.0,[],False,,[deleted],,,,,,dark,,,,,[removed],fe993932d6dced4c0a879e9aa5d7a6e0fbb467f5,True,True,,,DELETED,,0,1648754144,,0,{},i2vwg7q,False,t3_tszswx,False,True,t1_i2v4slu,/r/war/comments/tszswx/turkish_army_squad_gets_wiped_out_and_looted/i2vwg7q/,1648754158,1,True,True,False,war,t5_2qhk8,r/war,public,,0,[],,1648725344.0,,,,
821.0,[],False,,ragepaperbonsai,,,[],,,,text,t2_1jy79rxp,False,False,Dude just acting like he found a rare pokemon card lmao,4e9124a7d02a46e8f3c068070b65387a88db2013,True,False,,,,,0,1648754129,,0,{},i2vweti,False,t3_tswt7y,False,True,t3_tswt7y,/r/war/comments/tswt7y/watch_absolutely_wild_kadyrovtsy_tiktok_chechens/i2vweti/,1648754146,1,True,True,False,war,t5_2qhk8,r/war,public,,0,[],,1648725329.0,,,,
822.0,[],False,,[deleted],,,,,,dark,,,,,[removed],fe993932d6dced4c0a879e9aa5d7a6e0fbb467f5,True,True,,,DELETED,,0,1648754118,,0,{},i2vwdwy,False,t3_t63dpa,False,True,t3_t63dpa,/r/war/comments/t63dpa/russia_empire_of_evil_biggest_liars_and/i2vwdwy/,1648754137,1,True,True,False,war,t5_2qhk8,r/war,public,,0,[],,1648725318.0,,,,
823.0,[],False,,[deleted],,,,,,dark,,,,,[removed],fe993932d6dced4c0a879e9aa5d7a6e0fbb467f5,True,True,,,DELETED,,0,1648754081,,0,{},i2vwaja,False,t3_tt0o6h,False,True,t3_tt0o6h,/r/war/comments/tt0o6h/tik_tok_chechen_army_getting_shelled_by_ukrainian/i2vwaja/,1648754095,1,True,True,False,war,t5_2qhk8,r/war,public,,0,[],,1648725281.0,,,,
824.0,[],False,,manborg,,,[],,,,text,t2_9lcn8,False,False,"Unfortunately you have to engage from a far if your protecting heavy assets. The more stuff you have the harder it is to ambush.

I believe this is a reason long range engagements are more popular in more conventional engagements.",fdd4d925dd11c43f25d5a197870c2e0ebc5127cd,True,False,,,,,0,1648754067,,0,{},i2vw98w,False,t3_tszswx,False,True,t1_i2vi0wj,/r/war/comments/tszswx/turkish_army_squad_gets_wiped_out_and_looted/i2vw98w/,1648754083,1,True,True,False,war,t5_2qhk8,r/war,public,,0,[],,1648725267.0,,,,
825.0,[],False,,[deleted],,,,,,dark,,,,,[removed],fe993932d6dced4c0a879e9aa5d7a6e0fbb467f5,True,True,,,DELETED,,0,1648753996,,0,{},i2vw2ol,False,t3_tszswx,False,True,t1_i2v1fwh,/r/war/comments/tszswx/turkish_army_squad_gets_wiped_out_and_looted/i2vw2ol/,1648754012,1,True,True,False,war,t5_2qhk8,r/war,public,,0,[],,1648725196.0,,,,
826.0,[],False,,[deleted],,,,,,dark,,,,,[removed],fe993932d6dced4c0a879e9aa5d7a6e0fbb467f5,True,True,,,DELETED,,0,1648753924,,0,{},i2vvw4j,False,t3_tt4rxz,False,True,t1_i2vpcxb,/r/war/comments/tt4rxz/georgian_soldier_in_ukraine/i2vvw4j/,1648753936,1,True,True,False,war,t5_2qhk8,r/war,public,,0,[],,1648725124.0,,,,
827.0,[],False,,Vovkovych,,,[],,,,text,t2_15ohury2,False,True,There are pics of their documents and the face of the dead bodies that could be recognized.,35ee920faf5b551768ee862ec69172dc83b7134f,True,False,,,,,0,1648753896,,0,{},i2vvtk7,True,t3_tt0a5n,False,True,t1_i2vv0cm,/r/war/comments/tt0a5n/russian_army_shot_down_a_ukrainian_helicopter/i2vvtk7/,1648753915,1,True,True,False,war,t5_2qhk8,r/war,public,,0,[],,1648725096.0,,,,
828.0,[],False,,ragepaperbonsai,,,[],,,,text,t2_1jy79rxp,False,False,"About 80 percent of combat casualties are caused by anything but a bullet. So all that stuff flying around the battlefield is what kills people. Most of that stuff is stopped by a helmet. So this guy with a shemag around his head during shelling deserves a Darwin prize tho. Thats the fact, there is no space for ""i cant agree with you"" sorry :D",6bba0ad96ca99e3c74d65b7f1a2c88908e9af83c,True,False,,,,,0,1648753839,,0,{},i2vvoel,False,t3_tt4rxz,False,True,t1_i2vt31f,/r/war/comments/tt4rxz/georgian_soldier_in_ukraine/i2vvoel/,1648753852,1,True,True,False,war,t5_2qhk8,r/war,public,,0,[],,1648725039.0,,,,
829.0,[],False,,Zuutron,,,[],,,,text,t2_2hy7zf08,False,False,"Ahhhh okay! Thanks for the explanation,",8b463ac986944001958c4580efae56063ba7e6d7,True,False,,,,,0,1648753771,,0,{},i2vvi7i,False,t3_tshclo,False,True,t1_i2vtqc6,/r/war/comments/tshclo/taking_out_a_ukrainian_machine_gun_nest_with_a/i2vvi7i/,1648753784,1,True,True,False,war,t5_2qhk8,r/war,public,,0,[],,1648724971.0,,,,
830.0,[],False,,20WordsMax,,,[],,,,text,t2_753xkmvg,False,False,Source: https://www.defense.gouv.fr/ukraine-point-situation,e59929efc44abccff1628da0e7cdac31dfc26a81,True,False,,,,,0,1648753746,,0,{},i2vvfyv,True,t3_tstx90,False,False,t3_tstx90,/r/war/comments/tstx90/the_current_situation_of_the_russoukraine_war/i2vvfyv/,1648753764,1,True,True,False,war,t5_2qhk8,r/war,public,,0,[],,1648724946.0,,,,
831.0,[],False,,[deleted],,,,,,dark,,,,,[removed],fe993932d6dced4c0a879e9aa5d7a6e0fbb467f5,True,True,,,DELETED,,0,1648753723,,0,{},i2vvdvw,False,t3_tszswx,False,True,t1_i2up9ab,/r/war/comments/tszswx/turkish_army_squad_gets_wiped_out_and_looted/i2vvdvw/,1648753743,1,True,True,False,war,t5_2qhk8,r/war,public,,0,[],,1648724923.0,,,,
832.0,[],False,,Vovkovych,,,[],,,,text,t2_15ohury2,False,True,That bandaged corpse seems to be wearing a pilot uniform. Maybe he got wounded a few days ago but was still able to fly. But they were definitely extracting wounded soldiers from Mariupol.,d98db146e862117c3b08fdd45ff94495cf4764a8,True,False,,,,,0,1648753614,,0,{},i2vv3vy,True,t3_tt0a5n,False,True,t1_i2vfhl4,/r/war/comments/tt0a5n/russian_army_shot_down_a_ukrainian_helicopter/i2vv3vy/,1648753634,1,True,True,False,war,t5_2qhk8,r/war,public,,0,[],,1648724814.0,,,,
833.0,[],False,,[deleted],,,,,,dark,,,,,[removed],fe993932d6dced4c0a879e9aa5d7a6e0fbb467f5,True,True,,,DELETED,,0,1648753612,,0,{},i2vv3q1,False,t3_tszswx,False,True,t3_tszswx,/r/war/comments/tszswx/turkish_army_squad_gets_wiped_out_and_looted/i2vv3q1/,1648753625,1,True,True,False,war,t5_2qhk8,r/war,public,,0,[],,1648724812.0,,,,
834.0,[],False,,gsrmn,,,[],,,,text,t2_8m8qg,False,False,Confirmed where?,1d5541454cdde059ec2751a9241432715fd8ff13,True,False,,,,,0,1648753576,,0,{},i2vv0cm,False,t3_tt0a5n,False,True,t1_i2vg1bx,/r/war/comments/tt0a5n/russian_army_shot_down_a_ukrainian_helicopter/i2vv0cm/,1648753596,1,True,True,False,war,t5_2qhk8,r/war,public,,0,[],,1648724776.0,,,,
835.0,[],False,,[deleted],,,,,,dark,,,,,[removed],fe993932d6dced4c0a879e9aa5d7a6e0fbb467f5,True,True,,,DELETED,,0,1648753562,,0,{},i2vuz5l,False,t3_tszswx,False,True,t1_i2vi6h9,/r/war/comments/tszswx/turkish_army_squad_gets_wiped_out_and_looted/i2vuz5l/,1648753583,1,True,True,False,war,t5_2qhk8,r/war,public,,0,[],,1648724762.0,,,,
836.0,[],False,,Vovkovych,,,[],,,,text,t2_15ohury2,False,True,"Kiev is not safe yet. The russians were lying, they are still not that far. The British Intelligence said today that they expect another push for Kiev before Monday. Besides, the closest Ukrainian forces to Mariupol are really far. And the russians still have a significant force in the region. They should never allowed the russians to encircle Mariupol like this if they expected it to hold. Unfortunately I don't think they are going to try to retake it anytime soon.",6dee3035baba45714a85569d1adb6a24a7653bad,True,False,,,,,0,1648753556,,0,{},i2vuyk5,True,t3_tt0a5n,False,False,t1_i2vftlc,/r/war/comments/tt0a5n/russian_army_shot_down_a_ukrainian_helicopter/i2vuyk5/,1648753574,1,True,True,False,war,t5_2qhk8,r/war,public,,0,[],,1648724756.0,,,,
837.0,[],False,,Kaviliar,,,[],,,,text,t2_55apof6p,False,False,"You know, for the most part, the Russian troops have no hatred for the Ukrainians. There is hatred and anger towards the nationalists from the battalions, yes, but not in ordinary soldiers. Yes, just look at the attitude towards captured Ukrainians and captured Russian soldiers, these are two huge differences. I can upload a video if you want.
By the way, where are you from?",b7ff513cb2c829b2e1464c75a5e506c04123f4f4,True,False,,,,,0,1648753523,,0,{},i2vuvjf,False,t3_tsk0yx,False,True,t1_i2vtrv7,/r/war/comments/tsk0yx/will_russia_lose/i2vuvjf/,1648753541,1,True,True,False,war,t5_2qhk8,r/war,public,,0,[],,1648724723.0,,,,
838.0,[],False,,eserekli,,,[],,,,text,t2_nvfqyat,False,False,LoL AKP jailed main Kurdish opposition party's (HDP) leader. He is still jailed. Only radical Islamic Kurds and Kurds who benefit directly by AKP govt support Erdoğan. This is why AKP's the only coalition partner is MHP. Main Nationalist Party. And every single day they are blaming opposition parties to be shelved partners with HDP 🤡 This guy is living in an imaginary Turkey 🤔,fc52a0100c537794eea80cfa556b00caebbe0d68,True,False,,,,,0,1648753410,,0,{},i2vul1j,False,t3_tszswx,False,False,t1_i2vgs8m,/r/war/comments/tszswx/turkish_army_squad_gets_wiped_out_and_looted/i2vul1j/,1648753427,1,True,True,False,war,t5_2qhk8,r/war,public,,0,[],,1648724610.0,,,,
839.0,[],False,,KonradLegionair,,,[],,,,text,t2_8no6a2dg,False,False,"My grandma conquered Italy on a skateboard and a bazooka.
Source: trust me bro",6f27f2bba2e212866a483d22091731a450a326bd,True,False,,,,,0,1648753377,,0,{},i2vui1g,False,t3_tswi2e,False,True,t3_tswi2e,/r/war/comments/tswi2e/russian_scum_kidnapped_a_12yearold_girl_from/i2vui1g/,1648753393,1,True,True,False,war,t5_2qhk8,r/war,public,,0,[],,1648724577.0,,,,
840.0,[],False,,HazMat_Glow_Worm,,,[],,,,text,t2_5uwb8h4q,False,False,"This is several years old, and there’s a longer video without the cuts too.",2f08ff683cc5cd1d2928ee523d11c268a1bf26c9,True,False,,,,,0,1648753298,,0,{},i2vuao3,False,t3_tszswx,False,True,t3_tszswx,/r/war/comments/tszswx/turkish_army_squad_gets_wiped_out_and_looted/i2vuao3/,1648753313,1,True,True,False,war,t5_2qhk8,r/war,public,,0,[],,1648724498.0,,,,
841.0,[],False,,ReeceR16,,,[],,,,text,t2_9axfg9ww,False,False,Fake as fuck that,f5dac66af752281341031c8e030c673489215661,True,False,,,,,0,1648753195,,0,{},i2vu16c,False,t3_tt0o6h,False,True,t3_tt0o6h,/r/war/comments/tt0o6h/tik_tok_chechen_army_getting_shelled_by_ukrainian/i2vu16c/,1648753211,1,True,True,False,war,t5_2qhk8,r/war,public,,0,[],,1648724395.0,,,,
842.0,[],False,,JIHAAAAAAD,,,[],,,,text,t2_gsy0h,False,False,"Wire guided ATGM, I think (might be laser but similar principle). Operator has to keep focusing onto the target for the duration of the flight and the fins keep rotating to adjust trajectory onto the target. It moves as it is not fire and forget when maintains a trajectory but is continuously being corrected causing these weird movements.",b939b5f7dda58a8ab3e1842a9dc9fad31d420c67,True,False,,,,,0,1648753151,,0,{},i2vtx0t,False,t3_tshclo,False,False,t1_i2vakmq,/r/war/comments/tshclo/taking_out_a_ukrainian_machine_gun_nest_with_a/i2vtx0t/,1648753165,1,True,True,False,war,t5_2qhk8,r/war,public,,0,[],,1648724351.0,,,,
843.0,[],False,,JIHAAAAAAD,,,[],,,,text,t2_gsy0h,False,False,"Wire guided ATGM, I think (might be laser but similar principle). Operator has to keep focusing onto the target for the duration of the flight and the fins keep rotating to adjust trajectory onto the target. It moves as it is not fire and forget when maintains a trajectory but is continuously being corrected causing these weird movements.",b939b5f7dda58a8ab3e1842a9dc9fad31d420c67,True,True,,,,,0,1648753139,,0,{},i2vtvxr,False,t3_tshclo,False,True,t1_i2umyaw,/r/war/comments/tshclo/taking_out_a_ukrainian_machine_gun_nest_with_a/i2vtvxr/,1648753157,1,True,True,False,war,t5_2qhk8,r/war,public,,0,[],,1648724339.0,,,,
844.0,[],False,,ExoticBamboo,,,[],,,,text,t2_3qs5ldjk,False,False,"&gt;they created an enemy to be hated.

Yet they are not the one who invaded their enemy",c28d45d4ffdea53a73da816266280bb909c6c19c,True,False,,,,,0,1648753095,,0,{},i2vtrv7,False,t3_tsk0yx,False,True,t1_i2vpt74,/r/war/comments/tsk0yx/will_russia_lose/i2vtrv7/,1648753110,1,True,True,False,war,t5_2qhk8,r/war,public,,0,[],,1648724295.0,,,,
845.0,[],False,,AlphaDevill,,,[],,,,text,t2_gteqetxt,False,False,u/savevideobot,f195b0d1f5ce50b9b3e9029a442e58db08d61512,True,False,,,,,0,1648753087,,0,{},i2vtr1j,False,t3_tszswx,False,True,t3_tszswx,/r/war/comments/tszswx/turkish_army_squad_gets_wiped_out_and_looted/i2vtr1j/,1648753106,1,True,True,False,war,t5_2qhk8,r/war,public,,0,[],,1648724287.0,,,,
846.0,[],False,,[deleted],,,,,,dark,,,,,[removed],fe993932d6dced4c0a879e9aa5d7a6e0fbb467f5,True,True,,,DELETED,,0,1648753084,,0,{},i2vtqrq,False,t3_p7f7ln,False,True,t1_h9nazfv,/r/war/comments/p7f7ln/us_troops_in_afghanistan_date_unknown/i2vtqrq/,1648753106,1,True,True,False,war,t5_2qhk8,r/war,public,,0,[],,1648724284.0,,,,
847.0,[],False,,ragepaperbonsai,,,[],,,,text,t2_1jy79rxp,False,False,Hm,3209c0d4efd4dd94c7f3c576189b74dabd1048e0,True,False,,,,,0,1648753083,,0,{},i2vtqpc,False,t3_tsvvve,False,True,t3_tsvvve,/r/war/comments/tsvvve/a_brave_russian_tank_is_at_war_with_an_empty_house/i2vtqpc/,1648753097,1,True,True,False,war,t5_2qhk8,r/war,public,,0,[],,1648724283.0,,,,
848.0,[],False,,JIHAAAAAAD,,,[],,,,text,t2_gsy0h,False,False,"Wire guided ATGM, I think (might be laser but similar principle). Operator has to keep focusing onto the target for the duration of the flight and the fins keep rotating to adjust trajectory onto the target. It moves as it is not fire and forget when maintains a trajectory but is continuously being corrected causing these weird movements.",b939b5f7dda58a8ab3e1842a9dc9fad31d420c67,True,False,,,,,0,1648753079,,0,{},i2vtqc6,False,t3_tshclo,False,True,t1_i2smkv1,/r/war/comments/tshclo/taking_out_a_ukrainian_machine_gun_nest_with_a/i2vtqc6/,1648753098,1,True,True,False,war,t5_2qhk8,r/war,public,,0,[],,1648724279.0,,,,
849.0,[],False,,AlphaDevill,,,[],,,,text,t2_gteqetxt,False,False,u/savevideo,70a0f94b1709054e8c936673e18a6bab7d60f29f,True,False,,,,,0,1648753049,,0,{},i2vtniv,False,t3_tszswx,False,True,t3_tszswx,/r/war/comments/tszswx/turkish_army_squad_gets_wiped_out_and_looted/i2vtniv/,1648753065,1,True,True,False,war,t5_2qhk8,r/war,public,,0,[],,1648724249.0,,,,
850.0,[],False,,[deleted],,,,,,dark,,,,,[removed],fe993932d6dced4c0a879e9aa5d7a6e0fbb467f5,True,True,,,DELETED,,0,1648753044,,0,{},i2vtn0d,False,t3_p7f7ln,False,True,t1_h9lveji,/r/war/comments/p7f7ln/us_troops_in_afghanistan_date_unknown/i2vtn0d/,1648753060,1,True,True,False,war,t5_2qhk8,r/war,public,,0,[],,1648724244.0,,,,
851.0,[],False,,ragepaperbonsai,,,[],,,,text,t2_1jy79rxp,False,False,Looks like redneck rampage to me or wtf is goin on there? :D,ecf874c984dbc487c2053b3f3acdc32afdbe7e70,True,False,,,,,0,1648752980,,0,{},i2vth72,False,t3_tsvlzm,False,True,t3_tsvlzm,/r/war/comments/tsvlzm/ukrainian_artilery_found_russians_armored_car_in/i2vth72/,1648752997,1,True,True,False,war,t5_2qhk8,r/war,public,,0,[],,1648724180.0,,,,
852.0,[],False,,tactical_otb,,,[],,,,text,t2_3yzqmlt6,False,False,u/savevideobot,f195b0d1f5ce50b9b3e9029a442e58db08d61512,True,False,,,,,0,1648752893,,0,{},i2vt95y,False,t3_tt4rxz,False,True,t3_tt4rxz,/r/war/comments/tt4rxz/georgian_soldier_in_ukraine/i2vt95y/,1648752913,1,True,True,False,war,t5_2qhk8,r/war,public,,0,[],,1648724093.0,,,,
853.0,[],False,,Beginning-Shower121,,,[],,,,text,t2_dto8hmc5,False,False,And that goes against Russias stated plans if they don’t take dombass they have lost that’s what they said there objective is,7ece35988dd2d673c2d4a662024b0b2cae76a449,True,False,,,,,0,1648752854,,0,{},i2vt5fv,False,t3_ts4vjs,False,True,t1_i2vsxp1,/r/war/comments/ts4vjs/this_is_mariupol_just_to_put_things_into/i2vt5fv/,1648752871,1,True,True,False,war,t5_2qhk8,r/war,public,,0,[],,1648724054.0,,,,
854.0,[],False,,Nostrategy17,,,[],,,,text,t2_fd2isnrv,False,False,Give me them fires broda i am all kebab 😈😘 i wouldnt want to fuck 72 huris anyways.,013b9009813dfa076f43b7023511d35a102a7b0c,True,False,,,,,0,1648752837,,0,{},i2vt3uf,False,t3_tszswx,False,True,t1_i2vsx7v,/r/war/comments/tszswx/turkish_army_squad_gets_wiped_out_and_looted/i2vt3uf/,1648752859,1,True,True,False,war,t5_2qhk8,r/war,public,,0,[],,1648724037.0,,,,
855.0,[],False,,vinmel01,,,[],,,,text,t2_68yppvi1,False,False,"True, just hope it don't fall directly on your head, but if they just drop it randomly it's not verry likely",8efb8026bad88d6f80d9fdf18c610cdf6f296df1,True,False,,,,,0,1648752828,,0,{},i2vt31f,False,t3_tt4rxz,False,True,t1_i2vs0ad,/r/war/comments/tt4rxz/georgian_soldier_in_ukraine/i2vt31f/,1648752841,1,True,True,False,war,t5_2qhk8,r/war,public,,0,[],,1648724028.0,,,,
856.0,[],False,,Beginning-Shower121,,,[],,,,text,t2_dto8hmc5,False,False,Nato didnt have any interest to begin with cause ukraine couldn’t join soooo,fd98e6b12f78ccb01854535276361997fb57abbc,True,False,,,,,0,1648752821,,0,{},i2vt2dz,False,t3_ts4vjs,False,True,t1_i2vsxp1,/r/war/comments/ts4vjs/this_is_mariupol_just_to_put_things_into/i2vt2dz/,1648752833,1,True,True,False,war,t5_2qhk8,r/war,public,,0,[],,1648724021.0,,,,
857.0,[],False,,ragepaperbonsai,,,[],,,,text,t2_1jy79rxp,False,False,"There is no reason to get mad. They already almost achieved their goals... And those sanctions? Who cares, they will do business with China, India, Iran and many other countries... While Europe will hit the bottom in next months/years... Or what do you think about our EU future?",44603a5aea4074e00d9e0699d0c696acaf411e39,True,False,,,,,0,1648752813,,0,{},i2vt1ml,False,t3_tstixf,False,True,t3_tstixf,/r/war/comments/tstixf/what_if_russia_goes_mad/i2vt1ml/,1648752824,1,True,True,False,war,t5_2qhk8,r/war,public,,0,[],,1648724013.0,,,,
858.0,[],False,,hsoj_1,,,[],,,,text,t2_44w9w507,False,False,You wouldn’t be able to get your cars through the big hole you just created,efb733e1cff47366425b4311cc24e2d63215faca,True,False,,,,,0,1648752812,,0,{},i2vt1i4,False,t3_tsnbqi,False,True,t1_i2t5w4x,/r/war/comments/tsnbqi/ukrainian_drivers_goes_thru_antitank_mines_near/i2vt1i4/,1648752825,1,True,True,False,war,t5_2qhk8,r/war,public,,0,[],,1648724012.0,,,,
859.0,[],False,,koslovsettz1,,,[],,,,text,t2_4x90v6m7,False,False,"Most people think so, but from my perspective Russia just want to raze the country so nato lose the interest in it.",8bceb7bcce7ed6ffe27d3bc2897ed08a857b4e09,True,True,,,,,0,1648752771,,0,{},i2vsxp1,False,t3_ts4vjs,False,True,t1_i2rkeg2,/r/war/comments/ts4vjs/this_is_mariupol_just_to_put_things_into/i2vsxp1/,1648752786,1,True,True,False,war,t5_2qhk8,r/war,public,,0,[],,1648723971.0,,,,
860.0,[],False,,YZY21,,,[],,,,text,t2_chfipqp8,False,False,"“You will be defeated and gathered together to Hell, and worst indeed is that place to rest.”",8b6a55b78c8059659d230ea4007a1f8914b47830,True,False,,,,,0,1648752766,,0,{},i2vsx7v,False,t3_tszswx,False,True,t1_i2vrvfg,/r/war/comments/tszswx/turkish_army_squad_gets_wiped_out_and_looted/i2vsx7v/,1648752777,1,True,True,False,war,t5_2qhk8,r/war,public,,0,[],,1648723966.0,,,,
861.0,[],False,,Beginning-Shower121,,,[],,,,text,t2_dto8hmc5,False,False,The first one was a single soldier who got life in prison not comparable to mauripol and he second was said to have been a mistake,8fcacdb5a88e7abf22367fa8005a866c4a58bcef,True,False,,,,,0,1648752742,,0,{},i2vsuyi,False,t3_ts4vjs,False,True,t1_i2vaz50,/r/war/comments/ts4vjs/this_is_mariupol_just_to_put_things_into/i2vsuyi/,1648752755,1,True,True,False,war,t5_2qhk8,r/war,public,,0,[],,1648723942.0,,,,
862.0,[],False,,The-Real-Bearfort,,,[],,,,text,t2_cupc0rlc,False,False,mabe,21d2b4433ec3a25f38849a4c11abfa768131c270,True,False,,,,,0,1648752732,,0,{},i2vsu0c,False,t3_ts3hx6,False,True,t1_i2trn8y,/r/war/comments/ts3hx6/cats_also_love_ukrainian_army/i2vsu0c/,1648752756,1,True,True,False,war,t5_2qhk8,r/war,public,,0,[],,1648723932.0,,,,
863.0,[],False,,The-Real-Bearfort,,,[],,,,text,t2_cupc0rlc,False,False,thats what im woundering,c1cef5c1c956146d40e2eb7b5c1f198fe4758edd,True,False,,,,,0,1648752722,,0,{},i2vst4e,False,t3_ts3hx6,False,True,t1_i2spjxm,/r/war/comments/ts3hx6/cats_also_love_ukrainian_army/i2vst4e/,1648752750,1,True,True,False,war,t5_2qhk8,r/war,public,,0,[],,1648723922.0,,,,
864.0,[],False,,The-Real-Bearfort,,,[],,,,text,t2_cupc0rlc,False,False,why is there a us flag,71ae9cc84c3420b1d1959a7edc54c82d17feaf8f,True,False,,,,,0,1648752685,,0,{},i2vspms,False,t3_ts3hx6,False,True,t3_ts3hx6,/r/war/comments/ts3hx6/cats_also_love_ukrainian_army/i2vspms/,1648752697,1,True,True,False,war,t5_2qhk8,r/war,public,,0,[],,1648723885.0,,,,
865.0,[],False,,Nostrategy17,,,[],,,,text,t2_fd2isnrv,False,False,I wouldnt think like this. But i wouldnt expect less from someone who curses ataturk.,9d8b7c520453bb0077703beee711cd80090b2f9b,True,False,,,,,0,1648752449,,0,{},i2vs3p1,False,t3_tszswx,False,True,t1_i2vrv4a,/r/war/comments/tszswx/turkish_army_squad_gets_wiped_out_and_looted/i2vs3p1/,1648752465,1,True,True,False,war,t5_2qhk8,r/war,public,,0,[],,1648723649.0,,,,
866.0,[],False,,The-Real-Bearfort,,,[],,,,text,t2_cupc0rlc,False,False,what the cow thats crazy,f0e7bee7bc4d488efa9aed26f191834d5bc7ccde,True,False,,,,,0,1648752435,,0,{},i2vs2bw,False,t3_tsnbqi,False,True,t3_tsnbqi,/r/war/comments/tsnbqi/ukrainian_drivers_goes_thru_antitank_mines_near/i2vs2bw/,1648752448,1,True,True,False,war,t5_2qhk8,r/war,public,,0,[],,1648723635.0,,,,
