Unnamed: 0,all_awardings,archived,associated_award,author,author_flair_background_color,author_flair_css_class,author_flair_richtext,author_flair_template_id,author_flair_text,author_flair_text_color,author_flair_type,author_fullname,author_patreon_flair,author_premium,body,body_sha1,can_gild,collapsed,collapsed_because_crowd_control,collapsed_reason,collapsed_reason_code,comment_type,controversiality,created_utc,distinguished,gilded,gildings,id,is_submitter,link_id,locked,no_follow,parent_id,permalink,retrieved_utc,score,score_hidden,send_replies,stickied,subreddit,subreddit_id,subreddit_name_prefixed,subreddit_type,top_awarded_type,total_awards_received,treatment_tags,unrepliable_reason,created,author_cakeday,edited,editable,media_metadata
,[],False,,Dont_Say_No_to_Panda,,default,[],,,dark,text,t2_mp8dh,False,False,Do you have the link to this debunking as I’m sure this video will be popular amongst the “both sides” crowd?,b282558703f18f09163471f42820effcba1e7ae4,True,False,,,,,0,1648564904,,0,{},i2kiikw,False,t3_tqd0yi,False,True,t1_i2hpkns,/r/UkraineWarReports/comments/tqd0yi/anonymous_has_revealed_an_important/i2kiikw/,1648564921,1,False,True,False,UkraineWarReports,t5_5wncl5,r/UkraineWarReports,public,,0,[],,1648536104.0,,,,
,[],False,,oioioimatematehey,,default,[],,,dark,text,t2_l0hs208a,False,False,They are the new Ghostbusters 😂,54ae66f6a1b648dc4e79ac16c46598eb8aaa7872,True,False,,,,,0,1648564758,,0,{},i2ki5s8,True,t3_tr10og,False,True,t1_i2khy2p,/r/UkraineWarReports/comments/tr10og/watch_insane_combat_footage_of_kadyrovtsy_tiktok/i2ki5s8/,1648564773,1,False,True,False,UkraineWarReports,t5_5wncl5,r/UkraineWarReports,public,,0,[],,1648535958.0,,,,
,[],False,,Loud_Armadillo_5509,,default,[],,,dark,text,t2_39ddwduc,False,False,Of being a senile old fool who forces his White House handlers to continuously clean up after his senile mistakes!,faa01a93d555289d89c8adb4aa67edcea389793d,True,False,,,,,0,1648564692,,0,{},i2ki02f,False,t3_tosyh4,False,True,t1_i2asvqc,/r/UkraineWarReports/comments/tosyh4/the_us_president_joe_biden_called_putin_a_butcher/i2ki02f/,1648564705,1,False,True,False,UkraineWarReports,t5_5wncl5,r/UkraineWarReports,public,,0,[],,1648535892.0,,,,
,[],False,,No-Marsupial3128,,default,[],,,dark,text,t2_52rgiozz,False,False,"Chechen army, fighting buildings, fighting air and dust. Protectors of TikToks and Prada boots.",370a4506c12e453ea02a4826d6b55f5b4b7ec877,True,False,,,,,0,1648564669,,0,{},i2khy2p,False,t3_tr10og,False,True,t3_tr10og,/r/UkraineWarReports/comments/tr10og/watch_insane_combat_footage_of_kadyrovtsy_tiktok/i2khy2p/,1648564682,1,False,True,False,UkraineWarReports,t5_5wncl5,r/UkraineWarReports,public,,0,[],,1648535869.0,,,,
,[],False,,mcnatjm,,default,[],,,dark,text,t2_42dl6ln9,False,False,"Not insane, and barely combat footage.",a465c570877b2a0e75604eda637b7f4aa7597fe3,True,False,,,,,0,1648564631,,0,{},i2khuol,False,t3_tr10og,False,True,t3_tr10og,/r/UkraineWarReports/comments/tr10og/watch_insane_combat_footage_of_kadyrovtsy_tiktok/i2khuol/,1648564651,1,False,True,False,UkraineWarReports,t5_5wncl5,r/UkraineWarReports,public,,0,[],,1648535831.0,,,,
,[],False,,nycmagic00,,default,[],,,dark,text,t2_3zzd3fr1,False,False,He meant to say “we’re not able to take Kyiv because our military is all bark so we’ll stop taking massive loses. “,844a97fbcf40728cbc1acfe4444ae958f0a90c4a,True,False,,,,,0,1648564368,,0,{},i2kh7gz,False,t3_tr0b6p,False,True,t3_tr0b6p,/r/UkraineWarReports/comments/tr0b6p/russia_says_will_radically_reduce_military/i2kh7gz/,1648564382,1,False,True,False,UkraineWarReports,t5_5wncl5,r/UkraineWarReports,public,,0,[],,1648535568.0,,,,
,[],False,,AutoModerator,,,[],,,,text,t2_6l4z3,False,True,"This is a reminder to check the r/UkraineWarReports rules. Every post with 3+ reports will be removed automatically. 


*I am a bot, and this action was performed automatically. Please [contact the moderators of this subreddit](/message/compose/?to=/r/UkraineWarReports) if you have any questions or concerns.*",e5688e013c65d4c1643d0390e149f3023f592783,True,False,,,,,0,1648564260,moderator,0,{},i2kgy1r,False,t3_tr124t,False,True,t3_tr124t,/r/UkraineWarReports/comments/tr124t/russiaukraine_war_abramovich_spotted_in_istanbul/i2kgy1r/,1648564274,1,True,False,True,UkraineWarReports,t5_5wncl5,r/UkraineWarReports,public,,0,[],,1648535460.0,,,,
,[],False,,Loud_Armadillo_5509,,default,[],,,dark,text,t2_39ddwduc,False,False,Russians would just get caught doping in that sport too,55757acf4c3098dd6f4bb2b15f1a1a1e0db22e9b,True,False,,,,,0,1648564176,,0,{},i2kgqqb,False,t3_tqy6un,False,True,t1_i2kckmn,/r/UkraineWarReports/comments/tqy6un/a_russian_t80u_previously_unseen_appears_to_have/i2kgqqb/,1648564201,1,False,True,False,UkraineWarReports,t5_5wncl5,r/UkraineWarReports,public,,0,[],,1648535376.0,,,,
,[],False,,AutoModerator,,,[],,,,text,t2_6l4z3,False,True,"This is a reminder to check the r/UkraineWarReports rules. Every post with 3+ reports will be removed automatically. 


*I am a bot, and this action was performed automatically. Please [contact the moderators of this subreddit](/message/compose/?to=/r/UkraineWarReports) if you have any questions or concerns.*",e5688e013c65d4c1643d0390e149f3023f592783,True,False,,,,,0,1648564150,moderator,0,{},i2kgoj4,False,t3_tr10og,False,False,t3_tr10og,/r/UkraineWarReports/comments/tr10og/watch_insane_combat_footage_of_kadyrovtsy_tiktok/i2kgoj4/,1648564172,1,True,False,True,UkraineWarReports,t5_5wncl5,r/UkraineWarReports,public,,0,[],,1648535350.0,,,,
,[],False,,Zapfrog75,,default,[],,,dark,text,t2_5wl43az6,False,False,This was my question as well! One at the port and the patrol one is all I remember,1fdbcce7b2f51cd804154a26f14c13dd3281ffc2,True,False,,,,,0,1648564132,,0,{},i2kgmy8,False,t3_tqtyiz,False,True,t1_i2jxd9c,/r/UkraineWarReports/comments/tqtyiz/total_estimated_losses_of_the_enemy_from_2402_to/i2kgmy8/,1648564146,1,False,True,False,UkraineWarReports,t5_5wncl5,r/UkraineWarReports,public,,0,[],,1648535332.0,,,,
,[],False,,AutoModerator,,,[],,,,text,t2_6l4z3,False,True,"This is a reminder to check the r/UkraineWarReports rules. Every post with 3+ reports will be removed automatically. 


*I am a bot, and this action was performed automatically. Please [contact the moderators of this subreddit](/message/compose/?to=/r/UkraineWarReports) if you have any questions or concerns.*",e5688e013c65d4c1643d0390e149f3023f592783,True,False,,,,,0,1648563994,moderator,0,{},i2kgaxk,False,t3_tr0yre,False,True,t3_tr0yre,/r/UkraineWarReports/comments/tr0yre/anonymous_ruined_the_servers_of_the_russian/i2kgaxk/,1648564010,1,True,False,True,UkraineWarReports,t5_5wncl5,r/UkraineWarReports,public,,0,[],,1648535194.0,,,,
,[],False,,WeryWellDearSir,,default,[],,,dark,text,t2_5r2f3whg,False,False,"Fascist Duce Vladimir bravely hidden in the bunker:

Kyiv takeover failed miserably, we are in danger of encirclement on the easter side of the Dnieper river, losing already captured ground, taking heavy losses...

Sooooo we decided, to reduce the activity! We decided!!! WE!!!!

Soigu, hope you don't fuck it up in Eastern Ukraine, we will send reinforcements there to pretend that was the intention all the time! You all are morons and if you don't defeat Ukraine in the East, I will shoot all of you personally!!! NOW GO!

&amp;#x200B;

I can vividly see that meeting :-D",7d8bdb3bd00b4fc913e6a72d1cf2a64f148bb830,True,False,,,,,0,1648563901,,0,{},i2kg2wn,False,t3_tr0b6p,False,True,t3_tr0b6p,/r/UkraineWarReports/comments/tr0b6p/russia_says_will_radically_reduce_military/i2kg2wn/,1648563912,1,False,True,False,UkraineWarReports,t5_5wncl5,r/UkraineWarReports,public,,0,[],,1648535101.0,,,,
,[],False,,No-Marsupial3128,,default,[],,,dark,text,t2_52rgiozz,False,False,"2 h ago Russia promising to reduce the attacks on Cernihiv. Russia's POV : ""We did not say we will stop the attacks. We will reduce them, as in 5% less""",29df68b602ccacba89072aff421ae56e03f56ecb,True,False,,,,,0,1648563883,,0,{},i2kg1dj,False,t3_tr0mbh,False,True,t3_tr0mbh,/r/UkraineWarReports/comments/tr0mbh/during_a_live_interview_with_the_mayor_of/i2kg1dj/,1648563898,1,False,True,False,UkraineWarReports,t5_5wncl5,r/UkraineWarReports,public,,0,[],,1648535083.0,,,,
,[],False,,Some_Ukrainian_Guy,,default,[],,,dark,text,t2_1upfkgml,False,False,Reported by who?,d040ae2dd3c42b31066e8017547a1e3bbd355b60,True,False,,,,,0,1648563825,,0,{},i2kfwcc,False,t3_tqd0yi,False,True,t1_i2irzb7,/r/UkraineWarReports/comments/tqd0yi/anonymous_has_revealed_an_important/i2kfwcc/,1648563839,1,False,True,False,UkraineWarReports,t5_5wncl5,r/UkraineWarReports,public,,0,[],,1648535025.0,,,,
,[],False,,Shorecouple05,,default,[],,,dark,text,t2_bqvqra3o,False,False,There are yellow arrows lol can't see a god damn thing lol,7cba4d053b3fca9c87fcf63bc9e28b1ae30b7ae9,True,False,,,,,0,1648563474,,0,{},i2kf1wl,False,t3_tqyqrw,False,True,t1_i2k6707,/r/UkraineWarReports/comments/tqyqrw/counterattacks_result_on_the_map_between_march/i2kf1wl/,1648563486,1,False,True,False,UkraineWarReports,t5_5wncl5,r/UkraineWarReports,public,,0,[],,1648534674.0,,,,
,[],False,,jason_abacabb,,default,[],,,dark,text,t2_28ot7qx7,False,False,"LOL, I did not even see them the first time.",00da63647d71f9bf650964fa681b9f2c63bb8c4c,True,False,,,,,0,1648563246,,0,{},i2kehyf,False,t3_tqyqrw,False,True,t1_i2k6707,/r/UkraineWarReports/comments/tqyqrw/counterattacks_result_on_the_map_between_march/i2kehyf/,1648563262,1,False,True,False,UkraineWarReports,t5_5wncl5,r/UkraineWarReports,public,,0,[],,1648534446.0,,,,
,[],False,,No-Marsupial3128,,default,[],,,dark,text,t2_52rgiozz,False,False,Hey that is so romantic,d00496c72cabb51cb0a7cc148d572b7b5db660ba,True,False,,,,,0,1648563114,,0,{},i2ke6i9,False,t3_tqup0m,False,True,t3_tqup0m,/r/UkraineWarReports/comments/tqup0m/real_love_is/i2ke6i9/,1648563127,1,False,True,False,UkraineWarReports,t5_5wncl5,r/UkraineWarReports,public,,0,[],,1648534314.0,,,,
,[],False,,AutoModerator,,,[],,,,text,t2_6l4z3,False,True,"This is a reminder to check the r/UkraineWarReports rules. Every post with 3+ reports will be removed automatically. 


*I am a bot, and this action was performed automatically. Please [contact the moderators of this subreddit](/message/compose/?to=/r/UkraineWarReports) if you have any questions or concerns.*",e5688e013c65d4c1643d0390e149f3023f592783,True,False,,,,,0,1648563090,moderator,0,{},i2ke4g8,False,t3_tr0mbh,False,True,t3_tr0mbh,/r/UkraineWarReports/comments/tr0mbh/during_a_live_interview_with_the_mayor_of/i2ke4g8/,1648563105,1,True,False,True,UkraineWarReports,t5_5wncl5,r/UkraineWarReports,public,,0,[],,1648534290.0,,,,
,[],False,,AutoModerator,,,[],,,,text,t2_6l4z3,False,True,"This is a reminder to check the r/UkraineWarReports rules. Every post with 3+ reports will be removed automatically. 


*I am a bot, and this action was performed automatically. Please [contact the moderators of this subreddit](/message/compose/?to=/r/UkraineWarReports) if you have any questions or concerns.*",e5688e013c65d4c1643d0390e149f3023f592783,True,False,,,,,0,1648563039,moderator,0,{},i2ke065,False,t3_tr0mmn,False,True,t3_tr0mmn,/r/UkraineWarReports/comments/tr0mmn/anonymous_hack_vgtrk_the_allrussian_state/i2ke065/,1648563055,1,True,False,True,UkraineWarReports,t5_5wncl5,r/UkraineWarReports,public,,0,[],,1648534239.0,,,,
,[],False,,missmicckeyyy,,default,[],,,dark,text,t2_ctmrcaek,False,False,Just talking about who’d you kill…,6050b0835bfa394011b5f3b836385ab1ace4708c,True,False,,,,,0,1648562958,,0,{},i2kdtdg,False,t3_tqhgyo,False,True,t3_tqhgyo,/r/UkraineWarReports/comments/tqhgyo/russian_pow_agrees_to_join_ukranians_when_asked/i2kdtdg/,1648562972,1,False,True,False,UkraineWarReports,t5_5wncl5,r/UkraineWarReports,public,,0,[],,1648534158.0,,,,
,[],False,,TommyMoses,,default,[],,,dark,text,t2_6gyq6rhn,False,False,Putin happened.,6687d68e33790a5078ec3e3a389d311dd78688e8,True,False,,,,,0,1648562862,,0,{},i2kdl5n,False,t3_tqup0m,False,True,t1_i2k3qx9,/r/UkraineWarReports/comments/tqup0m/real_love_is/i2kdl5n/,1648562878,1,False,True,False,UkraineWarReports,t5_5wncl5,r/UkraineWarReports,public,,0,[],,1648534062.0,,,,
,[],False,,sanruan,,default,[],,,dark,text,t2_2iq3w3uk,False,False,"It is Russia’s only ice fee port in the region, basically a military base. They would not want to give it up easy.",2112d6db35b5d63e4d66a40632626ee8f8aca6e9,True,False,,,,,0,1648562827,,0,{},i2kdi6a,False,t3_tojbw2,False,True,t3_tojbw2,/r/UkraineWarReports/comments/tojbw2/in_poland_they_began_to_say_that_the_kaliningrad/i2kdi6a/,1648562841,1,False,True,False,UkraineWarReports,t5_5wncl5,r/UkraineWarReports,public,,0,[],,1648534027.0,,,,
,[],False,,AutoModerator,,,[],,,,text,t2_6l4z3,False,True,"This is a reminder to check the r/UkraineWarReports rules. Every post with 3+ reports will be removed automatically. 


*I am a bot, and this action was performed automatically. Please [contact the moderators of this subreddit](/message/compose/?to=/r/UkraineWarReports) if you have any questions or concerns.*",e5688e013c65d4c1643d0390e149f3023f592783,True,False,,,,,0,1648562813,moderator,0,{},i2kdgy3,False,t3_tr0jqd,False,True,t3_tr0jqd,/r/UkraineWarReports/comments/tr0jqd/russian_bmd_4_captured_by_ukrainians/i2kdgy3/,1648562825,1,True,False,True,UkraineWarReports,t5_5wncl5,r/UkraineWarReports,public,,0,[],,1648534013.0,,,,
,[],False,,AutoModerator,,,[],,,,text,t2_6l4z3,False,True,"This is a reminder to check the r/UkraineWarReports rules. Every post with 3+ reports will be removed automatically. 


*I am a bot, and this action was performed automatically. Please [contact the moderators of this subreddit](/message/compose/?to=/r/UkraineWarReports) if you have any questions or concerns.*",e5688e013c65d4c1643d0390e149f3023f592783,True,False,,,,,0,1648562753,moderator,0,{},i2kdbu4,False,t3_tr0j05,False,True,t3_tr0j05,/r/UkraineWarReports/comments/tr0j05/meaningful_talks_between_russia_ukraine_in_turkey/i2kdbu4/,1648562765,1,True,False,True,UkraineWarReports,t5_5wncl5,r/UkraineWarReports,public,,0,[],,1648533953.0,,,,
,[],False,,JackLord50,,default,[],,,dark,text,t2_7upgofe4,False,False,"It’s not No. 108, it’s No. 176.
Can you read?",8aafc8009c2e4cd54a0649720d9b3a3233cbe133,True,False,,,,,0,1648562696,,0,{},i2kd6xg,False,t3_tqd0yi,False,True,t1_i2jglxy,/r/UkraineWarReports/comments/tqd0yi/anonymous_has_revealed_an_important/i2kd6xg/,1648562712,1,False,True,False,UkraineWarReports,t5_5wncl5,r/UkraineWarReports,public,,0,[],,1648533896.0,,,,
,[],False,,ciaran036,,default,[],,,dark,text,t2_3cux3,False,False,"Well no. The Ukrainian military themselves seem unsure themselves. They have acknowledged that Russian disinformation is an issue but say they are ""investigating"" which is usually a good sign that it might be genuine. See [here](https://www.theguardian.com/world/2022/mar/28/ukraine-government-investigates-video-alleged-torture-russian-prisoners-of-war)",9123c9b32c8e04edc801f903c82ea7353596bcc9,True,False,,,,,0,1648562647,,0,{},i2kd2qe,False,t3_tqd0yi,False,True,t1_i2ka32r,/r/UkraineWarReports/comments/tqd0yi/anonymous_has_revealed_an_important/i2kd2qe/,1648562661,1,False,True,False,UkraineWarReports,t5_5wncl5,r/UkraineWarReports,public,,0,[],,1648533847.0,,,,
,[],False,,AutoModerator,,,[],,,,text,t2_6l4z3,False,True,"This is a reminder to check the r/UkraineWarReports rules. Every post with 3+ reports will be removed automatically. 


*I am a bot, and this action was performed automatically. Please [contact the moderators of this subreddit](/message/compose/?to=/r/UkraineWarReports) if you have any questions or concerns.*",e5688e013c65d4c1643d0390e149f3023f592783,True,False,,,,,0,1648562509,moderator,0,{},i2kcr0z,False,t3_tr0fwx,False,True,t3_tr0fwx,/r/UkraineWarReports/comments/tr0fwx/if_the_peace_deal_is_reached_and_the_world_just/i2kcr0z/,1648562527,1,True,False,True,UkraineWarReports,t5_5wncl5,r/UkraineWarReports,public,,0,[],,1648533709.0,,,,
,[],False,,AutoModerator,,,[],,,,text,t2_6l4z3,False,True,"This is a reminder to check the r/UkraineWarReports rules. Every post with 3+ reports will be removed automatically. 


*I am a bot, and this action was performed automatically. Please [contact the moderators of this subreddit](/message/compose/?to=/r/UkraineWarReports) if you have any questions or concerns.*",e5688e013c65d4c1643d0390e149f3023f592783,True,False,,,,,0,1648562443,moderator,0,{},i2kcli1,False,t3_tr0f1v,False,True,t3_tr0f1v,/r/UkraineWarReports/comments/tr0f1v/if_the_peace_deal_is_reached_and_the_world_just/i2kcli1/,1648562459,1,True,False,True,UkraineWarReports,t5_5wncl5,r/UkraineWarReports,public,,0,[],,1648533643.0,,,,
,[],False,,chrisblackbeard,,default,[],,,dark,text,t2_j9s4recg,False,False,A new sport for the Oylmpics !!,a8be5f0b8d7433b6ed7deda90fa08cde70b698de,True,False,,,,,0,1648562433,,0,{},i2kckmn,False,t3_tqy6un,False,True,t3_tqy6un,/r/UkraineWarReports/comments/tqy6un/a_russian_t80u_previously_unseen_appears_to_have/i2kckmn/,1648562452,1,False,True,False,UkraineWarReports,t5_5wncl5,r/UkraineWarReports,public,,0,[],,1648533633.0,,,,
,[],False,,SaveVideo,,default,[],,,dark,text,t2_8gveco3a,False,False,"###[View link](https://redditsave.com/r/UkraineWarReports/comments/tqy6un/a_russian_t80u_previously_unseen_appears_to_have/)


 --- 
 [**Info**](https://np.reddit.com/user/SaveVideo/comments/jv323v/info/)&amp;#32;|&amp;#32; [**Feedback**](https://np.reddit.com/message/compose/?to=Kryptonh&amp;subject=Feedback for savevideo)&amp;#32;|&amp;#32;[**Donate**](https://ko-fi.com/getvideo) &amp;#32;|&amp;#32; [**DMCA**](https://np.reddit.com/message/compose/?to=Kryptonh&amp;subject=Content removal request for savevideo&amp;message=https://np.reddit.com//r/UkraineWarReports/comments/tqy6un/a_russian_t80u_previously_unseen_appears_to_have/) &amp;#32;|&amp;#32; 
 [^(reddit video downloader)](https://redditsave.com) &amp;#32;|&amp;#32; [^(download video tiktok)](https://taksave.com)",3391c876357beba0b96fd7734b4a312487c9dc12,True,False,,,,,0,1648562428,,0,{},i2kck4x,False,t3_tqy6un,False,True,t1_i2kcf3c,/r/UkraineWarReports/comments/tqy6un/a_russian_t80u_previously_unseen_appears_to_have/i2kck4x/,1648562444,1,False,True,False,UkraineWarReports,t5_5wncl5,r/UkraineWarReports,public,,0,[],,1648533628.0,,,,
,[],False,,WeryWellDearSir,,default,[],,,dark,text,t2_5r2f3whg,False,False,"Russian should start learning how to bow to their new Chinese masters, how to say in Chinese ""No we do not need far East, happy to give it to you sir!"" and how to become cheap labor for the Chinese. Oh not the last one, Chinese need slaves with good work ethics, so it's just land, oil and gas.

Well done Russians",c2ec1d5c310a87ca9fedf01cc9730f765f0a3530,True,False,,,,,0,1648562409,,0,{},i2kciii,False,t3_tqyxpm,False,True,t3_tqyxpm,/r/UkraineWarReports/comments/tqyxpm/chinese_firms_look_to_cash_in_on_western_exodus/i2kciii/,1648562421,1,False,True,False,UkraineWarReports,t5_5wncl5,r/UkraineWarReports,public,,0,[],,1648533609.0,,,,
,[],False,,termileon,,default,[],,,dark,text,t2_28djefrd,False,False,u/savevideo,70a0f94b1709054e8c936673e18a6bab7d60f29f,True,False,,,,,0,1648562368,,0,{},i2kcf3c,False,t3_tqy6un,False,True,t3_tqy6un,/r/UkraineWarReports/comments/tqy6un/a_russian_t80u_previously_unseen_appears_to_have/i2kcf3c/,1648562383,1,False,True,False,UkraineWarReports,t5_5wncl5,r/UkraineWarReports,public,,0,[],,1648533568.0,,,,
,[],False,,Inigo93,,default,[],,,dark,text,t2_77h3j,False,True,"What military activity?  I thought they were just exercises. 

And that sums up how much I trust any statement from a Putin-lead government.",e68128abfb6581ce79e13e0e80559df791ccb965,True,False,,,,,0,1648562349,,0,{},i2kcdhb,False,t3_tr0b6p,False,True,t3_tr0b6p,/r/UkraineWarReports/comments/tr0b6p/russia_says_will_radically_reduce_military/i2kcdhb/,1648562360,1,False,True,False,UkraineWarReports,t5_5wncl5,r/UkraineWarReports,public,,0,[],,1648533549.0,,,,
,[],False,,AutoModerator,,,[],,,,text,t2_6l4z3,False,True,"This is a reminder to check the r/UkraineWarReports rules. Every post with 3+ reports will be removed automatically. 


*I am a bot, and this action was performed automatically. Please [contact the moderators of this subreddit](/message/compose/?to=/r/UkraineWarReports) if you have any questions or concerns.*",e5688e013c65d4c1643d0390e149f3023f592783,True,False,,,,,0,1648562145,moderator,0,{},i2kbwe9,False,t3_tr0b6p,False,True,t3_tr0b6p,/r/UkraineWarReports/comments/tr0b6p/russia_says_will_radically_reduce_military/i2kbwe9/,1648562158,1,True,False,True,UkraineWarReports,t5_5wncl5,r/UkraineWarReports,public,,0,[],,1648533345.0,,,,
,[],False,,AutoModerator,,,[],,,,text,t2_6l4z3,False,True,"This is a reminder to check the r/UkraineWarReports rules. Every post with 3+ reports will be removed automatically. 


*I am a bot, and this action was performed automatically. Please [contact the moderators of this subreddit](/message/compose/?to=/r/UkraineWarReports) if you have any questions or concerns.*",e5688e013c65d4c1643d0390e149f3023f592783,True,False,,,,,0,1648561863,moderator,0,{},i2kb8qu,False,t3_tr07tf,False,True,t3_tr07tf,/r/UkraineWarReports/comments/tr07tf/alpha_1_a_ukrainian_foreign_legion_team_of/i2kb8qu/,1648561877,1,True,False,True,UkraineWarReports,t5_5wncl5,r/UkraineWarReports,public,,0,[],,1648533063.0,,,,
,[],False,,AutoModerator,,,[],,,,text,t2_6l4z3,False,True,"This is a reminder to check the r/UkraineWarReports rules. Every post with 3+ reports will be removed automatically. 


*I am a bot, and this action was performed automatically. Please [contact the moderators of this subreddit](/message/compose/?to=/r/UkraineWarReports) if you have any questions or concerns.*",e5688e013c65d4c1643d0390e149f3023f592783,True,False,,,,,0,1648561686,moderator,0,{},i2katvg,False,t3_tr05o5,False,True,t3_tr05o5,/r/UkraineWarReports/comments/tr05o5/in_the_rivne_region_firefighters_are_still/i2katvg/,1648561704,1,True,False,True,UkraineWarReports,t5_5wncl5,r/UkraineWarReports,public,,0,[],,1648532886.0,,,,
,[],False,,AutoModerator,,,[],,,,text,t2_6l4z3,False,True,"This is a reminder to check the r/UkraineWarReports rules. Every post with 3+ reports will be removed automatically. 


*I am a bot, and this action was performed automatically. Please [contact the moderators of this subreddit](/message/compose/?to=/r/UkraineWarReports) if you have any questions or concerns.*",e5688e013c65d4c1643d0390e149f3023f592783,True,False,,,,,0,1648561668,moderator,0,{},i2kasft,False,t3_tr05g8,False,True,t3_tr05g8,/r/UkraineWarReports/comments/tr05g8/how_are_things_in_the_rest_of_ukraine/i2kasft/,1648561681,1,True,False,True,UkraineWarReports,t5_5wncl5,r/UkraineWarReports,public,,0,[],,1648532868.0,,,,
,[],False,,okdankekk,,default,[],,,dark,text,t2_g5896f80,False,False,Who pooped this filmmaker in the head? 🙄,bd00a380f105dd9fde1f5bd8a8349fc14ff6803c,True,False,,,,,0,1648561501,,0,{},i2kaelx,False,t3_tqfuys,False,True,t3_tqfuys,/r/UkraineWarReports/comments/tqfuys/russian_propaganda_expands_now_to_deers_yakutya/i2kaelx/,1648561519,1,False,True,False,UkraineWarReports,t5_5wncl5,r/UkraineWarReports,public,,0,[],,1648532701.0,,,,
,[],False,,Radek_Krushewsky,,default,[],,,dark,text,t2_afda4uwj,False,False,"So let's presume it's fake until it will be proven, shell we?",24b4a8b120dc8e6c919c3d89f555aa7cd1ed0119,True,False,,,,,0,1648561367,,0,{},i2ka32r,False,t3_tqd0yi,False,True,t1_i2k8us3,/r/UkraineWarReports/comments/tqd0yi/anonymous_has_revealed_an_important/i2ka32r/,1648561383,1,False,True,False,UkraineWarReports,t5_5wncl5,r/UkraineWarReports,public,,0,[],,1648532567.0,,,,
,[],False,,LurkinAintCookin,,default,[],,,dark,text,t2_aiu2iq6f,False,False,This is not a report.,ff189db6f3e6258e3823f62eb5565dd10febb8c0,True,False,,,,,0,1648561295,,0,{},i2k9wt0,False,t3_tqup0m,False,True,t3_tqup0m,/r/UkraineWarReports/comments/tqup0m/real_love_is/i2k9wt0/,1648561307,1,False,True,False,UkraineWarReports,t5_5wncl5,r/UkraineWarReports,public,,0,[],,1648532495.0,,,,
,[],False,,WoohanFlu4U,,default,[],,,dark,text,t2_5vrg38xt,False,False,"Just sayin, whenever there's footage of a riot or anything in Europe, and someone needs to huck something a long distance, the footwork proceeding the throw is atrocious. 

That being said, we kick shit with our toes when we traded soccer for baseball. Max impact, no control.",3bf02eb7c1eebd5a79046a4d7948d06a649e5b28,True,False,,,,,0,1648560935,,0,{},i2k92yt,False,t3_tq905j,False,True,t1_i2juqft,/r/UkraineWarReports/comments/tq905j/a_girl_who_threw_a_molotov_cocktail_at_a/i2k92yt/,1648560953,1,False,True,False,UkraineWarReports,t5_5wncl5,r/UkraineWarReports,public,,0,[],,1648532135.0,,,,
,[],False,,ciaran036,,default,[],,,dark,text,t2_3cux3,False,False,"yep, I don't believe anyone has verified anything about it yet.",42d4d6c4d9c40600144b2c825854ec024593481e,True,False,,,,,0,1648560832,,0,{},i2k8us3,False,t3_tqd0yi,False,True,t1_i2k6xvd,/r/UkraineWarReports/comments/tqd0yi/anonymous_has_revealed_an_important/i2k8us3/,1648560845,1,False,True,False,UkraineWarReports,t5_5wncl5,r/UkraineWarReports,public,,0,[],,1648532032.0,,,,
