Unnamed: 0,all_awardings,archived,associated_award,author,author_flair_background_color,author_flair_css_class,author_flair_richtext,author_flair_template_id,author_flair_text,author_flair_text_color,author_flair_type,author_fullname,author_patreon_flair,author_premium,body,body_sha1,can_gild,collapsed,collapsed_because_crowd_control,collapsed_reason,collapsed_reason_code,comment_type,controversiality,created_utc,distinguished,gilded,gildings,id,is_submitter,link_id,locked,no_follow,parent_id,permalink,retrieved_utc,score,score_hidden,send_replies,stickied,subreddit,subreddit_id,subreddit_name_prefixed,subreddit_type,top_awarded_type,total_awards_received,treatment_tags,unrepliable_reason,created,author_cakeday,edited,editable,media_metadata
,[],False,,AutoModerator,,,[],,,,text,t2_6l4z3,False,True,"This is a reminder to check the r/UkraineWarReports rules. Every post with 3+ reports will be removed automatically. 


*I am a bot, and this action was performed automatically. Please [contact the moderators of this subreddit](/message/compose/?to=/r/UkraineWarReports) if you have any questions or concerns.*",e5688e013c65d4c1643d0390e149f3023f592783,True,False,,,,,0,1648579202,moderator,0,{},i2ljye5,False,t3_tre84g,False,True,t3_tre84g,/r/UkraineWarReports/comments/tre84g/powerful_explosions_on_the_belgorod_border_have/i2ljye5/,1648581146,1,True,False,True,UkraineWarReports,t5_5wncl5,r/UkraineWarReports,public,,0,[],,1648550402.0,,,,
,[],False,,TheNebulousMind,,default,[],,,dark,text,t2_exjiw,False,False,https://en.wikipedia.org/wiki/Active\_measures,27f94d07100a400e5ffbdf4956ae7d10f23047a3,True,False,,,,,0,1648578873,,0,{},i2livnp,False,t3_tqd0yi,False,True,t1_i2j1no0,/r/UkraineWarReports/comments/tqd0yi/anonymous_has_revealed_an_important/i2livnp/,1648578887,1,False,True,False,UkraineWarReports,t5_5wncl5,r/UkraineWarReports,public,,0,[],,1648550073.0,,,,
,[],False,,mexius77,,default,[],,,dark,text,t2_1jp7b3u7,False,False,"&gt;I think this would be suicide.

I think the Ukrainian Army have proved they are competent, I dont see them blindly attacking, and from some of the video's I have seen, are attacking strategic points, not a full on push as people think.

Also the missing factor people are not taking into account is the morale of the Russian army, and communication to their leadership. Without leadership to guide decisions and should they feel they they are facing overwhelming force, they would probably retreat.

With decent air defence capability, they should not be so susceptible to   air attack.",84ab0683e175f0bb8596dd733563f0e3deb826f6,True,False,,,,,0,1648578709,,0,{},i2ligaq,False,t3_tqyqrw,False,True,t1_i2kmcws,/r/UkraineWarReports/comments/tqyqrw/counterattacks_result_on_the_map_between_march/i2ligaq/,1648578720,1,False,True,False,UkraineWarReports,t5_5wncl5,r/UkraineWarReports,public,,0,[],,1648549909.0,,,,
,[],False,,RojasBrother,,default,[],,,dark,text,t2_4x51c53w,False,False,Bad ass,97ad0d3ae3b2efea38626539d738e92b5db830f3,True,False,,,,,0,1648578373,,0,{},i2lhko8,False,t3_tqiq6k,False,True,t3_tqiq6k,/r/UkraineWarReports/comments/tqiq6k/footage_showing_a_russian_t72b_obr_1989_tank/i2lhko8/,1648578386,1,False,True,False,UkraineWarReports,t5_5wncl5,r/UkraineWarReports,public,,0,[],,1648549573.0,,,,
,[],False,,AutoModerator,,,[],,,,text,t2_6l4z3,False,True,"This is a reminder to check the r/UkraineWarReports rules. Every post with 3+ reports will be removed automatically. 


*I am a bot, and this action was performed automatically. Please [contact the moderators of this subreddit](/message/compose/?to=/r/UkraineWarReports) if you have any questions or concerns.*",e5688e013c65d4c1643d0390e149f3023f592783,True,False,,,,,0,1648578357,moderator,0,{},i2lhj8o,False,t3_trdlh5,False,True,t3_trdlh5,/r/UkraineWarReports/comments/trdlh5/russia_expels_diplomats_from_baltic_states_in/i2lhj8o/,1648578371,1,True,False,True,UkraineWarReports,t5_5wncl5,r/UkraineWarReports,public,,0,[],,1648549557.0,,,,
,[],False,,Ibboibboibbo,,default,[],,,dark,text,t2_1kkzxnpv,False,False,Not anymore. It’s pulled business from Russia now,64cd29bb0ef50f27af31bfb3ce202a1d16a46039,True,False,,,,,0,1648578355,,0,{},i2lhj3f,False,t3_trazub,False,True,t3_trazub,/r/UkraineWarReports/comments/trazub/activists_in_poland_protesting_in_front_of/i2lhj3f/,1648578370,1,False,True,False,UkraineWarReports,t5_5wncl5,r/UkraineWarReports,public,,0,[],,1648549555.0,,,,
,[],False,,RojasBrother,,default,[],,,dark,text,t2_4x51c53w,False,False,I think its likely due to the amount of manpads and how that would include helicopters shot down,a0246478dce011977f5cb36124452114e63bcba4,True,False,,,,,0,1648578342,,0,{},i2lhht7,False,t3_tqtyiz,False,True,t1_i2kt7mt,/r/UkraineWarReports/comments/tqtyiz/total_estimated_losses_of_the_enemy_from_2402_to/i2lhht7/,1648578353,1,False,True,False,UkraineWarReports,t5_5wncl5,r/UkraineWarReports,public,,0,[],,1648549542.0,,,,
,[],False,,AnimusFoxx,,default,[],,,dark,text,t2_ekl8w,False,False,I want this song what is it,a051a9027f4a994c1babe3909927d050effcccd4,True,False,,,,,0,1648578307,,0,{},i2lheji,False,t3_tqd4iq,False,True,t3_tqd4iq,/r/UkraineWarReports/comments/tqd4iq/an_excellent_example_of_an_ambush_carried_out_by/i2lheji/,1648578325,1,False,True,False,UkraineWarReports,t5_5wncl5,r/UkraineWarReports,public,,0,[],,1648549507.0,,,,
,[],False,,derdan16,,default,[],,,dark,text,t2_6ba31swn,False,False,imagine kids playing with sticks = military object,3a7410d0ff4bbb56144ae12fc5c932d093d68da3,True,False,,,,,0,1648578259,,0,{},i2lha32,False,t3_trah1s,False,True,t3_trah1s,/r/UkraineWarReports/comments/trah1s/chernihiv_playground/i2lha32/,1648578270,1,False,True,False,UkraineWarReports,t5_5wncl5,r/UkraineWarReports,public,,0,[],,1648549459.0,,,,
,[],False,,WeryWellDearSir,,default,[],,,dark,text,t2_5r2f3whg,False,False,Sure. Hitting them as hard as possible is a must,702f024e697380e87b03629e1d70d797e3fff60b,True,False,,,,,0,1648578109,,0,{},i2lgvv7,False,t3_tr0b6p,False,True,t1_i2lgkjh,/r/UkraineWarReports/comments/tr0b6p/russia_says_will_radically_reduce_military/i2lgvv7/,1648578128,1,False,True,False,UkraineWarReports,t5_5wncl5,r/UkraineWarReports,public,,0,[],,1648549309.0,,,,
,[],False,,RemindMeBot,,default,[],,,dark,text,t2_gbm4p,False,False,"I will be messaging you in 7 days on [**2022-04-05 18:20:44 UTC**](http://www.wolframalpha.com/input/?i=2022-04-05%2018:20:44%20UTC%20To%20Local%20Time) to remind you of [**this link**](https://www.reddit.com/r/UkraineWarReports/comments/tqyqrw/counterattacks_result_on_the_map_between_march/i2lgpo1/?context=3)

[**CLICK THIS LINK**](https://www.reddit.com/message/compose/?to=RemindMeBot&amp;subject=Reminder&amp;message=%5Bhttps%3A%2F%2Fwww.reddit.com%2Fr%2FUkraineWarReports%2Fcomments%2Ftqyqrw%2Fcounterattacks_result_on_the_map_between_march%2Fi2lgpo1%2F%5D%0A%0ARemindMe%21%202022-04-05%2018%3A20%3A44%20UTC) to send a PM to also be reminded and to reduce spam.

^(Parent commenter can ) [^(delete this message to hide from others.)](https://www.reddit.com/message/compose/?to=RemindMeBot&amp;subject=Delete%20Comment&amp;message=Delete%21%20tqyqrw)

*****

|[^(Info)](https://www.reddit.com/r/RemindMeBot/comments/e1bko7/remindmebot_info_v21/)|[^(Custom)](https://www.reddit.com/message/compose/?to=RemindMeBot&amp;subject=Reminder&amp;message=%5BLink%20or%20message%20inside%20square%20brackets%5D%0A%0ARemindMe%21%20Time%20period%20here)|[^(Your Reminders)](https://www.reddit.com/message/compose/?to=RemindMeBot&amp;subject=List%20Of%20Reminders&amp;message=MyReminders%21)|[^(Feedback)](https://www.reddit.com/message/compose/?to=Watchful1&amp;subject=RemindMeBot%20Feedback)|
|-|-|-|-|",8740c8b714e74b38cab2f070e7a6409bb8fe8a2b,True,False,,,,,0,1648578087,,0,{},i2lgtpz,False,t3_tqyqrw,False,True,t1_i2lgpo1,/r/UkraineWarReports/comments/tqyqrw/counterattacks_result_on_the_map_between_march/i2lgtpz/,1648578100,1,False,True,False,UkraineWarReports,t5_5wncl5,r/UkraineWarReports,public,,0,[],,1648549287.0,,,,
,[],False,,TheLateApexLine,,default,[],,,dark,text,t2_6l9mb,False,False,"&gt; From an unbiased perspective Russia is winning the war and it's only a matter of time until it's over

RemindMe! One week",55cb1b533400ef5c3d0e86f00a89a0936fbe8efc,True,False,,,,,0,1648578044,,0,{},i2lgpo1,False,t3_tqyqrw,False,True,t1_i2kys1f,/r/UkraineWarReports/comments/tqyqrw/counterattacks_result_on_the_map_between_march/i2lgpo1/,1648578055,1,False,True,False,UkraineWarReports,t5_5wncl5,r/UkraineWarReports,public,,0,[],,1648549244.0,,,,
,[],False,,Drunktaco357,,default,[],,,dark,text,t2_7h1sczaf,False,False,"They don’t deserve the chance the “reduce activity” or retreat at this point, I’d take it as far as I could, go ahead and drive that knife deep in there and leave a mark they will feel for a long time and a stand for everyone else to see, and they’ve already done a hell of a job at that.",237122f778a4175ae7e6c07c28984eef8213a0d6,True,False,,,,,0,1648577992,,0,{},i2lgkjh,False,t3_tr0b6p,False,True,t1_i2kg2wn,/r/UkraineWarReports/comments/tr0b6p/russia_says_will_radically_reduce_military/i2lgkjh/,1648578011,1,False,True,False,UkraineWarReports,t5_5wncl5,r/UkraineWarReports,public,,0,[],,1648549192.0,,,,
,[],False,,TheNebulousMind,,default,[],,,dark,text,t2_exjiw,False,False,This is a Russian troll likely employed with the Internet Research Agency. They stand out especially well when you look at their wordclouds with apps like RedditMetis. [Here is this users wordcloud.](https://imgur.com/a/QeBN2Iw),cb63cf93677e25de52edeb52945dd93f61d9661d,True,False,,,,,0,1648577985,,0,{},i2lgjvv,False,t3_tqd0yi,False,True,t1_i2jglxy,/r/UkraineWarReports/comments/tqd0yi/anonymous_has_revealed_an_important/i2lgjvv/,1648578002,1,False,True,False,UkraineWarReports,t5_5wncl5,r/UkraineWarReports,public,,0,[],,1648549185.0,,,,
,[],False,,AutoModerator,,,[],,,,text,t2_6l4z3,False,True,"This is a reminder to check the r/UkraineWarReports rules. Every post with 3+ reports will be removed automatically. 


*I am a bot, and this action was performed automatically. Please [contact the moderators of this subreddit](/message/compose/?to=/r/UkraineWarReports) if you have any questions or concerns.*",e5688e013c65d4c1643d0390e149f3023f592783,True,False,,,,,0,1648577966,moderator,0,{},i2lghzv,False,t3_trcx9s,False,True,t3_trcx9s,/r/UkraineWarReports/comments/trcx9s/kadyrovtsy_motorcycle_skills_are_as_good_as_their/i2lghzv/,1648577984,1,True,False,True,UkraineWarReports,t5_5wncl5,r/UkraineWarReports,public,,0,[],,1648549166.0,,,,
,[],False,,Welsh58,,default,[],,,dark,text,t2_3a02fuv4,False,False,"""All they are is dust in the wind... "". Or a thin, well cooked paste on the inside. The TC and gunner are sitting on the ammunition carousel, the driver is just ahead and lower than the ammunition. Everyone dies.",ac177332a7841b6b8547888fa351f4c369f66a99,True,False,,,,,0,1648577886,,0,{},i2lga69,False,t3_tqy6un,False,True,t1_i2lclmt,/r/UkraineWarReports/comments/tqy6un/a_russian_t80u_previously_unseen_appears_to_have/i2lga69/,1648577903,1,False,True,False,UkraineWarReports,t5_5wncl5,r/UkraineWarReports,public,,0,[],,1648549086.0,,,,
,[],False,,xtheory,,default,[],,,dark,text,t2_4bswp,False,True,Does this normally work for you?,068a032222d5dace0b592b8485654250122a7629,True,False,,,,,0,1648577853,,0,{},i2lg6yj,False,t3_tm4xgf,False,True,t1_i2legwf,/r/UkraineWarReports/comments/tm4xgf/meanwhile_the_azov_regiment_continues_to/i2lg6yj/,1648577866,1,False,True,False,UkraineWarReports,t5_5wncl5,r/UkraineWarReports,public,,0,[],,1648549053.0,,,,
,[],False,,zachadawija,,default,[],,,dark,text,t2_d3are,False,False,How do I know your comment isn't propaganda?,92b0f656afeacc013a82a1faff19ab86124ca6a3,True,False,,,,,0,1648577841,,0,{},i2lg5v1,False,t3_tqghse,False,True,t1_i2j8gvs,/r/UkraineWarReports/comments/tqghse/nice_try_russian_propagandists_but_you_failed/i2lg5v1/,1648577857,1,False,True,False,UkraineWarReports,t5_5wncl5,r/UkraineWarReports,public,,0,[],,1648549041.0,,,,
,[],False,,TheNebulousMind,,default,[],,,dark,text,t2_exjiw,False,False,Lol. This is the only comment that account ever posted.,1dd09b9c979cfca705ca6ca4c4e30482f793d9cf,True,False,,,,,0,1648577812,,0,{},i2lg354,False,t3_tqd0yi,False,True,t1_i2i22oo,/r/UkraineWarReports/comments/tqd0yi/anonymous_has_revealed_an_important/i2lg354/,1648577830,1,False,True,False,UkraineWarReports,t5_5wncl5,r/UkraineWarReports,public,,0,[],,1648549012.0,,,,
,[],False,,Drunktaco357,,default,[],,,dark,text,t2_7h1sczaf,False,False,That opening sequence/jingle thing reminded me of Borat. I get pumped every time I see them releasing info or taking over something like this.,bfdf6d2b1a7f627d231463a70c03785f0d47934c,True,False,,,,,0,1648577658,,0,{},i2lfobd,False,t3_tr0mmn,False,True,t3_tr0mmn,/r/UkraineWarReports/comments/tr0mmn/anonymous_hack_vgtrk_the_allrussian_state/i2lfobd/,1648577671,1,False,True,False,UkraineWarReports,t5_5wncl5,r/UkraineWarReports,public,,0,[],,1648548858.0,,,,
,[],False,,quagswagga,,default,[],,,dark,text,t2_2ug44c5e,False,True,There's a way better version of this video on other subs lol. What the hell happened here ? Are those compression artifacts or what is this ? lol,9af221d616f061af52aad557095ae043f9c68b76,True,False,,,,,0,1648577434,,0,{},i2lf388,False,t3_tqicy7,False,True,t3_tqicy7,/r/UkraineWarReports/comments/tqicy7/direct_hit_with_the_rpg_on_the_russian_tank/i2lf388/,1648577449,1,False,True,False,UkraineWarReports,t5_5wncl5,r/UkraineWarReports,public,,0,[],,1648548634.0,,,,
,[],False,,TheConnoissuer,,default,[],,,dark,text,t2_4edfntk3,False,False,Such a clown 🤡 🤣 😂,00a421444910232d58aa109fead7133d45612fa0,True,False,,,,,0,1648577193,,0,{},i2legwf,False,t3_tm4xgf,False,True,t1_i2l7cfy,/r/UkraineWarReports/comments/tm4xgf/meanwhile_the_azov_regiment_continues_to/i2legwf/,1648577208,1,False,True,False,UkraineWarReports,t5_5wncl5,r/UkraineWarReports,public,,0,[],,1648548393.0,,,,
,[],False,,Drake_The_One,,default,[],,,dark,text,t2_u8fwl,False,False,"Hate to break it to you, but becoming more peaceful as a civilization is not a result of prayer",0d20a52e40b4365176d6b8b8d2f47775456ebec0,True,False,,,,,0,1648576888,,0,{},i2ldo9t,False,t3_tqup0m,False,True,t1_i2kvuho,/r/UkraineWarReports/comments/tqup0m/real_love_is/i2ldo9t/,1648576905,1,False,True,False,UkraineWarReports,t5_5wncl5,r/UkraineWarReports,public,,0,[],,1648548088.0,,,,
,[],False,,AutoModerator,,,[],,,,text,t2_6l4z3,False,True,"This is a reminder to check the r/UkraineWarReports rules. Every post with 3+ reports will be removed automatically. 


*I am a bot, and this action was performed automatically. Please [contact the moderators of this subreddit](/message/compose/?to=/r/UkraineWarReports) if you have any questions or concerns.*",e5688e013c65d4c1643d0390e149f3023f592783,True,False,,,,,0,1648576808,moderator,0,{},i2ldgjn,False,t3_trazub,False,True,t3_trazub,/r/UkraineWarReports/comments/trazub/activists_in_poland_protesting_in_front_of/i2ldgjn/,1648576820,1,True,False,True,UkraineWarReports,t5_5wncl5,r/UkraineWarReports,public,,0,[],,1648548008.0,,,,
,[],False,,Majestic_Reference94,,default,[],,,dark,text,t2_7un00fxs,False,False,Really .,b5937ac17e7a49d990d670854129f40c71aa16f9,True,False,,,,,0,1648576710,,0,{},i2ld7bj,False,t3_trah1s,False,True,t3_trah1s,/r/UkraineWarReports/comments/trah1s/chernihiv_playground/i2ld7bj/,1648576721,1,False,True,False,UkraineWarReports,t5_5wncl5,r/UkraineWarReports,public,,0,[],,1648547910.0,,,,
,[],False,,Sr_Carlos_Danger,,default,[],,,dark,text,t2_cq9cl,False,False,"Monstrous, but the only honest comment here regardless. Everyone else pretending like they can make excuses for war crimes but also not be responsible for further way crimes smh",cec3b8e95fd64c4224dd6888c321ba758b3c595a,True,False,,,,,0,1648576634,,0,{},i2ld08x,False,t3_tqghse,False,True,t1_i2hc0xy,/r/UkraineWarReports/comments/tqghse/nice_try_russian_propagandists_but_you_failed/i2ld08x/,1648576645,1,False,True,False,UkraineWarReports,t5_5wncl5,r/UkraineWarReports,public,,0,[],,1648547834.0,,,,
,[],False,,Brian_Corey__,,default,[],,,dark,text,t2_he0w6lpl,False,False,"Baltika was bought by Carlsberg in 2008.  https://eng.baltika.ru/company/about-us/history/

  
*In April 2008, Baltika became a part of Carlsberg Group in full, which became possible after Carlsberg bought out the assets of Scottish &amp; Newcastle (S&amp;N). Carlsberg got a possession of S&amp;N share in BBH – major Baltika shareholder – and the assets of S&amp;N in France, Greece, China and Vietnam. At this stage, Carlsberg Group became the holder of 85% of Baltika shares, 15% of shares were left in hands of minority shareholders.*  
  
*In November 2012, Carlsberg Group bought out the rest of the shares from minority shareholders and became the holder of 100% of shares of Baltika breweries OJSC. To make the corporate governance more handy in 2013 there was made a decision to change the legal form of the company from OJSC to LLC. This step became possible after consolidation of 100% of Company shares into the hands of one owner – Carlsberg Group. Reorganization into the LLC was finished in January 2014.*",395619ef9ac1f5f4cf46186aaf8313ee0c4e5264,True,False,,,,,0,1648576619,,0,{},i2lcyqn,False,t3_tq9vbi,False,False,t1_i2hqp68,/r/UkraineWarReports/comments/tq9vbi/carlsberg_and_heineken_are_quitting_russia/i2lcyqn/,1648576630,1,False,True,False,UkraineWarReports,t5_5wncl5,r/UkraineWarReports,public,,0,[],,1648547819.0,,,,
,[],False,,Palmik7,,default,[],,,dark,text,t2_3oiurd3f,False,False,"I don't know but in the video of the burning ship in the port that I saw, there were at least two other leaving the port with really big fires on their decks. So maybe some sunk afterwards outside the port itself.",a80b991d3979176bc2c4f1755fc5aae485b6a7c6,True,False,,,,,0,1648576511,,0,{},i2lcoj8,False,t3_tqtyiz,False,True,t1_i2jxd9c,/r/UkraineWarReports/comments/tqtyiz/total_estimated_losses_of_the_enemy_from_2402_to/i2lcoj8/,1648576523,1,False,True,False,UkraineWarReports,t5_5wncl5,r/UkraineWarReports,public,,0,[],,1648547711.0,,,,
,[],False,,Sr_Carlos_Danger,,default,[],,,dark,text,t2_cq9cl,False,False,"Uh, no, 5.45x39 absolutely produces that much muzzle flash out of the short barreled rifles currently in use by both sides. There is no ""correct"" amount of blood for a wound to produce, or for an injured person to scream. You are using Holocaust denier-style rhetoric here",9d0bed23fad25a9e3ad3a74f5a4e0319499707dd,True,False,,,,,0,1648576501,,0,{},i2lcnjg,False,t3_tqghse,False,True,t1_i2ik9fn,/r/UkraineWarReports/comments/tqghse/nice_try_russian_propagandists_but_you_failed/i2lcnjg/,1648576516,1,False,True,False,UkraineWarReports,t5_5wncl5,r/UkraineWarReports,public,,0,[],,1648547701.0,,,,
,[],False,,Henri_is_back,,default,[],,,dark,text,t2_gyuzn4zo,False,False,What about the crew in these cases? Are they automatically dead in case of such a hit?,c5cd03a569392a6f69109ab512ef11442cdee28a,True,False,,,,,0,1648576480,,0,{},i2lclmt,False,t3_tqy6un,False,True,t3_tqy6un,/r/UkraineWarReports/comments/tqy6un/a_russian_t80u_previously_unseen_appears_to_have/i2lclmt/,1648576494,1,False,True,False,UkraineWarReports,t5_5wncl5,r/UkraineWarReports,public,,0,[],,1648547680.0,,,,
,[],False,,Nivistia,,default,[],,,dark,text,t2_kbksuth6,False,False,"You can bury your head in the sand as much as you want &amp; use your ""military analysts"", but all those reports from so many different entities including actual veterans &amp; military experts end with the same conclusions that the Russian army was heavily overestimated, unbelievably corrupted &amp; atrociously disorganized.

Shocking amount of untrained conscripts, abandoned equipment everywhere, 7 generals out of 20 killed in 1 month almost half which is a never seen before, a total of nearly 50 000 casualties (Dead + wounded), low moral, hunger, low resources, inadequately equipped for freezing temperatures, etc.

If I were a pro-russian &amp; had a privileged unfiltered access to the info like you do, I sure would at least question the Russian narrative after seeing those kind of figures. 

Do you seriously believe the 1 351 deaths number released 3 days ago by the Russians with such poor performance while they claim to have killed over 16 200 Ukrainians? It's not even trying to be realistic &amp; even some on Russian State-owned channels are really saying it would now take 40 years before ""finally"" taking over Ukraine without hiding their anger &amp; disappointment with how poorly things went &amp; their surprise of the resistance.

Even Abramovich daughter is condemning the war, one of Putin's closest ally, one of the wealthiest, most powerful figure's family relative taking a ""traitorous"" position against the Russian government.

Have a good one too.",3cc09aa55c374f23589bcad0d9663ba8fde16e80,True,False,,,,,0,1648576444,,0,{},i2lci7f,False,t3_tqyqrw,False,True,t1_i2l6yse,/r/UkraineWarReports/comments/tqyqrw/counterattacks_result_on_the_map_between_march/i2lci7f/,1648576458,1,False,True,False,UkraineWarReports,t5_5wncl5,r/UkraineWarReports,public,,0,[],,1648547644.0,,,,
,[],False,,AutoModerator,,,[],,,,text,t2_6l4z3,False,True,"This is a reminder to check the r/UkraineWarReports rules. Every post with 3+ reports will be removed automatically. 


*I am a bot, and this action was performed automatically. Please [contact the moderators of this subreddit](/message/compose/?to=/r/UkraineWarReports) if you have any questions or concerns.*",e5688e013c65d4c1643d0390e149f3023f592783,True,False,,,,,0,1648575804,moderator,0,{},i2lauhi,False,t3_tramff,False,True,t3_tramff,/r/UkraineWarReports/comments/tramff/otr21_tochka_shot_down_in_a_small_park_in_mariupol/i2lauhi/,1648575816,1,True,False,True,UkraineWarReports,t5_5wncl5,r/UkraineWarReports,public,,0,[],,1648547004.0,,,,
,[],False,,TheOddOne2,,default,[],,,dark,text,t2_dazjg,False,False,"I guess you didn't read anything. ""Wikipedia based article""... I refrain myself from witty remarks. 

You keep holding on to your ""independent journalist"" (in singular?)

No available maps can be completely trusted, not this one either. I merely helped you to the source.",fcdd3b0985ba86fad87d946632faf6d56be75183,True,False,,,,,0,1648575578,,0,{},i2la8wq,False,t3_tqyqrw,False,True,t1_i2l784f,/r/UkraineWarReports/comments/tqyqrw/counterattacks_result_on_the_map_between_march/i2la8wq/,1648575593,1,False,True,False,UkraineWarReports,t5_5wncl5,r/UkraineWarReports,public,,0,[],,1648546778.0,,,,
,[],False,,Siserith,,default,[],,,dark,text,t2_qxtem,False,False,"not nearly winning, but a good contender, pretty sure one got tossed near a km in one video.",251463cb774f34a4cdbeded689cda8a6196ae41c,True,False,,,,,0,1648575426,,0,{},i2l9uki,False,t3_tqy6un,False,True,t3_tqy6un,/r/UkraineWarReports/comments/tqy6un/a_russian_t80u_previously_unseen_appears_to_have/i2l9uki/,1648575440,1,False,True,False,UkraineWarReports,t5_5wncl5,r/UkraineWarReports,public,,0,[],,1648546626.0,,,,
,[],False,,AutoModerator,,,[],,,,text,t2_6l4z3,False,True,"This is a reminder to check the r/UkraineWarReports rules. Every post with 3+ reports will be removed automatically. 


*I am a bot, and this action was performed automatically. Please [contact the moderators of this subreddit](/message/compose/?to=/r/UkraineWarReports) if you have any questions or concerns.*",e5688e013c65d4c1643d0390e149f3023f592783,True,False,,,,,0,1648575415,moderator,0,{},i2l9tia,False,t3_trah1s,False,True,t3_trah1s,/r/UkraineWarReports/comments/trah1s/chernihiv_playground/i2l9tia/,1648575432,1,True,False,True,UkraineWarReports,t5_5wncl5,r/UkraineWarReports,public,,0,[],,1648546615.0,,,,
,[],False,,AutoModerator,,,[],,,,text,t2_6l4z3,False,True,"This is a reminder to check the r/UkraineWarReports rules. Every post with 3+ reports will be removed automatically. 


*I am a bot, and this action was performed automatically. Please [contact the moderators of this subreddit](/message/compose/?to=/r/UkraineWarReports) if you have any questions or concerns.*",e5688e013c65d4c1643d0390e149f3023f592783,True,False,,,,,0,1648575352,moderator,0,{},i2l9nou,False,t3_trag7d,False,True,t3_trag7d,/r/UkraineWarReports/comments/trag7d/strongly_support_ukraine_always_one_step_ahead/i2l9nou/,1648575365,1,True,False,True,UkraineWarReports,t5_5wncl5,r/UkraineWarReports,public,,0,[],,1648546552.0,,,,
,[],False,,FuzztoneBunny,,default,[],,,dark,text,t2_hyzdgj3a,False,False,Hahahah ope!,f0ba69ce3282b69243a7cc5854c8abf8911b4ad7,True,False,,,,,0,1648575198,,0,{},i2l994b,False,t3_tr0mmn,False,True,t3_tr0mmn,/r/UkraineWarReports/comments/tr0mmn/anonymous_hack_vgtrk_the_allrussian_state/i2l994b/,1648575214,1,False,True,False,UkraineWarReports,t5_5wncl5,r/UkraineWarReports,public,,0,[],,1648546398.0,,,,
,[],False,,AutoModerator,,,[],,,,text,t2_6l4z3,False,True,"This is a reminder to check the r/UkraineWarReports rules. Every post with 3+ reports will be removed automatically. 


*I am a bot, and this action was performed automatically. Please [contact the moderators of this subreddit](/message/compose/?to=/r/UkraineWarReports) if you have any questions or concerns.*",e5688e013c65d4c1643d0390e149f3023f592783,True,False,,,,,0,1648575030,moderator,0,{},i2l8t3r,False,t3_trabut,False,True,t3_trabut,/r/UkraineWarReports/comments/trabut/ukrainians_captured_russian_t_72_tank/i2l8t3r/,1648575043,1,True,False,True,UkraineWarReports,t5_5wncl5,r/UkraineWarReports,public,,0,[],,1648546230.0,,,,
,[],False,,_Zencyclist_,,default,[],,,dark,text,t2_5jlmikqg,False,False,Points for click-baity title I suppose.  Tame end of insane what I'm sayin,f87229dd39e1cfa487f2059d7c08622cff4a2958,True,False,,,,,0,1648575028,,0,{},i2l8svu,False,t3_tr10og,False,True,t3_tr10og,/r/UkraineWarReports/comments/tr10og/watch_insane_combat_footage_of_kadyrovtsy_tiktok/i2l8svu/,1648575043,1,False,True,False,UkraineWarReports,t5_5wncl5,r/UkraineWarReports,public,,0,[],,1648546228.0,,,,
