Unnamed: 0,all_awardings,archived,associated_award,author,author_flair_background_color,author_flair_css_class,author_flair_richtext,author_flair_template_id,author_flair_text,author_flair_text_color,author_flair_type,author_fullname,author_patreon_flair,author_premium,body,body_sha1,can_gild,collapsed,collapsed_because_crowd_control,collapsed_reason,collapsed_reason_code,comment_type,controversiality,created_utc,distinguished,gilded,gildings,id,is_submitter,link_id,locked,no_follow,parent_id,permalink,retrieved_utc,score,score_hidden,send_replies,stickied,subreddit,subreddit_id,subreddit_name_prefixed,subreddit_type,top_awarded_type,total_awards_received,treatment_tags,unrepliable_reason,created,author_cakeday,edited,editable,media_metadata
,[],False,,AutoModerator,,,[],,,,text,t2_6l4z3,False,True,"This is a reminder to check the r/UkraineWarReports rules. Every post with 3+ reports will be removed automatically. 


*I am a bot, and this action was performed automatically. Please [contact the moderators of this subreddit](/message/compose/?to=/r/UkraineWarReports) if you have any questions or concerns.*",e5688e013c65d4c1643d0390e149f3023f592783,True,False,,,,,0,1648538562,moderator,0,{},i2jd84e,False,t3_tqu91n,False,True,t3_tqu91n,/r/UkraineWarReports/comments/tqu91n/street_art_in_milan_this_is_a_jewish_girl/i2jd84e/,1648538579,1,True,False,True,UkraineWarReports,t5_5wncl5,r/UkraineWarReports,public,,0,[],,1648509762.0,,,,
,[],False,,Fletcher010770,,default,[],,,dark,text,t2_4vy4jmgo,False,False,"Nestle own the Body Shop??? Omg, yeah,  that's something Roddick would never, ever abide.",e6f10b126dbdfb07aaa033c952e8629316ae23d7,True,False,,,,,0,1648538375,,0,{},i2jd087,False,t3_tq9vbi,False,True,t1_i2hbr96,/r/UkraineWarReports/comments/tq9vbi/carlsberg_and_heineken_are_quitting_russia/i2jd087/,1648538391,1,False,True,False,UkraineWarReports,t5_5wncl5,r/UkraineWarReports,public,,0,[],,1648509575.0,,,,
,[],False,,AutoModerator,,,[],,,,text,t2_6l4z3,False,True,"This is a reminder to check the r/UkraineWarReports rules. Every post with 3+ reports will be removed automatically. 


*I am a bot, and this action was performed automatically. Please [contact the moderators of this subreddit](/message/compose/?to=/r/UkraineWarReports) if you have any questions or concerns.*",e5688e013c65d4c1643d0390e149f3023f592783,True,False,,,,,0,1648538312,moderator,0,{},i2jcxf7,False,t3_tqu6wc,False,True,t3_tqu6wc,/r/UkraineWarReports/comments/tqu6wc/march_28_2022_ua_air_force_destroyed_8_russian/i2jcxf7/,1648538323,1,True,False,True,UkraineWarReports,t5_5wncl5,r/UkraineWarReports,public,,0,[],,1648509512.0,,,,
,[],False,,Fletcher010770,,default,[],,,dark,text,t2_4vy4jmgo,False,False,Good.,bdc919c5862d2a39b57ca176d3abadd999201cf1,True,False,,,,,0,1648538209,,0,{},i2jct0m,False,t3_tq9vbi,False,True,t3_tq9vbi,/r/UkraineWarReports/comments/tq9vbi/carlsberg_and_heineken_are_quitting_russia/i2jct0m/,1648538220,1,False,True,False,UkraineWarReports,t5_5wncl5,r/UkraineWarReports,public,,0,[],,1648509409.0,,,,
,[],False,,belowlight,,default,[],,,dark,text,t2_5rtiio9o,False,False,"Well that seems a bit more realistic now you’ve moved the goalposts.

Of course if a soldier commits an act classifiable as a “war crime”, then they should be prosecuted appropriately for it.

If that’s what you *really* meant by “hunted” then it’s quite a reasonably objective - though certainly shouldn’t be limited to just Russian soldiers. All parties involved on both sides should be held accountable for some of the truly horrendous acts being committed, and hopefully will be.",00e362e506f2f2c7179269438bab6e1043a0680d,True,False,,,,,0,1648538203,,0,{},i2jcsqo,False,t3_tq7izq,False,True,t1_i2id7jy,/r/UkraineWarReports/comments/tq7izq/mariupol_before_and_after_russian_liberation/i2jcsqo/,1648538220,1,False,True,False,UkraineWarReports,t5_5wncl5,r/UkraineWarReports,public,,0,[],,1648509403.0,,,,
,[],False,,chickensandwiche,,,[],,,,text,t2_jaa9y,False,False,Cool so are you in? You can use archive.is to archive this page so I can't just pretend I didn't make the comment if I'm proven wrong.,16421d73e989e65fb381fb5bf34b0bd7b6fcb005,True,False,,,,,0,1648538149,,0,{},i2jcqh2,False,t3_tqd0yi,False,True,t1_i2jbtt2,/r/UkraineWarReports/comments/tqd0yi/anonymous_has_revealed_an_important/i2jcqh2/,1648538159,1,False,True,False,UkraineWarReports,t5_5wncl5,r/UkraineWarReports,public,,0,[],,1648509349.0,,,,
,[],False,,AutoModerator,,,[],,,,text,t2_6l4z3,False,True,"This is a reminder to check the r/UkraineWarReports rules. Every post with 3+ reports will be removed automatically. 


*I am a bot, and this action was performed automatically. Please [contact the moderators of this subreddit](/message/compose/?to=/r/UkraineWarReports) if you have any questions or concerns.*",e5688e013c65d4c1643d0390e149f3023f592783,True,False,,,,,0,1648538078,moderator,0,{},i2jcnfl,False,t3_tqu4ys,False,True,t3_tqu4ys,/r/UkraineWarReports/comments/tqu4ys/rf_war_crimes_144_children_killed_and_220/i2jcnfl/,1648538093,1,True,False,True,UkraineWarReports,t5_5wncl5,r/UkraineWarReports,public,,0,[],,1648509278.0,,,,
,[],False,,chickensandwiche,,,[],,,,text,t2_jaa9y,False,False,"&gt; Yep. I do. And I am willing to put money on the table. How about we each donate $1000 to the Red Cross, and when we find out who is correct the one who is incorrect will cover the other's donation?

Yeah sure. But can we make it that the winner chooses the charity? It's going to be hard for either of us to prove we made a donation but I'll take your word for it. And seeing as you took me up on it, I apologise for assuming you wouldn't. I've had too many conversations with redditors that just jump to name-calling instead of having a civil discussion about the facts and I appreciate that you didn't. If anyone else with an account over 4 years old wants to join in, feel free to comment.

&gt; 15 seconds into the video my hackles were up with what I thought were anomalies and so I stated it was fake, and reported it.

I feel like that your feelings about the war have clouded your judgment, but we'll have to wait and see. There's a couple of comments in the video thread (by other users) which I agree with, and explain why I think some of the supposed ""anomalies"" aren't really anomalies (e.g. [1][2]).

&gt; BTW, Ukraine govt issued a statement that the video was fake. FYI.

Are you referring to [this statement](https://twitter.com/nexta_tv/status/1508196787244486663) or something else? 

I'll remind you that the Ukrainian government also issued a [statement](https://twitter.com/nexta_tv/status/1497010338188857347) that all of the soldiers on Snake Island were dead.

You should also read through [this article](https://twitter.com/DavidPuente/status/1508558083978637336) by independent fact-checker David Puente (use google translate if you don't speak Italian), before we start. The 97% upvoted post we are both commenting on is part of a propaganda campaign.
 
[1]https://old.reddit.com/r/UkraineWarReports/comments/tqghse/nice_try_russian_propagandists_but_you_failed/i2h7jyd/      
[2]https://old.reddit.com/r/UkraineWarReports/comments/tqghse/nice_try_russian_propagandists_but_you_failed/i2i8l4w/",165d180595cdcc0043703603e5fa4e4207db476c,True,False,,,,,0,1648537934,,0,{},i2jch8w,False,t3_tqd0yi,False,False,t1_i2j7k53,/r/UkraineWarReports/comments/tqd0yi/anonymous_has_revealed_an_important/i2jch8w/,1648537950,1,False,True,False,UkraineWarReports,t5_5wncl5,r/UkraineWarReports,public,,0,[],,1648509134.0,,,,
,[],False,,Not_a_pariah,,default,[],,,dark,text,t2_12vbgw,False,False,Cause it's not a movie,daa93bbbe591dd85e27dda825317d1f78f6183d4,True,False,,,,,0,1648537643,,0,{},i2jc4tq,False,t3_tqicy7,False,True,t1_i2hbtcp,/r/UkraineWarReports/comments/tqicy7/direct_hit_with_the_rpg_on_the_russian_tank/i2jc4tq/,1648537657,1,False,True,False,UkraineWarReports,t5_5wncl5,r/UkraineWarReports,public,,0,[],,1648508843.0,,,,
,[],False,,phuckmydoodle,,default,[],,,dark,text,t2_2m2bum6,False,False,Putin's head should be broken up like Germany after WWII,716bc1de23787ee7f7ff4e8ec7e244e9dd630f5b,True,False,,,,,0,1648537551,,0,{},i2jc0uc,False,t3_tq7izq,False,True,t1_i2gg80e,/r/UkraineWarReports/comments/tq7izq/mariupol_before_and_after_russian_liberation/i2jc0uc/,1648537582,1,False,True,False,UkraineWarReports,t5_5wncl5,r/UkraineWarReports,public,,0,[],,1648508751.0,,,,
,[],False,,Fletcher010770,,default,[],,,dark,text,t2_4vy4jmgo,False,False,Keep fighting boys and girls. You're making them bleed badly.,958059d37eeaa44a312c2111e82abb2bbd518c07,True,False,,,,,0,1648537511,,0,{},i2jbz2k,False,t3_tqhems,False,True,t3_tqhems,/r/UkraineWarReports/comments/tqhems/ukrainian_stugnap_showed_its_effectiveness_again/i2jbz2k/,1648537526,1,False,True,False,UkraineWarReports,t5_5wncl5,r/UkraineWarReports,public,,0,[],,1648508711.0,,,,
,[],False,,steam-1123,,default,[],,,dark,text,t2_12qoqf,False,False,Let’s see you deleting your account. But honestly I don’t think you will. You’ll just live in your reality where there’s a “special military operation going on”.,bfe7fb9f61372fc09b0513452ba20d4a068402cb,True,False,,,,,0,1648537391,,0,{},i2jbtt2,False,t3_tqd0yi,False,True,t1_i2izsud,/r/UkraineWarReports/comments/tqd0yi/anonymous_has_revealed_an_important/i2jbtt2/,1648537402,1,False,True,False,UkraineWarReports,t5_5wncl5,r/UkraineWarReports,public,,0,[],,1648508591.0,,,,
,[],False,,AutoModerator,,,[],,,,text,t2_6l4z3,False,True,"This is a reminder to check the r/UkraineWarReports rules. Every post with 3+ reports will be removed automatically. 


*I am a bot, and this action was performed automatically. Please [contact the moderators of this subreddit](/message/compose/?to=/r/UkraineWarReports) if you have any questions or concerns.*",e5688e013c65d4c1643d0390e149f3023f592783,True,False,,,,,0,1648537287,moderator,0,{},i2jbp65,False,t3_tqtyiz,False,True,t3_tqtyiz,/r/UkraineWarReports/comments/tqtyiz/total_estimated_losses_of_the_enemy_from_2402_to/i2jbp65/,1648537302,1,True,False,True,UkraineWarReports,t5_5wncl5,r/UkraineWarReports,public,,0,[],,1648508487.0,,,,
,[],False,,AcrobaticBird5590,,default,[],,,dark,text,t2_k6idiwfc,False,False,Haha 2 hopes none   and bob,2b9e975e58e595b934c877ac40f6a40d7058bcd4,True,False,,,,,0,1648537287,,0,{},i2jbp6m,False,t3_tpj98k,False,True,t3_tpj98k,/r/UkraineWarReports/comments/tpj98k/europe_will_be_next_truth_about_russian_invasion/i2jbp6m/,1648537302,1,False,True,False,UkraineWarReports,t5_5wncl5,r/UkraineWarReports,public,,0,[],,1648508487.0,,,,
,[],False,,shadowhound21,,default,[],,,dark,text,t2_51nz0m81,False,False,Didn't think of this way it is indeed dumb to show who defected online XDD,b9bd7ab1b7f16e700a689d96b19c2177b7c84047,True,False,,,,,0,1648537271,,0,{},i2jboh3,False,t3_tqhgyo,False,True,t1_i2jbb6o,/r/UkraineWarReports/comments/tqhgyo/russian_pow_agrees_to_join_ukranians_when_asked/i2jboh3/,1648537282,1,False,True,False,UkraineWarReports,t5_5wncl5,r/UkraineWarReports,public,,0,[],,1648508471.0,,,,
,[],False,,AcrobaticBird5590,,default,[],,,dark,text,t2_k6idiwfc,False,False,Russia wont give you peace      no matter what you do putin has to die,e38ff71ce6d1f40df0ad9d9604cda4b3a8272945,True,False,,,,,0,1648537142,,0,{},i2jbirk,False,t3_tq0kmk,False,True,t3_tq0kmk,/r/UkraineWarReports/comments/tq0kmk/ukraine_ready_to_discuss_neutral_status_as_part/i2jbirk/,1648537158,1,False,True,False,UkraineWarReports,t5_5wncl5,r/UkraineWarReports,public,,0,[],,1648508342.0,,,,
,[],False,,13endix,,default,[],,,dark,text,t2_7lkoe90s,False,False,That does make a lot of sense!,a4f9642c70b56c7a6fe11c45c1e0d6fa59b3237c,True,False,,,,,0,1648537136,,0,{},i2jbihu,False,t3_tqhems,False,True,t1_i2j8yfr,/r/UkraineWarReports/comments/tqhems/ukrainian_stugnap_showed_its_effectiveness_again/i2jbihu/,1648537151,1,False,True,False,UkraineWarReports,t5_5wncl5,r/UkraineWarReports,public,,0,[],,1648508336.0,,,,
,[],False,,masterzergin,,default,[],,,dark,text,t2_rh0ep,False,False,"Obviously.. thats not my point. 

Its advertised that leavers get 50k. 
But this particular leaver with a tank got only 10k.

Seems like maybe it's just all propaganda.",a3d2b2d14bf8ba46f3542a206b1e2f75708a10d0,True,False,,,,,0,1648537133,,0,{},i2jbic1,False,t3_tqd0yi,False,True,t1_i2jbbe6,/r/UkraineWarReports/comments/tqd0yi/anonymous_has_revealed_an_important/i2jbic1/,1648537145,1,False,True,False,UkraineWarReports,t5_5wncl5,r/UkraineWarReports,public,,0,[],,1648508333.0,,,,
,[],False,,PervySmokez,,default,[],,,dark,text,t2_3ji9j8v4,False,False,Don’t forget life! Not worth so much but it’s a bonus on top of the 10k,17293a181dfe51918027c48cfd41bc842c59fc6e,True,False,,,,,0,1648536974,,0,{},i2jbbe6,False,t3_tqd0yi,False,True,t1_i2jaysm,/r/UkraineWarReports/comments/tqd0yi/anonymous_has_revealed_an_important/i2jbbe6/,1648536987,1,False,True,False,UkraineWarReports,t5_5wncl5,r/UkraineWarReports,public,,0,[],,1648508174.0,,,,
,[],False,,slinkymcman,,default,[],,,dark,text,t2_69rwgpkm,False,False,"Yep, first thing you do for defectors who fight for you is you don't plaster their face on the internet.",ad2d831fe96eb63bcae2c37f850779b9db5a200c,True,False,,,,,0,1648536970,,0,{},i2jbb6o,False,t3_tqhgyo,False,True,t1_i2j2v9i,/r/UkraineWarReports/comments/tqhgyo/russian_pow_agrees_to_join_ukranians_when_asked/i2jbb6o/,1648536980,1,False,True,False,UkraineWarReports,t5_5wncl5,r/UkraineWarReports,public,,0,[],,1648508170.0,,,,
,[],False,,Fletcher010770,,default,[],,,dark,text,t2_4vy4jmgo,False,False,"They are proven to be committed fighters, and are the only reason afaik that Mariupol has not fallen to the Russians. I've read quite a bit about them and it's said that only about 10% of them still hold those views. Shit, probably 5% of front line western armies privately hold an extremist view. It doesn't mean they're undisciplined.",30759dfa664c16453d8bb649257aeb748de3cd28,True,False,,,,,0,1648536912,,0,{},i2jb8mr,False,t3_t3roqu,False,True,t3_t3roqu,/r/UkraineWarReports/comments/t3roqu/a_foreign_volunteer_of_the_azov_regiment/i2jb8mr/,1648536928,1,False,True,False,UkraineWarReports,t5_5wncl5,r/UkraineWarReports,public,,0,[],,1648508112.0,,,,
,[],False,,masterzergin,,default,[],,,dark,text,t2_rh0ep,False,False,Apparently the guy who surrendered with a working tank is only getting 10k USD,c3bee0f4e3b18621adfa029883f91ee772e7f995,True,False,,,,,0,1648536689,,0,{},i2jaysm,False,t3_tqd0yi,False,True,t1_i2iq9cx,/r/UkraineWarReports/comments/tqd0yi/anonymous_has_revealed_an_important/i2jaysm/,1648536703,1,False,True,False,UkraineWarReports,t5_5wncl5,r/UkraineWarReports,public,,0,[],,1648507889.0,,,,
,[],False,,shadowhound21,,default,[],,,dark,text,t2_51nz0m81,False,False,Reminds me of Donetks when the Ukrainians bombed their own civilian population.,2e8b83f3e528faf3691a033adcd54dc9e3ded02e,True,False,,,,,0,1648536516,,0,{},i2jar7y,False,t3_tq7izq,False,True,t3_tq7izq,/r/UkraineWarReports/comments/tq7izq/mariupol_before_and_after_russian_liberation/i2jar7y/,1648536527,1,False,True,False,UkraineWarReports,t5_5wncl5,r/UkraineWarReports,public,,0,[],,1648507716.0,,,,
,[],False,,sneakpeekbot,,default,[],,,dark,text,t2_140r4p,False,False,"Here's a sneak peek of /r/SelfAwarewolves using the [top posts](https://np.reddit.com/r/SelfAwarewolves/top/?sort=top&amp;t=year) of the year!

\#1: [I changed the photos to see if the impact was still the same.](https://i.redd.it/c4rq2vfkpm571.jpg) | [4078 comments](https://np.reddit.com/r/SelfAwarewolves/comments/o14rnd/i_changed_the_photos_to_see_if_the_impact_was/)  
\#2: [Alt right twat realises he has the same ideology as the Taliban](https://i.redd.it/1jisyn8dzqh71.jpg) | [2935 comments](https://np.reddit.com/r/SelfAwarewolves/comments/p5jq8j/alt_right_twat_realises_he_has_the_same_ideology/)  
\#3: [Yes, Ted Cruz. It absolutely does speak volumes.](https://imgur.com/GNMhDJH) | [2976 comments](https://np.reddit.com/r/SelfAwarewolves/comments/n26nk2/yes_ted_cruz_it_absolutely_does_speak_volumes/)

----
^^I'm ^^a ^^bot, ^^beep ^^boop ^^| ^^Downvote ^^to ^^remove ^^| ^^[Contact](https://www.reddit.com/message/compose/?to=sneakpeekbot) ^^| ^^[Info](https://np.reddit.com/r/sneakpeekbot/) ^^| ^^[Opt-out](https://np.reddit.com/r/sneakpeekbot/comments/o8wk1r/blacklist_ix/) ^^| ^^[GitHub](https://github.com/ghnr/sneakpeekbot)",6bd639bac27a3c621360bce864233238b70386c8,True,False,,,,,0,1648536410,,0,{},i2jamid,False,t3_tpjjjw,False,True,t1_i2jalka,/r/UkraineWarReports/comments/tpjjjw/how_sanctions_are_killing_russia_russias_falling/i2jamid/,1648536422,1,False,True,False,UkraineWarReports,t5_5wncl5,r/UkraineWarReports,public,,0,[],,1648507610.0,,,,
,[],False,,theProffPuzzleCode,,default,[],,,dark,text,t2_5uujzt7j,False,False,r/SelfAwarewolves,2aa7ba30c17e8d502059bd208ad5267e09ca61ab,True,False,,,,,0,1648536388,,0,{},i2jalka,False,t3_tpjjjw,False,True,t1_i2hz9jg,/r/UkraineWarReports/comments/tpjjjw/how_sanctions_are_killing_russia_russias_falling/i2jalka/,1648536403,1,False,True,False,UkraineWarReports,t5_5wncl5,r/UkraineWarReports,public,,0,[],,1648507588.0,,,,
,[],False,,AutoModerator,,,[],,,,text,t2_6l4z3,False,True,"This is a reminder to check the r/UkraineWarReports rules. Every post with 3+ reports will be removed automatically. 


*I am a bot, and this action was performed automatically. Please [contact the moderators of this subreddit](/message/compose/?to=/r/UkraineWarReports) if you have any questions or concerns.*",e5688e013c65d4c1643d0390e149f3023f592783,True,False,,,,,0,1648535973,moderator,0,{},i2ja361,False,t3_tqtnjg,False,True,t3_tqtnjg,/r/UkraineWarReports/comments/tqtnjg/kremlin_spokesman_no_one_in_russia_is_thinking/i2ja361/,1648535984,1,True,False,True,UkraineWarReports,t5_5wncl5,r/UkraineWarReports,public,,0,[],,1648507173.0,,,,
,[],False,,Nelson1352,,default,[],,,dark,text,t2_dqlcw,False,False,What a strong and brave woman.,e15ba85357d2d617de2e4f320e032e6f38b0848a,True,False,,,,,0,1648535808,,0,{},i2j9vqe,False,t3_tqk2a6,False,True,t3_tqk2a6,/r/UkraineWarReports/comments/tqk2a6/77yearold_russian_painter_elena_osipova_from_st/i2j9vqe/,1648535821,1,False,True,False,UkraineWarReports,t5_5wncl5,r/UkraineWarReports,public,,0,[],,1648507008.0,,,,
,[],False,,TheConnoissuer,,default,[],,,dark,text,t2_4edfntk3,False,False,Lol you bend over for the media and actually believe everything they tell you. What a sheep hahaha,2060c240c2d109dfdd18f1ef61e44e15c5984d5a,True,False,,,,,0,1648535087,,0,{},i2j8z5o,False,t3_tm4xgf,False,True,t1_i2es1hh,/r/UkraineWarReports/comments/tm4xgf/meanwhile_the_azov_regiment_continues_to/i2j8z5o/,1648535098,1,False,True,False,UkraineWarReports,t5_5wncl5,r/UkraineWarReports,public,,0,[],,1648506287.0,,,,
,[],False,,AdzJayS,,default,[],,,dark,text,t2_k3mfc6dh,False,False,"It’s just British supplied combat clothing, they come from the manufacturer with Union flags already sewn on. There’s been plenty of them in videos. 👍🏻",a88e715f399a37b4fb56e8557ec6ac49860c85bc,True,False,,,,,0,1648535072,,0,{},i2j8yfr,False,t3_tqhems,False,True,t1_i2h8tw0,/r/UkraineWarReports/comments/tqhems/ukrainian_stugnap_showed_its_effectiveness_again/i2j8yfr/,1648535085,1,False,True,False,UkraineWarReports,t5_5wncl5,r/UkraineWarReports,public,,0,[],,1648506272.0,,,,
,[],False,,PzMcQuire,,default,[],,,dark,text,t2_12eeyv,False,False,"They're still probably trying to convince that Ukraine is the one bombing these places... 


""When in a war, just bomb the living shit out of your own infrastructure and cities, because the pesky psychological warfare is way more important that all of this shit you lose in the progress""

- Sun Tzu with a 42-celcius fever",3b7d5291f665c4cad1a2840cbc4ab6af524e8abb,True,False,,,,,0,1648535060,,0,{},i2j8xxp,False,t3_tqdbza,False,True,t3_tqdbza,/r/UkraineWarReports/comments/tqdbza/russia_destroyed_almost_1200_highrise_buildings/i2j8xxp/,1648535072,1,False,True,False,UkraineWarReports,t5_5wncl5,r/UkraineWarReports,public,,0,[],,1648506260.0,,,,
,[],False,,Mrs_Jekyl_and_Hyde,,default,[],,,dark,text,t2_r77et,False,False,disturbing number of people here thinking this is Zelensky. Look at the guy ffs. He doesn't look like him at all once they zoom closer. wowsa,abd02ab90bf09c00e61dc37cec0fc536cdb1f558,True,False,,,,,0,1648534979,,0,{},i2j8u9a,False,t3_tqcojt,False,True,t3_tqcojt,/r/UkraineWarReports/comments/tqcojt/zelensky_volodymyr_una_cover_di_john_lennon/i2j8u9a/,1648534992,1,False,True,False,UkraineWarReports,t5_5wncl5,r/UkraineWarReports,public,,0,[],,1648506179.0,,,,
,[],False,,JesseVentura911,,default,[],,,dark,text,t2_mwrb1,False,False,How do you know THIS isn’t propaganda,11f2eefc2f872dac5d1e1eaefb5ca484997a804b,True,False,,,,,0,1648534686,,0,{},i2j8gvs,False,t3_tqghse,False,True,t1_i2h891i,/r/UkraineWarReports/comments/tqghse/nice_try_russian_propagandists_but_you_failed/i2j8gvs/,1648534699,1,False,True,False,UkraineWarReports,t5_5wncl5,r/UkraineWarReports,public,,0,[],,1648505886.0,,,,
,[],False,,pocmok,,default,[],,,dark,text,t2_15l8beow,False,False,Bullshit )  it's not real,e0476ce7281e0b440a3dec07ed3a02425aab83b4,True,False,,,,,0,1648534494,,0,{},i2j882y,False,t3_tq3wwt,False,True,t3_tq3wwt,/r/UkraineWarReports/comments/tq3wwt/total_estimation_losses_of_the_enemy_from_2402_to/i2j882y/,1648534508,1,False,True,False,UkraineWarReports,t5_5wncl5,r/UkraineWarReports,public,,0,[],,1648505694.0,,,,
,[],False,,Mrs_Jekyl_and_Hyde,,default,[],,,dark,text,t2_r77et,False,False,what the hell is with the music in all these videos?,4723dae11d6763dae7583892e2e12e93db84a555,True,False,,,,,0,1648534462,,0,{},i2j86l2,False,t3_tqahs1,False,True,t3_tqahs1,/r/UkraineWarReports/comments/tqahs1/even_ukrainian_birds_taking_a_part_in_shelling_on/i2j86l2/,1648534474,1,False,True,False,UkraineWarReports,t5_5wncl5,r/UkraineWarReports,public,,0,[],,1648505662.0,,,,
,[],False,,AutoModerator,,,[],,,,text,t2_6l4z3,False,True,"This is a reminder to check the r/UkraineWarReports rules. Every post with 3+ reports will be removed automatically. 


*I am a bot, and this action was performed automatically. Please [contact the moderators of this subreddit](/message/compose/?to=/r/UkraineWarReports) if you have any questions or concerns.*",e5688e013c65d4c1643d0390e149f3023f592783,True,False,,,,,0,1648534315,moderator,0,{},i2j7zx1,False,t3_tqt9oa,False,True,t3_tqt9oa,/r/UkraineWarReports/comments/tqt9oa/ukrainian_cat_is_on_shift_the_enemy_has_no_chance/i2j7zx1/,1648534330,1,True,False,True,UkraineWarReports,t5_5wncl5,r/UkraineWarReports,public,,0,[],,1648505515.0,,,,
,[],False,,SaveVideo,,default,[],,,dark,text,t2_8gveco3a,False,False,"###[View link](https://redditsave.com/r/UkraineWarReports/comments/tqahs1/even_ukrainian_birds_taking_a_part_in_shelling_on/)


 --- 
 [**Info**](https://np.reddit.com/user/SaveVideo/comments/jv323v/info/)&amp;#32;|&amp;#32; [**Feedback**](https://np.reddit.com/message/compose/?to=Kryptonh&amp;subject=Feedback for savevideo)&amp;#32;|&amp;#32;[**Donate**](https://ko-fi.com/getvideo) &amp;#32;|&amp;#32; [**DMCA**](https://np.reddit.com/message/compose/?to=Kryptonh&amp;subject=Content removal request for savevideo&amp;message=https://np.reddit.com//r/UkraineWarReports/comments/tqahs1/even_ukrainian_birds_taking_a_part_in_shelling_on/) &amp;#32;|&amp;#32; 
 [^(reddit video downloader)](https://redditsave.com) &amp;#32;|&amp;#32; [^(download video tiktok)](https://taksave.com)",ce9c66d928333451a007e8cad8052b7b3200384b,True,False,,,,,0,1648534109,,0,{},i2j7qd4,False,t3_tqahs1,False,True,t1_i2j7pcy,/r/UkraineWarReports/comments/tqahs1/even_ukrainian_birds_taking_a_part_in_shelling_on/i2j7qd4/,1648534123,1,False,True,False,UkraineWarReports,t5_5wncl5,r/UkraineWarReports,public,,0,[],,1648505309.0,,,,
,[],False,,TheRedLewis,,default,[],,,dark,text,t2_bcslf3sw,False,False,u/savevideo,70a0f94b1709054e8c936673e18a6bab7d60f29f,True,False,,,,,0,1648534087,,0,{},i2j7pcy,False,t3_tqahs1,False,True,t3_tqahs1,/r/UkraineWarReports/comments/tqahs1/even_ukrainian_birds_taking_a_part_in_shelling_on/i2j7pcy/,1648534103,1,False,True,False,UkraineWarReports,t5_5wncl5,r/UkraineWarReports,public,,0,[],,1648505287.0,,,,
,[],False,,CaptainSur,,default,[],,,dark,text,t2_16rohi,False,False,"Yep.  I do.  And I am willing to put money on the table.  How about we each donate $1000 to the Red Cross, and when we find out who is correct the one who is incorrect will cover the other's donation?

The thing about having been a soldier is certain things become ingrained.  Vs irregulars who think they know, but because it was not drilled into them 24/7 in training for weeks on end, they don't really know and so they slip on the details.  Even when your on exercise in the slop there is an NCO who is always all over your tail to not look like a disaster in the making.  15 seconds into the video my hackles were up with what I thought were anomalies and so I stated it was fake, and reported it.  

BTW, Ukraine govt issued a statement that the video was fake. FYI.",78d2adf233f96b92ec253c614628b564f4cab826,True,False,,,,,0,1648533973,,0,{},i2j7k53,False,t3_tqd0yi,False,True,t1_i2izsud,/r/UkraineWarReports/comments/tqd0yi/anonymous_has_revealed_an_important/i2j7k53/,1648533985,1,False,True,False,UkraineWarReports,t5_5wncl5,r/UkraineWarReports,public,,0,[],,1648505173.0,,,,
,[],False,,NathamelCamel,,default,[],,,dark,text,t2_zbr1q,False,False,r/BirdsArentReal,db004d61021e29900479db12cf749870aea77175,True,False,,,,,0,1648533110,,0,{},i2j6ebx,False,t3_tqahs1,False,True,t1_i2g99ws,/r/UkraineWarReports/comments/tqahs1/even_ukrainian_birds_taking_a_part_in_shelling_on/i2j6ebx/,1648533123,1,False,True,False,UkraineWarReports,t5_5wncl5,r/UkraineWarReports,public,,0,[],,1648504310.0,,,,
