Unnamed: 0,all_awardings,archived,associated_award,author,author_flair_background_color,author_flair_css_class,author_flair_richtext,author_flair_template_id,author_flair_text,author_flair_text_color,author_flair_type,author_fullname,author_patreon_flair,author_premium,body,body_sha1,can_gild,collapsed,collapsed_because_crowd_control,collapsed_reason,collapsed_reason_code,comment_type,controversiality,created_utc,distinguished,gilded,gildings,id,is_submitter,link_id,locked,no_follow,parent_id,permalink,retrieved_utc,score,score_hidden,send_replies,stickied,subreddit,subreddit_id,subreddit_name_prefixed,subreddit_type,top_awarded_type,total_awards_received,treatment_tags,unrepliable_reason,created,author_cakeday,edited,editable,media_metadata
,[],False,,Mr_Soupe,,default,[],,,dark,text,t2_c4hrz,False,False,"The 15 hospitals were the caution to call the strikes ""surgical"".",391fc9b1014633009df425421c3b2d4530ea63a5,True,False,,,,,0,1648598343,,0,{},i2ngayx,False,t3_tqdbza,False,False,t3_tqdbza,/r/UkraineWarReports/comments/tqdbza/russia_destroyed_almost_1200_highrise_buildings/i2ngayx/,1648598359,1,False,True,False,UkraineWarReports,t5_5wncl5,r/UkraineWarReports,public,,0,[],,1648569543.0,,,,
,[],False,,Plastic_Flan_4204,,default,[],,,dark,text,t2_dgha8rag,False,False,Hm I dunno. Sounds like bullshit to me. Your countrymen are fleeing at wild numbers. A cowardly Russian is an brave human.,62ebdadac5b61422ea0005dd1ccfac026636ecc6,True,False,,,,,0,1648598328,,0,{},i2ng9uq,False,t3_trf29e,False,True,t1_i2mcy19,/r/UkraineWarReports/comments/trf29e/russians_forgot_their_own_soldiers/i2ng9uq/,1648598343,1,False,True,False,UkraineWarReports,t5_5wncl5,r/UkraineWarReports,public,,0,[],,1648569528.0,,,,
,[],False,,JakubSwitalski,,default,[],,,dark,text,t2_j1jemls,False,False,"There was a bunch of videos releasing simultaneously that no-one can 1000% prove are fake, but people have pointed out dozens of very suspicious things in them that together amount to the conclusion that Russia has released fake POW torture and murder footage from Ukrainian POV",a6d655dd20044c2f530b388bb42cd07186c25491,True,False,,,,,0,1648598131,,0,{},i2nfuja,False,t3_trf29e,False,True,t1_i2mgxef,/r/UkraineWarReports/comments/trf29e/russians_forgot_their_own_soldiers/i2nfuja/,1648598146,1,False,True,False,UkraineWarReports,t5_5wncl5,r/UkraineWarReports,public,,0,[],,1648569331.0,,,,
,[],False,,aPriori07,,default,[],,,dark,text,t2_1gk7c93x,False,False,Nice try Russian bot.,6bb54f5466661b48265b36eb76005a9e28aec2b3,True,False,,,,,0,1648597638,,0,{},i2nertx,False,t3_trf29e,False,True,t1_i2mcy19,/r/UkraineWarReports/comments/trf29e/russians_forgot_their_own_soldiers/i2nertx/,1648597654,1,False,True,False,UkraineWarReports,t5_5wncl5,r/UkraineWarReports,public,,0,[],,1648568838.0,,,,
,[],False,,Militant_Triangle,,default,[],,,dark,text,t2_2j0oofsf,False,False,"Kharkov..... like the largest Russian speaking ethnically Russian Ukrainians in the whole dang country.  Russia... we are here to save you!  By flattening you and your city too.... teeheheheheh!

And Yes... I intended to spell mainly Russian speaking city with the Russian spelling to illustrate the utter BULLSHIT of Pulter's Russia.  This is some Czar/Bolshevik level of hypocrisy.   I guess those Russian speaking ethnic Russians were also Nazi's. Rolls eyes... This damned insane stupidity needs to stop.",de5a2e5f3b2d30183ac67f49accee523639a15cc,True,False,,,,,0,1648597361,,0,{},i2ne63z,False,t3_trexh9,False,False,t3_trexh9,/r/UkraineWarReports/comments/trexh9/war_aftermath_of_kharkiv_city_ukraine_terrifying/i2ne63z/,1648597377,1,False,True,False,UkraineWarReports,t5_5wncl5,r/UkraineWarReports,public,,0,[],,1648568561.0,,,,
,[],False,,Inigo93,,default,[],,,dark,text,t2_77h3j,False,True,Got a brilliant idea on how to do that on which everyone can agree?,3cdf5dec0c2ad701be7f8dab1f3a38e134c1511c,True,False,,,,,0,1648597240,,0,{},i2ndwp1,False,t3_tqy6un,False,False,t1_i2ls9fu,/r/UkraineWarReports/comments/tqy6un/a_russian_t80u_previously_unseen_appears_to_have/i2ndwp1/,1648597260,1,False,True,False,UkraineWarReports,t5_5wncl5,r/UkraineWarReports,public,,0,[],,1648568440.0,,,,
,[],False,,wheelsmatsjall,,default,[],,,dark,text,t2_g2zq1wxn,False,False,I hope that Russia past somehow. They are not probably going to get anything because of Europeans are going to roll over and just by their gas and oil and say oh well at least you didn't invade us oh well oh well. They will just keep passing the buck to European countries. They could have put in troops before this ever happened piece creeping forces and Russia would not have invaded but they did not have enough backbone to do this. Instead they just stood around and suck their fingers like a bunch of little babies,9e86f4ab200f3d978633a057a15cd9b2ff949510,True,False,,,,,0,1648596795,,0,{},i2ncxh5,False,t3_tr4gjd,False,True,t1_i2kouxu,/r/UkraineWarReports/comments/tr4gjd/we_fight_you_support_world_win/i2ncxh5/,1648596813,1,False,True,False,UkraineWarReports,t5_5wncl5,r/UkraineWarReports,public,,0,[],,1648567995.0,,,,
,[],False,,Militant_Triangle,,default,[],,,dark,text,t2_2j0oofsf,False,False,"Woooo, professional NCO's in that rolling box.  Soldiering 101....F.",fa412ad0728b1d2936d23aa6602907e5045878fd,True,False,,,,,0,1648596757,,0,{},i2ncu9a,False,t3_trf29e,False,False,t3_trf29e,/r/UkraineWarReports/comments/trf29e/russians_forgot_their_own_soldiers/i2ncu9a/,1648596781,1,False,True,False,UkraineWarReports,t5_5wncl5,r/UkraineWarReports,public,,0,[],,1648567957.0,,,,
,[],False,,AutoModerator,,,[],,,,text,t2_6l4z3,False,True,"This is a reminder to check the r/UkraineWarReports rules. Every post with 3+ reports will be removed automatically. 


*I am a bot, and this action was performed automatically. Please [contact the moderators of this subreddit](/message/compose/?to=/r/UkraineWarReports) if you have any questions or concerns.*",e5688e013c65d4c1643d0390e149f3023f592783,True,False,,,,,0,1648596676,moderator,0,{},i2ncnq0,False,t3_trsvcf,False,True,t3_trsvcf,/r/UkraineWarReports/comments/trsvcf/eu_paid_russia_16_billion_for_fossil_fuels_since/i2ncnq0/,1648596697,1,True,False,True,UkraineWarReports,t5_5wncl5,r/UkraineWarReports,public,,0,[],,1648567876.0,,,,
,[],False,,wheelsmatsjall,,default,[],,,dark,text,t2_g2zq1wxn,False,False,"I want to also realizes fit organizations like Red Cross UNICEF United Way they will all take at least 20% for the top fat cats and wind up not giving all the money to Ukraine. They get their C4 just collecting the money. It is really disgusting how much money they take how much the top earner of United Way gets I know people that get $100,000 just to contact companies to contribute to the United Way. I didn't do anything except send out emails to companies to get their employees to give. The Red Cross pays their employees the Run branches well over a hundred thousand a year and the rest of us are trying to eat rice and beans and they're like oh well you didn't get the job I did haha that is their attitude and it is not a good attitude. But no one really wants to audit or do anything about these charitable organizations because they are run by the rich for the rich so that they can get their own money. I know a person who writes grants so he gets money from people to give money to Charities and he takes 30% of the money for himself he got $400,000 last year that is just a disgusting amount that all he does is attend high-end cocktail parties.",18bc4c4d11594cae85d65aed183acafe328d112d,True,False,,,,,0,1648596660,,0,{},i2ncmiw,False,t3_trezdx,False,True,t3_trezdx,/r/UkraineWarReports/comments/trezdx/there_is_nothing_left_mariupol_people_went/i2ncmiw/,1648596687,1,False,True,False,UkraineWarReports,t5_5wncl5,r/UkraineWarReports,public,,0,[],,1648567860.0,,,,
,[],False,,Rieger_not_Banta,,default,[],,,dark,text,t2_ea0y3msq,False,False,"Who is my savior?  Seriously, I would have voted for a bag of leaves over trump. Biden could disappear tomorrow for all I care. Maybe you’re projecting.  Are you a trump supporter? Gotta be.",32658dd3a1a3b321b53ba06c293c0dbd314c74f8,True,False,,,,,0,1648596596,,0,{},i2nch8p,False,t3_tosyh4,False,True,t1_i2ksytp,/r/UkraineWarReports/comments/tosyh4/the_us_president_joe_biden_called_putin_a_butcher/i2nch8p/,1648596612,1,False,True,False,UkraineWarReports,t5_5wncl5,r/UkraineWarReports,public,,0,[],,1648567796.0,,,,
,[],False,,Physical-Analyst468,,default,[],,,dark,text,t2_d5eo2u18,False,False,Sounds good,88a04b66e38f0d8b94f603d947495332bd0543a9,True,False,,,,,0,1648596498,,0,{},i2nc9e5,False,t3_tqghse,False,True,t1_i2mn4ep,/r/UkraineWarReports/comments/tqghse/nice_try_russian_propagandists_but_you_failed/i2nc9e5/,1648596517,1,False,True,False,UkraineWarReports,t5_5wncl5,r/UkraineWarReports,public,,0,[],,1648567698.0,,,,
,[],False,,Loose-Fee135,,default,[],,,dark,text,t2_j78opbd3,False,False,Another pic of the century :denazify Ukraine children playground,9ab1f095004ccaa352a60b628456cf97bde47adb,True,False,,,,,0,1648596487,,0,{},i2nc8i7,False,t3_trah1s,False,True,t3_trah1s,/r/UkraineWarReports/comments/trah1s/chernihiv_playground/i2nc8i7/,1648596507,1,False,True,False,UkraineWarReports,t5_5wncl5,r/UkraineWarReports,public,,0,[],,1648567687.0,,,,
,[],False,,wheelsmatsjall,,default,[],,,dark,text,t2_g2zq1wxn,False,False,No one has enough balls or backbone to make Russia pay. They will get away with murder and they will keep getting away with it and the Russian people will just say oh well most of them 1% May protest but 99% of Russian people don't care they need to be heard in the pocketbook. All the gas payments and oil payments that would have gone to Russia need to go to Ukraine for the next 20 years,91f1d8d1955dc2b66a8a1f2c5810569f3d7098c5,True,False,,,,,0,1648596426,,0,{},i2nc3jd,False,t3_trezdx,False,True,t3_trezdx,/r/UkraineWarReports/comments/trezdx/there_is_nothing_left_mariupol_people_went/i2nc3jd/,1648596443,1,False,True,False,UkraineWarReports,t5_5wncl5,r/UkraineWarReports,public,,0,[],,1648567626.0,,,,
,[],False,,wheelsmatsjall,,default,[],,,dark,text,t2_g2zq1wxn,False,False,Unfortunately the world does not care. I say this because they did not go in answer for Ukraine before there was ever an evasion. They could have put troops on the border of Ukraine before Russia ever invaded. Peacekeeping forces and Russia would not have invaded but they did not have enough balls especially Biden. Now unfortunately the Ukrainian people have nothing left. The reason they did not go in there is because they have no oil to have no gas to have nothing that the United States wants if they would have been the Middle East Country they would have been in there with troops on the ground in 3 minutes no. Unfortunately the rich 1% is only after their own they're not caring about the working Common Man. Unfortunately no one will help rebuild the cities and if they do they will only re-build them for 6 months and then that will be the end and they will all walk away and go oh well sorry people. It is disgusting how this world is.,ec8054aa99f27bfa225955bf9b563ffea608acc0,True,False,,,,,0,1648596302,,0,{},i2nbths,False,t3_trezdx,False,True,t3_trezdx,/r/UkraineWarReports/comments/trezdx/there_is_nothing_left_mariupol_people_went/i2nbths/,1648596327,1,False,True,False,UkraineWarReports,t5_5wncl5,r/UkraineWarReports,public,,0,[],,1648567502.0,,,,
,[],False,,Lilith303,,default,[],,,dark,text,t2_icj3r527,False,False,Lol!!,0ea8261d71e98e4658ca8c30cab45b2c2c3144ec,True,False,,,,,0,1648596011,,0,{},i2naih5,False,t3_tqup0m,False,True,t3_tqup0m,/r/UkraineWarReports/comments/tqup0m/real_love_is/i2naih5/,1648596025,1,False,True,False,UkraineWarReports,t5_5wncl5,r/UkraineWarReports,public,,0,[],,1648567211.0,,,,
,[],False,,dmkmobly,,default,[],,,dark,text,t2_a22oc411,False,False,The quick and the dead,6373a390b2a91ed4aea7d80a99955848e0176d71,True,False,,,,,0,1648595643,,0,{},i2n7jjl,False,t3_trf29e,False,True,t3_trf29e,/r/UkraineWarReports/comments/trf29e/russians_forgot_their_own_soldiers/i2n7jjl/,1648595678,1,False,True,False,UkraineWarReports,t5_5wncl5,r/UkraineWarReports,public,,0,[],,1648566843.0,,,,
,[],False,,No-Alternative-1132,,default,[],,,dark,text,t2_83bdw2zi,False,False,"It should be renamed ""Auchun"", or ""None"" in French. Financiers (aka usurers) are behind their continued presence and are worse than despotic, warmongering child-murderers. It IS that simple!",64187d3dce117103f2ce94103d9589da2bd81a88,True,False,,,,,0,1648595440,,0,{},i2n5snh,False,t3_tqwfxu,False,True,t3_tqwfxu,/r/UkraineWarReports/comments/tqwfxu/french_auchan_continues_supplying_russia_elite/i2n5snh/,1648595508,1,False,True,False,UkraineWarReports,t5_5wncl5,r/UkraineWarReports,public,,0,[],,1648566640.0,,,,
,[],False,,mancave313,,default,[],,,dark,text,t2_51guuv3m,False,False,I see white flags 🏳,2874628b23c0bec4aea7ee4eebeb1d2e949da92e,True,False,,,,,0,1648595070,,0,{},i2n2tia,False,t3_tr0b6p,False,True,t3_tr0b6p,/r/UkraineWarReports/comments/tr0b6p/russia_says_will_radically_reduce_military/i2n2tia/,1648595383,1,False,True,False,UkraineWarReports,t5_5wncl5,r/UkraineWarReports,public,,0,[],,1648566270.0,,,,
,[],False,,cynack,,default,[],,,dark,text,t2_gw5en,False,False,"That's what a number of smart individuals are thinking, especially after this latest explosion in Belgorod. Not sure why your comment got downvoted... pretty astute observation.",9c982071b2b0f7076a86385910c8435afea65194,True,False,,,,,0,1648594649,,0,{},i2my7li,False,t3_tr0b6p,False,True,t1_i2ly5ad,/r/UkraineWarReports/comments/tr0b6p/russia_says_will_radically_reduce_military/i2my7li/,1648595845,1,False,True,False,UkraineWarReports,t5_5wncl5,r/UkraineWarReports,public,,0,[],,1648565849.0,,,,
,[],False,,AbsurdlyDumb,,default,[],,,dark,text,t2_gt3detnq,False,False,"I don’t think it was a target, part of the rocket that detaches in flight and then just falls off",d0c8c036c24c1424451fc71540729c74345a3baf,True,False,,,,,0,1648594510,,0,{},i2mwe3e,False,t3_trah1s,False,True,t1_i2lmwyi,/r/UkraineWarReports/comments/trah1s/chernihiv_playground/i2mwe3e/,1648594534,1,False,True,False,UkraineWarReports,t5_5wncl5,r/UkraineWarReports,public,,0,[],,1648565710.0,,,,
,[],False,,tonzeejee,,default,[],,,dark,text,t2_69w7s,False,False,"That's the definition of ""left for dead"".",a697fce861f6ae0964886693d5ebbe3864c38e33,True,False,,,,,0,1648594475,,0,{},i2mvvtz,False,t3_trf29e,False,False,t3_trf29e,/r/UkraineWarReports/comments/trf29e/russians_forgot_their_own_soldiers/i2mvvtz/,1648595906,1,False,True,False,UkraineWarReports,t5_5wncl5,r/UkraineWarReports,public,,0,[],,1648565675.0,,,,
,[],False,,AbsurdlyDumb,,default,[],,,dark,text,t2_gt3detnq,False,False,That it wasn’t an intentional target,9c941854f634aecd53d6a006e61f2d2c70465fac,True,False,,,,,0,1648594461,,0,{},i2mvun7,False,t3_trah1s,False,True,t1_i2mjjp8,/r/UkraineWarReports/comments/trah1s/chernihiv_playground/i2mvun7/,1648594501,1,False,True,False,UkraineWarReports,t5_5wncl5,r/UkraineWarReports,public,,0,[],,1648565661.0,,,,
,[],False,,cynack,,default,[],,,dark,text,t2_gw5en,False,False,"Is Putin pulling back his forces, hiding in a bunker and initiating a false flag attack in Belgorod moments ago as a precursor to a nuclear attack?",8fbaf87541a1d2ee8b6b1dcc7b143b14a1951f63,True,False,,,,,0,1648594436,,0,{},i2mvd50,False,t3_tr0b6p,False,True,t3_tr0b6p,/r/UkraineWarReports/comments/tr0b6p/russia_says_will_radically_reduce_military/i2mvd50/,1648595919,1,False,True,False,UkraineWarReports,t5_5wncl5,r/UkraineWarReports,public,,0,[],,1648565636.0,,1648594687.0,,
,[],False,,LaSage,,default,[],,,dark,text,t2_6mq4b,False,False,Little put put is an embarrassment to his people,dae6bfa8d740676dbdd32d372b9bb0fef7ed12d7,True,False,,,,,0,1648594209,,0,{},i2mshld,False,t3_trf29e,False,True,t3_trf29e,/r/UkraineWarReports/comments/trf29e/russians_forgot_their_own_soldiers/i2mshld/,1648595993,1,False,True,False,UkraineWarReports,t5_5wncl5,r/UkraineWarReports,public,,0,[],,1648565409.0,,,,
,[],False,,Shankill-Road,,default,[],,,dark,text,t2_knsg9iet,False,False,"Is there any lists of businesses per country that remain in Russia?

These businesses should have been shut in every country that supports Ukraine as soon as they stated they would remain open in Russia.

Great concert tonight, they should have been highlighted on the big screen for all to see throughout it.

Glory To Ukraine 🇬🇧🇺🇦🇬🇧",293e0f8fd042f475607401207ec62b8924cf1f36,True,False,,,,,0,1648594205,,0,{},i2msh98,False,t3_trazub,False,True,t3_trazub,/r/UkraineWarReports/comments/trazub/activists_in_poland_protesting_in_front_of/i2msh98/,1648595993,1,False,True,False,UkraineWarReports,t5_5wncl5,r/UkraineWarReports,public,,0,[],,1648565405.0,,,,
,[],False,,Spenjamin,,default,[],,,dark,text,t2_a2soa,False,False,"Is this a shell, a missile or a bomb? Or something else?",541131c4bcd5b6d62d73b435420269eb91d437c3,True,False,,,,,0,1648594023,,0,{},i2mq4r3,False,t3_trah1s,False,True,t3_trah1s,/r/UkraineWarReports/comments/trah1s/chernihiv_playground/i2mq4r3/,1648594082,1,False,True,False,UkraineWarReports,t5_5wncl5,r/UkraineWarReports,public,,0,[],,1648565223.0,,,,
,[],False,,AutoModerator,,,[],,,,text,t2_6l4z3,False,True,"This is a reminder to check the r/UkraineWarReports rules. Every post with 3+ reports will be removed automatically. 


*I am a bot, and this action was performed automatically. Please [contact the moderators of this subreddit](/message/compose/?to=/r/UkraineWarReports) if you have any questions or concerns.*",e5688e013c65d4c1643d0390e149f3023f592783,True,False,,,,,0,1648593993,moderator,0,{},i2mpuje,False,t3_trrz7i,False,True,t3_trrz7i,/r/UkraineWarReports/comments/trrz7i/the_ukrainian_artillerists_are_saying_hi_to_all/i2mpuje/,1648594036,1,True,False,True,UkraineWarReports,t5_5wncl5,r/UkraineWarReports,public,,0,[],,1648565193.0,,,,
,[],False,,Minute_Grocery5947,,default,[],,,dark,text,t2_k5s7v7gi,False,False,"Russian criminals have purposely send this missile to the playground. The Russian criminals  have exact target launch capabilities!There  is no way to say they didn’t know how or why their missile ended up in a children’s playground!  
They were given orders to attack all civilians!",e2c428690c2aafaa4f439affeab504681efadb2c,True,False,,,,,0,1648593968,,0,{},i2mpskc,False,t3_trah1s,False,True,t3_trah1s,/r/UkraineWarReports/comments/trah1s/chernihiv_playground/i2mpskc/,1648593986,1,False,True,False,UkraineWarReports,t5_5wncl5,r/UkraineWarReports,public,,0,[],,1648565168.0,,,,
,[],False,,Slant1985,,default,[],,,dark,text,t2_5ul73dtu,False,False,"Way to go the reddit route of viewing any differing opinions as a personal attack. I’m not going to pretend to have no problem with Ukrainians shooting artillery men that attacked civilians, not because I empathize with the Russians but because I empathize with the Ukrainians that will have to live with this stain on their soul. That’s not to say I still don’t view this video with a heavy amount of skepticism. 

Also just as a lol to you trying to flex your “buddy the trauma medic.” Where do you think they bring those traumas to? They bring them to the trauma centers. Like the ones I’ve worked in three different states. Me. Not a “buddy.” Especially not a buddy who tries to convince you he’s a trauma medic when probably 80% of flights are composed of STEMI’s and CVA’s. 

As for what you stated the doctors stated, this requires further investigation. To that I agree. It’s the most logical response to the video. I’ll keep erring on the side of it being faked until or if a formal investigation rules it as authentic. You can believe whatever you want. Carry on with your downvotes if they make you warm and fuzzy.",7b26a5ec04abe5fbaca879210dd6af8a4707130e,True,False,,,,,0,1648593645,,0,{},i2mn4ep,False,t3_tqghse,False,True,t1_i2m09yq,/r/UkraineWarReports/comments/tqghse/nice_try_russian_propagandists_but_you_failed/i2mn4ep/,1648593673,1,False,True,False,UkraineWarReports,t5_5wncl5,r/UkraineWarReports,public,,0,[],,1648564845.0,,,,
,[],False,,UltorKitty,,default,[],,,dark,text,t2_do6x5tiu,False,False,Thank you!,184eb63a906e3136190bfe5ddab6df3340bd9b91,True,False,,,,,0,1648593617,,0,{},i2mmueb,False,t3_tdxssz,False,True,t1_i0maz82,/r/UkraineWarReports/comments/tdxssz/ukrainian_light_armor_engaging_enemy_forces/i2mmueb/,1648593639,1,False,True,False,UkraineWarReports,t5_5wncl5,r/UkraineWarReports,public,,0,[],,1648564817.0,,,,
,[],False,,OMG_YouSeeThat,,default,[],,,dark,text,t2_e7ozi6vw,False,False,This imagine just speaks on so many levels...,d0120ab58bafc90309f4c37158a5c1ee771a41de,True,False,,,,,0,1648593567,,0,{},i2mmau4,False,t3_trah1s,False,True,t3_trah1s,/r/UkraineWarReports/comments/trah1s/chernihiv_playground/i2mmau4/,1648593611,1,False,True,False,UkraineWarReports,t5_5wncl5,r/UkraineWarReports,public,,0,[],,1648564767.0,,,,
,[],False,,AutoModerator,,,[],,,,text,t2_6l4z3,False,True,"This is a reminder to check the r/UkraineWarReports rules. Every post with 3+ reports will be removed automatically. 


*I am a bot, and this action was performed automatically. Please [contact the moderators of this subreddit](/message/compose/?to=/r/UkraineWarReports) if you have any questions or concerns.*",e5688e013c65d4c1643d0390e149f3023f592783,True,False,,,,,0,1648593327,moderator,0,{},i2mlqvj,False,t3_trrr0v,False,True,t3_trrr0v,/r/UkraineWarReports/comments/trrr0v/guerra_de_ucrania_la_cara_humana_del_conflicto/i2mlqvj/,1648593343,1,True,False,True,UkraineWarReports,t5_5wncl5,r/UkraineWarReports,public,,0,[],,1648564527.0,,,,
,[],False,,cynack,,default,[],,,dark,text,t2_gw5en,False,False,At least they're not leaving any men behind. ;),6c2655893eeec1940d8f19daa626e63e0e7924f5,True,False,,,,,0,1648593307,,0,{},i2mlhh8,False,t3_tr2pt9,False,True,t3_tr2pt9,/r/UkraineWarReports/comments/tr2pt9/watch_russian_soldiers_abandoning_members_of/i2mlhh8/,1648593335,1,False,True,False,UkraineWarReports,t5_5wncl5,r/UkraineWarReports,public,,0,[],,1648564507.0,,,,
,[],False,,AutoModerator,,,[],,,,text,t2_6l4z3,False,True,"This is a reminder to check the r/UkraineWarReports rules. Every post with 3+ reports will be removed automatically. 


*I am a bot, and this action was performed automatically. Please [contact the moderators of this subreddit](/message/compose/?to=/r/UkraineWarReports) if you have any questions or concerns.*",e5688e013c65d4c1643d0390e149f3023f592783,True,False,,,,,0,1648592827,moderator,0,{},i2mkcln,False,t3_trr643,False,True,t3_trr643,/r/UkraineWarReports/comments/trr643/intense_combat_operation_shows_ukrainian_assault/i2mkcln/,1648592987,1,True,False,True,UkraineWarReports,t5_5wncl5,r/UkraineWarReports,public,,0,[],,1648564027.0,,,,
,[],False,,Amelia-Earwig,,default,[],,,dark,text,t2_j1k1js13,False,False,Fuck off with that pro-Putin propaganda.,25d795527263dc211701e8806855edfc9a8a5055,True,False,,,,,0,1648592720,,0,{},i2mk3t6,False,t3_trf29e,False,True,t1_i2mcy19,/r/UkraineWarReports/comments/trf29e/russians_forgot_their_own_soldiers/i2mk3t6/,1648593078,1,False,True,False,UkraineWarReports,t5_5wncl5,r/UkraineWarReports,public,,0,[],,1648563920.0,,,,
,[],False,,dean-LFC,,default,[],,,dark,text,t2_3anymy4x,False,False,Are they backing out to carpet bomb (even more than they are I mean..).. Or worse? Chemical / nuclear type of worse..,71d85724b77a97bb92b5ab8527ebc48d0627a51a,True,False,,,,,0,1648592707,,0,{},i2mk2dd,False,t3_tqyqrw,False,True,t3_tqyqrw,/r/UkraineWarReports/comments/tqyqrw/counterattacks_result_on_the_map_between_march/i2mk2dd/,1648593082,1,False,True,False,UkraineWarReports,t5_5wncl5,r/UkraineWarReports,public,,0,[],,1648563907.0,,,,
,[],False,,Corvus1412,,default,[],,,dark,text,t2_5h3h1djo,False,False,Thanks Russia for the denazification of that playground.,fed802482f5ab740d181efac2c48343afd9f57f0,True,False,,,,,0,1648592492,,0,{},i2mjk02,False,t3_trah1s,False,True,t3_trah1s,/r/UkraineWarReports/comments/trah1s/chernihiv_playground/i2mjk02/,1648592507,1,False,True,False,UkraineWarReports,t5_5wncl5,r/UkraineWarReports,public,,0,[],,1648563692.0,,,,
,[],False,,Cheesehead801,,default,[],,,dark,text,t2_vbppb94,False,False,"Even if that's true, it landed in a children's playground.. So I'm not sure what your point is.",4b44085cdd60cffbcefacd06ff4d914dc7f9a146,True,False,,,,,0,1648592488,,0,{},i2mjjp8,False,t3_trah1s,False,True,t1_i2m3eoc,/r/UkraineWarReports/comments/trah1s/chernihiv_playground/i2mjjp8/,1648592509,1,False,True,False,UkraineWarReports,t5_5wncl5,r/UkraineWarReports,public,,0,[],,1648563688.0,,,,
,[],False,,Charming-Wallaby-602,,default,[],,,dark,text,t2_f9yvg5z0,False,False,I do they are all over that playground smh sheep or smthn idk I'm not a retard,1348b283f12ae365e05594d637781fc229a763d8,True,False,,,,,0,1648592385,,0,{},i2mjao8,False,t3_trah1s,False,True,t1_i2lmd8e,/r/UkraineWarReports/comments/trah1s/chernihiv_playground/i2mjao8/,1648592411,1,False,True,False,UkraineWarReports,t5_5wncl5,r/UkraineWarReports,public,,0,[],,1648563585.0,,,,
,[],False,,Charming-Wallaby-602,,default,[],,,dark,text,t2_f9yvg5z0,False,False,Kids can pretend to be in the circus and get shot out of canons now,a7141c5458de05ecaccc9af6d6818c5ee81b061a,True,False,,,,,0,1648592350,,0,{},i2mj7nx,False,t3_trah1s,False,True,t3_trah1s,/r/UkraineWarReports/comments/trah1s/chernihiv_playground/i2mj7nx/,1648592420,1,False,True,False,UkraineWarReports,t5_5wncl5,r/UkraineWarReports,public,,0,[],,1648563550.0,,,,
,[],False,,shadowhound21,,default,[],,,dark,text,t2_51nz0m81,False,False,"Don't know how this proves I am a troll you just posted my stats? XDD
I reccomend going out bro this isn't real life",3c9822f65b3608973cbd2910c662a263b3c26b9c,True,False,,,,,0,1648592239,,0,{},i2mixxp,False,t3_tqyqrw,False,True,t1_i2midue,/r/UkraineWarReports/comments/tqyqrw/counterattacks_result_on_the_map_between_march/i2mixxp/,1648592495,1,False,True,False,UkraineWarReports,t5_5wncl5,r/UkraineWarReports,public,,0,[],,1648563439.0,,,,
